number,value,datetime_start,datetime_complete,duration,params_C,params_max_iter,params_solver,state
1292,0.6520362484987444,2023-10-02 12:12:46.536158,2023-10-02 12:12:46.712359,0 days 00:00:00.176201,16060.42222125699,490,sag,COMPLETE
1293,0.6418277104487389,2023-10-02 12:12:46.713368,2023-10-02 12:12:46.852498,0 days 00:00:00.139130,357.912025079601,490,sag,COMPLETE
1294,0.5,2023-10-02 12:12:46.852596,2023-10-02 12:12:47.025132,0 days 00:00:00.172536,0.00012551031688562238,500,sag,COMPLETE
1295,0.5855442733922918,2023-10-02 12:12:47.026132,2023-10-02 12:12:47.100794,0 days 00:00:00.074662,1.313782975003854,480,sag,COMPLETE
1296,0.6590785020198712,2023-10-02 12:12:47.101797,2023-10-02 12:12:47.269185,0 days 00:00:00.167388,7246.629226571748,500,sag,COMPLETE
1297,0.6590785020198712,2023-10-02 12:12:47.270184,2023-10-02 12:12:47.528907,0 days 00:00:00.258723,3548.0155510880913,490,sag,COMPLETE
1298,0.6520362484987444,2023-10-02 12:12:47.529910,2023-10-02 12:12:47.696717,0 days 00:00:00.166807,9665.838409783633,490,sag,COMPLETE
1299,0.6520362484987444,2023-10-02 12:12:47.697715,2023-10-02 12:12:47.867599,0 days 00:00:00.169884,4895.788581226722,480,sag,COMPLETE
1300,0.6520362484987444,2023-10-02 12:12:47.867599,2023-10-02 12:12:48.044926,0 days 00:00:00.177327,18050.715211284398,500,sag,COMPLETE
1301,0.6449939949776177,2023-10-02 12:12:48.045926,2023-10-02 12:12:48.211486,0 days 00:00:00.165560,2389.302388435587,480,sag,COMPLETE
1302,0.6520362484987444,2023-10-02 12:12:48.212489,2023-10-02 12:12:48.380549,0 days 00:00:00.168060,5957.905974472533,490,sag,COMPLETE
1303,0.6590785020198712,2023-10-02 12:12:48.381549,2023-10-02 12:12:48.572089,0 days 00:00:00.190540,13165.738286299644,500,sag,COMPLETE
1304,0.6449939949776177,2023-10-02 12:12:48.573146,2023-10-02 12:12:48.736444,0 days 00:00:00.163298,8344.63620193524,480,sag,COMPLETE
1305,0.6077082650944426,2023-10-02 12:12:48.737447,2023-10-02 12:12:48.810209,0 days 00:00:00.072762,3.8480072138769073,490,sag,COMPLETE
1306,0.6520362484987444,2023-10-02 12:12:48.811262,2023-10-02 12:12:48.975049,0 days 00:00:00.163787,1770.2171933628567,500,sag,COMPLETE
1307,0.6629544710121192,2023-10-02 12:12:48.976040,2023-10-02 12:12:49.155761,0 days 00:00:00.179721,17239.35009864264,480,sag,COMPLETE
1308,0.5,2023-10-02 12:12:49.156767,2023-10-02 12:12:49.613626,0 days 00:00:00.456859,2.333634452804241e-05,110,sag,COMPLETE
1309,0.6520362484987444,2023-10-02 12:12:49.613626,2023-10-02 12:12:49.779547,0 days 00:00:00.165921,16335.918771434406,480,sag,COMPLETE
1310,0.6013756960366853,2023-10-02 12:12:49.779547,2023-10-02 12:12:49.876439,0 days 00:00:00.096892,2.3409976651342723,480,sag,COMPLETE
1311,0.666120755540998,2023-10-02 12:12:49.877435,2023-10-02 12:12:50.063963,0 days 00:00:00.186528,4290.779902053819,480,sag,COMPLETE
1312,0.6449939949776177,2023-10-02 12:12:50.064963,2023-10-02 12:12:50.239293,0 days 00:00:00.174330,2699.424755415526,480,sag,COMPLETE
1313,0.637951741456491,2023-10-02 12:12:50.240294,2023-10-02 12:12:50.396439,0 days 00:00:00.156145,1249.703675914065,480,sag,COMPLETE
1314,0.6590785020198712,2023-10-02 12:12:50.397440,2023-10-02 12:12:50.561916,0 days 00:00:00.164476,3369.001554429714,490,sag,COMPLETE
1315,0.6520362484987444,2023-10-02 12:12:50.562916,2023-10-02 12:12:50.727545,0 days 00:00:00.164629,4796.610208024751,480,sag,COMPLETE
1316,0.5,2023-10-02 12:12:50.728541,2023-10-02 12:12:50.799927,0 days 00:00:00.071386,0.019944639497901637,490,sag,COMPLETE
1317,0.666120755540998,2023-10-02 12:12:50.800923,2023-10-02 12:12:50.996946,0 days 00:00:00.196023,6751.450482492644,480,sag,COMPLETE
1318,0.637951741456491,2023-10-02 12:12:50.997950,2023-10-02 12:12:51.166881,0 days 00:00:00.168931,6377.962487581699,480,sag,COMPLETE
1319,0.6629544710121192,2023-10-02 12:12:51.167881,2023-10-02 12:12:51.327914,0 days 00:00:00.160033,3938.3921121202347,480,sag,COMPLETE
1320,0.6520362484987444,2023-10-02 12:12:51.328914,2023-10-02 12:12:51.497624,0 days 00:00:00.168710,3231.5585697774095,470,sag,COMPLETE
1321,0.6590785020198712,2023-10-02 12:12:51.497624,2023-10-02 12:12:51.675776,0 days 00:00:00.178152,4239.047787990108,480,sag,COMPLETE
1322,0.6520362484987444,2023-10-02 12:12:51.676830,2023-10-02 12:12:51.839143,0 days 00:00:00.162313,2089.455796365254,470,sag,COMPLETE
1323,0.6449939949776177,2023-10-02 12:12:51.839143,2023-10-02 12:12:52.006051,0 days 00:00:00.166908,1714.8984151139268,480,sag,COMPLETE
1324,0.6629544710121192,2023-10-02 12:12:52.007048,2023-10-02 12:12:52.175771,0 days 00:00:00.168723,3597.587654226111,480,sag,COMPLETE
1325,0.6520362484987444,2023-10-02 12:12:52.176771,2023-10-02 12:12:52.339520,0 days 00:00:00.162749,3705.9939068656304,490,sag,COMPLETE
1326,0.637951741456491,2023-10-02 12:12:52.340518,2023-10-02 12:12:52.520205,0 days 00:00:00.179687,2322.927663855254,480,sag,COMPLETE
1327,0.6520362484987444,2023-10-02 12:12:52.520205,2023-10-02 12:12:52.682535,0 days 00:00:00.162330,4701.9767550018905,490,sag,COMPLETE
1328,0.6457036794409869,2023-10-02 12:12:52.683623,2023-10-02 12:12:52.835464,0 days 00:00:00.151841,296.80715122577294,480,sag,COMPLETE
1329,0.6590785020198712,2023-10-02 12:12:52.836465,2023-10-02 12:12:52.995501,0 days 00:00:00.159036,2717.7111714379444,480,sag,COMPLETE
1330,0.6449939949776177,2023-10-02 12:12:52.996534,2023-10-02 12:12:53.176792,0 days 00:00:00.180258,1181.1386050821218,490,sag,COMPLETE
1331,0.6559122174909924,2023-10-02 12:12:53.177792,2023-10-02 12:12:53.343546,0 days 00:00:00.165754,5879.576351943593,490,sag,COMPLETE
1332,0.6520362484987444,2023-10-02 12:12:53.344546,2023-10-02 12:12:53.535589,0 days 00:00:00.191043,3337.2048844154833,480,sag,COMPLETE
1333,0.6449939949776177,2023-10-02 12:12:53.535589,2023-10-02 12:12:53.766339,0 days 00:00:00.230750,6264.478511922633,490,sag,COMPLETE
1334,0.5,2023-10-02 12:12:53.767338,2023-10-02 12:12:54.075797,0 days 00:00:00.308459,5.103045665098476e-05,500,sag,COMPLETE
1335,0.5619609127634021,2023-10-02 12:12:54.075797,2023-10-02 12:12:54.146911,0 days 00:00:00.071114,0.9342935273029617,470,sag,COMPLETE
1336,0.6520362484987444,2023-10-02 12:12:54.146911,2023-10-02 12:12:54.308925,0 days 00:00:00.162014,2066.1539525345515,490,sag,COMPLETE
1337,0.6449939949776177,2023-10-02 12:12:54.309925,2023-10-02 12:12:54.476339,0 days 00:00:00.166414,7648.321757527356,480,sag,COMPLETE
1338,0.6449939949776177,2023-10-02 12:12:54.477339,2023-10-02 12:12:54.644444,0 days 00:00:00.167105,3951.771446614396,500,sag,COMPLETE
1339,0.5,2023-10-02 12:12:54.644444,2023-10-02 12:12:55.050210,0 days 00:00:00.405766,3.9519740540070555e-05,470,sag,COMPLETE
1340,0.637951741456491,2023-10-02 12:12:55.051210,2023-10-02 12:12:55.221280,0 days 00:00:00.170070,928.3986618145527,490,sag,COMPLETE
1341,0.637951741456491,2023-10-02 12:12:55.222280,2023-10-02 12:12:55.404105,0 days 00:00:00.181825,1473.667098591354,480,sag,COMPLETE
1342,0.6590785020198712,2023-10-02 12:12:55.405105,2023-10-02 12:12:55.576959,0 days 00:00:00.171854,4754.852163182204,500,sag,COMPLETE
1343,0.6520362484987444,2023-10-02 12:12:55.577963,2023-10-02 12:12:55.741960,0 days 00:00:00.163997,8999.432155393917,490,sag,COMPLETE
1344,0.5313352986133857,2023-10-02 12:12:55.741960,2023-10-02 12:12:55.823573,0 days 00:00:00.081613,0.5121871207490137,480,sag,COMPLETE
1345,0.6520362484987444,2023-10-02 12:12:55.823573,2023-10-02 12:12:56.001702,0 days 00:00:00.178129,2626.5255905345252,470,sag,COMPLETE
1346,0.6449939949776177,2023-10-02 12:12:56.002697,2023-10-02 12:12:56.178925,0 days 00:00:00.176228,7364.777051201908,490,sag,COMPLETE
1347,0.6520362484987444,2023-10-02 12:12:56.178925,2023-10-02 12:12:56.357758,0 days 00:00:00.178833,4655.513351460833,500,sag,COMPLETE
1348,0.666120755540998,2023-10-02 12:12:56.358757,2023-10-02 12:12:56.526945,0 days 00:00:00.168188,9108.89249604905,500,sag,COMPLETE
1349,0.6590785020198712,2023-10-02 12:12:56.527946,2023-10-02 12:12:56.701333,0 days 00:00:00.173387,10585.687321522782,500,sag,COMPLETE
1350,0.6520362484987444,2023-10-02 12:12:56.702329,2023-10-02 12:12:56.878763,0 days 00:00:00.176434,9311.70399595504,500,sag,COMPLETE
1351,0.6590785020198712,2023-10-02 12:12:56.878763,2023-10-02 12:12:57.048108,0 days 00:00:00.169345,6952.95769780895,500,sag,COMPLETE
1352,0.6520362484987444,2023-10-02 12:12:57.049107,2023-10-02 12:12:57.249047,0 days 00:00:00.199940,11258.151335260132,500,sag,COMPLETE
1353,0.666120755540998,2023-10-02 12:12:57.250044,2023-10-02 12:12:57.431101,0 days 00:00:00.181057,6611.132713575648,500,sag,COMPLETE
1354,0.6590785020198712,2023-10-02 12:12:57.432101,2023-10-02 12:12:57.597244,0 days 00:00:00.165143,11681.374798495362,500,sag,COMPLETE
1355,0.6449939949776177,2023-10-02 12:12:57.598244,2023-10-02 12:12:57.776607,0 days 00:00:00.178363,6085.454132821521,500,sag,COMPLETE
1356,0.5,2023-10-02 12:12:57.778175,2023-10-02 12:12:57.848210,0 days 00:00:00.070035,0.300516132927578,500,sag,COMPLETE
1357,0.6520362484987444,2023-10-02 12:12:57.849272,2023-10-02 12:12:58.029361,0 days 00:00:00.180089,8830.964517223943,500,sag,COMPLETE
1358,0.5,2023-10-02 12:12:58.029361,2023-10-02 12:12:58.123585,0 days 00:00:00.094224,0.0004969441626770656,490,sag,COMPLETE
1359,0.6481602795064964,2023-10-02 12:12:58.124586,2023-10-02 12:12:58.309722,0 days 00:00:00.185136,14419.105881314743,500,sag,COMPLETE
1360,0.5,2023-10-02 12:12:58.310718,2023-10-02 12:12:58.387251,0 days 00:00:00.076533,0.025761994325057963,500,sag,COMPLETE
1361,0.6520362484987444,2023-10-02 12:12:58.388251,2023-10-02 12:12:58.560786,0 days 00:00:00.172535,7105.722047249667,490,sag,COMPLETE
1362,0.5,2023-10-02 12:12:58.560786,2023-10-02 12:12:58.641307,0 days 00:00:00.080521,0.002386421844665926,490,sag,COMPLETE
1363,0.6590785020198712,2023-10-02 12:12:58.642307,2023-10-02 12:12:58.830375,0 days 00:00:00.188068,11545.975337590824,500,sag,COMPLETE
1364,0.6590785020198712,2023-10-02 12:12:58.830375,2023-10-02 12:12:59.011426,0 days 00:00:00.181051,16632.706656775805,490,sag,COMPLETE
1365,0.637951741456491,2023-10-02 12:12:59.011426,2023-10-02 12:12:59.180893,0 days 00:00:00.169467,620.8141835044472,500,sag,COMPLETE
1366,0.6590785020198712,2023-10-02 12:12:59.180893,2023-10-02 12:12:59.347425,0 days 00:00:00.166532,5819.434948580348,490,sag,COMPLETE
1367,0.6520362484987444,2023-10-02 12:12:59.348421,2023-10-02 12:12:59.519486,0 days 00:00:00.171065,8508.900884242754,490,sag,COMPLETE
1368,0.6449939949776177,2023-10-02 12:12:59.520484,2023-10-02 12:12:59.692525,0 days 00:00:00.172041,16032.241637881481,500,sag,COMPLETE
1369,0.6520362484987444,2023-10-02 12:12:59.693525,2023-10-02 12:12:59.859054,0 days 00:00:00.165529,5182.338922782024,500,sag,COMPLETE
1370,0.6457036794409869,2023-10-02 12:12:59.860054,2023-10-02 12:13:00.030393,0 days 00:00:00.170339,301.9064783676988,490,sag,COMPLETE
1371,0.6062888961677039,2023-10-02 12:13:00.031393,2023-10-02 12:13:00.118925,0 days 00:00:00.087532,6.571795029994728,500,sag,COMPLETE
1372,0.6488699639698657,2023-10-02 12:13:00.119926,2023-10-02 12:13:00.286981,0 days 00:00:00.167055,9849.628796673072,490,sag,COMPLETE
1373,0.5,2023-10-02 12:13:00.287973,2023-10-02 12:13:00.367977,0 days 00:00:00.080004,0.05798671573101065,500,sag,COMPLETE
1374,0.5,2023-10-02 12:13:00.367977,2023-10-02 12:13:00.440492,0 days 00:00:00.072515,0.15573341389636586,490,sag,COMPLETE
1375,0.5943334425155585,2023-10-02 12:13:00.441492,2023-10-02 12:13:00.518014,0 days 00:00:00.076522,2.13257727299329,490,sag,COMPLETE
1376,0.6418277104487389,2023-10-02 12:13:00.519024,2023-10-02 12:13:00.661548,0 days 00:00:00.142524,256.8767807389792,500,sag,COMPLETE
1377,0.6449939949776177,2023-10-02 12:13:00.662545,2023-10-02 12:13:00.832033,0 days 00:00:00.169488,4928.031890466748,480,sag,COMPLETE
1378,0.6590785020198712,2023-10-02 12:13:00.833032,2023-10-02 12:13:01.005795,0 days 00:00:00.172763,17458.679187139704,490,sag,COMPLETE
1379,0.6059613494923026,2023-10-02 12:13:01.006799,2023-10-02 12:13:01.081950,0 days 00:00:00.075151,1.6227126164197119,500,sag,COMPLETE
1380,0.6590785020198712,2023-10-02 12:13:01.081950,2023-10-02 12:13:01.310005,0 days 00:00:00.228055,8111.418155450497,490,sag,COMPLETE
1381,0.5,2023-10-02 12:13:01.311012,2023-10-02 12:13:01.467546,0 days 00:00:00.156534,0.00012073591645269898,480,sag,COMPLETE
1382,0.6520362484987444,2023-10-02 12:13:01.468553,2023-10-02 12:13:01.645072,0 days 00:00:00.176519,2459.118057851261,500,sag,COMPLETE
1383,0.6520362484987444,2023-10-02 12:13:01.646075,2023-10-02 12:13:01.818234,0 days 00:00:00.172159,12280.613129880498,490,sag,COMPLETE
1384,0.5,2023-10-02 12:13:01.819238,2023-10-02 12:13:01.911117,0 days 00:00:00.091879,0.0008905820216126384,500,sag,COMPLETE
1385,0.6449939949776177,2023-10-02 12:13:01.912117,2023-10-02 12:13:02.099165,0 days 00:00:00.187048,3474.5551070027414,480,sag,COMPLETE
1386,0.669996724533246,2023-10-02 12:13:02.100165,2023-10-02 12:13:02.260685,0 days 00:00:00.160520,7103.410087905755,490,sag,COMPLETE
1387,0.666120755540998,2023-10-02 12:13:02.261684,2023-10-02 12:13:02.439268,0 days 00:00:00.177584,4280.234157897627,500,sag,COMPLETE
1388,0.6520362484987444,2023-10-02 12:13:02.440268,2023-10-02 12:13:02.623357,0 days 00:00:00.183089,2077.772137365739,500,sag,COMPLETE
1389,0.6449939949776177,2023-10-02 12:13:02.623357,2023-10-02 12:13:02.804507,0 days 00:00:00.181150,1299.0264988056654,500,sag,COMPLETE
1390,0.5,2023-10-02 12:13:02.804507,2023-10-02 12:13:02.886028,0 days 00:00:00.081521,0.003707992681141376,500,sag,COMPLETE
1391,0.5,2023-10-02 12:13:02.886028,2023-10-02 12:13:03.092281,0 days 00:00:00.206253,9.656337124349233e-05,500,sag,COMPLETE
1392,0.6559122174909924,2023-10-02 12:13:03.093282,2023-10-02 12:13:03.266817,0 days 00:00:00.173535,3414.2289841359166,490,sag,COMPLETE
1393,0.5,2023-10-02 12:13:03.266817,2023-10-02 12:13:03.347356,0 days 00:00:00.080539,0.009439700454749548,500,sag,COMPLETE
1394,0.6520362484987444,2023-10-02 12:13:03.348354,2023-10-02 12:13:03.520989,0 days 00:00:00.172635,4448.54250024759,500,sag,COMPLETE
1395,0.5,2023-10-02 12:13:03.521988,2023-10-02 12:13:03.624628,0 days 00:00:00.102640,0.0009170900480734616,490,sag,COMPLETE
1396,0.6520362484987444,2023-10-02 12:13:03.624628,2023-10-02 12:13:03.783664,0 days 00:00:00.159036,1725.7386697829704,490,sag,COMPLETE
1397,0.6449939949776177,2023-10-02 12:13:03.783664,2023-10-02 12:13:03.969192,0 days 00:00:00.185528,2688.7593792269345,500,sag,COMPLETE
1398,0.637951741456491,2023-10-02 12:13:03.970195,2023-10-02 12:13:04.137805,0 days 00:00:00.167610,645.2112866773379,490,sag,COMPLETE
1399,0.6520362484987444,2023-10-02 12:13:04.138806,2023-10-02 12:13:04.308250,0 days 00:00:00.169444,5245.416929809451,500,sag,COMPLETE
1400,0.5478764057211486,2023-10-02 12:13:04.308250,2023-10-02 12:13:04.388824,0 days 00:00:00.080574,0.7389519523223158,490,sag,COMPLETE
1401,0.666120755540998,2023-10-02 12:13:04.389831,2023-10-02 12:13:04.564171,0 days 00:00:00.174340,6334.654695668497,500,sag,COMPLETE
1402,0.6520362484987444,2023-10-02 12:13:04.565167,2023-10-02 12:13:04.769442,0 days 00:00:00.204275,3509.525297281381,490,sag,COMPLETE
1403,0.5,2023-10-02 12:13:04.769442,2023-10-02 12:13:04.929810,0 days 00:00:00.160368,0.005928317367375344,500,sag,COMPLETE
1404,0.528169014084507,2023-10-02 12:13:04.930810,2023-10-02 12:13:05.004334,0 days 00:00:00.073524,0.4286801083624283,480,sag,COMPLETE
1405,0.5,2023-10-02 12:13:05.005334,2023-10-02 12:13:05.323023,0 days 00:00:00.317689,4.667327487853898e-05,490,sag,COMPLETE
1406,0.637951741456491,2023-10-02 12:13:05.324020,2023-10-02 12:13:05.414660,0 days 00:00:00.090640,8650.703952532496,500,newton-cg,COMPLETE
1407,0.637951741456491,2023-10-02 12:13:05.415660,2023-10-02 12:13:05.488183,0 days 00:00:00.072523,5295.015424877663,490,liblinear,COMPLETE
1408,0.5792117043345343,2023-10-02 12:13:05.488183,2023-10-02 12:13:05.584876,0 days 00:00:00.096693,1.1045559902645479,480,sag,COMPLETE
1409,0.6590785020198712,2023-10-02 12:13:05.584876,2023-10-02 12:13:05.772565,0 days 00:00:00.187689,2495.7178217767664,500,sag,COMPLETE
1410,0.637951741456491,2023-10-02 12:13:05.772565,2023-10-02 12:13:05.979923,0 days 00:00:00.207358,1506.9233099472624,490,sag,COMPLETE
1411,0.6449939949776177,2023-10-02 12:13:05.979923,2023-10-02 12:13:06.151528,0 days 00:00:00.171605,759.2738270797257,480,sag,COMPLETE
1412,0.5,2023-10-02 12:13:06.151528,2023-10-02 12:13:06.226047,0 days 00:00:00.074519,0.22141854778632544,500,sag,COMPLETE
1413,0.5,2023-10-02 12:13:06.226047,2023-10-02 12:13:06.791018,0 days 00:00:00.564971,2.9666142253728952e-05,490,sag,COMPLETE
1414,0.5,2023-10-02 12:13:06.792015,2023-10-02 12:13:06.866160,0 days 00:00:00.074145,0.0832014080271566,480,sag,COMPLETE
1415,0.6629544710121192,2023-10-02 12:13:06.866160,2023-10-02 12:13:07.044300,0 days 00:00:00.178140,10422.222577726403,500,sag,COMPLETE
1416,0.5,2023-10-02 12:13:07.045298,2023-10-02 12:13:07.135738,0 days 00:00:00.090440,0.11738806086437407,490,sag,COMPLETE
1417,0.5,2023-10-02 12:13:07.135738,2023-10-02 12:13:08.253911,0 days 00:00:01.118173,1.2968450102256661e-05,480,sag,COMPLETE
1418,0.5,2023-10-02 12:13:08.254980,2023-10-02 12:13:08.363642,0 days 00:00:00.108662,0.0002545339056941885,500,sag,COMPLETE
1419,0.5,2023-10-02 12:13:08.364637,2023-10-02 12:13:08.462775,0 days 00:00:00.098138,0.0004430741192903,490,sag,COMPLETE
1420,0.6062888961677039,2023-10-02 12:13:08.463767,2023-10-02 12:13:08.548282,0 days 00:00:00.084515,6.554723084535743,470,sag,COMPLETE
1421,0.6449939949776177,2023-10-02 12:13:08.549282,2023-10-02 12:13:08.719934,0 days 00:00:00.170652,6997.226965369749,490,sag,COMPLETE
1422,0.6520362484987444,2023-10-02 12:13:08.719934,2023-10-02 12:13:08.918163,0 days 00:00:00.198229,4340.816716244172,500,sag,COMPLETE
1423,0.6457036794409869,2023-10-02 12:13:08.919163,2023-10-02 12:13:09.063680,0 days 00:00:00.144517,209.69601984617515,480,sag,COMPLETE
1424,0.5,2023-10-02 12:13:09.063680,2023-10-02 12:13:09.267726,0 days 00:00:00.204046,8.297451659290774e-05,500,sag,COMPLETE
1425,0.637951741456491,2023-10-02 12:13:09.267726,2023-10-02 12:13:09.362392,0 days 00:00:00.094666,10903.445560766506,490,newton-cg,COMPLETE
1426,0.6309094879353642,2023-10-02 12:13:09.363392,2023-10-02 12:13:09.506459,0 days 00:00:00.143067,3017.5072775740828,470,liblinear,COMPLETE
1427,0.6520362484987444,2023-10-02 12:13:09.507469,2023-10-02 12:13:09.685563,0 days 00:00:00.178094,6031.55314095923,500,sag,COMPLETE
1428,0.5,2023-10-02 12:13:09.685563,2023-10-02 12:13:09.794576,0 days 00:00:00.109013,0.009851401791911385,480,sag,COMPLETE
1429,0.637951741456491,2023-10-02 12:13:09.795664,2023-10-02 12:13:09.971569,0 days 00:00:00.175905,13341.403007849778,490,sag,COMPLETE
1430,0.5,2023-10-02 12:13:09.971569,2023-10-02 12:13:10.069361,0 days 00:00:00.097792,0.013939288426719449,500,sag,COMPLETE
1431,0.5,2023-10-02 12:13:10.070361,2023-10-02 12:13:10.162631,0 days 00:00:00.092270,0.0014783421357725168,480,sag,COMPLETE
1432,0.6520362484987444,2023-10-02 12:13:10.163631,2023-10-02 12:13:10.334251,0 days 00:00:00.170620,1922.6252185967369,490,sag,COMPLETE
1433,0.5,2023-10-02 12:13:10.335374,2023-10-02 12:13:10.450562,0 days 00:00:00.115188,0.0002991945335038861,470,sag,COMPLETE
1434,0.6520362484987444,2023-10-02 12:13:10.451562,2023-10-02 12:13:10.619797,0 days 00:00:00.168235,8112.208505887206,490,sag,COMPLETE
1435,0.6449939949776177,2023-10-02 12:13:10.620801,2023-10-02 12:13:10.787242,0 days 00:00:00.166441,3641.7182747170605,500,sag,COMPLETE
1436,0.637951741456491,2023-10-02 12:13:10.788193,2023-10-02 12:13:10.978374,0 days 00:00:00.190181,975.2900932780378,480,sag,COMPLETE
1437,0.6590785020198712,2023-10-02 12:13:10.979374,2023-10-02 12:13:11.170688,0 days 00:00:00.191314,17839.169990909384,500,sag,COMPLETE
1438,0.5,2023-10-02 12:13:11.170688,2023-10-02 12:13:11.251110,0 days 00:00:00.080422,0.02858134233730959,480,sag,COMPLETE
1439,0.6069985806310733,2023-10-02 12:13:11.252110,2023-10-02 12:13:11.330788,0 days 00:00:00.078678,4.255106687769137,490,sag,COMPLETE
1440,0.6418277104487389,2023-10-02 12:13:11.331786,2023-10-02 12:13:11.524753,0 days 00:00:00.192967,534.8408395685296,500,sag,COMPLETE
1441,0.6418277104487389,2023-10-02 12:13:11.524753,2023-10-02 12:13:11.678464,0 days 00:00:00.153711,337.2585667119654,490,sag,COMPLETE
1442,0.666120755540998,2023-10-02 12:13:11.679459,2023-10-02 12:13:11.844150,0 days 00:00:00.164691,4792.215545394185,470,sag,COMPLETE
1443,0.6449939949776177,2023-10-02 12:13:11.845146,2023-10-02 12:13:12.007464,0 days 00:00:00.162318,8069.098305550395,480,sag,COMPLETE
1444,0.6590785020198712,2023-10-02 12:13:12.008467,2023-10-02 12:13:12.172985,0 days 00:00:00.164518,13488.849597593971,500,sag,COMPLETE
1445,0.6013756960366853,2023-10-02 12:13:12.173988,2023-10-02 12:13:12.262276,0 days 00:00:00.088288,2.2156144386141703,490,newton-cg,COMPLETE
1446,0.528169014084507,2023-10-02 12:13:12.263275,2023-10-02 12:13:12.337802,0 days 00:00:00.074527,0.4008812798648809,480,sag,COMPLETE
1447,0.5,2023-10-02 12:13:12.337802,2023-10-02 12:13:12.413333,0 days 00:00:00.075531,0.002624649735177458,500,liblinear,COMPLETE
1448,0.6520362484987444,2023-10-02 12:13:12.414332,2023-10-02 12:13:12.654323,0 days 00:00:00.239991,2476.6703933080926,490,sag,COMPLETE
1449,0.6520362484987444,2023-10-02 12:13:12.655324,2023-10-02 12:13:12.832385,0 days 00:00:00.177061,5232.416107242542,470,sag,COMPLETE
1450,0.6590785020198712,2023-10-02 12:13:12.832385,2023-10-02 12:13:13.012790,0 days 00:00:00.180405,10441.961555101954,500,sag,COMPLETE
1451,0.6590785020198712,2023-10-02 12:13:13.013786,2023-10-02 12:13:13.178329,0 days 00:00:00.164543,20218.374929130106,490,sag,COMPLETE
1452,0.6520362484987444,2023-10-02 12:13:13.179339,2023-10-02 12:13:13.348385,0 days 00:00:00.169046,1328.7976160971893,480,sag,COMPLETE
1453,0.6520362484987444,2023-10-02 12:13:13.348385,2023-10-02 12:13:13.541125,0 days 00:00:00.192740,3373.8880102738754,500,sag,COMPLETE
1454,0.666120755540998,2023-10-02 12:13:13.542129,2023-10-02 12:13:13.724189,0 days 00:00:00.182060,6924.1570296337,490,sag,COMPLETE
