number,value,datetime_start,datetime_complete,duration,params_C,params_max_iter,params_solver,state
966,0.6481602795064964,2023-10-02 12:11:55.164536,2023-10-02 12:11:55.308483,0 days 00:00:00.143947,61601.54633005571,470,saga,COMPLETE
967,0.6481602795064964,2023-10-02 12:11:55.308483,2023-10-02 12:11:55.457553,0 days 00:00:00.149070,31483.853323977655,480,saga,COMPLETE
968,0.6481602795064964,2023-10-02 12:11:55.458555,2023-10-02 12:11:55.602084,0 days 00:00:00.143529,18420.375467953094,470,saga,COMPLETE
969,0.6590785020198712,2023-10-02 12:11:55.603083,2023-10-02 12:11:55.753493,0 days 00:00:00.150410,50660.28232916076,490,saga,COMPLETE
970,0.6520362484987444,2023-10-02 12:11:55.754499,2023-10-02 12:11:55.898457,0 days 00:00:00.143958,98930.14750757685,460,saga,COMPLETE
971,0.6411180259853696,2023-10-02 12:11:55.899459,2023-10-02 12:11:56.047244,0 days 00:00:00.147785,11940.280739250105,490,saga,COMPLETE
972,0.6481602795064964,2023-10-02 12:11:56.047244,2023-10-02 12:11:56.195169,0 days 00:00:00.147925,27025.68839969481,470,saga,COMPLETE
973,0.6481602795064964,2023-10-02 12:11:56.195169,2023-10-02 12:11:56.339461,0 days 00:00:00.144292,42505.87249664174,450,saga,COMPLETE
974,0.6481602795064964,2023-10-02 12:11:56.340463,2023-10-02 12:11:56.489988,0 days 00:00:00.149525,23422.865006800854,480,saga,COMPLETE
975,0.6520362484987444,2023-10-02 12:11:56.490985,2023-10-02 12:11:56.638895,0 days 00:00:00.147910,61348.45058944972,480,saga,COMPLETE
976,0.6481602795064964,2023-10-02 12:11:56.638895,2023-10-02 12:11:56.788517,0 days 00:00:00.149622,10221.010766171537,490,saga,COMPLETE
977,0.6590785020198712,2023-10-02 12:11:56.788517,2023-10-02 12:11:56.935877,0 days 00:00:00.147360,18990.128361563064,460,saga,COMPLETE
978,0.6552025330276231,2023-10-02 12:11:56.936876,2023-10-02 12:11:57.097607,0 days 00:00:00.160731,35042.03564503889,470,saga,COMPLETE
979,0.6590785020198712,2023-10-02 12:11:57.098605,2023-10-02 12:11:57.250742,0 days 00:00:00.152137,66387.24850197199,480,saga,COMPLETE
980,0.6520362484987444,2023-10-02 12:11:57.251741,2023-10-02 12:11:57.406010,0 days 00:00:00.154269,13384.264861949969,490,saga,COMPLETE
981,0.666120755540998,2023-10-02 12:11:57.406010,2023-10-02 12:11:57.557209,0 days 00:00:00.151199,39594.03428287549,480,saga,COMPLETE
982,0.6590785020198712,2023-10-02 12:11:57.558212,2023-10-02 12:11:57.710181,0 days 00:00:00.151969,18874.503028635583,490,saga,COMPLETE
983,0.6481602795064964,2023-10-02 12:11:57.711174,2023-10-02 12:11:57.860591,0 days 00:00:00.149417,30761.231055355005,480,saga,COMPLETE
984,0.6520362484987444,2023-10-02 12:11:57.861591,2023-10-02 12:11:58.010131,0 days 00:00:00.148540,7754.224343768685,490,saga,COMPLETE
985,0.6481602795064964,2023-10-02 12:11:58.010131,2023-10-02 12:11:58.157083,0 days 00:00:00.146952,14529.340096449401,480,saga,COMPLETE
986,0.6449939949776177,2023-10-02 12:11:58.157083,2023-10-02 12:11:58.306581,0 days 00:00:00.149498,36620.488392175925,480,saga,COMPLETE
987,0.6442843105142483,2023-10-02 12:11:58.306581,2023-10-02 12:11:58.450641,0 days 00:00:00.144060,23659.113664419972,470,saga,COMPLETE
988,0.6590785020198712,2023-10-02 12:11:58.451641,2023-10-02 12:11:58.596752,0 days 00:00:00.145111,45601.87651655126,460,saga,COMPLETE
989,0.6520362484987444,2023-10-02 12:11:58.596752,2023-10-02 12:11:58.739878,0 days 00:00:00.143126,8725.878238613372,470,saga,COMPLETE
990,0.651326564035375,2023-10-02 12:11:58.740882,2023-10-02 12:11:58.912042,0 days 00:00:00.171160,20400.034505860665,490,saga,COMPLETE
991,0.6520362484987444,2023-10-02 12:11:58.912042,2023-10-02 12:11:59.060797,0 days 00:00:00.148755,12588.834154156506,480,saga,COMPLETE
992,0.6552025330276231,2023-10-02 12:11:59.061792,2023-10-02 12:11:59.203776,0 days 00:00:00.141984,42524.56600789815,450,saga,COMPLETE
993,0.6590785020198712,2023-10-02 12:11:59.203776,2023-10-02 12:11:59.359054,0 days 00:00:00.155278,26001.498753938,490,saga,COMPLETE
994,0.6411180259853696,2023-10-02 12:11:59.359054,2023-10-02 12:11:59.503501,0 days 00:00:00.144447,60280.98537008136,460,saga,COMPLETE
995,0.6520362484987444,2023-10-02 12:11:59.504504,2023-10-02 12:11:59.653176,0 days 00:00:00.148672,6923.339260464439,480,saga,COMPLETE
996,0.6552025330276231,2023-10-02 12:11:59.654179,2023-10-02 12:11:59.805312,0 days 00:00:00.151133,15122.596876140004,470,saga,COMPLETE
997,0.6449939949776177,2023-10-02 12:11:59.806396,2023-10-02 12:11:59.954588,0 days 00:00:00.148192,31711.19716486831,490,saga,COMPLETE
998,0.6481602795064964,2023-10-02 12:11:59.954588,2023-10-02 12:12:00.101650,0 days 00:00:00.147062,61803.23180138632,470,saga,COMPLETE
999,0.6552025330276231,2023-10-02 12:12:00.101650,2023-10-02 12:12:00.251723,0 days 00:00:00.150073,18805.170440004586,480,saga,COMPLETE
1000,0.6411180259853696,2023-10-02 12:12:00.252723,2023-10-02 12:12:00.401172,0 days 00:00:00.148449,36458.26262575368,490,saga,COMPLETE
1001,0.6520362484987444,2023-10-02 12:12:00.402170,2023-10-02 12:12:00.547592,0 days 00:00:00.145422,11433.744693603654,460,saga,COMPLETE
1002,0.6520362484987444,2023-10-02 12:12:00.548595,2023-10-02 12:12:00.697063,0 days 00:00:00.148468,49189.85627661943,470,saga,COMPLETE
1003,0.6590785020198712,2023-10-02 12:12:00.698079,2023-10-02 12:12:00.841570,0 days 00:00:00.143491,25126.057667123216,450,saga,COMPLETE
1004,0.6411180259853696,2023-10-02 12:12:00.841570,2023-10-02 12:12:00.988565,0 days 00:00:00.146995,9652.908538668566,480,saga,COMPLETE
1005,0.6590785020198712,2023-10-02 12:12:00.989558,2023-10-02 12:12:01.139172,0 days 00:00:00.149614,61576.860625170026,470,saga,COMPLETE
1006,0.5,2023-10-02 12:12:01.139172,2023-10-02 12:12:01.348077,0 days 00:00:00.208905,0.00017358385271012885,490,saga,COMPLETE
1007,0.6481602795064964,2023-10-02 12:12:01.349077,2023-10-02 12:12:01.496825,0 days 00:00:00.147748,6288.249471218964,480,saga,COMPLETE
1008,0.6449939949776177,2023-10-02 12:12:01.496825,2023-10-02 12:12:01.640270,0 days 00:00:00.143445,18941.674883279316,460,saga,COMPLETE
1009,0.6411180259853696,2023-10-02 12:12:01.641278,2023-10-02 12:12:01.793329,0 days 00:00:00.152051,99640.49770171255,480,saga,COMPLETE
1010,0.6520362484987444,2023-10-02 12:12:01.794321,2023-10-02 12:12:01.941687,0 days 00:00:00.147366,34106.26365235179,460,saga,COMPLETE
1011,0.6481602795064964,2023-10-02 12:12:01.942786,2023-10-02 12:12:02.091314,0 days 00:00:00.148528,42256.7330135783,470,saga,COMPLETE
1012,0.6411180259853696,2023-10-02 12:12:02.092316,2023-10-02 12:12:02.245985,0 days 00:00:00.153669,14710.72646331268,490,saga,COMPLETE
1013,0.6520362484987444,2023-10-02 12:12:02.245985,2023-10-02 12:12:02.393119,0 days 00:00:00.147134,24031.90621787463,480,saga,COMPLETE
1014,0.6481602795064964,2023-10-02 12:12:02.394125,2023-10-02 12:12:02.540563,0 days 00:00:00.146438,62297.314520518004,470,saga,COMPLETE
1015,0.5,2023-10-02 12:12:02.541604,2023-10-02 12:12:02.630127,0 days 00:00:00.088523,0.005055143484913427,490,saga,COMPLETE
1016,0.6481602795064964,2023-10-02 12:12:02.630127,2023-10-02 12:12:02.785802,0 days 00:00:00.155675,7879.529600503557,480,saga,COMPLETE
1017,0.637951741456491,2023-10-02 12:12:02.785802,2023-10-02 12:12:02.872903,0 days 00:00:00.087101,31834.070497677792,460,newton-cg,COMPLETE
1018,0.5,2023-10-02 12:12:02.873948,2023-10-02 12:12:02.949405,0 days 00:00:00.075457,0.01574886970372707,450,saga,COMPLETE
1019,0.6520362484987444,2023-10-02 12:12:02.950407,2023-10-02 12:12:03.101147,0 days 00:00:00.150740,4496.770584673388,470,saga,COMPLETE
1020,0.6481602795064964,2023-10-02 12:12:03.102150,2023-10-02 12:12:03.250771,0 days 00:00:00.148621,15890.437722655479,480,saga,COMPLETE
1021,0.637951741456491,2023-10-02 12:12:03.251775,2023-10-02 12:12:03.308772,0 days 00:00:00.056997,61617.41843734505,490,liblinear,COMPLETE
1022,0.6590785020198712,2023-10-02 12:12:03.308772,2023-10-02 12:12:03.520111,0 days 00:00:00.211339,24863.89970093709,480,saga,COMPLETE
1023,0.6590785020198712,2023-10-02 12:12:03.521110,2023-10-02 12:12:03.667564,0 days 00:00:00.146454,11501.29163347148,470,saga,COMPLETE
1024,0.6590785020198712,2023-10-02 12:12:03.668673,2023-10-02 12:12:03.829395,0 days 00:00:00.160722,46350.5400662026,490,saga,COMPLETE
1025,0.6590785020198712,2023-10-02 12:12:03.830396,2023-10-02 12:12:03.975335,0 days 00:00:00.144939,99573.23673167027,470,sag,COMPLETE
1026,0.6481602795064964,2023-10-02 12:12:03.976334,2023-10-02 12:12:04.124427,0 days 00:00:00.148093,33361.579151027145,480,saga,COMPLETE
1027,0.6552025330276231,2023-10-02 12:12:04.124427,2023-10-02 12:12:04.268464,0 days 00:00:00.144037,19558.491726405828,460,saga,COMPLETE
1028,0.6411180259853696,2023-10-02 12:12:04.269584,2023-10-02 12:12:04.420306,0 days 00:00:00.150722,6942.531415469344,490,saga,COMPLETE
1029,0.6449939949776177,2023-10-02 12:12:04.420306,2023-10-02 12:12:04.567751,0 days 00:00:00.147445,10122.339494853859,470,saga,COMPLETE
1030,0.5,2023-10-02 12:12:04.568753,2023-10-02 12:12:04.834838,0 days 00:00:00.266085,1.1034764555118032e-05,460,saga,COMPLETE
1031,0.5,2023-10-02 12:12:04.834838,2023-10-02 12:12:04.899025,0 days 00:00:00.064187,0.054216586658866625,480,saga,COMPLETE
1032,0.6520362484987444,2023-10-02 12:12:04.900025,2023-10-02 12:12:05.050657,0 days 00:00:00.150632,63050.43551484582,490,saga,COMPLETE
1033,0.6590785020198712,2023-10-02 12:12:05.050657,2023-10-02 12:12:05.208651,0 days 00:00:00.157994,40165.14833116174,500,saga,COMPLETE
1034,0.6481602795064964,2023-10-02 12:12:05.208651,2023-10-02 12:12:05.362123,0 days 00:00:00.153472,22107.45891654353,470,saga,COMPLETE
1035,0.5,2023-10-02 12:12:05.362123,2023-10-02 12:12:05.609841,0 days 00:00:00.247718,0.00013600769834163696,480,saga,COMPLETE
1036,0.666120755540998,2023-10-02 12:12:05.610842,2023-10-02 12:12:05.753273,0 days 00:00:00.142431,14252.142157687578,450,saga,COMPLETE
1037,0.637951741456491,2023-10-02 12:12:05.754272,2023-10-02 12:12:05.897080,0 days 00:00:00.142808,4543.866556513766,450,saga,COMPLETE
1038,0.6590785020198712,2023-10-02 12:12:05.898134,2023-10-02 12:12:06.040118,0 days 00:00:00.141984,12748.942699120596,450,saga,COMPLETE
1039,0.6449939949776177,2023-10-02 12:12:06.041116,2023-10-02 12:12:06.196426,0 days 00:00:00.155310,7812.227840957217,450,saga,COMPLETE
1040,0.6590785020198712,2023-10-02 12:12:06.196615,2023-10-02 12:12:06.343870,0 days 00:00:00.147255,13393.424559100891,460,saga,COMPLETE
1041,0.5,2023-10-02 12:12:06.343870,2023-10-02 12:12:06.504812,0 days 00:00:00.160942,0.00034501365239546965,460,saga,COMPLETE
1042,0.637951741456491,2023-10-02 12:12:06.504812,2023-10-02 12:12:06.591352,0 days 00:00:00.086540,18607.65100973709,460,newton-cg,COMPLETE
1043,0.6520362484987444,2023-10-02 12:12:06.592351,2023-10-02 12:12:06.740509,0 days 00:00:00.148158,5485.569564147481,470,saga,COMPLETE
1044,0.6520362484987444,2023-10-02 12:12:06.740509,2023-10-02 12:12:06.886036,0 days 00:00:00.145527,9063.927597877322,470,saga,COMPLETE
1045,0.6309094879353642,2023-10-02 12:12:06.887035,2023-10-02 12:12:06.944637,0 days 00:00:00.057602,2946.004721737817,460,liblinear,COMPLETE
1046,0.6520362484987444,2023-10-02 12:12:06.944637,2023-10-02 12:12:07.091551,0 days 00:00:00.146914,17167.616844940716,450,saga,COMPLETE
1047,0.6552025330276231,2023-10-02 12:12:07.091551,2023-10-02 12:12:07.238653,0 days 00:00:00.147102,27025.9330509098,470,saga,COMPLETE
1048,0.5,2023-10-02 12:12:07.238653,2023-10-02 12:12:07.414223,0 days 00:00:00.175570,0.0006601697938751512,460,saga,COMPLETE
1049,0.6590785020198712,2023-10-02 12:12:07.414223,2023-10-02 12:12:07.582282,0 days 00:00:00.168059,11801.472978388625,470,saga,COMPLETE
1050,0.6411180259853696,2023-10-02 12:12:07.582282,2023-10-02 12:12:07.732883,0 days 00:00:00.150601,27648.668635395,480,saga,COMPLETE
1051,0.6411180259853696,2023-10-02 12:12:07.733881,2023-10-02 12:12:07.879361,0 days 00:00:00.145480,4526.270512899379,450,saga,COMPLETE
1052,0.5,2023-10-02 12:12:07.880360,2023-10-02 12:12:07.948194,0 days 00:00:00.067834,0.2746578862868066,490,saga,COMPLETE
1053,0.5,2023-10-02 12:12:07.949189,2023-10-02 12:12:08.016301,0 days 00:00:00.067112,0.021234725902356227,470,sag,COMPLETE
1054,0.6449939949776177,2023-10-02 12:12:08.017298,2023-10-02 12:12:08.172498,0 days 00:00:00.155200,39706.52474581367,480,saga,COMPLETE
1055,0.5,2023-10-02 12:12:08.173496,2023-10-02 12:12:08.280705,0 days 00:00:00.107209,0.0027008678039924417,460,saga,COMPLETE
1056,0.6520362484987444,2023-10-02 12:12:08.280705,2023-10-02 12:12:08.434468,0 days 00:00:00.153763,14445.559712851182,500,saga,COMPLETE
1057,0.6520362484987444,2023-10-02 12:12:08.435468,2023-10-02 12:12:08.588117,0 days 00:00:00.152649,6398.766284917074,490,saga,COMPLETE
1058,0.5,2023-10-02 12:12:08.588117,2023-10-02 12:12:08.808022,0 days 00:00:00.219905,6.96496583329412e-05,350,saga,COMPLETE
1059,0.5,2023-10-02 12:12:08.808022,2023-10-02 12:12:08.871770,0 days 00:00:00.063748,0.12518111855905772,440,saga,COMPLETE
1060,0.6481602795064964,2023-10-02 12:12:08.871770,2023-10-02 12:12:09.024787,0 days 00:00:00.153017,23780.630624203033,470,saga,COMPLETE
1061,0.5,2023-10-02 12:12:09.025787,2023-10-02 12:12:09.113380,0 days 00:00:00.087593,0.01014131686117459,480,saga,COMPLETE
1062,0.6552025330276231,2023-10-02 12:12:09.113380,2023-10-02 12:12:09.257403,0 days 00:00:00.144023,41875.12732820644,450,saga,COMPLETE
1063,0.6411180259853696,2023-10-02 12:12:09.257403,2023-10-02 12:12:09.407950,0 days 00:00:00.150547,10903.943263253104,480,saga,COMPLETE
1064,0.6590785020198712,2023-10-02 12:12:09.408946,2023-10-02 12:12:09.557997,0 days 00:00:00.149051,16598.40249912918,470,saga,COMPLETE
1065,0.5,2023-10-02 12:12:09.559051,2023-10-02 12:12:09.686814,0 days 00:00:00.127763,0.001795835950003482,490,saga,COMPLETE
1066,0.6449939949776177,2023-10-02 12:12:09.686814,2023-10-02 12:12:09.832178,0 days 00:00:00.145364,28334.86551030998,460,saga,COMPLETE
1067,0.6238672344142374,2023-10-02 12:12:09.832178,2023-10-02 12:12:09.909701,0 days 00:00:00.077523,3047.0514660017684,480,newton-cg,COMPLETE
1068,0.6552025330276231,2023-10-02 12:12:09.910700,2023-10-02 12:12:10.062728,0 days 00:00:00.152028,7877.3272498467495,470,saga,COMPLETE
1069,0.6481602795064964,2023-10-02 12:12:10.062728,2023-10-02 12:12:10.219913,0 days 00:00:00.157185,45381.34614231034,500,saga,COMPLETE
1070,0.637951741456491,2023-10-02 12:12:10.220914,2023-10-02 12:12:10.286689,0 days 00:00:00.065775,19275.79073830265,490,liblinear,COMPLETE
1071,0.5,2023-10-02 12:12:10.286689,2023-10-02 12:12:10.358990,0 days 00:00:00.072301,0.036548567016768375,460,saga,COMPLETE
1072,0.5,2023-10-02 12:12:10.359986,2023-10-02 12:12:10.641632,0 days 00:00:00.281646,1.575420631928125e-05,470,saga,COMPLETE
1073,0.5,2023-10-02 12:12:10.642632,2023-10-02 12:12:10.702698,0 days 00:00:00.060066,0.20741940454737112,450,saga,COMPLETE
1074,0.5,2023-10-02 12:12:10.702698,2023-10-02 12:12:10.774323,0 days 00:00:00.071625,0.004679982192930455,480,saga,COMPLETE
1075,0.6488699639698657,2023-10-02 12:12:10.775318,2023-10-02 12:12:10.920779,0 days 00:00:00.145461,61503.82885127352,480,sag,COMPLETE
1076,0.6520362484987444,2023-10-02 12:12:10.921780,2023-10-02 12:12:11.078341,0 days 00:00:00.156561,29068.3115946233,490,saga,COMPLETE
1077,0.6590785020198712,2023-10-02 12:12:11.079346,2023-10-02 12:12:11.231945,0 days 00:00:00.152599,9403.163548704179,460,saga,COMPLETE
1078,0.6411180259853696,2023-10-02 12:12:11.232942,2023-10-02 12:12:11.378054,0 days 00:00:00.145112,14135.55237030817,470,saga,COMPLETE
1079,0.6520362484987444,2023-10-02 12:12:11.379053,2023-10-02 12:12:11.529741,0 days 00:00:00.150688,40214.76649382067,470,saga,COMPLETE
1080,0.6590785020198712,2023-10-02 12:12:11.530746,2023-10-02 12:12:11.697243,0 days 00:00:00.166497,4460.10529357212,500,saga,COMPLETE
1081,0.6481602795064964,2023-10-02 12:12:11.698230,2023-10-02 12:12:11.864443,0 days 00:00:00.166213,68957.37844740004,480,saga,COMPLETE
1082,0.6411180259853696,2023-10-02 12:12:11.865444,2023-10-02 12:12:12.010814,0 days 00:00:00.145370,96008.87779437428,370,saga,COMPLETE
1083,0.6481602795064964,2023-10-02 12:12:12.011813,2023-10-02 12:12:12.164858,0 days 00:00:00.153045,22411.133092886907,490,saga,COMPLETE
1084,0.6520362484987444,2023-10-02 12:12:12.165861,2023-10-02 12:12:12.310460,0 days 00:00:00.144599,1797.3132995322635,450,saga,COMPLETE
1085,0.5,2023-10-02 12:12:12.311457,2023-10-02 12:12:12.604888,0 days 00:00:00.293431,3.609466856486344e-05,480,saga,COMPLETE
1086,0.6520362484987444,2023-10-02 12:12:12.605941,2023-10-02 12:12:12.759811,0 days 00:00:00.153870,38962.69845904804,460,saga,COMPLETE
1087,0.5,2023-10-02 12:12:12.759811,2023-10-02 12:12:12.946691,0 days 00:00:00.186880,0.00022223581813906595,470,saga,COMPLETE
1088,0.5,2023-10-02 12:12:12.947688,2023-10-02 12:12:13.037421,0 days 00:00:00.089733,0.007510141093308007,490,saga,COMPLETE
1089,0.6520362484987444,2023-10-02 12:12:13.038422,2023-10-02 12:12:13.210674,0 days 00:00:00.172252,6635.456997618458,480,saga,COMPLETE
1090,0.5,2023-10-02 12:12:13.211671,2023-10-02 12:12:13.495377,0 days 00:00:00.283706,2.0609572091328356e-05,470,saga,COMPLETE
1091,0.5447101211922699,2023-10-02 12:12:13.495548,2023-10-02 12:12:13.563616,0 days 00:00:00.068068,0.6403734599718442,460,saga,COMPLETE
1092,0.6520362484987444,2023-10-02 12:12:13.564616,2023-10-02 12:12:13.725148,0 days 00:00:00.160532,15785.2783031737,490,saga,COMPLETE
1093,0.6590785020198712,2023-10-02 12:12:13.725148,2023-10-02 12:12:13.856213,0 days 00:00:00.131065,99653.41438393727,340,saga,COMPLETE
1094,0.6449939949776177,2023-10-02 12:12:13.856213,2023-10-02 12:12:13.919543,0 days 00:00:00.063330,29679.219677994748,500,liblinear,COMPLETE
1095,0.637951741456491,2023-10-02 12:12:13.920540,2023-10-02 12:12:14.002069,0 days 00:00:00.081529,10245.10732219837,480,newton-cg,COMPLETE
1096,0.6449939949776177,2023-10-02 12:12:14.002069,2023-10-02 12:12:14.147123,0 days 00:00:00.145054,51474.91405948082,450,saga,COMPLETE
1097,0.6520362484987444,2023-10-02 12:12:14.147123,2023-10-02 12:12:14.301657,0 days 00:00:00.154534,23832.226359151042,470,saga,COMPLETE
1098,0.5,2023-10-02 12:12:14.301657,2023-10-02 12:12:14.366183,0 days 00:00:00.064526,0.061401964202876684,480,saga,COMPLETE
1099,0.637951741456491,2023-10-02 12:12:14.366183,2023-10-02 12:12:14.514228,0 days 00:00:00.148045,3772.4118567898545,460,saga,COMPLETE
1100,0.666120755540998,2023-10-02 12:12:14.514228,2023-10-02 12:12:14.662608,0 days 00:00:00.148380,17996.376202303087,490,sag,COMPLETE
1101,0.5,2023-10-02 12:12:14.663608,2023-10-02 12:12:14.745243,0 days 00:00:00.081635,0.000909488128360534,500,sag,COMPLETE
1102,0.666120755540998,2023-10-02 12:12:14.746246,2023-10-02 12:12:14.902275,0 days 00:00:00.156029,10843.836768025718,500,sag,COMPLETE
1103,0.6590785020198712,2023-10-02 12:12:14.902336,2023-10-02 12:12:15.058576,0 days 00:00:00.156240,7499.3860045351685,490,sag,COMPLETE
1104,0.6520362484987444,2023-10-02 12:12:15.059640,2023-10-02 12:12:15.209978,0 days 00:00:00.150338,10545.559813398635,500,sag,COMPLETE
1105,0.666120755540998,2023-10-02 12:12:15.210977,2023-10-02 12:12:15.359928,0 days 00:00:00.148951,5241.057676391462,500,sag,COMPLETE
1106,0.637951741456491,2023-10-02 12:12:15.360921,2023-10-02 12:12:15.534501,0 days 00:00:00.173580,3189.1235184401517,500,sag,COMPLETE
1107,0.666120755540998,2023-10-02 12:12:15.535670,2023-10-02 12:12:15.699881,0 days 00:00:00.164211,5076.647920716685,500,sag,COMPLETE
1108,0.6590785020198712,2023-10-02 12:12:15.699881,2023-10-02 12:12:15.855191,0 days 00:00:00.155310,4375.240366849207,500,sag,COMPLETE
1109,0.6520362484987444,2023-10-02 12:12:15.856236,2023-10-02 12:12:16.004987,0 days 00:00:00.148751,3124.0920671593717,500,sag,COMPLETE
1110,0.6590785020198712,2023-10-02 12:12:16.005994,2023-10-02 12:12:16.156271,0 days 00:00:00.150277,5453.728215335439,500,sag,COMPLETE
1111,0.6590785020198712,2023-10-02 12:12:16.156271,2023-10-02 12:12:16.304805,0 days 00:00:00.148534,6451.4354089295775,500,sag,COMPLETE
1112,0.666120755540998,2023-10-02 12:12:16.305803,2023-10-02 12:12:16.455178,0 days 00:00:00.149375,4833.073086896973,500,sag,COMPLETE
1113,0.6449939949776177,2023-10-02 12:12:16.456180,2023-10-02 12:12:16.603478,0 days 00:00:00.147298,2198.2174894717114,500,sag,COMPLETE
1114,0.6520362484987444,2023-10-02 12:12:16.604481,2023-10-02 12:12:16.751590,0 days 00:00:00.147109,2711.836269690569,500,sag,COMPLETE
1115,0.6590785020198712,2023-10-02 12:12:16.751590,2023-10-02 12:12:16.909564,0 days 00:00:00.157974,4094.8845441901676,500,sag,COMPLETE
1116,0.6449939949776177,2023-10-02 12:12:16.910560,2023-10-02 12:12:17.063957,0 days 00:00:00.153397,1410.3784621009493,500,sag,COMPLETE
1117,0.6520362484987444,2023-10-02 12:12:17.065173,2023-10-02 12:12:17.228727,0 days 00:00:00.163554,2108.765767874064,500,sag,COMPLETE
1118,0.6520362484987444,2023-10-02 12:12:17.228727,2023-10-02 12:12:17.382753,0 days 00:00:00.154026,6913.504387004757,500,sag,COMPLETE
1119,0.666120755540998,2023-10-02 12:12:17.383755,2023-10-02 12:12:17.541766,0 days 00:00:00.158011,4846.910161012621,500,sag,COMPLETE
1120,0.6520362484987444,2023-10-02 12:12:17.541766,2023-10-02 12:12:17.693870,0 days 00:00:00.152104,4257.261118525409,500,sag,COMPLETE
1121,0.6520362484987444,2023-10-02 12:12:17.694864,2023-10-02 12:12:17.859573,0 days 00:00:00.164709,2725.015941164008,500,sag,COMPLETE
1122,0.6449939949776177,2023-10-02 12:12:17.859573,2023-10-02 12:12:18.011103,0 days 00:00:00.151530,3989.9438547389304,500,sag,COMPLETE
1123,0.5,2023-10-02 12:12:18.011103,2023-10-02 12:12:18.095372,0 days 00:00:00.084269,0.0005781056683857646,500,sag,COMPLETE
1124,0.6590785020198712,2023-10-02 12:12:18.096373,2023-10-02 12:12:18.246925,0 days 00:00:00.150552,5778.6183171979255,500,sag,COMPLETE
1125,0.6520362484987444,2023-10-02 12:12:18.247925,2023-10-02 12:12:18.399215,0 days 00:00:00.151290,1752.721244310576,500,sag,COMPLETE
1126,0.6590785020198712,2023-10-02 12:12:18.399215,2023-10-02 12:12:18.555222,0 days 00:00:00.156007,5620.08211539021,500,sag,COMPLETE
1127,0.6449939949776177,2023-10-02 12:12:18.556333,2023-10-02 12:12:18.730121,0 days 00:00:00.173788,1304.8798565949567,490,sag,COMPLETE
