number,value,datetime_start,datetime_complete,duration,params_C,params_max_iter,params_solver,state
7971,0.6449939949776177,2023-10-02 12:49:45.711088,2023-10-02 12:49:46.359484,0 days 00:00:00.648396,2897.501157378128,490,sag,COMPLETE
7972,0.5,2023-10-02 12:49:46.361485,2023-10-02 12:49:46.847170,0 days 00:00:00.485685,0.03288664222664063,480,sag,COMPLETE
7973,0.608417949557812,2023-10-02 12:49:46.851168,2023-10-02 12:49:47.461687,0 days 00:00:00.610519,3.0892595651041797,500,sag,COMPLETE
7974,0.6590785020198712,2023-10-02 12:49:47.463440,2023-10-02 12:49:48.014926,0 days 00:00:00.551486,18123.19487624483,320,sag,COMPLETE
7975,0.5,2023-10-02 12:49:48.032025,2023-10-02 12:49:48.542162,0 days 00:00:00.510137,0.09816977398655137,470,sag,COMPLETE
7976,0.6069985806310733,2023-10-02 12:49:48.542162,2023-10-02 12:49:48.989191,0 days 00:00:00.447029,4.602178296746938,430,sag,COMPLETE
7977,0.6077082650944426,2023-10-02 12:49:48.989191,2023-10-02 12:49:49.507612,0 days 00:00:00.518421,3.6364904333672166,340,sag,COMPLETE
7978,0.6534556174254831,2023-10-02 12:49:49.507612,2023-10-02 12:49:50.056559,0 days 00:00:00.548947,46.686312042218695,460,sag,COMPLETE
7979,0.649579648433235,2023-10-02 12:49:50.056559,2023-10-02 12:49:50.553864,0 days 00:00:00.497305,145.33776208718066,490,sag,COMPLETE
7980,0.5,2023-10-02 12:49:50.553864,2023-10-02 12:49:51.162999,0 days 00:00:00.609135,1.0407687809526752e-05,370,lbfgs,COMPLETE
7981,0.6418277104487389,2023-10-02 12:49:51.162999,2023-10-02 12:49:51.791829,0 days 00:00:00.628830,474.8730812033954,360,sag,COMPLETE
7982,0.6534556174254831,2023-10-02 12:49:51.793821,2023-10-02 12:49:52.234639,0 days 00:00:00.440818,70.13733566010015,450,sag,COMPLETE
7983,0.6449939949776177,2023-10-02 12:49:52.234639,2023-10-02 12:49:52.807506,0 days 00:00:00.572867,50317.71031698853,480,sag,COMPLETE
7984,0.666120755540998,2023-10-02 12:49:52.807506,2023-10-02 12:49:53.374719,0 days 00:00:00.567213,7463.549297351347,350,sag,COMPLETE
7985,0.6481602795064964,2023-10-02 12:49:53.374719,2023-10-02 12:49:53.954873,0 days 00:00:00.580154,25389.04325242664,500,sag,COMPLETE
7986,0.6369145103177202,2023-10-02 12:49:53.970513,2023-10-02 12:49:54.378448,0 days 00:00:00.407935,22.54469447678384,470,sag,COMPLETE
7987,0.5,2023-10-02 12:49:54.378448,2023-10-02 12:49:55.005987,0 days 00:00:00.627539,9.749814583542048e-05,390,sag,COMPLETE
7988,0.5925865269134185,2023-10-02 12:49:55.005987,2023-10-02 12:49:55.476364,0 days 00:00:00.470377,1.383848480359183,490,sag,COMPLETE
7989,0.6520362484987444,2023-10-02 12:49:55.476364,2023-10-02 12:49:55.952302,0 days 00:00:00.475938,36519.01513641442,420,sag,COMPLETE
7990,0.6590785020198712,2023-10-02 12:49:55.952302,2023-10-02 12:49:56.513813,0 days 00:00:00.561511,5262.560144085909,380,sag,COMPLETE
7991,0.637951741456491,2023-10-02 12:49:56.515813,2023-10-02 12:49:57.054618,0 days 00:00:00.538805,13345.94218205877,330,newton-cg,COMPLETE
7992,0.6488699639698657,2023-10-02 12:49:57.054618,2023-10-02 12:49:57.558346,0 days 00:00:00.503728,64351.311347269184,490,sag,COMPLETE
7993,0.6590785020198712,2023-10-02 12:49:57.560046,2023-10-02 12:49:58.166011,0 days 00:00:00.605965,99929.21568479275,480,sag,COMPLETE
7994,0.669996724533246,2023-10-02 12:49:58.168011,2023-10-02 12:49:58.737850,0 days 00:00:00.569839,25810.259308948946,500,sag,COMPLETE
7995,0.637951741456491,2023-10-02 12:49:58.737850,2023-10-02 12:49:59.241374,0 days 00:00:00.503524,9238.470579128134,450,liblinear,COMPLETE
7996,0.5,2023-10-02 12:49:59.244800,2023-10-02 12:49:59.659747,0 days 00:00:00.414947,0.010615777486462539,370,sag,COMPLETE
7997,0.6449939949776177,2023-10-02 12:49:59.662794,2023-10-02 12:50:00.245311,0 days 00:00:00.582517,43387.08888891694,460,sag,COMPLETE
7998,0.6520362484987444,2023-10-02 12:50:00.246397,2023-10-02 12:50:00.887703,0 days 00:00:00.641306,1808.9281856420312,470,sag,COMPLETE
7999,0.6559122174909924,2023-10-02 12:50:00.889707,2023-10-02 12:50:01.392600,0 days 00:00:00.502893,16168.307458936277,290,sag,COMPLETE
8000,0.6590785020198712,2023-10-02 12:50:01.392600,2023-10-02 12:50:01.961024,0 days 00:00:00.568424,3212.9545120796547,340,sag,COMPLETE
8001,0.6449939949776177,2023-10-02 12:50:01.961024,2023-10-02 12:50:02.544389,0 days 00:00:00.583365,6021.892969215827,440,sag,COMPLETE
8002,0.637951741456491,2023-10-02 12:50:02.559912,2023-10-02 12:50:03.061357,0 days 00:00:00.501445,1047.967551115485,500,sag,COMPLETE
8003,0.5,2023-10-02 12:50:03.061357,2023-10-02 12:50:03.995180,0 days 00:00:00.933823,2.992036882549715e-05,350,sag,COMPLETE
8004,0.6590785020198712,2023-10-02 12:50:03.995180,2023-10-02 12:50:04.650672,0 days 00:00:00.655492,61439.034860913824,360,sag,COMPLETE
8005,0.637951741456491,2023-10-02 12:50:04.650672,2023-10-02 12:50:05.220509,0 days 00:00:00.569837,32673.508820438776,480,lbfgs,COMPLETE
8006,0.6488699639698657,2023-10-02 12:50:05.220509,2023-10-02 12:50:05.722612,0 days 00:00:00.502103,11014.000402405385,490,sag,COMPLETE
8007,0.6449939949776177,2023-10-02 12:50:05.722612,2023-10-02 12:50:06.314518,0 days 00:00:00.591906,21161.396947337078,380,sag,COMPLETE
8008,0.5,2023-10-02 12:50:06.317514,2023-10-02 12:50:06.871177,0 days 00:00:00.553663,0.00014486665504384274,480,sag,COMPLETE
8009,0.6590785020198712,2023-10-02 12:50:06.873175,2023-10-02 12:50:07.358935,0 days 00:00:00.485760,4577.438118123333,450,sag,COMPLETE
8010,0.5,2023-10-02 12:50:07.361938,2023-10-02 12:50:07.831030,0 days 00:00:00.469092,0.009532579765071433,470,sag,COMPLETE
8011,0.6590785020198712,2023-10-02 12:50:07.831030,2023-10-02 12:50:08.406736,0 days 00:00:00.575706,63796.10992553994,500,sag,COMPLETE
8012,0.5,2023-10-02 12:50:08.408736,2023-10-02 12:50:08.913164,0 days 00:00:00.504428,0.0007457904667171676,360,sag,COMPLETE
8013,0.5619609127634021,2023-10-02 12:50:08.913164,2023-10-02 12:50:09.307282,0 days 00:00:00.394118,0.9772273449666709,490,sag,COMPLETE
8014,0.6411180259853696,2023-10-02 12:50:09.309282,2023-10-02 12:50:09.847757,0 days 00:00:00.538475,37785.51977507528,350,sag,COMPLETE
8015,0.637951741456491,2023-10-02 12:50:09.849700,2023-10-02 12:50:10.394893,0 days 00:00:00.545193,648.0780219446394,320,sag,COMPLETE
8016,0.637951741456491,2023-10-02 12:50:10.394893,2023-10-02 12:50:10.814784,0 days 00:00:00.419891,8183.152413301466,460,newton-cg,COMPLETE
8017,0.6590785020198712,2023-10-02 12:50:10.815942,2023-10-02 12:50:11.362064,0 days 00:00:00.546122,17346.975829167415,370,sag,COMPLETE
8018,0.6457036794409869,2023-10-02 12:50:11.364865,2023-10-02 12:50:11.899360,0 days 00:00:00.534495,218.1694372382495,490,sag,COMPLETE
8019,0.637951741456491,2023-10-02 12:50:11.899360,2023-10-02 12:50:12.288110,0 days 00:00:00.388750,28638.704453622646,340,liblinear,COMPLETE
8020,0.637951741456491,2023-10-02 12:50:12.299938,2023-10-02 12:50:12.897611,0 days 00:00:00.597673,2808.5687122520435,480,sag,COMPLETE
8021,0.6520362484987444,2023-10-02 12:50:12.898832,2023-10-02 12:50:13.449019,0 days 00:00:00.550187,50999.470942426946,430,sag,COMPLETE
8022,0.5,2023-10-02 12:50:13.465693,2023-10-02 12:50:13.965728,0 days 00:00:00.500035,0.0398779450238554,500,sag,COMPLETE
8023,0.6449939949776177,2023-10-02 12:50:13.965728,2023-10-02 12:50:14.449409,0 days 00:00:00.483681,12132.812588846484,440,sag,COMPLETE
8024,0.6590785020198712,2023-10-02 12:50:14.449409,2023-10-02 12:50:15.065926,0 days 00:00:00.616517,64768.22868578775,480,sag,COMPLETE
8025,0.6481602795064964,2023-10-02 12:50:15.067762,2023-10-02 12:50:15.733529,0 days 00:00:00.665767,5321.373561169273,460,sag,COMPLETE
8026,0.6020853805000546,2023-10-02 12:50:15.748549,2023-10-02 12:50:16.216212,0 days 00:00:00.467663,1.8400606938958872,470,sag,COMPLETE
8027,0.6235396877388361,2023-10-02 12:50:16.216212,2023-10-02 12:50:16.712772,0 days 00:00:00.496560,8.402555018274974,500,sag,COMPLETE
8028,0.6369145103177202,2023-10-02 12:50:16.712772,2023-10-02 12:50:17.200389,0 days 00:00:00.487617,20.076207802053354,490,sag,COMPLETE
8029,0.666120755540998,2023-10-02 12:50:17.216017,2023-10-02 12:50:17.684119,0 days 00:00:00.468102,23771.927202886367,380,sag,COMPLETE
8030,0.6277432034064855,2023-10-02 12:50:17.699765,2023-10-02 12:50:18.248842,0 days 00:00:00.549077,1462.3228473807244,360,lbfgs,COMPLETE
8031,0.5,2023-10-02 12:50:18.248842,2023-10-02 12:50:18.735297,0 days 00:00:00.486455,0.2954212430623525,350,sag,COMPLETE
8032,0.6590785020198712,2023-10-02 12:50:18.735297,2023-10-02 12:50:19.299231,0 days 00:00:00.563934,40558.47959893379,400,sag,COMPLETE
8033,0.6077082650944426,2023-10-02 12:50:19.301905,2023-10-02 12:50:19.684268,0 days 00:00:00.382363,3.5260422526323447,390,sag,COMPLETE
8034,0.666120755540998,2023-10-02 12:50:19.697791,2023-10-02 12:50:20.286395,0 days 00:00:00.588604,15123.78515879182,490,sag,COMPLETE
8035,0.6457036794409869,2023-10-02 12:50:20.286395,2023-10-02 12:50:20.828444,0 days 00:00:00.542049,205.19452881203563,450,sag,COMPLETE
8036,0.6418277104487389,2023-10-02 12:50:20.828444,2023-10-02 12:50:21.273217,0 days 00:00:00.444773,373.1809933951177,330,sag,COMPLETE
8037,0.6590785020198712,2023-10-02 12:50:21.273217,2023-10-02 12:50:21.833560,0 days 00:00:00.560343,7732.684062025393,440,sag,COMPLETE
8038,0.5,2023-10-02 12:50:21.833560,2023-10-02 12:50:22.345772,0 days 00:00:00.512212,0.0003579119438268576,480,sag,COMPLETE
8039,0.6552025330276231,2023-10-02 12:50:22.345772,2023-10-02 12:50:22.836744,0 days 00:00:00.490972,66617.38867746934,500,sag,COMPLETE
8040,0.669996724533246,2023-10-02 12:50:22.836744,2023-10-02 12:50:23.413677,0 days 00:00:00.576933,2419.2386855574186,420,sag,COMPLETE
8041,0.5,2023-10-02 12:50:23.416676,2023-10-02 12:50:23.919405,0 days 00:00:00.502729,0.0005408349818492055,460,sag,COMPLETE
8042,0.5,2023-10-02 12:50:23.935036,2023-10-02 12:50:24.422756,0 days 00:00:00.487720,3.910776451762805e-05,370,newton-cg,COMPLETE
8043,0.5,2023-10-02 12:50:24.425755,2023-10-02 12:50:24.834694,0 days 00:00:00.408939,0.0018928223687205458,490,sag,COMPLETE
8044,0.637951741456491,2023-10-02 12:50:24.837643,2023-10-02 12:50:25.313996,0 days 00:00:00.476353,25046.10624456056,470,liblinear,COMPLETE
8045,0.666120755540998,2023-10-02 12:50:25.313996,2023-10-02 12:50:25.847638,0 days 00:00:00.533642,44462.43689704806,340,sag,COMPLETE
8046,0.6590785020198712,2023-10-02 12:50:25.847638,2023-10-02 12:50:26.334121,0 days 00:00:00.486483,4287.674941054917,480,sag,COMPLETE
8047,0.6534556174254831,2023-10-02 12:50:26.334121,2023-10-02 12:50:26.851016,0 days 00:00:00.516895,83.09140015314848,360,sag,COMPLETE
8048,0.5,2023-10-02 12:50:26.851016,2023-10-02 12:50:27.350131,0 days 00:00:00.499115,0.02376178960050278,500,sag,COMPLETE
8049,0.6590785020198712,2023-10-02 12:50:27.350131,2023-10-02 12:50:27.831605,0 days 00:00:00.481474,99396.56290741662,470,sag,COMPLETE
8050,0.5,2023-10-02 12:50:27.831605,2023-10-02 12:50:28.312907,0 days 00:00:00.481302,0.007872103215071667,490,sag,COMPLETE
8051,0.6502893328966044,2023-10-02 12:50:28.312907,2023-10-02 12:50:28.813520,0 days 00:00:00.500613,33.430753676921285,350,sag,COMPLETE
8052,0.5,2023-10-02 12:50:28.813520,2023-10-02 12:50:29.314330,0 days 00:00:00.500810,0.16381995408393094,370,sag,COMPLETE
8053,0.6520362484987444,2023-10-02 12:50:29.314330,2023-10-02 12:50:29.804793,0 days 00:00:00.490463,10971.029384301059,450,sag,COMPLETE
8054,0.6337482257888415,2023-10-02 12:50:29.804793,2023-10-02 12:50:30.318919,0 days 00:00:00.514126,14.724095893650746,490,lbfgs,COMPLETE
8055,0.666120755540998,2023-10-02 12:50:30.320915,2023-10-02 12:50:30.865539,0 days 00:00:00.544624,32808.97861317013,330,sag,COMPLETE
8056,0.6590785020198712,2023-10-02 12:50:30.865539,2023-10-02 12:50:31.367673,0 days 00:00:00.502134,17410.63058611686,500,sag,COMPLETE
8057,0.666120755540998,2023-10-02 12:50:31.367673,2023-10-02 12:50:31.948314,0 days 00:00:00.580641,8751.212579384415,480,sag,COMPLETE
8058,0.5,2023-10-02 12:50:31.948314,2023-10-02 12:50:32.419144,0 days 00:00:00.470830,0.018856918160214037,380,sag,COMPLETE
8059,0.5,2023-10-02 12:50:32.434785,2023-10-02 12:50:32.921259,0 days 00:00:00.486474,0.1958669373551991,360,sag,COMPLETE
8060,0.6590785020198712,2023-10-02 12:50:32.921259,2023-10-02 12:50:33.407395,0 days 00:00:00.486136,49616.356017518636,460,sag,COMPLETE
8061,0.666120755540998,2023-10-02 12:50:33.407395,2023-10-02 12:50:33.956956,0 days 00:00:00.549561,68139.67685887363,500,sag,COMPLETE
8062,0.6449939949776177,2023-10-02 12:50:33.956956,2023-10-02 12:50:34.515894,0 days 00:00:00.558938,5551.679495894902,430,sag,COMPLETE
8063,0.6534556174254831,2023-10-02 12:50:34.515894,2023-10-02 12:50:34.931215,0 days 00:00:00.415321,117.3729835666475,470,sag,COMPLETE
8064,0.528169014084507,2023-10-02 12:50:34.931215,2023-10-02 12:50:35.454588,0 days 00:00:00.523373,0.4141844492990825,480,sag,COMPLETE
8065,0.6449939949776177,2023-10-02 12:50:35.454588,2023-10-02 12:50:35.981523,0 days 00:00:00.526935,99612.36656862168,340,newton-cg,COMPLETE
8066,0.5,2023-10-02 12:50:35.981523,2023-10-02 12:50:36.539582,0 days 00:00:00.558059,7.951450306684748e-05,450,sag,COMPLETE
8067,0.637951741456491,2023-10-02 12:50:36.539582,2023-10-02 12:50:37.102429,0 days 00:00:00.562847,740.6587498684453,490,sag,COMPLETE
8068,0.5,2023-10-02 12:50:37.102429,2023-10-02 12:50:37.623198,0 days 00:00:00.520769,0.0003922214419847212,320,sag,COMPLETE
8069,0.6590785020198712,2023-10-02 12:50:37.625839,2023-10-02 12:50:38.222870,0 days 00:00:00.597031,23227.891940544585,480,sag,COMPLETE
8070,0.6309094879353642,2023-10-02 12:50:38.225171,2023-10-02 12:50:38.602324,0 days 00:00:00.377153,3311.0196944404174,350,liblinear,COMPLETE
8071,0.5,2023-10-02 12:50:38.602324,2023-10-02 12:50:39.104941,0 days 00:00:00.502617,0.001000596830247947,440,sag,COMPLETE
8072,0.6559122174909924,2023-10-02 12:50:39.104941,2023-10-02 12:50:39.685695,0 days 00:00:00.580754,13205.290002207696,500,sag,COMPLETE
8073,0.6520362484987444,2023-10-02 12:50:39.685695,2023-10-02 12:50:40.172223,0 days 00:00:00.486528,2016.5079518052223,410,sag,COMPLETE
8074,0.5,2023-10-02 12:50:40.172223,2023-10-02 12:50:40.689547,0 days 00:00:00.517324,0.0017704220091396287,490,sag,COMPLETE
8075,0.6534556174254831,2023-10-02 12:50:40.689547,2023-10-02 12:50:41.191799,0 days 00:00:00.502252,52.636504472297744,370,sag,COMPLETE
8076,0.6418277104487389,2023-10-02 12:50:41.191799,2023-10-02 12:50:41.678261,0 days 00:00:00.486462,394.6593200661102,460,sag,COMPLETE
8077,0.5478764057211486,2023-10-02 12:50:41.678261,2023-10-02 12:50:42.179856,0 days 00:00:00.501595,0.7360181857360343,360,sag,COMPLETE
8078,0.6502893328966044,2023-10-02 12:50:42.179856,2023-10-02 12:50:42.697588,0 days 00:00:00.517732,33.4258192107268,470,sag,COMPLETE
8079,0.637951741456491,2023-10-02 12:50:42.697588,2023-10-02 12:50:43.199613,0 days 00:00:00.502025,34814.48958233554,390,lbfgs,COMPLETE
8080,0.666120755540998,2023-10-02 12:50:43.199613,2023-10-02 12:50:43.671292,0 days 00:00:00.471679,6872.31220106385,490,sag,COMPLETE
8081,0.6590785020198712,2023-10-02 12:50:43.686812,2023-10-02 12:50:44.255877,0 days 00:00:00.569065,20275.52600310141,450,sag,COMPLETE
8082,0.5,2023-10-02 12:50:44.255877,2023-10-02 12:50:44.764064,0 days 00:00:00.508187,0.005073460947040117,150,sag,COMPLETE
8083,0.6013756960366853,2023-10-02 12:50:44.766063,2023-10-02 12:50:45.157897,0 days 00:00:00.391834,2.2336313905512486,350,sag,COMPLETE
8084,0.5,2023-10-02 12:50:45.157897,2023-10-02 12:50:46.329261,0 days 00:00:01.171364,1.780204626270701e-05,500,sag,COMPLETE
8085,0.6520362484987444,2023-10-02 12:50:46.331714,2023-10-02 12:50:46.917600,0 days 00:00:00.585886,48341.21006638856,380,sag,COMPLETE
8086,0.5,2023-10-02 12:50:46.917600,2023-10-02 12:50:47.357162,0 days 00:00:00.439562,0.00017473993766150804,340,sag,COMPLETE
8087,0.6590785020198712,2023-10-02 12:50:47.357162,2023-10-02 12:50:47.906173,0 days 00:00:00.549011,13821.216199885515,310,sag,COMPLETE
8088,0.5,2023-10-02 12:50:47.921782,2023-10-02 12:50:48.423889,0 days 00:00:00.502107,0.003974036410005817,470,sag,COMPLETE
8089,0.6590785020198712,2023-10-02 12:50:48.439515,2023-10-02 12:50:49.046314,0 days 00:00:00.606799,29371.83199486029,480,sag,COMPLETE
8090,0.6277432034064855,2023-10-02 12:50:49.046314,2023-10-02 12:50:49.459745,0 days 00:00:00.413431,1071.4751509454995,500,newton-cg,COMPLETE
8091,0.6449939949776177,2023-10-02 12:50:49.459745,2023-10-02 12:50:50.024695,0 days 00:00:00.564950,3892.310791866828,490,sag,COMPLETE
8092,0.649579648433235,2023-10-02 12:50:50.024695,2023-10-02 12:50:50.558729,0 days 00:00:00.534034,155.65458908679292,460,sag,COMPLETE
8093,0.6418277104487389,2023-10-02 12:50:50.558729,2023-10-02 12:50:51.044791,0 days 00:00:00.486062,287.53731984438696,370,sag,COMPLETE
8094,0.6590785020198712,2023-10-02 12:50:51.044791,2023-10-02 12:50:51.610033,0 days 00:00:00.565242,62529.103614173946,440,sag,COMPLETE
8095,0.6590785020198712,2023-10-02 12:50:51.610033,2023-10-02 12:50:52.178004,0 days 00:00:00.567971,8357.992907233118,330,sag,COMPLETE
8096,0.637951741456491,2023-10-02 12:50:52.178004,2023-10-02 12:50:52.585985,0 days 00:00:00.407981,41403.01781843214,480,liblinear,COMPLETE
8097,0.6133311496888305,2023-10-02 12:50:52.585985,2023-10-02 12:50:53.088128,0 days 00:00:00.502143,7.101624836872611,360,sag,COMPLETE
8098,0.637951741456491,2023-10-02 12:50:53.088128,2023-10-02 12:50:53.670099,0 days 00:00:00.581971,1666.9707485386925,430,sag,COMPLETE
8099,0.5313352986133857,2023-10-02 12:50:53.685788,2023-10-02 12:50:54.188156,0 days 00:00:00.502368,0.5119948634896095,490,sag,COMPLETE
8100,0.6590785020198712,2023-10-02 12:50:54.188156,2023-10-02 12:50:54.659873,0 days 00:00:00.471717,66685.98909259739,420,sag,COMPLETE
8101,0.6590785020198712,2023-10-02 12:50:54.659873,2023-10-02 12:50:55.239630,0 days 00:00:00.579757,17773.695913668907,500,sag,COMPLETE
8102,0.6101648651599519,2023-10-02 12:50:55.239630,2023-10-02 12:50:55.741670,0 days 00:00:00.502040,5.206747396448753,480,sag,COMPLETE
8103,0.6520362484987444,2023-10-02 12:50:55.741670,2023-10-02 12:50:56.212515,0 days 00:00:00.470845,27601.371749729686,380,sag,COMPLETE
8104,0.637951741456491,2023-10-02 12:50:56.228147,2023-10-02 12:50:56.793184,0 days 00:00:00.565037,5109.086510646624,450,lbfgs,COMPLETE
8105,0.5996287804345454,2023-10-02 12:50:56.793184,2023-10-02 12:50:57.265692,0 days 00:00:00.472508,1.4539101548210955,470,sag,COMPLETE
8106,0.6069985806310733,2023-10-02 12:50:57.279701,2023-10-02 12:50:57.766811,0 days 00:00:00.487110,4.2312437335779896,350,sag,COMPLETE
8107,0.66224478654875,2023-10-02 12:50:57.766811,2023-10-02 12:50:58.238511,0 days 00:00:00.471700,11059.96590995632,400,sag,COMPLETE
8108,0.6590785020198712,2023-10-02 12:50:58.238511,2023-10-02 12:50:58.819532,0 days 00:00:00.581021,45774.65692039994,500,sag,COMPLETE
8109,0.6590785020198712,2023-10-02 12:50:58.819532,2023-10-02 12:50:59.400999,0 days 00:00:00.581467,2684.4652508525755,460,sag,COMPLETE
8110,0.5,2023-10-02 12:50:59.416872,2023-10-02 12:50:59.840200,0 days 00:00:00.423328,0.0034945516720912093,490,sag,COMPLETE
8111,0.6520362484987444,2023-10-02 12:50:59.840200,2023-10-02 12:51:00.389972,0 days 00:00:00.549772,18861.267827583826,340,sag,COMPLETE
8112,0.6590785020198712,2023-10-02 12:51:00.389972,2023-10-02 12:51:00.955014,0 days 00:00:00.565042,65851.32798775454,360,sag,COMPLETE
8113,0.6449939949776177,2023-10-02 12:51:00.970861,2023-10-02 12:51:01.441807,0 days 00:00:00.470946,6700.986105565985,370,sag,COMPLETE
8114,0.666120755540998,2023-10-02 12:51:01.441807,2023-10-02 12:51:02.022447,0 days 00:00:00.580640,30774.272192144363,490,sag,COMPLETE
8115,0.5,2023-10-02 12:51:02.022447,2023-10-02 12:51:02.892640,0 days 00:00:00.870193,3.830812278852815e-05,480,sag,COMPLETE
8116,0.5,2023-10-02 12:51:02.892640,2023-10-02 12:51:03.397386,0 days 00:00:00.504746,0.022587255030767014,440,sag,COMPLETE
8117,0.6590785020198712,2023-10-02 12:51:03.400388,2023-10-02 12:51:03.937071,0 days 00:00:00.536683,11198.25960376738,470,sag,COMPLETE
8118,0.6449939949776177,2023-10-02 12:51:03.952698,2023-10-02 12:51:04.493852,0 days 00:00:00.541154,70639.55726883687,390,newton-cg,COMPLETE
8119,0.5,2023-10-02 12:51:04.495852,2023-10-02 12:51:04.993029,0 days 00:00:00.497177,5.540367297305292e-05,500,liblinear,COMPLETE
8120,0.666120755540998,2023-10-02 12:51:04.995940,2023-10-02 12:51:05.459686,0 days 00:00:00.463746,4109.95518428947,350,sag,COMPLETE
8121,0.5,2023-10-02 12:51:05.462686,2023-10-02 12:51:07.048629,0 days 00:00:01.585943,1.3476725013900776e-05,490,sag,COMPLETE
8122,0.5,2023-10-02 12:51:07.051620,2023-10-02 12:51:07.605501,0 days 00:00:00.553881,0.0005772995039914319,450,sag,COMPLETE
8123,0.6552025330276231,2023-10-02 12:51:07.607494,2023-10-02 12:51:08.077736,0 days 00:00:00.470242,39013.12468220031,340,sag,COMPLETE
8124,0.5,2023-10-02 12:51:08.080731,2023-10-02 12:51:08.579670,0 days 00:00:00.498939,0.06416883924862896,330,sag,COMPLETE
8125,0.6298722567965934,2023-10-02 12:51:08.581673,2023-10-02 12:51:09.086930,0 days 00:00:00.505257,18.637989658525473,470,sag,COMPLETE
8126,0.6590785020198712,2023-10-02 12:51:09.088883,2023-10-02 12:51:09.685262,0 days 00:00:00.596379,20820.8338741584,480,sag,COMPLETE
8127,0.5,2023-10-02 12:51:09.688715,2023-10-02 12:51:10.124338,0 days 00:00:00.435623,0.0074392637170373034,460,sag,COMPLETE
8128,0.5,2023-10-02 12:51:10.124338,2023-10-02 12:51:10.626435,0 days 00:00:00.502097,0.13325320848498645,370,lbfgs,COMPLETE
8129,0.6590785020198712,2023-10-02 12:51:10.626435,2023-10-02 12:51:11.201658,0 days 00:00:00.575223,7740.236792805271,480,sag,COMPLETE
8130,0.6629544710121192,2023-10-02 12:51:11.201658,2023-10-02 12:51:11.719698,0 days 00:00:00.518040,13435.48971071954,500,sag,COMPLETE
8131,0.6298722567965934,2023-10-02 12:51:11.719698,2023-10-02 12:51:12.207645,0 days 00:00:00.487947,15.88447852643542,360,sag,COMPLETE
8132,0.637951741456491,2023-10-02 12:51:12.207645,2023-10-02 12:51:12.791119,0 days 00:00:00.583474,805.5767323865582,490,sag,COMPLETE
8133,0.6590785020198712,2023-10-02 12:51:12.791119,2023-10-02 12:51:13.369181,0 days 00:00:00.578062,30362.380042574725,410,sag,COMPLETE
