number,value,datetime_start,datetime_complete,duration,params_C,params_max_iter,params_solver,state
6993,0.6520362484987444,2023-10-02 12:41:37.894543,2023-10-02 12:41:38.338815,0 days 00:00:00.444272,2027.2589488339386,470,sag,COMPLETE
6994,0.5619609127634021,2023-10-02 12:41:38.340815,2023-10-02 12:41:38.770865,0 days 00:00:00.430050,0.8391257762323403,470,sag,COMPLETE
6995,0.6559122174909924,2023-10-02 12:41:38.770865,2023-10-02 12:41:39.199539,0 days 00:00:00.428674,24024.488851710583,400,sag,COMPLETE
6996,0.6520362484987444,2023-10-02 12:41:39.202539,2023-10-02 12:41:39.728812,0 days 00:00:00.526273,3131.741189714056,460,sag,COMPLETE
6997,0.6077082650944426,2023-10-02 12:41:39.730812,2023-10-02 12:41:40.153703,0 days 00:00:00.422891,3.602380925502937,450,newton-cg,COMPLETE
6998,0.6411180259853696,2023-10-02 12:41:40.169327,2023-10-02 12:41:40.610503,0 days 00:00:00.441176,42244.577378578375,370,sag,COMPLETE
6999,0.643956763838847,2023-10-02 12:41:40.612819,2023-10-02 12:41:41.055967,0 days 00:00:00.443148,27.404403125008482,380,sag,COMPLETE
7000,0.5345015831422644,2023-10-02 12:41:41.055967,2023-10-02 12:41:41.389552,0 days 00:00:00.333585,0.550063491788572,320,liblinear,COMPLETE
7001,0.6590785020198712,2023-10-02 12:41:41.405177,2023-10-02 12:41:41.891815,0 days 00:00:00.486638,15775.87820371023,340,sag,COMPLETE
7002,0.6449939949776177,2023-10-02 12:41:41.891815,2023-10-02 12:41:42.397409,0 days 00:00:00.505594,6855.895513201818,310,sag,COMPLETE
7003,0.6559122174909924,2023-10-02 12:41:42.399409,2023-10-02 12:41:42.841033,0 days 00:00:00.441624,65917.0298478814,470,sag,COMPLETE
7004,0.5,2023-10-02 12:41:42.841033,2023-10-02 12:41:43.286854,0 days 00:00:00.445821,0.04795205948354302,440,sag,COMPLETE
7005,0.5,2023-10-02 12:41:43.286854,2023-10-02 12:41:43.632325,0 days 00:00:00.345471,0.013939247754022388,420,sag,COMPLETE
7006,0.6520362484987444,2023-10-02 12:41:43.632325,2023-10-02 12:41:44.136230,0 days 00:00:00.503905,3889.649059454858,360,sag,COMPLETE
7007,0.6449939949776177,2023-10-02 12:41:44.136230,2023-10-02 12:41:44.626211,0 days 00:00:00.489981,953.8907701521395,390,sag,COMPLETE
7008,0.6629544710121192,2023-10-02 12:41:44.641859,2023-10-02 12:41:45.058482,0 days 00:00:00.416623,33476.37638678578,350,sag,COMPLETE
7009,0.5,2023-10-02 12:41:45.060817,2023-10-02 12:41:45.478028,0 days 00:00:00.417211,0.10802832739012332,340,sag,COMPLETE
7010,0.6534556174254831,2023-10-02 12:41:45.478028,2023-10-02 12:41:45.952246,0 days 00:00:00.474218,47.73360031083891,460,lbfgs,COMPLETE
7011,0.6449939949776177,2023-10-02 12:41:45.952246,2023-10-02 12:41:46.405906,0 days 00:00:00.453660,11278.918414302669,470,sag,COMPLETE
7012,0.6481602795064964,2023-10-02 12:41:46.407913,2023-10-02 12:41:46.895814,0 days 00:00:00.487901,20923.268586556504,370,sag,COMPLETE
7013,0.6337482257888415,2023-10-02 12:41:46.895814,2023-10-02 12:41:47.318744,0 days 00:00:00.422930,15.207842231139004,450,sag,COMPLETE
7014,0.6481602795064964,2023-10-02 12:41:47.323258,2023-10-02 12:41:47.804994,0 days 00:00:00.481736,47944.593547336764,350,sag,COMPLETE
7015,0.6520362484987444,2023-10-02 12:41:47.804994,2023-10-02 12:41:48.339610,0 days 00:00:00.534616,1674.54091334997,470,sag,COMPLETE
7016,0.649579648433235,2023-10-02 12:41:48.339610,2023-10-02 12:41:48.735854,0 days 00:00:00.396244,140.21441816334246,460,sag,COMPLETE
7017,0.6488699639698657,2023-10-02 12:41:48.738844,2023-10-02 12:41:49.246574,0 days 00:00:00.507730,69195.4164711807,440,sag,COMPLETE
7018,0.6101648651599519,2023-10-02 12:41:49.246574,2023-10-02 12:41:49.629760,0 days 00:00:00.383186,5.415703712654137,330,sag,COMPLETE
7019,0.6418277104487389,2023-10-02 12:41:49.629760,2023-10-02 12:41:50.172165,0 days 00:00:00.542405,6951.520616985867,360,sag,COMPLETE
7020,0.6552025330276231,2023-10-02 12:41:50.172165,2023-10-02 12:41:50.684073,0 days 00:00:00.511908,98145.36911868856,340,sag,COMPLETE
7021,0.666120755540998,2023-10-02 12:41:50.686077,2023-10-02 12:41:51.105284,0 days 00:00:00.419207,29092.848556186833,380,sag,COMPLETE
7022,0.5,2023-10-02 12:41:51.105284,2023-10-02 12:41:51.552266,0 days 00:00:00.446982,0.00016582536006180113,460,newton-cg,COMPLETE
7023,0.6590785020198712,2023-10-02 12:41:51.555261,2023-10-02 12:41:51.956298,0 days 00:00:00.401037,4409.830544786482,370,sag,COMPLETE
7024,0.6520362484987444,2023-10-02 12:41:51.956298,2023-10-02 12:41:52.474558,0 days 00:00:00.518260,12048.916598993894,470,sag,COMPLETE
7025,0.637951741456491,2023-10-02 12:41:52.474558,2023-10-02 12:41:52.929969,0 days 00:00:00.455411,44813.446495442004,430,liblinear,COMPLETE
7026,0.6590785020198712,2023-10-02 12:41:52.933481,2023-10-02 12:41:53.337995,0 days 00:00:00.404514,16452.07430551536,360,sag,COMPLETE
7027,0.5,2023-10-02 12:41:53.340990,2023-10-02 12:41:53.787214,0 days 00:00:00.446224,0.005447971318291231,450,sag,COMPLETE
7028,0.5,2023-10-02 12:41:53.787214,2023-10-02 12:41:54.135229,0 days 00:00:00.348015,0.0013040921839556866,440,sag,COMPLETE
7029,0.6481602795064964,2023-10-02 12:41:54.135229,2023-10-02 12:41:54.641381,0 days 00:00:00.506152,2763.357752677036,350,sag,COMPLETE
7030,0.6267059722677149,2023-10-02 12:41:54.641381,2023-10-02 12:41:55.096203,0 days 00:00:00.454822,11.388911548092091,320,sag,COMPLETE
7031,0.6590785020198712,2023-10-02 12:41:55.096203,2023-10-02 12:41:55.509864,0 days 00:00:00.413661,7508.400148339983,390,sag,COMPLETE
7032,0.5,2023-10-02 12:41:55.509864,2023-10-02 12:41:55.949647,0 days 00:00:00.439783,0.004921941461727637,500,sag,COMPLETE
7033,0.6457036794409869,2023-10-02 12:41:55.949647,2023-10-02 12:41:56.420183,0 days 00:00:00.470536,236.1830967411062,470,sag,COMPLETE
7034,0.6590785020198712,2023-10-02 12:41:56.420183,2023-10-02 12:41:56.874975,0 days 00:00:00.454792,23784.300543231973,410,sag,COMPLETE
7035,0.5,2023-10-02 12:41:56.874975,2023-10-02 12:41:57.314226,0 days 00:00:00.439251,0.0005454340896189512,360,lbfgs,COMPLETE
7036,0.6520362484987444,2023-10-02 12:41:57.314226,2023-10-02 12:41:57.742291,0 days 00:00:00.428065,98666.65586531378,370,sag,COMPLETE
7037,0.6309094879353642,2023-10-02 12:41:57.742291,2023-10-02 12:41:58.224262,0 days 00:00:00.481971,623.4526422406432,330,sag,COMPLETE
7038,0.6520362484987444,2023-10-02 12:41:58.224262,2023-10-02 12:41:58.744815,0 days 00:00:00.520553,99162.95318183572,450,sag,COMPLETE
7039,0.528169014084507,2023-10-02 12:41:58.757829,2023-10-02 12:41:59.102866,0 days 00:00:00.345037,0.38158131582771626,340,sag,COMPLETE
7040,0.5,2023-10-02 12:41:59.102866,2023-10-02 12:41:59.558064,0 days 00:00:00.455198,0.000613546087094692,480,sag,COMPLETE
7041,0.6590785020198712,2023-10-02 12:41:59.558064,2023-10-02 12:42:00.012892,0 days 00:00:00.454828,35745.60468749567,470,sag,COMPLETE
7042,0.6559122174909924,2023-10-02 12:42:00.028536,2023-10-02 12:42:00.530148,0 days 00:00:00.501612,10711.866306130622,420,sag,COMPLETE
7043,0.5,2023-10-02 12:42:00.530148,2023-10-02 12:42:00.954614,0 days 00:00:00.424466,0.07211167979097168,500,sag,COMPLETE
7044,0.66224478654875,2023-10-02 12:42:00.970269,2023-10-02 12:42:01.362564,0 days 00:00:00.392295,51197.56660382255,350,sag,COMPLETE
7045,0.637951741456491,2023-10-02 12:42:01.378204,2023-10-02 12:42:01.895944,0 days 00:00:00.517740,4386.639710588882,480,sag,COMPLETE
7046,0.5,2023-10-02 12:42:01.911582,2023-10-02 12:42:02.350915,0 days 00:00:00.439333,0.011119072179411594,460,sag,COMPLETE
7047,0.6534556174254831,2023-10-02 12:42:02.352933,2023-10-02 12:42:02.728052,0 days 00:00:00.375119,55.18296614680579,380,sag,COMPLETE
7048,0.5,2023-10-02 12:42:02.728052,2023-10-02 12:42:03.154655,0 days 00:00:00.426603,0.020554321191844808,500,sag,COMPLETE
7049,0.608417949557812,2023-10-02 12:42:03.167675,2023-10-02 12:42:03.513115,0 days 00:00:00.345440,2.7979354750271703,440,newton-cg,COMPLETE
7050,0.637951741456491,2023-10-02 12:42:03.513115,2023-10-02 12:42:03.936679,0 days 00:00:00.423564,19453.690058728564,480,liblinear,COMPLETE
7051,0.5,2023-10-02 12:42:03.936679,2023-10-02 12:42:04.500592,0 days 00:00:00.563913,0.00011839073428889696,370,sag,COMPLETE
7052,0.6590785020198712,2023-10-02 12:42:04.503186,2023-10-02 12:42:04.990468,0 days 00:00:00.487282,31794.0998738359,450,sag,COMPLETE
7053,0.6559122174909924,2023-10-02 12:42:04.990468,2023-10-02 12:42:05.459234,0 days 00:00:00.468766,1716.9266439094529,120,sag,COMPLETE
7054,0.5,2023-10-02 12:42:05.459234,2023-10-02 12:42:05.820001,0 days 00:00:00.360767,0.003688039559212215,470,sag,COMPLETE
7055,0.6590785020198712,2023-10-02 12:42:05.837067,2023-10-02 12:42:06.347707,0 days 00:00:00.510640,6554.461363518631,360,sag,COMPLETE
7056,0.6541653018888526,2023-10-02 12:42:06.349705,2023-10-02 12:42:06.796570,0 days 00:00:00.446865,29.700980263762737,400,sag,COMPLETE
7057,0.6449939949776177,2023-10-02 12:42:06.796570,2023-10-02 12:42:07.234365,0 days 00:00:00.437795,60910.013624349245,490,sag,COMPLETE
7058,0.6552025330276231,2023-10-02 12:42:07.234365,2023-10-02 12:42:07.743830,0 days 00:00:00.509465,15005.276954866738,330,sag,COMPLETE
7059,0.6590785020198712,2023-10-02 12:42:07.743830,2023-10-02 12:42:08.162871,0 days 00:00:00.419041,65061.4125520608,500,sag,COMPLETE
7060,0.6449939949776177,2023-10-02 12:42:08.178541,2023-10-02 12:42:08.680941,0 days 00:00:00.502400,1264.9498594895956,460,sag,COMPLETE
7061,0.637951741456491,2023-10-02 12:42:08.680941,2023-10-02 12:42:09.151819,0 days 00:00:00.470878,8646.24226668764,430,lbfgs,COMPLETE
7062,0.5,2023-10-02 12:42:09.151819,2023-10-02 12:42:09.496773,0 days 00:00:00.344954,0.1565843676903979,290,sag,COMPLETE
7063,0.6590785020198712,2023-10-02 12:42:09.496773,2023-10-02 12:42:09.999529,0 days 00:00:00.502756,23750.02538709316,350,sag,COMPLETE
7064,0.666120755540998,2023-10-02 12:42:09.999529,2023-10-02 12:42:10.487007,0 days 00:00:00.487478,2977.3067125311,340,sag,COMPLETE
7065,0.6590785020198712,2023-10-02 12:42:10.487007,2023-10-02 12:42:10.910771,0 days 00:00:00.423764,39536.99752724572,490,sag,COMPLETE
7066,0.5,2023-10-02 12:42:10.910771,2023-10-02 12:42:11.695775,0 days 00:00:00.785004,3.594778409356746e-05,480,sag,COMPLETE
7067,0.6457036794409869,2023-10-02 12:42:11.695775,2023-10-02 12:42:12.087619,0 days 00:00:00.391844,227.3160995523572,310,sag,COMPLETE
7068,0.5,2023-10-02 12:42:12.087619,2023-10-02 12:42:13.018312,0 days 00:00:00.930693,2.7801486167873266e-05,500,sag,COMPLETE
7069,0.6027950649634239,2023-10-02 12:42:13.018312,2023-10-02 12:42:13.443848,0 days 00:00:00.425536,1.568866862192606,470,sag,COMPLETE
7070,0.666120755540998,2023-10-02 12:42:13.443848,2023-10-02 12:42:13.865774,0 days 00:00:00.421926,5569.344943391583,360,sag,COMPLETE
7071,0.6449939949776177,2023-10-02 12:42:13.867774,2023-10-02 12:42:14.312256,0 days 00:00:00.444482,99521.8946943078,390,newton-cg,COMPLETE
7072,0.5,2023-10-02 12:42:14.312256,2023-10-02 12:42:14.813692,0 days 00:00:00.501436,8.617096979498092e-05,370,sag,COMPLETE
7073,0.666120755540998,2023-10-02 12:42:14.815692,2023-10-02 12:42:15.387525,0 days 00:00:00.571833,11954.435330346889,490,sag,COMPLETE
7074,0.5478764057211486,2023-10-02 12:42:15.390520,2023-10-02 12:42:15.824730,0 days 00:00:00.434210,0.7651234736647725,460,sag,COMPLETE
7075,0.6020853805000546,2023-10-02 12:42:15.824730,2023-10-02 12:42:16.178744,0 days 00:00:00.354014,1.8041936887614187,480,sag,COMPLETE
7076,0.6418277104487389,2023-10-02 12:42:16.178744,2023-10-02 12:42:16.679743,0 days 00:00:00.500999,376.30018688170543,500,sag,COMPLETE
7077,0.637951741456491,2023-10-02 12:42:16.688259,2023-10-02 12:42:17.033298,0 days 00:00:00.345039,24893.611380173115,450,liblinear,COMPLETE
7078,0.6108745496233213,2023-10-02 12:42:17.033298,2023-10-02 12:42:17.456919,0 days 00:00:00.423621,4.149350737096491,350,sag,COMPLETE
7079,0.5,2023-10-02 12:42:17.456919,2023-10-02 12:42:17.912199,0 days 00:00:00.455280,0.010754318982763725,440,sag,COMPLETE
7080,0.6590785020198712,2023-10-02 12:42:17.912199,2023-10-02 12:42:18.351808,0 days 00:00:00.439609,56583.06434882946,470,sag,COMPLETE
7081,0.5,2023-10-02 12:42:18.351808,2023-10-02 12:42:18.784473,0 days 00:00:00.432665,0.19014330642805458,490,sag,COMPLETE
7082,0.5,2023-10-02 12:42:18.790982,2023-10-02 12:42:19.214177,0 days 00:00:00.423195,0.052749589606601886,370,sag,COMPLETE
7083,0.666120755540998,2023-10-02 12:42:19.229807,2023-10-02 12:42:19.637745,0 days 00:00:00.407938,34418.36853087733,380,sag,COMPLETE
7084,0.5,2023-10-02 12:42:19.637745,2023-10-02 12:42:20.093000,0 days 00:00:00.455255,0.0005052321102429619,500,sag,COMPLETE
7085,0.6590785020198712,2023-10-02 12:42:20.093000,2023-10-02 12:42:20.547883,0 days 00:00:00.454883,17885.660643403935,490,sag,COMPLETE
7086,0.637951741456491,2023-10-02 12:42:20.547883,2023-10-02 12:42:21.033850,0 days 00:00:00.485967,9242.278571985838,340,lbfgs,COMPLETE
7087,0.5855442733922918,2023-10-02 12:42:21.033850,2023-10-02 12:42:21.473103,0 days 00:00:00.439253,1.3157369222653914,480,sag,COMPLETE
7088,0.5690031662845288,2023-10-02 12:42:21.473103,2023-10-02 12:42:21.818974,0 days 00:00:00.345871,1.0400008278371495,320,sag,COMPLETE
7089,0.6559122174909924,2023-10-02 12:42:21.818974,2023-10-02 12:42:22.336771,0 days 00:00:00.517797,820.2562472609552,360,sag,COMPLETE
7090,0.5,2023-10-02 12:42:22.336771,2023-10-02 12:42:22.693374,0 days 00:00:00.356603,0.006606752587173497,430,sag,COMPLETE
7091,0.6449939949776177,2023-10-02 12:42:22.697887,2023-10-02 12:42:23.216074,0 days 00:00:00.518187,4121.970490268147,450,sag,COMPLETE
7092,0.6590785020198712,2023-10-02 12:42:23.216074,2023-10-02 12:42:23.702552,0 days 00:00:00.486478,2275.195703574555,330,sag,COMPLETE
7093,0.666120755540998,2023-10-02 12:42:23.702552,2023-10-02 12:42:24.141768,0 days 00:00:00.439216,46348.143640090784,460,sag,COMPLETE
7094,0.5,2023-10-02 12:42:24.141768,2023-10-02 12:42:24.565399,0 days 00:00:00.423631,0.02117171099253478,470,sag,COMPLETE
7095,0.6590785020198712,2023-10-02 12:42:24.565399,2023-10-02 12:42:25.005115,0 days 00:00:00.439716,67322.05754214243,490,sag,COMPLETE
7096,0.637951741456491,2023-10-02 12:42:25.020762,2023-10-02 12:42:25.470244,0 days 00:00:00.449482,15283.759112536645,480,newton-cg,COMPLETE
7097,0.6418277104487389,2023-10-02 12:42:25.472240,2023-10-02 12:42:25.999844,0 days 00:00:00.527604,475.7324505439848,500,sag,COMPLETE
7098,0.5,2023-10-02 12:42:25.999844,2023-10-02 12:42:26.372547,0 days 00:00:00.372703,0.0025982345850139995,440,sag,COMPLETE
7099,0.6520362484987444,2023-10-02 12:42:26.372547,2023-10-02 12:42:26.882935,0 days 00:00:00.510388,28591.42872294282,380,sag,COMPLETE
7100,0.6590785020198712,2023-10-02 12:42:26.882935,2023-10-02 12:42:27.369427,0 days 00:00:00.486492,6184.665135042361,340,sag,COMPLETE
7101,0.5,2023-10-02 12:42:27.385065,2023-10-02 12:42:27.730516,0 days 00:00:00.345451,5.8856799077510765e-05,360,liblinear,COMPLETE
7102,0.6298722567965934,2023-10-02 12:42:27.730516,2023-10-02 12:42:28.210099,0 days 00:00:00.479583,17.76000622113399,490,sag,COMPLETE
7103,0.6449939949776177,2023-10-02 12:42:28.214096,2023-10-02 12:42:28.676166,0 days 00:00:00.462070,46230.03471841542,370,sag,COMPLETE
7104,0.6520362484987444,2023-10-02 12:42:28.676166,2023-10-02 12:42:29.193989,0 days 00:00:00.517823,11917.929278584621,480,sag,COMPLETE
7105,0.5,2023-10-02 12:42:29.193989,2023-10-02 12:42:30.258102,0 days 00:00:01.064113,1.958103790157194e-05,500,sag,COMPLETE
7106,0.5,2023-10-02 12:42:30.258102,2023-10-02 12:42:30.649848,0 days 00:00:00.391746,0.0009129128029944549,460,sag,COMPLETE
7107,0.6534556174254831,2023-10-02 12:42:30.651848,2023-10-02 12:42:31.118781,0 days 00:00:00.466933,90.60387753500731,350,sag,COMPLETE
7108,0.6520362484987444,2023-10-02 12:42:31.118781,2023-10-02 12:42:31.565936,0 days 00:00:00.447155,21226.996870657735,490,sag,COMPLETE
7109,0.637951741456491,2023-10-02 12:42:31.565936,2023-10-02 12:42:32.036505,0 days 00:00:00.470569,69724.94588129836,470,lbfgs,COMPLETE
7110,0.5,2023-10-02 12:42:32.036505,2023-10-02 12:42:32.512032,0 days 00:00:00.475527,0.0002917611749872514,350,sag,COMPLETE
7111,0.6573315864177312,2023-10-02 12:42:32.512032,2023-10-02 12:42:32.875449,0 days 00:00:00.363417,40.18020039215434,390,sag,COMPLETE
7112,0.6520362484987444,2023-10-02 12:42:32.875449,2023-10-02 12:42:33.391244,0 days 00:00:00.515795,2629.8402702089556,450,sag,COMPLETE
7113,0.66224478654875,2023-10-02 12:42:33.393248,2023-10-02 12:42:33.905362,0 days 00:00:00.512114,33882.08059424722,420,sag,COMPLETE
7114,0.6520362484987444,2023-10-02 12:42:33.905362,2023-10-02 12:42:34.343941,0 days 00:00:00.438579,9377.68840542999,500,sag,COMPLETE
7115,0.5,2023-10-02 12:42:34.359386,2023-10-02 12:42:34.784150,0 days 00:00:00.424764,0.08625536837590088,470,sag,COMPLETE
7116,0.5,2023-10-02 12:42:34.784150,2023-10-02 12:42:35.129297,0 days 00:00:00.345147,0.030707101351406054,480,sag,COMPLETE
7117,0.6449939949776177,2023-10-02 12:42:35.129297,2023-10-02 12:42:35.616410,0 days 00:00:00.487113,4512.412541000314,340,sag,COMPLETE
7118,0.6520362484987444,2023-10-02 12:42:35.632087,2023-10-02 12:42:36.119094,0 days 00:00:00.487007,19637.330109415205,360,sag,COMPLETE
7119,0.6520362484987444,2023-10-02 12:42:36.119094,2023-10-02 12:42:36.543378,0 days 00:00:00.424284,1108.967612608936,480,sag,COMPLETE
7120,0.666120755540998,2023-10-02 12:42:36.559015,2023-10-02 12:42:37.062562,0 days 00:00:00.503547,67498.07109592788,490,sag,COMPLETE
7121,0.637951741456491,2023-10-02 12:42:37.062562,2023-10-02 12:42:37.424429,0 days 00:00:00.361867,32139.066602908777,460,newton-cg,COMPLETE
7122,0.6457036794409869,2023-10-02 12:42:37.424429,2023-10-02 12:42:37.895186,0 days 00:00:00.470757,210.67699816482968,500,sag,COMPLETE
7123,0.6629544710121192,2023-10-02 12:42:37.910823,2023-10-02 12:42:38.397712,0 days 00:00:00.486889,7350.905900991819,380,sag,COMPLETE
7124,0.6590785020198712,2023-10-02 12:42:38.397712,2023-10-02 12:42:38.806005,0 days 00:00:00.408293,98868.85149538906,440,sag,COMPLETE
7125,0.6449939949776177,2023-10-02 12:42:38.821257,2023-10-02 12:42:39.350618,0 days 00:00:00.529361,49487.566993784654,490,sag,COMPLETE
7126,0.5,2023-10-02 12:42:39.352618,2023-10-02 12:42:39.733649,0 days 00:00:00.381031,0.0019536799144758733,350,sag,COMPLETE
7127,0.5313352986133857,2023-10-02 12:42:39.735820,2023-10-02 12:42:40.180322,0 days 00:00:00.444502,0.5000189993581559,370,liblinear,COMPLETE
7128,0.6552025330276231,2023-10-02 12:42:40.180322,2023-10-02 12:42:40.668144,0 days 00:00:00.487822,14426.478470302289,330,sag,COMPLETE
7129,0.6590785020198712,2023-10-02 12:42:40.683999,2023-10-02 12:42:41.095850,0 days 00:00:00.411851,3875.837763659569,430,sag,COMPLETE
7130,0.528169014084507,2023-10-02 12:42:41.095850,2023-10-02 12:42:41.524510,0 days 00:00:00.428660,0.3787490976109706,480,sag,COMPLETE
7131,0.6534556174254831,2023-10-02 12:42:41.524510,2023-10-02 12:42:41.991677,0 days 00:00:00.467167,63.39335327280101,500,sag,COMPLETE
7132,0.6449939949776177,2023-10-02 12:42:41.993678,2023-10-02 12:42:42.399546,0 days 00:00:00.405868,1800.40039335215,400,sag,COMPLETE
7133,0.6590785020198712,2023-10-02 12:42:42.399546,2023-10-02 12:42:42.948258,0 days 00:00:00.548712,24584.96419210184,450,sag,COMPLETE
7134,0.5,2023-10-02 12:42:42.950964,2023-10-02 12:42:43.313445,0 days 00:00:00.362481,0.0001960050701014841,470,lbfgs,COMPLETE
7135,0.6520362484987444,2023-10-02 12:42:43.313445,2023-10-02 12:42:43.838480,0 days 00:00:00.525035,45419.464865208145,490,sag,COMPLETE
7136,0.649579648433235,2023-10-02 12:42:43.838480,2023-10-02 12:42:44.353970,0 days 00:00:00.515490,128.83539605973937,360,sag,COMPLETE
7137,0.5,2023-10-02 12:42:44.355969,2023-10-02 12:42:44.943385,0 days 00:00:00.587416,4.9133197815426845e-05,460,sag,COMPLETE
7138,0.5,2023-10-02 12:42:44.945385,2023-10-02 12:42:45.385806,0 days 00:00:00.440421,0.03955448795455502,370,sag,COMPLETE
7139,0.6590785020198712,2023-10-02 12:42:45.387817,2023-10-02 12:42:45.830887,0 days 00:00:00.443070,9309.720371300686,500,sag,COMPLETE
7140,0.5,2023-10-02 12:42:45.832882,2023-10-02 12:42:46.289154,0 days 00:00:00.456272,0.01376433126949982,480,sag,COMPLETE
7141,0.6597881864832406,2023-10-02 12:42:46.291153,2023-10-02 12:42:46.778105,0 days 00:00:00.486952,5916.591231735993,300,sag,COMPLETE
7142,0.6590785020198712,2023-10-02 12:42:46.780103,2023-10-02 12:42:47.195415,0 days 00:00:00.415312,67270.90816307967,340,sag,COMPLETE
7143,0.6590785020198712,2023-10-02 12:42:47.197410,2023-10-02 12:42:47.727875,0 days 00:00:00.530465,14677.132663125716,490,sag,COMPLETE
7144,0.6449939949776177,2023-10-02 12:42:47.730385,2023-10-02 12:42:48.164865,0 days 00:00:00.434480,33114.08220428209,470,sag,COMPLETE
7145,0.6449939949776177,2023-10-02 12:42:48.166860,2023-10-02 12:42:48.666809,0 days 00:00:00.499949,3061.09668121711,380,sag,COMPLETE
7146,0.6534556174254831,2023-10-02 12:42:48.669880,2023-10-02 12:42:49.116903,0 days 00:00:00.447023,97.14123723405714,410,newton-cg,COMPLETE
7147,0.6520362484987444,2023-10-02 12:42:49.119991,2023-10-02 12:42:49.546911,0 days 00:00:00.426920,20906.448085321055,450,sag,COMPLETE
7148,0.6552025330276231,2023-10-02 12:42:49.548907,2023-10-02 12:42:50.079182,0 days 00:00:00.530275,64393.42366895672,440,sag,COMPLETE
7149,0.5,2023-10-02 12:42:50.079182,2023-10-02 12:42:50.518357,0 days 00:00:00.439175,0.0008494106409562515,500,liblinear,COMPLETE
7150,0.6541653018888526,2023-10-02 12:42:50.518357,2023-10-02 12:42:50.863777,0 days 00:00:00.345420,28.936494879633134,350,sag,COMPLETE
7151,0.6590785020198712,2023-10-02 12:42:50.879402,2023-10-02 12:42:51.382907,0 days 00:00:00.503505,10187.517383856824,320,sag,COMPLETE
7152,0.6133311496888305,2023-10-02 12:42:51.384907,2023-10-02 12:42:51.746542,0 days 00:00:00.361635,7.252233295933905,480,sag,COMPLETE
7153,0.6520362484987444,2023-10-02 12:42:51.748545,2023-10-02 12:42:52.248508,0 days 00:00:00.499963,43495.76374180598,360,sag,COMPLETE
7154,0.6590785020198712,2023-10-02 12:42:52.250555,2023-10-02 12:42:52.845026,0 days 00:00:00.594471,99568.57322138354,490,sag,COMPLETE
7155,0.637951741456491,2023-10-02 12:42:52.845026,2023-10-02 12:42:53.268793,0 days 00:00:00.423767,823.4100523908734,460,sag,COMPLETE
