number,value,datetime_start,datetime_complete,duration,params_C,params_max_iter,params_solver,state
1618,0.666120755540998,2023-10-02 12:13:40.419755,2023-10-02 12:13:40.593703,0 days 00:00:00.173948,8969.004672024497,500,sag,COMPLETE
1619,0.6520362484987444,2023-10-02 12:13:40.594702,2023-10-02 12:13:40.766962,0 days 00:00:00.172260,28772.467201657637,500,sag,COMPLETE
1620,0.6267059722677149,2023-10-02 12:13:40.767961,2023-10-02 12:13:40.857346,0 days 00:00:00.089385,10.173878185568958,490,sag,COMPLETE
1621,0.6457036794409869,2023-10-02 12:13:40.857346,2023-10-02 12:13:41.001894,0 days 00:00:00.144548,255.42015270355165,470,sag,COMPLETE
1622,0.6449939949776177,2023-10-02 12:13:41.001894,2023-10-02 12:13:41.176955,0 days 00:00:00.175061,911.5078680691827,480,sag,COMPLETE
1623,0.6449939949776177,2023-10-02 12:13:41.178043,2023-10-02 12:13:41.348720,0 days 00:00:00.170677,5190.027111757132,490,sag,COMPLETE
1624,0.6590785020198712,2023-10-02 12:13:41.349724,2023-10-02 12:13:41.520847,0 days 00:00:00.171123,12783.3097692366,500,sag,COMPLETE
1625,0.5,2023-10-02 12:13:41.521851,2023-10-02 12:13:41.613864,0 days 00:00:00.092013,0.013140112233523266,480,sag,COMPLETE
1626,0.6449939949776177,2023-10-02 12:13:41.614864,2023-10-02 12:13:41.796723,0 days 00:00:00.181859,1677.2357277759381,490,sag,COMPLETE
1627,0.5,2023-10-02 12:13:41.797721,2023-10-02 12:13:41.892602,0 days 00:00:00.094881,0.005007162553062224,500,sag,COMPLETE
1628,0.5,2023-10-02 12:13:41.893602,2023-10-02 12:13:41.981263,0 days 00:00:00.087661,0.022177324088169893,480,sag,COMPLETE
1629,0.6520362484987444,2023-10-02 12:13:41.982263,2023-10-02 12:13:42.157434,0 days 00:00:00.175171,3321.9052532814458,490,sag,COMPLETE
1630,0.6520362484987444,2023-10-02 12:13:42.157434,2023-10-02 12:13:42.330613,0 days 00:00:00.173179,8425.283233891898,470,sag,COMPLETE
1631,0.666120755540998,2023-10-02 12:13:42.330613,2023-10-02 12:13:42.522683,0 days 00:00:00.192070,19808.572917994803,500,sag,COMPLETE
1632,0.6449939949776177,2023-10-02 12:13:42.523682,2023-10-02 12:13:42.776820,0 days 00:00:00.253138,4985.616600934846,480,sag,COMPLETE
1633,0.637951741456491,2023-10-02 12:13:42.776820,2023-10-02 12:13:42.877835,0 days 00:00:00.101015,33264.58538058154,490,newton-cg,COMPLETE
1634,0.637951741456491,2023-10-02 12:13:42.878951,2023-10-02 12:13:42.984584,0 days 00:00:00.105633,11613.883049849064,500,liblinear,COMPLETE
1635,0.6520362484987444,2023-10-02 12:13:42.985573,2023-10-02 12:13:43.152380,0 days 00:00:00.166807,7292.074714531576,460,sag,COMPLETE
1636,0.6449939949776177,2023-10-02 12:13:43.153380,2023-10-02 12:13:43.346770,0 days 00:00:00.193390,19191.006309314784,490,sag,COMPLETE
1637,0.637951741456491,2023-10-02 12:13:43.347832,2023-10-02 12:13:43.529491,0 days 00:00:00.181659,2319.610062788426,480,sag,COMPLETE
1638,0.6520362484987444,2023-10-02 12:13:43.530491,2023-10-02 12:13:43.706015,0 days 00:00:00.175524,4921.08200996247,500,sag,COMPLETE
1639,0.5925865269134185,2023-10-02 12:13:43.706015,2023-10-02 12:13:43.818757,0 days 00:00:00.112742,1.3993567063979533,470,sag,COMPLETE
1640,0.5,2023-10-02 12:13:43.819757,2023-10-02 12:13:43.909282,0 days 00:00:00.089525,0.09198546056873091,490,sag,COMPLETE
1641,0.637951741456491,2023-10-02 12:13:43.909282,2023-10-02 12:13:44.095435,0 days 00:00:00.186153,11284.084603190193,500,sag,COMPLETE
1642,0.6449939949776177,2023-10-02 12:13:44.096428,2023-10-02 12:13:44.289223,0 days 00:00:00.192795,3469.866982851836,480,sag,COMPLETE
1643,0.5,2023-10-02 12:13:44.289223,2023-10-02 12:13:44.444299,0 days 00:00:00.155076,0.0003499544120419519,490,sag,COMPLETE
1644,0.6077082650944426,2023-10-02 12:13:44.445301,2023-10-02 12:13:44.530845,0 days 00:00:00.085544,3.6005900582660573,500,sag,COMPLETE
1645,0.6520362484987444,2023-10-02 12:13:44.530845,2023-10-02 12:13:44.710497,0 days 00:00:00.179652,32316.54052832874,480,sag,COMPLETE
1646,0.5,2023-10-02 12:13:44.711494,2023-10-02 12:13:45.925709,0 days 00:00:01.214215,1.1337319066125275e-05,470,sag,COMPLETE
1647,0.6534556174254831,2023-10-02 12:13:45.925709,2023-10-02 12:13:46.104196,0 days 00:00:00.178487,114.02521789914276,490,sag,COMPLETE
1648,0.637951741456491,2023-10-02 12:13:46.105265,2023-10-02 12:13:46.313291,0 days 00:00:00.208026,707.8949957817044,500,sag,COMPLETE
1649,0.666120755540998,2023-10-02 12:13:46.314360,2023-10-02 12:13:46.503335,0 days 00:00:00.188975,7711.578671561614,490,sag,COMPLETE
1650,0.649579648433235,2023-10-02 12:13:46.504414,2023-10-02 12:13:46.611988,0 days 00:00:00.107574,226.51298858476963,480,newton-cg,COMPLETE
1651,0.5,2023-10-02 12:13:46.611988,2023-10-02 12:13:46.697554,0 days 00:00:00.085566,0.008759649183768196,460,sag,COMPLETE
1652,0.6520362484987444,2023-10-02 12:13:46.697554,2023-10-02 12:13:46.897137,0 days 00:00:00.199583,15187.869618213903,500,sag,COMPLETE
1653,0.6238672344142374,2023-10-02 12:13:46.898137,2023-10-02 12:13:46.979667,0 days 00:00:00.081530,2161.9771362747156,490,liblinear,COMPLETE
1654,0.6590785020198712,2023-10-02 12:13:46.979667,2023-10-02 12:13:47.157193,0 days 00:00:00.177526,6003.404591331836,480,sag,COMPLETE
1655,0.6520362484987444,2023-10-02 12:13:47.157193,2023-10-02 12:13:47.341754,0 days 00:00:00.184561,1301.2305025993087,500,sag,COMPLETE
1656,0.5,2023-10-02 12:13:47.342756,2023-10-02 12:13:47.427592,0 days 00:00:00.084836,0.18231521318888944,490,sag,COMPLETE
1657,0.5,2023-10-02 12:13:47.427592,2023-10-02 12:13:47.508993,0 days 00:00:00.081401,0.1617492185480973,470,sag,COMPLETE
1658,0.6590785020198712,2023-10-02 12:13:47.509993,2023-10-02 12:13:47.707576,0 days 00:00:00.197583,23314.56291420195,500,sag,COMPLETE
1659,0.6140408341522,2023-10-02 12:13:47.707576,2023-10-02 12:13:47.792552,0 days 00:00:00.084976,5.019454829940801,480,sag,COMPLETE
1660,0.5,2023-10-02 12:13:47.792552,2023-10-02 12:13:47.906596,0 days 00:00:00.114044,0.29052585267931846,490,sag,COMPLETE
1661,0.6590785020198712,2023-10-02 12:13:47.907600,2023-10-02 12:13:48.078334,0 days 00:00:00.170734,3540.4672835496485,500,sag,COMPLETE
1662,0.528169014084507,2023-10-02 12:13:48.079329,2023-10-02 12:13:48.258617,0 days 00:00:00.179288,0.45471606241897716,490,sag,COMPLETE
1663,0.6520362484987444,2023-10-02 12:13:48.259616,2023-10-02 12:13:48.427059,0 days 00:00:00.167443,10966.824891900706,480,sag,COMPLETE
1664,0.6590785020198712,2023-10-02 12:13:48.428062,2023-10-02 12:13:48.635880,0 days 00:00:00.207818,40745.50402931261,470,sag,COMPLETE
1665,0.6520362484987444,2023-10-02 12:13:48.636880,2023-10-02 12:13:48.825420,0 days 00:00:00.188540,16950.429211917584,500,sag,COMPLETE
1666,0.637951741456491,2023-10-02 12:13:48.826420,2023-10-02 12:13:48.996094,0 days 00:00:00.169674,7673.85877029571,490,sag,COMPLETE
1667,0.649579648433235,2023-10-02 12:13:48.997175,2023-10-02 12:13:49.141247,0 days 00:00:00.144072,134.6808303767318,480,sag,COMPLETE
1668,0.6449939949776177,2023-10-02 12:13:49.142246,2023-10-02 12:13:49.311882,0 days 00:00:00.169636,4345.41872030413,500,sag,COMPLETE
1669,0.6520362484987444,2023-10-02 12:13:49.312886,2023-10-02 12:13:49.484589,0 days 00:00:00.171703,10341.293922670986,460,sag,COMPLETE
1670,0.6520362484987444,2023-10-02 12:13:49.484589,2023-10-02 12:13:49.663457,0 days 00:00:00.178868,6074.361637453975,490,sag,COMPLETE
1671,0.6013756960366853,2023-10-02 12:13:49.664506,2023-10-02 12:13:49.755270,0 days 00:00:00.090764,2.5005345361755507,470,newton-cg,COMPLETE
1672,0.5,2023-10-02 12:13:49.756269,2023-10-02 12:13:50.095757,0 days 00:00:00.339488,4.919524222868912e-05,500,sag,COMPLETE
1673,0.637951741456491,2023-10-02 12:13:50.096812,2023-10-02 12:13:50.178375,0 days 00:00:00.081563,22615.052872577435,480,liblinear,COMPLETE
1674,0.6449939949776177,2023-10-02 12:13:50.179376,2023-10-02 12:13:50.348893,0 days 00:00:00.169517,2552.191468135021,490,sag,COMPLETE
1675,0.5619609127634021,2023-10-02 12:13:50.350048,2023-10-02 12:13:50.441478,0 days 00:00:00.091430,0.8370647390327095,500,sag,COMPLETE
1676,0.6520362484987444,2023-10-02 12:13:50.441478,2023-10-02 12:13:50.681865,0 days 00:00:00.240387,13982.954882311189,490,sag,COMPLETE
1677,0.5,2023-10-02 12:13:50.681865,2023-10-02 12:13:50.765710,0 days 00:00:00.083845,0.04410676342202127,480,sag,COMPLETE
1678,0.6629544710121192,2023-10-02 12:13:50.766761,2023-10-02 12:13:50.940066,0 days 00:00:00.173305,36546.847161791906,470,sag,COMPLETE
1679,0.6520362484987444,2023-10-02 12:13:50.941067,2023-10-02 12:13:51.114913,0 days 00:00:00.173846,3951.454665467399,490,sag,COMPLETE
1680,0.5,2023-10-02 12:13:51.115920,2023-10-02 12:13:51.208583,0 days 00:00:00.092663,0.006290270925034871,500,sag,COMPLETE
1681,0.6590785020198712,2023-10-02 12:13:51.209582,2023-10-02 12:13:51.379639,0 days 00:00:00.170057,8356.596273835956,480,sag,COMPLETE
1682,0.5,2023-10-02 12:13:51.380635,2023-10-02 12:13:52.784718,0 days 00:00:01.404083,1.0373813758169619e-05,500,sag,COMPLETE
1683,0.6418277104487389,2023-10-02 12:13:52.784718,2023-10-02 12:13:52.935792,0 days 00:00:00.151074,388.1236718831862,490,sag,COMPLETE
1684,0.6449939949776177,2023-10-02 12:13:52.935792,2023-10-02 12:13:53.106715,0 days 00:00:00.170923,1473.7596278826009,480,sag,COMPLETE
1685,0.6520362484987444,2023-10-02 12:13:53.107757,2023-10-02 12:13:53.284822,0 days 00:00:00.177065,15200.455073364792,490,sag,COMPLETE
1686,0.5,2023-10-02 12:13:53.285827,2023-10-02 12:13:53.374742,0 days 00:00:00.088915,0.029410142936763646,460,sag,COMPLETE
1687,0.649579648433235,2023-10-02 12:13:53.375742,2023-10-02 12:13:53.500978,0 days 00:00:00.125236,162.3559739916457,470,sag,COMPLETE
1688,0.6235396877388361,2023-10-02 12:13:53.501983,2023-10-02 12:13:53.604651,0 days 00:00:00.102668,8.84379183697336,500,sag,COMPLETE
1689,0.5,2023-10-02 12:13:53.605651,2023-10-02 12:13:53.694166,0 days 00:00:00.088515,0.017795617294188645,480,sag,COMPLETE
1690,0.6520362484987444,2023-10-02 12:13:53.695165,2023-10-02 12:13:53.948223,0 days 00:00:00.253058,5727.188300232916,490,sag,COMPLETE
1691,0.5376678676711432,2023-10-02 12:13:53.949307,2023-10-02 12:13:54.042028,0 days 00:00:00.092721,0.6123844239044811,500,newton-cg,COMPLETE
1692,0.6590785020198712,2023-10-02 12:13:54.043026,2023-10-02 12:13:54.231668,0 days 00:00:00.188642,2695.9156473797157,490,sag,COMPLETE
1693,0.6559122174909924,2023-10-02 12:13:54.232668,2023-10-02 12:13:54.411671,0 days 00:00:00.179003,8824.33416538255,470,sag,COMPLETE
1694,0.5,2023-10-02 12:13:54.412664,2023-10-02 12:13:54.496180,0 days 00:00:00.083516,0.0010723902403400978,500,liblinear,COMPLETE
1695,0.6590785020198712,2023-10-02 12:13:54.497180,2023-10-02 12:13:54.686397,0 days 00:00:00.189217,20962.566545213416,480,sag,COMPLETE
1696,0.6590785020198712,2023-10-02 12:13:54.687400,2023-10-02 12:13:54.870204,0 days 00:00:00.182804,3677.1937212595194,490,sag,COMPLETE
1697,0.6590785020198712,2023-10-02 12:13:54.871206,2023-10-02 12:13:55.064279,0 days 00:00:00.193073,43704.68886923504,500,sag,COMPLETE
1698,0.637951741456491,2023-10-02 12:13:55.065274,2023-10-02 12:13:55.248230,0 days 00:00:00.182956,769.1898143450359,480,sag,COMPLETE
1699,0.6590785020198712,2023-10-02 12:13:55.248230,2023-10-02 12:13:55.430701,0 days 00:00:00.182471,11217.688377251938,490,sag,COMPLETE
1700,0.666120755540998,2023-10-02 12:13:55.431701,2023-10-02 12:13:55.636691,0 days 00:00:00.204990,5704.8284412352305,500,sag,COMPLETE
1701,0.637951741456491,2023-10-02 12:13:55.636691,2023-10-02 12:13:55.817330,0 days 00:00:00.180639,1806.0910110587279,470,sag,COMPLETE
1702,0.6590785020198712,2023-10-02 12:13:55.818403,2023-10-02 12:13:55.988494,0 days 00:00:00.170091,30393.247328683596,490,sag,COMPLETE
1703,0.5,2023-10-02 12:13:55.989547,2023-10-02 12:13:56.094193,0 days 00:00:00.104646,0.07993678403274383,480,sag,COMPLETE
1704,0.6520362484987444,2023-10-02 12:13:56.095190,2023-10-02 12:13:56.359767,0 days 00:00:00.264577,13142.427315255638,500,sag,COMPLETE
1705,0.6590785020198712,2023-10-02 12:13:56.360761,2023-10-02 12:13:56.541008,0 days 00:00:00.180247,6379.242579473612,490,sag,COMPLETE
1706,0.5,2023-10-02 12:13:56.542041,2023-10-02 12:13:56.664692,0 days 00:00:00.122651,0.0004459262596926175,470,sag,COMPLETE
1707,0.5,2023-10-02 12:13:56.665695,2023-10-02 12:13:56.750827,0 days 00:00:00.085132,0.1939423379017306,500,sag,COMPLETE
1708,0.6590785020198712,2023-10-02 12:13:56.751826,2023-10-02 12:13:56.920360,0 days 00:00:00.168534,23395.626599419546,480,sag,COMPLETE
1709,0.6520362484987444,2023-10-02 12:13:56.921366,2023-10-02 12:13:57.091282,0 days 00:00:00.169916,3807.5413726049383,460,sag,COMPLETE
1710,0.6590785020198712,2023-10-02 12:13:57.092278,2023-10-02 12:13:57.274038,0 days 00:00:00.181760,8956.642803426,490,sag,COMPLETE
1711,0.5,2023-10-02 12:13:57.275042,2023-10-02 12:13:57.366561,0 days 00:00:00.091519,0.002820791473795726,500,sag,COMPLETE
1712,0.6267059722677149,2023-10-02 12:13:57.367560,2023-10-02 12:13:57.524668,0 days 00:00:00.157108,12.662456210784448,480,newton-cg,COMPLETE
1713,0.5,2023-10-02 12:13:57.525665,2023-10-02 12:13:58.158685,0 days 00:00:00.633020,2.216596937909881e-05,440,sag,COMPLETE
1714,0.6277432034064855,2023-10-02 12:13:58.158685,2023-10-02 12:13:58.243432,0 days 00:00:00.084747,1067.9316772312059,490,liblinear,COMPLETE
1715,0.6013756960366853,2023-10-02 12:13:58.244433,2023-10-02 12:13:58.330723,0 days 00:00:00.086290,2.3844740787973553,500,sag,COMPLETE
1716,0.6552025330276231,2023-10-02 12:13:58.331723,2023-10-02 12:13:58.532817,0 days 00:00:00.201094,17068.037661699138,480,sag,COMPLETE
1717,0.6520362484987444,2023-10-02 12:13:58.533818,2023-10-02 12:13:58.718387,0 days 00:00:00.184569,2342.7819410264447,470,sag,COMPLETE
1718,0.6590785020198712,2023-10-02 12:13:58.719387,2023-10-02 12:13:58.957205,0 days 00:00:00.237818,5240.445819340224,490,sag,COMPLETE
1719,0.666120755540998,2023-10-02 12:13:58.958199,2023-10-02 12:13:59.149321,0 days 00:00:00.191122,10063.225820758551,500,sag,COMPLETE
1720,0.5415438366633912,2023-10-02 12:13:59.149321,2023-10-02 12:13:59.250519,0 days 00:00:00.101198,0.5809705356394113,490,sag,COMPLETE
1721,0.6481602795064964,2023-10-02 12:13:59.251517,2023-10-02 12:13:59.422856,0 days 00:00:00.171339,45966.20147704371,460,sag,COMPLETE
1722,0.5,2023-10-02 12:13:59.423854,2023-10-02 12:13:59.579159,0 days 00:00:00.155305,0.00018915338416685762,500,sag,COMPLETE
1723,0.6449939949776177,2023-10-02 12:13:59.580203,2023-10-02 12:13:59.757503,0 days 00:00:00.177300,27350.34344211248,480,sag,COMPLETE
1724,0.5,2023-10-02 12:13:59.758507,2023-10-02 12:13:59.870713,0 days 00:00:00.112206,0.0005580460720319596,490,sag,COMPLETE
1725,0.6449939949776177,2023-10-02 12:13:59.871716,2023-10-02 12:14:00.051711,0 days 00:00:00.179995,3821.9037128353093,500,sag,COMPLETE
1726,0.6069985806310733,2023-10-02 12:14:00.052711,2023-10-02 12:14:00.152022,0 days 00:00:00.099311,4.366910212453676,470,sag,COMPLETE
1727,0.6590785020198712,2023-10-02 12:14:00.153022,2023-10-02 12:14:00.332882,0 days 00:00:00.179860,14167.279020411335,480,sag,COMPLETE
1728,0.6520362484987444,2023-10-02 12:14:00.333886,2023-10-02 12:14:00.511924,0 days 00:00:00.178038,7221.178432145322,490,sag,COMPLETE
1729,0.6418277104487389,2023-10-02 12:14:00.511924,2023-10-02 12:14:00.689402,0 days 00:00:00.177478,407.76993288379225,480,sag,COMPLETE
1730,0.6590785020198712,2023-10-02 12:14:00.689402,2023-10-02 12:14:00.866255,0 days 00:00:00.176853,2750.2215595623497,500,sag,COMPLETE
1731,0.6520362484987444,2023-10-02 12:14:00.867260,2023-10-02 12:14:01.042912,0 days 00:00:00.175652,5671.850717962752,490,sag,COMPLETE
1732,0.6418277104487389,2023-10-02 12:14:01.043913,2023-10-02 12:14:01.322192,0 days 00:00:00.278279,534.7185071612303,500,sag,COMPLETE
1733,0.5,2023-10-02 12:14:01.323193,2023-10-02 12:14:01.413265,0 days 00:00:00.090072,0.1405848728915859,490,sag,COMPLETE
1734,0.66224478654875,2023-10-02 12:14:01.414264,2023-10-02 12:14:01.612700,0 days 00:00:00.198436,18567.697921162504,480,sag,COMPLETE
1735,0.5,2023-10-02 12:14:01.613700,2023-10-02 12:14:01.702583,0 days 00:00:00.088883,0.043381352290716636,470,newton-cg,COMPLETE
1736,0.6590785020198712,2023-10-02 12:14:01.703582,2023-10-02 12:14:01.902153,0 days 00:00:00.198571,10983.422564891745,500,sag,COMPLETE
1737,0.6238672344142374,2023-10-02 12:14:01.903151,2023-10-02 12:14:01.988796,0 days 00:00:00.085645,1663.8434168126362,490,liblinear,COMPLETE
1738,0.6520362484987444,2023-10-02 12:14:01.988796,2023-10-02 12:14:02.206132,0 days 00:00:00.217336,36610.20930155044,480,sag,COMPLETE
1739,0.666120755540998,2023-10-02 12:14:02.207132,2023-10-02 12:14:02.381151,0 days 00:00:00.174019,8068.916085295732,490,sag,COMPLETE
1740,0.6590785020198712,2023-10-02 12:14:02.382208,2023-10-02 12:14:02.561252,0 days 00:00:00.179044,4263.887414448493,500,sag,COMPLETE
1741,0.666120755540998,2023-10-02 12:14:02.561252,2023-10-02 12:14:02.749604,0 days 00:00:00.188352,15362.279791409608,470,sag,COMPLETE
1742,0.6449939949776177,2023-10-02 12:14:02.750668,2023-10-02 12:14:02.921265,0 days 00:00:00.170597,25580.376916134916,460,sag,COMPLETE
1743,0.5,2023-10-02 12:14:02.922263,2023-10-02 12:14:03.051668,0 days 00:00:00.129405,0.00022211188744303173,490,sag,COMPLETE
1744,0.5,2023-10-02 12:14:03.052668,2023-10-02 12:14:03.159699,0 days 00:00:00.107031,0.00256094596012611,480,sag,COMPLETE
1745,0.5,2023-10-02 12:14:03.160702,2023-10-02 12:14:03.337115,0 days 00:00:00.176413,0.00014529534553076132,500,sag,COMPLETE
1746,0.5894202423845398,2023-10-02 12:14:03.338222,2023-10-02 12:14:03.507456,0 days 00:00:00.169234,1.2422579195957557,500,sag,COMPLETE
1747,0.5,2023-10-02 12:14:03.508456,2023-10-02 12:14:03.629105,0 days 00:00:00.120649,0.0035373011621756675,480,sag,COMPLETE
1748,0.6520362484987444,2023-10-02 12:14:03.630101,2023-10-02 12:14:03.810068,0 days 00:00:00.179967,6649.888095069459,490,sag,COMPLETE
1749,0.6590785020198712,2023-10-02 12:14:03.811072,2023-10-02 12:14:04.029736,0 days 00:00:00.218664,53412.05293608757,490,sag,COMPLETE
1750,0.6062888961677039,2023-10-02 12:14:04.030736,2023-10-02 12:14:04.118253,0 days 00:00:00.087517,5.972053161799989,500,sag,COMPLETE
1751,0.637951741456491,2023-10-02 12:14:04.119252,2023-10-02 12:14:04.311633,0 days 00:00:00.192381,2975.394980773655,470,sag,COMPLETE
1752,0.5,2023-10-02 12:14:04.311633,2023-10-02 12:14:04.399114,0 days 00:00:00.087481,0.027834050020168564,480,sag,COMPLETE
1753,0.5,2023-10-02 12:14:04.399114,2023-10-02 12:14:04.498115,0 days 00:00:00.099001,1.865806552774179e-05,490,newton-cg,COMPLETE
1754,0.6534556174254831,2023-10-02 12:14:04.499115,2023-10-02 12:14:04.625982,0 days 00:00:00.126867,94.66586148279428,500,sag,COMPLETE
1755,0.6277432034064855,2023-10-02 12:14:04.627253,2023-10-02 12:14:04.714883,0 days 00:00:00.087630,1227.8731338244231,490,liblinear,COMPLETE
1756,0.5,2023-10-02 12:14:04.715923,2023-10-02 12:14:04.837696,0 days 00:00:00.121773,0.002161599501426204,480,sag,COMPLETE
1757,0.6590785020198712,2023-10-02 12:14:04.837696,2023-10-02 12:14:05.026155,0 days 00:00:00.188459,9738.210852325503,460,sag,COMPLETE
1758,0.6520362484987444,2023-10-02 12:14:05.027155,2023-10-02 12:14:05.218469,0 days 00:00:00.191314,4659.6763774999,500,sag,COMPLETE
1759,0.5,2023-10-02 12:14:05.219469,2023-10-02 12:14:05.557735,0 days 00:00:00.338266,4.309700513973184e-05,480,sag,COMPLETE
1760,0.6520362484987444,2023-10-02 12:14:05.558784,2023-10-02 12:14:05.806295,0 days 00:00:00.247511,20976.4530312729,470,sag,COMPLETE
1761,0.6418277104487389,2023-10-02 12:14:05.808306,2023-10-02 12:14:05.981337,0 days 00:00:00.173031,316.5124743056007,490,sag,COMPLETE
1762,0.666120755540998,2023-10-02 12:14:05.981337,2023-10-02 12:14:06.189933,0 days 00:00:00.208596,13328.099326552605,500,sag,COMPLETE
1763,0.6449939949776177,2023-10-02 12:14:06.190932,2023-10-02 12:14:06.373948,0 days 00:00:00.183016,1999.5369386146638,490,sag,COMPLETE
1764,0.6520362484987444,2023-10-02 12:14:06.374948,2023-10-02 12:14:06.558335,0 days 00:00:00.183387,7727.4538767422,500,sag,COMPLETE
1765,0.5,2023-10-02 12:14:06.558398,2023-10-02 12:14:07.110898,0 days 00:00:00.552500,2.9605363245820764e-05,470,sag,COMPLETE
1766,0.6590785020198712,2023-10-02 12:14:07.111902,2023-10-02 12:14:07.356024,0 days 00:00:00.244122,32419.509364636586,480,sag,COMPLETE
1767,0.604541980565564,2023-10-02 12:14:07.356024,2023-10-02 12:14:07.448595,0 days 00:00:00.092571,3.2219829581330135,490,sag,COMPLETE
1768,0.6552025330276231,2023-10-02 12:14:07.449586,2023-10-02 12:14:07.625676,0 days 00:00:00.176090,3342.9189619635,500,sag,COMPLETE
1769,0.5313352986133857,2023-10-02 12:14:07.625676,2023-10-02 12:14:07.714915,0 days 00:00:00.089239,0.4961444073612874,480,sag,COMPLETE
1770,0.6418277104487389,2023-10-02 12:14:07.715921,2023-10-02 12:14:07.887276,0 days 00:00:00.171355,687.7480275530413,450,sag,COMPLETE
1771,0.6520362484987444,2023-10-02 12:14:07.887276,2023-10-02 12:14:08.060841,0 days 00:00:00.173565,5114.106784394994,490,sag,COMPLETE
1772,0.6449939949776177,2023-10-02 12:14:08.061914,2023-10-02 12:14:08.238626,0 days 00:00:00.176712,13578.76153551241,500,sag,COMPLETE
1773,0.6534556174254831,2023-10-02 12:14:08.239599,2023-10-02 12:14:08.365457,0 days 00:00:00.125858,108.26484225822342,470,sag,COMPLETE
1774,0.637951741456491,2023-10-02 12:14:08.366458,2023-10-02 12:14:08.538150,0 days 00:00:00.171692,9795.759996397634,490,newton-cg,COMPLETE
1775,0.5,2023-10-02 12:14:08.539149,2023-10-02 12:14:08.630710,0 days 00:00:00.091561,0.00799020380774429,480,sag,COMPLETE
1776,0.637951741456491,2023-10-02 12:14:08.631710,2023-10-02 12:14:08.718680,0 days 00:00:00.086970,21907.048724692086,500,liblinear,COMPLETE
1777,0.5,2023-10-02 12:14:08.718680,2023-10-02 12:14:08.808510,0 days 00:00:00.089830,0.019904159646793804,490,sag,COMPLETE
1778,0.5,2023-10-02 12:14:08.809508,2023-10-02 12:14:08.912359,0 days 00:00:00.102851,0.0018398842086723211,120,sag,COMPLETE
1779,0.6590785020198712,2023-10-02 12:14:08.913361,2023-10-02 12:14:09.084099,0 days 00:00:00.170738,49704.41554415975,480,sag,COMPLETE
1780,0.5,2023-10-02 12:14:09.084099,2023-10-02 12:14:09.177837,0 days 00:00:00.093738,0.005856248521632905,500,sag,COMPLETE
