number,value,datetime_start,datetime_complete,duration,params_C,params_max_iter,params_solver,state
3084,0.6590785020198712,2023-10-02 12:18:27.392640,2023-10-02 12:18:27.619913,0 days 00:00:00.227273,25662.788914288954,450,sag,COMPLETE
3085,0.637951741456491,2023-10-02 12:18:27.620984,2023-10-02 12:18:27.868572,0 days 00:00:00.247588,25311.345743336748,450,newton-cg,COMPLETE
3086,0.6520362484987444,2023-10-02 12:18:27.869570,2023-10-02 12:18:28.098095,0 days 00:00:00.228525,46119.04500569928,450,saga,COMPLETE
3087,0.6590785020198712,2023-10-02 12:18:28.099089,2023-10-02 12:18:28.344143,0 days 00:00:00.245054,21551.32041722172,440,sag,COMPLETE
3088,0.6590785020198712,2023-10-02 12:18:28.345143,2023-10-02 12:18:28.582636,0 days 00:00:00.237493,35882.98178914979,450,sag,COMPLETE
3089,0.6590785020198712,2023-10-02 12:18:28.584069,2023-10-02 12:18:28.824704,0 days 00:00:00.240635,19390.286405246665,460,sag,COMPLETE
3090,0.637951741456491,2023-10-02 12:18:28.825703,2023-10-02 12:18:29.121285,0 days 00:00:00.295582,34714.59564210387,440,sag,COMPLETE
3091,0.637951741456491,2023-10-02 12:18:29.122288,2023-10-02 12:18:29.269245,0 days 00:00:00.146957,21765.09361124675,460,liblinear,COMPLETE
3092,0.6449939949776177,2023-10-02 12:18:29.270245,2023-10-02 12:18:29.502647,0 days 00:00:00.232402,59441.149736412495,450,saga,COMPLETE
3093,0.6449939949776177,2023-10-02 12:18:29.503646,2023-10-02 12:18:29.726564,0 days 00:00:00.222918,36139.48332392523,450,sag,COMPLETE
3094,0.6590785020198712,2023-10-02 12:18:29.727565,2023-10-02 12:18:30.018410,0 days 00:00:00.290845,18972.812019313908,440,sag,COMPLETE
3095,0.666120755540998,2023-10-02 12:18:30.019413,2023-10-02 12:18:30.258997,0 days 00:00:00.239584,47566.49075472385,450,sag,COMPLETE
3096,0.6590785020198712,2023-10-02 12:18:30.259997,2023-10-02 12:18:30.483088,0 days 00:00:00.223091,64698.91997770852,460,sag,COMPLETE
3097,0.6590785020198712,2023-10-02 12:18:30.484088,2023-10-02 12:18:30.704440,0 days 00:00:00.220352,28787.101136066678,440,sag,COMPLETE
3098,0.666120755540998,2023-10-02 12:18:30.705440,2023-10-02 12:18:30.933184,0 days 00:00:00.227744,15812.076079856184,450,sag,COMPLETE
3099,0.6590785020198712,2023-10-02 12:18:30.934183,2023-10-02 12:18:31.249774,0 days 00:00:00.315591,27457.15084698529,450,saga,COMPLETE
3100,0.637951741456491,2023-10-02 12:18:31.250773,2023-10-02 12:18:31.475319,0 days 00:00:00.224546,18944.625472261137,440,sag,COMPLETE
3101,0.6668304400043672,2023-10-02 12:18:31.476318,2023-10-02 12:18:31.701794,0 days 00:00:00.225476,62685.1829393074,460,sag,COMPLETE
3102,0.66224478654875,2023-10-02 12:18:31.702798,2023-10-02 12:18:31.930089,0 days 00:00:00.227291,66271.88960576999,460,sag,COMPLETE
3103,0.6520362484987444,2023-10-02 12:18:31.931092,2023-10-02 12:18:32.232926,0 days 00:00:00.301834,64886.20966250434,440,saga,COMPLETE
3104,0.637951741456491,2023-10-02 12:18:32.233924,2023-10-02 12:18:32.420959,0 days 00:00:00.187035,57993.38967050314,460,lbfgs,COMPLETE
3105,0.6590785020198712,2023-10-02 12:18:32.421959,2023-10-02 12:18:32.647742,0 days 00:00:00.225783,96478.6192448422,450,sag,COMPLETE
3106,0.6520362484987444,2023-10-02 12:18:32.648743,2023-10-02 12:18:32.888529,0 days 00:00:00.239786,94656.09381282437,440,sag,COMPLETE
3107,0.6520362484987444,2023-10-02 12:18:32.889606,2023-10-02 12:18:33.111867,0 days 00:00:00.222261,45491.15364441119,450,sag,COMPLETE
3108,0.6520362484987444,2023-10-02 12:18:33.112866,2023-10-02 12:18:33.404882,0 days 00:00:00.292016,69280.82437412215,450,sag,COMPLETE
3109,0.6481602795064964,2023-10-02 12:18:33.405881,2023-10-02 12:18:33.640150,0 days 00:00:00.234269,44614.4038344407,450,saga,COMPLETE
3110,0.666120755540998,2023-10-02 12:18:33.641212,2023-10-02 12:18:33.875488,0 days 00:00:00.234276,64037.68850279837,450,sag,COMPLETE
3111,0.6488699639698657,2023-10-02 12:18:33.876485,2023-10-02 12:18:34.124745,0 days 00:00:00.248260,35040.32359006389,460,sag,COMPLETE
3112,0.6520362484987444,2023-10-02 12:18:34.126815,2023-10-02 12:18:34.436404,0 days 00:00:00.309589,97719.51396564259,460,sag,COMPLETE
3113,0.6449939949776177,2023-10-02 12:18:34.438404,2023-10-02 12:18:34.607465,0 days 00:00:00.169061,99305.06986657169,470,newton-cg,COMPLETE
3114,0.6590785020198712,2023-10-02 12:18:34.608475,2023-10-02 12:18:34.860590,0 days 00:00:00.252115,50472.58944444053,450,sag,COMPLETE
3115,0.637951741456491,2023-10-02 12:18:34.861592,2023-10-02 12:18:35.023069,0 days 00:00:00.161477,47395.9754243151,460,liblinear,COMPLETE
3116,0.6552025330276231,2023-10-02 12:18:35.024067,2023-10-02 12:18:35.331899,0 days 00:00:00.307832,36854.15233995862,460,sag,COMPLETE
3117,0.6590785020198712,2023-10-02 12:18:35.332898,2023-10-02 12:18:35.572157,0 days 00:00:00.239259,40794.4445955319,440,saga,COMPLETE
3118,0.66224478654875,2023-10-02 12:18:35.573253,2023-10-02 12:18:35.823472,0 days 00:00:00.250219,30347.625979455952,450,sag,COMPLETE
3119,0.6559122174909924,2023-10-02 12:18:35.824464,2023-10-02 12:18:36.078958,0 days 00:00:00.254494,63827.86432538015,460,sag,COMPLETE
3120,0.6520362484987444,2023-10-02 12:18:36.079960,2023-10-02 12:18:36.341415,0 days 00:00:00.261455,67661.48815815599,450,sag,COMPLETE
3121,0.6520362484987444,2023-10-02 12:18:36.343476,2023-10-02 12:18:36.858552,0 days 00:00:00.515076,99669.54851157073,440,sag,COMPLETE
3122,0.6481602795064964,2023-10-02 12:18:36.859543,2023-10-02 12:18:37.167515,0 days 00:00:00.307972,27918.57120172538,460,saga,COMPLETE
3123,0.666120755540998,2023-10-02 12:18:37.169524,2023-10-02 12:18:37.418408,0 days 00:00:00.248884,52859.53842041966,460,sag,COMPLETE
3124,0.6590785020198712,2023-10-02 12:18:37.419411,2023-10-02 12:18:37.650400,0 days 00:00:00.230989,39983.48823741662,450,sag,COMPLETE
3125,0.637951741456491,2023-10-02 12:18:37.652395,2023-10-02 12:18:37.955314,0 days 00:00:00.302919,26001.54687910905,460,sag,COMPLETE
3126,0.669996724533246,2023-10-02 12:18:37.956308,2023-10-02 12:18:38.194836,0 days 00:00:00.238528,41055.25619355468,460,sag,COMPLETE
3127,0.6481602795064964,2023-10-02 12:18:38.195834,2023-10-02 12:18:38.425225,0 days 00:00:00.229391,42129.97313341303,450,saga,COMPLETE
3128,0.6590785020198712,2023-10-02 12:18:38.426225,2023-10-02 12:18:38.649363,0 days 00:00:00.223138,59674.44895045672,450,sag,COMPLETE
3129,0.637951741456491,2023-10-02 12:18:38.650365,2023-10-02 12:18:38.844838,0 days 00:00:00.194473,60977.46865055867,450,lbfgs,COMPLETE
3130,0.6590785020198712,2023-10-02 12:18:38.846841,2023-10-02 12:18:39.142994,0 days 00:00:00.296153,32193.22607749715,450,sag,COMPLETE
3131,0.6552025330276231,2023-10-02 12:18:39.143992,2023-10-02 12:18:39.367213,0 days 00:00:00.223221,38038.52521265381,440,sag,COMPLETE
3132,0.6590785020198712,2023-10-02 12:18:39.368210,2023-10-02 12:18:39.594420,0 days 00:00:00.226210,98975.43257187244,460,sag,COMPLETE
3133,0.6520362484987444,2023-10-02 12:18:39.595422,2023-10-02 12:18:39.823475,0 days 00:00:00.228053,66290.84531059174,440,sag,COMPLETE
3134,0.6520362484987444,2023-10-02 12:18:39.824476,2023-10-02 12:18:40.137588,0 days 00:00:00.313112,26517.83273032972,460,saga,COMPLETE
3135,0.6552025330276231,2023-10-02 12:18:40.138592,2023-10-02 12:18:40.367402,0 days 00:00:00.228810,46840.128510722534,450,sag,COMPLETE
3136,0.6590785020198712,2023-10-02 12:18:40.368402,2023-10-02 12:18:40.604989,0 days 00:00:00.236587,31097.592334619043,460,sag,COMPLETE
3137,0.6520362484987444,2023-10-02 12:18:40.607101,2023-10-02 12:18:40.843144,0 days 00:00:00.236043,62570.691775189734,460,sag,COMPLETE
3138,0.666120755540998,2023-10-02 12:18:40.844143,2023-10-02 12:18:41.151782,0 days 00:00:00.307639,23969.080167737335,440,sag,COMPLETE
3139,0.6449939949776177,2023-10-02 12:18:41.153906,2023-10-02 12:18:41.335947,0 days 00:00:00.182041,36759.17101452491,450,newton-cg,COMPLETE
3140,0.666120755540998,2023-10-02 12:18:41.336947,2023-10-02 12:18:41.569988,0 days 00:00:00.233041,22630.100188930555,460,saga,COMPLETE
3141,0.6552025330276231,2023-10-02 12:18:41.570988,2023-10-02 12:18:41.800657,0 days 00:00:00.229669,64115.30091971226,460,sag,COMPLETE
3142,0.66224478654875,2023-10-02 12:18:41.801654,2023-10-02 12:18:42.034787,0 days 00:00:00.233133,48137.77047298967,450,sag,COMPLETE
3143,0.666120755540998,2023-10-02 12:18:42.035792,2023-10-02 12:18:42.338575,0 days 00:00:00.302783,17920.926588310533,460,sag,COMPLETE
3144,0.637951741456491,2023-10-02 12:18:42.339644,2023-10-02 12:18:42.489204,0 days 00:00:00.149560,98472.49135744943,440,liblinear,COMPLETE
3145,0.669996724533246,2023-10-02 12:18:42.490202,2023-10-02 12:18:42.720068,0 days 00:00:00.229866,39558.78617450227,450,sag,COMPLETE
3146,0.6590785020198712,2023-10-02 12:18:42.722068,2023-10-02 12:18:42.959122,0 days 00:00:00.237054,43272.56933729598,430,sag,COMPLETE
3147,0.6449939949776177,2023-10-02 12:18:42.960118,2023-10-02 12:18:43.262290,0 days 00:00:00.302172,34620.88041233698,440,saga,COMPLETE
3148,0.6520362484987444,2023-10-02 12:18:43.263423,2023-10-02 12:18:43.487175,0 days 00:00:00.223752,62663.573119364344,440,sag,COMPLETE
3149,0.6488699639698657,2023-10-02 12:18:43.488196,2023-10-02 12:18:43.721256,0 days 00:00:00.233060,43156.55659092867,430,sag,COMPLETE
3150,0.5,2023-10-02 12:18:43.722296,2023-10-02 12:18:45.114478,0 days 00:00:01.392182,1.0602046259289792e-05,440,sag,COMPLETE
3151,0.6590785020198712,2023-10-02 12:18:45.115549,2023-10-02 12:18:45.414646,0 days 00:00:00.299097,27293.265287171875,450,sag,COMPLETE
3152,0.6481602795064964,2023-10-02 12:18:45.416646,2023-10-02 12:18:45.718761,0 days 00:00:00.302115,98464.73902994485,440,saga,COMPLETE
3153,0.6559122174909924,2023-10-02 12:18:45.720762,2023-10-02 12:18:45.959055,0 days 00:00:00.238293,64746.676166995116,460,sag,COMPLETE
3154,0.6520362484987444,2023-10-02 12:18:45.960055,2023-10-02 12:18:46.193694,0 days 00:00:00.233639,40691.10047038294,450,sag,COMPLETE
3155,0.6552025330276231,2023-10-02 12:18:46.194694,2023-10-02 12:18:46.423304,0 days 00:00:00.228610,30266.908426359714,450,sag,COMPLETE
3156,0.6590785020198712,2023-10-02 12:18:46.424365,2023-10-02 12:18:46.789490,0 days 00:00:00.365125,23746.538798984904,450,sag,COMPLETE
3157,0.637951741456491,2023-10-02 12:18:46.791494,2023-10-02 12:18:47.027060,0 days 00:00:00.235566,46877.093919648774,430,lbfgs,COMPLETE
3158,0.6520362484987444,2023-10-02 12:18:47.028057,2023-10-02 12:18:47.265108,0 days 00:00:00.237051,99264.12227842778,440,saga,COMPLETE
3159,0.6520362484987444,2023-10-02 12:18:47.266108,2023-10-02 12:18:47.492868,0 days 00:00:00.226760,61576.31688942561,450,sag,COMPLETE
3160,0.6590785020198712,2023-10-02 12:18:47.493870,2023-10-02 12:18:47.728741,0 days 00:00:00.234871,24735.12132533161,450,sag,COMPLETE
3161,0.666120755540998,2023-10-02 12:18:47.729887,2023-10-02 12:18:48.038472,0 days 00:00:00.308585,33096.907612748924,440,sag,COMPLETE
3162,0.6481602795064964,2023-10-02 12:18:48.039473,2023-10-02 12:18:48.275042,0 days 00:00:00.235569,20101.76754760191,450,sag,COMPLETE
3163,0.6590785020198712,2023-10-02 12:18:48.276046,2023-10-02 12:18:48.529092,0 days 00:00:00.253046,44564.40721007585,450,saga,COMPLETE
3164,0.6481602795064964,2023-10-02 12:18:48.531092,2023-10-02 12:18:48.793687,0 days 00:00:00.262595,64291.89503736323,460,sag,COMPLETE
3165,0.637951741456491,2023-10-02 12:18:48.794688,2023-10-02 12:18:49.035733,0 days 00:00:00.241045,19257.378171258482,440,newton-cg,COMPLETE
3166,0.6520362484987444,2023-10-02 12:18:49.037734,2023-10-02 12:18:49.271307,0 days 00:00:00.233573,38023.24286213303,460,sag,COMPLETE
3167,0.5,2023-10-02 12:18:49.272306,2023-10-02 12:18:49.581875,0 days 00:00:00.309569,7.846818908820497e-05,450,sag,COMPLETE
3168,0.637951741456491,2023-10-02 12:18:49.582872,2023-10-02 12:18:49.741392,0 days 00:00:00.158520,68470.0287639826,430,liblinear,COMPLETE
3169,0.5619609127634021,2023-10-02 12:18:49.743401,2023-10-02 12:18:49.911441,0 days 00:00:00.168040,0.8804074307270355,450,sag,COMPLETE
3170,0.5,2023-10-02 12:18:49.913442,2023-10-02 12:18:50.242009,0 days 00:00:00.328567,0.00010307459262040789,440,sag,COMPLETE
3171,0.6590785020198712,2023-10-02 12:18:50.243015,2023-10-02 12:18:50.482577,0 days 00:00:00.239562,26790.634517765415,460,saga,COMPLETE
3172,0.6449939949776177,2023-10-02 12:18:50.483579,2023-10-02 12:18:50.723620,0 days 00:00:00.240041,17639.31133242338,450,sag,COMPLETE
3173,0.6520362484987444,2023-10-02 12:18:50.724620,2023-10-02 12:18:50.959676,0 days 00:00:00.235056,40689.68926913405,430,sag,COMPLETE
3174,0.5,2023-10-02 12:18:50.961672,2023-10-02 12:18:51.700609,0 days 00:00:00.738937,2.3094797946145244e-05,460,sag,COMPLETE
3175,0.6520362484987444,2023-10-02 12:18:51.701679,2023-10-02 12:18:51.932004,0 days 00:00:00.230325,67768.80279628078,460,sag,COMPLETE
3176,0.651326564035375,2023-10-02 12:18:51.933004,2023-10-02 12:18:52.165600,0 days 00:00:00.232596,24297.396123641964,440,saga,COMPLETE
3177,0.66224478654875,2023-10-02 12:18:52.166600,2023-10-02 12:18:52.397680,0 days 00:00:00.231080,45880.23306617647,460,sag,COMPLETE
3178,0.666120755540998,2023-10-02 12:18:52.398811,2023-10-02 12:18:52.704088,0 days 00:00:00.305277,17493.95323430571,450,sag,COMPLETE
3179,0.6590785020198712,2023-10-02 12:18:52.705085,2023-10-02 12:18:52.935157,0 days 00:00:00.230072,33404.314369104744,460,sag,COMPLETE
3180,0.637951741456491,2023-10-02 12:18:52.936316,2023-10-02 12:18:53.126845,0 days 00:00:00.190529,67808.32735929824,460,lbfgs,COMPLETE
3181,0.5,2023-10-02 12:18:53.128846,2023-10-02 12:18:53.279035,0 days 00:00:00.150189,0.01556808679355441,430,sag,COMPLETE
3182,0.6411180259853696,2023-10-02 12:18:53.280037,2023-10-02 12:18:53.512345,0 days 00:00:00.232308,97929.4324575205,440,saga,COMPLETE
3183,0.6520362484987444,2023-10-02 12:18:53.513368,2023-10-02 12:18:53.834387,0 days 00:00:00.321019,16798.284388959353,460,sag,COMPLETE
3184,0.619663718746588,2023-10-02 12:18:53.835384,2023-10-02 12:18:53.989619,0 days 00:00:00.154235,9.603546870312329,450,sag,COMPLETE
3185,0.5,2023-10-02 12:18:53.990619,2023-10-02 12:18:54.141556,0 days 00:00:00.150937,0.030696338782311604,450,sag,COMPLETE
3186,0.5,2023-10-02 12:18:54.142558,2023-10-02 12:18:54.307447,0 days 00:00:00.164889,0.0017836475384813253,460,sag,COMPLETE
3187,0.5,2023-10-02 12:18:54.308448,2023-10-02 12:18:54.756487,0 days 00:00:00.448039,5.7059484882844126e-05,460,saga,COMPLETE
3188,0.6590785020198712,2023-10-02 12:18:54.758539,2023-10-02 12:18:54.996088,0 days 00:00:00.237549,28004.2617315167,430,sag,COMPLETE
3189,0.6457036794409869,2023-10-02 12:18:54.997089,2023-10-02 12:18:55.206132,0 days 00:00:00.209043,273.8264792191895,440,sag,COMPLETE
3190,0.5274593296211376,2023-10-02 12:18:55.208135,2023-10-02 12:18:55.367661,0 days 00:00:00.159526,0.5530447208389521,450,sag,COMPLETE
3191,0.6534556174254831,2023-10-02 12:18:55.368660,2023-10-02 12:18:55.538374,0 days 00:00:00.169714,121.9642114644797,460,newton-cg,COMPLETE
3192,0.6449939949776177,2023-10-02 12:18:55.539443,2023-10-02 12:18:55.840353,0 days 00:00:00.300910,99705.02644617528,460,sag,COMPLETE
3193,0.6559122174909924,2023-10-02 12:18:55.841418,2023-10-02 12:18:56.074886,0 days 00:00:00.233468,16443.339005358594,450,sag,COMPLETE
3194,0.6597881864832406,2023-10-02 12:18:56.075886,2023-10-02 12:18:56.313843,0 days 00:00:00.237957,42386.50370011833,440,saga,COMPLETE
3195,0.637951741456491,2023-10-02 12:18:56.314850,2023-10-02 12:18:56.475982,0 days 00:00:00.161132,27586.43827208863,460,liblinear,COMPLETE
3196,0.6590785020198712,2023-10-02 12:18:56.476981,2023-10-02 12:18:56.845605,0 days 00:00:00.368624,44126.9713543061,450,sag,COMPLETE
3197,0.6552025330276231,2023-10-02 12:18:56.846608,2023-10-02 12:18:57.078176,0 days 00:00:00.231568,17939.284440652435,460,sag,COMPLETE
3198,0.6552025330276231,2023-10-02 12:18:57.079178,2023-10-02 12:18:57.304216,0 days 00:00:00.225038,54254.81571619223,440,sag,COMPLETE
3199,0.5,2023-10-02 12:18:57.305216,2023-10-02 12:18:57.487260,0 days 00:00:00.182044,0.00036450477272187204,460,sag,COMPLETE
3200,0.6552025330276231,2023-10-02 12:18:57.488258,2023-10-02 12:18:57.803843,0 days 00:00:00.315585,28516.737066366797,450,saga,COMPLETE
3201,0.6062888961677039,2023-10-02 12:18:57.804838,2023-10-02 12:18:57.965367,0 days 00:00:00.160529,6.605116546145494,460,sag,COMPLETE
3202,0.6369145103177202,2023-10-02 12:18:57.966366,2023-10-02 12:18:58.149419,0 days 00:00:00.183053,18.835521186139918,430,sag,COMPLETE
3203,0.6590785020198712,2023-10-02 12:18:58.150418,2023-10-02 12:18:58.389990,0 days 00:00:00.239572,17053.073248525456,450,sag,COMPLETE
3204,0.6449939949776177,2023-10-02 12:18:58.390990,2023-10-02 12:18:58.632034,0 days 00:00:00.241044,58766.070024071516,440,sag,COMPLETE
3205,0.5,2023-10-02 12:18:58.634034,2023-10-02 12:18:58.977130,0 days 00:00:00.343096,0.0003125767252096717,460,saga,COMPLETE
3206,0.6590785020198712,2023-10-02 12:18:58.978125,2023-10-02 12:18:59.236220,0 days 00:00:00.258095,29233.241237061087,460,sag,COMPLETE
3207,0.66224478654875,2023-10-02 12:18:59.237212,2023-10-02 12:18:59.469786,0 days 00:00:00.232574,98163.2469843079,450,sag,COMPLETE
3208,0.5,2023-10-02 12:18:59.470786,2023-10-02 12:18:59.630843,0 days 00:00:00.160057,0.005814805705659571,460,sag,COMPLETE
3209,0.5,2023-10-02 12:18:59.631834,2023-10-02 12:18:59.870904,0 days 00:00:00.239070,0.24727804437585663,450,lbfgs,COMPLETE
3210,0.5,2023-10-02 12:18:59.871905,2023-10-02 12:19:00.028601,0 days 00:00:00.156696,0.02464915876644499,440,sag,COMPLETE
3211,0.666120755540998,2023-10-02 12:19:00.029608,2023-10-02 12:19:00.277187,0 days 00:00:00.247579,16219.393576413686,460,sag,COMPLETE
3212,0.6520362484987444,2023-10-02 12:19:00.278186,2023-10-02 12:19:00.519230,0 days 00:00:00.241044,43323.48793953899,470,saga,COMPLETE
3213,0.6449939949776177,2023-10-02 12:19:00.520229,2023-10-02 12:19:00.755281,0 days 00:00:00.235052,24873.537975715743,460,sag,COMPLETE
3214,0.6520362484987444,2023-10-02 12:19:00.756282,2023-10-02 12:19:01.060878,0 days 00:00:00.304596,62424.859899211566,430,sag,COMPLETE
3215,0.6520362484987444,2023-10-02 12:19:01.062875,2023-10-02 12:19:01.300975,0 days 00:00:00.238100,14010.486909963078,470,sag,COMPLETE
3216,0.6534556174254831,2023-10-02 12:19:01.301975,2023-10-02 12:19:01.500807,0 days 00:00:00.198832,63.24659932692693,440,newton-cg,COMPLETE
3217,0.5,2023-10-02 12:19:01.501807,2023-10-02 12:19:01.672349,0 days 00:00:00.170542,0.002517944445812825,470,sag,COMPLETE
3218,0.6590785020198712,2023-10-02 12:19:01.673348,2023-10-02 12:19:01.984451,0 days 00:00:00.311103,42169.65062768741,460,sag,COMPLETE
3219,0.5,2023-10-02 12:19:01.985457,2023-10-02 12:19:02.171983,0 days 00:00:00.186526,0.06130522883262116,450,saga,COMPLETE
3220,0.608417949557812,2023-10-02 12:19:02.172983,2023-10-02 12:19:02.342218,0 days 00:00:00.169235,2.8020430093577566,470,liblinear,COMPLETE
3221,0.6552025330276231,2023-10-02 12:19:02.343280,2023-10-02 12:19:02.609689,0 days 00:00:00.266409,23645.62312481819,440,sag,COMPLETE
3222,0.6590785020198712,2023-10-02 12:19:02.610690,2023-10-02 12:19:02.861478,0 days 00:00:00.250788,64467.29166732706,470,sag,COMPLETE
3223,0.5,2023-10-02 12:19:02.863509,2023-10-02 12:19:03.242029,0 days 00:00:00.378520,8.16026580984787e-05,450,sag,COMPLETE
3224,0.5,2023-10-02 12:19:03.243029,2023-10-02 12:19:03.408108,0 days 00:00:00.165079,0.19870979643153486,460,saga,COMPLETE
3225,0.5,2023-10-02 12:19:03.409101,2023-10-02 12:19:03.570556,0 days 00:00:00.161455,0.32494533956707156,470,sag,COMPLETE
3226,0.6502893328966044,2023-10-02 12:19:03.571556,2023-10-02 12:19:03.742020,0 days 00:00:00.170464,36.3682094773898,470,sag,COMPLETE
3227,0.6059613494923026,2023-10-02 12:19:03.743019,2023-10-02 12:19:03.979685,0 days 00:00:00.236666,1.6752669759224645,460,sag,COMPLETE
3228,0.5651271972922809,2023-10-02 12:19:03.980684,2023-10-02 12:19:04.142085,0 days 00:00:00.161401,1.0706765304544303,450,sag,COMPLETE
3229,0.5,2023-10-02 12:19:04.143077,2023-10-02 12:19:04.479110,0 days 00:00:00.336033,0.0001502979011383979,430,saga,COMPLETE
3230,0.6418277104487389,2023-10-02 12:19:04.480115,2023-10-02 12:19:04.809260,0 days 00:00:00.329145,423.16090490592524,470,sag,COMPLETE
3231,0.6369145103177202,2023-10-02 12:19:04.810264,2023-10-02 12:19:05.062985,0 days 00:00:00.252721,23.104480042663997,460,sag,COMPLETE
3232,0.637951741456491,2023-10-02 12:19:05.063982,2023-10-02 12:19:05.339729,0 days 00:00:00.275747,14894.810138366052,450,lbfgs,COMPLETE
3233,0.6520362484987444,2023-10-02 12:19:05.340729,2023-10-02 12:19:05.588551,0 days 00:00:00.247822,30442.156894698895,440,sag,COMPLETE
3234,0.6449939949776177,2023-10-02 12:19:05.589547,2023-10-02 12:19:05.847588,0 days 00:00:00.258041,42102.26739662168,470,sag,COMPLETE
3235,0.5,2023-10-02 12:19:05.848591,2023-10-02 12:19:06.022459,0 days 00:00:00.173868,0.0013986427068781093,470,sag,COMPLETE
3236,0.6298722567965934,2023-10-02 12:19:06.024463,2023-10-02 12:19:06.287628,0 days 00:00:00.263165,15.087322281847793,460,saga,COMPLETE
3237,0.6629544710121192,2023-10-02 12:19:06.288628,2023-10-02 12:19:06.535538,0 days 00:00:00.246910,14696.193759536594,470,sag,COMPLETE
3238,0.6418277104487389,2023-10-02 12:19:06.536591,2023-10-02 12:19:06.901559,0 days 00:00:00.364968,334.7079262994287,450,sag,COMPLETE
3239,0.5,2023-10-02 12:19:06.902555,2023-10-02 12:19:08.375911,0 days 00:00:01.473356,1.0046210473593076e-05,460,sag,COMPLETE
3240,0.6520362484987444,2023-10-02 12:19:08.376904,2023-10-02 12:19:08.701236,0 days 00:00:00.324332,66963.74189663352,440,sag,COMPLETE
3241,0.6520362484987444,2023-10-02 12:19:08.702243,2023-10-02 12:19:08.944911,0 days 00:00:00.242668,20934.787103546,470,saga,COMPLETE
3242,0.6267059722677149,2023-10-02 12:19:08.945907,2023-10-02 12:19:09.115982,0 days 00:00:00.170075,12.028502564103638,470,sag,COMPLETE
3243,0.6449939949776177,2023-10-02 12:19:09.117988,2023-10-02 12:19:09.311171,0 days 00:00:00.193183,35287.22102520973,450,newton-cg,COMPLETE
3244,0.5,2023-10-02 12:19:09.313172,2023-10-02 12:19:09.539086,0 days 00:00:00.225914,0.007595236441573956,430,sag,COMPLETE
3245,0.5943334425155585,2023-10-02 12:19:09.540079,2023-10-02 12:19:09.716134,0 days 00:00:00.176055,2.0751175811073184,460,sag,COMPLETE
