number,value,datetime_start,datetime_complete,duration,params_C,params_max_iter,params_solver,state
6830,0.6520362484987444,2023-10-02 12:40:21.897775,2023-10-02 12:40:22.399865,0 days 00:00:00.502090,7460.5264844136145,380,sag,COMPLETE
6831,0.666120755540998,2023-10-02 12:40:22.399865,2023-10-02 12:40:22.776134,0 days 00:00:00.376269,65064.38596399914,350,sag,COMPLETE
6832,0.6442843105142483,2023-10-02 12:40:22.776134,2023-10-02 12:40:23.262845,0 days 00:00:00.486711,99658.03032936773,360,sag,COMPLETE
6833,0.6133311496888305,2023-10-02 12:40:23.262845,2023-10-02 12:40:23.609081,0 days 00:00:00.346236,6.812255126939657,390,sag,COMPLETE
6834,0.5,2023-10-02 12:40:23.609081,2023-10-02 12:40:24.113673,0 days 00:00:00.504592,0.00012385000072970644,340,sag,COMPLETE
6835,0.666120755540998,2023-10-02 12:40:24.113673,2023-10-02 12:40:24.519536,0 days 00:00:00.405863,26999.37619826369,370,sag,COMPLETE
6836,0.637951741456491,2023-10-02 12:40:24.519536,2023-10-02 12:40:24.998728,0 days 00:00:00.479192,4202.129793784436,350,sag,COMPLETE
6837,0.6502893328966044,2023-10-02 12:40:24.998728,2023-10-02 12:40:25.429365,0 days 00:00:00.430637,35.608984359029755,360,sag,COMPLETE
6838,0.6418277104487389,2023-10-02 12:40:25.429365,2023-10-02 12:40:25.837328,0 days 00:00:00.407963,336.3125598648299,380,sag,COMPLETE
6839,0.649579648433235,2023-10-02 12:40:25.837328,2023-10-02 12:40:26.323826,0 days 00:00:00.486498,200.59667491984754,390,lbfgs,COMPLETE
6840,0.6520362484987444,2023-10-02 12:40:26.323826,2023-10-02 12:40:26.708552,0 days 00:00:00.384726,2370.0074519397394,340,sag,COMPLETE
6841,0.5855442733922918,2023-10-02 12:40:26.708552,2023-10-02 12:40:27.132312,0 days 00:00:00.423760,1.285814745629775,370,sag,COMPLETE
6842,0.6534556174254831,2023-10-02 12:40:27.132312,2023-10-02 12:40:27.585510,0 days 00:00:00.453198,54.51356864964884,350,sag,COMPLETE
6843,0.5,2023-10-02 12:40:27.585510,2023-10-02 12:40:28.621326,0 days 00:00:01.035816,1.602202774836063e-05,360,sag,COMPLETE
6844,0.608417949557812,2023-10-02 12:40:28.621326,2023-10-02 12:40:29.029284,0 days 00:00:00.407958,2.5921089014580687,370,sag,COMPLETE
6845,0.6449939949776177,2023-10-02 12:40:29.029284,2023-10-02 12:40:29.437530,0 days 00:00:00.408246,25393.04967905308,340,sag,COMPLETE
6846,0.669996724533246,2023-10-02 12:40:29.437530,2023-10-02 12:40:29.909382,0 days 00:00:00.471852,61755.1479288297,350,sag,COMPLETE
6847,0.6267059722677149,2023-10-02 12:40:29.909382,2023-10-02 12:40:30.332442,0 days 00:00:00.423060,9.980729945840672,360,sag,COMPLETE
6848,0.6534556174254831,2023-10-02 12:40:30.332442,2023-10-02 12:40:30.693021,0 days 00:00:00.360579,146.97107335362537,350,newton-cg,COMPLETE
6849,0.6449939949776177,2023-10-02 12:40:30.708652,2023-10-02 12:40:31.179812,0 days 00:00:00.471160,7823.481438673923,370,sag,COMPLETE
6850,0.6552025330276231,2023-10-02 12:40:31.179812,2023-10-02 12:40:31.588161,0 days 00:00:00.408349,35415.0841315904,340,sag,COMPLETE
6851,0.6488699639698657,2023-10-02 12:40:31.588161,2023-10-02 12:40:32.090713,0 days 00:00:00.502552,951.3640216926863,380,sag,COMPLETE
6852,0.6369145103177202,2023-10-02 12:40:32.090713,2023-10-02 12:40:32.514428,0 days 00:00:00.423715,21.269941518044263,380,liblinear,COMPLETE
6853,0.5,2023-10-02 12:40:32.514428,2023-10-02 12:40:32.844294,0 days 00:00:00.329866,0.10155097214862843,360,sag,COMPLETE
6854,0.6520362484987444,2023-10-02 12:40:32.844294,2023-10-02 12:40:33.330751,0 days 00:00:00.486457,18118.8644522531,370,sag,COMPLETE
6855,0.6488699639698657,2023-10-02 12:40:33.330751,2023-10-02 12:40:33.723134,0 days 00:00:00.392383,46511.24229939598,330,sag,COMPLETE
6856,0.6298722567965934,2023-10-02 12:40:33.723134,2023-10-02 12:40:34.178015,0 days 00:00:00.454881,16.662731992647863,410,sag,COMPLETE
6857,0.5,2023-10-02 12:40:34.178015,2023-10-02 12:40:34.539083,0 days 00:00:00.361068,0.031001170487866766,360,sag,COMPLETE
6858,0.6590785020198712,2023-10-02 12:40:34.539083,2023-10-02 12:40:35.025622,0 days 00:00:00.486539,4351.551056435269,400,sag,COMPLETE
6859,0.5,2023-10-02 12:40:35.025622,2023-10-02 12:40:35.464906,0 days 00:00:00.439284,0.0007458588838451089,330,sag,COMPLETE
6860,0.6069985806310733,2023-10-02 12:40:35.464906,2023-10-02 12:40:35.809446,0 days 00:00:00.344540,4.200228248932561,390,sag,COMPLETE
6861,0.637951741456491,2023-10-02 12:40:35.809446,2023-10-02 12:40:36.265161,0 days 00:00:00.455715,10992.884322116968,350,lbfgs,COMPLETE
6862,0.6449939949776177,2023-10-02 12:40:36.280788,2023-10-02 12:40:36.677115,0 days 00:00:00.396327,1663.5674280349942,430,sag,COMPLETE
6863,0.5,2023-10-02 12:40:36.677115,2023-10-02 12:40:37.100226,0 days 00:00:00.423111,0.0012975005487478484,340,sag,COMPLETE
6864,0.5,2023-10-02 12:40:37.100226,2023-10-02 12:40:37.525891,0 days 00:00:00.425665,0.005393419368147906,360,sag,COMPLETE
6865,0.5,2023-10-02 12:40:37.525891,2023-10-02 12:40:37.876886,0 days 00:00:00.350995,0.02387343481947479,370,sag,COMPLETE
6866,0.6534556174254831,2023-10-02 12:40:37.879882,2023-10-02 12:40:38.338515,0 days 00:00:00.458633,107.97535785418,350,sag,COMPLETE
6867,0.5,2023-10-02 12:40:38.340511,2023-10-02 12:40:38.682261,0 days 00:00:00.341750,0.0031044337202460162,380,sag,COMPLETE
6868,0.5,2023-10-02 12:40:38.684265,2023-10-02 12:40:39.117147,0 days 00:00:00.432882,0.06645460220976503,390,sag,COMPLETE
6869,0.6520362484987444,2023-10-02 12:40:39.119141,2023-10-02 12:40:39.629508,0 days 00:00:00.510367,23648.252567447144,420,sag,COMPLETE
6870,0.6520362484987444,2023-10-02 12:40:39.629508,2023-10-02 12:40:40.037416,0 days 00:00:00.407908,65909.38589240755,340,sag,COMPLETE
6871,0.5619609127634021,2023-10-02 12:40:40.037416,2023-10-02 12:40:40.512289,0 days 00:00:00.474873,0.8797550210447979,320,sag,COMPLETE
6872,0.6573315864177312,2023-10-02 12:40:40.512289,2023-10-02 12:40:40.857722,0 days 00:00:00.345433,38.203861777061356,360,sag,COMPLETE
6873,0.637951741456491,2023-10-02 12:40:40.857722,2023-10-02 12:40:41.312800,0 days 00:00:00.455078,5897.209076810073,380,newton-cg,COMPLETE
6874,0.6590785020198712,2023-10-02 12:40:41.312800,2023-10-02 12:40:41.737808,0 days 00:00:00.425008,44221.49458497447,440,sag,COMPLETE
6875,0.5,2023-10-02 12:40:41.739808,2023-10-02 12:40:42.216942,0 days 00:00:00.477134,0.0021071713395334093,350,sag,COMPLETE
6876,0.5,2023-10-02 12:40:42.219092,2023-10-02 12:40:42.647393,0 days 00:00:00.428301,0.00031879273022234,310,liblinear,COMPLETE
6877,0.6449939949776177,2023-10-02 12:40:42.647393,2023-10-02 12:40:43.082182,0 days 00:00:00.434789,2812.380571014669,370,sag,COMPLETE
6878,0.666120755540998,2023-10-02 12:40:43.082182,2023-10-02 12:40:43.597930,0 days 00:00:00.515748,15405.536405495344,450,sag,COMPLETE
6879,0.5,2023-10-02 12:40:43.599945,2023-10-02 12:40:43.965458,0 days 00:00:00.365513,0.01266568464720754,330,sag,COMPLETE
6880,0.6457036794409869,2023-10-02 12:40:43.965458,2023-10-02 12:40:44.451931,0 days 00:00:00.486473,243.37432418982115,450,sag,COMPLETE
6881,0.5,2023-10-02 12:40:44.451931,2023-10-02 12:40:44.880796,0 days 00:00:00.428865,0.1354158749802418,400,sag,COMPLETE
6882,0.6629544710121192,2023-10-02 12:40:44.880796,2023-10-02 12:40:45.305355,0 days 00:00:00.424559,68086.87362216797,340,sag,COMPLETE
6883,0.6590785020198712,2023-10-02 12:40:45.305355,2023-10-02 12:40:45.792009,0 days 00:00:00.486654,30397.054535511383,360,sag,COMPLETE
6884,0.6520362484987444,2023-10-02 12:40:45.792009,2023-10-02 12:40:46.195784,0 days 00:00:00.403775,8965.616416966714,350,sag,COMPLETE
6885,0.6069985806310733,2023-10-02 12:40:46.195784,2023-10-02 12:40:46.626446,0 days 00:00:00.430662,4.195051493125803,380,sag,COMPLETE
6886,0.6316191723987334,2023-10-02 12:40:46.626446,2023-10-02 12:40:47.081971,0 days 00:00:00.455525,578.1336258450746,430,lbfgs,COMPLETE
6887,0.6481602795064964,2023-10-02 12:40:47.097596,2023-10-02 12:40:47.489906,0 days 00:00:00.392310,19170.105353054234,370,sag,COMPLETE
6888,0.6020853805000546,2023-10-02 12:40:47.489906,2023-10-02 12:40:47.897958,0 days 00:00:00.408052,1.7715111542413897,350,sag,COMPLETE
6889,0.6449939949776177,2023-10-02 12:40:47.897958,2023-10-02 12:40:48.307073,0 days 00:00:00.409115,99256.83768735788,440,sag,COMPLETE
6890,0.666120755540998,2023-10-02 12:40:48.307073,2023-10-02 12:40:48.867369,0 days 00:00:00.560296,47036.49343777444,360,sag,COMPLETE
6891,0.5,2023-10-02 12:40:48.867369,2023-10-02 12:40:49.306686,0 days 00:00:00.439317,0.0002174474477936077,420,sag,COMPLETE
6892,0.6520362484987444,2023-10-02 12:40:49.322317,2023-10-02 12:40:49.699050,0 days 00:00:00.376733,3691.976361241504,330,sag,COMPLETE
6893,0.5,2023-10-02 12:40:49.714688,2023-10-02 12:40:50.184746,0 days 00:00:00.470058,0.28275956932117324,370,sag,COMPLETE
6894,0.6449939949776177,2023-10-02 12:40:50.186740,2023-10-02 12:40:50.597228,0 days 00:00:00.410488,6053.723867309265,450,sag,COMPLETE
6895,0.666120755540998,2023-10-02 12:40:50.597228,2023-10-02 12:40:51.083007,0 days 00:00:00.485779,12583.95427275429,390,sag,COMPLETE
6896,0.6590785020198712,2023-10-02 12:40:51.083007,2023-10-02 12:40:51.580800,0 days 00:00:00.497793,30961.013180033755,320,sag,COMPLETE
6897,0.5408341522000218,2023-10-02 12:40:51.582325,2023-10-02 12:40:52.029787,0 days 00:00:00.447462,0.6482788414947093,340,newton-cg,COMPLETE
6898,0.6449939949776177,2023-10-02 12:40:52.031782,2023-10-02 12:40:52.507369,0 days 00:00:00.475587,44425.75762059929,360,sag,COMPLETE
6899,0.649579648433235,2023-10-02 12:40:52.507369,2023-10-02 12:40:52.902101,0 days 00:00:00.394732,130.38530723605402,440,sag,COMPLETE
6900,0.637951741456491,2023-10-02 12:40:52.904101,2023-10-02 12:40:53.420624,0 days 00:00:00.516523,1383.4338325471551,450,sag,COMPLETE
6901,0.637951741456491,2023-10-02 12:40:53.420624,2023-10-02 12:40:53.764688,0 days 00:00:00.344064,9450.215494867261,380,liblinear,COMPLETE
6902,0.669996724533246,2023-10-02 12:40:53.764688,2023-10-02 12:40:54.295386,0 days 00:00:00.530698,22756.725785374972,410,sag,COMPLETE
6903,0.6552025330276231,2023-10-02 12:40:54.295386,2023-10-02 12:40:54.785747,0 days 00:00:00.490361,67937.83728502662,350,sag,COMPLETE
6904,0.5,2023-10-02 12:40:54.785747,2023-10-02 12:40:55.155614,0 days 00:00:00.369867,0.0004651637022468057,370,sag,COMPLETE
6905,0.6520362484987444,2023-10-02 12:40:55.155614,2023-10-02 12:40:55.645907,0 days 00:00:00.490293,2860.058584775688,340,sag,COMPLETE
6906,0.5,2023-10-02 12:40:55.645907,2023-10-02 12:40:55.982496,0 days 00:00:00.336589,0.1499985113671296,430,sag,COMPLETE
6907,0.6235396877388361,2023-10-02 12:40:55.982496,2023-10-02 12:40:56.441263,0 days 00:00:00.458767,8.66595087355803,360,sag,COMPLETE
6908,0.6520362484987444,2023-10-02 12:40:56.441263,2023-10-02 12:40:56.953926,0 days 00:00:00.512663,6245.822307964914,450,sag,COMPLETE
6909,0.5,2023-10-02 12:40:56.956945,2023-10-02 12:40:57.277888,0 days 00:00:00.320943,0.06727171269186777,350,sag,COMPLETE
6910,0.6534556174254831,2023-10-02 12:40:57.277888,2023-10-02 12:40:57.746117,0 days 00:00:00.468229,79.01279510857827,400,sag,COMPLETE
6911,0.637951741456491,2023-10-02 12:40:57.746117,2023-10-02 12:40:58.135038,0 days 00:00:00.388921,16264.96660552539,460,lbfgs,COMPLETE
6912,0.6520362484987444,2023-10-02 12:40:58.135038,2023-10-02 12:40:58.616101,0 days 00:00:00.481063,33163.92234879087,300,sag,COMPLETE
6913,0.6337482257888415,2023-10-02 12:40:58.619101,2023-10-02 12:40:59.031377,0 days 00:00:00.412276,14.538773361032517,370,sag,COMPLETE
6914,0.634075772464243,2023-10-02 12:40:59.043356,2023-10-02 12:40:59.441123,0 days 00:00:00.397767,69165.21515135038,330,sag,COMPLETE
6915,0.528169014084507,2023-10-02 12:40:59.441123,2023-10-02 12:40:59.860195,0 days 00:00:00.419072,0.4639258011174193,450,sag,COMPLETE
6916,0.5,2023-10-02 12:40:59.872223,2023-10-02 12:41:00.844777,0 days 00:00:00.972554,1.848169705252579e-05,440,sag,COMPLETE
6917,0.5,2023-10-02 12:41:00.844777,2023-10-02 12:41:01.272749,0 days 00:00:00.427972,0.0024571912201076162,360,sag,COMPLETE
6918,0.6449939949776177,2023-10-02 12:41:01.272749,2023-10-02 12:41:01.672897,0 days 00:00:00.400148,11604.796000390748,340,sag,COMPLETE
6919,0.6534556174254831,2023-10-02 12:41:01.672897,2023-10-02 12:41:02.118650,0 days 00:00:00.445753,41.28024741671884,380,sag,COMPLETE
6920,0.5,2023-10-02 12:41:02.120650,2023-10-02 12:41:03.009325,0 days 00:00:00.888675,2.6723951045619913e-05,350,sag,COMPLETE
6921,0.6520362484987444,2023-10-02 12:41:03.010621,2023-10-02 12:41:03.413628,0 days 00:00:00.403007,98456.36630240014,390,sag,COMPLETE
6922,0.6418277104487389,2023-10-02 12:41:03.413628,2023-10-02 12:41:03.900758,0 days 00:00:00.487130,348.66523212262217,360,sag,COMPLETE
6923,0.5313352986133857,2023-10-02 12:41:03.900758,2023-10-02 12:41:04.244423,0 days 00:00:00.343665,0.5364040813176645,460,sag,COMPLETE
6924,0.5,2023-10-02 12:41:04.244423,2023-10-02 12:41:04.669001,0 days 00:00:00.424578,6.019526625453989e-05,320,newton-cg,COMPLETE
6925,0.6520362484987444,2023-10-02 12:41:04.669001,2023-10-02 12:41:05.169871,0 days 00:00:00.500870,1932.716807026179,310,sag,COMPLETE
6926,0.6629544710121192,2023-10-02 12:41:05.169871,2023-10-02 12:41:05.635331,0 days 00:00:00.465460,22946.907080964942,340,sag,COMPLETE
6927,0.5,2023-10-02 12:41:05.650955,2023-10-02 12:41:06.090425,0 days 00:00:00.439470,0.024045873132049467,370,sag,COMPLETE
6928,0.6309094879353642,2023-10-02 12:41:06.090425,2023-10-02 12:41:06.440495,0 days 00:00:00.350070,4348.277773215043,420,liblinear,COMPLETE
6929,0.6449939949776177,2023-10-02 12:41:06.440495,2023-10-02 12:41:06.945849,0 days 00:00:00.505354,971.7841403341815,440,sag,COMPLETE
6930,0.6520362484987444,2023-10-02 12:41:06.945849,2023-10-02 12:41:07.473301,0 days 00:00:00.527452,44514.32313317946,430,sag,COMPLETE
6931,0.5,2023-10-02 12:41:07.473301,2023-10-02 12:41:08.046567,0 days 00:00:00.573266,4.9875498270943636e-05,330,sag,COMPLETE
6932,0.6520362484987444,2023-10-02 12:41:08.046567,2023-10-02 12:41:08.611731,0 days 00:00:00.565164,7993.5886121379235,460,sag,COMPLETE
6933,0.6534556174254831,2023-10-02 12:41:08.611731,2023-10-02 12:41:08.962953,0 days 00:00:00.351222,54.57967111908697,380,sag,COMPLETE
6934,0.6590785020198712,2023-10-02 12:41:08.974472,2023-10-02 12:41:09.469233,0 days 00:00:00.494761,33291.75535443184,370,sag,COMPLETE
6935,0.6629544710121192,2023-10-02 12:41:09.471226,2023-10-02 12:41:09.916093,0 days 00:00:00.444867,15053.405524841088,450,sag,COMPLETE
6936,0.637951741456491,2023-10-02 12:41:09.916093,2023-10-02 12:41:10.400798,0 days 00:00:00.484705,62271.09624674752,360,lbfgs,COMPLETE
6937,0.6629544710121192,2023-10-02 12:41:10.400798,2023-10-02 12:41:10.898975,0 days 00:00:00.498177,23383.984132653663,350,sag,COMPLETE
6938,0.6520362484987444,2023-10-02 12:41:10.898975,2023-10-02 12:41:11.313806,0 days 00:00:00.414831,5012.36743960294,460,sag,COMPLETE
6939,0.5,2023-10-02 12:41:11.313806,2023-10-02 12:41:11.766040,0 days 00:00:00.452234,0.00820606457547551,440,sag,COMPLETE
6940,0.5,2023-10-02 12:41:11.766040,2023-10-02 12:41:12.148234,0 days 00:00:00.382194,0.00018766060229769206,340,sag,COMPLETE
6941,0.6590785020198712,2023-10-02 12:41:12.163875,2023-10-02 12:41:12.678891,0 days 00:00:00.515016,99624.88164350975,350,sag,COMPLETE
6942,0.6590785020198712,2023-10-02 12:41:12.678891,2023-10-02 12:41:13.196616,0 days 00:00:00.517725,50627.97810832168,450,sag,COMPLETE
6943,0.6069985806310733,2023-10-02 12:41:13.199365,2023-10-02 12:41:13.553000,0 days 00:00:00.353635,4.378900904744621,370,sag,COMPLETE
6944,0.6059613494923026,2023-10-02 12:41:13.553000,2023-10-02 12:41:14.024782,0 days 00:00:00.471782,1.6059653366015725,360,sag,COMPLETE
6945,0.6267059722677149,2023-10-02 12:41:14.040399,2023-10-02 12:41:14.390141,0 days 00:00:00.349742,11.725155389776072,380,sag,COMPLETE
6946,0.5,2023-10-02 12:41:14.392135,2023-10-02 12:41:14.829283,0 days 00:00:00.437148,0.06748365382547715,330,sag,COMPLETE
6947,0.6590785020198712,2023-10-02 12:41:14.832076,2023-10-02 12:41:15.331402,0 days 00:00:00.499326,99551.05161264422,460,sag,COMPLETE
6948,0.5,2023-10-02 12:41:15.333298,2023-10-02 12:41:15.682132,0 days 00:00:00.348834,0.00010889982267143228,360,newton-cg,COMPLETE
6949,0.6520362484987444,2023-10-02 12:41:15.682132,2023-10-02 12:41:16.201551,0 days 00:00:00.519419,3030.3671901369025,440,sag,COMPLETE
6950,0.6534556174254831,2023-10-02 12:41:16.203551,2023-10-02 12:41:16.593095,0 days 00:00:00.389544,113.07001064797385,370,sag,COMPLETE
6951,0.666120755540998,2023-10-02 12:41:16.593095,2023-10-02 12:41:17.100556,0 days 00:00:00.507461,10158.713526765536,430,sag,COMPLETE
6952,0.637951741456491,2023-10-02 12:41:17.101364,2023-10-02 12:41:17.457001,0 days 00:00:00.355637,33628.7884998271,340,liblinear,COMPLETE
6953,0.6418277104487389,2023-10-02 12:41:17.459001,2023-10-02 12:41:17.966523,0 days 00:00:00.507522,503.5458044061677,460,sag,COMPLETE
6954,0.666120755540998,2023-10-02 12:41:17.966523,2023-10-02 12:41:18.527405,0 days 00:00:00.560882,18471.614264091953,410,sag,COMPLETE
6955,0.5,2023-10-02 12:41:18.527405,2023-10-02 12:41:18.935345,0 days 00:00:00.407940,0.0007904800106427348,450,sag,COMPLETE
6956,0.637951741456491,2023-10-02 12:41:18.935345,2023-10-02 12:41:19.546881,0 days 00:00:00.611536,1764.9605459899549,350,sag,COMPLETE
6957,0.6590785020198712,2023-10-02 12:41:19.562510,2023-10-02 12:41:19.988080,0 days 00:00:00.425570,48607.92764838356,460,sag,COMPLETE
6958,0.6449939949776177,2023-10-02 12:41:19.988080,2023-10-02 12:41:20.519964,0 days 00:00:00.531884,7375.104072646722,370,sag,COMPLETE
6959,0.608417949557812,2023-10-02 12:41:20.519964,2023-10-02 12:41:21.036161,0 days 00:00:00.516197,2.664123849265372,390,sag,COMPLETE
6960,0.5,2023-10-02 12:41:21.053003,2023-10-02 12:41:22.875982,0 days 00:00:01.822979,1.0311737089063647e-05,320,sag,COMPLETE
6961,0.6552025330276231,2023-10-02 12:41:22.877993,2023-10-02 12:41:23.402043,0 days 00:00:00.524050,15147.637983453935,350,sag,COMPLETE
6962,0.637951741456491,2023-10-02 12:41:23.417682,2023-10-02 12:41:23.810374,0 days 00:00:00.392692,28909.796214683593,360,lbfgs,COMPLETE
6963,0.6629544710121192,2023-10-02 12:41:23.810374,2023-10-02 12:41:24.319405,0 days 00:00:00.509031,65203.43721955832,450,sag,COMPLETE
6964,0.6369145103177202,2023-10-02 12:41:24.319405,2023-10-02 12:41:24.758066,0 days 00:00:00.438661,22.44088619094162,380,sag,COMPLETE
6965,0.6062888961677039,2023-10-02 12:41:24.758066,2023-10-02 12:41:25.109566,0 days 00:00:00.351500,6.320205360925907,340,sag,COMPLETE
6966,0.6520362484987444,2023-10-02 12:41:25.111559,2023-10-02 12:41:25.619972,0 days 00:00:00.508413,4661.658995717888,400,sag,COMPLETE
6967,0.666120755540998,2023-10-02 12:41:25.619972,2023-10-02 12:41:26.136499,0 days 00:00:00.516527,10399.978747330619,440,sag,COMPLETE
6968,0.637951741456491,2023-10-02 12:41:26.136499,2023-10-02 12:41:26.705542,0 days 00:00:00.569043,23608.745449793798,460,sag,COMPLETE
6969,0.5,2023-10-02 12:41:26.705881,2023-10-02 12:41:27.198976,0 days 00:00:00.493095,0.0002902871733095353,420,sag,COMPLETE
6970,0.6449939949776177,2023-10-02 12:41:27.198976,2023-10-02 12:41:27.621656,0 days 00:00:00.422680,48213.112680786355,360,sag,COMPLETE
6971,0.6590785020198712,2023-10-02 12:41:27.638103,2023-10-02 12:41:28.138202,0 days 00:00:00.500099,2955.4518561999125,380,sag,COMPLETE
6972,0.5,2023-10-02 12:41:28.154877,2023-10-02 12:41:28.505104,0 days 00:00:00.350227,0.0025973410474083546,390,sag,COMPLETE
6973,0.637951741456491,2023-10-02 12:41:28.521041,2023-10-02 12:41:29.023979,0 days 00:00:00.502938,1092.9848024283792,350,sag,COMPLETE
6974,0.6457036794409869,2023-10-02 12:41:29.023979,2023-10-02 12:41:29.472500,0 days 00:00:00.448521,303.38091019863936,330,liblinear,COMPLETE
6975,0.637951741456491,2023-10-02 12:41:29.472500,2023-10-02 12:41:29.855746,0 days 00:00:00.383246,6562.2237280971285,450,newton-cg,COMPLETE
6976,0.6629544710121192,2023-10-02 12:41:29.855746,2023-10-02 12:41:30.355844,0 days 00:00:00.500098,30273.770819051642,300,sag,COMPLETE
6977,0.6590785020198712,2023-10-02 12:41:30.355844,2023-10-02 12:41:30.789260,0 days 00:00:00.433416,15151.69094585547,350,sag,COMPLETE
6978,0.6411180259853696,2023-10-02 12:41:30.789260,2023-10-02 12:41:31.306973,0 days 00:00:00.517713,44800.427598250324,370,sag,COMPLETE
6979,0.6534556174254831,2023-10-02 12:41:31.306973,2023-10-02 12:41:31.773206,0 days 00:00:00.466233,71.18154044151372,440,sag,COMPLETE
6980,0.6520362484987444,2023-10-02 12:41:31.773206,2023-10-02 12:41:32.242100,0 days 00:00:00.468894,68561.94453761738,460,sag,COMPLETE
6981,0.6520362484987444,2023-10-02 12:41:32.242100,2023-10-02 12:41:32.773648,0 days 00:00:00.531548,9128.873345486474,460,sag,COMPLETE
6982,0.5,2023-10-02 12:41:32.773648,2023-10-02 12:41:33.124365,0 days 00:00:00.350717,0.24089007544706748,330,sag,COMPLETE
6983,0.5,2023-10-02 12:41:33.124365,2023-10-02 12:41:33.557374,0 days 00:00:00.433009,0.031325947347866076,370,sag,COMPLETE
6984,0.6449939949776177,2023-10-02 12:41:33.557374,2023-10-02 12:41:34.107065,0 days 00:00:00.549691,19792.08365274398,430,sag,COMPLETE
6985,0.5,2023-10-02 12:41:34.107619,2023-10-02 12:41:34.534905,0 days 00:00:00.427286,0.17484551473126075,340,lbfgs,COMPLETE
6986,0.6552025330276231,2023-10-02 12:41:34.540043,2023-10-02 12:41:35.079545,0 days 00:00:00.539502,5034.058520846039,410,sag,COMPLETE
6987,0.6481602795064964,2023-10-02 12:41:35.081545,2023-10-02 12:41:35.508799,0 days 00:00:00.427254,34645.88088242271,380,sag,COMPLETE
6988,0.637951741456491,2023-10-02 12:41:35.509832,2023-10-02 12:41:36.018970,0 days 00:00:00.509138,597.2458441079983,360,sag,COMPLETE
6989,0.6552025330276231,2023-10-02 12:41:36.018970,2023-10-02 12:41:36.521432,0 days 00:00:00.502462,67916.94777481421,360,sag,COMPLETE
6990,0.5,2023-10-02 12:41:36.523431,2023-10-02 12:41:36.891972,0 days 00:00:00.368541,0.0012637501118065882,450,sag,COMPLETE
6991,0.6629544710121192,2023-10-02 12:41:36.891972,2023-10-02 12:41:37.387442,0 days 00:00:00.495470,12392.28453718291,350,sag,COMPLETE
6992,0.6457036794409869,2023-10-02 12:41:37.403070,2023-10-02 12:41:37.894543,0 days 00:00:00.491473,205.16348321141461,430,sag,COMPLETE
