number,value,datetime_start,datetime_complete,duration,params_C,params_max_iter,params_solver,state
2595,0.6520362484987444,2023-10-02 12:16:40.878933,2023-10-02 12:16:41.089697,0 days 00:00:00.210764,61307.13605158623,470,sag,COMPLETE
2596,0.6520362484987444,2023-10-02 12:16:41.091690,2023-10-02 12:16:41.374849,0 days 00:00:00.283159,6213.269517227619,490,sag,COMPLETE
2597,0.6590785020198712,2023-10-02 12:16:41.375848,2023-10-02 12:16:41.598365,0 days 00:00:00.222517,15329.471403178497,500,saga,COMPLETE
2598,0.6590785020198712,2023-10-02 12:16:41.599361,2023-10-02 12:16:41.813567,0 days 00:00:00.214206,3593.241216040741,480,sag,COMPLETE
2599,0.6520362484987444,2023-10-02 12:16:41.814566,2023-10-02 12:16:42.031894,0 days 00:00:00.217328,9484.387946885494,490,sag,COMPLETE
2600,0.5,2023-10-02 12:16:42.032893,2023-10-02 12:16:42.167938,0 days 00:00:00.135045,0.010784053790364479,470,sag,COMPLETE
2601,0.6449939949776177,2023-10-02 12:16:42.168934,2023-10-02 12:16:42.381381,0 days 00:00:00.212447,1477.7838041591408,490,sag,COMPLETE
2602,0.6534556174254831,2023-10-02 12:16:42.382384,2023-10-02 12:16:42.615664,0 days 00:00:00.233280,46.92748036194043,500,saga,COMPLETE
2603,0.5,2023-10-02 12:16:42.616662,2023-10-02 12:16:42.749322,0 days 00:00:00.132660,0.0022431757167390804,480,sag,COMPLETE
2604,0.6590785020198712,2023-10-02 12:16:42.750321,2023-10-02 12:16:42.959943,0 days 00:00:00.209622,29232.367556166355,460,sag,COMPLETE
2605,0.6520362484987444,2023-10-02 12:16:42.960945,2023-10-02 12:16:43.169738,0 days 00:00:00.208793,2397.661674059921,500,sag,COMPLETE
2606,0.643956763838847,2023-10-02 12:16:43.170740,2023-10-02 12:16:43.304509,0 days 00:00:00.133769,24.880067501633615,490,sag,COMPLETE
2607,0.6481602795064964,2023-10-02 12:16:43.305501,2023-10-02 12:16:43.594130,0 days 00:00:00.288629,5081.0284974046945,480,saga,COMPLETE
2608,0.5,2023-10-02 12:16:43.595129,2023-10-02 12:16:43.720367,0 days 00:00:00.125238,0.181558118187975,490,sag,COMPLETE
2609,0.6590785020198712,2023-10-02 12:16:43.721360,2023-10-02 12:16:43.933909,0 days 00:00:00.212549,49170.614724434374,450,sag,COMPLETE
2610,0.637951741456491,2023-10-02 12:16:43.934919,2023-10-02 12:16:44.108610,0 days 00:00:00.173691,19214.629705077652,500,lbfgs,COMPLETE
2611,0.5,2023-10-02 12:16:44.109607,2023-10-02 12:16:44.250859,0 days 00:00:00.141252,0.012564793566414137,470,sag,COMPLETE
2612,0.6590785020198712,2023-10-02 12:16:44.251858,2023-10-02 12:16:44.458824,0 days 00:00:00.206966,8613.839534754714,490,sag,COMPLETE
2613,0.6520362484987444,2023-10-02 12:16:44.460136,2023-10-02 12:16:44.743879,0 days 00:00:00.283743,13794.8300723624,380,saga,COMPLETE
2614,0.5,2023-10-02 12:16:44.744971,2023-10-02 12:16:44.871552,0 days 00:00:00.126581,0.02982723431576081,480,sag,COMPLETE
2615,0.6534556174254831,2023-10-02 12:16:44.872552,2023-10-02 12:16:45.027192,0 days 00:00:00.154640,72.7255655408031,500,sag,COMPLETE
2616,0.6520362484987444,2023-10-02 12:16:45.028192,2023-10-02 12:16:45.230545,0 days 00:00:00.202353,3425.957485408769,430,sag,COMPLETE
2617,0.637951741456491,2023-10-02 12:16:45.231542,2023-10-02 12:16:45.388894,0 days 00:00:00.157352,6752.891934174743,490,newton-cg,COMPLETE
2618,0.637951741456491,2023-10-02 12:16:45.389894,2023-10-02 12:16:45.603343,0 days 00:00:00.213449,694.3208993707091,480,sag,COMPLETE
2619,0.5,2023-10-02 12:16:45.604343,2023-10-02 12:16:45.800389,0 days 00:00:00.196046,0.0002188657076200826,500,liblinear,COMPLETE
2620,0.649579648433235,2023-10-02 12:16:45.801388,2023-10-02 12:16:45.975583,0 days 00:00:00.174195,141.77308121933243,470,sag,COMPLETE
2621,0.6520362484987444,2023-10-02 12:16:45.976581,2023-10-02 12:16:46.194427,0 days 00:00:00.217846,26426.74208042831,490,saga,COMPLETE
2622,0.6559122174909924,2023-10-02 12:16:46.195565,2023-10-02 12:16:46.413319,0 days 00:00:00.217754,73805.47907289185,500,sag,COMPLETE
2623,0.6298722567965934,2023-10-02 12:16:46.414326,2023-10-02 12:16:46.550323,0 days 00:00:00.135997,16.357778234105037,480,sag,COMPLETE
2624,0.6552025330276231,2023-10-02 12:16:46.551324,2023-10-02 12:16:46.765375,0 days 00:00:00.214051,11613.7475009518,490,sag,COMPLETE
2625,0.6520362484987444,2023-10-02 12:16:46.766379,2023-10-02 12:16:47.049602,0 days 00:00:00.283223,40632.40953656117,450,sag,COMPLETE
2626,0.6337482257888415,2023-10-02 12:16:47.050605,2023-10-02 12:16:47.188535,0 days 00:00:00.137930,13.116330637948534,460,saga,COMPLETE
2627,0.6481602795064964,2023-10-02 12:16:47.189586,2023-10-02 12:16:47.386308,0 days 00:00:00.196722,19128.125961287995,390,sag,COMPLETE
2628,0.6590785020198712,2023-10-02 12:16:47.387308,2023-10-02 12:16:47.611567,0 days 00:00:00.224259,4887.422772250674,500,sag,COMPLETE
2629,0.6590785020198712,2023-10-02 12:16:47.612566,2023-10-02 12:16:47.822522,0 days 00:00:00.209956,2410.22238447086,480,sag,COMPLETE
2630,0.5943334425155585,2023-10-02 12:16:47.823522,2023-10-02 12:16:48.023625,0 days 00:00:00.200103,2.0755575311446184,500,sag,COMPLETE
2631,0.6449939949776177,2023-10-02 12:16:48.024625,2023-10-02 12:16:48.239843,0 days 00:00:00.215218,9024.330626515071,470,saga,COMPLETE
2632,0.5408341522000218,2023-10-02 12:16:48.240930,2023-10-02 12:16:48.372529,0 days 00:00:00.131599,0.6693617865726184,490,sag,COMPLETE
2633,0.6449939949776177,2023-10-02 12:16:48.373529,2023-10-02 12:16:48.584335,0 days 00:00:00.210806,1231.986151840509,480,sag,COMPLETE
2634,0.5,2023-10-02 12:16:48.586337,2023-10-02 12:16:48.711266,0 days 00:00:00.124929,0.01537735372900615,490,sag,COMPLETE
2635,0.5,2023-10-02 12:16:48.712272,2023-10-02 12:16:48.846801,0 days 00:00:00.134529,5.717685431203689e-05,500,lbfgs,COMPLETE
2636,0.5792117043345343,2023-10-02 12:16:48.847798,2023-10-02 12:16:48.977474,0 days 00:00:00.129676,1.1250700153887119,420,sag,COMPLETE
2637,0.6069985806310733,2023-10-02 12:16:48.979472,2023-10-02 12:16:49.178699,0 days 00:00:00.199227,4.946038017341264,470,sag,COMPLETE
2638,0.6590785020198712,2023-10-02 12:16:49.179692,2023-10-02 12:16:49.403322,0 days 00:00:00.223630,5388.939705136963,490,saga,COMPLETE
2639,0.6590785020198712,2023-10-02 12:16:49.404321,2023-10-02 12:16:49.616522,0 days 00:00:00.212201,15323.983617937514,480,sag,COMPLETE
2640,0.5,2023-10-02 12:16:49.617522,2023-10-02 12:16:49.763147,0 days 00:00:00.145625,0.0013822615019882581,500,sag,COMPLETE
2641,0.6418277104487389,2023-10-02 12:16:49.764149,2023-10-02 12:16:49.997741,0 days 00:00:00.233592,466.7359390263459,490,sag,COMPLETE
2642,0.637951741456491,2023-10-02 12:16:49.998743,2023-10-02 12:16:50.152356,0 days 00:00:00.153613,31267.197191486975,500,newton-cg,COMPLETE
2643,0.6418277104487389,2023-10-02 12:16:50.153350,2023-10-02 12:16:50.409057,0 days 00:00:00.255707,286.9769802816814,480,sag,COMPLETE
2644,0.5,2023-10-02 12:16:50.410057,2023-10-02 12:16:50.575188,0 days 00:00:00.165131,0.00262113360551302,460,saga,COMPLETE
2645,0.5,2023-10-02 12:16:50.576196,2023-10-02 12:16:50.709633,0 days 00:00:00.133437,0.15325305840097703,470,sag,COMPLETE
2646,0.6309094879353642,2023-10-02 12:16:50.710636,2023-10-02 12:16:50.838133,0 days 00:00:00.127497,3641.344752233607,490,liblinear,COMPLETE
2647,0.5,2023-10-02 12:16:50.839126,2023-10-02 12:16:51.024341,0 days 00:00:00.185215,0.00015331268179294744,500,sag,COMPLETE
2648,0.6590785020198712,2023-10-02 12:16:51.025341,2023-10-02 12:16:51.313051,0 days 00:00:00.287710,8092.030266727689,480,sag,COMPLETE
2649,0.5,2023-10-02 12:16:51.314051,2023-10-02 12:16:51.543932,0 days 00:00:00.229881,0.00010456332903436861,490,sag,COMPLETE
2650,0.6552025330276231,2023-10-02 12:16:51.544934,2023-10-02 12:16:51.747144,0 days 00:00:00.202210,21448.41146357226,410,saga,COMPLETE
2651,0.669996724533246,2023-10-02 12:16:51.748144,2023-10-02 12:16:51.960962,0 days 00:00:00.212818,60767.07140735962,500,sag,COMPLETE
2652,0.666120755540998,2023-10-02 12:16:51.961969,2023-10-02 12:16:52.174876,0 days 00:00:00.212907,66871.45806511395,490,sag,COMPLETE
2653,0.6590785020198712,2023-10-02 12:16:52.175875,2023-10-02 12:16:52.386961,0 days 00:00:00.211086,76245.06918916263,470,sag,COMPLETE
2654,0.666120755540998,2023-10-02 12:16:52.387959,2023-10-02 12:16:52.677144,0 days 00:00:00.289185,72116.2244563808,500,sag,COMPLETE
2655,0.666120755540998,2023-10-02 12:16:52.679142,2023-10-02 12:16:52.863471,0 days 00:00:00.184329,39861.62695020819,340,sag,COMPLETE
2656,0.6520362484987444,2023-10-02 12:16:52.864469,2023-10-02 12:16:53.078178,0 days 00:00:00.213709,24038.595698892586,480,saga,COMPLETE
2657,0.6590785020198712,2023-10-02 12:16:53.079180,2023-10-02 12:16:53.296728,0 days 00:00:00.217548,57577.10978763416,500,sag,COMPLETE
2658,0.5,2023-10-02 12:16:53.297717,2023-10-02 12:16:53.816526,0 days 00:00:00.518809,3.2834498230477557e-05,480,sag,COMPLETE
2659,0.6520362484987444,2023-10-02 12:16:53.817528,2023-10-02 12:16:54.116273,0 days 00:00:00.298745,86652.10966401375,490,sag,COMPLETE
2660,0.666120755540998,2023-10-02 12:16:54.117276,2023-10-02 12:16:54.337159,0 days 00:00:00.219883,57863.22334458786,490,sag,COMPLETE
2661,0.6481602795064964,2023-10-02 12:16:54.338173,2023-10-02 12:16:54.548850,0 days 00:00:00.210677,49183.04699549501,440,saga,COMPLETE
2662,0.637951741456491,2023-10-02 12:16:54.549848,2023-10-02 12:16:54.719475,0 days 00:00:00.169627,78468.15862843754,500,lbfgs,COMPLETE
2663,0.6449939949776177,2023-10-02 12:16:54.720474,2023-10-02 12:16:54.934400,0 days 00:00:00.213926,35137.919477807634,480,sag,COMPLETE
2664,0.6590785020198712,2023-10-02 12:16:54.935400,2023-10-02 12:16:55.226313,0 days 00:00:00.290913,48616.475144086464,500,sag,COMPLETE
2665,0.6520362484987444,2023-10-02 12:16:55.227320,2023-10-02 12:16:55.447661,0 days 00:00:00.220341,47827.20207622133,490,sag,COMPLETE
2666,0.5,2023-10-02 12:16:55.448660,2023-10-02 12:16:55.575250,0 days 00:00:00.126590,0.3236259561594797,470,sag,COMPLETE
2667,0.5,2023-10-02 12:16:55.576243,2023-10-02 12:16:55.910918,0 days 00:00:00.334675,6.998506905470834e-05,450,saga,COMPLETE
2668,0.6590785020198712,2023-10-02 12:16:55.911918,2023-10-02 12:16:56.121291,0 days 00:00:00.209373,79952.10081912078,460,sag,COMPLETE
2669,0.6449939949776177,2023-10-02 12:16:56.122411,2023-10-02 12:16:56.276939,0 days 00:00:00.154528,97875.33293870161,490,newton-cg,COMPLETE
2670,0.6270335189431162,2023-10-02 12:16:56.277939,2023-10-02 12:16:56.506458,0 days 00:00:00.228519,40109.95139513009,500,sag,COMPLETE
2671,0.6520362484987444,2023-10-02 12:16:56.507455,2023-10-02 12:16:56.720504,0 days 00:00:00.213049,34584.74054718126,480,sag,COMPLETE
2672,0.5,2023-10-02 12:16:56.721498,2023-10-02 12:16:56.922795,0 days 00:00:00.201297,0.12138534689021706,490,sag,COMPLETE
2673,0.637951741456491,2023-10-02 12:16:56.923795,2023-10-02 12:16:57.050407,0 days 00:00:00.126612,95359.74669976017,470,liblinear,COMPLETE
2674,0.6069985806310733,2023-10-02 12:16:57.051406,2023-10-02 12:16:57.188951,0 days 00:00:00.137545,4.59327388815307,480,saga,COMPLETE
2675,0.6203734032099574,2023-10-02 12:16:57.189952,2023-10-02 12:16:57.322776,0 days 00:00:00.132824,7.856828391416378,500,sag,COMPLETE
2676,0.6520362484987444,2023-10-02 12:16:57.323778,2023-10-02 12:16:57.542852,0 days 00:00:00.219074,54305.90322917278,490,sag,COMPLETE
2677,0.5,2023-10-02 12:16:57.543928,2023-10-02 12:16:57.701396,0 days 00:00:00.157468,0.0004590426674502802,500,sag,COMPLETE
2678,0.6590785020198712,2023-10-02 12:16:57.702402,2023-10-02 12:16:57.914594,0 days 00:00:00.212192,28397.294303804752,480,sag,COMPLETE
2679,0.6449939949776177,2023-10-02 12:16:57.915597,2023-10-02 12:16:58.202465,0 days 00:00:00.286868,35623.115893043345,490,sag,COMPLETE
2680,0.608417949557812,2023-10-02 12:16:58.203538,2023-10-02 12:16:58.351812,0 days 00:00:00.148274,2.7537864945735806,500,saga,COMPLETE
2681,0.649579648433235,2023-10-02 12:16:58.352809,2023-10-02 12:16:58.573772,0 days 00:00:00.220963,152.29511893232743,460,sag,COMPLETE
2682,0.6457036794409869,2023-10-02 12:16:58.574774,2023-10-02 12:16:58.750924,0 days 00:00:00.176150,189.96133537825543,480,sag,COMPLETE
2683,0.6449939949776177,2023-10-02 12:16:58.751929,2023-10-02 12:16:58.972460,0 days 00:00:00.220531,824.9793990567822,490,sag,COMPLETE
2684,0.6520362484987444,2023-10-02 12:16:58.973456,2023-10-02 12:16:59.189725,0 days 00:00:00.216269,1554.1519990045497,500,sag,COMPLETE
2685,0.5,2023-10-02 12:16:59.190736,2023-10-02 12:16:59.439084,0 days 00:00:00.248348,0.005460565252378345,470,saga,COMPLETE
2686,0.6520362484987444,2023-10-02 12:16:59.440099,2023-10-02 12:16:59.659018,0 days 00:00:00.218919,99573.84159419601,490,sag,COMPLETE
2687,0.6520362484987444,2023-10-02 12:16:59.660020,2023-10-02 12:16:59.879801,0 days 00:00:00.219781,23502.19152252584,500,sag,COMPLETE
2688,0.6238672344142374,2023-10-02 12:16:59.881798,2023-10-02 12:17:00.073711,0 days 00:00:00.191913,1819.2227529779088,480,lbfgs,COMPLETE
2689,0.6411180259853696,2023-10-02 12:17:00.074718,2023-10-02 12:17:00.313599,0 days 00:00:00.238881,39365.70536778138,490,sag,COMPLETE
2690,0.5,2023-10-02 12:17:00.314599,2023-10-02 12:17:00.446961,0 days 00:00:00.132362,0.00540642382920724,470,sag,COMPLETE
2691,0.6520362484987444,2023-10-02 12:17:00.448958,2023-10-02 12:17:00.742066,0 days 00:00:00.293108,18891.523227888083,480,saga,COMPLETE
2692,0.5,2023-10-02 12:17:00.743148,2023-10-02 12:17:00.873058,0 days 00:00:00.129910,0.033314088301907754,500,sag,COMPLETE
2693,0.6520362484987444,2023-10-02 12:17:00.874050,2023-10-02 12:17:01.095618,0 days 00:00:00.221568,2406.364167010689,490,sag,COMPLETE
2694,0.5,2023-10-02 12:17:01.096615,2023-10-02 12:17:01.236331,0 days 00:00:00.139716,0.05317254363956214,480,sag,COMPLETE
2695,0.6534556174254831,2023-10-02 12:17:01.237331,2023-10-02 12:17:01.396039,0 days 00:00:00.158708,58.754444833281724,500,newton-cg,COMPLETE
2696,0.643956763838847,2023-10-02 12:17:01.397036,2023-10-02 12:17:01.538566,0 days 00:00:00.141530,25.316078371572935,490,sag,COMPLETE
2697,0.6552025330276231,2023-10-02 12:17:01.539565,2023-10-02 12:17:01.765207,0 days 00:00:00.225642,52217.10944973799,470,saga,COMPLETE
2698,0.5,2023-10-02 12:17:01.766206,2023-10-02 12:17:01.964946,0 days 00:00:00.198740,0.10121636586586762,500,sag,COMPLETE
2699,0.5,2023-10-02 12:17:01.965952,2023-10-02 12:17:02.092005,0 days 00:00:00.126053,0.23635202368786937,430,liblinear,COMPLETE
2700,0.5855442733922918,2023-10-02 12:17:02.093004,2023-10-02 12:17:02.229580,0 days 00:00:00.136576,1.3172507617219233,360,sag,COMPLETE
2701,0.6418277104487389,2023-10-02 12:17:02.230580,2023-10-02 12:17:02.446533,0 days 00:00:00.215953,570.4315333764271,490,sag,COMPLETE
2702,0.6267059722677149,2023-10-02 12:17:02.447524,2023-10-02 12:17:02.587205,0 days 00:00:00.139681,13.260664281467863,480,sag,COMPLETE
2703,0.6552025330276231,2023-10-02 12:17:02.588205,2023-10-02 12:17:02.798969,0 days 00:00:00.210764,27162.689551016018,450,sag,COMPLETE
2704,0.6449939949776177,2023-10-02 12:17:02.799967,2023-10-02 12:17:03.018477,0 days 00:00:00.218510,15639.283274484675,500,saga,COMPLETE
2705,0.5,2023-10-02 12:17:03.019476,2023-10-02 12:17:03.786125,0 days 00:00:00.766649,1.830564207312513e-05,460,sag,COMPLETE
2706,0.5,2023-10-02 12:17:03.787127,2023-10-02 12:17:04.338249,0 days 00:00:00.551122,3.6803256412459116e-05,490,sag,COMPLETE
2707,0.6534556174254831,2023-10-02 12:17:04.339250,2023-10-02 12:17:04.497304,0 days 00:00:00.158054,95.32212177588205,470,sag,COMPLETE
2708,0.6590785020198712,2023-10-02 12:17:04.498298,2023-10-02 12:17:04.721335,0 days 00:00:00.223037,3770.496844279993,480,sag,COMPLETE
2709,0.6552025330276231,2023-10-02 12:17:04.722334,2023-10-02 12:17:04.909975,0 days 00:00:00.187641,55523.047045850566,320,saga,COMPLETE
2710,0.6502893328966044,2023-10-02 12:17:04.910974,2023-10-02 12:17:05.057564,0 days 00:00:00.146590,36.246469221430544,500,sag,COMPLETE
2711,0.6520362484987444,2023-10-02 12:17:05.058568,2023-10-02 12:17:05.281994,0 days 00:00:00.223426,2736.849782807469,490,sag,COMPLETE
2712,0.5,2023-10-02 12:17:05.282996,2023-10-02 12:17:05.498829,0 days 00:00:00.215833,0.0010412498404371168,500,sag,COMPLETE
2713,0.637951741456491,2023-10-02 12:17:05.499831,2023-10-02 12:17:05.685466,0 days 00:00:00.185635,12623.808309242673,480,lbfgs,COMPLETE
2714,0.669996724533246,2023-10-02 12:17:05.686524,2023-10-02 12:17:05.907178,0 days 00:00:00.220654,98483.16155239948,490,sag,COMPLETE
2715,0.6590785020198712,2023-10-02 12:17:05.908178,2023-10-02 12:17:06.124791,0 days 00:00:00.216613,76195.0675946464,490,saga,COMPLETE
2716,0.6590785020198712,2023-10-02 12:17:06.125789,2023-10-02 12:17:06.338740,0 days 00:00:00.212951,60050.55634395797,470,sag,COMPLETE
2717,0.669996724533246,2023-10-02 12:17:06.339740,2023-10-02 12:17:06.625841,0 days 00:00:00.286101,80029.6209218285,440,sag,COMPLETE
2718,0.666120755540998,2023-10-02 12:17:06.626841,2023-10-02 12:17:06.830501,0 days 00:00:00.203660,76469.35015635099,440,sag,COMPLETE
2719,0.666120755540998,2023-10-02 12:17:06.831503,2023-10-02 12:17:07.034550,0 days 00:00:00.203047,70314.80604593652,420,sag,COMPLETE
2720,0.6590785020198712,2023-10-02 12:17:07.035549,2023-10-02 12:17:07.245313,0 days 00:00:00.209764,76225.05281378028,440,sag,COMPLETE
2721,0.6552025330276231,2023-10-02 12:17:07.246308,2023-10-02 12:17:07.458525,0 days 00:00:00.212217,72257.85869249048,400,saga,COMPLETE
2722,0.6449939949776177,2023-10-02 12:17:07.459581,2023-10-02 12:17:07.617386,0 days 00:00:00.157805,95286.922681869,450,newton-cg,COMPLETE
2723,0.6520362484987444,2023-10-02 12:17:07.618385,2023-10-02 12:17:07.837440,0 days 00:00:00.219055,89258.97532630146,450,sag,COMPLETE
2724,0.6520362484987444,2023-10-02 12:17:07.838439,2023-10-02 12:17:08.043238,0 days 00:00:00.204799,65717.44244706846,430,sag,COMPLETE
2725,0.637951741456491,2023-10-02 12:17:08.044237,2023-10-02 12:17:08.252227,0 days 00:00:00.207990,92511.87051404724,450,liblinear,COMPLETE
2726,0.6449939949776177,2023-10-02 12:17:08.253278,2023-10-02 12:17:08.460224,0 days 00:00:00.206946,94618.26765876215,460,sag,COMPLETE
2727,0.6590785020198712,2023-10-02 12:17:08.461218,2023-10-02 12:17:08.672015,0 days 00:00:00.210797,54297.23114463214,440,sag,COMPLETE
2728,0.6520362484987444,2023-10-02 12:17:08.673062,2023-10-02 12:17:08.893356,0 days 00:00:00.220294,79627.76001065422,460,saga,COMPLETE
2729,0.6552025330276231,2023-10-02 12:17:08.894358,2023-10-02 12:17:09.107015,0 days 00:00:00.212657,58723.81606814267,440,sag,COMPLETE
2730,0.6590785020198712,2023-10-02 12:17:09.108015,2023-10-02 12:17:09.321753,0 days 00:00:00.213738,51179.445324248285,450,sag,COMPLETE
2731,0.6590785020198712,2023-10-02 12:17:09.322749,2023-10-02 12:17:09.536828,0 days 00:00:00.214079,90471.42125951947,450,sag,COMPLETE
2732,0.6590785020198712,2023-10-02 12:17:09.537828,2023-10-02 12:17:09.832079,0 days 00:00:00.294251,98744.38820916784,500,sag,COMPLETE
2733,0.6552025330276231,2023-10-02 12:17:09.833079,2023-10-02 12:17:10.028699,0 days 00:00:00.195620,47864.33091580695,350,saga,COMPLETE
2734,0.6590785020198712,2023-10-02 12:17:10.029701,2023-10-02 12:17:10.240201,0 days 00:00:00.210500,44609.585696569,430,sag,COMPLETE
2735,0.66224478654875,2023-10-02 12:17:10.241292,2023-10-02 12:17:10.455215,0 days 00:00:00.213923,60163.13006698688,440,sag,COMPLETE
2736,0.6520362484987444,2023-10-02 12:17:10.456270,2023-10-02 12:17:10.666322,0 days 00:00:00.210052,43295.26535650905,440,sag,COMPLETE
2737,0.6590785020198712,2023-10-02 12:17:10.667398,2023-10-02 12:17:10.877084,0 days 00:00:00.209686,58552.96529551799,450,sag,COMPLETE
2738,0.6481602795064964,2023-10-02 12:17:10.878087,2023-10-02 12:17:11.177712,0 days 00:00:00.299625,94944.9710115839,460,sag,COMPLETE
2739,0.6520362484987444,2023-10-02 12:17:11.178709,2023-10-02 12:17:11.394305,0 days 00:00:00.215596,94881.93117015329,450,saga,COMPLETE
2740,0.666120755540998,2023-10-02 12:17:11.395299,2023-10-02 12:17:11.616828,0 days 00:00:00.221529,48657.97760031745,440,sag,COMPLETE
2741,0.637951741456491,2023-10-02 12:17:11.617828,2023-10-02 12:17:11.796093,0 days 00:00:00.178265,38356.67994064999,460,lbfgs,COMPLETE
2742,0.6520362484987444,2023-10-02 12:17:11.798216,2023-10-02 12:17:12.006461,0 days 00:00:00.208245,38126.128711004676,450,sag,COMPLETE
2743,0.6449939949776177,2023-10-02 12:17:12.007460,2023-10-02 12:17:12.285345,0 days 00:00:00.277885,45894.89635372219,430,sag,COMPLETE
2744,0.6449939949776177,2023-10-02 12:17:12.286352,2023-10-02 12:17:12.490643,0 days 00:00:00.204291,59895.50759698298,440,sag,COMPLETE
2745,0.5,2023-10-02 12:17:12.491643,2023-10-02 12:17:12.629896,0 days 00:00:00.138253,0.008098085302824758,430,saga,COMPLETE
2746,0.6449939949776177,2023-10-02 12:17:12.630896,2023-10-02 12:17:12.847529,0 days 00:00:00.216633,32322.88165359069,440,sag,COMPLETE
2747,0.6520362484987444,2023-10-02 12:17:12.848531,2023-10-02 12:17:13.062009,0 days 00:00:00.213478,97068.3945967701,430,sag,COMPLETE
2748,0.6552025330276231,2023-10-02 12:17:13.063007,2023-10-02 12:17:13.278285,0 days 00:00:00.215278,34923.69763689266,450,sag,COMPLETE
2749,0.5,2023-10-02 12:17:13.279379,2023-10-02 12:17:13.417748,0 days 00:00:00.138369,7.607132307823965e-05,410,newton-cg,COMPLETE
2750,0.6411180259853696,2023-10-02 12:17:13.418746,2023-10-02 12:17:13.634238,0 days 00:00:00.215492,64850.50247156807,430,sag,COMPLETE
2751,0.637951741456491,2023-10-02 12:17:13.635238,2023-10-02 12:17:13.845468,0 days 00:00:00.210230,33847.555795554435,440,liblinear,COMPLETE
2752,0.651326564035375,2023-10-02 12:17:13.846466,2023-10-02 12:17:14.070531,0 days 00:00:00.224065,94561.33389607562,500,saga,COMPLETE
2753,0.5,2023-10-02 12:17:14.071522,2023-10-02 12:17:14.216813,0 days 00:00:00.145291,0.0031881168819512854,440,sag,COMPLETE
2754,0.5,2023-10-02 12:17:14.217813,2023-10-02 12:17:14.366554,0 days 00:00:00.148741,0.0014851612286788543,370,sag,COMPLETE
2755,0.6520362484987444,2023-10-02 12:17:14.367557,2023-10-02 12:17:14.587430,0 days 00:00:00.219873,58191.6087478471,450,sag,COMPLETE
2756,0.5,2023-10-02 12:17:14.588415,2023-10-02 12:17:14.746454,0 days 00:00:00.158039,0.0002993984280874109,500,sag,COMPLETE
2757,0.6520362484987444,2023-10-02 12:17:14.747453,2023-10-02 12:17:14.963159,0 days 00:00:00.215706,31815.532732179112,450,sag,COMPLETE
