number,value,datetime_start,datetime_complete,duration,params_C,params_max_iter,params_solver,state
6504,0.637951741456491,2023-10-02 12:37:53.713833,2023-10-02 12:37:54.106174,0 days 00:00:00.392341,45994.49024594498,440,liblinear,COMPLETE
6505,0.6520362484987444,2023-10-02 12:37:54.121797,2023-10-02 12:37:54.592653,0 days 00:00:00.470856,5089.979508185275,350,sag,COMPLETE
6506,0.6520362484987444,2023-10-02 12:37:54.592653,2023-10-02 12:37:55.000102,0 days 00:00:00.407449,24010.33054816319,460,sag,COMPLETE
6507,0.6590785020198712,2023-10-02 12:37:55.000102,2023-10-02 12:37:55.517898,0 days 00:00:00.517796,62233.397943842276,370,sag,COMPLETE
6508,0.6298722567965934,2023-10-02 12:37:55.517898,2023-10-02 12:37:55.831721,0 days 00:00:00.313823,17.899278740371056,330,sag,COMPLETE
6509,0.528169014084507,2023-10-02 12:37:55.831721,2023-10-02 12:37:56.271649,0 days 00:00:00.439928,0.46368880725173006,450,sag,COMPLETE
6510,0.6062888961677039,2023-10-02 12:37:56.274647,2023-10-02 12:37:56.607899,0 days 00:00:00.333252,6.41199897784175,380,sag,COMPLETE
6511,0.5,2023-10-02 12:37:56.609898,2023-10-02 12:37:57.033059,0 days 00:00:00.423161,0.011812683459094074,470,sag,COMPLETE
6512,0.6418277104487389,2023-10-02 12:37:57.035049,2023-10-02 12:37:57.443428,0 days 00:00:00.408379,428.3206539027355,470,sag,COMPLETE
6513,0.5,2023-10-02 12:37:57.443428,2023-10-02 12:37:57.854952,0 days 00:00:00.411524,0.0041417478165904804,350,lbfgs,COMPLETE
6514,0.666120755540998,2023-10-02 12:37:57.854952,2023-10-02 12:37:58.317893,0 days 00:00:00.462941,15258.279196549003,340,sag,COMPLETE
6515,0.5,2023-10-02 12:37:58.317893,2023-10-02 12:37:58.649884,0 days 00:00:00.331991,0.02642469393999497,430,sag,COMPLETE
6516,0.6520362484987444,2023-10-02 12:37:58.651879,2023-10-02 12:37:59.153710,0 days 00:00:00.501831,1745.0657507439544,460,sag,COMPLETE
6517,0.6520362484987444,2023-10-02 12:37:59.153710,2023-10-02 12:37:59.561229,0 days 00:00:00.407519,33516.36222863031,360,sag,COMPLETE
6518,0.6520362484987444,2023-10-02 12:37:59.563228,2023-10-02 12:38:00.047980,0 days 00:00:00.484752,7249.412067271907,370,sag,COMPLETE
6519,0.5,2023-10-02 12:38:00.047980,2023-10-02 12:38:00.432836,0 days 00:00:00.384856,0.056708847636955696,440,sag,COMPLETE
6520,0.6520362484987444,2023-10-02 12:38:00.448466,2023-10-02 12:38:00.933709,0 days 00:00:00.485243,10587.40269348576,450,sag,COMPLETE
6521,0.6520362484987444,2023-10-02 12:38:00.933709,2023-10-02 12:38:01.408665,0 days 00:00:00.474956,48385.564532021504,470,sag,COMPLETE
6522,0.5,2023-10-02 12:38:01.424312,2023-10-02 12:38:01.738117,0 days 00:00:00.313805,0.0311601692589946,380,sag,COMPLETE
6523,0.6559122174909924,2023-10-02 12:38:01.738117,2023-10-02 12:38:02.201476,0 days 00:00:00.463359,66619.94994297359,320,sag,COMPLETE
6524,0.6449939949776177,2023-10-02 12:38:02.201476,2023-10-02 12:38:02.590755,0 days 00:00:00.389279,2928.4145335685357,340,sag,COMPLETE
6525,0.5619609127634021,2023-10-02 12:38:02.590755,2023-10-02 12:38:03.057696,0 days 00:00:00.466941,0.8667473347280973,410,newton-cg,COMPLETE
6526,0.6590785020198712,2023-10-02 12:38:03.057696,2023-10-02 12:38:03.461080,0 days 00:00:00.403384,22745.56920900996,360,sag,COMPLETE
6527,0.6590785020198712,2023-10-02 12:38:03.463079,2023-10-02 12:38:03.972225,0 days 00:00:00.509146,4382.913092882843,460,sag,COMPLETE
6528,0.5,2023-10-02 12:38:03.972225,2023-10-02 12:38:04.313627,0 days 00:00:00.341402,0.0021230442150967184,430,sag,COMPLETE
6529,0.5,2023-10-02 12:38:04.315623,2023-10-02 12:38:04.687241,0 days 00:00:00.371618,0.004426687578505028,390,liblinear,COMPLETE
6530,0.6481602795064964,2023-10-02 12:38:04.687241,2023-10-02 12:38:05.184278,0 days 00:00:00.497037,33674.32170738267,470,sag,COMPLETE
6531,0.6520362484987444,2023-10-02 12:38:05.198372,2023-10-02 12:38:05.586587,0 days 00:00:00.388215,16261.562144182157,350,sag,COMPLETE
6532,0.6520362484987444,2023-10-02 12:38:05.586587,2023-10-02 12:38:06.043124,0 days 00:00:00.456537,63787.73125238411,330,sag,COMPLETE
6533,0.649579648433235,2023-10-02 12:38:06.058763,2023-10-02 12:38:06.404059,0 days 00:00:00.345296,128.89581637163522,460,sag,COMPLETE
6534,0.5,2023-10-02 12:38:06.404059,2023-10-02 12:38:07.237910,0 days 00:00:00.833851,2.7848791014739693e-05,360,sag,COMPLETE
6535,0.6013756960366853,2023-10-02 12:38:07.253550,2023-10-02 12:38:07.573527,0 days 00:00:00.319977,2.465753102957537,400,sag,COMPLETE
6536,0.6449939949776177,2023-10-02 12:38:07.573527,2023-10-02 12:38:08.070482,0 days 00:00:00.496955,1094.2808010411711,450,sag,COMPLETE
6537,0.5,2023-10-02 12:38:08.072483,2023-10-02 12:38:08.499277,0 days 00:00:00.426794,0.006330831731653014,440,sag,COMPLETE
6538,0.5,2023-10-02 12:38:08.499277,2023-10-02 12:38:08.812486,0 days 00:00:00.313209,1.6223268796001567e-05,470,lbfgs,COMPLETE
6539,0.6077082650944426,2023-10-02 12:38:08.813531,2023-10-02 12:38:09.206256,0 days 00:00:00.392725,3.9438194893333827,370,sag,COMPLETE
6540,0.6590785020198712,2023-10-02 12:38:09.213822,2023-10-02 12:38:09.614624,0 days 00:00:00.400802,7447.218930729697,420,sag,COMPLETE
6541,0.6411180259853696,2023-10-02 12:38:09.614624,2023-10-02 12:38:10.104415,0 days 00:00:00.489791,34771.00390420505,470,sag,COMPLETE
6542,0.6449939949776177,2023-10-02 12:38:10.115432,2023-10-02 12:38:10.481119,0 days 00:00:00.365687,10445.418030594103,340,sag,COMPLETE
6543,0.6534556174254831,2023-10-02 12:38:10.481119,2023-10-02 12:38:10.917143,0 days 00:00:00.436024,63.27491660333873,450,sag,COMPLETE
6544,0.5,2023-10-02 12:38:10.919143,2023-10-02 12:38:11.359078,0 days 00:00:00.439935,0.0005868158035631196,350,sag,COMPLETE
6545,0.6590785020198712,2023-10-02 12:38:11.359078,2023-10-02 12:38:11.790696,0 days 00:00:00.431618,19084.058735138413,380,sag,COMPLETE
6546,0.6442843105142483,2023-10-02 12:38:11.790696,2023-10-02 12:38:12.261521,0 days 00:00:00.470825,67897.19876605691,330,sag,COMPLETE
6547,0.5982094115078066,2023-10-02 12:38:12.261521,2023-10-02 12:38:12.575499,0 days 00:00:00.313978,1.8862439613231494,360,sag,COMPLETE
6548,0.6520362484987444,2023-10-02 12:38:12.575499,2023-10-02 12:38:13.087792,0 days 00:00:00.512293,5455.9677333731815,480,sag,COMPLETE
6549,0.6449939949776177,2023-10-02 12:38:13.087792,2023-10-02 12:38:13.431153,0 days 00:00:00.343361,44527.00448738538,460,newton-cg,COMPLETE
6550,0.5478764057211486,2023-10-02 12:38:13.431153,2023-10-02 12:38:13.854246,0 days 00:00:00.423093,0.6868586343281694,370,sag,COMPLETE
6551,0.666120755540998,2023-10-02 12:38:13.854246,2023-10-02 12:38:14.343018,0 days 00:00:00.488772,25260.96664374172,470,sag,COMPLETE
6552,0.6449939949776177,2023-10-02 12:38:14.345310,2023-10-02 12:38:14.747377,0 days 00:00:00.402067,2196.608609601455,480,sag,COMPLETE
6553,0.637951741456491,2023-10-02 12:38:14.763007,2023-10-02 12:38:15.157846,0 days 00:00:00.394839,11975.663655777298,440,liblinear,COMPLETE
6554,0.6590785020198712,2023-10-02 12:38:15.157846,2023-10-02 12:38:15.552825,0 days 00:00:00.394979,3506.3095676040157,460,sag,COMPLETE
6555,0.6590785020198712,2023-10-02 12:38:15.552825,2023-10-02 12:38:16.026980,0 days 00:00:00.474155,99612.45631946031,350,sag,COMPLETE
6556,0.6133311496888305,2023-10-02 12:38:16.026980,2023-10-02 12:38:16.364058,0 days 00:00:00.337078,7.13639105408648,480,sag,COMPLETE
6557,0.5,2023-10-02 12:38:16.364058,2023-10-02 12:38:17.152710,0 days 00:00:00.788652,3.3890905182686e-05,450,sag,COMPLETE
6558,0.5,2023-10-02 12:38:17.152710,2023-10-02 12:38:17.524203,0 days 00:00:00.371493,0.0006679970997626384,340,sag,COMPLETE
6559,0.5996287804345454,2023-10-02 12:38:17.525712,2023-10-02 12:38:17.930817,0 days 00:00:00.405105,1.4704509399928778,360,sag,COMPLETE
6560,0.6449939949776177,2023-10-02 12:38:17.932814,2023-10-02 12:38:18.420800,0 days 00:00:00.487986,42206.45149660779,380,sag,COMPLETE
6561,0.6520362484987444,2023-10-02 12:38:18.422760,2023-10-02 12:38:18.827971,0 days 00:00:00.405211,19832.774533705888,430,sag,COMPLETE
6562,0.6267059722677149,2023-10-02 12:38:18.827971,2023-10-02 12:38:19.299921,0 days 00:00:00.471950,12.605760865715867,470,lbfgs,COMPLETE
6563,0.66224478654875,2023-10-02 12:38:19.301926,2023-10-02 12:38:19.709677,0 days 00:00:00.407751,7676.904346219804,320,sag,COMPLETE
6564,0.5,2023-10-02 12:38:19.709677,2023-10-02 12:38:20.128770,0 days 00:00:00.419093,0.002677798662579412,480,sag,COMPLETE
6565,0.5,2023-10-02 12:38:20.128770,2023-10-02 12:38:20.469290,0 days 00:00:00.340520,0.24289927250563603,370,sag,COMPLETE
6566,0.6418277104487389,2023-10-02 12:38:20.469290,2023-10-02 12:38:20.954434,0 days 00:00:00.485144,569.4443600161574,470,sag,COMPLETE
6567,0.6590785020198712,2023-10-02 12:38:20.954434,2023-10-02 12:38:21.423625,0 days 00:00:00.469191,65522.02995304466,350,sag,COMPLETE
6568,0.6590785020198712,2023-10-02 12:38:21.425624,2023-10-02 12:38:21.812778,0 days 00:00:00.387154,32987.85282597122,440,sag,COMPLETE
6569,0.6488699639698657,2023-10-02 12:38:21.812778,2023-10-02 12:38:22.330709,0 days 00:00:00.517931,99030.14495877112,480,sag,COMPLETE
6570,0.6629544710121192,2023-10-02 12:38:22.332212,2023-10-02 12:38:22.723432,0 days 00:00:00.391220,12792.186218632334,460,sag,COMPLETE
6571,0.6449939949776177,2023-10-02 12:38:22.723432,2023-10-02 12:38:23.209664,0 days 00:00:00.486232,5235.072484882649,330,sag,COMPLETE
6572,0.6449939949776177,2023-10-02 12:38:23.211664,2023-10-02 12:38:23.600519,0 days 00:00:00.388855,1244.1532519715477,450,sag,COMPLETE
6573,0.5,2023-10-02 12:38:23.600519,2023-10-02 12:38:24.064675,0 days 00:00:00.464156,0.0001503736161365695,410,sag,COMPLETE
6574,0.637951741456491,2023-10-02 12:38:24.064675,2023-10-02 12:38:24.510404,0 days 00:00:00.445729,24127.435614544225,460,newton-cg,COMPLETE
6575,0.666120755540998,2023-10-02 12:38:24.510404,2023-10-02 12:38:24.903849,0 days 00:00:00.393445,15350.378219466402,390,sag,COMPLETE
6576,0.5,2023-10-02 12:38:24.903849,2023-10-02 12:38:25.349885,0 days 00:00:00.446036,0.00036739978950404935,480,sag,COMPLETE
6577,0.6590785020198712,2023-10-02 12:38:25.349885,2023-10-02 12:38:25.749435,0 days 00:00:00.399550,46465.78680506912,340,sag,COMPLETE
6578,0.637951741456491,2023-10-02 12:38:25.749435,2023-10-02 12:38:26.148187,0 days 00:00:00.398752,9065.372863566512,470,liblinear,COMPLETE
6579,0.6369145103177202,2023-10-02 12:38:26.164787,2023-10-02 12:38:26.519475,0 days 00:00:00.354688,20.956910420592152,360,sag,COMPLETE
6580,0.5,2023-10-02 12:38:26.521474,2023-10-02 12:38:26.914059,0 days 00:00:00.392585,0.15972016653402474,430,sag,COMPLETE
6581,0.6520362484987444,2023-10-02 12:38:26.929691,2023-10-02 12:38:27.332130,0 days 00:00:00.402439,63811.468984971405,480,sag,COMPLETE
6582,0.637951741456491,2023-10-02 12:38:27.332130,2023-10-02 12:38:27.780008,0 days 00:00:00.447878,2436.997383803486,310,sag,COMPLETE
6583,0.666120755540998,2023-10-02 12:38:27.780008,2023-10-02 12:38:28.264567,0 days 00:00:00.484559,99802.85246182834,420,sag,COMPLETE
6584,0.6534556174254831,2023-10-02 12:38:28.264567,2023-10-02 12:38:28.599156,0 days 00:00:00.334589,92.59297194476648,480,sag,COMPLETE
6585,0.6457036794409869,2023-10-02 12:38:28.599156,2023-10-02 12:38:29.081763,0 days 00:00:00.482607,274.4504145989505,370,sag,COMPLETE
6586,0.6541653018888526,2023-10-02 12:38:29.083329,2023-10-02 12:38:29.415182,0 days 00:00:00.331853,33.115901298305864,350,sag,COMPLETE
6587,0.6590785020198712,2023-10-02 12:38:29.415182,2023-10-02 12:38:29.896588,0 days 00:00:00.481406,29851.146190080337,450,sag,COMPLETE
6588,0.637951741456491,2023-10-02 12:38:29.899973,2023-10-02 12:38:30.266542,0 days 00:00:00.366569,5253.784861064607,470,lbfgs,COMPLETE
6589,0.6534556174254831,2023-10-02 12:38:30.266542,2023-10-02 12:38:30.681252,0 days 00:00:00.414710,48.44332996005348,400,sag,COMPLETE
6590,0.5,2023-10-02 12:38:30.681252,2023-10-02 12:38:31.799905,0 days 00:00:01.118653,1.588190466042882e-05,480,sag,COMPLETE
6591,0.6590785020198712,2023-10-02 12:38:31.799905,2023-10-02 12:38:32.195678,0 days 00:00:00.395773,18656.36693800356,350,sag,COMPLETE
6592,0.5,2023-10-02 12:38:32.195678,2023-10-02 12:38:32.603710,0 days 00:00:00.408032,0.0018710345107488268,360,sag,COMPLETE
6593,0.6267059722677149,2023-10-02 12:38:32.619329,2023-10-02 12:38:32.936999,0 days 00:00:00.317670,13.14948886341948,440,sag,COMPLETE
6594,0.5,2023-10-02 12:38:32.946038,2023-10-02 12:38:33.349289,0 days 00:00:00.403251,0.017246245360332015,340,sag,COMPLETE
6595,0.5690031662845288,2023-10-02 12:38:33.349289,2023-10-02 12:38:33.670215,0 days 00:00:00.320926,1.0394533822169036,460,sag,COMPLETE
6596,0.6520362484987444,2023-10-02 12:38:33.684115,2023-10-02 12:38:34.151819,0 days 00:00:00.467704,46559.52342595439,380,sag,COMPLETE
6597,0.6449939949776177,2023-10-02 12:38:34.151819,2023-10-02 12:38:34.659554,0 days 00:00:00.507735,10795.12905962526,480,sag,COMPLETE
6598,0.6449939949776177,2023-10-02 12:38:34.659554,2023-10-02 12:38:35.052138,0 days 00:00:00.392584,812.2324683249421,470,sag,COMPLETE
6599,0.637951741456491,2023-10-02 12:38:35.068251,2023-10-02 12:38:35.494739,0 days 00:00:00.426488,28132.21610525122,330,newton-cg,COMPLETE
6600,0.5982094115078066,2023-10-02 12:38:35.494739,2023-10-02 12:38:35.813297,0 days 00:00:00.318558,1.9876962975791403,370,sag,COMPLETE
6601,0.6520362484987444,2023-10-02 12:38:35.813297,2023-10-02 12:38:36.302484,0 days 00:00:00.489187,3804.431530795737,450,sag,COMPLETE
6602,0.6449939949776177,2023-10-02 12:38:36.304492,2023-10-02 12:38:36.679608,0 days 00:00:00.375116,7544.865328925519,470,sag,COMPLETE
6603,0.66224478654875,2023-10-02 12:38:36.695237,2023-10-02 12:38:37.238572,0 days 00:00:00.543335,68247.72929412729,480,sag,COMPLETE
6604,0.666120755540998,2023-10-02 12:38:37.241595,2023-10-02 12:38:37.728129,0 days 00:00:00.486534,15420.807335685588,440,sag,COMPLETE
6605,0.643956763838847,2023-10-02 12:38:37.728129,2023-10-02 12:38:38.081406,0 days 00:00:00.353277,25.71362882107763,460,liblinear,COMPLETE
6606,0.6520362484987444,2023-10-02 12:38:38.083402,2023-10-02 12:38:38.554028,0 days 00:00:00.470626,33431.352399224976,320,sag,COMPLETE
6607,0.6590785020198712,2023-10-02 12:38:38.554028,2023-10-02 12:38:38.956884,0 days 00:00:00.402856,41366.782752585044,480,sag,COMPLETE
6608,0.6520362484987444,2023-10-02 12:38:38.956884,2023-10-02 12:38:39.427537,0 days 00:00:00.470653,1509.6876112892198,360,sag,COMPLETE
6609,0.6590785020198712,2023-10-02 12:38:39.427537,2023-10-02 12:38:39.803790,0 days 00:00:00.376253,65554.25357651258,350,sag,COMPLETE
6610,0.6140408341522,2023-10-02 12:38:39.803790,2023-10-02 12:38:40.243063,0 days 00:00:00.439273,5.013545096837184,340,sag,COMPLETE
6611,0.6520362484987444,2023-10-02 12:38:40.243063,2023-10-02 12:38:40.635439,0 days 00:00:00.392376,22804.967618325813,470,sag,COMPLETE
6612,0.6316191723987334,2023-10-02 12:38:40.635439,2023-10-02 12:38:41.074873,0 days 00:00:00.439434,499.4299759707188,460,lbfgs,COMPLETE
6613,0.6590785020198712,2023-10-02 12:38:41.090525,2023-10-02 12:38:41.592603,0 days 00:00:00.502078,5378.455552972821,480,sag,COMPLETE
6614,0.5376678676711432,2023-10-02 12:38:41.592603,2023-10-02 12:38:41.952777,0 days 00:00:00.360174,0.6100256808720381,370,sag,COMPLETE
6615,0.6520362484987444,2023-10-02 12:38:41.955782,2023-10-02 12:38:42.462415,0 days 00:00:00.506633,2965.7479150683303,450,sag,COMPLETE
6616,0.6481602795064964,2023-10-02 12:38:42.470928,2023-10-02 12:38:42.865207,0 days 00:00:00.394279,10678.71099270921,430,sag,COMPLETE
6617,0.6457036794409869,2023-10-02 12:38:42.865207,2023-10-02 12:38:43.449087,0 days 00:00:00.583880,195.39230844291967,390,sag,COMPLETE
6618,0.6597881864832406,2023-10-02 12:38:43.451087,2023-10-02 12:38:43.840253,0 days 00:00:00.389166,48876.871079518874,410,sag,COMPLETE
6619,0.5,2023-10-02 12:38:43.856174,2023-10-02 12:38:44.267270,0 days 00:00:00.411096,0.041290209094433344,360,sag,COMPLETE
6620,0.5,2023-10-02 12:38:44.267270,2023-10-02 12:38:44.672432,0 days 00:00:00.405162,0.06327989863820052,480,sag,COMPLETE
6621,0.5,2023-10-02 12:38:44.672432,2023-10-02 12:38:45.005448,0 days 00:00:00.333016,0.0009325519375991417,380,sag,COMPLETE
6622,0.6559122174909924,2023-10-02 12:38:45.020898,2023-10-02 12:38:45.480491,0 days 00:00:00.459593,18356.25154715643,330,sag,COMPLETE
6623,0.6418277104487389,2023-10-02 12:38:45.480491,2023-10-02 12:38:45.873352,0 days 00:00:00.392861,373.26886255361325,470,sag,COMPLETE
6624,0.5,2023-10-02 12:38:45.873352,2023-10-02 12:38:46.300136,0 days 00:00:00.426784,0.007366084275504237,350,newton-cg,COMPLETE
6625,0.5,2023-10-02 12:38:46.300136,2023-10-02 12:38:46.969139,0 days 00:00:00.669003,3.808778526219624e-05,450,sag,COMPLETE
6626,0.5,2023-10-02 12:38:46.969139,2023-10-02 12:38:47.382373,0 days 00:00:00.413234,0.0033388232817381795,340,sag,COMPLETE
6627,0.5,2023-10-02 12:38:47.382373,2023-10-02 12:38:47.792592,0 days 00:00:00.410219,0.00030192835760948453,480,liblinear,COMPLETE
6628,0.6590785020198712,2023-10-02 12:38:47.792592,2023-10-02 12:38:48.205369,0 days 00:00:00.412777,8061.009186752301,460,sag,COMPLETE
6629,0.6449939949776177,2023-10-02 12:38:48.205369,2023-10-02 12:38:48.758113,0 days 00:00:00.552744,24440.983451356737,440,sag,COMPLETE
6630,0.637951741456491,2023-10-02 12:38:48.758113,2023-10-02 12:38:49.248403,0 days 00:00:00.490290,67041.12034608478,480,sag,COMPLETE
6631,0.6590785020198712,2023-10-02 12:38:49.251402,2023-10-02 12:38:49.790404,0 days 00:00:00.539002,1864.8662430657018,360,sag,COMPLETE
6632,0.5,2023-10-02 12:38:49.806034,2023-10-02 12:38:51.418804,0 days 00:00:01.612770,1.1204901191058205e-05,380,sag,COMPLETE
6633,0.6534556174254831,2023-10-02 12:38:51.420804,2023-10-02 12:38:51.860022,0 days 00:00:00.439218,70.50918125307675,370,sag,COMPLETE
6634,0.5,2023-10-02 12:38:51.860022,2023-10-02 12:38:52.282126,0 days 00:00:00.422104,0.00145940448109768,460,sag,COMPLETE
6635,0.6559122174909924,2023-10-02 12:38:52.282126,2023-10-02 12:38:52.698448,0 days 00:00:00.416322,13732.08627018514,480,sag,COMPLETE
6636,0.6481602795064964,2023-10-02 12:38:52.700449,2023-10-02 12:38:53.195900,0 days 00:00:00.495451,39067.9499936524,470,sag,COMPLETE
6637,0.6534556174254831,2023-10-02 12:38:53.195900,2023-10-02 12:38:53.560553,0 days 00:00:00.364653,47.34633090866669,160,lbfgs,COMPLETE
6638,0.6449939949776177,2023-10-02 12:38:53.560553,2023-10-02 12:38:54.079022,0 days 00:00:00.518469,4318.5168324545675,490,sag,COMPLETE
6639,0.5982094115078066,2023-10-02 12:38:54.079022,2023-10-02 12:38:54.435348,0 days 00:00:00.356326,1.9638832184222892,340,sag,COMPLETE
6640,0.666120755540998,2023-10-02 12:38:54.435348,2023-10-02 12:38:54.891288,0 days 00:00:00.455940,29467.412967669403,320,sag,COMPLETE
6641,0.6449939949776177,2023-10-02 12:38:54.891288,2023-10-02 12:38:55.412443,0 days 00:00:00.521155,6000.692440850896,420,sag,COMPLETE
6642,0.6449939949776177,2023-10-02 12:38:55.412443,2023-10-02 12:38:55.824969,0 days 00:00:00.412526,779.3960627683679,450,sag,COMPLETE
6643,0.5,2023-10-02 12:38:55.824969,2023-10-02 12:38:56.346080,0 days 00:00:00.521111,9.595548075894413e-05,470,sag,COMPLETE
6644,0.5619609127634021,2023-10-02 12:38:56.346080,2023-10-02 12:38:56.715009,0 days 00:00:00.368929,0.9136496407295926,350,sag,COMPLETE
6645,0.6449939949776177,2023-10-02 12:38:56.717086,2023-10-02 12:38:57.210486,0 days 00:00:00.493400,15681.906856699703,400,sag,COMPLETE
6646,0.6449939949776177,2023-10-02 12:38:57.210486,2023-10-02 12:38:57.646520,0 days 00:00:00.436034,98577.01200623896,440,sag,COMPLETE
6647,0.666120755540998,2023-10-02 12:38:57.648543,2023-10-02 12:38:58.142241,0 days 00:00:00.493698,99434.43106481529,480,sag,COMPLETE
6648,0.608417949557812,2023-10-02 12:38:58.142241,2023-10-02 12:38:58.465547,0 days 00:00:00.323306,2.8318928505220406,490,sag,COMPLETE
6649,0.6449939949776177,2023-10-02 12:38:58.465547,2023-10-02 12:38:58.909568,0 days 00:00:00.444021,48763.38543241252,360,newton-cg,COMPLETE
6650,0.5,2023-10-02 12:38:58.909568,2023-10-02 12:38:59.331517,0 days 00:00:00.421949,0.12068766763095017,480,sag,COMPLETE
6651,0.5,2023-10-02 12:38:59.331517,2023-10-02 12:38:59.785869,0 days 00:00:00.454352,8.442022037433236e-05,430,sag,COMPLETE
6652,0.637951741456491,2023-10-02 12:38:59.795417,2023-10-02 12:39:00.212212,0 days 00:00:00.416795,10963.620044716461,330,liblinear,COMPLETE
6653,0.6590785020198712,2023-10-02 12:39:00.229005,2023-10-02 12:39:00.666512,0 days 00:00:00.437507,3312.6074299897673,490,sag,COMPLETE
6654,0.637951741456491,2023-10-02 12:39:00.668507,2023-10-02 12:39:01.102025,0 days 00:00:00.433518,25692.960030567356,110,sag,COMPLETE
6655,0.5,2023-10-02 12:39:01.102025,2023-10-02 12:39:01.482460,0 days 00:00:00.380435,0.028746476786282053,450,sag,COMPLETE
6656,0.6541653018888526,2023-10-02 12:39:01.484448,2023-10-02 12:39:01.927151,0 days 00:00:00.442703,30.548575338709636,350,sag,COMPLETE
6657,0.6559122174909924,2023-10-02 12:39:01.927151,2023-10-02 12:39:02.425530,0 days 00:00:00.498379,67138.46358419082,470,sag,COMPLETE
6658,0.6520362484987444,2023-10-02 12:39:02.425530,2023-10-02 12:39:02.851182,0 days 00:00:00.425652,6896.88184813244,480,sag,COMPLETE
6659,0.6559122174909924,2023-10-02 12:39:02.851182,2023-10-02 12:39:03.330114,0 days 00:00:00.478932,41515.2201763627,390,sag,COMPLETE
6660,0.6449939949776177,2023-10-02 12:39:03.345140,2023-10-02 12:39:03.770947,0 days 00:00:00.425807,16107.523715560905,460,sag,COMPLETE
6661,0.666120755540998,2023-10-02 12:39:03.770947,2023-10-02 12:39:04.291644,0 days 00:00:00.520697,9659.588532280413,490,sag,COMPLETE
6662,0.6098373184845508,2023-10-02 12:39:04.298526,2023-10-02 12:39:04.659484,0 days 00:00:00.360958,1.586039746561096,490,lbfgs,COMPLETE
6663,0.6418277104487389,2023-10-02 12:39:04.661476,2023-10-02 12:39:05.148033,0 days 00:00:00.486557,303.92842778721723,370,sag,COMPLETE
6664,0.6267059722677149,2023-10-02 12:39:05.148033,2023-10-02 12:39:05.581319,0 days 00:00:00.433286,12.786079569325203,460,sag,COMPLETE
6665,0.666120755540998,2023-10-02 12:39:05.581319,2023-10-02 12:39:05.976656,0 days 00:00:00.395337,30951.92686734982,340,sag,COMPLETE
6666,0.649579648433235,2023-10-02 12:39:05.976656,2023-10-02 12:39:06.422781,0 days 00:00:00.446125,142.730178365378,480,sag,COMPLETE
