number,value,datetime_start,datetime_complete,duration,params_C,params_max_iter,params_solver,state
3409,0.6590785020198712,2023-10-02 12:19:47.741250,2023-10-02 12:19:48.002525,0 days 00:00:00.261275,68703.51012658534,470,sag,COMPLETE
3410,0.6027950649634239,2023-10-02 12:19:48.003525,2023-10-02 12:19:48.234225,0 days 00:00:00.230700,1.5719613554744927,440,sag,COMPLETE
3411,0.5,2023-10-02 12:19:48.235224,2023-10-02 12:19:48.399210,0 days 00:00:00.163986,0.033319872927544555,480,sag,COMPLETE
3412,0.5,2023-10-02 12:19:48.400211,2023-10-02 12:19:48.809348,0 days 00:00:00.409137,4.691572363435263e-05,460,sag,COMPLETE
3413,0.666120755540998,2023-10-02 12:19:48.811349,2023-10-02 12:19:49.050517,0 days 00:00:00.239168,10050.097723998782,470,sag,COMPLETE
3414,0.5,2023-10-02 12:19:49.051520,2023-10-02 12:19:49.285942,0 days 00:00:00.234422,0.0006903808343607423,480,lbfgs,COMPLETE
3415,0.6590785020198712,2023-10-02 12:19:49.286941,2023-10-02 12:19:49.528272,0 days 00:00:00.241331,26271.70929769092,440,saga,COMPLETE
3416,0.6062888961677039,2023-10-02 12:19:49.529274,2023-10-02 12:19:49.690801,0 days 00:00:00.161527,5.6234307084614255,470,sag,COMPLETE
3417,0.6520362484987444,2023-10-02 12:19:49.691798,2023-10-02 12:19:49.957561,0 days 00:00:00.265763,45898.064887472014,490,sag,COMPLETE
3418,0.6481602795064964,2023-10-02 12:19:49.959644,2023-10-02 12:19:50.268077,0 days 00:00:00.308433,19008.82744868767,460,sag,COMPLETE
3419,0.666120755540998,2023-10-02 12:19:50.269073,2023-10-02 12:19:50.524275,0 days 00:00:00.255202,62679.81430332476,480,sag,COMPLETE
3420,0.6449939949776177,2023-10-02 12:19:50.525275,2023-10-02 12:19:50.768911,0 days 00:00:00.243636,876.0452275952085,450,saga,COMPLETE
3421,0.6534556174254831,2023-10-02 12:19:50.770991,2023-10-02 12:19:50.951389,0 days 00:00:00.180398,67.31382859857133,490,sag,COMPLETE
3422,0.6411180259853696,2023-10-02 12:19:50.952387,2023-10-02 12:19:51.264351,0 days 00:00:00.311964,35431.759800208165,480,sag,COMPLETE
3423,0.637951741456491,2023-10-02 12:19:51.265350,2023-10-02 12:19:51.458441,0 days 00:00:00.193091,9741.28323369799,490,newton-cg,COMPLETE
3424,0.666120755540998,2023-10-02 12:19:51.460441,2023-10-02 12:19:51.709264,0 days 00:00:00.248823,15926.647239879889,470,sag,COMPLETE
3425,0.6559122174909924,2023-10-02 12:19:51.711267,2023-10-02 12:19:51.944952,0 days 00:00:00.233685,27258.661467913673,420,sag,COMPLETE
3426,0.5,2023-10-02 12:19:51.945953,2023-10-02 12:19:52.400593,0 days 00:00:00.454640,1.56562506851541e-05,450,saga,COMPLETE
3427,0.5,2023-10-02 12:19:52.401595,2023-10-02 12:19:52.560649,0 days 00:00:00.159054,0.0003620927953652246,330,liblinear,COMPLETE
3428,0.666120755540998,2023-10-02 12:19:52.562643,2023-10-02 12:19:52.805731,0 days 00:00:00.243088,43092.353045368975,460,sag,COMPLETE
3429,0.6520362484987444,2023-10-02 12:19:52.807729,2023-10-02 12:19:53.073931,0 days 00:00:00.266202,99200.03140273367,480,sag,COMPLETE
3430,0.5,2023-10-02 12:19:53.074929,2023-10-02 12:19:53.312124,0 days 00:00:00.237195,0.07617781606427668,490,sag,COMPLETE
3431,0.6541653018888526,2023-10-02 12:19:53.313165,2023-10-02 12:19:53.503878,0 days 00:00:00.190713,31.378546113843036,490,sag,COMPLETE
3432,0.6590785020198712,2023-10-02 12:19:53.505884,2023-10-02 12:19:53.750815,0 days 00:00:00.244931,9683.258639580607,480,sag,COMPLETE
3433,0.6520362484987444,2023-10-02 12:19:53.752811,2023-10-02 12:19:53.996061,0 days 00:00:00.243250,15727.620233891215,460,saga,COMPLETE
3434,0.6590785020198712,2023-10-02 12:19:53.997063,2023-10-02 12:19:54.311498,0 days 00:00:00.314435,98737.46136871562,470,sag,COMPLETE
3435,0.6520362484987444,2023-10-02 12:19:54.312494,2023-10-02 12:19:54.561038,0 days 00:00:00.248544,22521.611338839488,490,sag,COMPLETE
3436,0.6520362484987444,2023-10-02 12:19:54.563040,2023-10-02 12:19:54.809025,0 days 00:00:00.245985,66324.09638964408,480,sag,COMPLETE
3437,0.637951741456491,2023-10-02 12:19:54.810025,2023-10-02 12:19:55.052922,0 days 00:00:00.242897,34665.59705124924,450,sag,COMPLETE
3438,0.6590785020198712,2023-10-02 12:19:55.054976,2023-10-02 12:19:55.387623,0 days 00:00:00.332647,9506.450869113836,490,saga,COMPLETE
3439,0.6520362484987444,2023-10-02 12:19:55.388630,2023-10-02 12:19:55.644475,0 days 00:00:00.255845,15167.638908074035,470,sag,COMPLETE
3440,0.5,2023-10-02 12:19:55.646475,2023-10-02 12:19:55.807567,0 days 00:00:00.161092,0.3369044573554874,490,sag,COMPLETE
3441,0.619663718746588,2023-10-02 12:19:55.808569,2023-10-02 12:19:55.971959,0 days 00:00:00.163390,9.425538368476559,440,sag,COMPLETE
3442,0.6629544710121192,2023-10-02 12:19:55.972959,2023-10-02 12:19:56.304802,0 days 00:00:00.331843,45744.76614710905,480,sag,COMPLETE
3443,0.6457036794409869,2023-10-02 12:19:56.305822,2023-10-02 12:19:56.518048,0 days 00:00:00.212226,303.361795165003,430,lbfgs,COMPLETE
3444,0.6457036794409869,2023-10-02 12:19:56.519051,2023-10-02 12:19:56.750033,0 days 00:00:00.230982,135.98245385013834,460,saga,COMPLETE
3445,0.5,2023-10-02 12:19:56.752026,2023-10-02 12:19:56.932399,0 days 00:00:00.180373,0.19869021445410145,490,sag,COMPLETE
3446,0.604541980565564,2023-10-02 12:19:56.933402,2023-10-02 12:19:57.168299,0 days 00:00:00.234897,3.198656118664603,480,sag,COMPLETE
3447,0.6520362484987444,2023-10-02 12:19:57.169298,2023-10-02 12:19:57.412310,0 days 00:00:00.243012,27449.490654070993,470,sag,COMPLETE
3448,0.5,2023-10-02 12:19:57.414311,2023-10-02 12:19:57.609153,0 days 00:00:00.194842,0.0008168370362322178,490,sag,COMPLETE
3449,0.6449939949776177,2023-10-02 12:19:57.610156,2023-10-02 12:19:57.873905,0 days 00:00:00.263749,60132.922796691084,450,saga,COMPLETE
3450,0.666120755540998,2023-10-02 12:19:57.874906,2023-10-02 12:19:58.203164,0 days 00:00:00.328258,9174.11756257562,490,sag,COMPLETE
3451,0.619663718746588,2023-10-02 12:19:58.204165,2023-10-02 12:19:58.389368,0 days 00:00:00.185203,9.482770392871549,470,newton-cg,COMPLETE
3452,0.666120755540998,2023-10-02 12:19:58.390361,2023-10-02 12:19:58.640775,0 days 00:00:00.250414,27565.881376221292,480,sag,COMPLETE
3453,0.5,2023-10-02 12:19:58.641775,2023-10-02 12:19:58.803584,0 days 00:00:00.161809,0.00015156713223360234,460,liblinear,COMPLETE
3454,0.5,2023-10-02 12:19:58.804581,2023-10-02 12:19:59.052492,0 days 00:00:00.247911,0.0014905550703604917,490,sag,COMPLETE
3455,0.6471230483677258,2023-10-02 12:19:59.053494,2023-10-02 12:19:59.231544,0 days 00:00:00.178050,28.55064930020727,440,sag,COMPLETE
3456,0.6520362484987444,2023-10-02 12:19:59.232544,2023-10-02 12:19:59.524806,0 days 00:00:00.292262,16383.757601238369,480,sag,COMPLETE
3457,0.637951741456491,2023-10-02 12:19:59.525805,2023-10-02 12:19:59.782086,0 days 00:00:00.256281,43053.61963471998,470,saga,COMPLETE
3458,0.6590785020198712,2023-10-02 12:19:59.783088,2023-10-02 12:20:00.097985,0 days 00:00:00.314897,12883.839047723908,480,sag,COMPLETE
3459,0.5,2023-10-02 12:20:00.099988,2023-10-02 12:20:00.324374,0 days 00:00:00.224386,0.0001545994879305524,400,sag,COMPLETE
3460,0.6590785020198712,2023-10-02 12:20:00.325381,2023-10-02 12:20:00.570683,0 days 00:00:00.245302,21434.45512456031,490,sag,COMPLETE
3461,0.6534556174254831,2023-10-02 12:20:00.571683,2023-10-02 12:20:00.809664,0 days 00:00:00.237981,119.72290431564255,490,sag,COMPLETE
3462,0.6449939949776177,2023-10-02 12:20:00.810662,2023-10-02 12:20:01.159873,0 days 00:00:00.349211,542.6529061568222,460,saga,COMPLETE
3463,0.6552025330276231,2023-10-02 12:20:01.161875,2023-10-02 12:20:01.440761,0 days 00:00:00.278886,67232.34243633808,500,sag,COMPLETE
3464,0.6590785020198712,2023-10-02 12:20:01.441755,2023-10-02 12:20:01.685665,0 days 00:00:00.243910,98549.22735773318,450,sag,COMPLETE
3465,0.637951741456491,2023-10-02 12:20:01.686666,2023-10-02 12:20:01.906489,0 days 00:00:00.219823,7760.089919563489,480,lbfgs,COMPLETE
3466,0.6369145103177202,2023-10-02 12:20:01.907486,2023-10-02 12:20:02.160018,0 days 00:00:00.252532,20.283635844810295,130,sag,COMPLETE
3467,0.6520362484987444,2023-10-02 12:20:02.161018,2023-10-02 12:20:02.420322,0 days 00:00:00.259304,30959.5632681178,470,sag,COMPLETE
3468,0.5,2023-10-02 12:20:02.421325,2023-10-02 12:20:02.806820,0 days 00:00:00.385495,2.4243845603095857e-05,490,saga,COMPLETE
3469,0.6481602795064964,2023-10-02 12:20:02.807818,2023-10-02 12:20:03.069507,0 days 00:00:00.261689,41855.51175756194,500,sag,COMPLETE
3470,0.6552025330276231,2023-10-02 12:20:03.070504,2023-10-02 12:20:03.387234,0 days 00:00:00.316730,20608.477285474764,460,sag,COMPLETE
3471,0.666120755540998,2023-10-02 12:20:03.388233,2023-10-02 12:20:03.627091,0 days 00:00:00.238858,64133.04637110045,430,sag,COMPLETE
3472,0.637951741456491,2023-10-02 12:20:03.628091,2023-10-02 12:20:03.886147,0 days 00:00:00.258056,867.2282050262439,480,sag,COMPLETE
3473,0.6418277104487389,2023-10-02 12:20:03.887204,2023-10-02 12:20:04.143694,0 days 00:00:00.256490,221.39919731937727,490,saga,COMPLETE
3474,0.5,2023-10-02 12:20:04.144701,2023-10-02 12:20:04.386487,0 days 00:00:00.241786,0.028637652108364983,370,sag,COMPLETE
3475,0.6520362484987444,2023-10-02 12:20:04.388488,2023-10-02 12:20:04.631189,0 days 00:00:00.242701,12299.840707796411,450,sag,COMPLETE
3476,0.5,2023-10-02 12:20:04.632315,2023-10-02 12:20:04.800595,0 days 00:00:00.168280,0.045828609916697356,250,newton-cg,COMPLETE
3477,0.6481602795064964,2023-10-02 12:20:04.802593,2023-10-02 12:20:05.064529,0 days 00:00:00.261936,8121.4160616250065,500,sag,COMPLETE
3478,0.6590785020198712,2023-10-02 12:20:05.066593,2023-10-02 12:20:05.407865,0 days 00:00:00.341272,21237.697999296386,480,sag,COMPLETE
3479,0.5855442733922918,2023-10-02 12:20:05.408865,2023-10-02 12:20:05.583636,0 days 00:00:00.174771,1.271711683317602,470,sag,COMPLETE
3480,0.5,2023-10-02 12:20:05.585634,2023-10-02 12:20:05.745682,0 days 00:00:00.160048,0.020275532784842364,490,liblinear,COMPLETE
3481,0.5,2023-10-02 12:20:05.747685,2023-10-02 12:20:06.002492,0 days 00:00:00.254807,0.008973484842886988,440,saga,COMPLETE
3482,0.6590785020198712,2023-10-02 12:20:06.003492,2023-10-02 12:20:06.248099,0 days 00:00:00.244607,45420.08605452612,500,sag,COMPLETE
3483,0.6590785020198712,2023-10-02 12:20:06.249099,2023-10-02 12:20:06.497132,0 days 00:00:00.248033,13370.018424775997,490,sag,COMPLETE
3484,0.6552025330276231,2023-10-02 12:20:06.498182,2023-10-02 12:20:06.718875,0 days 00:00:00.220693,32029.679207833287,310,sag,COMPLETE
3485,0.5,2023-10-02 12:20:06.719864,2023-10-02 12:20:06.888527,0 days 00:00:00.168663,0.04561712094966825,470,sag,COMPLETE
3486,0.6520362484987444,2023-10-02 12:20:06.889524,2023-10-02 12:20:07.225380,0 days 00:00:00.335856,68034.95054213716,460,saga,COMPLETE
3487,0.6520362484987444,2023-10-02 12:20:07.226378,2023-10-02 12:20:07.482919,0 days 00:00:00.256541,8872.676074013556,480,sag,COMPLETE
3488,0.5,2023-10-02 12:20:07.483921,2023-10-02 12:20:07.745772,0 days 00:00:00.261851,0.00010482145170397887,500,sag,COMPLETE
3489,0.6552025330276231,2023-10-02 12:20:07.746773,2023-10-02 12:20:07.993670,0 days 00:00:00.246897,20257.938098105362,490,sag,COMPLETE
3490,0.6573315864177312,2023-10-02 12:20:07.995667,2023-10-02 12:20:08.247162,0 days 00:00:00.251495,38.33506710016911,450,sag,COMPLETE
3491,0.5,2023-10-02 12:20:08.248160,2023-10-02 12:20:08.619666,0 days 00:00:00.371506,6.491089422662157e-05,470,saga,COMPLETE
3492,0.5,2023-10-02 12:20:08.621666,2023-10-02 12:20:08.788981,0 days 00:00:00.167315,0.007036679234786922,380,sag,COMPLETE
3493,0.5313352986133857,2023-10-02 12:20:08.789981,2023-10-02 12:20:09.041926,0 days 00:00:00.251945,0.5145831237413652,500,lbfgs,COMPLETE
3494,0.6418277104487389,2023-10-02 12:20:09.042926,2023-10-02 12:20:09.280023,0 days 00:00:00.237097,396.13095667863405,490,sag,COMPLETE
3495,0.6449939949776177,2023-10-02 12:20:09.281019,2023-10-02 12:20:09.535911,0 days 00:00:00.254892,1114.2302551527698,480,sag,COMPLETE
3496,0.6133311496888305,2023-10-02 12:20:09.536985,2023-10-02 12:20:09.748486,0 days 00:00:00.211501,6.896082192721131,490,sag,COMPLETE
3497,0.5,2023-10-02 12:20:09.749487,2023-10-02 12:20:10.179166,0 days 00:00:00.429679,6.408605776507676e-05,440,sag,COMPLETE
3498,0.6481602795064964,2023-10-02 12:20:10.180167,2023-10-02 12:20:10.436552,0 days 00:00:00.256385,35466.25400373501,460,saga,COMPLETE
3499,0.5,2023-10-02 12:20:10.438553,2023-10-02 12:20:10.620173,0 days 00:00:00.181620,0.0022646713944903933,480,sag,COMPLETE
3500,0.666120755540998,2023-10-02 12:20:10.622177,2023-10-02 12:20:10.887381,0 days 00:00:00.265204,13579.34277405646,500,sag,COMPLETE
3501,0.6590785020198712,2023-10-02 12:20:10.888383,2023-10-02 12:20:11.206514,0 days 00:00:00.318131,47263.58985986397,470,sag,COMPLETE
3502,0.6337482257888415,2023-10-02 12:20:11.208512,2023-10-02 12:20:11.409525,0 days 00:00:00.201013,14.520529395233323,320,sag,COMPLETE
3503,0.6101648651599519,2023-10-02 12:20:11.410534,2023-10-02 12:20:11.601925,0 days 00:00:00.191391,5.302008766734767,490,newton-cg,COMPLETE
3504,0.6449939949776177,2023-10-02 12:20:11.602970,2023-10-02 12:20:12.049151,0 days 00:00:00.446181,584.9655449415927,500,saga,COMPLETE
3505,0.5,2023-10-02 12:20:12.051154,2023-10-02 12:20:12.268317,0 days 00:00:00.217163,0.02046492437771666,480,liblinear,COMPLETE
3506,0.5478764057211486,2023-10-02 12:20:12.268317,2023-10-02 12:20:12.481627,0 days 00:00:00.213310,0.7014363474484487,490,sag,COMPLETE
3507,0.6590785020198712,2023-10-02 12:20:12.483630,2023-10-02 12:20:12.728955,0 days 00:00:00.245325,26091.064053887516,470,sag,COMPLETE
3508,0.643956763838847,2023-10-02 12:20:12.729952,2023-10-02 12:20:12.979622,0 days 00:00:00.249670,25.371359287164967,450,sag,COMPLETE
3509,0.5,2023-10-02 12:20:12.980622,2023-10-02 12:20:13.156831,0 days 00:00:00.176209,0.004050529475282872,460,sag,COMPLETE
3510,0.5,2023-10-02 12:20:13.158827,2023-10-02 12:20:13.339104,0 days 00:00:00.180277,0.04414896629496891,500,saga,COMPLETE
3511,0.6411180259853696,2023-10-02 12:20:13.340100,2023-10-02 12:20:13.594523,0 days 00:00:00.254423,7773.200711975365,480,sag,COMPLETE
3512,0.6534556174254831,2023-10-02 12:20:13.595534,2023-10-02 12:20:13.862652,0 days 00:00:00.267118,64.58055601401786,490,sag,COMPLETE
3513,0.5,2023-10-02 12:20:13.863654,2023-10-02 12:20:14.429006,0 days 00:00:00.565352,3.17925161399368e-05,290,sag,COMPLETE
3514,0.669996724533246,2023-10-02 12:20:14.430066,2023-10-02 12:20:14.659421,0 days 00:00:00.229355,99008.64335254804,360,sag,COMPLETE
3515,0.6590785020198712,2023-10-02 12:20:14.660422,2023-10-02 12:20:14.959292,0 days 00:00:00.298870,70773.51476902573,350,sag,COMPLETE
3516,0.6481602795064964,2023-10-02 12:20:14.960294,2023-10-02 12:20:15.190490,0 days 00:00:00.230196,72460.87726020733,330,saga,COMPLETE
3517,0.6520362484987444,2023-10-02 12:20:15.191489,2023-10-02 12:20:15.425486,0 days 00:00:00.233997,75706.45167198277,310,sag,COMPLETE
3518,0.637951741456491,2023-10-02 12:20:15.427485,2023-10-02 12:20:15.629938,0 days 00:00:00.202453,71376.91598691703,300,lbfgs,COMPLETE
3519,0.6590785020198712,2023-10-02 12:20:15.630938,2023-10-02 12:20:15.933689,0 days 00:00:00.302751,66079.25073322185,390,sag,COMPLETE
3520,0.6481602795064964,2023-10-02 12:20:15.935690,2023-10-02 12:20:16.170457,0 days 00:00:00.234767,66214.21610054637,350,sag,COMPLETE
3521,0.6449939949776177,2023-10-02 12:20:16.172455,2023-10-02 12:20:16.396667,0 days 00:00:00.224212,91576.75214912584,340,sag,COMPLETE
3522,0.6442843105142483,2023-10-02 12:20:16.397672,2023-10-02 12:20:16.690788,0 days 00:00:00.293116,67446.42278075832,270,saga,COMPLETE
3523,0.6520362484987444,2023-10-02 12:20:16.691788,2023-10-02 12:20:16.919015,0 days 00:00:00.227227,95617.3225093151,370,sag,COMPLETE
3524,0.6520362484987444,2023-10-02 12:20:16.920015,2023-10-02 12:20:17.133269,0 days 00:00:00.213254,53331.201452521185,290,sag,COMPLETE
3525,0.6590785020198712,2023-10-02 12:20:17.134269,2023-10-02 12:20:17.363091,0 days 00:00:00.228822,96437.27292730335,360,sag,COMPLETE
3526,0.6411180259853696,2023-10-02 12:20:17.364091,2023-10-02 12:20:17.676828,0 days 00:00:00.312737,44135.219412470135,390,sag,COMPLETE
3527,0.6449939949776177,2023-10-02 12:20:17.678824,2023-10-02 12:20:17.864240,0 days 00:00:00.185416,41061.7919294858,340,newton-cg,COMPLETE
3528,0.666120755540998,2023-10-02 12:20:17.866239,2023-10-02 12:20:18.092897,0 days 00:00:00.226658,92932.06507352706,320,saga,COMPLETE
3529,0.6411180259853696,2023-10-02 12:20:18.093902,2023-10-02 12:20:18.317243,0 days 00:00:00.223341,99230.4693783473,360,sag,COMPLETE
3530,0.6520362484987444,2023-10-02 12:20:18.318243,2023-10-02 12:20:18.632994,0 days 00:00:00.314751,49036.191399267285,430,sag,COMPLETE
3531,0.6520362484987444,2023-10-02 12:20:18.634990,2023-10-02 12:20:18.858847,0 days 00:00:00.223857,98796.35252854589,320,sag,COMPLETE
3532,0.637951741456491,2023-10-02 12:20:18.860849,2023-10-02 12:20:19.027903,0 days 00:00:00.167054,48145.136408418104,360,liblinear,COMPLETE
3533,0.5,2023-10-02 12:20:19.028906,2023-10-02 12:20:19.283145,0 days 00:00:00.254239,0.012194568358129373,280,sag,COMPLETE
3534,0.6559122174909924,2023-10-02 12:20:19.284145,2023-10-02 12:20:19.537199,0 days 00:00:00.253054,38291.13100696611,380,sag,COMPLETE
3535,0.5,2023-10-02 12:20:19.538706,2023-10-02 12:20:19.702410,0 days 00:00:00.163704,0.09781825952915901,400,saga,COMPLETE
3536,0.6520362484987444,2023-10-02 12:20:19.704412,2023-10-02 12:20:19.936491,0 days 00:00:00.232079,33477.26999317865,400,sag,COMPLETE
3537,0.637951741456491,2023-10-02 12:20:19.939054,2023-10-02 12:20:20.247611,0 days 00:00:00.308557,60235.83681836405,410,sag,COMPLETE
3538,0.669996724533246,2023-10-02 12:20:20.248610,2023-10-02 12:20:20.467786,0 days 00:00:00.219176,53385.64495747177,330,sag,COMPLETE
3539,0.6590785020198712,2023-10-02 12:20:20.468782,2023-10-02 12:20:20.702842,0 days 00:00:00.234060,57916.35249090419,340,sag,COMPLETE
3540,0.6481602795064964,2023-10-02 12:20:20.704850,2023-10-02 12:20:20.968418,0 days 00:00:00.263568,52103.73066835057,350,saga,COMPLETE
3541,0.6590785020198712,2023-10-02 12:20:20.969419,2023-10-02 12:20:21.261825,0 days 00:00:00.292406,71225.50523418153,340,sag,COMPLETE
3542,0.6559122174909924,2023-10-02 12:20:21.261825,2023-10-02 12:20:21.510290,0 days 00:00:00.248465,45404.52275849631,320,sag,COMPLETE
3543,0.637951741456491,2023-10-02 12:20:21.510290,2023-10-02 12:20:21.709101,0 days 00:00:00.198811,63993.9874081112,360,lbfgs,COMPLETE
3544,0.6590785020198712,2023-10-02 12:20:21.709101,2023-10-02 12:20:22.017521,0 days 00:00:00.308420,33569.66473224395,350,sag,COMPLETE
3545,0.6309094879353642,2023-10-02 12:20:22.019562,2023-10-02 12:20:22.287463,0 days 00:00:00.267901,68331.48128268776,340,sag,COMPLETE
3546,0.6520362484987444,2023-10-02 12:20:22.287463,2023-10-02 12:20:22.540354,0 days 00:00:00.252891,94877.27046665,390,saga,COMPLETE
3547,0.6552025330276231,2023-10-02 12:20:22.540354,2023-10-02 12:20:22.786626,0 days 00:00:00.246272,96294.97014736934,420,sag,COMPLETE
3548,0.6520362484987444,2023-10-02 12:20:22.802243,2023-10-02 12:20:23.100242,0 days 00:00:00.297999,43462.77209647199,330,sag,COMPLETE
3549,0.651326564035375,2023-10-02 12:20:23.100242,2023-10-02 12:20:23.375635,0 days 00:00:00.275393,31174.9306280455,420,sag,COMPLETE
3550,0.6520362484987444,2023-10-02 12:20:23.376629,2023-10-02 12:20:23.622262,0 days 00:00:00.245633,51972.82937909752,370,sag,COMPLETE
3551,0.6597881864832406,2023-10-02 12:20:23.622262,2023-10-02 12:20:23.843373,0 days 00:00:00.221111,96826.37437363238,310,sag,COMPLETE
3552,0.6411180259853696,2023-10-02 12:20:23.843373,2023-10-02 12:20:24.168780,0 days 00:00:00.325407,31542.87423522717,300,saga,COMPLETE
3553,0.637951741456491,2023-10-02 12:20:24.169783,2023-10-02 12:20:24.400528,0 days 00:00:00.230745,31859.817747582623,350,sag,COMPLETE
3554,0.6559122174909924,2023-10-02 12:20:24.400528,2023-10-02 12:20:24.635736,0 days 00:00:00.235208,42199.67992050333,340,sag,COMPLETE
3555,0.6449939949776177,2023-10-02 12:20:24.644753,2023-10-02 12:20:24.902680,0 days 00:00:00.257927,53308.33035211029,360,newton-cg,COMPLETE
3556,0.6520362484987444,2023-10-02 12:20:24.902680,2023-10-02 12:20:25.114289,0 days 00:00:00.211609,24910.29995783389,350,sag,COMPLETE
3557,0.6449939949776177,2023-10-02 12:20:25.114289,2023-10-02 12:20:25.408457,0 days 00:00:00.294168,65014.31747995436,320,sag,COMPLETE
3558,0.6590785020198712,2023-10-02 12:20:25.408457,2023-10-02 12:20:25.626787,0 days 00:00:00.218330,28398.272358009363,310,saga,COMPLETE
3559,0.637951741456491,2023-10-02 12:20:25.626787,2023-10-02 12:20:25.893708,0 days 00:00:00.266921,63602.34109085579,340,liblinear,COMPLETE
3560,0.6520362484987444,2023-10-02 12:20:25.893708,2023-10-02 12:20:26.113308,0 days 00:00:00.219600,43793.586742433756,320,sag,COMPLETE
3561,0.666120755540998,2023-10-02 12:20:26.113308,2023-10-02 12:20:26.370841,0 days 00:00:00.257533,97304.31623695783,370,sag,COMPLETE
3562,0.6520362484987444,2023-10-02 12:20:26.370841,2023-10-02 12:20:26.621692,0 days 00:00:00.250851,24008.94840234862,380,sag,COMPLETE
3563,0.6520362484987444,2023-10-02 12:20:26.621692,2023-10-02 12:20:26.978173,0 days 00:00:00.356481,32137.970572292455,350,sag,COMPLETE
3564,0.6481602795064964,2023-10-02 12:20:26.979225,2023-10-02 12:20:27.232842,0 days 00:00:00.253617,44737.80411321206,330,saga,COMPLETE
3565,0.5,2023-10-02 12:20:27.232842,2023-10-02 12:20:27.412784,0 days 00:00:00.179942,0.006472573445622501,310,sag,COMPLETE
3566,0.6069985806310733,2023-10-02 12:20:27.412784,2023-10-02 12:20:27.687297,0 days 00:00:00.274513,4.781605012878449,330,sag,COMPLETE
3567,0.6534556174254831,2023-10-02 12:20:27.688308,2023-10-02 12:20:27.926069,0 days 00:00:00.237761,86.52669937901197,320,sag,COMPLETE
3568,0.6520362484987444,2023-10-02 12:20:27.926069,2023-10-02 12:20:28.161685,0 days 00:00:00.235616,22372.851555235044,400,sag,COMPLETE
3569,0.6449939949776177,2023-10-02 12:20:28.161685,2023-10-02 12:20:28.412819,0 days 00:00:00.251134,61708.30974451943,330,sag,COMPLETE
3570,0.637951741456491,2023-10-02 12:20:28.412819,2023-10-02 12:20:28.709689,0 days 00:00:00.296870,34298.01553034276,370,lbfgs,COMPLETE
