number,value,datetime_start,datetime_complete,duration,params_C,params_max_iter,params_solver,state
8949,0.637951741456491,2023-10-02 12:58:56.451884,2023-10-02 12:58:57.050040,0 days 00:00:00.598156,5255.663879131851,140,lbfgs,COMPLETE
8950,0.5,2023-10-02 12:58:57.050040,2023-10-02 12:58:57.644545,0 days 00:00:00.594505,0.00019926141186789044,380,sag,COMPLETE
8951,0.5,2023-10-02 12:58:57.644545,2023-10-02 12:58:58.178370,0 days 00:00:00.533825,0.004478252448493773,360,sag,COMPLETE
8952,0.6457036794409869,2023-10-02 12:58:58.193980,2023-10-02 12:58:58.662368,0 days 00:00:00.468388,165.45391671592077,340,sag,COMPLETE
8953,0.643956763838847,2023-10-02 12:58:58.678020,2023-10-02 12:58:59.214480,0 days 00:00:00.536460,26.85013591355942,440,sag,COMPLETE
8954,0.6309094879353642,2023-10-02 12:58:59.229885,2023-10-02 12:58:59.798895,0 days 00:00:00.569010,353.3684058055922,120,sag,COMPLETE
8955,0.6449939949776177,2023-10-02 12:58:59.798895,2023-10-02 12:59:00.420269,0 days 00:00:00.621374,728.8669302428841,430,sag,COMPLETE
8956,0.6590785020198712,2023-10-02 12:59:00.435931,2023-10-02 12:59:01.030573,0 days 00:00:00.594642,47307.596788334995,350,sag,COMPLETE
8957,0.6590785020198712,2023-10-02 12:59:01.030573,2023-10-02 12:59:01.550008,0 days 00:00:00.519435,7341.814593349256,370,sag,COMPLETE
8958,0.6590785020198712,2023-10-02 12:59:01.550008,2023-10-02 12:59:02.162093,0 days 00:00:00.612085,26490.739842103565,360,sag,COMPLETE
8959,0.5,2023-10-02 12:59:02.162093,2023-10-02 12:59:03.227807,0 days 00:00:01.065714,2.2485628226869166e-05,450,sag,COMPLETE
8960,0.6449939949776177,2023-10-02 12:59:03.227807,2023-10-02 12:59:03.872069,0 days 00:00:00.644262,2721.1911251420593,450,sag,COMPLETE
8961,0.637951741456491,2023-10-02 12:59:03.872069,2023-10-02 12:59:04.427812,0 days 00:00:00.555743,12552.666086473424,380,newton-cg,COMPLETE
8962,0.6520362484987444,2023-10-02 12:59:04.427812,2023-10-02 12:59:04.923638,0 days 00:00:00.495826,44715.12614728749,400,sag,COMPLETE
8963,0.6590785020198712,2023-10-02 12:59:04.939283,2023-10-02 12:59:05.562248,0 days 00:00:00.622965,65466.196804176274,410,sag,COMPLETE
8964,0.649579648433235,2023-10-02 12:59:05.563349,2023-10-02 12:59:06.136949,0 days 00:00:00.573600,128.64588372186506,340,sag,COMPLETE
8965,0.6449939949776177,2023-10-02 12:59:06.149469,2023-10-02 12:59:06.817487,0 days 00:00:00.668018,23666.5176228123,460,sag,COMPLETE
8966,0.6449939949776177,2023-10-02 12:59:06.817487,2023-10-02 12:59:07.429412,0 days 00:00:00.611925,4770.775057781539,370,sag,COMPLETE
8967,0.6534556174254831,2023-10-02 12:59:07.445045,2023-10-02 12:59:07.884148,0 days 00:00:00.439103,101.48594508114631,430,liblinear,COMPLETE
8968,0.6541653018888526,2023-10-02 12:59:07.899776,2023-10-02 12:59:08.515977,0 days 00:00:00.616201,32.72557679402662,360,sag,COMPLETE
8969,0.6006660115733159,2023-10-02 12:59:08.515977,2023-10-02 12:59:09.117613,0 days 00:00:00.601636,3.341612106869327,390,sag,COMPLETE
8970,0.6520362484987444,2023-10-02 12:59:09.117613,2023-10-02 12:59:09.760812,0 days 00:00:00.643199,1547.520645609473,410,sag,COMPLETE
8971,0.608417949557812,2023-10-02 12:59:09.760812,2023-10-02 12:59:10.203101,0 days 00:00:00.442289,2.5686880274974953,450,sag,COMPLETE
8972,0.6590785020198712,2023-10-02 12:59:10.203101,2023-10-02 12:59:10.811226,0 days 00:00:00.608125,10435.148573433395,330,sag,COMPLETE
8973,0.6077082650944426,2023-10-02 12:59:10.811226,2023-10-02 12:59:11.383182,0 days 00:00:00.571956,4.0189850632399,350,lbfgs,COMPLETE
8974,0.5,2023-10-02 12:59:11.385178,2023-10-02 12:59:11.918688,0 days 00:00:00.533510,0.0760807594735829,420,sag,COMPLETE
8975,0.6520362484987444,2023-10-02 12:59:11.921688,2023-10-02 12:59:12.518852,0 days 00:00:00.597164,34134.40038071291,370,sag,COMPLETE
8976,0.6590785020198712,2023-10-02 12:59:12.520852,2023-10-02 12:59:13.037522,0 days 00:00:00.516670,66494.58774557858,460,sag,COMPLETE
8977,0.6449939949776177,2023-10-02 12:59:13.039659,2023-10-02 12:59:13.639933,0 days 00:00:00.600274,17975.73648208961,440,sag,COMPLETE
8978,0.6411180259853696,2023-10-02 12:59:13.642930,2023-10-02 12:59:14.234179,0 days 00:00:00.591249,5692.597523156118,350,sag,COMPLETE
8979,0.5,2023-10-02 12:59:14.236175,2023-10-02 12:59:14.771732,0 days 00:00:00.535557,0.042498813374536794,340,sag,COMPLETE
8980,0.6520362484987444,2023-10-02 12:59:14.774722,2023-10-02 12:59:15.377687,0 days 00:00:00.602965,3134.6353585592005,360,sag,COMPLETE
8981,0.6590785020198712,2023-10-02 12:59:15.380822,2023-10-02 12:59:15.890863,0 days 00:00:00.510041,41843.17989724348,390,sag,COMPLETE
8982,0.6590785020198712,2023-10-02 12:59:15.892854,2023-10-02 12:59:16.480017,0 days 00:00:00.587163,8783.01118263504,380,sag,COMPLETE
8983,0.6449939949776177,2023-10-02 12:59:16.480017,2023-10-02 12:59:17.085942,0 days 00:00:00.605925,1138.105791811344,450,sag,COMPLETE
8984,0.5,2023-10-02 12:59:17.085942,2023-10-02 12:59:17.666076,0 days 00:00:00.580134,0.00024251716230598748,460,sag,COMPLETE
8985,0.6590785020198712,2023-10-02 12:59:17.666076,2023-10-02 12:59:18.278940,0 days 00:00:00.612864,26552.257949659474,430,sag,COMPLETE
8986,0.6590785020198712,2023-10-02 12:59:18.278940,2023-10-02 12:59:18.801842,0 days 00:00:00.522902,15572.167304811706,370,sag,COMPLETE
8987,0.6059613494923026,2023-10-02 12:59:18.801842,2023-10-02 12:59:19.345158,0 days 00:00:00.543316,1.6485621963422115,440,newton-cg,COMPLETE
8988,0.6520362484987444,2023-10-02 12:59:19.360783,2023-10-02 12:59:19.941953,0 days 00:00:00.581170,68999.94274232951,350,sag,COMPLETE
8989,0.5,2023-10-02 12:59:19.941953,2023-10-02 12:59:20.506161,0 days 00:00:00.564208,0.0002954347126146934,460,sag,COMPLETE
8990,0.637951741456491,2023-10-02 12:59:20.506161,2023-10-02 12:59:21.039125,0 days 00:00:00.532964,45905.15901156736,330,liblinear,COMPLETE
8991,0.5,2023-10-02 12:59:21.039125,2023-10-02 12:59:21.478933,0 days 00:00:00.439808,0.001915450796569263,270,sag,COMPLETE
8992,0.6534556174254831,2023-10-02 12:59:21.494951,2023-10-02 12:59:22.028125,0 days 00:00:00.533174,52.35351415899345,360,sag,COMPLETE
8993,0.6590785020198712,2023-10-02 12:59:22.043970,2023-10-02 12:59:22.639149,0 days 00:00:00.595179,99907.43002446782,400,sag,COMPLETE
8994,0.5478764057211486,2023-10-02 12:59:22.639149,2023-10-02 12:59:23.174370,0 days 00:00:00.535221,0.7541494846171736,340,sag,COMPLETE
8995,0.6449939949776177,2023-10-02 12:59:23.174370,2023-10-02 12:59:23.681644,0 days 00:00:00.507274,7069.260698609732,380,sag,COMPLETE
8996,0.6520362484987444,2023-10-02 12:59:23.681644,2023-10-02 12:59:24.286690,0 days 00:00:00.605046,22233.298356496547,370,sag,COMPLETE
8997,0.6520362484987444,2023-10-02 12:59:24.286690,2023-10-02 12:59:24.882434,0 days 00:00:00.595744,99716.20090083416,410,sag,COMPLETE
8998,0.5,2023-10-02 12:59:24.898120,2023-10-02 12:59:25.431984,0 days 00:00:00.533864,0.012564160874226973,350,lbfgs,COMPLETE
8999,0.5,2023-10-02 12:59:25.431984,2023-10-02 12:59:26.404571,0 days 00:00:00.972587,2.871264332798845e-05,360,sag,COMPLETE
9000,0.5,2023-10-02 12:59:26.404571,2023-10-02 12:59:26.843788,0 days 00:00:00.439217,0.035695224344945306,460,sag,COMPLETE
9001,0.5,2023-10-02 12:59:26.859387,2023-10-02 12:59:27.393173,0 days 00:00:00.533786,0.0051344543107411725,420,sag,COMPLETE
9002,0.6449939949776177,2023-10-02 12:59:27.393173,2023-10-02 12:59:28.004503,0 days 00:00:00.611330,2360.134422328064,450,sag,COMPLETE
9003,0.6590785020198712,2023-10-02 12:59:28.004503,2023-10-02 12:59:28.624158,0 days 00:00:00.619655,35028.07564083094,440,sag,COMPLETE
9004,0.5,2023-10-02 12:59:28.624158,2023-10-02 12:59:29.258868,0 days 00:00:00.634710,0.00011378890409271576,380,sag,COMPLETE
9005,0.6267059722677149,2023-10-02 12:59:29.258868,2023-10-02 12:59:29.715197,0 days 00:00:00.456329,9.862906587806082,330,sag,COMPLETE
9006,0.6573315864177312,2023-10-02 12:59:29.715197,2023-10-02 12:59:30.263224,0 days 00:00:00.548027,39.853999396952155,460,sag,COMPLETE
9007,0.6629544710121192,2023-10-02 12:59:30.263224,2023-10-02 12:59:30.868815,0 days 00:00:00.605591,4035.6278009574685,360,sag,COMPLETE
9008,0.6062888961677039,2023-10-02 12:59:30.868815,2023-10-02 12:59:31.407958,0 days 00:00:00.539143,6.610726591766757,390,sag,COMPLETE
9009,0.6590785020198712,2023-10-02 12:59:31.407958,2023-10-02 12:59:32.006515,0 days 00:00:00.598557,16758.24619322751,340,sag,COMPLETE
9010,0.6559122174909924,2023-10-02 12:59:32.006515,2023-10-02 12:59:32.506316,0 days 00:00:00.499801,10270.025069063775,370,sag,COMPLETE
9011,0.637951741456491,2023-10-02 12:59:32.521972,2023-10-02 12:59:33.071333,0 days 00:00:00.549361,29638.85521609246,440,newton-cg,COMPLETE
9012,0.5,2023-10-02 12:59:33.071333,2023-10-02 12:59:33.603614,0 days 00:00:00.532281,0.1942108633564778,350,sag,COMPLETE
9013,0.5,2023-10-02 12:59:33.603614,2023-10-02 12:59:34.137701,0 days 00:00:00.534087,0.007264226796146103,430,sag,COMPLETE
9014,0.6534556174254831,2023-10-02 12:59:34.153316,2023-10-02 12:59:34.718069,0 days 00:00:00.564753,70.54756054923114,380,sag,COMPLETE
9015,0.637951741456491,2023-10-02 12:59:34.718069,2023-10-02 12:59:35.142345,0 days 00:00:00.424276,49634.68747429955,450,liblinear,COMPLETE
9016,0.6520362484987444,2023-10-02 12:59:35.157998,2023-10-02 12:59:35.752496,0 days 00:00:00.594498,5663.702863136644,400,sag,COMPLETE
9017,0.6449939949776177,2023-10-02 12:59:35.752496,2023-10-02 12:59:36.365074,0 days 00:00:00.612578,1507.8624700494465,460,sag,COMPLETE
9018,0.5,2023-10-02 12:59:36.365074,2023-10-02 12:59:36.902685,0 days 00:00:00.537611,0.24912272697228283,360,sag,COMPLETE
9019,0.6590785020198712,2023-10-02 12:59:36.902685,2023-10-02 12:59:37.400431,0 days 00:00:00.497746,62223.167800854644,370,sag,COMPLETE
9020,0.6590785020198712,2023-10-02 12:59:37.400431,2023-10-02 12:59:37.999317,0 days 00:00:00.598886,14510.283955144127,350,sag,COMPLETE
9021,0.6583688175565019,2023-10-02 12:59:37.999317,2023-10-02 12:59:38.600086,0 days 00:00:00.600769,22961.233577551546,390,sag,COMPLETE
9022,0.5,2023-10-02 12:59:38.607594,2023-10-02 12:59:39.159421,0 days 00:00:00.551827,0.0006762420595409082,340,sag,COMPLETE
9023,0.637951741456491,2023-10-02 12:59:39.176106,2023-10-02 12:59:39.768849,0 days 00:00:00.592743,895.4366933027981,370,sag,COMPLETE
9024,0.5,2023-10-02 12:59:39.768849,2023-10-02 12:59:40.224669,0 days 00:00:00.455820,0.02419821090960499,330,lbfgs,COMPLETE
9025,0.6449939949776177,2023-10-02 12:59:40.224669,2023-10-02 12:59:40.850572,0 days 00:00:00.625903,8666.206621698031,420,sag,COMPLETE
9026,0.6520362484987444,2023-10-02 12:59:40.850572,2023-10-02 12:59:41.464036,0 days 00:00:00.613464,3381.1995899183084,460,sag,COMPLETE
9027,0.6590785020198712,2023-10-02 12:59:41.464036,2023-10-02 12:59:42.074799,0 days 00:00:00.610763,67716.47340014989,450,sag,COMPLETE
9028,0.5,2023-10-02 12:59:42.074799,2023-10-02 12:59:42.640227,0 days 00:00:00.565428,0.0029296550370956163,360,sag,COMPLETE
9029,0.5,2023-10-02 12:59:42.640227,2023-10-02 12:59:43.110736,0 days 00:00:00.470509,0.0004277406053600097,380,sag,COMPLETE
9030,0.6534556174254831,2023-10-02 12:59:43.110736,2023-10-02 12:59:43.658831,0 days 00:00:00.548095,80.70260018938517,440,sag,COMPLETE
9031,0.6520362484987444,2023-10-02 12:59:43.674464,2023-10-02 12:59:44.270678,0 days 00:00:00.596214,37180.09761846286,450,sag,COMPLETE
9032,0.5,2023-10-02 12:59:44.286308,2023-10-02 12:59:44.835726,0 days 00:00:00.549418,0.001065993390256929,460,sag,COMPLETE
9033,0.5,2023-10-02 12:59:44.835726,2023-10-02 12:59:45.305714,0 days 00:00:00.469988,0.018763136477795064,350,sag,COMPLETE
9034,0.6590785020198712,2023-10-02 12:59:45.311234,2023-10-02 12:59:45.917475,0 days 00:00:00.606241,11591.791413821325,320,sag,COMPLETE
9035,0.6449939949776177,2023-10-02 12:59:45.933123,2023-10-02 12:59:46.513661,0 days 00:00:00.580538,45494.12439698698,410,newton-cg,COMPLETE
9036,0.6520362484987444,2023-10-02 12:59:46.513661,2023-10-02 12:59:47.125917,0 days 00:00:00.612256,24846.84711540203,340,sag,COMPLETE
9037,0.643956763838847,2023-10-02 12:59:47.125917,2023-10-02 12:59:47.675348,0 days 00:00:00.549431,26.89251061843584,360,sag,COMPLETE
9038,0.6449939949776177,2023-10-02 12:59:47.675348,2023-10-02 12:59:48.193430,0 days 00:00:00.518082,4908.480994377846,430,sag,COMPLETE
9039,0.6386614259198603,2023-10-02 12:59:48.193430,2023-10-02 12:59:48.725807,0 days 00:00:00.532377,445.8969447873722,380,liblinear,COMPLETE
9040,0.6590785020198712,2023-10-02 12:59:48.725807,2023-10-02 12:59:49.337841,0 days 00:00:00.612034,99212.37000102986,460,sag,COMPLETE
9041,0.6520362484987444,2023-10-02 12:59:49.337841,2023-10-02 12:59:49.950008,0 days 00:00:00.612167,2169.9968144924387,400,sag,COMPLETE
9042,0.5,2023-10-02 12:59:49.950008,2023-10-02 12:59:50.513332,0 days 00:00:00.563324,0.030988818411757817,350,sag,COMPLETE
9043,0.5313352986133857,2023-10-02 12:59:50.513332,2023-10-02 12:59:50.952929,0 days 00:00:00.439597,0.521268997521509,370,sag,COMPLETE
9044,0.6481602795064964,2023-10-02 12:59:50.968551,2023-10-02 12:59:51.548274,0 days 00:00:00.579723,17434.509380674033,360,sag,COMPLETE
9045,0.6369145103177202,2023-10-02 12:59:51.564016,2023-10-02 12:59:52.099043,0 days 00:00:00.535027,18.99059783540678,390,sag,COMPLETE
9046,0.5982094115078066,2023-10-02 12:59:52.099043,2023-10-02 12:59:52.632414,0 days 00:00:00.533371,1.8753564700705279,450,sag,COMPLETE
9047,0.6590785020198712,2023-10-02 12:59:52.632414,2023-10-02 12:59:53.243186,0 days 00:00:00.610772,66211.40541319967,370,sag,COMPLETE
9048,0.637951741456491,2023-10-02 12:59:53.258832,2023-10-02 12:59:53.744760,0 days 00:00:00.485928,7208.66163141806,340,lbfgs,COMPLETE
9049,0.528169014084507,2023-10-02 12:59:53.744760,2023-10-02 12:59:54.294787,0 days 00:00:00.550027,0.44217784374030333,470,sag,COMPLETE
9050,0.5,2023-10-02 12:59:54.294787,2023-10-02 12:59:54.831471,0 days 00:00:00.536684,0.061935393294911614,330,sag,COMPLETE
9051,0.6520362484987444,2023-10-02 12:59:54.831471,2023-10-02 12:59:55.439019,0 days 00:00:00.607548,29165.917052307046,420,sag,COMPLETE
9052,0.6590785020198712,2023-10-02 12:59:55.439019,2023-10-02 12:59:56.033750,0 days 00:00:00.594731,46924.91664123239,390,sag,COMPLETE
9053,0.5,2023-10-02 12:59:56.047782,2023-10-02 12:59:56.568073,0 days 00:00:00.520291,0.000128312458299294,440,sag,COMPLETE
9054,0.666120755540998,2023-10-02 12:59:56.568073,2023-10-02 12:59:57.200698,0 days 00:00:00.632625,13218.733194878372,460,sag,COMPLETE
9055,0.6590785020198712,2023-10-02 12:59:57.215712,2023-10-02 12:59:57.791952,0 days 00:00:00.576240,3390.4124805049046,200,sag,COMPLETE
9056,0.6449939949776177,2023-10-02 12:59:57.791952,2023-10-02 12:59:58.383816,0 days 00:00:00.591864,20056.761183091003,360,sag,COMPLETE
9057,0.5,2023-10-02 12:59:58.400146,2023-10-02 12:59:59.063501,0 days 00:00:00.663355,4.481745477073731e-05,350,sag,COMPLETE
9058,0.6520362484987444,2023-10-02 12:59:59.079138,2023-10-02 12:59:59.680589,0 days 00:00:00.601451,67347.1980324257,430,sag,COMPLETE
9059,0.5,2023-10-02 12:59:59.680589,2023-10-02 13:00:00.458698,0 days 00:00:00.778109,5.701460648768203e-05,380,sag,COMPLETE
9060,0.637951741456491,2023-10-02 13:00:00.458698,2023-10-02 13:00:01.022257,0 days 00:00:00.563559,33566.5467306249,500,newton-cg,COMPLETE
9061,0.66224478654875,2023-10-02 13:00:01.022257,2023-10-02 13:00:01.644088,0 days 00:00:00.621831,99430.17052552738,440,sag,COMPLETE
9062,0.6590785020198712,2023-10-02 13:00:01.652127,2023-10-02 13:00:02.169232,0 days 00:00:00.517105,9453.928146010596,470,sag,COMPLETE
9063,0.637951741456491,2023-10-02 13:00:02.169232,2023-10-02 13:00:02.703215,0 days 00:00:00.533983,5925.593522180671,370,liblinear,COMPLETE
9064,0.6520362484987444,2023-10-02 13:00:02.703215,2023-10-02 13:00:03.298175,0 days 00:00:00.594960,45544.37856990968,410,sag,COMPLETE
9065,0.6449939949776177,2023-10-02 13:00:03.313809,2023-10-02 13:00:03.925482,0 days 00:00:00.611673,955.2182185069817,450,sag,COMPLETE
9066,0.6590785020198712,2023-10-02 13:00:03.925482,2023-10-02 13:00:04.512446,0 days 00:00:00.586964,22762.5920925278,340,sag,COMPLETE
9067,0.637951741456491,2023-10-02 13:00:04.512446,2023-10-02 13:00:05.039379,0 days 00:00:00.526933,2619.54098007821,470,sag,COMPLETE
9068,0.6520362484987444,2023-10-02 13:00:05.039379,2023-10-02 13:00:05.666316,0 days 00:00:00.626937,12652.869632753529,460,sag,COMPLETE
9069,0.5,2023-10-02 13:00:05.666316,2023-10-02 13:00:06.514736,0 days 00:00:00.848420,3.854960214100577e-05,500,sag,COMPLETE
9070,0.6559122174909924,2023-10-02 13:00:06.514736,2023-10-02 13:00:07.110797,0 days 00:00:00.596061,32975.557119612466,350,sag,COMPLETE
9071,0.6449939949776177,2023-10-02 13:00:07.110797,2023-10-02 13:00:07.722653,0 days 00:00:00.611856,1681.3260417277206,450,sag,COMPLETE
9072,0.6520362484987444,2023-10-02 13:00:07.738260,2023-10-02 13:00:08.239685,0 days 00:00:00.501425,4343.1167617998335,400,sag,COMPLETE
9073,0.6449939949776177,2023-10-02 13:00:08.239685,2023-10-02 13:00:08.835921,0 days 00:00:00.596236,62784.44267200451,360,sag,COMPLETE
9074,0.6069985806310733,2023-10-02 13:00:08.835921,2023-10-02 13:00:09.393214,0 days 00:00:00.557293,4.237668877234664,370,sag,COMPLETE
9075,0.6449939949776177,2023-10-02 13:00:09.393214,2023-10-02 13:00:10.030432,0 days 00:00:00.637218,99921.91977302085,500,sag,COMPLETE
9076,0.6316191723987334,2023-10-02 13:00:10.030432,2023-10-02 13:00:10.608950,0 days 00:00:00.578518,542.7885801346644,470,lbfgs,COMPLETE
9077,0.6267059722677149,2023-10-02 13:00:10.608950,2023-10-02 13:00:11.047209,0 days 00:00:00.438259,12.565855520248334,440,sag,COMPLETE
9078,0.5,2023-10-02 13:00:11.061732,2023-10-02 13:00:11.605802,0 days 00:00:00.544070,0.08484542820269261,500,sag,COMPLETE
9079,0.5,2023-10-02 13:00:11.605802,2023-10-02 13:00:12.144290,0 days 00:00:00.538488,0.14687017130137242,330,sag,COMPLETE
9080,0.6449939949776177,2023-10-02 13:00:12.144290,2023-10-02 13:00:12.773226,0 days 00:00:00.628936,8754.491211290924,380,sag,COMPLETE
9081,0.5,2023-10-02 13:00:12.773226,2023-10-02 13:00:13.337003,0 days 00:00:00.563777,0.00123990650955936,420,sag,COMPLETE
9082,0.6449939949776177,2023-10-02 13:00:13.337003,2023-10-02 13:00:13.933966,0 days 00:00:00.596963,18842.080804378926,360,sag,COMPLETE
9083,0.6418277104487389,2023-10-02 13:00:13.933966,2023-10-02 13:00:14.468080,0 days 00:00:00.534114,313.3169547894664,460,sag,COMPLETE
9084,0.6449939949776177,2023-10-02 13:00:14.468080,2023-10-02 13:00:15.017248,0 days 00:00:00.549168,41677.784646648826,320,newton-cg,COMPLETE
9085,0.6069985806310733,2023-10-02 13:00:15.017248,2023-10-02 13:00:15.569898,0 days 00:00:00.552650,4.4544682614372695,340,sag,COMPLETE
9086,0.5,2023-10-02 13:00:15.580415,2023-10-02 13:00:16.239731,0 days 00:00:00.659316,9.112829463638639e-05,390,sag,COMPLETE
9087,0.6590785020198712,2023-10-02 13:00:16.255365,2023-10-02 13:00:16.850318,0 days 00:00:00.594953,6422.014054568852,350,sag,COMPLETE
9088,0.6457036794409869,2023-10-02 13:00:16.865960,2023-10-02 13:00:17.291451,0 days 00:00:00.425491,255.6984060823645,370,liblinear,COMPLETE
9089,0.6020853805000546,2023-10-02 13:00:17.307076,2023-10-02 13:00:17.844313,0 days 00:00:00.537237,1.8376022835917303,430,sag,COMPLETE
9090,0.6590785020198712,2023-10-02 13:00:17.844313,2023-10-02 13:00:18.451506,0 days 00:00:00.607193,28204.663139777087,470,sag,COMPLETE
9091,0.5,2023-10-02 13:00:18.451506,2023-10-02 13:00:19.012850,0 days 00:00:00.561344,0.14065441809549492,450,sag,COMPLETE
9092,0.6520362484987444,2023-10-02 13:00:19.012850,2023-10-02 13:00:19.659582,0 days 00:00:00.646732,66155.96565090964,500,sag,COMPLETE
9093,0.6520362484987444,2023-10-02 13:00:19.659582,2023-10-02 13:00:20.166000,0 days 00:00:00.506418,15651.441580569814,380,sag,COMPLETE
9094,0.5,2023-10-02 13:00:20.166000,2023-10-02 13:00:20.710344,0 days 00:00:00.544344,0.2899287149178147,460,sag,COMPLETE
9095,0.5,2023-10-02 13:00:20.710344,2023-10-02 13:00:21.289659,0 days 00:00:00.579315,0.0003494444124076697,500,sag,COMPLETE
9096,0.666120755540998,2023-10-02 13:00:21.289659,2023-10-02 13:00:21.887346,0 days 00:00:00.597687,48413.27885894656,310,sag,COMPLETE
9097,0.6573315864177312,2023-10-02 13:00:21.887346,2023-10-02 13:00:22.441538,0 days 00:00:00.554192,39.73462379431321,470,sag,COMPLETE
9098,0.619663718746588,2023-10-02 13:00:22.441538,2023-10-02 13:00:23.000430,0 days 00:00:00.558892,9.22040150278512,360,lbfgs,COMPLETE
9099,0.6520362484987444,2023-10-02 13:00:23.000430,2023-10-02 13:00:23.502604,0 days 00:00:00.502174,4000.595049717573,430,sag,COMPLETE
9100,0.5,2023-10-02 13:00:23.518238,2023-10-02 13:00:24.035831,0 days 00:00:00.517593,0.10821969896798607,350,sag,COMPLETE
9101,0.6449939949776177,2023-10-02 13:00:24.051242,2023-10-02 13:00:24.648697,0 days 00:00:00.597455,11245.952794520821,400,saga,COMPLETE
9102,0.6449939949776177,2023-10-02 13:00:24.664333,2023-10-02 13:00:25.275051,0 days 00:00:00.610718,25468.210126915466,500,sag,COMPLETE
9103,0.5,2023-10-02 13:00:25.291114,2023-10-02 13:00:25.824532,0 days 00:00:00.533418,0.0034177176430913547,370,sag,COMPLETE
9104,0.5,2023-10-02 13:00:25.824532,2023-10-02 13:00:26.262221,0 days 00:00:00.437689,0.30160109519674255,330,sag,COMPLETE
9105,0.6449939949776177,2023-10-02 13:00:26.277819,2023-10-02 13:00:26.875855,0 days 00:00:00.598036,1609.06561259795,440,sag,COMPLETE
9106,0.6449939949776177,2023-10-02 13:00:26.875855,2023-10-02 13:00:27.526077,0 days 00:00:00.650222,67096.94688371576,470,sag,COMPLETE
9107,0.5,2023-10-02 13:00:27.526077,2023-10-02 13:00:28.082386,0 days 00:00:00.556309,0.012023989269646729,450,sag,COMPLETE
9108,0.6457036794409869,2023-10-02 13:00:28.082386,2023-10-02 13:00:28.679272,0 days 00:00:00.596886,209.4475265268817,340,sag,COMPLETE
9109,0.6520362484987444,2023-10-02 13:00:28.679272,2023-10-02 13:00:29.182674,0 days 00:00:00.503402,6581.547375170184,390,sag,COMPLETE
9110,0.637951741456491,2023-10-02 13:00:29.182674,2023-10-02 13:00:29.729482,0 days 00:00:00.546808,32693.15066725793,420,newton-cg,COMPLETE
9111,0.6298722567965934,2023-10-02 13:00:29.745344,2023-10-02 13:00:30.280190,0 days 00:00:00.534846,16.00353359982113,410,sag,COMPLETE
