number,value,datetime_start,datetime_complete,duration,params_C,params_max_iter,params_solver,state
4223,0.5,2023-10-02 12:23:37.520714,2023-10-02 12:23:37.729765,0 days 00:00:00.209051,0.0047769337475839545,350,sag,COMPLETE
4224,0.6590785020198712,2023-10-02 12:23:37.730766,2023-10-02 12:23:38.102053,0 days 00:00:00.371287,8879.484936196495,430,sag,COMPLETE
4225,0.6520362484987444,2023-10-02 12:23:38.103052,2023-10-02 12:23:38.386102,0 days 00:00:00.283050,5107.6707353317,470,sag,COMPLETE
4226,0.6481602795064964,2023-10-02 12:23:38.388110,2023-10-02 12:23:38.699732,0 days 00:00:00.311622,43638.552811792215,450,saga,COMPLETE
4227,0.5,2023-10-02 12:23:38.701238,2023-10-02 12:23:40.150730,0 days 00:00:01.449492,1.1621817749893423e-05,440,sag,COMPLETE
4228,0.66224478654875,2023-10-02 12:23:40.152731,2023-10-02 12:23:40.466613,0 days 00:00:00.313882,22773.177505192536,480,sag,COMPLETE
4229,0.6449939949776177,2023-10-02 12:23:40.467608,2023-10-02 12:23:40.691430,0 days 00:00:00.223822,64836.73177133244,500,newton-cg,COMPLETE
4230,0.5,2023-10-02 12:23:40.692040,2023-10-02 12:23:41.242943,0 days 00:00:00.550903,4.834807280794124e-05,240,sag,COMPLETE
4231,0.6573315864177312,2023-10-02 12:23:41.242943,2023-10-02 12:23:41.483697,0 days 00:00:00.240754,38.070749156973335,490,sag,COMPLETE
4232,0.637951741456491,2023-10-02 12:23:41.485698,2023-10-02 12:23:41.685842,0 days 00:00:00.200144,11220.568133251665,310,liblinear,COMPLETE
4233,0.5478764057211486,2023-10-02 12:23:41.688185,2023-10-02 12:23:42.000704,0 days 00:00:00.312519,0.7180167770865524,460,saga,COMPLETE
4234,0.5,2023-10-02 12:23:42.002704,2023-10-02 12:23:42.536952,0 days 00:00:00.534248,3.994537710056076e-05,490,sag,COMPLETE
4235,0.6573315864177312,2023-10-02 12:23:42.537944,2023-10-02 12:23:42.777014,0 days 00:00:00.239070,38.36770709972992,480,sag,COMPLETE
4236,0.5,2023-10-02 12:23:42.778005,2023-10-02 12:23:43.052701,0 days 00:00:00.274696,0.02770767376572884,470,sag,COMPLETE
4237,0.5,2023-10-02 12:23:43.054707,2023-10-02 12:23:43.256759,0 days 00:00:00.202052,0.013782076922825329,500,sag,COMPLETE
4238,0.6520362484987444,2023-10-02 12:23:43.257760,2023-10-02 12:23:43.545943,0 days 00:00:00.288183,33940.9596433793,490,sag,COMPLETE
4239,0.637951741456491,2023-10-02 12:23:43.547943,2023-10-02 12:23:43.937094,0 days 00:00:00.389151,1556.9863873821826,460,saga,COMPLETE
4240,0.666120755540998,2023-10-02 12:23:43.938100,2023-10-02 12:23:44.261476,0 days 00:00:00.323376,47111.65672242631,480,sag,COMPLETE
4241,0.5,2023-10-02 12:23:44.262477,2023-10-02 12:23:44.486526,0 days 00:00:00.224049,0.0008407825693115513,440,sag,COMPLETE
4242,0.5,2023-10-02 12:23:44.487527,2023-10-02 12:23:44.779724,0 days 00:00:00.292197,0.0014665390208514733,470,lbfgs,COMPLETE
4243,0.5,2023-10-02 12:23:44.780724,2023-10-02 12:23:45.029190,0 days 00:00:00.248466,0.00023871716178534844,490,sag,COMPLETE
4244,0.6552025330276231,2023-10-02 12:23:45.030188,2023-10-02 12:23:45.416317,0 days 00:00:00.386129,16302.278493483638,500,sag,COMPLETE
4245,0.6062888961677039,2023-10-02 12:23:45.417317,2023-10-02 12:23:45.636365,0 days 00:00:00.219048,6.323651701226203,450,saga,COMPLETE
4246,0.5,2023-10-02 12:23:45.638366,2023-10-02 12:23:45.869433,0 days 00:00:00.231067,0.0006107142628981972,480,sag,COMPLETE
4247,0.6520362484987444,2023-10-02 12:23:45.870433,2023-10-02 12:23:46.255907,0 days 00:00:00.385474,67422.57677490351,500,sag,COMPLETE
4248,0.6449939949776177,2023-10-02 12:23:46.256901,2023-10-02 12:23:46.476952,0 days 00:00:00.220051,1092.0818562297575,110,sag,COMPLETE
4249,0.5,2023-10-02 12:23:46.478962,2023-10-02 12:23:46.682006,0 days 00:00:00.203044,0.1705563785221088,480,sag,COMPLETE
4250,0.6552025330276231,2023-10-02 12:23:46.683000,2023-10-02 12:23:47.098227,0 days 00:00:00.415227,5538.153644838345,470,saga,COMPLETE
4251,0.6590785020198712,2023-10-02 12:23:47.100221,2023-10-02 12:23:47.396427,0 days 00:00:00.296206,25676.406706936035,390,sag,COMPLETE
4252,0.6534556174254831,2023-10-02 12:23:47.397427,2023-10-02 12:23:47.621990,0 days 00:00:00.224563,87.55527292656312,490,sag,COMPLETE
4253,0.6457036794409869,2023-10-02 12:23:47.623990,2023-10-02 12:23:47.952583,0 days 00:00:00.328593,197.26954249992608,450,sag,COMPLETE
4254,0.6013756960366853,2023-10-02 12:23:47.954588,2023-10-02 12:23:48.152521,0 days 00:00:00.197933,2.485908712624413,290,sag,COMPLETE
4255,0.5478764057211486,2023-10-02 12:23:48.153520,2023-10-02 12:23:48.366133,0 days 00:00:00.212613,0.7822087824034961,460,newton-cg,COMPLETE
4256,0.6418277104487389,2023-10-02 12:23:48.368140,2023-10-02 12:23:48.719759,0 days 00:00:00.351619,299.5269579396678,500,saga,COMPLETE
4257,0.5,2023-10-02 12:23:48.720760,2023-10-02 12:23:49.563299,0 days 00:00:00.842539,1.9348987928122273e-05,480,sag,COMPLETE
4258,0.6449939949776177,2023-10-02 12:23:49.564287,2023-10-02 12:23:49.858909,0 days 00:00:00.294622,2089.0813554992374,490,sag,COMPLETE
4259,0.6520362484987444,2023-10-02 12:23:49.860909,2023-10-02 12:23:50.199173,0 days 00:00:00.338264,9437.281164194279,330,sag,COMPLETE
4260,0.637951741456491,2023-10-02 12:23:50.200172,2023-10-02 12:23:50.396359,0 days 00:00:00.196187,50566.506129600515,470,liblinear,COMPLETE
4261,0.6481602795064964,2023-10-02 12:23:50.397361,2023-10-02 12:23:50.659696,0 days 00:00:00.262335,15333.797398795406,370,sag,COMPLETE
4262,0.6590785020198712,2023-10-02 12:23:50.660693,2023-10-02 12:23:50.991264,0 days 00:00:00.330571,32053.74602825217,280,sag,COMPLETE
4263,0.6442843105142483,2023-10-02 12:23:50.993270,2023-10-02 12:23:51.284425,0 days 00:00:00.291155,99751.67394727192,490,saga,COMPLETE
4264,0.6534556174254831,2023-10-02 12:23:51.285428,2023-10-02 12:23:51.505483,0 days 00:00:00.220055,52.2708352511587,360,sag,COMPLETE
4265,0.619663718746588,2023-10-02 12:23:51.507483,2023-10-02 12:23:51.780058,0 days 00:00:00.272575,9.611239298868762,470,sag,COMPLETE
4266,0.6457036794409869,2023-10-02 12:23:51.781058,2023-10-02 12:23:52.029408,0 days 00:00:00.248350,187.30645401503816,500,sag,COMPLETE
4267,0.666120755540998,2023-10-02 12:23:52.030410,2023-10-02 12:23:52.305509,0 days 00:00:00.275099,23734.433474957354,440,sag,COMPLETE
4268,0.6520362484987444,2023-10-02 12:23:52.307503,2023-10-02 12:23:52.681595,0 days 00:00:00.374092,4850.858292326872,480,saga,COMPLETE
4269,0.637951741456491,2023-10-02 12:23:52.682595,2023-10-02 12:23:52.915173,0 days 00:00:00.232578,68643.72228934102,420,lbfgs,COMPLETE
4270,0.5,2023-10-02 12:23:52.917162,2023-10-02 12:23:53.135490,0 days 00:00:00.218328,0.33589182375431237,460,sag,COMPLETE
4271,0.6590785020198712,2023-10-02 12:23:53.137482,2023-10-02 12:23:53.493057,0 days 00:00:00.355575,10977.101263533063,490,sag,COMPLETE
4272,0.6520362484987444,2023-10-02 12:23:53.495063,2023-10-02 12:23:53.784637,0 days 00:00:00.289574,40670.56078977571,450,sag,COMPLETE
4273,0.5,2023-10-02 12:23:53.785638,2023-10-02 12:23:54.055637,0 days 00:00:00.269999,0.0001401455735020065,500,sag,COMPLETE
4274,0.6411180259853696,2023-10-02 12:23:54.057637,2023-10-02 12:23:54.428746,0 days 00:00:00.371109,20258.30719552888,490,saga,COMPLETE
4275,0.6520362484987444,2023-10-02 12:23:54.429748,2023-10-02 12:23:54.715307,0 days 00:00:00.285559,49950.322555425206,480,sag,COMPLETE
4276,0.6520362484987444,2023-10-02 12:23:54.717306,2023-10-02 12:23:55.001362,0 days 00:00:00.284056,8675.511144565526,470,sag,COMPLETE
4277,0.6520362484987444,2023-10-02 12:23:55.002362,2023-10-02 12:23:55.357613,0 days 00:00:00.355251,31239.617090024625,460,sag,COMPLETE
4278,0.6418277104487389,2023-10-02 12:23:55.358613,2023-10-02 12:23:55.632383,0 days 00:00:00.273770,398.186977844053,500,sag,COMPLETE
4279,0.6520362484987444,2023-10-02 12:23:55.633383,2023-10-02 12:23:55.922709,0 days 00:00:00.289326,15403.793088918736,480,sag,COMPLETE
4280,0.649579648433235,2023-10-02 12:23:55.924713,2023-10-02 12:23:56.277715,0 days 00:00:00.353002,80.7960255702129,410,saga,COMPLETE
4281,0.5,2023-10-02 12:23:56.279710,2023-10-02 12:23:56.507305,0 days 00:00:00.227595,0.0018157777833588836,430,sag,COMPLETE
4282,0.6238672344142374,2023-10-02 12:23:56.508305,2023-10-02 12:23:56.731436,0 days 00:00:00.223131,3337.9870352247217,490,newton-cg,COMPLETE
4283,0.637951741456491,2023-10-02 12:23:56.732442,2023-10-02 12:23:57.100296,0 days 00:00:00.367854,695.1232172221893,480,sag,COMPLETE
4284,0.5855442733922918,2023-10-02 12:23:57.102294,2023-10-02 12:23:57.305994,0 days 00:00:00.203700,1.2993629444636663,470,sag,COMPLETE
4285,0.5792117043345343,2023-10-02 12:23:57.306993,2023-10-02 12:23:57.503071,0 days 00:00:00.196078,1.095023953957496,440,liblinear,COMPLETE
4286,0.6369145103177202,2023-10-02 12:23:57.504072,2023-10-02 12:23:57.789657,0 days 00:00:00.285585,19.685797665103067,490,sag,COMPLETE
4287,0.6481602795064964,2023-10-02 12:23:57.790657,2023-10-02 12:23:58.068919,0 days 00:00:00.278262,24966.426844654616,450,saga,COMPLETE
4288,0.6520362484987444,2023-10-02 12:23:58.069919,2023-10-02 12:23:58.428201,0 days 00:00:00.358282,66740.57989156124,460,sag,COMPLETE
4289,0.6520362484987444,2023-10-02 12:23:58.429200,2023-10-02 12:23:58.723601,0 days 00:00:00.294401,6820.421810776563,500,sag,COMPLETE
4290,0.6449939949776177,2023-10-02 12:23:58.724610,2023-10-02 12:23:58.989662,0 days 00:00:00.265052,99225.0063253642,350,sag,COMPLETE
4291,0.6481602795064964,2023-10-02 12:23:58.991667,2023-10-02 12:23:59.370352,0 days 00:00:00.378685,42372.90262430846,480,sag,COMPLETE
4292,0.5,2023-10-02 12:23:59.371366,2023-10-02 12:23:59.598408,0 days 00:00:00.227042,0.007234281794636237,490,saga,COMPLETE
4293,0.6520362484987444,2023-10-02 12:23:59.599412,2023-10-02 12:23:59.877022,0 days 00:00:00.277610,15962.632294945846,470,sag,COMPLETE
4294,0.6520362484987444,2023-10-02 12:23:59.879022,2023-10-02 12:24:00.257730,0 days 00:00:00.378708,33466.674806113806,500,sag,COMPLETE
4295,0.6020853805000546,2023-10-02 12:24:00.259730,2023-10-02 12:24:00.477527,0 days 00:00:00.217797,1.7537470606831564,480,lbfgs,COMPLETE
4296,0.6520362484987444,2023-10-02 12:24:00.478541,2023-10-02 12:24:00.760696,0 days 00:00:00.282155,99867.74107701605,460,sag,COMPLETE
4297,0.666120755540998,2023-10-02 12:24:00.761696,2023-10-02 12:24:01.126048,0 days 00:00:00.364352,12259.902814340148,490,sag,COMPLETE
4298,0.6069985806310733,2023-10-02 12:24:01.127048,2023-10-02 12:24:01.340102,0 days 00:00:00.213054,4.505752683058993,470,saga,COMPLETE
4299,0.669996724533246,2023-10-02 12:24:01.341102,2023-10-02 12:24:01.599236,0 days 00:00:00.258134,4733.3710845286305,380,sag,COMPLETE
4300,0.6520362484987444,2023-10-02 12:24:01.601233,2023-10-02 12:24:01.941332,0 days 00:00:00.340099,2826.3371390529464,370,sag,COMPLETE
4301,0.6520362484987444,2023-10-02 12:24:01.942332,2023-10-02 12:24:02.207038,0 days 00:00:00.264706,1987.335729988106,380,sag,COMPLETE
4302,0.6590785020198712,2023-10-02 12:24:02.208037,2023-10-02 12:24:02.472593,0 days 00:00:00.264556,3418.719459420637,370,sag,COMPLETE
4303,0.6520362484987444,2023-10-02 12:24:02.473592,2023-10-02 12:24:02.811185,0 days 00:00:00.337593,1481.8909085131809,380,sag,COMPLETE
4304,0.6520362484987444,2023-10-02 12:24:02.812185,2023-10-02 12:24:03.096196,0 days 00:00:00.284011,2618.9149604129257,380,saga,COMPLETE
4305,0.6449939949776177,2023-10-02 12:24:03.097195,2023-10-02 12:24:03.394371,0 days 00:00:00.297176,5278.313497039937,390,sag,COMPLETE
4306,0.6309094879353642,2023-10-02 12:24:03.395371,2023-10-02 12:24:03.690949,0 days 00:00:00.295578,3948.3778808314887,360,newton-cg,COMPLETE
4307,0.637951741456491,2023-10-02 12:24:03.691949,2023-10-02 12:24:03.960553,0 days 00:00:00.268604,4344.197612303821,400,sag,COMPLETE
4308,0.6590785020198712,2023-10-02 12:24:03.962549,2023-10-02 12:24:04.238674,0 days 00:00:00.276125,3448.294306114371,370,sag,COMPLETE
4309,0.6238672344142374,2023-10-02 12:24:04.238674,2023-10-02 12:24:04.547958,0 days 00:00:00.309284,2351.156753456897,340,liblinear,COMPLETE
4310,0.6520362484987444,2023-10-02 12:24:04.548958,2023-10-02 12:24:04.822631,0 days 00:00:00.273673,1212.1333339876958,390,sag,COMPLETE
4311,0.6520362484987444,2023-10-02 12:24:04.822631,2023-10-02 12:24:05.113106,0 days 00:00:00.290475,4016.8388652543563,360,saga,COMPLETE
4312,0.6520362484987444,2023-10-02 12:24:05.115105,2023-10-02 12:24:05.500216,0 days 00:00:00.385111,1656.9376509952676,370,sag,COMPLETE
4313,0.666120755540998,2023-10-02 12:24:05.501216,2023-10-02 12:24:05.796836,0 days 00:00:00.295620,6972.065811539734,360,sag,COMPLETE
4314,0.6520362484987444,2023-10-02 12:24:05.797837,2023-10-02 12:24:06.063422,0 days 00:00:00.265585,2544.146486593909,380,sag,COMPLETE
4315,0.6449939949776177,2023-10-02 12:24:06.064422,2023-10-02 12:24:06.424567,0 days 00:00:00.360145,4962.333793324355,380,sag,COMPLETE
4316,0.5,2023-10-02 12:24:06.426567,2023-10-02 12:24:06.650642,0 days 00:00:00.224075,0.0010950308238960509,390,sag,COMPLETE
4317,0.6481602795064964,2023-10-02 12:24:06.651642,2023-10-02 12:24:06.930235,0 days 00:00:00.278593,4604.720675087677,370,saga,COMPLETE
4318,0.6520362484987444,2023-10-02 12:24:06.931235,2023-10-02 12:24:07.277813,0 days 00:00:00.346578,2615.5034161715967,360,sag,COMPLETE
4319,0.6309094879353642,2023-10-02 12:24:07.279835,2023-10-02 12:24:07.546409,0 days 00:00:00.266574,2020.9954465383178,380,sag,COMPLETE
4320,0.5,2023-10-02 12:24:07.548409,2023-10-02 12:24:07.784508,0 days 00:00:00.236099,5.151583764269374e-05,360,lbfgs,COMPLETE
4321,0.608417949557812,2023-10-02 12:24:07.785509,2023-10-02 12:24:08.081141,0 days 00:00:00.295632,3.0400288490438223,380,sag,COMPLETE
4322,0.6590785020198712,2023-10-02 12:24:08.083110,2023-10-02 12:24:08.373704,0 days 00:00:00.290594,6572.783242855098,380,sag,COMPLETE
4323,0.5415438366633912,2023-10-02 12:24:08.374703,2023-10-02 12:24:08.588772,0 days 00:00:00.214069,0.5621652984110714,370,saga,COMPLETE
4324,0.6590785020198712,2023-10-02 12:24:08.590768,2023-10-02 12:24:08.959900,0 days 00:00:00.369132,6560.223745816407,380,sag,COMPLETE
4325,0.666120755540998,2023-10-02 12:24:08.960886,2023-10-02 12:24:09.248847,0 days 00:00:00.287961,3386.0639574230677,410,sag,COMPLETE
4326,0.5,2023-10-02 12:24:09.249847,2023-10-02 12:24:09.471398,0 days 00:00:00.221551,0.003456899650908838,360,sag,COMPLETE
4327,0.649579648433235,2023-10-02 12:24:09.471681,2023-10-02 12:24:09.791654,0 days 00:00:00.319973,129.22756838616831,360,sag,COMPLETE
4328,0.6520362484987444,2023-10-02 12:24:09.791654,2023-10-02 12:24:10.087376,0 days 00:00:00.295722,5132.404453917614,360,saga,COMPLETE
4329,0.6520362484987444,2023-10-02 12:24:10.088370,2023-10-02 12:24:10.451478,0 days 00:00:00.363108,7717.392585909581,350,sag,COMPLETE
4330,0.6418277104487389,2023-10-02 12:24:10.453478,2023-10-02 12:24:10.741109,0 days 00:00:00.287631,428.63000502501,390,sag,COMPLETE
4331,0.6590785020198712,2023-10-02 12:24:10.743109,2023-10-02 12:24:11.015181,0 days 00:00:00.272072,1344.264218292261,350,sag,COMPLETE
4332,0.6481602795064964,2023-10-02 12:24:11.016181,2023-10-02 12:24:11.392731,0 days 00:00:00.376550,4111.3673328401055,380,sag,COMPLETE
4333,0.5,2023-10-02 12:24:11.393729,2023-10-02 12:24:11.622236,0 days 00:00:00.228507,2.597443454136241e-05,390,newton-cg,COMPLETE
4334,0.6481602795064964,2023-10-02 12:24:11.623746,2023-10-02 12:24:11.891785,0 days 00:00:00.268039,8032.659117911358,350,saga,COMPLETE
4335,0.5,2023-10-02 12:24:11.892640,2023-10-02 12:24:12.202390,0 days 00:00:00.309750,0.05412456075132003,380,sag,COMPLETE
4336,0.5,2023-10-02 12:24:12.204381,2023-10-02 12:24:12.404435,0 days 00:00:00.200054,0.21764656535177393,360,liblinear,COMPLETE
4337,0.6520362484987444,2023-10-02 12:24:12.406435,2023-10-02 12:24:12.676021,0 days 00:00:00.269586,68216.42257368116,370,sag,COMPLETE
4338,0.666120755540998,2023-10-02 12:24:12.678013,2023-10-02 12:24:13.009776,0 days 00:00:00.331763,65401.6049767337,380,sag,COMPLETE
4339,0.5982094115078066,2023-10-02 12:24:13.009776,2023-10-02 12:24:13.224869,0 days 00:00:00.215093,1.900085593594985,380,sag,COMPLETE
4340,0.6488699639698657,2023-10-02 12:24:13.229919,2023-10-02 12:24:13.512350,0 days 00:00:00.282431,1710.3807638317166,380,sag,COMPLETE
4341,0.6573315864177312,2023-10-02 12:24:13.512350,2023-10-02 12:24:13.827002,0 days 00:00:00.314652,38.77789447710229,350,saga,COMPLETE
4342,0.637951741456491,2023-10-02 12:24:13.827002,2023-10-02 12:24:14.093493,0 days 00:00:00.266491,671.4262587751097,370,sag,COMPLETE
4343,0.6520362484987444,2023-10-02 12:24:14.093493,2023-10-02 12:24:14.375996,0 days 00:00:00.282503,2201.3954806479123,360,sag,COMPLETE
4344,0.5,2023-10-02 12:24:14.375996,2023-10-02 12:24:14.674162,0 days 00:00:00.298166,0.0003971854376721873,370,sag,COMPLETE
4345,0.6069985806310733,2023-10-02 12:24:14.674162,2023-10-02 12:24:14.878165,0 days 00:00:00.204003,4.78811570233242,370,sag,COMPLETE
4346,0.5,2023-10-02 12:24:14.878165,2023-10-02 12:24:15.159634,0 days 00:00:00.281469,0.0007492569078344672,380,saga,COMPLETE
4347,0.6203734032099574,2023-10-02 12:24:15.159634,2023-10-02 12:24:15.486695,0 days 00:00:00.327061,7.531272001112042,360,lbfgs,COMPLETE
4348,0.5,2023-10-02 12:24:15.488701,2023-10-02 12:24:15.739176,0 days 00:00:00.250475,0.00046748573589489056,380,sag,COMPLETE
4349,0.6449939949776177,2023-10-02 12:24:15.740184,2023-10-02 12:24:16.005603,0 days 00:00:00.265419,933.537503538225,360,sag,COMPLETE
4350,0.6337482257888415,2023-10-02 12:24:16.007270,2023-10-02 12:24:16.305548,0 days 00:00:00.298278,13.514387208843923,360,sag,COMPLETE
4351,0.5,2023-10-02 12:24:16.307546,2023-10-02 12:24:16.514557,0 days 00:00:00.207011,0.3156148347430911,350,sag,COMPLETE
4352,0.6520362484987444,2023-10-02 12:24:16.516564,2023-10-02 12:24:16.782163,0 days 00:00:00.265599,8727.900187378007,340,saga,COMPLETE
4353,0.6552025330276231,2023-10-02 12:24:16.783164,2023-10-02 12:24:17.131391,0 days 00:00:00.348227,51299.82964627323,420,sag,COMPLETE
4354,0.6457036794409869,2023-10-02 12:24:17.131391,2023-10-02 12:24:17.386783,0 days 00:00:00.255392,245.27977951399131,360,sag,COMPLETE
4355,0.6629544710121192,2023-10-02 12:24:17.386783,2023-10-02 12:24:17.653711,0 days 00:00:00.266928,5677.911430622427,370,sag,COMPLETE
4356,0.6449939949776177,2023-10-02 12:24:17.653711,2023-10-02 12:24:17.983215,0 days 00:00:00.329504,1108.9573508230542,360,sag,COMPLETE
4357,0.5,2023-10-02 12:24:17.983215,2023-10-02 12:24:18.219831,0 days 00:00:00.236616,0.015533505177323405,390,sag,COMPLETE
4358,0.6449939949776177,2023-10-02 12:24:18.220831,2023-10-02 12:24:18.450569,0 days 00:00:00.229738,64475.00124805418,390,newton-cg,COMPLETE
4359,0.6541653018888526,2023-10-02 12:24:18.452569,2023-10-02 12:24:18.766612,0 days 00:00:00.314043,30.312871163145157,370,saga,COMPLETE
4360,0.637951741456491,2023-10-02 12:24:18.768609,2023-10-02 12:24:19.035031,0 days 00:00:00.266422,654.2952698880881,380,sag,COMPLETE
4361,0.637951741456491,2023-10-02 12:24:19.035031,2023-10-02 12:24:19.257563,0 days 00:00:00.222532,11491.349866055705,370,liblinear,COMPLETE
4362,0.6520362484987444,2023-10-02 12:24:19.259575,2023-10-02 12:24:19.605971,0 days 00:00:00.346396,3220.0834361634693,360,sag,COMPLETE
4363,0.5,2023-10-02 12:24:19.607758,2023-10-02 12:24:19.821227,0 days 00:00:00.213469,0.02621314122496025,400,sag,COMPLETE
4364,0.6559122174909924,2023-10-02 12:24:19.822226,2023-10-02 12:24:20.079349,0 days 00:00:00.257123,40020.32854007153,340,sag,COMPLETE
4365,0.6552025330276231,2023-10-02 12:24:20.079349,2023-10-02 12:24:20.437445,0 days 00:00:00.358096,69757.61070528562,370,saga,COMPLETE
4366,0.6668304400043672,2023-10-02 12:24:20.437445,2023-10-02 12:24:20.707524,0 days 00:00:00.270079,7472.2612982811925,360,sag,COMPLETE
4367,0.6534556174254831,2023-10-02 12:24:20.707524,2023-10-02 12:24:20.927257,0 days 00:00:00.219733,50.11005985608843,350,sag,COMPLETE
4368,0.6559122174909924,2023-10-02 12:24:20.927257,2023-10-02 12:24:21.264453,0 days 00:00:00.337196,3496.2272285139647,370,sag,COMPLETE
4369,0.6520362484987444,2023-10-02 12:24:21.264453,2023-10-02 12:24:21.530892,0 days 00:00:00.266439,4127.767856615964,370,sag,COMPLETE
4370,0.5,2023-10-02 12:24:21.530892,2023-10-02 12:24:21.740460,0 days 00:00:00.209568,0.08913969917843177,370,sag,COMPLETE
4371,0.6449939949776177,2023-10-02 12:24:21.740460,2023-10-02 12:24:22.080401,0 days 00:00:00.339941,5390.562932830079,360,sag,COMPLETE
4372,0.6520362484987444,2023-10-02 12:24:22.080401,2023-10-02 12:24:22.341816,0 days 00:00:00.261415,2778.862309979013,360,sag,COMPLETE
4373,0.6590785020198712,2023-10-02 12:24:22.347357,2023-10-02 12:24:22.597964,0 days 00:00:00.250607,7637.782143005592,340,sag,COMPLETE
4374,0.6449939949776177,2023-10-02 12:24:22.597964,2023-10-02 12:24:22.943602,0 days 00:00:00.345638,2542.756955704355,350,sag,COMPLETE
4375,0.6520362484987444,2023-10-02 12:24:22.943602,2023-10-02 12:24:23.225679,0 days 00:00:00.282077,6130.413681712192,370,sag,COMPLETE
4376,0.5,2023-10-02 12:24:23.226583,2023-10-02 12:24:23.539910,0 days 00:00:00.313327,0.03309847569718286,370,sag,COMPLETE
4377,0.6449939949776177,2023-10-02 12:24:23.540917,2023-10-02 12:24:23.813423,0 days 00:00:00.272506,4741.26961655429,360,sag,COMPLETE
4378,0.5,2023-10-02 12:24:23.814423,2023-10-02 12:24:24.020135,0 days 00:00:00.205712,0.002978513478388879,370,sag,COMPLETE
4379,0.6488699639698657,2023-10-02 12:24:24.020135,2023-10-02 12:24:24.365124,0 days 00:00:00.344989,2578.0457463091757,370,sag,COMPLETE
4380,0.6534556174254831,2023-10-02 12:24:24.365124,2023-10-02 12:24:24.615983,0 days 00:00:00.250859,93.75447390523166,350,sag,COMPLETE
4381,0.666120755540998,2023-10-02 12:24:24.615983,2023-10-02 12:24:24.882863,0 days 00:00:00.266880,6928.000361010989,360,sag,COMPLETE
4382,0.6267059722677149,2023-10-02 12:24:24.882863,2023-10-02 12:24:25.181046,0 days 00:00:00.298183,12.754377927874334,350,sag,COMPLETE
4383,0.6520362484987444,2023-10-02 12:24:25.181046,2023-10-02 12:24:25.483687,0 days 00:00:00.302641,1490.25328397614,360,sag,COMPLETE
4384,0.6520362484987444,2023-10-02 12:24:25.484687,2023-10-02 12:24:25.746383,0 days 00:00:00.261696,1096.7094933339938,350,sag,COMPLETE
