number,value,datetime_start,datetime_complete,duration,params_C,params_max_iter,params_solver,state
804,0.6541653018888526,2023-10-02 12:11:35.647777,2023-10-02 12:11:35.736216,0 days 00:00:00.088439,30.55813168439133,330,saga,COMPLETE
805,0.6298722567965934,2023-10-02 12:11:35.737213,2023-10-02 12:11:35.816861,0 days 00:00:00.079648,15.549233552068932,500,saga,COMPLETE
806,0.637951741456491,2023-10-02 12:11:35.816861,2023-10-02 12:11:35.992342,0 days 00:00:00.175481,4842.015960461037,210,lbfgs,COMPLETE
807,0.6520362484987444,2023-10-02 12:11:35.993342,2023-10-02 12:11:36.099556,0 days 00:00:00.106214,756.386978898791,310,saga,COMPLETE
808,0.6418277104487389,2023-10-02 12:11:36.100744,2023-10-02 12:11:36.190264,0 days 00:00:00.089520,172.5584392354413,220,saga,COMPLETE
809,0.6534556174254831,2023-10-02 12:11:36.191262,2023-10-02 12:11:36.279557,0 days 00:00:00.088295,52.253242934669444,430,lbfgs,COMPLETE
810,0.6411180259853696,2023-10-02 12:11:36.279557,2023-10-02 12:11:36.365088,0 days 00:00:00.085531,37342.285308505765,200,saga,COMPLETE
811,0.6457036794409869,2023-10-02 12:11:36.365088,2023-10-02 12:11:36.474471,0 days 00:00:00.109383,319.6274679803758,230,lbfgs,COMPLETE
812,0.5,2023-10-02 12:11:36.474471,2023-10-02 12:11:36.547999,0 days 00:00:00.073528,0.013013030820835334,470,saga,COMPLETE
813,0.5943334425155585,2023-10-02 12:11:36.549003,2023-10-02 12:11:36.605106,0 days 00:00:00.056103,1.925596729600045,180,saga,COMPLETE
814,0.637951741456491,2023-10-02 12:11:36.606103,2023-10-02 12:11:36.706727,0 days 00:00:00.100624,8427.400187313731,200,lbfgs,COMPLETE
815,0.5,2023-10-02 12:11:36.707728,2023-10-02 12:11:36.931308,0 days 00:00:00.223580,5.42482435670397e-05,380,saga,COMPLETE
816,0.6541653018888526,2023-10-02 12:11:36.931308,2023-10-02 12:11:37.010314,0 days 00:00:00.079006,29.92734969512444,190,saga,COMPLETE
817,0.6238672344142374,2023-10-02 12:11:37.010314,2023-10-02 12:11:37.101490,0 days 00:00:00.091176,2794.9468044607256,300,lbfgs,COMPLETE
818,0.6457036794409869,2023-10-02 12:11:37.101490,2023-10-02 12:11:37.193016,0 days 00:00:00.091526,87.64913578562408,210,saga,COMPLETE
819,0.5,2023-10-02 12:11:37.194012,2023-10-02 12:11:37.263546,0 days 00:00:00.069534,0.19208048644189682,190,lbfgs,COMPLETE
820,0.6274156567310841,2023-10-02 12:11:37.264546,2023-10-02 12:11:37.324273,0 days 00:00:00.059727,7.731204115456,440,saga,COMPLETE
821,0.5,2023-10-02 12:11:37.324273,2023-10-02 12:11:37.383517,0 days 00:00:00.059244,0.003010566253934449,240,newton-cg,COMPLETE
822,0.604541980565564,2023-10-02 12:11:37.383517,2023-10-02 12:11:37.444516,0 days 00:00:00.060999,3.1924393353538774,220,saga,COMPLETE
823,0.6534556174254831,2023-10-02 12:11:37.444516,2023-10-02 12:11:37.534039,0 days 00:00:00.089523,46.02402291338922,290,lbfgs,COMPLETE
824,0.637951741456491,2023-10-02 12:11:37.535041,2023-10-02 12:11:37.587243,0 days 00:00:00.052202,13928.711552735847,280,liblinear,COMPLETE
825,0.5957528114422973,2023-10-02 12:11:37.587243,2023-10-02 12:11:37.644984,0 days 00:00:00.057741,1.4896844259448563,180,saga,COMPLETE
826,0.6369145103177202,2023-10-02 12:11:37.645983,2023-10-02 12:11:37.729512,0 days 00:00:00.083529,18.248136590538856,210,saga,COMPLETE
827,0.637951741456491,2023-10-02 12:11:37.730514,2023-10-02 12:11:37.842184,0 days 00:00:00.111670,5926.087794725587,200,lbfgs,COMPLETE
828,0.5070422535211268,2023-10-02 12:11:37.843196,2023-10-02 12:11:37.899248,0 days 00:00:00.056052,0.34441271116868055,500,saga,COMPLETE
829,0.5,2023-10-02 12:11:37.900252,2023-10-02 12:11:37.958766,0 days 00:00:00.058514,0.21977635529140777,320,lbfgs,COMPLETE
830,0.6552025330276231,2023-10-02 12:11:37.959765,2023-10-02 12:11:38.099932,0 days 00:00:00.140167,47054.58517061227,460,saga,COMPLETE
831,0.6534556174254831,2023-10-02 12:11:38.100932,2023-10-02 12:11:38.212596,0 days 00:00:00.111664,69.4129734932958,490,saga,COMPLETE
832,0.6277432034064855,2023-10-02 12:11:38.213113,2023-10-02 12:11:38.317935,0 days 00:00:00.104822,1426.1455188977584,230,lbfgs,COMPLETE
833,0.6580412708811005,2023-10-02 12:11:38.318005,2023-10-02 12:11:38.403153,0 days 00:00:00.085148,26.129873570030174,190,saga,COMPLETE
834,0.6369145103177202,2023-10-02 12:11:38.403153,2023-10-02 12:11:38.486799,0 days 00:00:00.083646,21.922023243524034,180,saga,COMPLETE
835,0.6337482257888415,2023-10-02 12:11:38.486799,2023-10-02 12:11:38.560143,0 days 00:00:00.073344,13.327319603736024,260,saga,COMPLETE
836,0.6411180259853696,2023-10-02 12:11:38.560143,2023-10-02 12:11:38.650217,0 days 00:00:00.090074,20612.07873967542,180,saga,COMPLETE
837,0.6062888961677039,2023-10-02 12:11:38.650217,2023-10-02 12:11:38.711224,0 days 00:00:00.061007,5.424599742624581,190,saga,COMPLETE
838,0.5,2023-10-02 12:11:38.712226,2023-10-02 12:11:38.851310,0 days 00:00:00.139084,2.9681883362021676e-05,190,saga,COMPLETE
839,0.5,2023-10-02 12:11:38.852319,2023-10-02 12:11:38.969689,0 days 00:00:00.117370,0.0006672861720242442,180,saga,COMPLETE
840,0.6520362484987444,2023-10-02 12:11:38.970693,2023-10-02 12:11:39.082194,0 days 00:00:00.111501,4307.389520399754,300,saga,COMPLETE
841,0.6520362484987444,2023-10-02 12:11:39.082194,2023-10-02 12:11:39.221489,0 days 00:00:00.139295,33273.94114846516,470,saga,COMPLETE
842,0.6541653018888526,2023-10-02 12:11:39.221489,2023-10-02 12:11:39.311496,0 days 00:00:00.090007,29.707496120614284,450,saga,COMPLETE
843,0.5,2023-10-02 12:11:39.312497,2023-10-02 12:11:39.455782,0 days 00:00:00.143285,0.00028823567362729454,220,saga,COMPLETE
844,0.5,2023-10-02 12:11:39.455782,2023-10-02 12:11:39.670410,0 days 00:00:00.214628,7.051734565539773e-05,340,saga,COMPLETE
845,0.6267059722677149,2023-10-02 12:11:39.671416,2023-10-02 12:11:39.735080,0 days 00:00:00.063664,11.537766758677456,400,saga,COMPLETE
846,0.6411180259853696,2023-10-02 12:11:39.736095,2023-10-02 12:11:39.843601,0 days 00:00:00.107506,10603.64310315004,310,saga,COMPLETE
847,0.6481602795064964,2023-10-02 12:11:39.844602,2023-10-02 12:11:39.932481,0 days 00:00:00.087879,403.2075078134396,200,saga,COMPLETE
848,0.5,2023-10-02 12:11:39.933537,2023-10-02 12:11:40.176168,0 days 00:00:00.242631,0.00016777928091811262,480,saga,COMPLETE
849,0.6534556174254831,2023-10-02 12:11:40.176168,2023-10-02 12:11:40.254956,0 days 00:00:00.078788,41.68181391596069,190,saga,COMPLETE
850,0.5,2023-10-02 12:11:40.254956,2023-10-02 12:11:40.308035,0 days 00:00:00.053079,0.09770136824865219,250,saga,COMPLETE
851,0.6369145103177202,2023-10-02 12:11:40.308035,2023-10-02 12:11:40.383243,0 days 00:00:00.075208,20.978893037765886,210,saga,COMPLETE
852,0.637951741456491,2023-10-02 12:11:40.384244,2023-10-02 12:11:40.475378,0 days 00:00:00.091134,173.17125449308597,200,saga,COMPLETE
853,0.649579648433235,2023-10-02 12:11:40.476375,2023-10-02 12:11:40.592966,0 days 00:00:00.116591,111.33068015989849,490,saga,COMPLETE
854,0.5,2023-10-02 12:11:40.592966,2023-10-02 12:11:40.669065,0 days 00:00:00.076099,0.0037659540239208247,180,saga,COMPLETE
855,0.6552025330276231,2023-10-02 12:11:40.669065,2023-10-02 12:11:40.756014,0 days 00:00:00.086949,24758.227083016878,190,saga,COMPLETE
856,0.6449939949776177,2023-10-02 12:11:40.757013,2023-10-02 12:11:40.835617,0 days 00:00:00.078604,68450.25391054233,360,newton-cg,COMPLETE
857,0.6534556174254831,2023-10-02 12:11:40.835617,2023-10-02 12:11:40.935005,0 days 00:00:00.099388,57.67352679402916,240,saga,COMPLETE
858,0.5,2023-10-02 12:11:40.936005,2023-10-02 12:11:41.014143,0 days 00:00:00.078138,0.008453364586857456,220,saga,COMPLETE
859,0.6277432034064855,2023-10-02 12:11:41.014143,2023-10-02 12:11:41.083162,0 days 00:00:00.069019,970.0994481621257,420,liblinear,COMPLETE
860,0.6481602795064964,2023-10-02 12:11:41.084168,2023-10-02 12:11:41.178715,0 days 00:00:00.094547,8464.683656230396,200,saga,COMPLETE
861,0.6235396877388361,2023-10-02 12:11:41.178715,2023-10-02 12:11:41.236974,0 days 00:00:00.058259,7.790973039913266,300,saga,COMPLETE
862,0.6411180259853696,2023-10-02 12:11:41.237965,2023-10-02 12:11:41.346525,0 days 00:00:00.108560,15472.286185402303,280,saga,COMPLETE
863,0.6520362484987444,2023-10-02 12:11:41.347586,2023-10-02 12:11:41.461275,0 days 00:00:00.113689,1776.057977413859,310,saga,COMPLETE
864,0.6541653018888526,2023-10-02 12:11:41.461275,2023-10-02 12:11:41.558575,0 days 00:00:00.097300,27.922857187054746,500,saga,COMPLETE
865,0.5,2023-10-02 12:11:41.559572,2023-10-02 12:11:41.741704,0 days 00:00:00.182132,1.0154653672129218e-05,290,saga,COMPLETE
866,0.6298722567965934,2023-10-02 12:11:41.742700,2023-10-02 12:11:41.815211,0 days 00:00:00.072511,16.209793159686072,230,saga,COMPLETE
867,0.5,2023-10-02 12:11:41.815211,2023-10-02 12:11:41.871220,0 days 00:00:00.056009,0.02099876688088479,330,saga,COMPLETE
868,0.5690031662845288,2023-10-02 12:11:41.872221,2023-10-02 12:11:41.930755,0 days 00:00:00.058534,1.0119516541026699,410,saga,COMPLETE
869,0.634075772464243,2023-10-02 12:11:41.930755,2023-10-02 12:11:42.028283,0 days 00:00:00.097528,3078.063437433359,210,saga,COMPLETE
870,0.5478764057211486,2023-10-02 12:11:42.028283,2023-10-02 12:11:42.086295,0 days 00:00:00.058012,0.729799197480889,190,saga,COMPLETE
871,0.6411180259853696,2023-10-02 12:11:42.086295,2023-10-02 12:11:42.199004,0 days 00:00:00.112709,98422.91847675758,320,saga,COMPLETE
872,0.6534556174254831,2023-10-02 12:11:42.199004,2023-10-02 12:11:42.282532,0 days 00:00:00.083528,45.829594875447256,270,saga,COMPLETE
873,0.637951741456491,2023-10-02 12:11:42.283532,2023-10-02 12:11:42.355174,0 days 00:00:00.071642,5863.501042518067,180,newton-cg,COMPLETE
874,0.649579648433235,2023-10-02 12:11:42.355174,2023-10-02 12:11:42.457342,0 days 00:00:00.102168,82.25716270608974,440,saga,COMPLETE
875,0.6481602795064964,2023-10-02 12:11:42.458346,2023-10-02 12:11:42.551875,0 days 00:00:00.093529,45622.08061177897,210,saga,COMPLETE
876,0.5,2023-10-02 12:11:42.552874,2023-10-02 12:11:42.637516,0 days 00:00:00.084642,0.00025286987345038685,200,sag,COMPLETE
877,0.6316191723987334,2023-10-02 12:11:42.638524,2023-10-02 12:11:42.693630,0 days 00:00:00.055106,626.5364922500428,430,liblinear,COMPLETE
878,0.6541653018888526,2023-10-02 12:11:42.694637,2023-10-02 12:11:42.783161,0 days 00:00:00.088524,32.32135087693319,190,saga,COMPLETE
879,0.619663718746588,2023-10-02 12:11:42.784160,2023-10-02 12:11:42.859423,0 days 00:00:00.075263,10.205739875646403,230,saga,COMPLETE
880,0.5,2023-10-02 12:11:42.859423,2023-10-02 12:11:42.920999,0 days 00:00:00.061576,0.0011249527648810964,460,lbfgs,COMPLETE
881,0.6418277104487389,2023-10-02 12:11:42.920999,2023-10-02 12:11:43.035495,0 days 00:00:00.114496,188.0909378652423,220,saga,COMPLETE
882,0.637951741456491,2023-10-02 12:11:43.035495,2023-10-02 12:11:43.163011,0 days 00:00:00.127516,13634.45865507682,290,lbfgs,COMPLETE
883,0.6590785020198712,2023-10-02 12:11:43.163092,2023-10-02 12:11:43.309879,0 days 00:00:00.146787,28799.368237894432,480,saga,COMPLETE
884,0.5,2023-10-02 12:11:43.310880,2023-10-02 12:11:43.374693,0 days 00:00:00.063813,0.03641732031010665,480,saga,COMPLETE
885,0.6520362484987444,2023-10-02 12:11:43.374693,2023-10-02 12:11:43.519144,0 days 00:00:00.144451,27896.986949094462,490,saga,COMPLETE
886,0.6520362484987444,2023-10-02 12:11:43.519144,2023-10-02 12:11:43.667136,0 days 00:00:00.147992,58855.30988266518,480,saga,COMPLETE
887,0.6520362484987444,2023-10-02 12:11:43.667136,2023-10-02 12:11:43.808725,0 days 00:00:00.141589,25038.49632199635,480,saga,COMPLETE
888,0.6590785020198712,2023-10-02 12:11:43.808725,2023-10-02 12:11:43.951982,0 days 00:00:00.143257,46661.93712863424,470,saga,COMPLETE
889,0.6520362484987444,2023-10-02 12:11:43.951982,2023-10-02 12:11:44.095837,0 days 00:00:00.143855,31250.91682147536,470,saga,COMPLETE
890,0.6069985806310733,2023-10-02 12:11:44.096841,2023-10-02 12:11:44.166086,0 days 00:00:00.069245,4.4035731554390525,460,saga,COMPLETE
891,0.6481602795064964,2023-10-02 12:11:44.167085,2023-10-02 12:11:44.306632,0 days 00:00:00.139547,98780.83082529182,470,saga,COMPLETE
892,0.6552025330276231,2023-10-02 12:11:44.306632,2023-10-02 12:11:44.458792,0 days 00:00:00.152160,30363.76276311185,470,saga,COMPLETE
893,0.6520362484987444,2023-10-02 12:11:44.458792,2023-10-02 12:11:44.600077,0 days 00:00:00.141285,22254.660014707573,470,saga,COMPLETE
894,0.6481602795064964,2023-10-02 12:11:44.600077,2023-10-02 12:11:44.746200,0 days 00:00:00.146123,54756.26798045148,490,saga,COMPLETE
895,0.5,2023-10-02 12:11:44.747204,2023-10-02 12:11:44.824717,0 days 00:00:00.077513,0.006178873684952694,480,saga,COMPLETE
896,0.6411180259853696,2023-10-02 12:11:44.825725,2023-10-02 12:11:44.964427,0 days 00:00:00.138702,49652.77442745419,460,saga,COMPLETE
897,0.6559122174909924,2023-10-02 12:11:44.965474,2023-10-02 12:11:45.042040,0 days 00:00:00.076566,61266.0827040454,110,saga,COMPLETE
898,0.6411180259853696,2023-10-02 12:11:45.043132,2023-10-02 12:11:45.247043,0 days 00:00:00.203911,16267.483196185902,470,saga,COMPLETE
899,0.5,2023-10-02 12:11:45.248041,2023-10-02 12:11:45.506871,0 days 00:00:00.258830,2.3687598896685546e-05,450,saga,COMPLETE
900,0.6590785020198712,2023-10-02 12:11:45.507864,2023-10-02 12:11:45.652904,0 days 00:00:00.145040,37709.319826075225,480,saga,COMPLETE
901,0.6520362484987444,2023-10-02 12:11:45.653903,2023-10-02 12:11:45.799521,0 days 00:00:00.145618,36757.91083470607,500,saga,COMPLETE
902,0.6449939949776177,2023-10-02 12:11:45.799521,2023-10-02 12:11:45.947008,0 days 00:00:00.147487,61853.22169080668,490,saga,COMPLETE
903,0.6481602795064964,2023-10-02 12:11:45.947008,2023-10-02 12:11:46.099620,0 days 00:00:00.152612,39361.73386584568,500,saga,COMPLETE
904,0.6520362484987444,2023-10-02 12:11:46.100674,2023-10-02 12:11:46.253942,0 days 00:00:00.153268,39525.4108811617,480,saga,COMPLETE
905,0.6590785020198712,2023-10-02 12:11:46.254945,2023-10-02 12:11:46.409311,0 days 00:00:00.154366,17989.599311517355,490,saga,COMPLETE
906,0.6481602795064964,2023-10-02 12:11:46.410365,2023-10-02 12:11:46.560428,0 days 00:00:00.150063,17403.645579345317,490,saga,COMPLETE
907,0.6411180259853696,2023-10-02 12:11:46.561434,2023-10-02 12:11:46.715242,0 days 00:00:00.153808,11477.993152097371,500,saga,COMPLETE
908,0.6520362484987444,2023-10-02 12:11:46.716235,2023-10-02 12:11:46.864244,0 days 00:00:00.148009,21032.760817677754,490,saga,COMPLETE
909,0.6520362484987444,2023-10-02 12:11:46.864244,2023-10-02 12:11:47.012975,0 days 00:00:00.148731,28835.644650498038,490,saga,COMPLETE
910,0.6520362484987444,2023-10-02 12:11:47.013984,2023-10-02 12:11:47.165836,0 days 00:00:00.151852,10767.163747383709,500,saga,COMPLETE
911,0.608417949557812,2023-10-02 12:11:47.166835,2023-10-02 12:11:47.224445,0 days 00:00:00.057610,2.6568776610969715,480,saga,COMPLETE
912,0.6481602795064964,2023-10-02 12:11:47.225448,2023-10-02 12:11:47.378114,0 days 00:00:00.152666,17558.999152896653,500,saga,COMPLETE
913,0.6520362484987444,2023-10-02 12:11:47.379120,2023-10-02 12:11:47.526655,0 days 00:00:00.147535,73253.13183604498,490,saga,COMPLETE
914,0.6442843105142483,2023-10-02 12:11:47.527655,2023-10-02 12:11:47.674860,0 days 00:00:00.147205,41285.210531109515,490,saga,COMPLETE
915,0.6449939949776177,2023-10-02 12:11:47.675858,2023-10-02 12:11:47.825008,0 days 00:00:00.149150,9130.228843026473,490,saga,COMPLETE
916,0.6590785020198712,2023-10-02 12:11:47.825008,2023-10-02 12:11:47.970200,0 days 00:00:00.145192,24488.16724165166,480,saga,COMPLETE
917,0.666120755540998,2023-10-02 12:11:47.971203,2023-10-02 12:11:48.121110,0 days 00:00:00.149907,26908.530573880464,480,saga,COMPLETE
918,0.6520362484987444,2023-10-02 12:11:48.122112,2023-10-02 12:11:48.268998,0 days 00:00:00.146886,21845.47385399652,480,saga,COMPLETE
919,0.6552025330276231,2023-10-02 12:11:48.269994,2023-10-02 12:11:48.413617,0 days 00:00:00.143623,31986.729188731024,480,saga,COMPLETE
920,0.6481602795064964,2023-10-02 12:11:48.413617,2023-10-02 12:11:48.562751,0 days 00:00:00.149134,16420.77460459828,480,saga,COMPLETE
921,0.6520362484987444,2023-10-02 12:11:48.563749,2023-10-02 12:11:48.719990,0 days 00:00:00.156241,41729.02631654976,480,saga,COMPLETE
922,0.666120755540998,2023-10-02 12:11:48.720992,2023-10-02 12:11:48.865032,0 days 00:00:00.144040,27589.011022724942,480,saga,COMPLETE
923,0.6590785020198712,2023-10-02 12:11:48.866032,2023-10-02 12:11:49.011399,0 days 00:00:00.145367,22950.563360196695,480,saga,COMPLETE
924,0.6590785020198712,2023-10-02 12:11:49.012402,2023-10-02 12:11:49.159562,0 days 00:00:00.147160,24992.98491832032,470,saga,COMPLETE
925,0.6520362484987444,2023-10-02 12:11:49.159562,2023-10-02 12:11:49.303857,0 days 00:00:00.144295,25727.229788982215,470,saga,COMPLETE
926,0.6449939949776177,2023-10-02 12:11:49.304910,2023-10-02 12:11:49.449036,0 days 00:00:00.144126,20311.66825829817,470,saga,COMPLETE
927,0.6590785020198712,2023-10-02 12:11:49.449036,2023-10-02 12:11:49.593853,0 days 00:00:00.144817,30682.740544824075,470,saga,COMPLETE
928,0.6481602795064964,2023-10-02 12:11:49.594854,2023-10-02 12:11:49.746591,0 days 00:00:00.151737,32491.819093238973,470,saga,COMPLETE
929,0.6520362484987444,2023-10-02 12:11:49.747586,2023-10-02 12:11:49.890224,0 days 00:00:00.142638,22732.93406481145,470,saga,COMPLETE
930,0.6411180259853696,2023-10-02 12:11:49.890224,2023-10-02 12:11:50.036006,0 days 00:00:00.145782,14264.999604101149,470,saga,COMPLETE
931,0.6590785020198712,2023-10-02 12:11:50.037005,2023-10-02 12:11:50.179237,0 days 00:00:00.142232,39034.59466897067,470,saga,COMPLETE
932,0.6590785020198712,2023-10-02 12:11:50.179237,2023-10-02 12:11:50.322558,0 days 00:00:00.143321,46967.63101290802,460,saga,COMPLETE
933,0.6520362484987444,2023-10-02 12:11:50.323565,2023-10-02 12:11:50.464133,0 days 00:00:00.140568,48308.84809774769,460,saga,COMPLETE
934,0.6552025330276231,2023-10-02 12:11:50.465143,2023-10-02 12:11:50.610996,0 days 00:00:00.145853,58826.43652601373,460,saga,COMPLETE
935,0.6552025330276231,2023-10-02 12:11:50.610996,2023-10-02 12:11:50.757856,0 days 00:00:00.146860,40084.946060055874,470,saga,COMPLETE
936,0.6481602795064964,2023-10-02 12:11:50.758855,2023-10-02 12:11:50.907556,0 days 00:00:00.148701,24793.155495441206,480,saga,COMPLETE
937,0.6520362484987444,2023-10-02 12:11:50.907556,2023-10-02 12:11:51.056321,0 days 00:00:00.148765,37224.35530721417,470,saga,COMPLETE
938,0.6449939949776177,2023-10-02 12:11:51.057323,2023-10-02 12:11:51.197858,0 days 00:00:00.140535,60795.02388910921,470,saga,COMPLETE
939,0.6481602795064964,2023-10-02 12:11:51.198855,2023-10-02 12:11:51.347694,0 days 00:00:00.148839,15975.458894280571,460,saga,COMPLETE
940,0.6590785020198712,2023-10-02 12:11:51.347694,2023-10-02 12:11:51.496519,0 days 00:00:00.148825,68049.66164716445,480,saga,COMPLETE
941,0.6520362484987444,2023-10-02 12:11:51.497522,2023-10-02 12:11:51.648057,0 days 00:00:00.150535,77791.84643352893,480,saga,COMPLETE
942,0.6520362484987444,2023-10-02 12:11:51.649053,2023-10-02 12:11:51.795258,0 days 00:00:00.146205,63915.77567659009,480,saga,COMPLETE
943,0.6520362484987444,2023-10-02 12:11:51.795258,2023-10-02 12:11:51.939347,0 days 00:00:00.144089,37067.53390947159,480,saga,COMPLETE
944,0.6520362484987444,2023-10-02 12:11:51.940339,2023-10-02 12:11:52.086146,0 days 00:00:00.145807,28370.092349786504,470,saga,COMPLETE
945,0.6411180259853696,2023-10-02 12:11:52.086146,2023-10-02 12:11:52.233256,0 days 00:00:00.147110,94287.21870033848,480,saga,COMPLETE
946,0.6481602795064964,2023-10-02 12:11:52.233256,2023-10-02 12:11:52.376443,0 days 00:00:00.143187,49924.786807122684,460,saga,COMPLETE
947,0.6481602795064964,2023-10-02 12:11:52.377447,2023-10-02 12:11:52.521992,0 days 00:00:00.144545,24405.705637723317,480,saga,COMPLETE
948,0.6590785020198712,2023-10-02 12:11:52.522987,2023-10-02 12:11:52.671082,0 days 00:00:00.148095,98487.54953196533,470,saga,COMPLETE
949,0.6449939949776177,2023-10-02 12:11:52.671082,2023-10-02 12:11:52.816539,0 days 00:00:00.145457,68549.85371353853,470,saga,COMPLETE
950,0.6481602795064964,2023-10-02 12:11:52.816539,2023-10-02 12:11:52.957931,0 days 00:00:00.141392,62219.37771056273,460,saga,COMPLETE
951,0.6590785020198712,2023-10-02 12:11:52.957931,2023-10-02 12:11:53.108376,0 days 00:00:00.150445,44199.354974844566,470,saga,COMPLETE
952,0.66224478654875,2023-10-02 12:11:53.108376,2023-10-02 12:11:53.252539,0 days 00:00:00.144163,98067.50123960513,470,saga,COMPLETE
953,0.6520362484987444,2023-10-02 12:11:53.252539,2023-10-02 12:11:53.398995,0 days 00:00:00.146456,93847.36981803755,470,saga,COMPLETE
954,0.6411180259853696,2023-10-02 12:11:53.399992,2023-10-02 12:11:53.549083,0 days 00:00:00.149091,92347.7337824739,460,saga,COMPLETE
955,0.6481602795064964,2023-10-02 12:11:53.549083,2023-10-02 12:11:53.695826,0 days 00:00:00.146743,61811.036910404975,480,saga,COMPLETE
956,0.6481602795064964,2023-10-02 12:11:53.695826,2023-10-02 12:11:53.839239,0 days 00:00:00.143413,40952.293520087966,460,saga,COMPLETE
957,0.6520362484987444,2023-10-02 12:11:53.840250,2023-10-02 12:11:53.988293,0 days 00:00:00.148043,65887.01746532849,470,saga,COMPLETE
958,0.6590785020198712,2023-10-02 12:11:53.988293,2023-10-02 12:11:54.135823,0 days 00:00:00.147530,43014.234343940334,480,saga,COMPLETE
959,0.6552025330276231,2023-10-02 12:11:54.136884,2023-10-02 12:11:54.279423,0 days 00:00:00.142539,29168.84542987259,470,saga,COMPLETE
960,0.6520362484987444,2023-10-02 12:11:54.280418,2023-10-02 12:11:54.430481,0 days 00:00:00.150063,98041.0743002966,480,saga,COMPLETE
961,0.6520362484987444,2023-10-02 12:11:54.431479,2023-10-02 12:11:54.573899,0 days 00:00:00.142420,96834.17795816365,460,saga,COMPLETE
962,0.6520362484987444,2023-10-02 12:11:54.574889,2023-10-02 12:11:54.724023,0 days 00:00:00.149134,19444.53529694687,480,saga,COMPLETE
963,0.6481602795064964,2023-10-02 12:11:54.724023,2023-10-02 12:11:54.873505,0 days 00:00:00.149482,45929.86228242833,470,saga,COMPLETE
964,0.6590785020198712,2023-10-02 12:11:54.873505,2023-10-02 12:11:55.021128,0 days 00:00:00.147623,29249.153938506595,480,saga,COMPLETE
965,0.6481602795064964,2023-10-02 12:11:55.022130,2023-10-02 12:11:55.163541,0 days 00:00:00.141411,13455.858569840428,460,saga,COMPLETE
