number,value,datetime_start,datetime_complete,duration,params_C,params_max_iter,params_solver,state
7319,0.6488699639698657,2023-10-02 12:44:14.909593,2023-10-02 12:44:15.443617,0 days 00:00:00.534024,21018.307467115454,320,sag,COMPLETE
7320,0.6520362484987444,2023-10-02 12:44:15.445612,2023-10-02 12:44:15.981399,0 days 00:00:00.535787,68612.59182009757,440,sag,COMPLETE
7321,0.528169014084507,2023-10-02 12:44:15.983393,2023-10-02 12:44:16.356515,0 days 00:00:00.373122,0.4158863733832621,450,sag,COMPLETE
7322,0.5619609127634021,2023-10-02 12:44:16.359502,2023-10-02 12:44:16.827695,0 days 00:00:00.468193,0.8212238890469656,300,newton-cg,COMPLETE
7323,0.6309094879353642,2023-10-02 12:44:16.829693,2023-10-02 12:44:17.302776,0 days 00:00:00.473083,4031.2500908074544,480,liblinear,COMPLETE
7324,0.6298722567965934,2023-10-02 12:44:17.305778,2023-10-02 12:44:17.693883,0 days 00:00:00.388105,16.339925318917786,430,sag,COMPLETE
7325,0.5,2023-10-02 12:44:17.695871,2023-10-02 12:44:18.166501,0 days 00:00:00.470630,0.0027672152735839116,490,sag,COMPLETE
7326,0.6590785020198712,2023-10-02 12:44:18.168495,2023-10-02 12:44:18.608617,0 days 00:00:00.440122,29006.12012900247,340,sag,COMPLETE
7327,0.5,2023-10-02 12:44:18.611614,2023-10-02 12:44:19.079301,0 days 00:00:00.467687,0.05410805493704242,370,sag,COMPLETE
7328,0.5,2023-10-02 12:44:19.081299,2023-10-02 12:44:19.536618,0 days 00:00:00.455319,0.17398412176579697,350,sag,COMPLETE
7329,0.6534556174254831,2023-10-02 12:44:19.539613,2023-10-02 12:44:19.950728,0 days 00:00:00.411115,79.72792558847041,500,sag,COMPLETE
7330,0.6590785020198712,2023-10-02 12:44:19.952725,2023-10-02 12:44:20.497387,0 days 00:00:00.544662,11520.810976230821,460,sag,COMPLETE
7331,0.5,2023-10-02 12:44:20.499388,2023-10-02 12:44:21.122553,0 days 00:00:00.623165,7.775730961626093e-05,490,sag,COMPLETE
7332,0.6590785020198712,2023-10-02 12:44:21.125561,2023-10-02 12:44:21.570193,0 days 00:00:00.444632,47491.304393561244,470,sag,COMPLETE
7333,0.637951741456491,2023-10-02 12:44:21.572196,2023-10-02 12:44:22.095432,0 days 00:00:00.523236,5762.069395248023,480,lbfgs,COMPLETE
7334,0.5,2023-10-02 12:44:22.097440,2023-10-02 12:44:22.570054,0 days 00:00:00.472614,0.09333215833038658,500,sag,COMPLETE
7335,0.5,2023-10-02 12:44:22.572055,2023-10-02 12:44:22.992163,0 days 00:00:00.420108,0.0002167400877122121,390,sag,COMPLETE
7336,0.6590785020198712,2023-10-02 12:44:22.994156,2023-10-02 12:44:23.544887,0 days 00:00:00.550731,17410.945205454063,490,sag,COMPLETE
7337,0.6502893328966044,2023-10-02 12:44:23.546887,2023-10-02 12:44:23.930495,0 days 00:00:00.383608,35.70813440790275,360,sag,COMPLETE
7338,0.637951741456491,2023-10-02 12:44:23.933496,2023-10-02 12:44:24.476268,0 days 00:00:00.542772,1319.9156561044058,450,sag,COMPLETE
7339,0.6534556174254831,2023-10-02 12:44:24.478266,2023-10-02 12:44:24.972929,0 days 00:00:00.494663,57.2993338491608,330,sag,COMPLETE
7340,0.604541980565564,2023-10-02 12:44:24.974922,2023-10-02 12:44:25.348027,0 days 00:00:00.373105,3.290221208665111,370,sag,COMPLETE
7341,0.666120755540998,2023-10-02 12:44:25.350026,2023-10-02 12:44:25.901228,0 days 00:00:00.551202,36497.90120443553,470,sag,COMPLETE
7342,0.6520362484987444,2023-10-02 12:44:25.903228,2023-10-02 12:44:26.453927,0 days 00:00:00.550699,2956.0642576953364,500,sag,COMPLETE
7343,0.6520362484987444,2023-10-02 12:44:26.455928,2023-10-02 12:44:26.904651,0 days 00:00:00.448723,66779.89006152072,350,sag,COMPLETE
7344,0.6418277104487389,2023-10-02 12:44:26.907655,2023-10-02 12:44:27.450812,0 days 00:00:00.543157,447.6025007774091,480,sag,COMPLETE
7345,0.666120755540998,2023-10-02 12:44:27.453809,2023-10-02 12:44:27.974466,0 days 00:00:00.520657,9025.05687365895,340,sag,COMPLETE
7346,0.637951741456491,2023-10-02 12:44:27.976466,2023-10-02 12:44:28.426602,0 days 00:00:00.450136,24074.858863917623,440,sag,COMPLETE
7347,0.6027950649634239,2023-10-02 12:44:28.428599,2023-10-02 12:44:28.902234,0 days 00:00:00.473635,1.552843080113049,490,sag,COMPLETE
7348,0.5,2023-10-02 12:44:28.904233,2023-10-02 12:44:29.272387,0 days 00:00:00.368154,3.740237870305077e-05,360,liblinear,COMPLETE
7349,0.637951741456491,2023-10-02 12:44:29.274383,2023-10-02 12:44:29.778053,0 days 00:00:00.503670,15281.557320516013,460,newton-cg,COMPLETE
7350,0.6449939949776177,2023-10-02 12:44:29.780051,2023-10-02 12:44:30.340351,0 days 00:00:00.560300,70153.74559760053,500,sag,COMPLETE
7351,0.6590785020198712,2023-10-02 12:44:30.342341,2023-10-02 12:44:30.789487,0 days 00:00:00.447146,36377.12346876023,380,sag,COMPLETE
7352,0.6520362484987444,2023-10-02 12:44:30.791478,2023-10-02 12:44:31.343833,0 days 00:00:00.552355,6450.219806947356,480,sag,COMPLETE
7353,0.6534556174254831,2023-10-02 12:44:31.345835,2023-10-02 12:44:31.823960,0 days 00:00:00.478125,49.4328978943091,450,sag,COMPLETE
7354,0.6590785020198712,2023-10-02 12:44:31.826984,2023-10-02 12:44:32.289581,0 days 00:00:00.462597,2161.9208274425,480,sag,COMPLETE
7355,0.6520362484987444,2023-10-02 12:44:32.292580,2023-10-02 12:44:32.838313,0 days 00:00:00.545733,63936.90951792324,420,sag,COMPLETE
7356,0.6457036794409869,2023-10-02 12:44:32.840313,2023-10-02 12:44:33.258351,0 days 00:00:00.418038,227.58539782326673,470,sag,COMPLETE
7357,0.5,2023-10-02 12:44:33.260347,2023-10-02 12:44:34.284180,0 days 00:00:01.023833,2.0131559081428723e-05,490,sag,COMPLETE
7358,0.5,2023-10-02 12:44:34.287339,2023-10-02 12:44:34.754161,0 days 00:00:00.466822,0.001249017471267474,350,sag,COMPLETE
7359,0.6309094879353642,2023-10-02 12:44:34.756161,2023-10-02 12:44:35.190262,0 days 00:00:00.434101,3941.662174795642,400,lbfgs,COMPLETE
7360,0.6411180259853696,2023-10-02 12:44:35.192256,2023-10-02 12:44:35.673351,0 days 00:00:00.481095,11517.455890150104,140,sag,COMPLETE
7361,0.5,2023-10-02 12:44:35.675350,2023-10-02 12:44:36.132763,0 days 00:00:00.457413,0.015484896898003352,430,sag,COMPLETE
7362,0.666120755540998,2023-10-02 12:44:36.135762,2023-10-02 12:44:36.597611,0 days 00:00:00.461849,24487.494330760444,500,sag,COMPLETE
7363,0.6069985806310733,2023-10-02 12:44:36.599614,2023-10-02 12:44:37.064743,0 days 00:00:00.465129,4.491686975429062,130,sag,COMPLETE
7364,0.666120755540998,2023-10-02 12:44:37.066743,2023-10-02 12:44:37.607389,0 days 00:00:00.540646,44325.30011128811,460,sag,COMPLETE
7365,0.6590785020198712,2023-10-02 12:44:37.609384,2023-10-02 12:44:38.051934,0 days 00:00:00.442550,18715.907839674495,370,sag,COMPLETE
7366,0.6590785020198712,2023-10-02 12:44:38.053933,2023-10-02 12:44:38.568309,0 days 00:00:00.514376,6974.810019969395,340,sag,COMPLETE
7367,0.6552025330276231,2023-10-02 12:44:38.570304,2023-10-02 12:44:39.029533,0 days 00:00:00.459229,98451.6448363558,390,sag,COMPLETE
7368,0.5,2023-10-02 12:44:39.031538,2023-10-02 12:44:39.498846,0 days 00:00:00.467308,0.0008066648771075261,490,sag,COMPLETE
7369,0.5,2023-10-02 12:44:39.501840,2023-10-02 12:44:39.988728,0 days 00:00:00.486888,0.00047080298414695033,360,sag,COMPLETE
7370,0.6520362484987444,2023-10-02 12:44:39.990734,2023-10-02 12:44:40.442875,0 days 00:00:00.452141,32729.69991433869,470,sag,COMPLETE
7371,0.6449939949776177,2023-10-02 12:44:40.444865,2023-10-02 12:44:40.934560,0 days 00:00:00.489695,63593.78331590332,500,newton-cg,COMPLETE
7372,0.528169014084507,2023-10-02 12:44:40.936560,2023-10-02 12:44:41.392726,0 days 00:00:00.456166,0.4568009005996921,480,sag,COMPLETE
7373,0.637951741456491,2023-10-02 12:44:41.394726,2023-10-02 12:44:41.777375,0 days 00:00:00.382649,13808.293291436123,450,liblinear,COMPLETE
7374,0.6520362484987444,2023-10-02 12:44:41.779368,2023-10-02 12:44:42.302497,0 days 00:00:00.523129,1657.2692089495797,380,sag,COMPLETE
7375,0.6449939949776177,2023-10-02 12:44:42.305664,2023-10-02 12:44:42.849888,0 days 00:00:00.544224,4105.797895830305,440,sag,COMPLETE
7376,0.6590785020198712,2023-10-02 12:44:42.852882,2023-10-02 12:44:43.304536,0 days 00:00:00.451654,33564.505907485574,490,sag,COMPLETE
7377,0.5,2023-10-02 12:44:43.306557,2023-10-02 12:44:43.811322,0 days 00:00:00.504765,0.00023375077351101359,460,sag,COMPLETE
7378,0.5,2023-10-02 12:44:43.814322,2023-10-02 12:44:44.298688,0 days 00:00:00.484366,8.243892792492467e-05,480,sag,COMPLETE
7379,0.6203734032099574,2023-10-02 12:44:44.300688,2023-10-02 12:44:44.766855,0 days 00:00:00.466167,7.498180041274755,350,sag,COMPLETE
7380,0.6597881864832406,2023-10-02 12:44:44.769851,2023-10-02 12:44:45.248187,0 days 00:00:00.478336,49788.63835600387,110,sag,COMPLETE
7381,0.6418277104487389,2023-10-02 12:44:45.249261,2023-10-02 12:44:45.694876,0 days 00:00:00.445615,334.16323589588444,500,sag,COMPLETE
7382,0.5,2023-10-02 12:44:45.697869,2023-10-02 12:44:46.602959,0 days 00:00:00.905090,2.972538698043263e-05,490,sag,COMPLETE
7383,0.6534556174254831,2023-10-02 12:44:46.604997,2023-10-02 12:44:47.098128,0 days 00:00:00.493131,122.72146593125585,320,lbfgs,COMPLETE
7384,0.5943334425155585,2023-10-02 12:44:47.100129,2023-10-02 12:44:47.462397,0 days 00:00:00.362268,2.0638817127703333,470,sag,COMPLETE
7385,0.5,2023-10-02 12:44:47.464397,2023-10-02 12:44:47.958065,0 days 00:00:00.493668,0.0003196081042896052,330,sag,COMPLETE
7386,0.5,2023-10-02 12:44:47.960066,2023-10-02 12:44:48.416501,0 days 00:00:00.456435,0.009181407822253409,370,sag,COMPLETE
7387,0.6520362484987444,2023-10-02 12:44:48.418498,2023-10-02 12:44:48.844706,0 days 00:00:00.426208,22373.476087231633,360,sag,COMPLETE
7388,0.6559122174909924,2023-10-02 12:44:48.846698,2023-10-02 12:44:49.393118,0 days 00:00:00.546420,8363.724513934183,490,sag,COMPLETE
7389,0.6488699639698657,2023-10-02 12:44:49.395118,2023-10-02 12:44:49.837602,0 days 00:00:00.442484,12792.412394416146,340,sag,COMPLETE
7390,0.6449939949776177,2023-10-02 12:44:49.839609,2023-10-02 12:44:50.389346,0 days 00:00:00.549737,63881.99910333764,500,sag,COMPLETE
7391,0.6449939949776177,2023-10-02 12:44:50.391346,2023-10-02 12:44:50.930603,0 days 00:00:00.539257,2474.476957419773,450,sag,COMPLETE
7392,0.5996287804345454,2023-10-02 12:44:50.933611,2023-10-02 12:44:51.328271,0 days 00:00:00.394660,1.474584626774694,480,sag,COMPLETE
7393,0.5,2023-10-02 12:44:51.330276,2023-10-02 12:44:51.810908,0 days 00:00:00.480632,0.0009213274706234484,380,sag,COMPLETE
7394,0.6449939949776177,2023-10-02 12:44:51.813908,2023-10-02 12:44:52.369931,0 days 00:00:00.556023,1206.0394089154445,440,sag,COMPLETE
7395,0.637951741456491,2023-10-02 12:44:52.371928,2023-10-02 12:44:52.762220,0 days 00:00:00.390292,34430.51499041885,470,newton-cg,COMPLETE
7396,0.637951741456491,2023-10-02 12:44:52.764216,2023-10-02 12:44:53.304572,0 days 00:00:00.540356,837.315926803167,490,sag,COMPLETE
7397,0.6590785020198712,2023-10-02 12:44:53.306572,2023-10-02 12:44:53.749289,0 days 00:00:00.442717,4906.844125273331,350,sag,COMPLETE
7398,0.637951741456491,2023-10-02 12:44:53.751286,2023-10-02 12:44:54.210113,0 days 00:00:00.458827,98488.03994987237,430,liblinear,COMPLETE
7399,0.5,2023-10-02 12:44:54.212108,2023-10-02 12:44:54.665329,0 days 00:00:00.453221,0.20385965126484848,500,sag,COMPLETE
7400,0.637951741456491,2023-10-02 12:44:54.667326,2023-10-02 12:44:55.098000,0 days 00:00:00.430674,629.697083523098,370,sag,COMPLETE
7401,0.6520362484987444,2023-10-02 12:44:55.100995,2023-10-02 12:44:55.660790,0 days 00:00:00.559795,20463.789859329303,470,sag,COMPLETE
7402,0.6629544710121192,2023-10-02 12:44:55.662799,2023-10-02 12:44:56.206138,0 days 00:00:00.543339,9043.389207813716,480,sag,COMPLETE
7403,0.6520362484987444,2023-10-02 12:44:56.208135,2023-10-02 12:44:56.649005,0 days 00:00:00.440870,45123.89416499329,410,sag,COMPLETE
7404,0.5,2023-10-02 12:44:56.651005,2023-10-02 12:44:57.109891,0 days 00:00:00.458886,0.004182216814478506,460,sag,COMPLETE
7405,0.5690031662845288,2023-10-02 12:44:57.111890,2023-10-02 12:44:57.570022,0 days 00:00:00.458132,1.0311619080374352,360,sag,COMPLETE
7406,0.6101648651599519,2023-10-02 12:44:57.572022,2023-10-02 12:44:57.942237,0 days 00:00:00.370215,5.510233822190009,490,sag,COMPLETE
7407,0.5,2023-10-02 12:44:57.945237,2023-10-02 12:44:58.396190,0 days 00:00:00.450953,0.025362625768141158,330,sag,COMPLETE
7408,0.637951741456491,2023-10-02 12:44:58.398190,2023-10-02 12:44:58.811201,0 days 00:00:00.413011,15034.905251811078,160,lbfgs,COMPLETE
7409,0.5,2023-10-02 12:44:58.813192,2023-10-02 12:44:59.273188,0 days 00:00:00.459996,0.08438198125574434,450,sag,COMPLETE
7410,0.6534556174254831,2023-10-02 12:44:59.275188,2023-10-02 12:44:59.774342,0 days 00:00:00.499154,51.96362694622886,500,sag,COMPLETE
7411,0.6449939949776177,2023-10-02 12:44:59.776342,2023-10-02 12:45:00.216477,0 days 00:00:00.440135,5754.535993843186,340,sag,COMPLETE
7412,0.5408341522000218,2023-10-02 12:45:00.218473,2023-10-02 12:45:00.691282,0 days 00:00:00.472809,0.654317967318896,480,sag,COMPLETE
7413,0.6590785020198712,2023-10-02 12:45:00.693285,2023-10-02 12:45:01.328705,0 days 00:00:00.635420,24754.871555975227,490,sag,COMPLETE
7414,0.6298722567965934,2023-10-02 12:45:01.330754,2023-10-02 12:45:01.733510,0 days 00:00:00.402756,16.0039348405866,460,sag,COMPLETE
7415,0.6520362484987444,2023-10-02 12:45:01.735510,2023-10-02 12:45:02.265576,0 days 00:00:00.530066,2747.0357421025187,350,sag,COMPLETE
7416,0.6590785020198712,2023-10-02 12:45:02.267583,2023-10-02 12:45:02.809676,0 days 00:00:00.542093,45308.28834352367,500,sag,COMPLETE
7417,0.6457036794409869,2023-10-02 12:45:02.812676,2023-10-02 12:45:03.230255,0 days 00:00:00.417579,209.36194971545706,390,sag,COMPLETE
7418,0.6457036794409869,2023-10-02 12:45:03.232256,2023-10-02 12:45:03.743889,0 days 00:00:00.511633,175.34889804620624,370,sag,COMPLETE
7419,0.6267059722677149,2023-10-02 12:45:03.745889,2023-10-02 12:45:04.126103,0 days 00:00:00.380214,10.704521794441863,310,sag,COMPLETE
7420,0.6449939949776177,2023-10-02 12:45:04.128099,2023-10-02 12:45:04.662399,0 days 00:00:00.534300,8400.87831715312,470,sag,COMPLETE
7421,0.6449939949776177,2023-10-02 12:45:04.665398,2023-10-02 12:45:05.153512,0 days 00:00:00.488114,67681.64691424355,180,sag,COMPLETE
7422,0.637951741456491,2023-10-02 12:45:05.155514,2023-10-02 12:45:05.548994,0 days 00:00:00.393480,25905.62392559193,480,newton-cg,COMPLETE
7423,0.6590785020198712,2023-10-02 12:45:05.551993,2023-10-02 12:45:06.099055,0 days 00:00:00.547062,13712.918785625314,440,sag,COMPLETE
7424,0.6309094879353642,2023-10-02 12:45:06.102201,2023-10-02 12:45:06.564633,0 days 00:00:00.462432,3975.438498793053,360,liblinear,COMPLETE
7425,0.6077082650944426,2023-10-02 12:45:06.566777,2023-10-02 12:45:06.930421,0 days 00:00:00.363644,3.488724007288443,490,sag,COMPLETE
7426,0.6590785020198712,2023-10-02 12:45:06.933427,2023-10-02 12:45:07.458623,0 days 00:00:00.525196,35641.57273153227,340,sag,COMPLETE
7427,0.5,2023-10-02 12:45:07.460691,2023-10-02 12:45:07.836092,0 days 00:00:00.375401,0.1231520379104014,500,sag,COMPLETE
7428,0.6590785020198712,2023-10-02 12:45:07.838196,2023-10-02 12:45:08.375366,0 days 00:00:00.537170,99840.3437602092,470,sag,COMPLETE
7429,0.66224478654875,2023-10-02 12:45:08.377368,2023-10-02 12:45:08.935312,0 days 00:00:00.557944,66903.36936884541,450,sag,COMPLETE
7430,0.6559122174909924,2023-10-02 12:45:08.937311,2023-10-02 12:45:09.382339,0 days 00:00:00.445028,17861.623830111952,380,sag,COMPLETE
7431,0.6235396877388361,2023-10-02 12:45:09.384373,2023-10-02 12:45:09.856879,0 days 00:00:00.472506,8.922094664988666,350,sag,COMPLETE
7432,0.6449939949776177,2023-10-02 12:45:09.858878,2023-10-02 12:45:10.418245,0 days 00:00:00.559367,1385.990945066946,490,sag,COMPLETE
7433,0.5,2023-10-02 12:45:10.420244,2023-10-02 12:45:10.804773,0 days 00:00:00.384529,0.034862650230159595,420,lbfgs,COMPLETE
7434,0.5,2023-10-02 12:45:10.807772,2023-10-02 12:45:11.284779,0 days 00:00:00.477007,0.001782924458434876,360,sag,COMPLETE
7435,0.6534556174254831,2023-10-02 12:45:11.286780,2023-10-02 12:45:11.772980,0 days 00:00:00.486200,84.75103574797862,460,sag,COMPLETE
7436,0.666120755540998,2023-10-02 12:45:11.775980,2023-10-02 12:45:12.221963,0 days 00:00:00.445983,7858.528274011409,480,sag,COMPLETE
7437,0.66224478654875,2023-10-02 12:45:12.223967,2023-10-02 12:45:12.747386,0 days 00:00:00.523419,45925.19291317559,370,sag,COMPLETE
7438,0.6520362484987444,2023-10-02 12:45:12.749388,2023-10-02 12:45:13.275362,0 days 00:00:00.525974,24671.525909767108,320,sag,COMPLETE
7439,0.666120755540998,2023-10-02 12:45:13.278357,2023-10-02 12:45:13.746552,0 days 00:00:00.468195,99423.50382970077,430,sag,COMPLETE
7440,0.5,2023-10-02 12:45:13.748711,2023-10-02 12:45:14.230828,0 days 00:00:00.482117,0.12249837658648122,400,sag,COMPLETE
7441,0.6590785020198712,2023-10-02 12:45:14.232827,2023-10-02 12:45:14.662859,0 days 00:00:00.430032,11300.241912780535,290,sag,COMPLETE
7442,0.6449939949776177,2023-10-02 12:45:14.664854,2023-10-02 12:45:15.211251,0 days 00:00:00.546397,3174.776014318342,500,sag,COMPLETE
7443,0.5,2023-10-02 12:45:15.214250,2023-10-02 12:45:16.401459,0 days 00:00:01.187209,1.5701686792055075e-05,480,sag,COMPLETE
7444,0.5,2023-10-02 12:45:16.404456,2023-10-02 12:45:16.808563,0 days 00:00:00.404107,0.0002081131742886338,490,sag,COMPLETE
7445,0.637951741456491,2023-10-02 12:45:16.810689,2023-10-02 12:45:17.286199,0 days 00:00:00.475510,5498.747409767328,480,newton-cg,COMPLETE
7446,0.6590785020198712,2023-10-02 12:45:17.288333,2023-10-02 12:45:17.829456,0 days 00:00:00.541123,49577.091328518654,450,sag,COMPLETE
7447,0.637951741456491,2023-10-02 12:45:17.831453,2023-10-02 12:45:18.289630,0 days 00:00:00.458177,608.7307454155757,500,sag,COMPLETE
7448,0.5,2023-10-02 12:45:18.292625,2023-10-02 12:45:18.766221,0 days 00:00:00.473596,0.0006718641588278417,330,sag,COMPLETE
7449,0.666120755540998,2023-10-02 12:45:18.769214,2023-10-02 12:45:19.312515,0 days 00:00:00.543301,32500.008960445673,470,sag,COMPLETE
7450,0.6238672344142374,2023-10-02 12:45:19.314516,2023-10-02 12:45:19.681100,0 days 00:00:00.366584,1962.2093310032726,490,liblinear,COMPLETE
7451,0.5792117043345343,2023-10-02 12:45:19.684096,2023-10-02 12:45:20.151113,0 days 00:00:00.467017,1.1071561897293467,460,sag,COMPLETE
7452,0.6559122174909924,2023-10-02 12:45:20.153105,2023-10-02 12:45:20.672686,0 days 00:00:00.519581,16302.012254492138,360,sag,COMPLETE
7453,0.666120755540998,2023-10-02 12:45:20.674685,2023-10-02 12:45:21.102354,0 days 00:00:00.427669,63946.60671419636,340,sag,COMPLETE
7454,0.6552025330276231,2023-10-02 12:45:21.104354,2023-10-02 12:45:21.630645,0 days 00:00:00.526291,9025.870393568663,380,sag,COMPLETE
7455,0.5,2023-10-02 12:45:21.632677,2023-10-02 12:45:22.310974,0 days 00:00:00.678297,5.1571072939810175e-05,490,sag,COMPLETE
7456,0.6590785020198712,2023-10-02 12:45:22.312974,2023-10-02 12:45:22.753098,0 days 00:00:00.440124,5615.749128904321,440,sag,COMPLETE
7457,0.5,2023-10-02 12:45:22.756098,2023-10-02 12:45:23.232522,0 days 00:00:00.476424,0.01686038120361314,350,lbfgs,COMPLETE
7458,0.6203734032099574,2023-10-02 12:45:23.234515,2023-10-02 12:45:23.693493,0 days 00:00:00.458978,7.425962241968481,500,sag,COMPLETE
7459,0.6520362484987444,2023-10-02 12:45:23.695493,2023-10-02 12:45:24.128247,0 days 00:00:00.432754,25297.37576090384,370,sag,COMPLETE
7460,0.5313352986133857,2023-10-02 12:45:24.130248,2023-10-02 12:45:24.586772,0 days 00:00:00.456524,0.5305804641226765,480,sag,COMPLETE
7461,0.6449939949776177,2023-10-02 12:45:24.589772,2023-10-02 12:45:25.142378,0 days 00:00:00.552606,35146.29259063387,460,sag,COMPLETE
7462,0.5,2023-10-02 12:45:25.145374,2023-10-02 12:45:25.510325,0 days 00:00:00.364951,0.3075775908013449,470,sag,COMPLETE
7463,0.6520362484987444,2023-10-02 12:45:25.513330,2023-10-02 12:45:26.066174,0 days 00:00:00.552844,16186.466782433738,490,sag,COMPLETE
7464,0.6449939949776177,2023-10-02 12:45:26.069184,2023-10-02 12:45:26.597059,0 days 00:00:00.527875,3360.599449116572,350,sag,COMPLETE
7465,0.5,2023-10-02 12:45:26.599059,2023-10-02 12:45:26.979995,0 days 00:00:00.380936,0.002660110040718717,390,sag,COMPLETE
7466,0.6534556174254831,2023-10-02 12:45:26.982032,2023-10-02 12:45:27.455680,0 days 00:00:00.473648,43.312840947544046,500,sag,COMPLETE
7467,0.637951741456491,2023-10-02 12:45:27.458678,2023-10-02 12:45:27.902213,0 days 00:00:00.443535,61843.23618913586,450,sag,COMPLETE
7468,0.6629544710121192,2023-10-02 12:45:27.904211,2023-10-02 12:45:28.437892,0 days 00:00:00.533681,12416.774807355827,380,sag,COMPLETE
7469,0.6449939949776177,2023-10-02 12:45:28.439999,2023-10-02 12:45:28.939503,0 days 00:00:00.499504,67784.85219054033,360,newton-cg,COMPLETE
7470,0.6418277104487389,2023-10-02 12:45:28.941503,2023-10-02 12:45:29.422947,0 days 00:00:00.481444,426.018201558149,480,sag,COMPLETE
7471,0.5,2023-10-02 12:45:29.424940,2023-10-02 12:45:29.914916,0 days 00:00:00.489976,0.005538136550687738,490,sag,COMPLETE
7472,0.5,2023-10-02 12:45:29.917910,2023-10-02 12:45:30.377084,0 days 00:00:00.459174,0.03102371286788754,330,sag,COMPLETE
7473,0.6520362484987444,2023-10-02 12:45:30.379079,2023-10-02 12:45:30.829029,0 days 00:00:00.449950,33718.83100847031,440,sag,COMPLETE
7474,0.5,2023-10-02 12:45:30.832137,2023-10-02 12:45:31.300794,0 days 00:00:00.468657,0.00013548977644007955,470,liblinear,COMPLETE
7475,0.6418277104487389,2023-10-02 12:45:31.302789,2023-10-02 12:45:31.911936,0 days 00:00:00.609147,293.98077183339814,340,sag,COMPLETE
7476,0.6520362484987444,2023-10-02 12:45:31.915047,2023-10-02 12:45:32.429759,0 days 00:00:00.514712,6039.598044328333,370,sag,COMPLETE
7477,0.5,2023-10-02 12:45:32.432760,2023-10-02 12:45:32.913397,0 days 00:00:00.480637,0.007765778048856502,500,sag,COMPLETE
7478,0.6590785020198712,2023-10-02 12:45:32.916403,2023-10-02 12:45:33.519932,0 days 00:00:00.603529,21450.687808857067,480,sag,COMPLETE
7479,0.6590785020198712,2023-10-02 12:45:33.521929,2023-10-02 12:45:33.999959,0 days 00:00:00.478030,10919.075862104251,460,sag,COMPLETE
7480,0.5,2023-10-02 12:45:34.001959,2023-10-02 12:45:34.480673,0 days 00:00:00.478714,0.04434213516245642,420,sag,COMPLETE
7481,0.5,2023-10-02 12:45:34.482671,2023-10-02 12:45:34.932714,0 days 00:00:00.450043,0.07318758734211374,490,sag,COMPLETE
