number,value,datetime_start,datetime_complete,duration,params_C,params_max_iter,params_solver,state
5363,0.6590785020198712,2023-10-02 12:30:09.095384,2023-10-02 12:30:09.462476,0 days 00:00:00.367092,10175.747679898665,480,sag,COMPLETE
5364,0.5690031662845288,2023-10-02 12:30:09.463476,2023-10-02 12:30:09.814013,0 days 00:00:00.350537,1.0356073447493985,340,sag,COMPLETE
5365,0.6520362484987444,2023-10-02 12:30:09.817022,2023-10-02 12:30:10.176313,0 days 00:00:00.359291,65102.6617222163,500,sag,COMPLETE
5366,0.6337482257888415,2023-10-02 12:30:10.178317,2023-10-02 12:30:10.543762,0 days 00:00:00.365445,14.48118200293318,490,sag,COMPLETE
5367,0.5,2023-10-02 12:30:10.545761,2023-10-02 12:30:10.816963,0 days 00:00:00.271202,0.04193401476716939,470,sag,COMPLETE
5368,0.5,2023-10-02 12:30:10.816963,2023-10-02 12:30:11.630981,0 days 00:00:00.814018,2.9595293838644165e-05,370,sag,COMPLETE
5369,0.637951741456491,2023-10-02 12:30:11.631979,2023-10-02 12:30:11.950582,0 days 00:00:00.318603,32556.557109076584,500,lbfgs,COMPLETE
5370,0.5,2023-10-02 12:30:11.952566,2023-10-02 12:30:12.317195,0 days 00:00:00.364629,0.0021453727507085335,340,sag,COMPLETE
5371,0.5478764057211486,2023-10-02 12:30:12.317195,2023-10-02 12:30:12.593262,0 days 00:00:00.276067,0.7518707600785931,490,sag,COMPLETE
5372,0.6418277104487389,2023-10-02 12:30:12.595263,2023-10-02 12:30:12.951868,0 days 00:00:00.356605,309.8298136059066,480,sag,COMPLETE
5373,0.6520362484987444,2023-10-02 12:30:12.953868,2023-10-02 12:30:13.317744,0 days 00:00:00.363876,18201.928375474214,140,sag,COMPLETE
5374,0.5,2023-10-02 12:30:13.333370,2023-10-02 12:30:13.625878,0 days 00:00:00.292508,0.0013173328073456116,350,sag,COMPLETE
5375,0.6559122174909924,2023-10-02 12:30:13.627873,2023-10-02 12:30:14.066565,0 days 00:00:00.438692,7069.366110341251,480,sag,COMPLETE
5376,0.666120755540998,2023-10-02 12:30:14.066565,2023-10-02 12:30:14.452246,0 days 00:00:00.385681,99710.36719791341,500,sag,COMPLETE
5377,0.608417949557812,2023-10-02 12:30:14.454235,2023-10-02 12:30:14.816710,0 days 00:00:00.362475,3.1160534365805495,390,sag,COMPLETE
5378,0.6559122174909924,2023-10-02 12:30:14.819708,2023-10-02 12:30:15.191637,0 days 00:00:00.371929,45866.40641373996,470,sag,COMPLETE
5379,0.5,2023-10-02 12:30:15.193640,2023-10-02 12:30:15.555955,0 days 00:00:00.362315,0.10985029393766063,490,sag,COMPLETE
5380,0.6449939949776177,2023-10-02 12:30:15.557955,2023-10-02 12:30:15.889403,0 days 00:00:00.331448,24153.69066188973,380,sag,COMPLETE
5381,0.5,2023-10-02 12:30:15.891398,2023-10-02 12:30:16.167405,0 days 00:00:00.276007,0.0004087076852999198,490,newton-cg,COMPLETE
5382,0.6590785020198712,2023-10-02 12:30:16.167405,2023-10-02 12:30:16.584665,0 days 00:00:00.417260,3548.4020882454656,300,sag,COMPLETE
5383,0.6590785020198712,2023-10-02 12:30:16.585738,2023-10-02 12:30:16.918939,0 days 00:00:00.333201,13014.96507761026,360,sag,COMPLETE
5384,0.6449939949776177,2023-10-02 12:30:16.918939,2023-10-02 12:30:17.341654,0 days 00:00:00.422715,51510.540724258186,330,sag,COMPLETE
5385,0.6238672344142374,2023-10-02 12:30:17.343655,2023-10-02 12:30:17.623466,0 days 00:00:00.279811,2246.6182388823586,500,liblinear,COMPLETE
5386,0.6520362484987444,2023-10-02 12:30:17.625465,2023-10-02 12:30:18.083588,0 days 00:00:00.458123,7564.738604820439,480,sag,COMPLETE
5387,0.5,2023-10-02 12:30:18.086330,2023-10-02 12:30:18.401640,0 days 00:00:00.315310,0.0002708272633164427,430,sag,COMPLETE
5388,0.6449939949776177,2023-10-02 12:30:18.401640,2023-10-02 12:30:18.835187,0 days 00:00:00.433547,999.8597946955895,490,sag,COMPLETE
5389,0.5,2023-10-02 12:30:18.835187,2023-10-02 12:30:19.208055,0 days 00:00:00.372868,0.00012710816585138882,470,sag,COMPLETE
5390,0.6590785020198712,2023-10-02 12:30:19.210055,2023-10-02 12:30:19.635443,0 days 00:00:00.425388,17253.7290965457,370,sag,COMPLETE
5391,0.6520362484987444,2023-10-02 12:30:19.635443,2023-10-02 12:30:19.987197,0 days 00:00:00.351754,29291.033033033087,350,sag,COMPLETE
5392,0.5,2023-10-02 12:30:19.994708,2023-10-02 12:30:20.287504,0 days 00:00:00.292796,0.047161208398321414,480,sag,COMPLETE
5393,0.6534556174254831,2023-10-02 12:30:20.287504,2023-10-02 12:30:20.688311,0 days 00:00:00.400807,110.71999628816938,420,sag,COMPLETE
5394,0.6449939949776177,2023-10-02 12:30:20.690311,2023-10-02 12:30:21.078533,0 days 00:00:00.388222,4803.146252082885,500,sag,COMPLETE
5395,0.5,2023-10-02 12:30:21.080540,2023-10-02 12:30:21.481048,0 days 00:00:00.400508,0.16107749677710181,490,sag,COMPLETE
5396,0.637951741456491,2023-10-02 12:30:21.484038,2023-10-02 12:30:21.888877,0 days 00:00:00.404839,60636.051955911666,500,lbfgs,COMPLETE
5397,0.6457036794409869,2023-10-02 12:30:21.890876,2023-10-02 12:30:22.302847,0 days 00:00:00.411971,227.3048621481843,470,sag,COMPLETE
5398,0.6590785020198712,2023-10-02 12:30:22.304415,2023-10-02 12:30:22.639132,0 days 00:00:00.334717,10060.030809949283,340,sag,COMPLETE
5399,0.5478764057211486,2023-10-02 12:30:22.639132,2023-10-02 12:30:23.033108,0 days 00:00:00.393976,0.6791528928324414,480,sag,COMPLETE
5400,0.5,2023-10-02 12:30:23.035108,2023-10-02 12:30:24.148417,0 days 00:00:01.113309,1.474168032658812e-05,440,sag,COMPLETE
5401,0.66224478654875,2023-10-02 12:30:24.150417,2023-10-02 12:30:24.565442,0 days 00:00:00.415025,99496.22666508146,360,sag,COMPLETE
5402,0.6559122174909924,2023-10-02 12:30:24.566446,2023-10-02 12:30:24.975883,0 days 00:00:00.409437,40219.4340492221,490,sag,COMPLETE
5403,0.6590785020198712,2023-10-02 12:30:24.977882,2023-10-02 12:30:25.339236,0 days 00:00:00.361354,20620.253155913466,380,sag,COMPLETE
5404,0.6449939949776177,2023-10-02 12:30:25.339236,2023-10-02 12:30:25.792007,0 days 00:00:00.452771,6414.065847581268,480,sag,COMPLETE
5405,0.6590785020198712,2023-10-02 12:30:25.794006,2023-10-02 12:30:26.194150,0 days 00:00:00.400144,30951.51133093711,500,sag,COMPLETE
5406,0.6520362484987444,2023-10-02 12:30:26.196150,2023-10-02 12:30:26.606073,0 days 00:00:00.409923,13551.003454020047,320,sag,COMPLETE
5407,0.5,2023-10-02 12:30:26.606073,2023-10-02 12:30:26.872988,0 days 00:00:00.266915,0.30167571856364317,350,sag,COMPLETE
5408,0.6309094879353642,2023-10-02 12:30:26.872988,2023-10-02 12:30:27.245622,0 days 00:00:00.372634,3478.9784371870082,490,newton-cg,COMPLETE
5409,0.637951741456491,2023-10-02 12:30:27.247612,2023-10-02 12:30:27.520448,0 days 00:00:00.272836,65644.93293506534,470,liblinear,COMPLETE
5410,0.6520362484987444,2023-10-02 12:30:27.522362,2023-10-02 12:30:27.928483,0 days 00:00:00.406121,1472.607675456598,370,sag,COMPLETE
5411,0.6534556174254831,2023-10-02 12:30:27.930483,2023-10-02 12:30:28.223469,0 days 00:00:00.292986,41.06589039980271,500,sag,COMPLETE
5412,0.6481602795064964,2023-10-02 12:30:28.223469,2023-10-02 12:30:28.713413,0 days 00:00:00.489944,45691.93576094527,490,sag,COMPLETE
5413,0.6101648651599519,2023-10-02 12:30:28.715420,2023-10-02 12:30:29.005881,0 days 00:00:00.290461,5.551814095498007,480,sag,COMPLETE
5414,0.5,2023-10-02 12:30:29.005881,2023-10-02 12:30:29.291430,0 days 00:00:00.285549,0.014601612698958539,360,sag,COMPLETE
5415,0.6062888961677039,2023-10-02 12:30:29.291430,2023-10-02 12:30:29.680331,0 days 00:00:00.388901,6.487836097625332,330,sag,COMPLETE
5416,0.6541653018888526,2023-10-02 12:30:29.682331,2023-10-02 12:30:29.972930,0 days 00:00:00.290599,29.478180110162796,500,sag,COMPLETE
5417,0.6418277104487389,2023-10-02 12:30:29.972930,2023-10-02 12:30:30.390836,0 days 00:00:00.417906,445.09319527235164,470,sag,COMPLETE
5418,0.6590785020198712,2023-10-02 12:30:30.404376,2023-10-02 12:30:30.784332,0 days 00:00:00.379956,20393.547793786987,490,sag,COMPLETE
5419,0.637951741456491,2023-10-02 12:30:30.786332,2023-10-02 12:30:31.194415,0 days 00:00:00.408083,9439.035961084122,340,lbfgs,COMPLETE
5420,0.6449939949776177,2023-10-02 12:30:31.196415,2023-10-02 12:30:31.540219,0 days 00:00:00.343804,2320.01872929333,430,sag,COMPLETE
5421,0.5,2023-10-02 12:30:31.540219,2023-10-02 12:30:31.891692,0 days 00:00:00.351473,0.008504065146728308,480,sag,COMPLETE
5422,0.6590785020198712,2023-10-02 12:30:31.891692,2023-10-02 12:30:32.273807,0 days 00:00:00.382115,34635.030356658885,500,sag,COMPLETE
5423,0.6552025330276231,2023-10-02 12:30:32.273807,2023-10-02 12:30:32.739043,0 days 00:00:00.465236,67118.6380053224,490,sag,COMPLETE
5424,0.5,2023-10-02 12:30:32.740042,2023-10-02 12:30:33.020802,0 days 00:00:00.280760,0.07665992772333767,470,sag,COMPLETE
5425,0.6552025330276231,2023-10-02 12:30:33.022801,2023-10-02 12:30:33.371081,0 days 00:00:00.348280,5391.03990191182,350,sag,COMPLETE
5426,0.6534556174254831,2023-10-02 12:30:33.373080,2023-10-02 12:30:33.741102,0 days 00:00:00.368022,45.9035445551959,370,sag,COMPLETE
5427,0.5,2023-10-02 12:30:33.741102,2023-10-02 12:30:34.025794,0 days 00:00:00.284692,0.024841870133343876,440,sag,COMPLETE
5428,0.6590785020198712,2023-10-02 12:30:34.025794,2023-10-02 12:30:34.468369,0 days 00:00:00.442575,15691.053711242443,490,sag,COMPLETE
5429,0.6534556174254831,2023-10-02 12:30:34.470365,2023-10-02 12:30:34.772060,0 days 00:00:00.301695,54.01089158895739,500,sag,COMPLETE
5430,0.5,2023-10-02 12:30:34.774247,2023-10-02 12:30:35.175020,0 days 00:00:00.400773,0.0004640146337249284,390,sag,COMPLETE
5431,0.66224478654875,2023-10-02 12:30:35.175020,2023-10-02 12:30:35.544089,0 days 00:00:00.369069,26409.6188847659,480,sag,COMPLETE
5432,0.637951741456491,2023-10-02 12:30:35.546089,2023-10-02 12:30:35.935363,0 days 00:00:00.389274,8757.002901035023,330,newton-cg,COMPLETE
5433,0.6552025330276231,2023-10-02 12:30:35.937364,2023-10-02 12:30:36.275414,0 days 00:00:00.338050,47840.82249295676,360,sag,COMPLETE
5434,0.637951741456491,2023-10-02 12:30:36.275414,2023-10-02 12:30:36.632721,0 days 00:00:00.357307,99566.02450608,470,liblinear,COMPLETE
5435,0.6449939949776177,2023-10-02 12:30:36.633721,2023-10-02 12:30:37.027362,0 days 00:00:00.393641,1222.045280624157,490,sag,COMPLETE
5436,0.6449939949776177,2023-10-02 12:30:37.027362,2023-10-02 12:30:37.427026,0 days 00:00:00.399664,14192.338304765386,340,sag,COMPLETE
5437,0.6590785020198712,2023-10-02 12:30:37.429021,2023-10-02 12:30:37.867536,0 days 00:00:00.438515,4318.866972424159,500,sag,COMPLETE
5438,0.5,2023-10-02 12:30:37.867536,2023-10-02 12:30:38.322617,0 days 00:00:00.455081,6.490326588942564e-05,480,sag,COMPLETE
5439,0.6590785020198712,2023-10-02 12:30:38.322617,2023-10-02 12:30:38.730632,0 days 00:00:00.408015,23886.493302848856,380,sag,COMPLETE
5440,0.6590785020198712,2023-10-02 12:30:38.730632,2023-10-02 12:30:39.060042,0 days 00:00:00.329410,2661.52777750837,350,sag,COMPLETE
5441,0.6411180259853696,2023-10-02 12:30:39.060042,2023-10-02 12:30:39.483594,0 days 00:00:00.423552,35754.96893536057,420,sag,COMPLETE
5442,0.6590785020198712,2023-10-02 12:30:39.499231,2023-10-02 12:30:39.844672,0 days 00:00:00.345441,7136.680561097291,500,sag,COMPLETE
5443,0.6590785020198712,2023-10-02 12:30:39.844672,2023-10-02 12:30:40.241237,0 days 00:00:00.396565,63990.633531547974,120,sag,COMPLETE
5444,0.637951741456491,2023-10-02 12:30:40.242237,2023-10-02 12:30:40.622798,0 days 00:00:00.380561,12338.34472842149,490,lbfgs,COMPLETE
5445,0.5,2023-10-02 12:30:40.624368,2023-10-02 12:30:40.988492,0 days 00:00:00.364124,0.006755472172624935,480,sag,COMPLETE
5446,0.666120755540998,2023-10-02 12:30:40.989493,2023-10-02 12:30:41.353483,0 days 00:00:00.363990,43623.85557416506,490,sag,COMPLETE
5447,0.637951741456491,2023-10-02 12:30:41.355483,2023-10-02 12:30:41.711079,0 days 00:00:00.355596,824.1002072252647,470,sag,COMPLETE
5448,0.5,2023-10-02 12:30:41.713887,2023-10-02 12:30:42.064002,0 days 00:00:00.350115,0.003570006747293755,360,sag,COMPLETE
5449,0.5,2023-10-02 12:30:42.064002,2023-10-02 12:30:42.340471,0 days 00:00:00.276469,0.2276673243901301,500,sag,COMPLETE
5450,0.5,2023-10-02 12:30:42.342479,2023-10-02 12:30:42.719481,0 days 00:00:00.377002,0.00017742594831884643,490,sag,COMPLETE
5451,0.6449939949776177,2023-10-02 12:30:42.719481,2023-10-02 12:30:43.048623,0 days 00:00:00.329142,21382.03775643762,280,sag,COMPLETE
5452,0.5,2023-10-02 12:30:43.048623,2023-10-02 12:30:43.425241,0 days 00:00:00.376618,0.013052486747940614,370,sag,COMPLETE
5453,0.6457036794409869,2023-10-02 12:30:43.426245,2023-10-02 12:30:43.741977,0 days 00:00:00.315732,161.19550803921408,350,sag,COMPLETE
5454,0.6520362484987444,2023-10-02 12:30:43.743977,2023-10-02 12:30:44.197619,0 days 00:00:00.453642,10647.3508500952,480,sag,COMPLETE
5455,0.6457036794409869,2023-10-02 12:30:44.197619,2023-10-02 12:30:44.563731,0 days 00:00:00.366112,200.83945939882412,470,sag,COMPLETE
5456,0.6309094879353642,2023-10-02 12:30:44.563731,2023-10-02 12:30:44.884975,0 days 00:00:00.321244,4161.705732342402,110,newton-cg,COMPLETE
5457,0.5,2023-10-02 12:30:44.884975,2023-10-02 12:30:45.263887,0 days 00:00:00.378912,0.03417027211120659,500,sag,COMPLETE
5458,0.6418277104487389,2023-10-02 12:30:45.263887,2023-10-02 12:30:45.606162,0 days 00:00:00.342275,347.9136296930094,440,sag,COMPLETE
5459,0.637951741456491,2023-10-02 12:30:45.606162,2023-10-02 12:30:45.976465,0 days 00:00:00.370303,6611.10010561653,310,liblinear,COMPLETE
5460,0.6337482257888415,2023-10-02 12:30:45.976465,2023-10-02 12:30:46.259007,0 days 00:00:00.282542,13.598731268055896,490,sag,COMPLETE
5461,0.637951741456491,2023-10-02 12:30:46.259007,2023-10-02 12:30:46.696994,0 days 00:00:00.437987,527.3957380907724,320,sag,COMPLETE
5462,0.6520362484987444,2023-10-02 12:30:46.696994,2023-10-02 12:30:47.131422,0 days 00:00:00.434428,66189.55479513356,480,sag,COMPLETE
5463,0.6534556174254831,2023-10-02 12:30:47.133433,2023-10-02 12:30:47.533694,0 days 00:00:00.400261,61.614230474994535,460,sag,COMPLETE
5464,0.6520362484987444,2023-10-02 12:30:47.535694,2023-10-02 12:30:47.885463,0 days 00:00:00.349769,17768.31293476784,340,sag,COMPLETE
5465,0.6534556174254831,2023-10-02 12:30:47.887461,2023-10-02 12:30:48.278739,0 days 00:00:00.391278,75.62332298648589,410,sag,COMPLETE
5466,0.6520362484987444,2023-10-02 12:30:48.280353,2023-10-02 12:30:48.664697,0 days 00:00:00.384344,28086.644309792988,500,sag,COMPLETE
5467,0.6449939949776177,2023-10-02 12:30:48.664697,2023-10-02 12:30:49.015629,0 days 00:00:00.350932,2610.306910689527,360,sag,COMPLETE
5468,0.5943334425155585,2023-10-02 12:30:49.015629,2023-10-02 12:30:49.381925,0 days 00:00:00.366296,2.066077963773788,480,sag,COMPLETE
5469,0.6590785020198712,2023-10-02 12:30:49.381925,2023-10-02 12:30:49.782124,0 days 00:00:00.400199,44473.822040861545,470,sag,COMPLETE
5470,0.5,2023-10-02 12:30:49.784109,2023-10-02 12:30:50.149655,0 days 00:00:00.365546,0.0006086270620141617,330,lbfgs,COMPLETE
5471,0.5,2023-10-02 12:30:50.149655,2023-10-02 12:30:50.448712,0 days 00:00:00.299057,0.005196929324605073,380,sag,COMPLETE
5472,0.666120755540998,2023-10-02 12:30:50.448712,2023-10-02 12:30:50.898909,0 days 00:00:00.450197,9571.597545561257,490,sag,COMPLETE
5473,0.6369145103177202,2023-10-02 12:30:50.898909,2023-10-02 12:30:51.181678,0 days 00:00:00.282769,19.2451011152937,500,sag,COMPLETE
5474,0.6101648651599519,2023-10-02 12:30:51.182415,2023-10-02 12:30:51.532643,0 days 00:00:00.350228,5.065063596305934,440,sag,COMPLETE
5475,0.5,2023-10-02 12:30:51.532643,2023-10-02 12:30:51.799378,0 days 00:00:00.266735,0.3238746380878934,400,sag,COMPLETE
5476,0.6629544710121192,2023-10-02 12:30:51.799378,2023-10-02 12:30:52.249588,0 days 00:00:00.450210,69309.22491554714,490,sag,COMPLETE
5477,0.5478764057211486,2023-10-02 12:30:52.249588,2023-10-02 12:30:52.516765,0 days 00:00:00.267177,0.7735788335072662,370,sag,COMPLETE
5478,0.6027950649634239,2023-10-02 12:30:52.516765,2023-10-02 12:30:52.783451,0 days 00:00:00.266686,1.5476572803505193,470,sag,COMPLETE
5479,0.5,2023-10-02 12:30:52.783451,2023-10-02 12:30:53.149914,0 days 00:00:00.366463,0.0010980568599200265,460,sag,COMPLETE
5480,0.6590785020198712,2023-10-02 12:30:53.149914,2023-10-02 12:30:53.516894,0 days 00:00:00.366980,17898.84403852123,480,sag,COMPLETE
5481,0.5,2023-10-02 12:30:53.516894,2023-10-02 12:30:54.100335,0 days 00:00:00.583441,5.123986397735652e-05,390,sag,COMPLETE
5482,0.6449939949776177,2023-10-02 12:30:54.100335,2023-10-02 12:30:54.432991,0 days 00:00:00.332656,31081.255441097128,350,sag,COMPLETE
5483,0.5,2023-10-02 12:30:54.433710,2023-10-02 12:30:54.784022,0 days 00:00:00.350312,0.00010485242709863602,500,newton-cg,COMPLETE
5484,0.5,2023-10-02 12:30:54.784022,2023-10-02 12:30:55.067414,0 days 00:00:00.283392,0.12529921646067535,430,sag,COMPLETE
5485,0.6520362484987444,2023-10-02 12:30:55.067414,2023-10-02 12:30:55.530486,0 days 00:00:00.463072,5988.684504848291,490,sag,COMPLETE
5486,0.6238672344142374,2023-10-02 12:30:55.534218,2023-10-02 12:30:55.817840,0 days 00:00:00.283622,1682.5091454767382,480,liblinear,COMPLETE
5487,0.6520362484987444,2023-10-02 12:30:55.817840,2023-10-02 12:30:56.267982,0 days 00:00:00.450142,13790.118948942145,500,sag,COMPLETE
5488,0.6590785020198712,2023-10-02 12:30:56.267982,2023-10-02 12:30:56.617824,0 days 00:00:00.349842,42463.68246336909,360,sag,COMPLETE
5489,0.666120755540998,2023-10-02 12:30:56.617824,2023-10-02 12:30:56.984632,0 days 00:00:00.366808,68166.22592258808,490,sag,COMPLETE
5490,0.6449939949776177,2023-10-02 12:30:56.984632,2023-10-02 12:30:57.418316,0 days 00:00:00.433684,3859.893180413902,340,sag,COMPLETE
5491,0.608417949557812,2023-10-02 12:30:57.418316,2023-10-02 12:30:57.701778,0 days 00:00:00.283462,2.6216702616943217,450,sag,COMPLETE
5492,0.6449939949776177,2023-10-02 12:30:57.701778,2023-10-02 12:30:58.151767,0 days 00:00:00.449989,24594.335220465662,470,sag,COMPLETE
5493,0.637951741456491,2023-10-02 12:30:58.168548,2023-10-02 12:30:58.485513,0 days 00:00:00.316965,8730.531339193994,460,lbfgs,COMPLETE
5494,0.5,2023-10-02 12:30:58.502100,2023-10-02 12:30:58.852529,0 days 00:00:00.350429,0.076490959764378,500,sag,COMPLETE
5495,0.6590785020198712,2023-10-02 12:30:58.852529,2023-10-02 12:30:59.219012,0 days 00:00:00.366483,32092.649977826066,490,sag,COMPLETE
5496,0.666120755540998,2023-10-02 12:30:59.219012,2023-10-02 12:30:59.685693,0 days 00:00:00.466681,17516.621744655768,480,sag,COMPLETE
5497,0.5,2023-10-02 12:30:59.685693,2023-10-02 12:30:59.969424,0 days 00:00:00.283731,0.0018977287176182374,350,sag,COMPLETE
5498,0.5,2023-10-02 12:30:59.985941,2023-10-02 12:31:00.403022,0 days 00:00:00.417081,0.042365239064194975,380,sag,COMPLETE
5499,0.669996724533246,2023-10-02 12:31:00.403022,2023-10-02 12:31:00.769705,0 days 00:00:00.366683,65317.162224996915,330,sag,COMPLETE
5500,0.5,2023-10-02 12:31:00.786433,2023-10-02 12:31:01.069880,0 days 00:00:00.283447,0.18529605976674182,490,sag,COMPLETE
5501,0.666120755540998,2023-10-02 12:31:01.086593,2023-10-02 12:31:01.519986,0 days 00:00:00.433393,98838.16033489766,370,sag,COMPLETE
5502,0.5478764057211486,2023-10-02 12:31:01.519986,2023-10-02 12:31:01.786679,0 days 00:00:00.266693,0.7743481564025592,500,sag,COMPLETE
5503,0.6449939949776177,2023-10-02 12:31:01.802618,2023-10-02 12:31:02.252521,0 days 00:00:00.449903,5509.8690181501825,440,sag,COMPLETE
5504,0.6590785020198712,2023-10-02 12:31:02.254527,2023-10-02 12:31:02.620563,0 days 00:00:00.366036,11627.94263020416,480,sag,COMPLETE
5505,0.6449939949776177,2023-10-02 12:31:02.637090,2023-10-02 12:31:03.090637,0 days 00:00:00.453547,47868.05698786077,470,newton-cg,COMPLETE
5506,0.5,2023-10-02 12:31:03.092637,2023-10-02 12:31:04.593657,0 days 00:00:01.501020,1.1232176318353638e-05,490,sag,COMPLETE
5507,0.5,2023-10-02 12:31:04.593657,2023-10-02 12:31:04.986378,0 days 00:00:00.392721,0.00034251796200415394,500,sag,COMPLETE
5508,0.6534556174254831,2023-10-02 12:31:04.986378,2023-10-02 12:31:05.300135,0 days 00:00:00.313757,112.24249806018517,340,sag,COMPLETE
5509,0.5,2023-10-02 12:31:05.300135,2023-10-02 12:31:05.645587,0 days 00:00:00.345452,0.002704762100417764,360,liblinear,COMPLETE
5510,0.6471230483677258,2023-10-02 12:31:05.645587,2023-10-02 12:31:05.943728,0 days 00:00:00.298141,28.485567156793813,480,sag,COMPLETE
5511,0.6590785020198712,2023-10-02 12:31:05.943728,2023-10-02 12:31:06.304390,0 days 00:00:00.360662,2411.9651281062024,460,sag,COMPLETE
5512,0.5,2023-10-02 12:31:06.304390,2023-10-02 12:31:06.665465,0 days 00:00:00.361075,0.006055956137871951,350,sag,COMPLETE
5513,0.6449939949776177,2023-10-02 12:31:06.665465,2023-10-02 12:31:07.057772,0 days 00:00:00.392307,1098.6409728971967,490,sag,COMPLETE
5514,0.6027950649634239,2023-10-02 12:31:07.057772,2023-10-02 12:31:07.417956,0 days 00:00:00.360184,1.5623367610646424,450,sag,COMPLETE
5515,0.5,2023-10-02 12:31:07.417956,2023-10-02 12:31:07.731731,0 days 00:00:00.313775,0.00022477925340547982,500,sag,COMPLETE
5516,0.5,2023-10-02 12:31:07.731731,2023-10-02 12:31:08.092821,0 days 00:00:00.361090,0.024439316481737288,470,sag,COMPLETE
5517,0.6590785020198712,2023-10-02 12:31:08.092821,2023-10-02 12:31:08.422215,0 days 00:00:00.329394,21413.451179087686,320,sag,COMPLETE
5518,0.637951741456491,2023-10-02 12:31:08.422215,2023-10-02 12:31:08.814547,0 days 00:00:00.392332,7367.097849854558,480,lbfgs,COMPLETE
5519,0.5,2023-10-02 12:31:08.830171,2023-10-02 12:31:09.096569,0 days 00:00:00.266398,0.01650640006404275,490,sag,COMPLETE
5520,0.5070422535211268,2023-10-02 12:31:09.096569,2023-10-02 12:31:09.457636,0 days 00:00:00.361067,0.3580828863769118,370,sag,COMPLETE
5521,0.666120755540998,2023-10-02 12:31:09.457636,2023-10-02 12:31:09.818301,0 days 00:00:00.360665,33894.112008576514,500,sag,COMPLETE
5522,0.5690031662845288,2023-10-02 12:31:09.818301,2023-10-02 12:31:10.100838,0 days 00:00:00.282537,1.0438001771051733,340,sag,COMPLETE
5523,0.666120755540998,2023-10-02 12:31:10.100838,2023-10-02 12:31:10.531200,0 days 00:00:00.430362,12237.71541383239,440,sag,COMPLETE
5524,0.5,2023-10-02 12:31:10.531200,2023-10-02 12:31:10.829353,0 days 00:00:00.298153,0.0006721541103887681,460,sag,COMPLETE
5525,0.6590785020198712,2023-10-02 12:31:10.829353,2023-10-02 12:31:11.282749,0 days 00:00:00.453396,44200.186620385444,480,sag,COMPLETE
5526,0.6559122174909924,2023-10-02 12:31:11.282749,2023-10-02 12:31:11.621555,0 days 00:00:00.338806,3817.946984527838,360,sag,COMPLETE
