number,value,datetime_start,datetime_complete,duration,params_C,params_max_iter,params_solver,state
2433,0.6590785020198712,2023-10-02 12:16:07.449644,2023-10-02 12:16:07.660943,0 days 00:00:00.211299,10306.659772777584,500,sag,COMPLETE
2434,0.5,2023-10-02 12:16:07.661992,2023-10-02 12:16:07.797855,0 days 00:00:00.135863,0.001065970547308482,470,sag,COMPLETE
2435,0.5,2023-10-02 12:16:07.797855,2023-10-02 12:16:07.992657,0 days 00:00:00.194802,0.13332907184103288,490,saga,COMPLETE
2436,0.5943334425155585,2023-10-02 12:16:07.993660,2023-10-02 12:16:08.111178,0 days 00:00:00.117518,2.066559245909021,480,sag,COMPLETE
2437,0.6449939949776177,2023-10-02 12:16:08.112181,2023-10-02 12:16:08.257125,0 days 00:00:00.144944,45427.08723438184,500,newton-cg,COMPLETE
2438,0.6449939949776177,2023-10-02 12:16:08.258115,2023-10-02 12:16:08.459934,0 days 00:00:00.201819,1021.1808886815355,480,sag,COMPLETE
2439,0.6062888961677039,2023-10-02 12:16:08.460939,2023-10-02 12:16:08.590190,0 days 00:00:00.129251,6.505928953336303,500,sag,COMPLETE
2440,0.5,2023-10-02 12:16:08.591190,2023-10-02 12:16:08.708782,0 days 00:00:00.117592,0.0006469851493295108,490,liblinear,COMPLETE
2441,0.6418277104487389,2023-10-02 12:16:08.710823,2023-10-02 12:16:08.895859,0 days 00:00:00.185036,295.76658333219564,460,sag,COMPLETE
2442,0.6559122174909924,2023-10-02 12:16:08.896859,2023-10-02 12:16:09.177428,0 days 00:00:00.280569,2461.5944750414624,440,sag,COMPLETE
2443,0.6590785020198712,2023-10-02 12:16:09.177428,2023-10-02 12:16:09.389336,0 days 00:00:00.211908,24978.935228608,490,saga,COMPLETE
2444,0.6520362484987444,2023-10-02 12:16:09.390338,2023-10-02 12:16:09.593393,0 days 00:00:00.203055,6888.265410371385,500,sag,COMPLETE
2445,0.6559122174909924,2023-10-02 12:16:09.594386,2023-10-02 12:16:09.800448,0 days 00:00:00.206062,3718.475155156824,480,sag,COMPLETE
2446,0.6520362484987444,2023-10-02 12:16:09.801455,2023-10-02 12:16:10.003507,0 days 00:00:00.202052,15163.633650121334,470,sag,COMPLETE
2447,0.6590785020198712,2023-10-02 12:16:10.004512,2023-10-02 12:16:10.226619,0 days 00:00:00.222107,66688.31214858303,500,sag,COMPLETE
2448,0.528169014084507,2023-10-02 12:16:10.228620,2023-10-02 12:16:10.350679,0 days 00:00:00.122059,0.40392537127349876,490,sag,COMPLETE
2449,0.6449939949776177,2023-10-02 12:16:10.352697,2023-10-02 12:16:10.640772,0 days 00:00:00.288075,9149.48453469835,480,saga,COMPLETE
2450,0.5,2023-10-02 12:16:10.641772,2023-10-02 12:16:11.973120,0 days 00:00:01.331348,1.0215758319453082e-05,450,sag,COMPLETE
2451,0.5,2023-10-02 12:16:11.974123,2023-10-02 12:16:12.099147,0 days 00:00:00.125024,0.003629481447796515,420,sag,COMPLETE
2452,0.6590785020198712,2023-10-02 12:16:12.100146,2023-10-02 12:16:12.303381,0 days 00:00:00.203235,23378.50603863627,490,sag,COMPLETE
2453,0.6457036794409869,2023-10-02 12:16:12.304381,2023-10-02 12:16:12.442106,0 days 00:00:00.137725,135.58103015450868,120,saga,COMPLETE
2454,0.6520362484987444,2023-10-02 12:16:12.443111,2023-10-02 12:16:12.655446,0 days 00:00:00.212335,4873.340043351734,500,sag,COMPLETE
2455,0.6590785020198712,2023-10-02 12:16:12.656438,2023-10-02 12:16:12.862155,0 days 00:00:00.205717,12081.14031811036,470,sag,COMPLETE
2456,0.6534556174254831,2023-10-02 12:16:12.863165,2023-10-02 12:16:13.006835,0 days 00:00:00.143670,56.735836921297846,480,sag,COMPLETE
2457,0.6520362484987444,2023-10-02 12:16:13.007834,2023-10-02 12:16:13.286824,0 days 00:00:00.278990,2063.4877006164024,490,sag,COMPLETE
2458,0.6629544710121192,2023-10-02 12:16:13.287828,2023-10-02 12:16:13.492031,0 days 00:00:00.204203,38808.14906966088,500,sag,COMPLETE
2459,0.5,2023-10-02 12:16:13.493031,2023-10-02 12:16:13.725762,0 days 00:00:00.232731,0.0003920265148666451,460,saga,COMPLETE
2460,0.6590785020198712,2023-10-02 12:16:13.726764,2023-10-02 12:16:13.930780,0 days 00:00:00.204016,6874.416488366308,490,sag,COMPLETE
2461,0.637951741456491,2023-10-02 12:16:13.931779,2023-10-02 12:16:14.131842,0 days 00:00:00.200063,860.1080305430651,480,sag,COMPLETE
2462,0.637951741456491,2023-10-02 12:16:14.132837,2023-10-02 12:16:14.273509,0 days 00:00:00.140672,21002.43151476588,500,newton-cg,COMPLETE
2463,0.5,2023-10-02 12:16:14.273590,2023-10-02 12:16:14.764548,0 days 00:00:00.490958,3.555100835041633e-05,490,sag,COMPLETE
2464,0.6309094879353642,2023-10-02 12:16:14.765548,2023-10-02 12:16:14.947459,0 days 00:00:00.181911,4133.374950027806,470,liblinear,COMPLETE
2465,0.6590785020198712,2023-10-02 12:16:14.948461,2023-10-02 12:16:15.134278,0 days 00:00:00.185817,10293.985868585927,350,sag,COMPLETE
2466,0.6520362484987444,2023-10-02 12:16:15.135278,2023-10-02 12:16:15.344923,0 days 00:00:00.209645,2795.532219231296,500,saga,COMPLETE
2467,0.637951741456491,2023-10-02 12:16:15.345924,2023-10-02 12:16:15.550021,0 days 00:00:00.204097,15479.047641975749,480,sag,COMPLETE
2468,0.5,2023-10-02 12:16:15.551127,2023-10-02 12:16:15.677167,0 days 00:00:00.126040,0.05620412796674797,490,sag,COMPLETE
2469,0.5,2023-10-02 12:16:15.678167,2023-10-02 12:16:15.800061,0 days 00:00:00.121894,0.24776284286642525,500,sag,COMPLETE
2470,0.6590785020198712,2023-10-02 12:16:15.802052,2023-10-02 12:16:16.019586,0 days 00:00:00.217534,35962.61456863315,480,sag,COMPLETE
2471,0.649579648433235,2023-10-02 12:16:16.020639,2023-10-02 12:16:16.271528,0 days 00:00:00.250889,74.07492735884577,470,saga,COMPLETE
2472,0.6590785020198712,2023-10-02 12:16:16.272535,2023-10-02 12:16:16.476822,0 days 00:00:00.204287,6250.047364349754,490,sag,COMPLETE
2473,0.6520362484987444,2023-10-02 12:16:16.477822,2023-10-02 12:16:16.693523,0 days 00:00:00.215701,1766.3622799709083,500,sag,COMPLETE
2474,0.6520362484987444,2023-10-02 12:16:16.694532,2023-10-02 12:16:16.902551,0 days 00:00:00.208019,21914.967007825868,490,sag,COMPLETE
2475,0.5619609127634021,2023-10-02 12:16:16.903586,2023-10-02 12:16:17.028119,0 days 00:00:00.124533,0.821958107063356,480,sag,COMPLETE
2476,0.5855442733922918,2023-10-02 12:16:17.029117,2023-10-02 12:16:17.163256,0 days 00:00:00.134139,1.297439328048501,500,saga,COMPLETE
2477,0.5,2023-10-02 12:16:17.164255,2023-10-02 12:16:17.286877,0 days 00:00:00.122622,0.03540427851165311,460,sag,COMPLETE
2478,0.640080794846599,2023-10-02 12:16:17.287880,2023-10-02 12:16:17.496454,0 days 00:00:00.208574,27.51351002250605,480,sag,COMPLETE
2479,0.5,2023-10-02 12:16:17.497456,2023-10-02 12:16:17.615991,0 days 00:00:00.118535,0.24423641508200428,490,sag,COMPLETE
2480,0.6629544710121192,2023-10-02 12:16:17.616989,2023-10-02 12:16:17.809832,0 days 00:00:00.192843,99359.28648722536,390,sag,COMPLETE
2481,0.6069985806310733,2023-10-02 12:16:17.809832,2023-10-02 12:16:17.948791,0 days 00:00:00.138959,4.670499479331575,500,lbfgs,COMPLETE
2482,0.6590785020198712,2023-10-02 12:16:17.949794,2023-10-02 12:16:18.165079,0 days 00:00:00.215285,10829.71372936395,470,saga,COMPLETE
2483,0.5855442733922918,2023-10-02 12:16:18.166074,2023-10-02 12:16:18.287923,0 days 00:00:00.121849,1.3598843895860049,490,sag,COMPLETE
2484,0.6481602795064964,2023-10-02 12:16:18.288922,2023-10-02 12:16:18.495972,0 days 00:00:00.207050,59864.089147852195,500,sag,COMPLETE
2485,0.6520362484987444,2023-10-02 12:16:18.495972,2023-10-02 12:16:18.704369,0 days 00:00:00.208397,4168.124717891062,480,sag,COMPLETE
2486,0.6590785020198712,2023-10-02 12:16:18.705432,2023-10-02 12:16:18.981037,0 days 00:00:00.275605,7315.9259630984225,490,sag,COMPLETE
2487,0.5,2023-10-02 12:16:18.981037,2023-10-02 12:16:19.101556,0 days 00:00:00.120519,0.00013296859802018634,490,newton-cg,COMPLETE
2488,0.649579648433235,2023-10-02 12:16:19.102552,2023-10-02 12:16:19.263755,0 days 00:00:00.161203,124.9689639991046,470,sag,COMPLETE
2489,0.6520362484987444,2023-10-02 12:16:19.264754,2023-10-02 12:16:19.485096,0 days 00:00:00.220342,14506.700745419948,500,saga,COMPLETE
2490,0.5,2023-10-02 12:16:19.485096,2023-10-02 12:16:19.603697,0 days 00:00:00.118601,0.0227954462144614,480,liblinear,COMPLETE
2491,0.5,2023-10-02 12:16:19.604694,2023-10-02 12:16:19.776742,0 days 00:00:00.172048,0.00017350089482182955,490,sag,COMPLETE
2492,0.6449939949776177,2023-10-02 12:16:19.777739,2023-10-02 12:16:19.993186,0 days 00:00:00.215447,1396.1299664318224,500,sag,COMPLETE
2493,0.6418277104487389,2023-10-02 12:16:19.993186,2023-10-02 12:16:20.263411,0 days 00:00:00.270225,331.5567490284432,480,sag,COMPLETE
2494,0.669996724533246,2023-10-02 12:16:20.264411,2023-10-02 12:16:20.470871,0 days 00:00:00.206460,31224.973500886877,500,sag,COMPLETE
2495,0.6520362484987444,2023-10-02 12:16:20.471869,2023-10-02 12:16:20.679507,0 days 00:00:00.207638,54570.90157529514,460,saga,COMPLETE
2496,0.6520362484987444,2023-10-02 12:16:20.680507,2023-10-02 12:16:20.886662,0 days 00:00:00.206155,39060.137796773124,490,sag,COMPLETE
2497,0.6449939949776177,2023-10-02 12:16:20.887667,2023-10-02 12:16:21.092904,0 days 00:00:00.205237,63058.23923117284,470,sag,COMPLETE
2498,0.666120755540998,2023-10-02 12:16:21.092959,2023-10-02 12:16:21.306041,0 days 00:00:00.213082,33679.71336614864,500,sag,COMPLETE
2499,0.666120755540998,2023-10-02 12:16:21.307047,2023-10-02 12:16:21.517345,0 days 00:00:00.210298,28136.641081900056,480,sag,COMPLETE
2500,0.6520362484987444,2023-10-02 12:16:21.518352,2023-10-02 12:16:21.804464,0 days 00:00:00.286112,43341.33842082095,490,saga,COMPLETE
2501,0.6337482257888415,2023-10-02 12:16:21.805503,2023-10-02 12:16:21.929476,0 days 00:00:00.123973,14.379075017085354,500,sag,COMPLETE
2502,0.6559122174909924,2023-10-02 12:16:21.930474,2023-10-02 12:16:22.135425,0 days 00:00:00.204951,66880.73051928505,480,sag,COMPLETE
2503,0.666120755540998,2023-10-02 12:16:22.135425,2023-10-02 12:16:22.340699,0 days 00:00:00.205274,24862.798497377767,490,sag,COMPLETE
2504,0.666120755540998,2023-10-02 12:16:22.341698,2023-10-02 12:16:22.534008,0 days 00:00:00.192310,27754.52461364466,430,sag,COMPLETE
2505,0.6590785020198712,2023-10-02 12:16:22.535077,2023-10-02 12:16:22.751153,0 days 00:00:00.216076,32923.82469864972,500,sag,COMPLETE
2506,0.6481602795064964,2023-10-02 12:16:22.752151,2023-10-02 12:16:22.960364,0 days 00:00:00.208213,45270.839075335076,470,saga,COMPLETE
2507,0.6590785020198712,2023-10-02 12:16:22.961371,2023-10-02 12:16:23.239483,0 days 00:00:00.278112,19985.896711918762,490,sag,COMPLETE
2508,0.6590785020198712,2023-10-02 12:16:23.240486,2023-10-02 12:16:23.439007,0 days 00:00:00.198521,73213.65891250562,450,sag,COMPLETE
2509,0.5,2023-10-02 12:16:23.440064,2023-10-02 12:16:23.559630,0 days 00:00:00.119566,0.11510745313247522,480,sag,COMPLETE
2510,0.6316191723987334,2023-10-02 12:16:23.561140,2023-10-02 12:16:23.729683,0 days 00:00:00.168543,612.3334987991759,500,lbfgs,COMPLETE
2511,0.6520362484987444,2023-10-02 12:16:23.730685,2023-10-02 12:16:23.945985,0 days 00:00:00.215300,20091.044686406272,490,sag,COMPLETE
2512,0.6481602795064964,2023-10-02 12:16:23.946992,2023-10-02 12:16:24.155156,0 days 00:00:00.208164,98571.67363153906,480,saga,COMPLETE
2513,0.6520362484987444,2023-10-02 12:16:24.156156,2023-10-02 12:16:24.363488,0 days 00:00:00.207332,41675.95603919614,500,sag,COMPLETE
2514,0.5,2023-10-02 12:16:24.364488,2023-10-02 12:16:25.257477,0 days 00:00:00.892989,1.5582392005017786e-05,470,sag,COMPLETE
2515,0.5,2023-10-02 12:16:25.258478,2023-10-02 12:16:25.380916,0 days 00:00:00.122438,4.3017254102755945e-05,490,newton-cg,COMPLETE
2516,0.637951741456491,2023-10-02 12:16:25.381915,2023-10-02 12:16:25.505467,0 days 00:00:00.123552,17512.61810644817,500,liblinear,COMPLETE
2517,0.5,2023-10-02 12:16:25.506465,2023-10-02 12:16:25.649413,0 days 00:00:00.142948,0.0014506172248942132,480,sag,COMPLETE
2518,0.6590785020198712,2023-10-02 12:16:25.650414,2023-10-02 12:16:25.856584,0 days 00:00:00.206170,27402.903568268204,460,sag,COMPLETE
2519,0.604541980565564,2023-10-02 12:16:25.857584,2023-10-02 12:16:25.988931,0 days 00:00:00.131347,3.1362716699633153,490,saga,COMPLETE
2520,0.6418277104487389,2023-10-02 12:16:25.989925,2023-10-02 12:16:26.192915,0 days 00:00:00.202990,405.49453632896495,490,sag,COMPLETE
2521,0.5,2023-10-02 12:16:26.193911,2023-10-02 12:16:26.319211,0 days 00:00:00.125300,0.06891740413744821,470,sag,COMPLETE
2522,0.6449939949776177,2023-10-02 12:16:26.319211,2023-10-02 12:16:26.587632,0 days 00:00:00.268421,15107.053238302538,440,sag,COMPLETE
2523,0.6235396877388361,2023-10-02 12:16:26.588629,2023-10-02 12:16:26.710328,0 days 00:00:00.121699,8.692948427876027,500,sag,COMPLETE
2524,0.6552025330276231,2023-10-02 12:16:26.711336,2023-10-02 12:16:26.934704,0 days 00:00:00.223368,57391.44433638508,480,saga,COMPLETE
2525,0.6520362484987444,2023-10-02 12:16:26.935855,2023-10-02 12:16:27.143913,0 days 00:00:00.208058,27257.725348349213,500,sag,COMPLETE
2526,0.5274593296211376,2023-10-02 12:16:27.144913,2023-10-02 12:16:27.270709,0 days 00:00:00.125796,0.5517170241309101,480,sag,COMPLETE
2527,0.5,2023-10-02 12:16:27.271709,2023-10-02 12:16:27.394406,0 days 00:00:00.122697,0.18527153571831464,490,sag,COMPLETE
2528,0.6590785020198712,2023-10-02 12:16:27.396408,2023-10-02 12:16:27.675392,0 days 00:00:00.278984,13952.841199063514,500,sag,COMPLETE
2529,0.6520362484987444,2023-10-02 12:16:27.676392,2023-10-02 12:16:27.879082,0 days 00:00:00.202690,41211.29966027443,470,sag,COMPLETE
2530,0.5,2023-10-02 12:16:27.880081,2023-10-02 12:16:28.013631,0 days 00:00:00.133550,0.09772040690685829,490,saga,COMPLETE
2531,0.5,2023-10-02 12:16:28.014630,2023-10-02 12:16:28.164454,0 days 00:00:00.149824,0.0009070716871183675,500,sag,COMPLETE
2532,0.637951741456491,2023-10-02 12:16:28.165452,2023-10-02 12:16:28.356430,0 days 00:00:00.190978,17562.71555689831,410,lbfgs,COMPLETE
2533,0.649579648433235,2023-10-02 12:16:28.357482,2023-10-02 12:16:28.515818,0 days 00:00:00.158336,99.10942059737512,130,sag,COMPLETE
2534,0.6520362484987444,2023-10-02 12:16:28.516818,2023-10-02 12:16:28.725439,0 days 00:00:00.208621,9891.007517186008,460,sag,COMPLETE
2535,0.6590785020198712,2023-10-02 12:16:28.726496,2023-10-02 12:16:28.998681,0 days 00:00:00.272185,31275.116863010415,480,sag,COMPLETE
2536,0.6590785020198712,2023-10-02 12:16:28.999681,2023-10-02 12:16:29.214895,0 days 00:00:00.215214,10649.453731117317,490,saga,COMPLETE
2537,0.5,2023-10-02 12:16:29.215899,2023-10-02 12:16:29.341817,0 days 00:00:00.125918,0.010877508678841546,260,sag,COMPLETE
2538,0.6069985806310733,2023-10-02 12:16:29.342825,2023-10-02 12:16:29.476962,0 days 00:00:00.134137,4.419862888313777,360,sag,COMPLETE
2539,0.6449939949776177,2023-10-02 12:16:29.477970,2023-10-02 12:16:29.696146,0 days 00:00:00.218176,1042.3366537490667,500,sag,COMPLETE
2540,0.6316191723987334,2023-10-02 12:16:29.697144,2023-10-02 12:16:29.841408,0 days 00:00:00.144264,509.5980240383707,480,newton-cg,COMPLETE
2541,0.5,2023-10-02 12:16:29.842407,2023-10-02 12:16:29.969228,0 days 00:00:00.126821,0.006097660524030946,490,sag,COMPLETE
2542,0.6337482257888415,2023-10-02 12:16:29.970226,2023-10-02 12:16:30.177297,0 days 00:00:00.207071,14.080277793833341,480,liblinear,COMPLETE
2543,0.6059613494923026,2023-10-02 12:16:30.178297,2023-10-02 12:16:30.310947,0 days 00:00:00.132650,1.5897353675289008,470,saga,COMPLETE
2544,0.66224478654875,2023-10-02 12:16:30.311941,2023-10-02 12:16:30.533560,0 days 00:00:00.221619,99926.34470628184,490,sag,COMPLETE
2545,0.5,2023-10-02 12:16:30.534562,2023-10-02 12:16:30.679934,0 days 00:00:00.145372,0.003713422466287666,500,sag,COMPLETE
2546,0.6590785020198712,2023-10-02 12:16:30.680983,2023-10-02 12:16:30.899039,0 days 00:00:00.218056,23137.221557747474,500,sag,COMPLETE
2547,0.666120755540998,2023-10-02 12:16:30.900034,2023-10-02 12:16:31.110272,0 days 00:00:00.210238,3303.7902764827877,490,sag,COMPLETE
2548,0.6629544710121192,2023-10-02 12:16:31.111302,2023-10-02 12:16:31.322432,0 days 00:00:00.211130,46921.4996884185,480,sag,COMPLETE
2549,0.6590785020198712,2023-10-02 12:16:31.323473,2023-10-02 12:16:31.611463,0 days 00:00:00.287990,16305.789634933148,490,saga,COMPLETE
2550,0.6520362484987444,2023-10-02 12:16:31.612533,2023-10-02 12:16:31.813692,0 days 00:00:00.201159,5948.102969990344,460,sag,COMPLETE
2551,0.6369145103177202,2023-10-02 12:16:31.814696,2023-10-02 12:16:31.951228,0 days 00:00:00.136532,21.016274542050827,500,sag,COMPLETE
2552,0.6573315864177312,2023-10-02 12:16:31.952228,2023-10-02 12:16:32.107854,0 days 00:00:00.155626,40.03427587802585,450,sag,COMPLETE
2553,0.5,2023-10-02 12:16:32.108855,2023-10-02 12:16:32.262362,0 days 00:00:00.153507,0.00036420272946774705,490,sag,COMPLETE
2554,0.6590785020198712,2023-10-02 12:16:32.263361,2023-10-02 12:16:32.484913,0 days 00:00:00.221552,10153.842357443687,470,saga,COMPLETE
2555,0.608417949557812,2023-10-02 12:16:32.485971,2023-10-02 12:16:32.681035,0 days 00:00:00.195064,2.9573185869483725,500,sag,COMPLETE
2556,0.6449939949776177,2023-10-02 12:16:32.682034,2023-10-02 12:16:32.877064,0 days 00:00:00.195030,1992.230942753158,400,sag,COMPLETE
2557,0.6552025330276231,2023-10-02 12:16:32.878064,2023-10-02 12:16:33.107187,0 days 00:00:00.229123,21293.91203686092,480,sag,COMPLETE
2558,0.5,2023-10-02 12:16:33.108193,2023-10-02 12:16:33.236534,0 days 00:00:00.128341,0.0006776513059400454,500,lbfgs,COMPLETE
2559,0.6520362484987444,2023-10-02 12:16:33.237533,2023-10-02 12:16:33.454956,0 days 00:00:00.217423,62051.51725026906,490,sag,COMPLETE
2560,0.6520362484987444,2023-10-02 12:16:33.455963,2023-10-02 12:16:33.668822,0 days 00:00:00.212859,2913.2401370563016,470,saga,COMPLETE
2561,0.6369145103177202,2023-10-02 12:16:33.670409,2023-10-02 12:16:33.873249,0 days 00:00:00.202840,20.59683547816627,480,sag,COMPLETE
2562,0.5619609127634021,2023-10-02 12:16:33.874245,2023-10-02 12:16:33.995096,0 days 00:00:00.120851,0.8401570195064543,490,sag,COMPLETE
2563,0.6457036794409869,2023-10-02 12:16:33.996096,2023-10-02 12:16:34.181823,0 days 00:00:00.185727,217.72616346831848,500,sag,COMPLETE
2564,0.6520362484987444,2023-10-02 12:16:34.182823,2023-10-02 12:16:34.386360,0 days 00:00:00.203537,7549.234147035843,420,sag,COMPLETE
2565,0.637951741456491,2023-10-02 12:16:34.387361,2023-10-02 12:16:34.532259,0 days 00:00:00.144898,31640.98237957794,490,newton-cg,COMPLETE
2566,0.649579648433235,2023-10-02 12:16:34.533262,2023-10-02 12:16:34.737383,0 days 00:00:00.204121,128.58934745786868,480,saga,COMPLETE
2567,0.5,2023-10-02 12:16:34.738381,2023-10-02 12:16:34.960879,0 days 00:00:00.222498,0.0008407407815512507,500,sag,COMPLETE
2568,0.5313352986133857,2023-10-02 12:16:34.961879,2023-10-02 12:16:35.081919,0 days 00:00:00.120040,0.5307246752611215,480,liblinear,COMPLETE
2569,0.6520362484987444,2023-10-02 12:16:35.081919,2023-10-02 12:16:35.294710,0 days 00:00:00.212791,12989.530383460658,440,sag,COMPLETE
2570,0.5,2023-10-02 12:16:35.295712,2023-10-02 12:16:35.448939,0 days 00:00:00.153227,0.0002760680730881695,470,sag,COMPLETE
2571,0.5,2023-10-02 12:16:35.449987,2023-10-02 12:16:36.282465,0 days 00:00:00.832478,1.6135378277480324e-05,490,sag,COMPLETE
2572,0.6590785020198712,2023-10-02 12:16:36.283468,2023-10-02 12:16:36.482301,0 days 00:00:00.198833,4672.553443138429,460,sag,COMPLETE
2573,0.6520362484987444,2023-10-02 12:16:36.483298,2023-10-02 12:16:36.748140,0 days 00:00:00.264842,18372.75719055514,330,saga,COMPLETE
2574,0.6590785020198712,2023-10-02 12:16:36.749200,2023-10-02 12:16:36.953669,0 days 00:00:00.204469,8289.963741961748,490,sag,COMPLETE
2575,0.6449939949776177,2023-10-02 12:16:36.955688,2023-10-02 12:16:37.170776,0 days 00:00:00.215088,1609.8151505764893,500,sag,COMPLETE
2576,0.6590785020198712,2023-10-02 12:16:37.171776,2023-10-02 12:16:37.393387,0 days 00:00:00.221611,45820.50891377237,480,sag,COMPLETE
2577,0.5,2023-10-02 12:16:37.394465,2023-10-02 12:16:37.522025,0 days 00:00:00.127560,0.018223294615001728,500,sag,COMPLETE
2578,0.6520362484987444,2023-10-02 12:16:37.523025,2023-10-02 12:16:37.823529,0 days 00:00:00.300504,12221.861750766337,490,saga,COMPLETE
2579,0.6590785020198712,2023-10-02 12:16:37.824528,2023-10-02 12:16:38.037460,0 days 00:00:00.212932,5386.682597646053,470,sag,COMPLETE
2580,0.6235396877388361,2023-10-02 12:16:38.038458,2023-10-02 12:16:38.167423,0 days 00:00:00.128965,8.75934367158349,500,sag,COMPLETE
2581,0.6020853805000546,2023-10-02 12:16:38.168416,2023-10-02 12:16:38.325486,0 days 00:00:00.157070,1.7393645984986739,480,sag,COMPLETE
2582,0.6457036794409869,2023-10-02 12:16:38.326486,2023-10-02 12:16:38.556003,0 days 00:00:00.229517,256.4331670331029,480,sag,COMPLETE
2583,0.6449939949776177,2023-10-02 12:16:38.556999,2023-10-02 12:16:38.771846,0 days 00:00:00.214847,939.9585836326921,490,saga,COMPLETE
2584,0.637951741456491,2023-10-02 12:16:38.772851,2023-10-02 12:16:39.020128,0 days 00:00:00.247277,26925.51187793331,500,lbfgs,COMPLETE
2585,0.5,2023-10-02 12:16:39.021185,2023-10-02 12:16:39.147770,0 days 00:00:00.126585,0.0675834836221625,490,sag,COMPLETE
2586,0.6520362484987444,2023-10-02 12:16:39.148769,2023-10-02 12:16:39.356995,0 days 00:00:00.208226,2594.413683761273,460,sag,COMPLETE
2587,0.6520362484987444,2023-10-02 12:16:39.357993,2023-10-02 12:16:39.567982,0 days 00:00:00.209989,4120.357259695057,500,sag,COMPLETE
2588,0.6520362484987444,2023-10-02 12:16:39.568984,2023-10-02 12:16:39.772754,0 days 00:00:00.203770,8355.810530170103,470,sag,COMPLETE
2589,0.6411180259853696,2023-10-02 12:16:39.773662,2023-10-02 12:16:39.985097,0 days 00:00:00.211435,20382.287423797556,480,saga,COMPLETE
2590,0.637951741456491,2023-10-02 12:16:39.986156,2023-10-02 12:16:40.269252,0 days 00:00:00.283096,12359.081582415289,490,sag,COMPLETE
2591,0.6534556174254831,2023-10-02 12:16:40.270257,2023-10-02 12:16:40.414540,0 days 00:00:00.144283,89.2667828496179,500,newton-cg,COMPLETE
2592,0.5,2023-10-02 12:16:40.415533,2023-10-02 12:16:40.543374,0 days 00:00:00.127841,0.34255256076272467,480,sag,COMPLETE
2593,0.6559122174909924,2023-10-02 12:16:40.544372,2023-10-02 12:16:40.756806,0 days 00:00:00.212434,34491.65838291059,490,sag,COMPLETE
2594,0.5,2023-10-02 12:16:40.757803,2023-10-02 12:16:40.877934,0 days 00:00:00.120131,0.04879138568130251,500,liblinear,COMPLETE
