number,value,datetime_start,datetime_complete,duration,params_C,params_max_iter,params_solver,state
8460,0.6520362484987444,2023-10-02 12:54:15.409829,2023-10-02 12:54:16.015433,0 days 00:00:00.605604,21852.19929352135,490,sag,COMPLETE
8461,0.5,2023-10-02 12:54:16.018429,2023-10-02 12:54:16.464637,0 days 00:00:00.446208,0.0007179495794935499,490,sag,COMPLETE
8462,0.6590785020198712,2023-10-02 12:54:16.466635,2023-10-02 12:54:17.049826,0 days 00:00:00.583191,62718.96849003893,360,sag,COMPLETE
8463,0.5,2023-10-02 12:54:17.052826,2023-10-02 12:54:17.583483,0 days 00:00:00.530657,0.09207136074038512,460,newton-cg,COMPLETE
8464,0.6418277104487389,2023-10-02 12:54:17.586475,2023-10-02 12:54:18.095293,0 days 00:00:00.508818,378.9811241226714,500,sag,COMPLETE
8465,0.6101648651599519,2023-10-02 12:54:18.098293,2023-10-02 12:54:18.628093,0 days 00:00:00.529800,5.181161884586367,310,sag,COMPLETE
8466,0.637951741456491,2023-10-02 12:54:18.631086,2023-10-02 12:54:19.146500,0 days 00:00:00.515414,10372.637321991253,410,liblinear,COMPLETE
8467,0.6449939949776177,2023-10-02 12:54:19.148497,2023-10-02 12:54:19.728556,0 days 00:00:00.580059,1501.7042808515328,440,sag,COMPLETE
8468,0.6590785020198712,2023-10-02 12:54:19.730772,2023-10-02 12:54:20.309964,0 days 00:00:00.579192,27985.23864295136,380,sag,COMPLETE
8469,0.6520362484987444,2023-10-02 12:54:20.312956,2023-10-02 12:54:20.814116,0 days 00:00:00.501160,45153.06513066955,470,sag,COMPLETE
8470,0.5,2023-10-02 12:54:20.817274,2023-10-02 12:54:21.448061,0 days 00:00:00.630787,9.615236405278706e-05,480,sag,COMPLETE
8471,0.6520362484987444,2023-10-02 12:54:21.451059,2023-10-02 12:54:22.055317,0 days 00:00:00.604258,15444.600738637595,500,sag,COMPLETE
8472,0.66224478654875,2023-10-02 12:54:22.057519,2023-10-02 12:54:22.536937,0 days 00:00:00.479418,6714.136528381585,340,sag,COMPLETE
8473,0.6541653018888526,2023-10-02 12:54:22.538937,2023-10-02 12:54:23.076756,0 days 00:00:00.537819,30.803071309669626,490,sag,COMPLETE
8474,0.5,2023-10-02 12:54:23.078883,2023-10-02 12:54:24.107259,0 days 00:00:01.028376,2.3612988911205457e-05,470,sag,COMPLETE
8475,0.6520362484987444,2023-10-02 12:54:24.110259,2023-10-02 12:54:24.674529,0 days 00:00:00.564270,4229.456769990792,370,sag,COMPLETE
8476,0.6520362484987444,2023-10-02 12:54:24.677529,2023-10-02 12:54:25.250105,0 days 00:00:00.572576,2098.0618547984654,320,sag,COMPLETE
8477,0.608417949557812,2023-10-02 12:54:25.252296,2023-10-02 12:54:25.697325,0 days 00:00:00.445029,2.9097058838533436,100,lbfgs,COMPLETE
8478,0.5,2023-10-02 12:54:25.699326,2023-10-02 12:54:26.222448,0 days 00:00:00.523122,0.07798010936314573,390,sag,COMPLETE
8479,0.5,2023-10-02 12:54:26.225448,2023-10-02 12:54:26.759396,0 days 00:00:00.533948,0.0548420769256255,360,sag,COMPLETE
8480,0.6552025330276231,2023-10-02 12:54:26.761900,2023-10-02 12:54:27.366169,0 days 00:00:00.604269,65338.918435494,450,sag,COMPLETE
8481,0.5,2023-10-02 12:54:27.369191,2023-10-02 12:54:28.124015,0 days 00:00:00.754824,3.9842894199787406e-05,480,sag,COMPLETE
8482,0.6520362484987444,2023-10-02 12:54:28.127017,2023-10-02 12:54:28.742010,0 days 00:00:00.614993,1079.6391120983906,440,sag,COMPLETE
8483,0.6449939949776177,2023-10-02 12:54:28.745005,2023-10-02 12:54:29.332836,0 days 00:00:00.587831,23362.707352926194,330,sag,COMPLETE
8484,0.6481602795064964,2023-10-02 12:54:29.335836,2023-10-02 12:54:29.928126,0 days 00:00:00.592290,47489.49241507875,420,sag,COMPLETE
8485,0.5,2023-10-02 12:54:29.930126,2023-10-02 12:54:30.361369,0 days 00:00:00.431243,0.05650842503843301,460,sag,COMPLETE
8486,0.6488699639698657,2023-10-02 12:54:30.363364,2023-10-02 12:54:30.933977,0 days 00:00:00.570613,12393.619575211584,350,sag,COMPLETE
8487,0.6590785020198712,2023-10-02 12:54:30.935983,2023-10-02 12:54:31.526145,0 days 00:00:00.590162,32918.12513356902,490,sag,COMPLETE
8488,0.6449939949776177,2023-10-02 12:54:31.528146,2023-10-02 12:54:32.063100,0 days 00:00:00.534954,69480.35918393971,500,newton-cg,COMPLETE
8489,0.6520362484987444,2023-10-02 12:54:32.066099,2023-10-02 12:54:32.530642,0 days 00:00:00.464543,8528.923406928443,290,sag,COMPLETE
8490,0.5,2023-10-02 12:54:32.532646,2023-10-02 12:54:33.047753,0 days 00:00:00.515107,0.021718264339782623,430,sag,COMPLETE
8491,0.6309094879353642,2023-10-02 12:54:33.050747,2023-10-02 12:54:33.568446,0 days 00:00:00.517699,3889.9562687280236,380,liblinear,COMPLETE
8492,0.666120755540998,2023-10-02 12:54:33.571575,2023-10-02 12:54:34.082109,0 days 00:00:00.510534,18288.645448633673,480,sag,COMPLETE
8493,0.6298722567965934,2023-10-02 12:54:34.084108,2023-10-02 12:54:34.596424,0 days 00:00:00.512316,15.721724450632113,500,sag,COMPLETE
8494,0.5,2023-10-02 12:54:34.599425,2023-10-02 12:54:35.148425,0 days 00:00:00.549000,0.00039486680980626925,360,sag,COMPLETE
8495,0.6552025330276231,2023-10-02 12:54:35.152589,2023-10-02 12:54:35.745040,0 days 00:00:00.592451,47350.03084453223,490,sag,COMPLETE
8496,0.6471230483677258,2023-10-02 12:54:35.748040,2023-10-02 12:54:36.277701,0 days 00:00:00.529661,28.671949844338258,350,sag,COMPLETE
8497,0.6534556174254831,2023-10-02 12:54:36.279707,2023-10-02 12:54:36.724725,0 days 00:00:00.445018,79.41854118662818,370,sag,COMPLETE
8498,0.6369145103177202,2023-10-02 12:54:36.727725,2023-10-02 12:54:37.254692,0 days 00:00:00.526967,19.10204513770581,470,sag,COMPLETE
8499,0.6418277104487389,2023-10-02 12:54:37.257690,2023-10-02 12:54:37.854954,0 days 00:00:00.597264,330.66385900623715,450,sag,COMPLETE
8500,0.619663718746588,2023-10-02 12:54:37.856950,2023-10-02 12:54:38.278450,0 days 00:00:00.421500,9.756404741809492,480,sag,COMPLETE
8501,0.6449939949776177,2023-10-02 12:54:38.281450,2023-10-02 12:54:38.870453,0 days 00:00:00.589003,2408.9160041075797,460,sag,COMPLETE
8502,0.5313352986133857,2023-10-02 12:54:38.872642,2023-10-02 12:54:39.403384,0 days 00:00:00.530742,0.49188026257267803,490,lbfgs,COMPLETE
8503,0.6590785020198712,2023-10-02 12:54:39.406390,2023-10-02 12:54:39.992010,0 days 00:00:00.585620,5907.406464269787,340,sag,COMPLETE
8504,0.6534556174254831,2023-10-02 12:54:39.994002,2023-10-02 12:54:40.556564,0 days 00:00:00.562562,105.38901887562736,500,sag,COMPLETE
8505,0.6520362484987444,2023-10-02 12:54:40.559577,2023-10-02 12:54:41.063505,0 days 00:00:00.503928,22832.286933551954,480,sag,COMPLETE
8506,0.666120755540998,2023-10-02 12:54:41.065506,2023-10-02 12:54:41.668824,0 days 00:00:00.603318,12395.21218773029,490,sag,COMPLETE
8507,0.6559122174909924,2023-10-02 12:54:41.670824,2023-10-02 12:54:42.270671,0 days 00:00:00.599847,34689.38987801548,360,sag,COMPLETE
8508,0.5,2023-10-02 12:54:42.273183,2023-10-02 12:54:42.799283,0 days 00:00:00.526100,0.013368135308904256,330,sag,COMPLETE
8509,0.6488699639698657,2023-10-02 12:54:42.801275,2023-10-02 12:54:43.321161,0 days 00:00:00.519886,67028.13507996652,460,sag,COMPLETE
8510,0.6552025330276231,2023-10-02 12:54:43.323225,2023-10-02 12:54:43.920623,0 days 00:00:00.597398,7475.551152130226,470,sag,COMPLETE
8511,0.6481602795064964,2023-10-02 12:54:43.923617,2023-10-02 12:54:44.520865,0 days 00:00:00.597248,16276.059835630671,370,sag,COMPLETE
8512,0.5,2023-10-02 12:54:44.522860,2023-10-02 12:54:44.953773,0 days 00:00:00.430913,0.015424789204971586,350,sag,COMPLETE
8513,0.6277432034064855,2023-10-02 12:54:44.955768,2023-10-02 12:54:45.491554,0 days 00:00:00.535786,822.7445471259784,500,newton-cg,COMPLETE
8514,0.5855442733922918,2023-10-02 12:54:45.493548,2023-10-02 12:54:46.018860,0 days 00:00:00.525312,1.3370968157628333,430,sag,COMPLETE
8515,0.5,2023-10-02 12:54:46.021860,2023-10-02 12:54:47.703489,0 days 00:00:01.681629,1.0918404870201e-05,490,sag,COMPLETE
8516,0.637951741456491,2023-10-02 12:54:47.705533,2023-10-02 12:54:48.220295,0 days 00:00:00.514762,32704.65347227134,440,liblinear,COMPLETE
8517,0.5,2023-10-02 12:54:48.222333,2023-10-02 12:54:48.667156,0 days 00:00:00.444823,0.0006783812715100519,380,sag,COMPLETE
8518,0.5,2023-10-02 12:54:48.669168,2023-10-02 12:54:49.191723,0 days 00:00:00.522555,0.00981308383026605,480,sag,COMPLETE
8519,0.6590785020198712,2023-10-02 12:54:49.194724,2023-10-02 12:54:49.797569,0 days 00:00:00.602845,68938.68419334396,500,sag,COMPLETE
8520,0.6590785020198712,2023-10-02 12:54:49.799568,2023-10-02 12:54:50.302183,0 days 00:00:00.502615,48342.11067843644,340,sag,COMPLETE
8521,0.6520362484987444,2023-10-02 12:54:50.304179,2023-10-02 12:54:50.896356,0 days 00:00:00.592177,2690.573789566974,450,sag,COMPLETE
8522,0.6590785020198712,2023-10-02 12:54:50.899356,2023-10-02 12:54:51.495678,0 days 00:00:00.596322,10385.55069731497,390,sag,COMPLETE
8523,0.6449939949776177,2023-10-02 12:54:51.498679,2023-10-02 12:54:52.106363,0 days 00:00:00.607684,4856.448809873933,360,sag,COMPLETE
8524,0.5,2023-10-02 12:54:52.109363,2023-10-02 12:54:52.646260,0 days 00:00:00.536897,0.004810344857639095,260,sag,COMPLETE
8525,0.5,2023-10-02 12:54:52.648257,2023-10-02 12:54:53.103868,0 days 00:00:00.455611,0.041575938201265386,460,sag,COMPLETE
8526,0.6133311496888305,2023-10-02 12:54:53.105866,2023-10-02 12:54:53.646731,0 days 00:00:00.540865,7.217006230729413,470,lbfgs,COMPLETE
8527,0.5,2023-10-02 12:54:53.649731,2023-10-02 12:54:54.183391,0 days 00:00:00.533660,0.05250360739033497,310,sag,COMPLETE
8528,0.5,2023-10-02 12:54:54.186388,2023-10-02 12:54:54.693436,0 days 00:00:00.507048,0.34292519334284327,490,sag,COMPLETE
8529,0.6520362484987444,2023-10-02 12:54:54.696440,2023-10-02 12:54:55.184042,0 days 00:00:00.487602,25373.41118796955,350,sag,COMPLETE
8530,0.6590785020198712,2023-10-02 12:54:55.187121,2023-10-02 12:54:55.788408,0 days 00:00:00.601287,15196.491091924958,490,sag,COMPLETE
8531,0.637951741456491,2023-10-02 12:54:55.790536,2023-10-02 12:54:56.402641,0 days 00:00:00.612105,1373.094781803725,500,sag,COMPLETE
8532,0.5,2023-10-02 12:54:56.404697,2023-10-02 12:54:56.943981,0 days 00:00:00.539284,0.008396246923440043,470,sag,COMPLETE
8533,0.6534556174254831,2023-10-02 12:54:56.946980,2023-10-02 12:54:57.400941,0 days 00:00:00.453961,60.003285860073284,480,sag,COMPLETE
8534,0.5,2023-10-02 12:54:57.403979,2023-10-02 12:54:57.952201,0 days 00:00:00.548222,0.0005235297960346373,280,sag,COMPLETE
8535,0.6520362484987444,2023-10-02 12:54:57.955204,2023-10-02 12:54:58.534449,0 days 00:00:00.579245,43919.39971720761,370,sag,COMPLETE
8536,0.6418277104487389,2023-10-02 12:54:58.536529,2023-10-02 12:54:59.124965,0 days 00:00:00.588436,518.1777624709063,440,sag,COMPLETE
8537,0.6449939949776177,2023-10-02 12:54:59.126965,2023-10-02 12:54:59.582500,0 days 00:00:00.455535,68924.21475551264,320,newton-cg,COMPLETE
8538,0.5,2023-10-02 12:54:59.585013,2023-10-02 12:55:00.118249,0 days 00:00:00.533236,0.002468547339734285,480,sag,COMPLETE
8539,0.6520362484987444,2023-10-02 12:55:00.120249,2023-10-02 12:55:00.760295,0 days 00:00:00.640046,23138.74736518418,450,sag,COMPLETE
8540,0.666120755540998,2023-10-02 12:55:00.764299,2023-10-02 12:55:01.317279,0 days 00:00:00.552980,6930.197576649192,500,sag,COMPLETE
8541,0.5,2023-10-02 12:55:01.319280,2023-10-02 12:55:01.846269,0 days 00:00:00.526989,0.1711636154549456,380,liblinear,COMPLETE
8542,0.6520362484987444,2023-10-02 12:55:01.849273,2023-10-02 12:55:02.460251,0 days 00:00:00.610978,3819.6282819880566,490,sag,COMPLETE
8543,0.6449939949776177,2023-10-02 12:55:02.463250,2023-10-02 12:55:03.052676,0 days 00:00:00.589426,11490.136668228788,340,sag,COMPLETE
8544,0.666120755540998,2023-10-02 12:55:03.055810,2023-10-02 12:55:03.655943,0 days 00:00:00.600133,34910.37962847898,400,sag,COMPLETE
8545,0.528169014084507,2023-10-02 12:55:03.657943,2023-10-02 12:55:04.087271,0 days 00:00:00.429328,0.4335494592278329,360,sag,COMPLETE
8546,0.669996724533246,2023-10-02 12:55:04.089278,2023-10-02 12:55:04.684421,0 days 00:00:00.595143,99608.93429886611,480,sag,COMPLETE
8547,0.5619609127634021,2023-10-02 12:55:04.686418,2023-10-02 12:55:05.232760,0 days 00:00:00.546342,0.8627720564760041,460,sag,COMPLETE
8548,0.6590785020198712,2023-10-02 12:55:05.235770,2023-10-02 12:55:05.774315,0 days 00:00:00.538545,18906.342368954647,500,sag,COMPLETE
8549,0.6203734032099574,2023-10-02 12:55:05.776314,2023-10-02 12:55:06.291440,0 days 00:00:00.515126,7.332517837984235,210,sag,COMPLETE
8550,0.6133311496888305,2023-10-02 12:55:06.294442,2023-10-02 12:55:06.830268,0 days 00:00:00.535826,6.82001088117969,350,sag,COMPLETE
8551,0.5925865269134185,2023-10-02 12:55:06.832268,2023-10-02 12:55:07.358097,0 days 00:00:00.525829,1.379482597173529,370,lbfgs,COMPLETE
8552,0.5,2023-10-02 12:55:07.361096,2023-10-02 12:55:08.512618,0 days 00:00:01.151522,1.8320625343757643e-05,330,sag,COMPLETE
8553,0.6590785020198712,2023-10-02 12:55:08.514598,2023-10-02 12:55:09.021493,0 days 00:00:00.506895,48002.482285708764,490,sag,COMPLETE
8554,0.666120755540998,2023-10-02 12:55:09.024488,2023-10-02 12:55:09.612443,0 days 00:00:00.587955,8868.33725851349,470,sag,COMPLETE
8555,0.6077082650944426,2023-10-02 12:55:09.614567,2023-10-02 12:55:10.147824,0 days 00:00:00.533257,3.6077297018768797,450,sag,COMPLETE
8556,0.6449939949776177,2023-10-02 12:55:10.150820,2023-10-02 12:55:10.754638,0 days 00:00:00.603818,828.6209503105266,420,sag,COMPLETE
8557,0.6449939949776177,2023-10-02 12:55:10.756638,2023-10-02 12:55:11.297930,0 days 00:00:00.541292,1980.904924946841,500,sag,COMPLETE
8558,0.6457036794409869,2023-10-02 12:55:11.300927,2023-10-02 12:55:11.885212,0 days 00:00:00.584285,180.7806990926656,490,sag,COMPLETE
8559,0.5,2023-10-02 12:55:11.887213,2023-10-02 12:55:12.543832,0 days 00:00:00.656619,9.574723153818576e-05,460,sag,COMPLETE
8560,0.666120755540998,2023-10-02 12:55:12.546830,2023-10-02 12:55:13.165816,0 days 00:00:00.618986,65665.15678639413,480,sag,COMPLETE
8561,0.6520362484987444,2023-10-02 12:55:13.167814,2023-10-02 12:55:13.668392,0 days 00:00:00.500578,5028.776783848302,360,sag,COMPLETE
8562,0.637951741456491,2023-10-02 12:55:13.671505,2023-10-02 12:55:14.214318,0 days 00:00:00.542813,31647.796369994172,430,newton-cg,COMPLETE
8563,0.6590785020198712,2023-10-02 12:55:14.216315,2023-10-02 12:55:14.813402,0 days 00:00:00.597087,17077.234940091956,470,sag,COMPLETE
8564,0.5,2023-10-02 12:55:14.815402,2023-10-02 12:55:15.385078,0 days 00:00:00.569676,0.00019368995112922717,380,sag,COMPLETE
8565,0.6020853805000546,2023-10-02 12:55:15.387083,2023-10-02 12:55:15.820112,0 days 00:00:00.433029,1.7106637116341947,490,sag,COMPLETE
8566,0.6238672344142374,2023-10-02 12:55:15.823109,2023-10-02 12:55:16.339461,0 days 00:00:00.516352,2784.167706054323,340,liblinear,COMPLETE
8567,0.666120755540998,2023-10-02 12:55:16.342491,2023-10-02 12:55:16.936763,0 days 00:00:00.594272,25352.376916574656,350,sag,COMPLETE
8568,0.5,2023-10-02 12:55:16.938768,2023-10-02 12:55:17.388444,0 days 00:00:00.449676,0.0019949722002761136,500,sag,COMPLETE
8569,0.6481602795064964,2023-10-02 12:55:17.391439,2023-10-02 12:55:17.988177,0 days 00:00:00.596738,99067.43510398545,440,sag,COMPLETE
8570,0.608417949557812,2023-10-02 12:55:17.991168,2023-10-02 12:55:18.524090,0 days 00:00:00.532922,2.609191732052533,470,sag,COMPLETE
8571,0.5,2023-10-02 12:55:18.526083,2023-10-02 12:55:19.045274,0 days 00:00:00.519191,0.19381402116237978,410,sag,COMPLETE
8572,0.6418277104487389,2023-10-02 12:55:19.047405,2023-10-02 12:55:19.633330,0 days 00:00:00.585925,341.6083347716054,480,sag,COMPLETE
8573,0.6590785020198712,2023-10-02 12:55:19.635446,2023-10-02 12:55:20.124160,0 days 00:00:00.488714,9815.545373361552,390,sag,COMPLETE
8574,0.6590785020198712,2023-10-02 12:55:20.126159,2023-10-02 12:55:20.727137,0 days 00:00:00.600978,51458.35658817911,450,sag,COMPLETE
8575,0.5,2023-10-02 12:55:20.729138,2023-10-02 12:55:21.261221,0 days 00:00:00.532083,0.0026576592532315205,370,sag,COMPLETE
8576,0.6309094879353642,2023-10-02 12:55:21.263221,2023-10-02 12:55:21.818586,0 days 00:00:00.555365,3772.6959432800663,490,lbfgs,COMPLETE
8577,0.6520362484987444,2023-10-02 12:55:21.821699,2023-10-02 12:55:22.342467,0 days 00:00:00.520768,99714.06775094717,500,sag,COMPLETE
8578,0.5,2023-10-02 12:55:22.344521,2023-10-02 12:55:22.866919,0 days 00:00:00.522398,0.02285861715685903,480,sag,COMPLETE
8579,0.6552025330276231,2023-10-02 12:55:22.868919,2023-10-02 12:55:23.458904,0 days 00:00:00.589985,33835.06689203931,330,sag,COMPLETE
8580,0.6520362484987444,2023-10-02 12:55:23.460908,2023-10-02 12:55:24.042500,0 days 00:00:00.581592,6808.659958578781,350,sag,COMPLETE
8581,0.6590785020198712,2023-10-02 12:55:24.045538,2023-10-02 12:55:24.542248,0 days 00:00:00.496710,12548.04957117797,370,sag,COMPLETE
8582,0.5,2023-10-02 12:55:24.544242,2023-10-02 12:55:25.075242,0 days 00:00:00.531000,0.0014314224340334733,460,sag,COMPLETE
8583,0.6590785020198712,2023-10-02 12:55:25.077238,2023-10-02 12:55:25.682069,0 days 00:00:00.604831,48419.83951402513,490,sag,COMPLETE
8584,0.6449939949776177,2023-10-02 12:55:25.685069,2023-10-02 12:55:26.282134,0 days 00:00:00.597065,22125.84433464649,360,sag,COMPLETE
8585,0.6488699639698657,2023-10-02 12:55:26.285127,2023-10-02 12:55:26.794998,0 days 00:00:00.509871,1356.6245603426678,490,sag,COMPLETE
8586,0.6267059722677149,2023-10-02 12:55:26.797998,2023-10-02 12:55:27.315586,0 days 00:00:00.517588,11.439200434736996,480,sag,COMPLETE
8587,0.6449939949776177,2023-10-02 12:55:27.317586,2023-10-02 12:55:27.856143,0 days 00:00:00.538557,68779.7873825554,500,newton-cg,COMPLETE
8588,0.6520362484987444,2023-10-02 12:55:27.859149,2023-10-02 12:55:28.344725,0 days 00:00:00.485576,5554.579012085811,340,sag,COMPLETE
8589,0.5,2023-10-02 12:55:28.347858,2023-10-02 12:55:28.885842,0 days 00:00:00.537984,0.0010501406387995063,470,sag,COMPLETE
8590,0.669996724533246,2023-10-02 12:55:28.887839,2023-10-02 12:55:29.504948,0 days 00:00:00.617109,13808.844410026588,450,sag,COMPLETE
8591,0.6369145103177202,2023-10-02 12:55:29.507088,2023-10-02 12:55:30.050802,0 days 00:00:00.543714,21.712100488344987,430,sag,COMPLETE
8592,0.6316191723987334,2023-10-02 12:55:30.052798,2023-10-02 12:55:30.572763,0 days 00:00:00.519965,560.920352293777,460,liblinear,COMPLETE
8593,0.6534556174254831,2023-10-02 12:55:30.575766,2023-10-02 12:55:31.046931,0 days 00:00:00.471165,94.29112410534509,360,sag,COMPLETE
8594,0.5,2023-10-02 12:55:31.050928,2023-10-02 12:55:31.593002,0 days 00:00:00.542074,0.09703282291996058,380,sag,COMPLETE
8595,0.6629544710121192,2023-10-02 12:55:31.596013,2023-10-02 12:55:32.222977,0 days 00:00:00.626964,35252.24171797863,500,sag,COMPLETE
8596,0.5,2023-10-02 12:55:32.225978,2023-10-02 12:55:32.750403,0 days 00:00:00.524425,0.02772507923495001,440,sag,COMPLETE
8597,0.6534556174254831,2023-10-02 12:55:32.752404,2023-10-02 12:55:33.200233,0 days 00:00:00.447829,49.64643279670376,480,sag,COMPLETE
8598,0.6590785020198712,2023-10-02 12:55:33.202232,2023-10-02 12:55:33.821882,0 days 00:00:00.619650,22906.847441558857,490,sag,COMPLETE
8599,0.6520362484987444,2023-10-02 12:55:33.823926,2023-10-02 12:55:34.453842,0 days 00:00:00.629916,8296.981412950097,470,sag,COMPLETE
8600,0.5,2023-10-02 12:55:34.455842,2023-10-02 12:55:34.987170,0 days 00:00:00.531328,1.058901847463177e-05,500,lbfgs,COMPLETE
8601,0.6520362484987444,2023-10-02 12:55:34.990171,2023-10-02 12:55:35.461993,0 days 00:00:00.471822,3271.8170839315967,330,sag,COMPLETE
8602,0.6481602795064964,2023-10-02 12:55:35.463989,2023-10-02 12:55:36.054093,0 days 00:00:00.590104,68098.79349695446,350,sag,COMPLETE
8603,0.5,2023-10-02 12:55:36.056157,2023-10-02 12:55:37.123707,0 days 00:00:01.067550,2.335829332438549e-05,370,sag,COMPLETE
8604,0.6590785020198712,2023-10-02 12:55:37.125704,2023-10-02 12:55:37.751371,0 days 00:00:00.625667,47775.50628853538,490,sag,COMPLETE
8605,0.643956763838847,2023-10-02 12:55:37.754371,2023-10-02 12:55:38.206157,0 days 00:00:00.451786,27.360358276207577,390,sag,COMPLETE
8606,0.5,2023-10-02 12:55:38.208151,2023-10-02 12:55:38.749273,0 days 00:00:00.541122,0.0010852479657588081,480,sag,COMPLETE
8607,0.6520362484987444,2023-10-02 12:55:38.752265,2023-10-02 12:55:39.371494,0 days 00:00:00.619229,98809.88494466334,460,sag,COMPLETE
8608,0.6520362484987444,2023-10-02 12:55:39.373497,2023-10-02 12:55:39.967430,0 days 00:00:00.593933,16584.794823645563,320,sag,COMPLETE
8609,0.5,2023-10-02 12:55:39.970431,2023-10-02 12:55:40.415530,0 days 00:00:00.445099,0.010349888517566517,360,sag,COMPLETE
8610,0.6777486625177421,2023-10-02 12:55:40.418533,2023-10-02 12:55:41.011116,0 days 00:00:00.592583,29467.555804775806,400,sag,COMPLETE
8611,0.6552025330276231,2023-10-02 12:55:41.013640,2023-10-02 12:55:41.613943,0 days 00:00:00.600303,43917.383245908786,400,sag,COMPLETE
8612,0.5,2023-10-02 12:55:41.616940,2023-10-02 12:55:42.170233,0 days 00:00:00.553293,0.00026026316842406,410,sag,COMPLETE
8613,0.6527459329621137,2023-10-02 12:55:42.173224,2023-10-02 12:55:42.672685,0 days 00:00:00.499461,48139.71651441854,410,sag,COMPLETE
8614,0.6449939949776177,2023-10-02 12:55:42.675682,2023-10-02 12:55:43.261651,0 days 00:00:00.585969,65343.17032814918,400,newton-cg,COMPLETE
8615,0.6629544710121192,2023-10-02 12:55:43.264654,2023-10-02 12:55:43.877510,0 days 00:00:00.612856,35958.70636187616,400,sag,COMPLETE
8616,0.637951741456491,2023-10-02 12:55:43.880510,2023-10-02 12:55:44.420177,0 days 00:00:00.539667,67780.62204633413,410,liblinear,COMPLETE
8617,0.66224478654875,2023-10-02 12:55:44.423175,2023-10-02 12:55:44.935225,0 days 00:00:00.512050,36255.887045150375,410,sag,COMPLETE
8618,0.666120755540998,2023-10-02 12:55:44.937355,2023-10-02 12:55:45.536990,0 days 00:00:00.599635,40873.244415771806,410,sag,COMPLETE
8619,0.6520362484987444,2023-10-02 12:55:45.539991,2023-10-02 12:55:46.148115,0 days 00:00:00.608124,57166.439441930714,410,sag,COMPLETE
8620,0.6013756960366853,2023-10-02 12:55:46.151111,2023-10-02 12:55:46.713555,0 days 00:00:00.562444,2.2270509291676057,390,sag,COMPLETE
8621,0.6629544710121192,2023-10-02 12:55:46.715558,2023-10-02 12:55:47.314398,0 days 00:00:00.598840,34441.85732572533,400,sag,COMPLETE
8622,0.6520362484987444,2023-10-02 12:55:47.316906,2023-10-02 12:55:47.832360,0 days 00:00:00.515454,58885.69490828924,420,sag,COMPLETE
