number,value,datetime_start,datetime_complete,duration,params_C,params_max_iter,params_solver,state
9764,0.6559122174909924,2023-10-02 13:07:14.439597,2023-10-02 13:07:14.990475,0 days 00:00:00.550878,32267.203357003003,470,sag,COMPLETE
9765,0.637951741456491,2023-10-02 13:07:15.006110,2023-10-02 13:07:15.648972,0 days 00:00:00.642862,664.7515543509315,440,sag,COMPLETE
9766,0.6534556174254831,2023-10-02 13:07:15.648972,2023-10-02 13:07:16.260410,0 days 00:00:00.611438,87.96857088716355,500,sag,COMPLETE
9767,0.5,2023-10-02 13:07:16.260410,2023-10-02 13:07:16.840083,0 days 00:00:00.579673,0.0020359026513316098,490,sag,COMPLETE
9768,0.6077082650944426,2023-10-02 13:07:16.840083,2023-10-02 13:07:17.406069,0 days 00:00:00.565986,3.998108621924108,480,sag,COMPLETE
9769,0.6449939949776177,2023-10-02 13:07:17.406069,2023-10-02 13:07:18.047576,0 days 00:00:00.641507,1574.234149168029,420,sag,COMPLETE
9770,0.6059613494923026,2023-10-02 13:07:18.047576,2023-10-02 13:07:18.534717,0 days 00:00:00.487141,1.6004336795232463,210,lbfgs,COMPLETE
9771,0.6520362484987444,2023-10-02 13:07:18.550340,2023-10-02 13:07:19.193624,0 days 00:00:00.643284,3702.276722219476,490,sag,COMPLETE
9772,0.6520362484987444,2023-10-02 13:07:19.193624,2023-10-02 13:07:19.821812,0 days 00:00:00.628188,49088.16476433111,250,sag,COMPLETE
9773,0.5,2023-10-02 13:07:19.821812,2023-10-02 13:07:20.573295,0 days 00:00:00.751483,2.0570818254799154e-05,370,saga,COMPLETE
9774,0.5,2023-10-02 13:07:20.579810,2023-10-02 13:07:21.321475,0 days 00:00:00.741665,7.246825951636224e-05,460,sag,COMPLETE
9775,0.6559122174909924,2023-10-02 13:07:21.321475,2023-10-02 13:07:21.982386,0 days 00:00:00.660911,63330.55102970814,480,sag,COMPLETE
9776,0.6457036794409869,2023-10-02 13:07:21.985434,2023-10-02 13:07:22.506656,0 days 00:00:00.521222,191.89060619144308,430,sag,COMPLETE
9777,0.6013756960366853,2023-10-02 13:07:22.506656,2023-10-02 13:07:23.067902,0 days 00:00:00.561246,2.463105467837705,500,sag,COMPLETE
9778,0.5,2023-10-02 13:07:23.067902,2023-10-02 13:07:23.662871,0 days 00:00:00.594969,0.0003293806742094051,450,sag,COMPLETE
9779,0.6520362484987444,2023-10-02 13:07:23.662871,2023-10-02 13:07:24.308100,0 days 00:00:00.645229,17012.085979077434,470,sag,COMPLETE
9780,0.6629544710121192,2023-10-02 13:07:24.323742,2023-10-02 13:07:24.969925,0 days 00:00:00.646183,6122.295037823186,370,sag,COMPLETE
9781,0.5,2023-10-02 13:07:24.969925,2023-10-02 13:07:26.721706,0 days 00:00:01.751781,1.0641584157827786e-05,380,sag,COMPLETE
9782,0.6337482257888415,2023-10-02 13:07:26.737357,2023-10-02 13:07:27.214464,0 days 00:00:00.477107,13.607913038520536,400,sag,COMPLETE
9783,0.637951741456491,2023-10-02 13:07:27.214464,2023-10-02 13:07:27.805301,0 days 00:00:00.590837,26661.928730347452,480,newton-cg,COMPLETE
9784,0.5619609127634021,2023-10-02 13:07:27.820946,2023-10-02 13:07:28.398879,0 days 00:00:00.577933,0.99656889592915,130,sag,COMPLETE
9785,0.6520362484987444,2023-10-02 13:07:28.398879,2023-10-02 13:07:29.045112,0 days 00:00:00.646233,45109.01823583878,490,sag,COMPLETE
9786,0.528169014084507,2023-10-02 13:07:29.060739,2023-10-02 13:07:29.630753,0 days 00:00:00.570014,0.3708420083428785,460,liblinear,COMPLETE
9787,0.666120755540998,2023-10-02 13:07:29.630753,2023-10-02 13:07:30.300612,0 days 00:00:00.669859,12662.655247095034,500,sag,COMPLETE
9788,0.6267059722677149,2023-10-02 13:07:30.315652,2023-10-02 13:07:30.893712,0 days 00:00:00.578060,11.674738669450113,410,sag,COMPLETE
9789,0.6590785020198712,2023-10-02 13:07:30.901261,2023-10-02 13:07:31.444700,0 days 00:00:00.543439,3030.6470586126543,390,sag,COMPLETE
9790,0.6590785020198712,2023-10-02 13:07:31.444700,2023-10-02 13:07:32.079192,0 days 00:00:00.634492,8370.820695544851,470,sag,COMPLETE
9791,0.6235396877388361,2023-10-02 13:07:32.094824,2023-10-02 13:07:32.667759,0 days 00:00:00.572935,8.815516755742673,450,sag,COMPLETE
9792,0.6520362484987444,2023-10-02 13:07:32.667759,2023-10-02 13:07:33.310794,0 days 00:00:00.643035,21489.79133703939,440,sag,COMPLETE
9793,0.6590785020198712,2023-10-02 13:07:33.310794,2023-10-02 13:07:33.970224,0 days 00:00:00.659430,37538.14476471722,480,sag,COMPLETE
9794,0.6502893328966044,2023-10-02 13:07:33.970224,2023-10-02 13:07:34.558095,0 days 00:00:00.587871,34.12692971051355,490,sag,COMPLETE
9795,0.6449939949776177,2023-10-02 13:07:34.558095,2023-10-02 13:07:35.240944,0 days 00:00:00.682849,54036.885924593924,460,sag,COMPLETE
9796,0.6062888961677039,2023-10-02 13:07:35.240944,2023-10-02 13:07:35.773644,0 days 00:00:00.532700,6.058376528653265,500,lbfgs,COMPLETE
9797,0.5,2023-10-02 13:07:35.773644,2023-10-02 13:07:36.338796,0 days 00:00:00.565152,0.03171440828222425,380,sag,COMPLETE
9798,0.6590785020198712,2023-10-02 13:07:36.338796,2023-10-02 13:07:37.028116,0 days 00:00:00.689320,4614.656037098939,490,sag,COMPLETE
9799,0.5,2023-10-02 13:07:37.028116,2023-10-02 13:07:37.702942,0 days 00:00:00.674826,0.0005989558737764967,470,saga,COMPLETE
9800,0.6520362484987444,2023-10-02 13:07:37.702942,2023-10-02 13:07:38.347325,0 days 00:00:00.644383,66986.60575333254,360,sag,COMPLETE
9801,0.5,2023-10-02 13:07:38.347325,2023-10-02 13:07:38.973814,0 days 00:00:00.626489,0.0001798592388396142,480,sag,COMPLETE
9802,0.5,2023-10-02 13:07:38.973814,2023-10-02 13:07:39.789485,0 days 00:00:00.815671,1.4648538337303666e-05,100,sag,COMPLETE
9803,0.6590785020198712,2023-10-02 13:07:39.789485,2023-10-02 13:07:40.434477,0 days 00:00:00.644992,19375.696927235877,370,sag,COMPLETE
9804,0.6062888961677039,2023-10-02 13:07:40.434477,2023-10-02 13:07:41.013450,0 days 00:00:00.578973,6.582222949439021,500,sag,COMPLETE
9805,0.6449939949776177,2023-10-02 13:07:41.020486,2023-10-02 13:07:41.650770,0 days 00:00:00.630284,9244.068808153208,400,sag,COMPLETE
9806,0.6520362484987444,2023-10-02 13:07:41.650770,2023-10-02 13:07:42.346929,0 days 00:00:00.696159,33634.714903839296,490,sag,COMPLETE
9807,0.6309094879353642,2023-10-02 13:07:42.346929,2023-10-02 13:07:42.992034,0 days 00:00:00.645105,1123.4456727973554,440,sag,COMPLETE
9808,0.6534556174254831,2023-10-02 13:07:42.992034,2023-10-02 13:07:43.601517,0 days 00:00:00.609483,103.68705377914125,470,sag,COMPLETE
9809,0.5,2023-10-02 13:07:43.601517,2023-10-02 13:07:44.067643,0 days 00:00:00.466126,0.001559737968238466,390,newton-cg,COMPLETE
9810,0.6457036794409869,2023-10-02 13:07:44.067643,2023-10-02 13:07:44.698776,0 days 00:00:00.631133,176.16376017263744,480,sag,COMPLETE
9811,0.6590785020198712,2023-10-02 13:07:44.698776,2023-10-02 13:07:45.346402,0 days 00:00:00.647626,68267.81910646493,450,sag,COMPLETE
9812,0.6238672344142374,2023-10-02 13:07:45.346402,2023-10-02 13:07:45.923214,0 days 00:00:00.576812,1871.4391632753752,370,liblinear,COMPLETE
9813,0.6590785020198712,2023-10-02 13:07:45.923214,2023-10-02 13:07:46.566028,0 days 00:00:00.642814,12894.81153175788,460,sag,COMPLETE
9814,0.5,2023-10-02 13:07:46.566028,2023-10-02 13:07:47.147754,0 days 00:00:00.581726,0.004403476549069767,490,sag,COMPLETE
9815,0.5,2023-10-02 13:07:47.147754,2023-10-02 13:07:47.632963,0 days 00:00:00.485209,0.01638411201590439,360,sag,COMPLETE
9816,0.6520362484987444,2023-10-02 13:07:47.632963,2023-10-02 13:07:48.291811,0 days 00:00:00.658848,26925.58321490066,500,sag,COMPLETE
9817,0.6552025330276231,2023-10-02 13:07:48.291811,2023-10-02 13:07:48.994603,0 days 00:00:00.702792,6012.495845242087,480,sag,COMPLETE
9818,0.6520362484987444,2023-10-02 13:07:49.010235,2023-10-02 13:07:49.672599,0 days 00:00:00.662364,42283.19048533522,470,sag,COMPLETE
9819,0.6449939949776177,2023-10-02 13:07:49.672599,2023-10-02 13:07:50.315192,0 days 00:00:00.642593,2670.9968261098124,430,sag,COMPLETE
9820,0.6552025330276231,2023-10-02 13:07:50.315192,2023-10-02 13:07:50.960963,0 days 00:00:00.645771,99350.99642511157,420,sag,COMPLETE
9821,0.6590785020198712,2023-10-02 13:07:50.960963,2023-10-02 13:07:51.641685,0 days 00:00:00.680722,17964.261931692323,500,sag,COMPLETE
9822,0.608417949557812,2023-10-02 13:07:51.641685,2023-10-02 13:07:52.119846,0 days 00:00:00.478161,2.6514549157354597,460,lbfgs,COMPLETE
9823,0.6590785020198712,2023-10-02 13:07:52.119846,2023-10-02 13:07:52.783925,0 days 00:00:00.664079,67789.52700070382,490,sag,COMPLETE
9824,0.637951741456491,2023-10-02 13:07:52.783925,2023-10-02 13:07:53.421640,0 days 00:00:00.637715,31861.53559631044,380,sag,COMPLETE
9825,0.6077082650944426,2023-10-02 13:07:53.421640,2023-10-02 13:07:54.001572,0 days 00:00:00.579932,3.9854274426011447,480,sag,COMPLETE
9826,0.6449939949776177,2023-10-02 13:07:54.001572,2023-10-02 13:07:54.648286,0 days 00:00:00.646714,8969.158885460993,370,saga,COMPLETE
9827,0.6411180259853696,2023-10-02 13:07:54.648286,2023-10-02 13:07:55.303379,0 days 00:00:00.655093,4126.571666835302,450,sag,COMPLETE
9828,0.6418277104487389,2023-10-02 13:07:55.303379,2023-10-02 13:07:55.959729,0 days 00:00:00.656350,563.1809736553217,490,sag,COMPLETE
9829,0.5313352986133857,2023-10-02 13:07:55.959729,2023-10-02 13:07:56.451355,0 days 00:00:00.491626,0.4955096631482653,360,sag,COMPLETE
9830,0.6590785020198712,2023-10-02 13:07:56.451355,2023-10-02 13:07:57.107070,0 days 00:00:00.655715,65367.65697856356,470,sag,COMPLETE
9831,0.6481602795064964,2023-10-02 13:07:57.107070,2023-10-02 13:07:57.753442,0 days 00:00:00.646372,22566.233179543742,390,sag,COMPLETE
9832,0.66224478654875,2023-10-02 13:07:57.753442,2023-10-02 13:07:58.409966,0 days 00:00:00.656524,13497.103840093145,500,sag,COMPLETE
9833,0.6520362484987444,2023-10-02 13:07:58.425627,2023-10-02 13:07:59.069293,0 days 00:00:00.643666,42381.4386618982,440,sag,COMPLETE
9834,0.6471230483677258,2023-10-02 13:07:59.069293,2023-10-02 13:07:59.657304,0 days 00:00:00.588011,27.849684978830773,480,sag,COMPLETE
9835,0.637951741456491,2023-10-02 13:07:59.657304,2023-10-02 13:08:00.158979,0 days 00:00:00.501675,5607.558941044688,410,newton-cg,COMPLETE
9836,0.5478764057211486,2023-10-02 13:08:00.166494,2023-10-02 13:08:00.731815,0 days 00:00:00.565321,0.7575417716605963,460,sag,COMPLETE
9837,0.5,2023-10-02 13:08:00.731815,2023-10-02 13:08:01.343557,0 days 00:00:00.611742,0.00022007110534913752,490,sag,COMPLETE
9838,0.6534556174254831,2023-10-02 13:08:01.343557,2023-10-02 13:08:01.908426,0 days 00:00:00.564869,85.15648855309598,470,liblinear,COMPLETE
9839,0.5,2023-10-02 13:08:01.908426,2023-10-02 13:08:02.566611,0 days 00:00:00.658185,0.00012012404423519949,450,sag,COMPLETE
9840,0.666120755540998,2023-10-02 13:08:02.582256,2023-10-02 13:08:03.212099,0 days 00:00:00.629843,66478.19927105459,380,sag,COMPLETE
9841,0.6573315864177312,2023-10-02 13:08:03.212099,2023-10-02 13:08:03.791974,0 days 00:00:00.579875,40.04620305512484,430,sag,COMPLETE
9842,0.6590785020198712,2023-10-02 13:08:03.791974,2023-10-02 13:08:04.293038,0 days 00:00:00.501064,28933.413376962897,150,sag,COMPLETE
9843,0.6590785020198712,2023-10-02 13:08:04.293038,2023-10-02 13:08:04.934259,0 days 00:00:00.641221,99169.46198285496,360,sag,COMPLETE
9844,0.5,2023-10-02 13:08:04.934259,2023-10-02 13:08:05.515803,0 days 00:00:00.581544,0.20952993255168148,500,sag,COMPLETE
9845,0.6590785020198712,2023-10-02 13:08:05.515803,2023-10-02 13:08:06.189836,0 days 00:00:00.674033,15098.911414447228,490,sag,COMPLETE
9846,0.666120755540998,2023-10-02 13:08:06.189836,2023-10-02 13:08:06.860553,0 days 00:00:00.670717,7573.715139945097,480,sag,COMPLETE
9847,0.6629544710121192,2023-10-02 13:08:06.860553,2023-10-02 13:08:07.491642,0 days 00:00:00.631089,48123.615193989936,370,sag,COMPLETE
9848,0.5,2023-10-02 13:08:07.491642,2023-10-02 13:08:07.980585,0 days 00:00:00.488943,0.00584599853177141,460,sag,COMPLETE
9849,0.6520362484987444,2023-10-02 13:08:07.980585,2023-10-02 13:08:08.652625,0 days 00:00:00.672040,1552.9937948324923,480,saga,COMPLETE
9850,0.5,2023-10-02 13:08:08.668255,2023-10-02 13:08:09.248080,0 days 00:00:00.579825,1.6766222889773934e-05,500,lbfgs,COMPLETE
9851,0.666120755540998,2023-10-02 13:08:09.248080,2023-10-02 13:08:09.891635,0 days 00:00:00.643555,22459.660267584397,470,sag,COMPLETE
9852,0.6534556174254831,2023-10-02 13:08:09.907542,2023-10-02 13:08:10.508969,0 days 00:00:00.601427,45.535467175766506,400,sag,COMPLETE
9853,0.6418277104487389,2023-10-02 13:08:10.508969,2023-10-02 13:08:11.193635,0 days 00:00:00.684666,344.4645641752948,490,sag,COMPLETE
9854,0.666120755540998,2023-10-02 13:08:11.193635,2023-10-02 13:08:11.850666,0 days 00:00:00.657031,2812.0201502823875,440,sag,COMPLETE
9855,0.6520362484987444,2023-10-02 13:08:11.850666,2023-10-02 13:08:12.416717,0 days 00:00:00.566051,36906.40937411355,380,sag,COMPLETE
9856,0.6411180259853696,2023-10-02 13:08:12.416717,2023-10-02 13:08:13.045226,0 days 00:00:00.628509,99754.08757064023,360,sag,COMPLETE
9857,0.6590785020198712,2023-10-02 13:08:13.060855,2023-10-02 13:08:13.704501,0 days 00:00:00.643646,10950.388365181889,470,sag,COMPLETE
9858,0.6520362484987444,2023-10-02 13:08:13.720135,2023-10-02 13:08:14.382632,0 days 00:00:00.662497,4287.850386807604,490,sag,COMPLETE
9859,0.6590785020198712,2023-10-02 13:08:14.393152,2023-10-02 13:08:15.099513,0 days 00:00:00.706361,49798.25333448727,500,sag,COMPLETE
9860,0.604541980565564,2023-10-02 13:08:15.115148,2023-10-02 13:08:15.711347,0 days 00:00:00.596199,3.229551306224543,450,sag,COMPLETE
9861,0.637951741456491,2023-10-02 13:08:15.711347,2023-10-02 13:08:16.323980,0 days 00:00:00.612633,19536.36112633801,460,newton-cg,COMPLETE
9862,0.5,2023-10-02 13:08:16.323980,2023-10-02 13:08:16.810247,0 days 00:00:00.486267,0.0010947108862866058,370,sag,COMPLETE
9863,0.6520362484987444,2023-10-02 13:08:16.826077,2023-10-02 13:08:17.489013,0 days 00:00:00.662936,31183.616063737114,480,sag,COMPLETE
9864,0.649579648433235,2023-10-02 13:08:17.489013,2023-10-02 13:08:18.127333,0 days 00:00:00.638320,145.02324325813768,500,sag,COMPLETE
9865,0.6316191723987334,2023-10-02 13:08:18.127333,2023-10-02 13:08:18.693318,0 days 00:00:00.565985,734.2658626889092,390,liblinear,COMPLETE
9866,0.5,2023-10-02 13:08:18.693318,2023-10-02 13:08:19.272630,0 days 00:00:00.579312,0.058168121937680006,430,sag,COMPLETE
9867,0.6027950649634239,2023-10-02 13:08:19.288249,2023-10-02 13:08:19.853429,0 days 00:00:00.565180,1.5376537345127554,360,sag,COMPLETE
9868,0.6520362484987444,2023-10-02 13:08:19.853429,2023-10-02 13:08:20.402087,0 days 00:00:00.548658,8138.15024671604,420,sag,COMPLETE
9869,0.666120755540998,2023-10-02 13:08:20.402087,2023-10-02 13:08:21.076556,0 days 00:00:00.674469,68571.33507227797,490,sag,COMPLETE
9870,0.6449939949776177,2023-10-02 13:08:21.076556,2023-10-02 13:08:21.735668,0 days 00:00:00.659112,13775.905769327808,450,sag,COMPLETE
9871,0.6520362484987444,2023-10-02 13:08:21.751322,2023-10-02 13:08:22.403007,0 days 00:00:00.651685,44328.04348470008,470,sag,COMPLETE
9872,0.6418277104487389,2023-10-02 13:08:22.403007,2023-10-02 13:08:23.037364,0 days 00:00:00.634357,398.0183191861194,370,sag,COMPLETE
9873,0.6449939949776177,2023-10-02 13:08:23.037364,2023-10-02 13:08:23.700193,0 days 00:00:00.662829,2730.040854011075,480,sag,COMPLETE
9874,0.5,2023-10-02 13:08:23.713209,2023-10-02 13:08:24.308285,0 days 00:00:00.595076,0.13106057408906338,410,lbfgs,COMPLETE
9875,0.6418277104487389,2023-10-02 13:08:24.308285,2023-10-02 13:08:24.834816,0 days 00:00:00.526531,246.027551564991,440,sag,COMPLETE
9876,0.6449939949776177,2023-10-02 13:08:24.834816,2023-10-02 13:08:25.504133,0 days 00:00:00.669317,1153.5698888738107,460,saga,COMPLETE
9877,0.6481602795064964,2023-10-02 13:08:25.504133,2023-10-02 13:08:26.161914,0 days 00:00:00.657781,25193.554852255693,490,sag,COMPLETE
9878,0.66224478654875,2023-10-02 13:08:26.161914,2023-10-02 13:08:26.817810,0 days 00:00:00.655896,5746.946778985417,500,sag,COMPLETE
9879,0.5,2023-10-02 13:08:26.817810,2023-10-02 13:08:27.586279,0 days 00:00:00.768469,5.8147727017388895e-05,490,sag,COMPLETE
9880,0.5,2023-10-02 13:08:27.602031,2023-10-02 13:08:28.167377,0 days 00:00:00.565346,0.029655550706177567,380,sag,COMPLETE
9881,0.5,2023-10-02 13:08:28.167377,2023-10-02 13:08:28.656552,0 days 00:00:00.489175,0.11190789674204991,480,sag,COMPLETE
9882,0.666120755540998,2023-10-02 13:08:28.656552,2023-10-02 13:08:29.296954,0 days 00:00:00.640402,64354.50922525008,460,sag,COMPLETE
9883,0.6552025330276231,2023-10-02 13:08:29.311710,2023-10-02 13:08:29.954210,0 days 00:00:00.642500,12251.374319635583,390,sag,COMPLETE
9884,0.5,2023-10-02 13:08:29.954210,2023-10-02 13:08:30.520325,0 days 00:00:00.566115,0.013594003186423759,370,sag,COMPLETE
9885,0.6267059722677149,2023-10-02 13:08:30.535975,2023-10-02 13:08:31.116533,0 days 00:00:00.580558,13.252843192524681,480,sag,COMPLETE
9886,0.6590785020198712,2023-10-02 13:08:31.116533,2023-10-02 13:08:31.775353,0 days 00:00:00.658820,37062.25008467138,500,sag,COMPLETE
9887,0.666120755540998,2023-10-02 13:08:31.775353,2023-10-02 13:08:32.448570,0 days 00:00:00.673217,20217.744919679364,470,sag,COMPLETE
9888,0.5313352986133857,2023-10-02 13:08:32.448570,2023-10-02 13:08:32.920019,0 days 00:00:00.471449,0.48429211467697353,360,sag,COMPLETE
9889,0.5,2023-10-02 13:08:32.920019,2023-10-02 13:08:33.505594,0 days 00:00:00.585575,0.2897424998082958,400,newton-cg,COMPLETE
9890,0.6238672344142374,2023-10-02 13:08:33.505594,2023-10-02 13:08:34.080779,0 days 00:00:00.575185,1944.252125149264,490,liblinear,COMPLETE
9891,0.6629544710121192,2023-10-02 13:08:34.080779,2023-10-02 13:08:34.738756,0 days 00:00:00.657977,66362.89213530872,450,sag,COMPLETE
9892,0.6520362484987444,2023-10-02 13:08:34.738756,2023-10-02 13:08:35.413614,0 days 00:00:00.674858,7110.546808572575,470,sag,COMPLETE
9893,0.6488699639698657,2023-10-02 13:08:35.413614,2023-10-02 13:08:36.072854,0 days 00:00:00.659240,3971.0441528533343,490,sag,COMPLETE
9894,0.6552025330276231,2023-10-02 13:08:36.088486,2023-10-02 13:08:36.734059,0 days 00:00:00.645573,45674.32149089464,500,sag,COMPLETE
9895,0.6590785020198712,2023-10-02 13:08:36.749754,2023-10-02 13:08:37.282288,0 days 00:00:00.532534,24395.288528929166,360,sag,COMPLETE
9896,0.6559122174909924,2023-10-02 13:08:37.282288,2023-10-02 13:08:37.926986,0 days 00:00:00.644698,99741.1212672189,440,sag,COMPLETE
9897,0.6520362484987444,2023-10-02 13:08:37.926986,2023-10-02 13:08:38.567852,0 days 00:00:00.640866,11259.194646218444,380,sag,COMPLETE
9898,0.5,2023-10-02 13:08:38.567852,2023-10-02 13:08:39.257700,0 days 00:00:00.689848,9.421515547020945e-05,430,sag,COMPLETE
9899,0.5,2023-10-02 13:08:39.257700,2023-10-02 13:08:40.763523,0 days 00:00:01.505823,1.3751366777274208e-05,460,sag,COMPLETE
9900,0.6590785020198712,2023-10-02 13:08:40.763523,2023-10-02 13:08:41.434568,0 days 00:00:00.671045,31947.778208297925,480,sag,COMPLETE
9901,0.5,2023-10-02 13:08:41.438076,2023-10-02 13:08:42.003230,0 days 00:00:00.565154,0.016947830506600908,500,lbfgs,COMPLETE
9902,0.5,2023-10-02 13:08:42.003230,2023-10-02 13:08:42.518623,0 days 00:00:00.515393,0.002590113833946642,300,sag,COMPLETE
9903,0.5,2023-10-02 13:08:42.518623,2023-10-02 13:08:43.109417,0 days 00:00:00.590794,0.006852607942593159,480,sag,COMPLETE
9904,0.5,2023-10-02 13:08:43.109417,2023-10-02 13:08:43.695322,0 days 00:00:00.585905,0.08092642353474865,410,saga,COMPLETE
9905,0.666120755540998,2023-10-02 13:08:43.695322,2023-10-02 13:08:44.355077,0 days 00:00:00.659755,65679.15202300769,470,sag,COMPLETE
9906,0.6520362484987444,2023-10-02 13:08:44.370767,2023-10-02 13:08:45.029317,0 days 00:00:00.658550,15139.39096905459,490,sag,COMPLETE
9907,0.5,2023-10-02 13:08:45.041830,2023-10-02 13:08:45.657028,0 days 00:00:00.615198,0.09879195124128703,450,sag,COMPLETE
9908,0.5,2023-10-02 13:08:45.657028,2023-10-02 13:08:46.804975,0 days 00:00:01.147947,1.8580530235016804e-05,360,sag,COMPLETE
9909,0.5549186592422753,2023-10-02 13:08:46.804975,2023-10-02 13:08:47.428395,0 days 00:00:00.623420,0.8102317540084795,500,sag,COMPLETE
9910,0.6552025330276231,2023-10-02 13:08:47.428395,2023-10-02 13:08:48.247110,0 days 00:00:00.818715,44530.51585858334,480,sag,COMPLETE
9911,0.666120755540998,2023-10-02 13:08:48.260624,2023-10-02 13:08:49.075968,0 days 00:00:00.815344,99630.5671018402,380,sag,COMPLETE
9912,0.5,2023-10-02 13:08:49.075968,2023-10-02 13:08:49.908863,0 days 00:00:00.832895,0.0002742791420410497,470,newton-cg,COMPLETE
9913,0.6449939949776177,2023-10-02 13:08:49.908863,2023-10-02 13:08:50.708046,0 days 00:00:00.799183,4872.32475384514,370,sag,COMPLETE
9914,0.6520362484987444,2023-10-02 13:08:50.723666,2023-10-02 13:08:51.543961,0 days 00:00:00.820295,18062.000183815024,390,sag,COMPLETE
9915,0.6520362484987444,2023-10-02 13:08:51.543961,2023-10-02 13:08:52.213357,0 days 00:00:00.669396,7925.19312606074,490,sag,COMPLETE
9916,0.6418277104487389,2023-10-02 13:08:52.228985,2023-10-02 13:08:52.918270,0 days 00:00:00.689285,384.5631737299616,460,sag,COMPLETE
9917,0.637951741456491,2023-10-02 13:08:52.918270,2023-10-02 13:08:53.582083,0 days 00:00:00.663813,1350.7294243043825,420,sag,COMPLETE
9918,0.6559122174909924,2023-10-02 13:08:53.582083,2023-10-02 13:08:54.331805,0 days 00:00:00.749722,30049.50154926248,450,sag,COMPLETE
9919,0.6590785020198712,2023-10-02 13:08:54.331805,2023-10-02 13:08:55.068509,0 days 00:00:00.736704,2606.9004576026487,480,sag,COMPLETE
9920,0.6481602795064964,2023-10-02 13:08:55.068509,2023-10-02 13:08:55.931455,0 days 00:00:00.862946,53644.24911644133,490,sag,COMPLETE
9921,0.637951741456491,2023-10-02 13:08:55.931455,2023-10-02 13:08:56.510550,0 days 00:00:00.579095,9717.287617887516,440,liblinear,COMPLETE
9922,0.6369145103177202,2023-10-02 13:08:56.526176,2023-10-02 13:08:57.013663,0 days 00:00:00.487487,23.072609189310587,500,sag,COMPLETE
9923,0.6101648651599519,2023-10-02 13:08:57.013663,2023-10-02 13:08:57.609515,0 days 00:00:00.595852,5.332146509261872,360,sag,COMPLETE
9924,0.6449939949776177,2023-10-02 13:08:57.609515,2023-10-02 13:08:58.350907,0 days 00:00:00.741392,29067.57633859222,370,sag,COMPLETE
9925,0.5,2023-10-02 13:08:58.350907,2023-10-02 13:08:59.147573,0 days 00:00:00.796666,0.0006899147248676932,460,lbfgs,COMPLETE
9926,0.6457036794409869,2023-10-02 13:08:59.147573,2023-10-02 13:08:59.969579,0 days 00:00:00.822006,171.5889607178917,470,sag,COMPLETE
