number,value,datetime_start,datetime_complete,duration,params_C,params_max_iter,params_solver,state
1781,0.6449939949776177,2023-10-02 12:14:09.177837,2023-10-02 12:14:09.352215,0 days 00:00:00.174378,6396.501150972495,460,sag,COMPLETE
1782,0.6449939949776177,2023-10-02 12:14:09.353213,2023-10-02 12:14:09.537766,0 days 00:00:00.184553,2058.892840776233,490,sag,COMPLETE
1783,0.6590785020198712,2023-10-02 12:14:09.538761,2023-10-02 12:14:09.724818,0 days 00:00:00.186057,3566.7245449703023,500,sag,COMPLETE
1784,0.5982094115078066,2023-10-02 12:14:09.725816,2023-10-02 12:14:09.817835,0 days 00:00:00.092019,1.947319570500188,470,sag,COMPLETE
1785,0.5,2023-10-02 12:14:09.818835,2023-10-02 12:14:09.908271,0 days 00:00:00.089436,0.3042674210883888,480,sag,COMPLETE
1786,0.6590785020198712,2023-10-02 12:14:09.908271,2023-10-02 12:14:10.109089,0 days 00:00:00.200818,14545.151699261625,490,sag,COMPLETE
1787,0.6449939949776177,2023-10-02 12:14:10.110085,2023-10-02 12:14:10.299529,0 days 00:00:00.189444,9366.697014141404,500,sag,COMPLETE
1788,0.5792117043345343,2023-10-02 12:14:10.300529,2023-10-02 12:14:10.462098,0 days 00:00:00.161569,1.131695322643126,480,sag,COMPLETE
1789,0.6590785020198712,2023-10-02 12:14:10.463105,2023-10-02 12:14:10.643671,0 days 00:00:00.180566,5007.283022239201,490,sag,COMPLETE
1790,0.6267059722677149,2023-10-02 12:14:10.644667,2023-10-02 12:14:10.752641,0 days 00:00:00.107974,13.189497852884768,470,sag,COMPLETE
1791,0.5,2023-10-02 12:14:10.752641,2023-10-02 12:14:10.844162,0 days 00:00:00.091521,0.09412892811682622,500,sag,COMPLETE
1792,0.6559122174909924,2023-10-02 12:14:10.845162,2023-10-02 12:14:11.017490,0 days 00:00:00.172328,29116.246095812527,490,sag,COMPLETE
1793,0.6457036794409869,2023-10-02 12:14:11.018531,2023-10-02 12:14:11.171726,0 days 00:00:00.153195,264.1512927739874,480,sag,COMPLETE
1794,0.6277432034064855,2023-10-02 12:14:11.172726,2023-10-02 12:14:11.293672,0 days 00:00:00.120946,1375.8099494079772,500,newton-cg,COMPLETE
1795,0.6520362484987444,2023-10-02 12:14:11.294681,2023-10-02 12:14:11.483323,0 days 00:00:00.188642,65879.28484816416,490,sag,COMPLETE
1796,0.5,2023-10-02 12:14:11.483323,2023-10-02 12:14:11.726544,0 days 00:00:00.243221,7.796990958423349e-05,470,sag,COMPLETE
1797,0.6590785020198712,2023-10-02 12:14:11.726544,2023-10-02 12:14:11.913261,0 days 00:00:00.186717,18606.208386542294,480,sag,COMPLETE
1798,0.5549186592422753,2023-10-02 12:14:11.914280,2023-10-02 12:14:12.007673,0 days 00:00:00.093393,0.8072959101334999,500,sag,COMPLETE
1799,0.6267059722677149,2023-10-02 12:14:12.008672,2023-10-02 12:14:12.102202,0 days 00:00:00.093530,10.389911949722785,490,sag,COMPLETE
1800,0.637951741456491,2023-10-02 12:14:12.103201,2023-10-02 12:14:12.191164,0 days 00:00:00.087963,7224.90523758944,480,liblinear,COMPLETE
1801,0.5,2023-10-02 12:14:12.191164,2023-10-02 12:14:12.300335,0 days 00:00:00.109171,0.0009707027836052365,460,sag,COMPLETE
1802,0.6520362484987444,2023-10-02 12:14:12.301335,2023-10-02 12:14:12.570939,0 days 00:00:00.269604,2903.997123509621,500,sag,COMPLETE
1803,0.637951741456491,2023-10-02 12:14:12.571938,2023-10-02 12:14:12.756415,0 days 00:00:00.184477,863.1721348549245,490,sag,COMPLETE
1804,0.6449939949776177,2023-10-02 12:14:12.756415,2023-10-02 12:14:12.934046,0 days 00:00:00.177631,10841.193279748686,500,sag,COMPLETE
1805,0.5,2023-10-02 12:14:12.935046,2023-10-02 12:14:14.107622,0 days 00:00:01.172576,1.320991386171409e-05,480,sag,COMPLETE
1806,0.6520362484987444,2023-10-02 12:14:14.107622,2023-10-02 12:14:14.326183,0 days 00:00:00.218561,4905.533509803412,490,sag,COMPLETE
1807,0.5,2023-10-02 12:14:14.326183,2023-10-02 12:14:14.416814,0 days 00:00:00.090631,0.013754955555832213,500,sag,COMPLETE
1808,0.6590785020198712,2023-10-02 12:14:14.417814,2023-10-02 12:14:14.599019,0 days 00:00:00.181205,20477.72807419216,470,sag,COMPLETE
1809,0.6520362484987444,2023-10-02 12:14:14.599019,2023-10-02 12:14:14.772101,0 days 00:00:00.173082,38981.286740488984,480,sag,COMPLETE
1810,0.666120755540998,2023-10-02 12:14:14.773100,2023-10-02 12:14:14.957804,0 days 00:00:00.184704,7162.549364386595,490,sag,COMPLETE
1811,0.649579648433235,2023-10-02 12:14:14.958799,2023-10-02 12:14:15.093469,0 days 00:00:00.134670,131.49800738981588,490,sag,COMPLETE
1812,0.5,2023-10-02 12:14:15.094475,2023-10-02 12:14:15.232604,0 days 00:00:00.138129,0.00017764749016466695,500,sag,COMPLETE
1813,0.6520362484987444,2023-10-02 12:14:15.233698,2023-10-02 12:14:15.411133,0 days 00:00:00.177435,2697.0440180265523,480,sag,COMPLETE
1814,0.6590785020198712,2023-10-02 12:14:15.412128,2023-10-02 12:14:15.595260,0 days 00:00:00.183132,14026.039144150905,500,sag,COMPLETE
1815,0.6309094879353642,2023-10-02 12:14:15.595260,2023-10-02 12:14:15.834355,0 days 00:00:00.239095,4088.1788068564742,470,newton-cg,COMPLETE
1816,0.5,2023-10-02 12:14:15.835347,2023-10-02 12:14:16.060481,0 days 00:00:00.225134,0.00010534425760682121,490,sag,COMPLETE
1817,0.6418277104487389,2023-10-02 12:14:16.061480,2023-10-02 12:14:16.262813,0 days 00:00:00.201333,529.8736020702671,460,sag,COMPLETE
1818,0.6238672344142374,2023-10-02 12:14:16.263867,2023-10-02 12:14:16.358876,0 days 00:00:00.095009,1788.451711340451,480,liblinear,COMPLETE
1819,0.6590785020198712,2023-10-02 12:14:16.359993,2023-10-02 12:14:16.548955,0 days 00:00:00.188962,10436.509063382051,500,sag,COMPLETE
1820,0.5,2023-10-02 12:14:16.549955,2023-10-02 12:14:16.659341,0 days 00:00:00.109386,0.0008695997450161088,490,sag,COMPLETE
1821,0.666120755540998,2023-10-02 12:14:16.660338,2023-10-02 12:14:16.835120,0 days 00:00:00.174782,29278.1099911602,490,sag,COMPLETE
1822,0.6590785020198712,2023-10-02 12:14:16.836114,2023-10-02 12:14:17.030310,0 days 00:00:00.194196,6115.100184555336,440,sag,COMPLETE
1823,0.5,2023-10-02 12:14:17.031318,2023-10-02 12:14:17.158512,0 days 00:00:00.127194,0.06657475202344583,470,sag,COMPLETE
1824,0.6590785020198712,2023-10-02 12:14:17.159513,2023-10-02 12:14:17.339033,0 days 00:00:00.179520,15237.584065175894,500,sag,COMPLETE
1825,0.6590785020198712,2023-10-02 12:14:17.340034,2023-10-02 12:14:17.517167,0 days 00:00:00.177133,9318.528233767862,480,sag,COMPLETE
1826,0.5,2023-10-02 12:14:17.518167,2023-10-02 12:14:17.628316,0 days 00:00:00.110149,0.03754409169218667,490,sag,COMPLETE
1827,0.5,2023-10-02 12:14:17.629318,2023-10-02 12:14:17.750786,0 days 00:00:00.121468,0.0035238921443026478,500,sag,COMPLETE
1828,0.6520362484987444,2023-10-02 12:14:17.751787,2023-10-02 12:14:18.024560,0 days 00:00:00.272773,67163.52010778499,480,sag,COMPLETE
1829,0.6457036794409869,2023-10-02 12:14:18.025554,2023-10-02 12:14:18.188238,0 days 00:00:00.162684,252.16351036792022,490,sag,COMPLETE
1830,0.5,2023-10-02 12:14:18.188238,2023-10-02 12:14:18.287953,0 days 00:00:00.099715,0.14800278461927527,500,sag,COMPLETE
1831,0.6590785020198712,2023-10-02 12:14:18.288989,2023-10-02 12:14:18.462424,0 days 00:00:00.173435,4414.339058054448,470,sag,COMPLETE
1832,0.669996724533246,2023-10-02 12:14:18.462424,2023-10-02 12:14:18.643006,0 days 00:00:00.180582,20393.000425882816,480,sag,COMPLETE
1833,0.6481602795064964,2023-10-02 12:14:18.644006,2023-10-02 12:14:18.834645,0 days 00:00:00.190639,33872.52791859585,470,sag,COMPLETE
1834,0.6520362484987444,2023-10-02 12:14:18.835638,2023-10-02 12:14:19.034309,0 days 00:00:00.198671,47006.58927397615,460,sag,COMPLETE
1835,0.669996724533246,2023-10-02 12:14:19.035306,2023-10-02 12:14:19.205463,0 days 00:00:00.170157,30106.332706098576,450,sag,COMPLETE
1836,0.6449939949776177,2023-10-02 12:14:19.205463,2023-10-02 12:14:19.334573,0 days 00:00:00.129110,38741.14894411258,460,newton-cg,COMPLETE
1837,0.6442843105142483,2023-10-02 12:14:19.335571,2023-10-02 12:14:19.509045,0 days 00:00:00.173474,62241.579238113976,440,sag,COMPLETE
1838,0.666120755540998,2023-10-02 12:14:19.510040,2023-10-02 12:14:19.687778,0 days 00:00:00.177738,50467.548633476355,440,sag,COMPLETE
1839,0.6449939949776177,2023-10-02 12:14:19.687778,2023-10-02 12:14:19.859568,0 days 00:00:00.171790,27261.1229466282,420,sag,COMPLETE
1840,0.637951741456491,2023-10-02 12:14:19.860585,2023-10-02 12:14:19.950584,0 days 00:00:00.089999,25763.01822627259,450,liblinear,COMPLETE
1841,0.6590785020198712,2023-10-02 12:14:19.950584,2023-10-02 12:14:20.141076,0 days 00:00:00.190492,61590.36082270402,450,sag,COMPLETE
1842,0.6552025330276231,2023-10-02 12:14:20.142079,2023-10-02 12:14:20.305945,0 days 00:00:00.163866,32602.745531648456,420,sag,COMPLETE
1843,0.66224478654875,2023-10-02 12:14:20.306931,2023-10-02 12:14:20.554423,0 days 00:00:00.247492,20920.569703876903,430,sag,COMPLETE
1844,0.6590785020198712,2023-10-02 12:14:20.554423,2023-10-02 12:14:20.728276,0 days 00:00:00.173853,40461.33333243933,460,sag,COMPLETE
1845,0.6590785020198712,2023-10-02 12:14:20.729276,2023-10-02 12:14:20.905272,0 days 00:00:00.175996,21906.28561969047,450,sag,COMPLETE
1846,0.5,2023-10-02 12:14:20.905272,2023-10-02 12:14:20.999048,0 days 00:00:00.093776,0.009721900082836528,430,sag,COMPLETE
1847,0.6590785020198712,2023-10-02 12:14:21.000043,2023-10-02 12:14:21.188449,0 days 00:00:00.188406,51357.6166844624,450,sag,COMPLETE
1848,0.6590785020198712,2023-10-02 12:14:21.189449,2023-10-02 12:14:21.361422,0 days 00:00:00.171973,20891.421387255625,460,sag,COMPLETE
1849,0.666120755540998,2023-10-02 12:14:21.361422,2023-10-02 12:14:21.534259,0 days 00:00:00.172837,35551.50970294321,450,sag,COMPLETE
1850,0.6520362484987444,2023-10-02 12:14:21.534259,2023-10-02 12:14:21.721338,0 days 00:00:00.187079,70616.42796983533,440,sag,COMPLETE
1851,0.5,2023-10-02 12:14:21.722351,2023-10-02 12:14:21.841397,0 days 00:00:00.119046,0.0004412546150841467,470,sag,COMPLETE
1852,0.666120755540998,2023-10-02 12:14:21.841397,2023-10-02 12:14:22.021675,0 days 00:00:00.180278,21919.2070030741,470,sag,COMPLETE
1853,0.6077082650944426,2023-10-02 12:14:22.022671,2023-10-02 12:14:22.121709,0 days 00:00:00.099038,3.6202131444916406,470,sag,COMPLETE
1854,0.6457036794409869,2023-10-02 12:14:22.122715,2023-10-02 12:14:22.270759,0 days 00:00:00.148044,172.37992051788007,410,sag,COMPLETE
1855,0.6559122174909924,2023-10-02 12:14:22.271759,2023-10-02 12:14:22.442694,0 days 00:00:00.170935,17402.974234094378,430,sag,COMPLETE
1856,0.6590785020198712,2023-10-02 12:14:22.443695,2023-10-02 12:14:22.620893,0 days 00:00:00.177198,35632.03163581387,460,sag,COMPLETE
1857,0.5982094115078066,2023-10-02 12:14:22.621896,2023-10-02 12:14:22.795055,0 days 00:00:00.173159,1.9781780579687256,460,newton-cg,COMPLETE
1858,0.5,2023-10-02 12:14:22.796060,2023-10-02 12:14:22.928590,0 days 00:00:00.132530,0.00024410856775347156,450,sag,COMPLETE
1859,0.6590785020198712,2023-10-02 12:14:22.929589,2023-10-02 12:14:23.103765,0 days 00:00:00.174176,15901.47654369003,470,sag,COMPLETE
1860,0.6520362484987444,2023-10-02 12:14:23.104762,2023-10-02 12:14:23.285896,0 days 00:00:00.181134,29469.209121096177,470,sag,COMPLETE
1861,0.6449939949776177,2023-10-02 12:14:23.285896,2023-10-02 12:14:23.464971,0 days 00:00:00.179075,70592.83868017374,460,sag,COMPLETE
1862,0.6277432034064855,2023-10-02 12:14:23.465972,2023-10-02 12:14:23.555980,0 days 00:00:00.090008,1102.031697818793,470,liblinear,COMPLETE
1863,0.6449939949776177,2023-10-02 12:14:23.556982,2023-10-02 12:14:23.730196,0 days 00:00:00.173214,14568.37933721047,400,sag,COMPLETE
1864,0.666120755540998,2023-10-02 12:14:23.731193,2023-10-02 12:14:23.908321,0 days 00:00:00.177128,44006.724577569774,480,sag,COMPLETE
1865,0.6590785020198712,2023-10-02 12:14:23.909328,2023-10-02 12:14:24.088485,0 days 00:00:00.179157,20359.12817433567,480,sag,COMPLETE
1866,0.5313352986133857,2023-10-02 12:14:24.088485,2023-10-02 12:14:24.196475,0 days 00:00:00.107990,0.5027626142003663,470,sag,COMPLETE
1867,0.6590785020198712,2023-10-02 12:14:24.197473,2023-10-02 12:14:24.368512,0 days 00:00:00.171039,15610.774759819331,440,sag,COMPLETE
1868,0.6590785020198712,2023-10-02 12:14:24.369508,2023-10-02 12:14:24.547949,0 days 00:00:00.178441,97168.66805385302,480,sag,COMPLETE
1869,0.5,2023-10-02 12:14:24.548949,2023-10-02 12:14:24.822527,0 days 00:00:00.273578,6.14015788990044e-05,480,sag,COMPLETE
1870,0.5,2023-10-02 12:14:24.823526,2023-10-02 12:14:24.984519,0 days 00:00:00.160993,0.00471720589158312,460,sag,COMPLETE
1871,0.5619609127634021,2023-10-02 12:14:24.985519,2023-10-02 12:14:25.081057,0 days 00:00:00.095538,0.996928010288314,470,sag,COMPLETE
1872,0.5,2023-10-02 12:14:25.082057,2023-10-02 12:14:25.529209,0 days 00:00:00.447152,3.606408512407377e-05,430,sag,COMPLETE
1873,0.6520362484987444,2023-10-02 12:14:25.530258,2023-10-02 12:14:25.706349,0 days 00:00:00.176091,28125.65101837899,480,sag,COMPLETE
1874,0.6559122174909924,2023-10-02 12:14:25.707349,2023-10-02 12:14:25.889065,0 days 00:00:00.181716,12804.809300655053,480,sag,COMPLETE
1875,0.666120755540998,2023-10-02 12:14:25.890071,2023-10-02 12:14:26.066723,0 days 00:00:00.176652,10865.768112833808,470,sag,COMPLETE
1876,0.666120755540998,2023-10-02 12:14:26.066723,2023-10-02 12:14:26.252930,0 days 00:00:00.186207,24296.91067460668,460,sag,COMPLETE
1877,0.5,2023-10-02 12:14:26.252930,2023-10-02 12:14:26.381675,0 days 00:00:00.128745,0.0005964128955742584,480,sag,COMPLETE
1878,0.6238672344142374,2023-10-02 12:14:26.381675,2023-10-02 12:14:26.498158,0 days 00:00:00.116483,1852.9017449869054,480,newton-cg,COMPLETE
1879,0.6457036794409869,2023-10-02 12:14:26.499158,2023-10-02 12:14:26.639697,0 days 00:00:00.140539,175.62519999560408,470,sag,COMPLETE
1880,0.637951741456491,2023-10-02 12:14:26.639697,2023-10-02 12:14:26.734625,0 days 00:00:00.094928,52099.00779100398,480,liblinear,COMPLETE
1881,0.6590785020198712,2023-10-02 12:14:26.735627,2023-10-02 12:14:26.917489,0 days 00:00:00.181862,12017.43351921241,480,sag,COMPLETE
1882,0.5,2023-10-02 12:14:26.918487,2023-10-02 12:14:27.078511,0 days 00:00:00.160024,0.06309374546042239,420,sag,COMPLETE
1883,0.6590785020198712,2023-10-02 12:14:27.079498,2023-10-02 12:14:27.253018,0 days 00:00:00.173520,2750.4979380629043,450,sag,COMPLETE
1884,0.6590785020198712,2023-10-02 12:14:27.253018,2023-10-02 12:14:27.440881,0 days 00:00:00.187863,7896.202041507189,470,sag,COMPLETE
1885,0.5,2023-10-02 12:14:27.441881,2023-10-02 12:14:27.534570,0 days 00:00:00.092689,0.04801869669986565,480,sag,COMPLETE
1886,0.6552025330276231,2023-10-02 12:14:27.534570,2023-10-02 12:14:27.742449,0 days 00:00:00.207879,37506.37560492775,480,sag,COMPLETE
1887,0.6449939949776177,2023-10-02 12:14:27.743448,2023-10-02 12:14:27.921764,0 days 00:00:00.178316,1007.4631622613495,490,sag,COMPLETE
1888,0.5,2023-10-02 12:14:27.922764,2023-10-02 12:14:28.761246,0 days 00:00:00.838482,1.477612046654744e-05,470,sag,COMPLETE
1889,0.6235396877388361,2023-10-02 12:14:28.762780,2023-10-02 12:14:28.866445,0 days 00:00:00.103665,8.875269803523574,440,sag,COMPLETE
1890,0.5211267605633803,2023-10-02 12:14:28.867444,2023-10-02 12:14:28.961576,0 days 00:00:00.094132,0.3652402476498587,480,sag,COMPLETE
1891,0.5,2023-10-02 12:14:28.961576,2023-10-02 12:14:29.085783,0 days 00:00:00.124207,0.0011033677140227587,490,sag,COMPLETE
1892,0.5,2023-10-02 12:14:29.086783,2023-10-02 12:14:29.189499,0 days 00:00:00.102716,0.009025542298355938,460,sag,COMPLETE
1893,0.6059613494923026,2023-10-02 12:14:29.190501,2023-10-02 12:14:29.286037,0 days 00:00:00.095536,1.6634430526153965,490,sag,COMPLETE
1894,0.5,2023-10-02 12:14:29.288035,2023-10-02 12:14:29.399038,0 days 00:00:00.111003,0.02286128000924899,470,sag,COMPLETE
1895,0.5,2023-10-02 12:14:29.400038,2023-10-02 12:14:29.766089,0 days 00:00:00.366051,6.204874357450588e-05,480,sag,COMPLETE
1896,0.6298722567965934,2023-10-02 12:14:29.767088,2023-10-02 12:14:29.878407,0 days 00:00:00.111319,16.758133728063882,490,sag,COMPLETE
1897,0.5,2023-10-02 12:14:29.879402,2023-10-02 12:14:29.981259,0 days 00:00:00.101857,0.18875610583619667,490,sag,COMPLETE
1898,0.637951741456491,2023-10-02 12:14:29.982256,2023-10-02 12:14:30.101470,0 days 00:00:00.119214,19025.746247013092,480,newton-cg,COMPLETE
1899,0.6590785020198712,2023-10-02 12:14:30.102469,2023-10-02 12:14:30.297836,0 days 00:00:00.195367,13003.117236289374,460,sag,COMPLETE
1900,0.5,2023-10-02 12:14:30.297895,2023-10-02 12:14:30.395596,0 days 00:00:00.097701,0.001850037195346425,490,liblinear,COMPLETE
1901,0.666120755540998,2023-10-02 12:14:30.396596,2023-10-02 12:14:30.585239,0 days 00:00:00.188643,5699.000442395818,470,sag,COMPLETE
1902,0.637951741456491,2023-10-02 12:14:30.585239,2023-10-02 12:14:30.762242,0 days 00:00:00.177003,558.8488519905486,410,sag,COMPLETE
1903,0.6590785020198712,2023-10-02 12:14:30.763249,2023-10-02 12:14:30.946528,0 days 00:00:00.183279,3278.1328764173754,480,sag,COMPLETE
1904,0.5619609127634021,2023-10-02 12:14:30.946528,2023-10-02 12:14:31.042717,0 days 00:00:00.096189,0.8489413699848998,490,sag,COMPLETE
1905,0.6520362484987444,2023-10-02 12:14:31.043712,2023-10-02 12:14:31.205135,0 days 00:00:00.161423,26939.35519043403,370,sag,COMPLETE
1906,0.6457036794409869,2023-10-02 12:14:31.205135,2023-10-02 12:14:31.353985,0 days 00:00:00.148850,242.02535596813118,430,sag,COMPLETE
1907,0.5,2023-10-02 12:14:31.354988,2023-10-02 12:14:31.520177,0 days 00:00:00.165189,0.014885214089442907,490,sag,COMPLETE
1908,0.6520362484987444,2023-10-02 12:14:31.521177,2023-10-02 12:14:31.701235,0 days 00:00:00.180058,9292.917097202595,480,sag,COMPLETE
1909,0.6418277104487389,2023-10-02 12:14:31.702233,2023-10-02 12:14:31.880867,0 days 00:00:00.178634,445.11944418375856,470,sag,COMPLETE
1910,0.6449939949776177,2023-10-02 12:14:31.881867,2023-10-02 12:14:32.061821,0 days 00:00:00.179954,1997.5191917448424,490,sag,COMPLETE
1911,0.6006660115733159,2023-10-02 12:14:32.061821,2023-10-02 12:14:32.167862,0 days 00:00:00.106041,3.341974950704462,480,sag,COMPLETE
1912,0.6520362484987444,2023-10-02 12:14:32.168862,2023-10-02 12:14:32.358939,0 days 00:00:00.190077,54913.011954114416,490,sag,COMPLETE
1913,0.6590785020198712,2023-10-02 12:14:32.359939,2023-10-02 12:14:32.537028,0 days 00:00:00.177089,17808.01958183648,450,sag,COMPLETE
1914,0.5,2023-10-02 12:14:32.538072,2023-10-02 12:14:32.659676,0 days 00:00:00.121604,0.00030980053614477576,470,sag,COMPLETE
1915,0.6520362484987444,2023-10-02 12:14:32.660672,2023-10-02 12:14:32.846277,0 days 00:00:00.185605,4798.354814968338,490,sag,COMPLETE
1916,0.6520362484987444,2023-10-02 12:14:32.846277,2023-10-02 12:14:33.030418,0 days 00:00:00.184141,97218.184748827,480,sag,COMPLETE
1917,0.6337482257888415,2023-10-02 12:14:33.031464,2023-10-02 12:14:33.129980,0 days 00:00:00.098516,14.401675222505249,490,sag,COMPLETE
1918,0.6520362484987444,2023-10-02 12:14:33.130979,2023-10-02 12:14:33.314033,0 days 00:00:00.183054,8018.366020599507,480,sag,COMPLETE
1919,0.637951741456491,2023-10-02 12:14:33.315035,2023-10-02 12:14:33.495359,0 days 00:00:00.180324,26812.901749075085,410,newton-cg,COMPLETE
1920,0.637951741456491,2023-10-02 12:14:33.496361,2023-10-02 12:14:33.591541,0 days 00:00:00.095180,13017.615523641936,460,liblinear,COMPLETE
1921,0.5,2023-10-02 12:14:33.592604,2023-10-02 12:14:33.687175,0 days 00:00:00.094571,0.29576014221177216,490,sag,COMPLETE
1922,0.5,2023-10-02 12:14:33.688173,2023-10-02 12:14:33.784144,0 days 00:00:00.095971,0.19026078074877684,480,sag,COMPLETE
1923,0.6534556174254831,2023-10-02 12:14:33.785195,2023-10-02 12:14:33.910505,0 days 00:00:00.125310,93.22418201546336,470,sag,COMPLETE
1924,0.5,2023-10-02 12:14:33.910505,2023-10-02 12:14:34.005634,0 days 00:00:00.095129,0.05117391995888679,490,sag,COMPLETE
1925,0.669996724533246,2023-10-02 12:14:34.006633,2023-10-02 12:14:34.185474,0 days 00:00:00.178841,3312.378126840891,500,sag,COMPLETE
1926,0.6449939949776177,2023-10-02 12:14:34.186472,2023-10-02 12:14:34.379087,0 days 00:00:00.192615,1213.300286928863,500,sag,COMPLETE
1927,0.6520362484987444,2023-10-02 12:14:34.380136,2023-10-02 12:14:34.592255,0 days 00:00:00.212119,1688.3718051150183,500,sag,COMPLETE
1928,0.6590785020198712,2023-10-02 12:14:34.593251,2023-10-02 12:14:34.795898,0 days 00:00:00.202647,2532.81272403811,500,sag,COMPLETE
1929,0.637951741456491,2023-10-02 12:14:34.797020,2023-10-02 12:14:34.996404,0 days 00:00:00.199384,888.6994920523016,500,sag,COMPLETE
1930,0.5,2023-10-02 12:14:34.996404,2023-10-02 12:14:35.107402,0 days 00:00:00.110998,0.0065196833104338376,500,sag,COMPLETE
1931,0.6449939949776177,2023-10-02 12:14:35.107402,2023-10-02 12:14:35.363353,0 days 00:00:00.255951,4216.946671734619,500,sag,COMPLETE
1932,0.6520362484987444,2023-10-02 12:14:35.364352,2023-10-02 12:14:35.545398,0 days 00:00:00.181046,2767.447557946784,500,sag,COMPLETE
1933,0.6077082650944426,2023-10-02 12:14:35.545398,2023-10-02 12:14:35.642937,0 days 00:00:00.097539,3.9833168859294683,500,sag,COMPLETE
1934,0.6520362484987444,2023-10-02 12:14:35.643931,2023-10-02 12:14:35.827706,0 days 00:00:00.183775,1740.3169123367832,500,sag,COMPLETE
1935,0.6235396877388361,2023-10-02 12:14:35.827706,2023-10-02 12:14:35.925538,0 days 00:00:00.097832,8.526039068746773,490,sag,COMPLETE
1936,0.6449939949776177,2023-10-02 12:14:35.926538,2023-10-02 12:14:36.108585,0 days 00:00:00.182047,3644.0055998022513,500,sag,COMPLETE
1937,0.6590785020198712,2023-10-02 12:14:36.109583,2023-10-02 12:14:36.290144,0 days 00:00:00.180561,40721.702897853196,490,sag,COMPLETE
1938,0.6449939949776177,2023-10-02 12:14:36.291134,2023-10-02 12:14:36.479119,0 days 00:00:00.187985,2676.1770639329334,500,sag,COMPLETE
1939,0.6449939949776177,2023-10-02 12:14:36.480118,2023-10-02 12:14:36.659135,0 days 00:00:00.179017,5798.038066400146,490,sag,COMPLETE
1940,0.6203734032099574,2023-10-02 12:14:36.660135,2023-10-02 12:14:36.750968,0 days 00:00:00.090833,7.9811612217391,490,liblinear,COMPLETE
1941,0.6309094879353642,2023-10-02 12:14:36.751967,2023-10-02 12:14:36.936576,0 days 00:00:00.184609,1310.433810444043,500,sag,COMPLETE
1942,0.6449939949776177,2023-10-02 12:14:36.937575,2023-10-02 12:14:37.053896,0 days 00:00:00.116321,66105.26055687305,490,newton-cg,COMPLETE
1943,0.6449939949776177,2023-10-02 12:14:37.053896,2023-10-02 12:14:37.235993,0 days 00:00:00.182097,21380.984935589004,500,sag,COMPLETE
