number,value,datetime_start,datetime_complete,duration,params_C,params_max_iter,params_solver,state
9112,0.6077082650944426,2023-10-02 13:00:30.295825,2023-10-02 13:00:30.844979,0 days 00:00:00.549154,3.8271833633625656,360,sag,COMPLETE
9113,0.6534556174254831,2023-10-02 13:00:30.844979,2023-10-02 13:00:31.399456,0 days 00:00:00.554477,62.34457105916959,380,sag,COMPLETE
9114,0.6590785020198712,2023-10-02 13:00:31.399456,2023-10-02 13:00:32.029744,0 days 00:00:00.630288,16707.44502695553,500,sag,COMPLETE
9115,0.637951741456491,2023-10-02 13:00:32.029744,2023-10-02 13:00:32.474388,0 days 00:00:00.444644,44983.618720709565,460,liblinear,COMPLETE
9116,0.6520362484987444,2023-10-02 13:00:32.474388,2023-10-02 13:00:33.087373,0 days 00:00:00.612985,3040.7845999684887,470,sag,COMPLETE
9117,0.6520362484987444,2023-10-02 13:00:33.087373,2023-10-02 13:00:33.703671,0 days 00:00:00.616298,807.951452093103,350,sag,COMPLETE
9118,0.6668304400043672,2023-10-02 13:00:33.703671,2023-10-02 13:00:34.326696,0 days 00:00:00.623025,11701.32022728584,370,sag,COMPLETE
9119,0.6520362484987444,2023-10-02 13:00:34.326696,2023-10-02 13:00:34.953646,0 days 00:00:00.626950,99515.24543683199,500,sag,COMPLETE
9120,0.66224478654875,2023-10-02 13:00:34.953646,2023-10-02 13:00:35.487939,0 days 00:00:00.534293,21600.485399750636,490,sag,COMPLETE
9121,0.6629544710121192,2023-10-02 13:00:35.487939,2023-10-02 13:00:36.083214,0 days 00:00:00.595275,7741.8540042793475,340,sag,COMPLETE
9122,0.6062888961677039,2023-10-02 13:00:36.083214,2023-10-02 13:00:36.616578,0 days 00:00:00.533364,5.870339106269374,480,sag,COMPLETE
9123,0.6520362484987444,2023-10-02 13:00:36.632236,2023-10-02 13:00:37.242810,0 days 00:00:00.610574,43634.45468786169,450,sag,COMPLETE
9124,0.637951741456491,2023-10-02 13:00:37.242810,2023-10-02 13:00:37.811728,0 days 00:00:00.568918,66818.93256584424,440,lbfgs,COMPLETE
9125,0.6534556174254831,2023-10-02 13:00:37.811728,2023-10-02 13:00:38.279221,0 days 00:00:00.467493,90.12431830886811,460,sag,COMPLETE
9126,0.6520362484987444,2023-10-02 13:00:38.279221,2023-10-02 13:00:38.875883,0 days 00:00:00.596662,2258.4767769929053,330,sag,COMPLETE
9127,0.6590785020198712,2023-10-02 13:00:38.875883,2023-10-02 13:00:39.501196,0 days 00:00:00.625313,4417.161124169105,360,saga,COMPLETE
9128,0.6552025330276231,2023-10-02 13:00:39.501196,2023-10-02 13:00:40.130819,0 days 00:00:00.629623,28484.24995156343,500,sag,COMPLETE
9129,0.649579648433235,2023-10-02 13:00:40.130819,2023-10-02 13:00:40.699878,0 days 00:00:00.569059,130.8028442881176,260,sag,COMPLETE
9130,0.5,2023-10-02 13:00:40.699878,2023-10-02 13:00:41.258314,0 days 00:00:00.558436,0.001667503314665469,490,sag,COMPLETE
9131,0.5478764057211486,2023-10-02 13:00:41.258314,2023-10-02 13:00:41.697067,0 days 00:00:00.438753,0.8011514037756277,470,sag,COMPLETE
9132,0.6552025330276231,2023-10-02 13:00:41.697067,2023-10-02 13:00:42.318661,0 days 00:00:00.621594,14342.507347619887,480,sag,COMPLETE
9133,0.6552025330276231,2023-10-02 13:00:42.318661,2023-10-02 13:00:42.911876,0 days 00:00:00.593215,44155.115336324634,350,sag,COMPLETE
9134,0.6520362484987444,2023-10-02 13:00:42.911876,2023-10-02 13:00:43.534074,0 days 00:00:00.622198,8902.235815481066,490,sag,COMPLETE
9135,0.5478764057211486,2023-10-02 13:00:43.534074,2023-10-02 13:00:44.065789,0 days 00:00:00.531715,0.6832350230365489,380,sag,COMPLETE
9136,0.6418277104487389,2023-10-02 13:00:44.065789,2023-10-02 13:00:44.585259,0 days 00:00:00.519470,343.5483085266578,370,sag,COMPLETE
9137,0.608417949557812,2023-10-02 13:00:44.585259,2023-10-02 13:00:45.123318,0 days 00:00:00.538059,3.060548856718678,450,newton-cg,COMPLETE
9138,0.5,2023-10-02 13:00:45.135328,2023-10-02 13:00:45.667311,0 days 00:00:00.531983,0.00214623987280065,500,sag,COMPLETE
9139,0.6590785020198712,2023-10-02 13:00:45.667311,2023-10-02 13:00:46.279425,0 days 00:00:00.612114,21818.185711214224,320,sag,COMPLETE
9140,0.6449939949776177,2023-10-02 13:00:46.279425,2023-10-02 13:00:46.891465,0 days 00:00:00.612040,1365.7634741981162,360,sag,COMPLETE
9141,0.6552025330276231,2023-10-02 13:00:46.891465,2023-10-02 13:00:47.428625,0 days 00:00:00.537160,61815.9236598826,390,sag,COMPLETE
9142,0.6629544710121192,2023-10-02 13:00:47.428625,2023-10-02 13:00:48.036754,0 days 00:00:00.608129,99491.81113659614,430,sag,COMPLETE
9143,0.6573315864177312,2023-10-02 13:00:48.052401,2023-10-02 13:00:48.601213,0 days 00:00:00.548812,37.96456120465137,490,sag,COMPLETE
9144,0.637951741456491,2023-10-02 13:00:48.601213,2023-10-02 13:00:49.149816,0 days 00:00:00.548603,5405.699542927192,470,liblinear,COMPLETE
9145,0.6020853805000546,2023-10-02 13:00:49.149816,2023-10-02 13:00:49.682543,0 days 00:00:00.532727,1.761436706729203,350,sag,COMPLETE
9146,0.6418277104487389,2023-10-02 13:00:49.682543,2023-10-02 13:00:50.233660,0 days 00:00:00.551117,518.8420591972704,480,sag,COMPLETE
9147,0.649579648433235,2023-10-02 13:00:50.233660,2023-10-02 13:00:50.796420,0 days 00:00:00.562760,150.65099477271949,400,sag,COMPLETE
9148,0.5,2023-10-02 13:00:50.796420,2023-10-02 13:00:51.346075,0 days 00:00:00.549655,0.10830842602886351,340,sag,COMPLETE
9149,0.637951741456491,2023-10-02 13:00:51.361726,2023-10-02 13:00:51.957672,0 days 00:00:00.595946,33759.72298093915,410,lbfgs,COMPLETE
9150,0.5,2023-10-02 13:00:51.957672,2023-10-02 13:00:52.521446,0 days 00:00:00.563774,0.00040410642745213347,370,sag,COMPLETE
9151,0.5,2023-10-02 13:00:52.521446,2023-10-02 13:00:53.432814,0 days 00:00:00.911368,3.3736297206594096e-05,440,sag,COMPLETE
9152,0.5,2023-10-02 13:00:53.432814,2023-10-02 13:00:53.999333,0 days 00:00:00.566519,0.0003298166115184632,500,saga,COMPLETE
9153,0.528169014084507,2023-10-02 13:00:53.999333,2023-10-02 13:00:54.548608,0 days 00:00:00.549275,0.376161612060201,460,sag,COMPLETE
9154,0.5996287804345454,2023-10-02 13:00:54.548608,2023-10-02 13:00:55.089098,0 days 00:00:00.540490,1.4688053960919651,420,sag,COMPLETE
9155,0.666120755540998,2023-10-02 13:00:55.089098,2023-10-02 13:00:55.721939,0 days 00:00:00.632841,15693.766751048843,480,sag,COMPLETE
9156,0.6449939949776177,2023-10-02 13:00:55.721939,2023-10-02 13:00:56.334110,0 days 00:00:00.612171,2580.921683675446,380,sag,COMPLETE
9157,0.6298722567965934,2023-10-02 13:00:56.334110,2023-10-02 13:00:56.789164,0 days 00:00:00.455054,15.886235641290003,490,sag,COMPLETE
9158,0.666120755540998,2023-10-02 13:00:56.804786,2023-10-02 13:00:57.415494,0 days 00:00:00.610708,66895.48351545984,460,sag,COMPLETE
9159,0.6520362484987444,2023-10-02 13:00:57.415494,2023-10-02 13:00:58.045202,0 days 00:00:00.629708,9101.53260303065,500,sag,COMPLETE
9160,0.6520362484987444,2023-10-02 13:00:58.048476,2023-10-02 13:00:58.674405,0 days 00:00:00.625929,33213.22973198642,470,sag,COMPLETE
9161,0.6449939949776177,2023-10-02 13:00:58.690036,2023-10-02 13:00:59.251817,0 days 00:00:00.561781,20970.140993933495,180,sag,COMPLETE
9162,0.6449939949776177,2023-10-02 13:00:59.251817,2023-10-02 13:00:59.718820,0 days 00:00:00.467003,48433.4931934895,330,newton-cg,COMPLETE
9163,0.6590785020198712,2023-10-02 13:00:59.718820,2023-10-02 13:01:00.352201,0 days 00:00:00.633381,4608.519349248604,360,sag,COMPLETE
9164,0.6520362484987444,2023-10-02 13:01:00.365216,2023-10-02 13:01:01.024053,0 days 00:00:00.658837,10831.842682790919,490,sag,COMPLETE
9165,0.6590785020198712,2023-10-02 13:01:01.024053,2023-10-02 13:01:01.654691,0 days 00:00:00.630638,6447.706983938071,480,sag,COMPLETE
9166,0.637951741456491,2023-10-02 13:01:01.654691,2023-10-02 13:01:02.199934,0 days 00:00:00.545243,33117.23512383475,450,liblinear,COMPLETE
9167,0.6520362484987444,2023-10-02 13:01:02.199934,2023-10-02 13:01:02.828852,0 days 00:00:00.628918,69611.02783559778,500,sag,COMPLETE
9168,0.5,2023-10-02 13:01:02.828852,2023-10-02 13:01:03.444968,0 days 00:00:00.616116,7.239365955070391e-05,280,sag,COMPLETE
9169,0.6559122174909924,2023-10-02 13:01:03.444968,2023-10-02 13:01:04.052539,0 days 00:00:00.607571,16448.076253763524,350,sag,COMPLETE
9170,0.6520362484987444,2023-10-02 13:01:04.061070,2023-10-02 13:01:04.661832,0 days 00:00:00.600762,3278.6932833641467,390,sag,COMPLETE
9171,0.6457036794409869,2023-10-02 13:01:04.661832,2023-10-02 13:01:05.263188,0 days 00:00:00.601356,209.38155752350383,370,sag,COMPLETE
9172,0.6449939949776177,2023-10-02 13:01:05.263188,2023-10-02 13:01:05.864122,0 days 00:00:00.600934,49976.61324386178,340,sag,COMPLETE
9173,0.5,2023-10-02 13:01:05.864122,2023-10-02 13:01:06.326535,0 days 00:00:00.462413,0.006926897234647617,380,sag,COMPLETE
9174,0.6267059722677149,2023-10-02 13:01:06.342155,2023-10-02 13:01:06.889925,0 days 00:00:00.547770,10.608062000415782,490,sag,COMPLETE
9175,0.5,2023-10-02 13:01:06.889925,2023-10-02 13:01:07.424981,0 days 00:00:00.535056,0.06199140423446337,440,sag,COMPLETE
9176,0.6449939949776177,2023-10-02 13:01:07.424981,2023-10-02 13:01:08.043114,0 days 00:00:00.618133,994.4683560682489,460,sag,COMPLETE
9177,0.6552025330276231,2023-10-02 13:01:08.043114,2023-10-02 13:01:08.679349,0 days 00:00:00.636235,24456.805311250217,480,saga,COMPLETE
9178,0.6534556174254831,2023-10-02 13:01:08.679349,2023-10-02 13:01:09.150133,0 days 00:00:00.470784,94.9830620964518,470,sag,COMPLETE
9179,0.5,2023-10-02 13:01:09.162281,2023-10-02 13:01:09.714641,0 days 00:00:00.552360,0.0006951642081450339,360,lbfgs,COMPLETE
9180,0.6520362484987444,2023-10-02 13:01:09.714641,2023-10-02 13:01:10.343205,0 days 00:00:00.628564,13602.217583475462,450,sag,COMPLETE
9181,0.6590785020198712,2023-10-02 13:01:10.343205,2023-10-02 13:01:10.974637,0 days 00:00:00.631432,99545.52062468584,430,sag,COMPLETE
9182,0.6449939949776177,2023-10-02 13:01:10.974637,2023-10-02 13:01:11.611857,0 days 00:00:00.637220,1713.7999802054076,490,sag,COMPLETE
9183,0.6520362484987444,2023-10-02 13:01:11.613288,2023-10-02 13:01:12.240476,0 days 00:00:00.627188,6647.091794123534,500,sag,COMPLETE
9184,0.6449939949776177,2023-10-02 13:01:12.240476,2023-10-02 13:01:12.763784,0 days 00:00:00.523308,44421.98940145485,400,sag,COMPLETE
9185,0.6411180259853696,2023-10-02 13:01:12.763784,2023-10-02 13:01:13.368986,0 days 00:00:00.605202,4222.237345551185,370,sag,COMPLETE
9186,0.6590785020198712,2023-10-02 13:01:13.368986,2023-10-02 13:01:13.964572,0 days 00:00:00.595586,25805.95161867789,350,sag,COMPLETE
9187,0.6418277104487389,2023-10-02 13:01:13.964572,2023-10-02 13:01:14.582000,0 days 00:00:00.617428,366.4491012671091,330,sag,COMPLETE
9188,0.637951741456491,2023-10-02 13:01:14.582000,2023-10-02 13:01:15.164735,0 days 00:00:00.582735,10077.620001244197,480,newton-cg,COMPLETE
9189,0.637951741456491,2023-10-02 13:01:15.164735,2023-10-02 13:01:15.674603,0 days 00:00:00.509868,35534.50789730928,360,sag,COMPLETE
9190,0.5,2023-10-02 13:01:15.674603,2023-10-02 13:01:16.224766,0 days 00:00:00.550163,0.004633549319546399,490,sag,COMPLETE
9191,0.6520362484987444,2023-10-02 13:01:16.224766,2023-10-02 13:01:16.838738,0 days 00:00:00.613972,99347.27424863962,340,sag,COMPLETE
9192,0.5,2023-10-02 13:01:16.838738,2023-10-02 13:01:17.370653,0 days 00:00:00.531915,0.18252545593109287,500,liblinear,COMPLETE
9193,0.5690031662845288,2023-10-02 13:01:17.386827,2023-10-02 13:01:17.929459,0 days 00:00:00.542632,1.0454267889038442,470,sag,COMPLETE
9194,0.6449939949776177,2023-10-02 13:01:17.929459,2023-10-02 13:01:18.546427,0 days 00:00:00.616968,64402.511380617914,380,sag,COMPLETE
9195,0.6337482257888415,2023-10-02 13:01:18.546427,2023-10-02 13:01:18.988996,0 days 00:00:00.442569,15.392279107104871,410,sag,COMPLETE
9196,0.5,2023-10-02 13:01:19.004685,2023-10-02 13:01:19.550399,0 days 00:00:00.545714,0.003651571925885231,450,sag,COMPLETE
9197,0.666120755540998,2023-10-02 13:01:19.565450,2023-10-02 13:01:20.177316,0 days 00:00:00.611866,17585.799709572148,440,sag,COMPLETE
9198,0.5943334425155585,2023-10-02 13:01:20.177316,2023-10-02 13:01:20.711015,0 days 00:00:00.533699,2.109356481132952,460,sag,COMPLETE
9199,0.6457036794409869,2023-10-02 13:01:20.711015,2023-10-02 13:01:21.295683,0 days 00:00:00.584668,173.13424812925194,480,sag,COMPLETE
9200,0.637951741456491,2023-10-02 13:01:21.295683,2023-10-02 13:01:21.824858,0 days 00:00:00.529175,694.0366101224946,500,sag,COMPLETE
9201,0.637951741456491,2023-10-02 13:01:21.840491,2023-10-02 13:01:22.401589,0 days 00:00:00.561098,46532.979974035276,470,lbfgs,COMPLETE
9202,0.6449939949776177,2023-10-02 13:01:22.401589,2023-10-02 13:01:23.001308,0 days 00:00:00.599719,2544.826906353149,370,sag,COMPLETE
9203,0.6520362484987444,2023-10-02 13:01:23.001308,2023-10-02 13:01:23.601750,0 days 00:00:00.600442,8576.720974350237,320,sag,COMPLETE
9204,0.6449939949776177,2023-10-02 13:01:23.618105,2023-10-02 13:01:24.257088,0 days 00:00:00.638983,20173.785249419812,480,sag,COMPLETE
9205,0.6590785020198712,2023-10-02 13:01:24.257088,2023-10-02 13:01:24.866872,0 days 00:00:00.609784,4984.7333797508,390,sag,COMPLETE
9206,0.5,2023-10-02 13:01:24.866872,2023-10-02 13:01:25.321759,0 days 00:00:00.454887,0.029454810412499272,430,saga,COMPLETE
9207,0.6520362484987444,2023-10-02 13:01:25.321759,2023-10-02 13:01:25.952450,0 days 00:00:00.630691,68170.00866861765,490,sag,COMPLETE
9208,0.5,2023-10-02 13:01:25.952450,2023-10-02 13:01:26.546033,0 days 00:00:00.593583,0.0002315259966523602,340,sag,COMPLETE
9209,0.5,2023-10-02 13:01:26.546033,2023-10-02 13:01:27.643578,0 days 00:00:01.097545,2.1680509421150976e-05,360,sag,COMPLETE
9210,0.5,2023-10-02 13:01:27.643578,2023-10-02 13:01:28.434875,0 days 00:00:00.791297,4.4996401866576184e-05,500,sag,COMPLETE
9211,0.5,2023-10-02 13:01:28.434875,2023-10-02 13:01:28.883545,0 days 00:00:00.448670,0.008369514355093338,350,sag,COMPLETE
9212,0.643956763838847,2023-10-02 13:01:28.883545,2023-10-02 13:01:29.449650,0 days 00:00:00.566105,24.917736799135024,490,sag,COMPLETE
9213,0.6534556174254831,2023-10-02 13:01:29.449650,2023-10-02 13:01:30.028319,0 days 00:00:00.578669,67.44706387297545,370,sag,COMPLETE
9214,0.6235396877388361,2023-10-02 13:01:30.028319,2023-10-02 13:01:30.593418,0 days 00:00:00.565099,8.399565693003181,460,newton-cg,COMPLETE
9215,0.5,2023-10-02 13:01:30.593418,2023-10-02 13:01:31.785524,0 days 00:00:01.192106,1.9880802754108564e-05,480,sag,COMPLETE
9216,0.5,2023-10-02 13:01:31.785524,2023-10-02 13:01:32.224713,0 days 00:00:00.439189,0.12922062302395623,380,sag,COMPLETE
9217,0.637951741456491,2023-10-02 13:01:32.240358,2023-10-02 13:01:32.774265,0 days 00:00:00.533907,31135.03829178231,470,liblinear,COMPLETE
9218,0.6590785020198712,2023-10-02 13:01:32.774265,2023-10-02 13:01:33.417597,0 days 00:00:00.643332,12047.669679556086,490,sag,COMPLETE
9219,0.5,2023-10-02 13:01:33.417597,2023-10-02 13:01:33.965544,0 days 00:00:00.547947,0.07504919889457866,440,sag,COMPLETE
9220,0.6559122174909924,2023-10-02 13:01:33.965544,2023-10-02 13:01:34.609349,0 days 00:00:00.643805,44352.480187130954,500,sag,COMPLETE
9221,0.6449939949776177,2023-10-02 13:01:34.620367,2023-10-02 13:01:35.236729,0 days 00:00:00.616362,2052.472926698827,420,sag,COMPLETE
9222,0.6590785020198712,2023-10-02 13:01:35.236729,2023-10-02 13:01:35.747657,0 days 00:00:00.510928,25981.28785390887,350,sag,COMPLETE
9223,0.6449939949776177,2023-10-02 13:01:35.747657,2023-10-02 13:01:36.350994,0 days 00:00:00.603337,3630.56282054427,360,sag,COMPLETE
9224,0.528169014084507,2023-10-02 13:01:36.366628,2023-10-02 13:01:36.916511,0 days 00:00:00.549883,0.42965658472366464,480,sag,COMPLETE
9225,0.6520362484987444,2023-10-02 13:01:36.924028,2023-10-02 13:01:37.527451,0 days 00:00:00.603423,15109.841893469582,400,sag,COMPLETE
9226,0.666120755540998,2023-10-02 13:01:37.543101,2023-10-02 13:01:38.185475,0 days 00:00:00.642374,7147.5267327857055,450,sag,COMPLETE
9227,0.637951741456491,2023-10-02 13:01:38.185475,2023-10-02 13:01:38.687816,0 days 00:00:00.502341,68559.15934581717,460,lbfgs,COMPLETE
9228,0.5,2023-10-02 13:01:38.687816,2023-10-02 13:01:39.239351,0 days 00:00:00.551535,0.25217137758314584,490,sag,COMPLETE
9229,0.637951741456491,2023-10-02 13:01:39.254999,2023-10-02 13:01:39.895566,0 days 00:00:00.640567,750.5082758733174,500,sag,COMPLETE
9230,0.6590785020198712,2023-10-02 13:01:39.895566,2023-10-02 13:01:40.517941,0 days 00:00:00.622375,35841.33380496352,380,sag,COMPLETE
9231,0.5,2023-10-02 13:01:40.530458,2023-10-02 13:01:41.134451,0 days 00:00:00.603993,0.0022105290575834447,340,saga,COMPLETE
9232,0.6520362484987444,2023-10-02 13:01:41.134451,2023-10-02 13:01:41.687313,0 days 00:00:00.552862,99043.52116376304,470,sag,COMPLETE
9233,0.5,2023-10-02 13:01:41.687313,2023-10-02 13:01:42.248717,0 days 00:00:00.561404,0.023062781357073396,330,sag,COMPLETE
9234,0.6527459329621137,2023-10-02 13:01:42.248717,2023-10-02 13:01:42.859349,0 days 00:00:00.610632,1430.2284942580925,390,sag,COMPLETE
9235,0.6449939949776177,2023-10-02 13:01:42.875238,2023-10-02 13:01:43.487991,0 days 00:00:00.612753,21688.272227493475,480,sag,COMPLETE
9236,0.5,2023-10-02 13:01:43.503628,2023-10-02 13:01:44.041566,0 days 00:00:00.537938,0.01684629666006188,370,sag,COMPLETE
9237,0.6520362484987444,2023-10-02 13:01:44.041566,2023-10-02 13:01:44.554343,0 days 00:00:00.512777,10339.189158092742,350,sag,COMPLETE
9238,0.6573315864177312,2023-10-02 13:01:44.554343,2023-10-02 13:01:45.119502,0 days 00:00:00.565159,40.53873781664296,310,sag,COMPLETE
9239,0.6520362484987444,2023-10-02 13:01:45.119502,2023-10-02 13:01:45.761841,0 days 00:00:00.642339,48731.114423206636,490,sag,COMPLETE
9240,0.6101648651599519,2023-10-02 13:01:45.761841,2023-10-02 13:01:46.310873,0 days 00:00:00.549032,5.5312685080114665,410,newton-cg,COMPLETE
9241,0.5855442733922918,2023-10-02 13:01:46.310873,2023-10-02 13:01:46.860169,0 days 00:00:00.549296,1.2566712387656376,500,sag,COMPLETE
9242,0.5,2023-10-02 13:01:46.860169,2023-10-02 13:01:47.472490,0 days 00:00:00.612321,0.00014660938965243238,450,sag,COMPLETE
9243,0.6590785020198712,2023-10-02 13:01:47.472490,2023-10-02 13:01:48.004758,0 days 00:00:00.532268,5361.280185617996,440,sag,COMPLETE
9244,0.6077082650944426,2023-10-02 13:01:48.004758,2023-10-02 13:01:48.545392,0 days 00:00:00.540634,3.5829388270265667,480,liblinear,COMPLETE
9245,0.666120755540998,2023-10-02 13:01:48.553912,2023-10-02 13:01:49.157144,0 days 00:00:00.603232,99269.17664843112,430,sag,COMPLETE
9246,0.643956763838847,2023-10-02 13:01:49.157144,2023-10-02 13:01:49.731356,0 days 00:00:00.574212,24.93025451081398,460,sag,COMPLETE
9247,0.5,2023-10-02 13:01:49.731356,2023-10-02 13:01:50.279362,0 days 00:00:00.548006,0.01133370255912622,360,sag,COMPLETE
9248,0.6418277104487389,2023-10-02 13:01:50.295805,2023-10-02 13:01:50.828484,0 days 00:00:00.532679,322.0969934558459,490,sag,COMPLETE
9249,0.5478764057211486,2023-10-02 13:01:50.828484,2023-10-02 13:01:51.377865,0 days 00:00:00.549381,0.7177424601410273,470,sag,COMPLETE
9250,0.666120755540998,2023-10-02 13:01:51.377865,2023-10-02 13:01:52.005526,0 days 00:00:00.627661,16385.518819994766,500,sag,COMPLETE
9251,0.6590785020198712,2023-10-02 13:01:52.021156,2023-10-02 13:01:52.633216,0 days 00:00:00.612060,65980.08495306905,360,sag,COMPLETE
9252,0.5,2023-10-02 13:01:52.633216,2023-10-02 13:01:53.181616,0 days 00:00:00.548400,0.03061280585984816,420,sag,COMPLETE
9253,0.5,2023-10-02 13:01:53.181616,2023-10-02 13:01:53.723252,0 days 00:00:00.541636,0.050894926497276616,340,lbfgs,COMPLETE
9254,0.6418277104487389,2023-10-02 13:01:53.723252,2023-10-02 13:01:54.231691,0 days 00:00:00.508439,30978.735103945364,300,sag,COMPLETE
9255,0.6520362484987444,2023-10-02 13:01:54.231691,2023-10-02 13:01:54.829969,0 days 00:00:00.598278,3239.3417130618154,370,sag,COMPLETE
9256,0.5,2023-10-02 13:01:54.829969,2023-10-02 13:01:55.613231,0 days 00:00:00.783262,1.8293120549845428e-05,490,saga,COMPLETE
9257,0.6590785020198712,2023-10-02 13:01:55.628865,2023-10-02 13:01:56.261457,0 days 00:00:00.632592,47029.59475221067,480,sag,COMPLETE
9258,0.669996724533246,2023-10-02 13:01:56.261457,2023-10-02 13:01:56.862096,0 days 00:00:00.600639,6906.762176658067,350,sag,COMPLETE
9259,0.6552025330276231,2023-10-02 13:01:56.869398,2023-10-02 13:01:57.387269,0 days 00:00:00.517871,11991.25103541775,460,sag,COMPLETE
9260,0.5,2023-10-02 13:01:57.402899,2023-10-02 13:01:57.964327,0 days 00:00:00.561428,0.001514227979930273,380,sag,COMPLETE
9261,0.6590785020198712,2023-10-02 13:01:57.965860,2023-10-02 13:01:58.603617,0 days 00:00:00.637757,24060.544044194783,500,sag,COMPLETE
9262,0.5855442733922918,2023-10-02 13:01:58.603617,2023-10-02 13:01:59.173523,0 days 00:00:00.569906,1.3143915993852624,440,sag,COMPLETE
9263,0.6457036794409869,2023-10-02 13:01:59.173523,2023-10-02 13:01:59.756909,0 days 00:00:00.583386,171.77448879072975,490,sag,COMPLETE
9264,0.6267059722677149,2023-10-02 13:01:59.756909,2023-10-02 13:02:00.209739,0 days 00:00:00.452830,11.925916788265623,470,sag,COMPLETE
9265,0.6559122174909924,2023-10-02 13:02:00.209739,2023-10-02 13:02:00.816317,0 days 00:00:00.606578,48758.06283358185,390,sag,COMPLETE
9266,0.6013756960366853,2023-10-02 13:02:00.816317,2023-10-02 13:02:01.385949,0 days 00:00:00.569632,2.2750680371125767,370,newton-cg,COMPLETE
9267,0.5,2023-10-02 13:02:01.385949,2023-10-02 13:02:02.071319,0 days 00:00:00.685370,8.168218452637765e-05,330,sag,COMPLETE
9268,0.6449939949776177,2023-10-02 13:02:02.071319,2023-10-02 13:02:02.687876,0 days 00:00:00.616557,1044.476406885295,450,sag,COMPLETE
9269,0.6238672344142374,2023-10-02 13:02:02.687876,2023-10-02 13:02:03.233356,0 days 00:00:00.545480,2399.0202595584205,500,liblinear,COMPLETE
9270,0.5,2023-10-02 13:02:03.233356,2023-10-02 13:02:03.753289,0 days 00:00:00.519933,0.0001485132067913395,430,sag,COMPLETE
9271,0.6418277104487389,2023-10-02 13:02:03.753289,2023-10-02 13:02:04.384687,0 days 00:00:00.631398,506.2207392104668,490,sag,COMPLETE
9272,0.6559122174909924,2023-10-02 13:02:04.384687,2023-10-02 13:02:04.992709,0 days 00:00:00.608022,16160.284605219562,360,sag,COMPLETE
9273,0.6534556174254831,2023-10-02 13:02:04.992709,2023-10-02 13:02:05.578783,0 days 00:00:00.586074,86.94285522157821,320,sag,COMPLETE
9274,0.5,2023-10-02 13:02:05.584922,2023-10-02 13:02:06.169484,0 days 00:00:00.584562,0.0004720668794906527,460,sag,COMPLETE
