number,value,datetime_start,datetime_complete,duration,params_C,params_max_iter,params_solver,state
3246,0.5,2023-10-02 12:19:09.717143,2023-10-02 12:19:09.872055,0 days 00:00:00.154912,0.13200973791507248,470,sag,COMPLETE
3247,0.5,2023-10-02 12:19:09.873057,2023-10-02 12:19:10.021511,0 days 00:00:00.148454,0.11150136952290093,470,liblinear,COMPLETE
3248,0.5376678676711432,2023-10-02 12:19:10.022512,2023-10-02 12:19:10.285306,0 days 00:00:00.262794,0.584647934378687,440,saga,COMPLETE
3249,0.6077082650944426,2023-10-02 12:19:10.286312,2023-10-02 12:19:10.463410,0 days 00:00:00.177098,4.0957567641081924,470,sag,COMPLETE
3250,0.6590785020198712,2023-10-02 12:19:10.465412,2023-10-02 12:19:10.709695,0 days 00:00:00.244283,14074.890521308242,470,sag,COMPLETE
3251,0.6457036794409869,2023-10-02 12:19:10.710687,2023-10-02 12:19:10.902849,0 days 00:00:00.192162,161.46744460765282,460,sag,COMPLETE
3252,0.6590785020198712,2023-10-02 12:19:10.903851,2023-10-02 12:19:11.139662,0 days 00:00:00.235811,68190.80710567364,450,sag,COMPLETE
3253,0.5,2023-10-02 12:19:11.140661,2023-10-02 12:19:11.360917,0 days 00:00:00.220256,0.033216253599152916,460,saga,COMPLETE
3254,0.6449939949776177,2023-10-02 12:19:11.361919,2023-10-02 12:19:11.593490,0 days 00:00:00.231571,26709.018169840525,450,sag,COMPLETE
3255,0.666120755540998,2023-10-02 12:19:11.594490,2023-10-02 12:19:11.837570,0 days 00:00:00.243080,99396.31473894733,470,sag,COMPLETE
3256,0.604541980565564,2023-10-02 12:19:11.838570,2023-10-02 12:19:11.991631,0 days 00:00:00.153061,3.189967455507368,460,sag,COMPLETE
3257,0.666120755540998,2023-10-02 12:19:11.993631,2023-10-02 12:19:12.278734,0 days 00:00:00.285103,43723.777267516234,340,sag,COMPLETE
3258,0.637951741456491,2023-10-02 12:19:12.279734,2023-10-02 12:19:12.472263,0 days 00:00:00.192529,25413.924698577626,470,lbfgs,COMPLETE
3259,0.6235396877388361,2023-10-02 12:19:12.473261,2023-10-02 12:19:12.627308,0 days 00:00:00.154047,8.337664290465034,440,sag,COMPLETE
3260,0.6590785020198712,2023-10-02 12:19:12.629365,2023-10-02 12:19:12.863212,0 days 00:00:00.233847,16042.46552373069,450,saga,COMPLETE
3261,0.649579648433235,2023-10-02 12:19:12.864210,2023-10-02 12:19:13.124461,0 days 00:00:00.260251,154.0345574502909,430,sag,COMPLETE
3262,0.6590785020198712,2023-10-02 12:19:13.126455,2023-10-02 12:19:13.356973,0 days 00:00:00.230518,44653.48730602503,460,sag,COMPLETE
3263,0.5,2023-10-02 12:19:13.357971,2023-10-02 12:19:13.512087,0 days 00:00:00.154116,0.07473442826067611,470,sag,COMPLETE
3264,0.6418277104487389,2023-10-02 12:19:13.512273,2023-10-02 12:19:13.753533,0 days 00:00:00.241260,522.4778167950054,470,sag,COMPLETE
3265,0.5,2023-10-02 12:19:13.754533,2023-10-02 12:19:14.015227,0 days 00:00:00.260694,0.004408981866192055,450,saga,COMPLETE
3266,0.6534556174254831,2023-10-02 12:19:14.016228,2023-10-02 12:19:14.226126,0 days 00:00:00.209898,79.18603880202839,460,sag,COMPLETE
3267,0.6590785020198712,2023-10-02 12:19:14.228126,2023-10-02 12:19:14.474553,0 days 00:00:00.246427,21402.23295927031,470,sag,COMPLETE
3268,0.6629544710121192,2023-10-02 12:19:14.475623,2023-10-02 12:19:14.709020,0 days 00:00:00.233397,13224.235766465743,440,sag,COMPLETE
3269,0.5619609127634021,2023-10-02 12:19:14.710080,2023-10-02 12:19:14.955730,0 days 00:00:00.245650,0.9147831091301541,470,newton-cg,COMPLETE
3270,0.5,2023-10-02 12:19:14.956733,2023-10-02 12:19:15.135913,0 days 00:00:00.179180,0.000509901310663818,430,sag,COMPLETE
3271,0.5,2023-10-02 12:19:15.136917,2023-10-02 12:19:15.293245,0 days 00:00:00.156328,0.03745916897913664,460,liblinear,COMPLETE
3272,0.6552025330276231,2023-10-02 12:19:15.294246,2023-10-02 12:19:15.527020,0 days 00:00:00.232774,65513.515662195045,450,saga,COMPLETE
3273,0.6520362484987444,2023-10-02 12:19:15.528020,2023-10-02 12:19:15.833946,0 days 00:00:00.305926,34372.64876266788,470,sag,COMPLETE
3274,0.6552025330276231,2023-10-02 12:19:15.834946,2023-10-02 12:19:16.067200,0 days 00:00:00.232254,21191.95640209164,460,sag,COMPLETE
3275,0.6457036794409869,2023-10-02 12:19:16.068197,2023-10-02 12:19:16.262841,0 days 00:00:00.194644,185.05563078010047,440,sag,COMPLETE
3276,0.5,2023-10-02 12:19:16.263845,2023-10-02 12:19:16.418016,0 days 00:00:00.154171,0.008443527782615071,470,sag,COMPLETE
3277,0.528169014084507,2023-10-02 12:19:16.419016,2023-10-02 12:19:16.648112,0 days 00:00:00.229096,0.38613891854550997,470,sag,COMPLETE
3278,0.6590785020198712,2023-10-02 12:19:16.649112,2023-10-02 12:19:16.882173,0 days 00:00:00.233061,12701.0219715487,450,saga,COMPLETE
3279,0.6020853805000546,2023-10-02 12:19:16.883174,2023-10-02 12:19:17.035051,0 days 00:00:00.151877,1.7996135562617075,470,sag,COMPLETE
3280,0.6534556174254831,2023-10-02 12:19:17.036051,2023-10-02 12:19:17.234379,0 days 00:00:00.198328,97.64820239718806,440,sag,COMPLETE
3281,0.5,2023-10-02 12:19:17.236380,2023-10-02 12:19:17.476206,0 days 00:00:00.239826,0.0006957625186252269,460,sag,COMPLETE
3282,0.5,2023-10-02 12:19:17.477204,2023-10-02 12:19:17.634328,0 days 00:00:00.157124,0.014264725131141243,320,sag,COMPLETE
3283,0.6481602795064964,2023-10-02 12:19:17.635410,2023-10-02 12:19:17.839968,0 days 00:00:00.204558,63444.77246381578,280,saga,COMPLETE
3284,0.5,2023-10-02 12:19:17.840970,2023-10-02 12:19:18.225004,0 days 00:00:00.384034,4.806783021755588e-05,470,sag,COMPLETE
3285,0.6457036794409869,2023-10-02 12:19:18.226009,2023-10-02 12:19:18.515018,0 days 00:00:00.289009,269.5337193217102,450,sag,COMPLETE
3286,0.637951741456491,2023-10-02 12:19:18.517017,2023-10-02 12:19:18.714046,0 days 00:00:00.197029,32824.860356652665,470,lbfgs,COMPLETE
3287,0.666120755540998,2023-10-02 12:19:18.715045,2023-10-02 12:19:18.950366,0 days 00:00:00.235321,45272.631026092364,460,sag,COMPLETE
3288,0.6520362484987444,2023-10-02 12:19:18.951366,2023-10-02 12:19:19.177239,0 days 00:00:00.225873,13510.658762917565,420,sag,COMPLETE
3289,0.5,2023-10-02 12:19:19.178239,2023-10-02 12:19:19.333301,0 days 00:00:00.155062,0.021104259791956854,460,saga,COMPLETE
3290,0.666120755540998,2023-10-02 12:19:19.334301,2023-10-02 12:19:19.636185,0 days 00:00:00.301884,23104.00449826995,450,sag,COMPLETE
3291,0.6590785020198712,2023-10-02 12:19:19.638188,2023-10-02 12:19:19.831676,0 days 00:00:00.193488,68524.26368409449,250,sag,COMPLETE
3292,0.6520362484987444,2023-10-02 12:19:19.832676,2023-10-02 12:19:20.064518,0 days 00:00:00.231842,33130.396132910326,470,sag,COMPLETE
3293,0.6573315864177312,2023-10-02 12:19:20.065519,2023-10-02 12:19:20.234722,0 days 00:00:00.169203,37.64474009152716,430,sag,COMPLETE
3294,0.6449939949776177,2023-10-02 12:19:20.235747,2023-10-02 12:19:20.491994,0 days 00:00:00.256247,98268.51900991028,470,newton-cg,COMPLETE
3295,0.6411180259853696,2023-10-02 12:19:20.492994,2023-10-02 12:19:20.734874,0 days 00:00:00.241880,17860.592030448126,440,saga,COMPLETE
3296,0.5,2023-10-02 12:19:20.736876,2023-10-02 12:19:21.009650,0 days 00:00:00.272774,8.239631769871536e-05,460,sag,COMPLETE
3297,0.637951741456491,2023-10-02 12:19:21.010651,2023-10-02 12:19:21.251506,0 days 00:00:00.240855,648.1825169479692,470,sag,COMPLETE
3298,0.6133311496888305,2023-10-02 12:19:21.253530,2023-10-02 12:19:21.481946,0 days 00:00:00.228416,6.805951546287415,450,liblinear,COMPLETE
3299,0.5,2023-10-02 12:19:21.482948,2023-10-02 12:19:21.683947,0 days 00:00:00.200999,0.00017794526303957972,470,sag,COMPLETE
3300,0.5,2023-10-02 12:19:21.685947,2023-10-02 12:19:22.208009,0 days 00:00:00.522062,3.4320193438744864e-05,450,sag,COMPLETE
3301,0.6520362484987444,2023-10-02 12:19:22.210009,2023-10-02 12:19:22.449483,0 days 00:00:00.239474,12523.831220585553,460,sag,COMPLETE
3302,0.6418277104487389,2023-10-02 12:19:22.450483,2023-10-02 12:19:22.738718,0 days 00:00:00.288235,154.16170315825028,470,saga,COMPLETE
3303,0.5478764057211486,2023-10-02 12:19:22.739717,2023-10-02 12:19:22.893889,0 days 00:00:00.154172,0.7716796435961807,470,sag,COMPLETE
3304,0.5,2023-10-02 12:19:22.894895,2023-10-02 12:19:23.054098,0 days 00:00:00.159203,0.2830992258163683,460,sag,COMPLETE
3305,0.5,2023-10-02 12:19:23.055098,2023-10-02 12:19:23.238162,0 days 00:00:00.183064,0.0002944811327120738,470,sag,COMPLETE
3306,0.5,2023-10-02 12:19:23.239163,2023-10-02 12:19:23.497437,0 days 00:00:00.258274,0.0002661745008296592,460,sag,COMPLETE
3307,0.6481602795064964,2023-10-02 12:19:23.498439,2023-10-02 12:19:23.735044,0 days 00:00:00.236605,41039.19095951426,430,saga,COMPLETE
3308,0.6629544710121192,2023-10-02 12:19:23.736042,2023-10-02 12:19:23.964286,0 days 00:00:00.228244,24202.431464507536,440,sag,COMPLETE
3309,0.6481602795064964,2023-10-02 12:19:23.965288,2023-10-02 12:19:24.190595,0 days 00:00:00.225307,64344.78336179483,350,sag,COMPLETE
3310,0.5,2023-10-02 12:19:24.191599,2023-10-02 12:19:24.425006,0 days 00:00:00.233407,0.010698554911646898,470,lbfgs,COMPLETE
3311,0.6449939949776177,2023-10-02 12:19:24.426006,2023-10-02 12:19:24.654941,0 days 00:00:00.228935,12688.510488333985,440,sag,COMPLETE
3312,0.6520362484987444,2023-10-02 12:19:24.655943,2023-10-02 12:19:24.897661,0 days 00:00:00.241718,98701.57638137612,460,sag,COMPLETE
3313,0.6449939949776177,2023-10-02 12:19:24.898721,2023-10-02 12:19:25.133601,0 days 00:00:00.234880,45493.63058303994,450,saga,COMPLETE
3314,0.6369145103177202,2023-10-02 12:19:25.134599,2023-10-02 12:19:25.372609,0 days 00:00:00.238010,18.87791174746432,470,sag,COMPLETE
3315,0.6449939949776177,2023-10-02 12:19:25.373614,2023-10-02 12:19:25.625822,0 days 00:00:00.252208,22369.969090245602,470,sag,COMPLETE
3316,0.637951741456491,2023-10-02 12:19:25.626825,2023-10-02 12:19:25.877082,0 days 00:00:00.250257,26816.707918683285,460,sag,COMPLETE
3317,0.6449939949776177,2023-10-02 12:19:25.878080,2023-10-02 12:19:26.082141,0 days 00:00:00.204061,13135.76841769618,310,sag,COMPLETE
3318,0.6411180259853696,2023-10-02 12:19:26.084145,2023-10-02 12:19:26.399192,0 days 00:00:00.315047,46799.88865633104,450,saga,COMPLETE
3319,0.6534556174254831,2023-10-02 12:19:26.400192,2023-10-02 12:19:26.575639,0 days 00:00:00.175447,53.94895842956685,470,sag,COMPLETE
3320,0.6520362484987444,2023-10-02 12:19:26.576639,2023-10-02 12:19:26.811319,0 days 00:00:00.234680,99124.83146803957,450,sag,COMPLETE
3321,0.6559122174909924,2023-10-02 12:19:26.812322,2023-10-02 12:19:27.048595,0 days 00:00:00.236273,17715.445773659445,470,sag,COMPLETE
3322,0.6534556174254831,2023-10-02 12:19:27.049695,2023-10-02 12:19:27.289778,0 days 00:00:00.240083,41.95934236605476,430,newton-cg,COMPLETE
3323,0.637951741456491,2023-10-02 12:19:27.290781,2023-10-02 12:19:27.445233,0 days 00:00:00.154452,33740.428256906795,460,liblinear,COMPLETE
3324,0.5,2023-10-02 12:19:27.447228,2023-10-02 12:19:27.607406,0 days 00:00:00.160178,0.012541689129302768,470,sag,COMPLETE
3325,0.5,2023-10-02 12:19:27.608404,2023-10-02 12:19:27.772938,0 days 00:00:00.164534,0.0026582224003334712,450,sag,COMPLETE
3326,0.6520362484987444,2023-10-02 12:19:27.773935,2023-10-02 12:19:28.090126,0 days 00:00:00.316191,99869.6419165286,480,saga,COMPLETE
3327,0.6520362484987444,2023-10-02 12:19:28.092123,2023-10-02 12:19:28.331652,0 days 00:00:00.239529,49838.15269254275,470,sag,COMPLETE
3328,0.6418277104487389,2023-10-02 12:19:28.332652,2023-10-02 12:19:28.562924,0 days 00:00:00.230272,322.8136760296169,480,sag,COMPLETE
3329,0.6590785020198712,2023-10-02 12:19:28.563925,2023-10-02 12:19:28.780585,0 days 00:00:00.216660,12185.973166900745,370,sag,COMPLETE
3330,0.6590785020198712,2023-10-02 12:19:28.781588,2023-10-02 12:19:29.081707,0 days 00:00:00.300119,30511.093480671283,420,sag,COMPLETE
3331,0.6590785020198712,2023-10-02 12:19:29.083741,2023-10-02 12:19:29.346164,0 days 00:00:00.262423,22004.858936389224,460,saga,COMPLETE
3332,0.5,2023-10-02 12:19:29.348165,2023-10-02 12:19:29.519325,0 days 00:00:00.171160,0.0007228689528670541,480,sag,COMPLETE
3333,0.5,2023-10-02 12:19:29.520325,2023-10-02 12:19:29.693878,0 days 00:00:00.173553,0.0012162301938458623,440,sag,COMPLETE
3334,0.5,2023-10-02 12:19:29.694877,2023-10-02 12:19:29.922681,0 days 00:00:00.227804,0.12069898745365054,470,sag,COMPLETE
3335,0.6267059722677149,2023-10-02 12:19:29.923679,2023-10-02 12:19:30.104869,0 days 00:00:00.181190,12.398295296168252,480,lbfgs,COMPLETE
3336,0.6449939949776177,2023-10-02 12:19:30.105869,2023-10-02 12:19:30.327898,0 days 00:00:00.222029,63255.192611720246,380,sag,COMPLETE
3337,0.6411180259853696,2023-10-02 12:19:30.328932,2023-10-02 12:19:30.503379,0 days 00:00:00.174447,570.1798467945968,110,saga,COMPLETE
3338,0.6013756960366853,2023-10-02 12:19:30.504379,2023-10-02 12:19:30.734348,0 days 00:00:00.229969,2.441580253537023,460,sag,COMPLETE
3339,0.6449939949776177,2023-10-02 12:19:30.735347,2023-10-02 12:19:30.967794,0 days 00:00:00.232447,10826.137465873802,440,sag,COMPLETE
3340,0.637951741456491,2023-10-02 12:19:30.968794,2023-10-02 12:19:31.184065,0 days 00:00:00.215271,34868.6522274946,350,sag,COMPLETE
3341,0.5,2023-10-02 12:19:31.185065,2023-10-02 12:19:31.810717,0 days 00:00:00.625652,2.4277104420163676e-05,450,sag,COMPLETE
3342,0.6520362484987444,2023-10-02 12:19:31.812716,2023-10-02 12:19:32.129261,0 days 00:00:00.316545,19945.705206549366,480,sag,COMPLETE
3343,0.5,2023-10-02 12:19:32.130304,2023-10-02 12:19:32.296858,0 days 00:00:00.166554,0.005841977285136887,470,sag,COMPLETE
3344,0.604541980565564,2023-10-02 12:19:32.298853,2023-10-02 12:19:32.469899,0 days 00:00:00.171046,3.060525742189713,480,saga,COMPLETE
3345,0.5,2023-10-02 12:19:32.470899,2023-10-02 12:19:32.628844,0 days 00:00:00.157945,0.13181822583345498,460,sag,COMPLETE
3346,0.5345015831422644,2023-10-02 12:19:32.630852,2023-10-02 12:19:32.860047,0 days 00:00:00.229195,0.5578308758416805,480,sag,COMPLETE
3347,0.6449939949776177,2023-10-02 12:19:32.861047,2023-10-02 12:19:33.038329,0 days 00:00:00.177282,63305.424828320545,470,newton-cg,COMPLETE
3348,0.6520362484987444,2023-10-02 12:19:33.039489,2023-10-02 12:19:33.283548,0 days 00:00:00.244059,11192.468559374856,450,sag,COMPLETE
3349,0.637951741456491,2023-10-02 12:19:33.284543,2023-10-02 12:19:33.442285,0 days 00:00:00.157742,17225.207981314976,140,liblinear,COMPLETE
3350,0.5,2023-10-02 12:19:33.443284,2023-10-02 12:19:33.687496,0 days 00:00:00.244212,0.025163413482945696,480,saga,COMPLETE
3351,0.6520362484987444,2023-10-02 12:19:33.688498,2023-10-02 12:19:33.931979,0 days 00:00:00.243481,34447.93299605851,470,sag,COMPLETE
3352,0.6481602795064964,2023-10-02 12:19:33.933037,2023-10-02 12:19:34.183578,0 days 00:00:00.250541,65084.770988925324,440,sag,COMPLETE
3353,0.6457036794409869,2023-10-02 12:19:34.184577,2023-10-02 12:19:34.400705,0 days 00:00:00.216128,222.4779997405973,480,sag,COMPLETE
3354,0.5,2023-10-02 12:19:34.400705,2023-10-02 12:19:35.197808,0 days 00:00:00.797103,2.0220501302743612e-05,460,sag,COMPLETE
3355,0.6449939949776177,2023-10-02 12:19:35.198808,2023-10-02 12:19:35.442580,0 days 00:00:00.243772,28269.413535378724,470,saga,COMPLETE
3356,0.6590785020198712,2023-10-02 12:19:35.443582,2023-10-02 12:19:35.689658,0 days 00:00:00.246076,43937.99046983279,480,sag,COMPLETE
3357,0.6629544710121192,2023-10-02 12:19:35.690657,2023-10-02 12:19:35.933018,0 days 00:00:00.242361,11496.143991747016,450,sag,COMPLETE
3358,0.6629544710121192,2023-10-02 12:19:35.934016,2023-10-02 12:19:36.251252,0 days 00:00:00.317236,99698.08662086929,480,sag,COMPLETE
3359,0.6062888961677039,2023-10-02 12:19:36.253254,2023-10-02 12:19:36.422911,0 days 00:00:00.169657,6.274870116898762,460,sag,COMPLETE
3360,0.649579648433235,2023-10-02 12:19:36.424913,2023-10-02 12:19:36.634711,0 days 00:00:00.209798,93.40459509139662,300,saga,COMPLETE
3361,0.6059613494923026,2023-10-02 12:19:36.635718,2023-10-02 12:19:36.795252,0 days 00:00:00.159534,1.683396035481304,440,sag,COMPLETE
3362,0.5,2023-10-02 12:19:36.797250,2023-10-02 12:19:37.033807,0 days 00:00:00.236557,1.0851269465998358e-05,430,lbfgs,COMPLETE
3363,0.5,2023-10-02 12:19:37.034806,2023-10-02 12:19:37.199342,0 days 00:00:00.164536,0.09061916687442335,480,sag,COMPLETE
3364,0.6488699639698657,2023-10-02 12:19:37.200339,2023-10-02 12:19:37.420021,0 days 00:00:00.219682,19102.794479976557,340,sag,COMPLETE
3365,0.6449939949776177,2023-10-02 12:19:37.422021,2023-10-02 12:19:37.678775,0 days 00:00:00.256754,46049.13354389078,470,sag,COMPLETE
3366,0.6077082650944426,2023-10-02 12:19:37.679766,2023-10-02 12:19:37.916576,0 days 00:00:00.236810,3.976647635736365,460,sag,COMPLETE
3367,0.6418277104487389,2023-10-02 12:19:37.917573,2023-10-02 12:19:38.163661,0 days 00:00:00.246088,153.9688310262609,480,saga,COMPLETE
3368,0.6369145103177202,2023-10-02 12:19:38.164658,2023-10-02 12:19:38.385094,0 days 00:00:00.220436,23.487999456090506,450,sag,COMPLETE
3369,0.6534556174254831,2023-10-02 12:19:38.387093,2023-10-02 12:19:38.578862,0 days 00:00:00.191769,57.14306981919654,470,sag,COMPLETE
3370,0.6267059722677149,2023-10-02 12:19:38.579862,2023-10-02 12:19:38.822445,0 days 00:00:00.242583,13.29695259488188,480,sag,COMPLETE
3371,0.5211267605633803,2023-10-02 12:19:38.824441,2023-10-02 12:19:38.987286,0 days 00:00:00.162845,0.3657192647231978,420,sag,COMPLETE
3372,0.5,2023-10-02 12:19:38.988290,2023-10-02 12:19:39.167309,0 days 00:00:00.179019,9.178223131331752e-05,450,newton-cg,COMPLETE
3373,0.6481602795064964,2023-10-02 12:19:39.168313,2023-10-02 12:19:39.444446,0 days 00:00:00.276133,17982.9567866267,480,saga,COMPLETE
3374,0.6590785020198712,2023-10-02 12:19:39.445443,2023-10-02 12:19:39.755403,0 days 00:00:00.309960,10774.685561511506,470,sag,COMPLETE
3375,0.6386614259198603,2023-10-02 12:19:39.756401,2023-10-02 12:19:39.913891,0 days 00:00:00.157490,489.21098502070674,480,liblinear,COMPLETE
3376,0.5,2023-10-02 12:19:39.914891,2023-10-02 12:19:40.080512,0 days 00:00:00.165621,0.0026662882470422184,460,sag,COMPLETE
3377,0.6534556174254831,2023-10-02 12:19:40.081511,2023-10-02 12:19:40.279605,0 days 00:00:00.198094,112.5805222274576,440,sag,COMPLETE
3378,0.5,2023-10-02 12:19:40.280609,2023-10-02 12:19:40.534309,0 days 00:00:00.253700,0.05497242477254375,480,sag,COMPLETE
3379,0.6552025330276231,2023-10-02 12:19:40.535310,2023-10-02 12:19:40.785407,0 days 00:00:00.250097,29043.44812269932,470,saga,COMPLETE
3380,0.6520362484987444,2023-10-02 12:19:40.787440,2023-10-02 12:19:41.011277,0 days 00:00:00.223837,62523.469351693115,390,sag,COMPLETE
3381,0.5,2023-10-02 12:19:41.012281,2023-10-02 12:19:41.199249,0 days 00:00:00.186968,0.0017827429420454108,460,sag,COMPLETE
3382,0.5,2023-10-02 12:19:41.200243,2023-10-02 12:19:41.476832,0 days 00:00:00.276589,0.00027208502727247744,480,sag,COMPLETE
3383,0.6559122174909924,2023-10-02 12:19:41.478833,2023-10-02 12:19:41.715656,0 days 00:00:00.236823,28915.084786246563,450,sag,COMPLETE
3384,0.5619609127634021,2023-10-02 12:19:41.716699,2023-10-02 12:19:41.898977,0 days 00:00:00.182278,0.9646232005674118,470,saga,COMPLETE
3385,0.6520362484987444,2023-10-02 12:19:41.900970,2023-10-02 12:19:42.145545,0 days 00:00:00.244575,13727.645575012917,480,sag,COMPLETE
3386,0.5,2023-10-02 12:19:42.146550,2023-10-02 12:19:42.381605,0 days 00:00:00.235055,0.13844299044874542,460,sag,COMPLETE
3387,0.6386614259198603,2023-10-02 12:19:42.383614,2023-10-02 12:19:42.616856,0 days 00:00:00.233242,350.0919074667254,480,lbfgs,COMPLETE
3388,0.6590785020198712,2023-10-02 12:19:42.617863,2023-10-02 12:19:42.856120,0 days 00:00:00.238257,48421.94527702951,470,sag,COMPLETE
3389,0.5721694508134076,2023-10-02 12:19:42.857128,2023-10-02 12:19:43.015251,0 days 00:00:00.158123,1.0927666865188481,440,sag,COMPLETE
3390,0.5,2023-10-02 12:19:43.016254,2023-10-02 12:19:43.286888,0 days 00:00:00.270634,0.00104326990444886,430,sag,COMPLETE
3391,0.5,2023-10-02 12:19:43.287885,2023-10-02 12:19:43.467302,0 days 00:00:00.179417,0.18977812380083667,480,saga,COMPLETE
3392,0.666120755540998,2023-10-02 12:19:43.468303,2023-10-02 12:19:43.707087,0 days 00:00:00.238784,20190.448140925848,450,sag,COMPLETE
3393,0.6449939949776177,2023-10-02 12:19:43.708087,2023-10-02 12:19:43.965914,0 days 00:00:00.257827,10334.746886570809,480,sag,COMPLETE
3394,0.637951741456491,2023-10-02 12:19:43.968028,2023-10-02 12:19:44.300040,0 days 00:00:00.332012,813.1968812127774,460,sag,COMPLETE
3395,0.666120755540998,2023-10-02 12:19:44.301040,2023-10-02 12:19:44.544719,0 days 00:00:00.243679,34830.08480408574,480,sag,COMPLETE
3396,0.6481602795064964,2023-10-02 12:19:44.545719,2023-10-02 12:19:44.798026,0 days 00:00:00.252307,62021.13794888531,470,saga,COMPLETE
3397,0.6449939949776177,2023-10-02 12:19:44.799023,2023-10-02 12:19:45.129494,0 days 00:00:00.330471,19724.014893497588,460,sag,COMPLETE
3398,0.643956763838847,2023-10-02 12:19:45.131621,2023-10-02 12:19:45.399763,0 days 00:00:00.268142,26.603171152026736,480,newton-cg,COMPLETE
3399,0.6534556174254831,2023-10-02 12:19:45.400760,2023-10-02 12:19:45.603863,0 days 00:00:00.203103,46.01633135939154,470,sag,COMPLETE
3400,0.5,2023-10-02 12:19:45.604865,2023-10-02 12:19:45.804647,0 days 00:00:00.199782,0.015018987706382202,450,sag,COMPLETE
3401,0.6520362484987444,2023-10-02 12:19:45.805649,2023-10-02 12:19:46.107244,0 days 00:00:00.301595,44088.30015505747,480,sag,COMPLETE
3402,0.637951741456491,2023-10-02 12:19:46.109251,2023-10-02 12:19:46.414006,0 days 00:00:00.304755,10240.523083537546,430,liblinear,COMPLETE
3403,0.5,2023-10-02 12:19:46.416006,2023-10-02 12:19:46.650076,0 days 00:00:00.234070,0.0037863053855191025,460,saga,COMPLETE
3404,0.6449939949776177,2023-10-02 12:19:46.652074,2023-10-02 12:19:46.885120,0 days 00:00:00.233046,28208.675556578146,360,sag,COMPLETE
3405,0.6449939949776177,2023-10-02 12:19:46.886120,2023-10-02 12:19:47.151056,0 days 00:00:00.264936,15579.007250482133,480,sag,COMPLETE
3406,0.5313352986133857,2023-10-02 12:19:47.152060,2023-10-02 12:19:47.396237,0 days 00:00:00.244177,0.49884364695450856,470,sag,COMPLETE
3407,0.5,2023-10-02 12:19:47.397253,2023-10-02 12:19:47.559285,0 days 00:00:00.162032,0.2244847347263507,450,sag,COMPLETE
3408,0.6267059722677149,2023-10-02 12:19:47.561290,2023-10-02 12:19:47.739243,0 days 00:00:00.177953,10.905546625551215,480,saga,COMPLETE
