number,value,datetime_start,datetime_complete,duration,params_C,params_max_iter,params_solver,state
6178,0.6559122174909924,2023-10-02 12:35:33.280449,2023-10-02 12:35:33.636500,0 days 00:00:00.356051,2503.1071373434347,340,sag,COMPLETE
6179,0.5,2023-10-02 12:35:33.636500,2023-10-02 12:35:35.112856,0 days 00:00:01.476356,1.1248843863749333e-05,490,sag,COMPLETE
6180,0.637951741456491,2023-10-02 12:35:35.112856,2023-10-02 12:35:35.411829,0 days 00:00:00.298973,99378.20585637519,480,liblinear,COMPLETE
6181,0.6520362484987444,2023-10-02 12:35:35.411829,2023-10-02 12:35:35.870396,0 days 00:00:00.458567,8788.735207797768,360,sag,COMPLETE
6182,0.6629544710121192,2023-10-02 12:35:35.870396,2023-10-02 12:35:36.261254,0 days 00:00:00.390858,35666.26135100741,470,sag,COMPLETE
6183,0.666120755540998,2023-10-02 12:35:36.262663,2023-10-02 12:35:36.731825,0 days 00:00:00.469162,61477.56115803198,500,sag,COMPLETE
6184,0.5,2023-10-02 12:35:36.731825,2023-10-02 12:35:37.048311,0 days 00:00:00.316486,0.11252569180061472,140,sag,COMPLETE
6185,0.649579648433235,2023-10-02 12:35:37.048311,2023-10-02 12:35:37.481850,0 days 00:00:00.433539,136.93922768694793,460,sag,COMPLETE
6186,0.5,2023-10-02 12:35:37.481850,2023-10-02 12:35:37.796578,0 days 00:00:00.314728,0.13442399811717126,350,sag,COMPLETE
6187,0.5925865269134185,2023-10-02 12:35:37.796578,2023-10-02 12:35:38.198558,0 days 00:00:00.401980,1.4120827572234695,380,sag,COMPLETE
6188,0.6668304400043672,2023-10-02 12:35:38.200556,2023-10-02 12:35:38.613758,0 days 00:00:00.413202,13077.020655046525,500,sag,COMPLETE
6189,0.637951741456491,2023-10-02 12:35:38.615567,2023-10-02 12:35:39.046389,0 days 00:00:00.430822,5381.776399909095,450,lbfgs,COMPLETE
6190,0.666120755540998,2023-10-02 12:35:39.046389,2023-10-02 12:35:39.513514,0 days 00:00:00.467125,29899.486465811224,490,sag,COMPLETE
6191,0.6449939949776177,2023-10-02 12:35:39.513514,2023-10-02 12:35:39.882182,0 days 00:00:00.368668,752.0090164712537,370,sag,COMPLETE
6192,0.6590785020198712,2023-10-02 12:35:39.882182,2023-10-02 12:35:40.361150,0 days 00:00:00.478968,49868.17090002137,470,sag,COMPLETE
6193,0.6534556174254831,2023-10-02 12:35:40.364499,2023-10-02 12:35:40.686578,0 days 00:00:00.322079,41.34364907961384,490,sag,COMPLETE
6194,0.5,2023-10-02 12:35:40.686578,2023-10-02 12:35:41.646045,0 days 00:00:00.959467,2.201946761427385e-05,310,sag,COMPLETE
6195,0.6267059722677149,2023-10-02 12:35:41.646045,2023-10-02 12:35:41.950657,0 days 00:00:00.304612,10.757886505013136,480,sag,COMPLETE
6196,0.6457036794409869,2023-10-02 12:35:41.950657,2023-10-02 12:35:42.400589,0 days 00:00:00.449932,231.86199268540528,430,sag,COMPLETE
6197,0.6481602795064964,2023-10-02 12:35:42.400589,2023-10-02 12:35:42.784073,0 days 00:00:00.383484,20909.47902931145,390,sag,COMPLETE
6198,0.5,2023-10-02 12:35:42.785587,2023-10-02 12:35:43.186197,0 days 00:00:00.400610,0.0027741463246775066,340,sag,COMPLETE
6199,0.6534556174254831,2023-10-02 12:35:43.186197,2023-10-02 12:35:43.509713,0 days 00:00:00.323516,52.63783697491973,440,sag,COMPLETE
6200,0.6590785020198712,2023-10-02 12:35:43.509713,2023-10-02 12:35:43.988600,0 days 00:00:00.478887,3872.984410126537,500,sag,COMPLETE
6201,0.637951741456491,2023-10-02 12:35:43.990600,2023-10-02 12:35:44.319929,0 days 00:00:00.329329,9570.312291680042,480,newton-cg,COMPLETE
6202,0.6520362484987444,2023-10-02 12:35:44.321925,2023-10-02 12:35:44.849399,0 days 00:00:00.527474,67013.71195382459,490,sag,COMPLETE
6203,0.5,2023-10-02 12:35:44.849399,2023-10-02 12:35:45.168679,0 days 00:00:00.319280,0.0008622661575491856,500,sag,COMPLETE
6204,0.6298722567965934,2023-10-02 12:35:45.168679,2023-10-02 12:35:45.643814,0 days 00:00:00.475135,16.30433563756697,460,sag,COMPLETE
6205,0.6238672344142374,2023-10-02 12:35:45.643814,2023-10-02 12:35:45.959886,0 days 00:00:00.316072,2320.19455583706,470,liblinear,COMPLETE
6206,0.6449939949776177,2023-10-02 12:35:45.959886,2023-10-02 12:35:46.404352,0 days 00:00:00.444466,14141.295131977864,360,sag,COMPLETE
6207,0.5376678676711432,2023-10-02 12:35:46.406352,2023-10-02 12:35:46.717016,0 days 00:00:00.310664,0.6109700273502813,330,sag,COMPLETE
6208,0.5,2023-10-02 12:35:46.717563,2023-10-02 12:35:47.196211,0 days 00:00:00.478648,9.551867903316427e-05,250,sag,COMPLETE
6209,0.5823779888634131,2023-10-02 12:35:47.211863,2023-10-02 12:35:47.516846,0 days 00:00:00.304983,1.186345583029267,350,sag,COMPLETE
6210,0.6449939949776177,2023-10-02 12:35:47.516846,2023-10-02 12:35:47.992395,0 days 00:00:00.475549,6869.184150961294,490,sag,COMPLETE
6211,0.5,2023-10-02 12:35:47.992395,2023-10-02 12:35:48.297055,0 days 00:00:00.304660,0.1685523673042655,480,sag,COMPLETE
6212,0.6590785020198712,2023-10-02 12:35:48.299055,2023-10-02 12:35:48.775979,0 days 00:00:00.476924,30862.034242415626,490,sag,COMPLETE
6213,0.5,2023-10-02 12:35:48.775979,2023-10-02 12:35:49.135959,0 days 00:00:00.359980,0.00017399409296137475,470,sag,COMPLETE
6214,0.6277432034064855,2023-10-02 12:35:49.135959,2023-10-02 12:35:49.561087,0 days 00:00:00.425128,1676.2916689541842,450,lbfgs,COMPLETE
6215,0.6552025330276231,2023-10-02 12:35:49.561087,2023-10-02 12:35:50.033549,0 days 00:00:00.472462,52931.4504612847,480,sag,COMPLETE
6216,0.6534556174254831,2023-10-02 12:35:50.035935,2023-10-02 12:35:50.369509,0 days 00:00:00.333574,85.0883501410644,500,sag,COMPLETE
6217,0.6449939949776177,2023-10-02 12:35:50.369509,2023-10-02 12:35:50.847578,0 days 00:00:00.478069,962.3883344529348,380,sag,COMPLETE
6218,0.634075772464243,2023-10-02 12:35:50.847578,2023-10-02 12:35:51.208643,0 days 00:00:00.361065,99401.23715426325,270,sag,COMPLETE
6219,0.666120755540998,2023-10-02 12:35:51.208643,2023-10-02 12:35:51.674044,0 days 00:00:00.465401,14233.202752150457,370,sag,COMPLETE
6220,0.5,2023-10-02 12:35:51.674044,2023-10-02 12:35:51.989946,0 days 00:00:00.315902,0.015631569078201343,340,sag,COMPLETE
6221,0.6590785020198712,2023-10-02 12:35:51.991944,2023-10-02 12:35:52.484888,0 days 00:00:00.492944,27272.833549301333,490,sag,COMPLETE
6222,0.6590785020198712,2023-10-02 12:35:52.484888,2023-10-02 12:35:52.897914,0 days 00:00:00.413026,5295.906593886569,500,sag,COMPLETE
6223,0.6520362484987444,2023-10-02 12:35:52.899914,2023-10-02 12:35:53.362153,0 days 00:00:00.462239,45863.821606344216,460,sag,COMPLETE
6224,0.6418277104487389,2023-10-02 12:35:53.362153,2023-10-02 12:35:53.738950,0 days 00:00:00.376797,509.6158165521153,360,sag,COMPLETE
6225,0.6449939949776177,2023-10-02 12:35:53.738950,2023-10-02 12:35:54.209791,0 days 00:00:00.470841,19376.582852461852,470,sag,COMPLETE
6226,0.5,2023-10-02 12:35:54.209791,2023-10-02 12:35:54.508842,0 days 00:00:00.299051,0.13252890100166162,280,newton-cg,COMPLETE
6227,0.6590785020198712,2023-10-02 12:35:54.508842,2023-10-02 12:35:54.999471,0 days 00:00:00.490629,8397.006320043538,440,sag,COMPLETE
6228,0.6520362484987444,2023-10-02 12:35:55.001479,2023-10-02 12:35:55.413980,0 days 00:00:00.412501,66573.79820773554,490,sag,COMPLETE
6229,0.5,2023-10-02 12:35:55.429628,2023-10-02 12:35:55.831066,0 days 00:00:00.401438,0.04310084069614212,480,liblinear,COMPLETE
6230,0.528169014084507,2023-10-02 12:35:55.831066,2023-10-02 12:35:56.140119,0 days 00:00:00.309053,0.39451799536836946,330,sag,COMPLETE
6231,0.6520362484987444,2023-10-02 12:35:56.140119,2023-10-02 12:35:56.604711,0 days 00:00:00.464592,3455.934645105057,400,sag,COMPLETE
6232,0.649579648433235,2023-10-02 12:35:56.604711,2023-10-02 12:35:56.962593,0 days 00:00:00.357882,149.3537129887743,350,sag,COMPLETE
6233,0.6590785020198712,2023-10-02 12:35:56.964593,2023-10-02 12:35:57.436203,0 days 00:00:00.471610,22284.75258833718,490,sag,COMPLETE
6234,0.6077082650944426,2023-10-02 12:35:57.436203,2023-10-02 12:35:57.746057,0 days 00:00:00.309854,3.747057381282199,500,sag,COMPLETE
6235,0.5943334425155585,2023-10-02 12:35:57.761685,2023-10-02 12:35:58.156948,0 days 00:00:00.395263,2.0877147468345743,450,sag,COMPLETE
6236,0.6559122174909924,2023-10-02 12:35:58.156948,2023-10-02 12:35:58.559198,0 days 00:00:00.402250,11865.786562560414,370,sag,COMPLETE
6237,0.6590785020198712,2023-10-02 12:35:58.561210,2023-10-02 12:35:59.032838,0 days 00:00:00.471628,37510.98281083557,480,sag,COMPLETE
6238,0.6520362484987444,2023-10-02 12:35:59.032838,2023-10-02 12:35:59.506445,0 days 00:00:00.473607,6445.5419783748475,500,sag,COMPLETE
6239,0.5,2023-10-02 12:35:59.506445,2023-10-02 12:35:59.807222,0 days 00:00:00.300777,0.006520982953802007,460,lbfgs,COMPLETE
6240,0.6590785020198712,2023-10-02 12:35:59.807222,2023-10-02 12:36:00.293118,0 days 00:00:00.485896,68107.6817587869,490,sag,COMPLETE
6241,0.6101648651599519,2023-10-02 12:36:00.293118,2023-10-02 12:36:00.597421,0 days 00:00:00.304303,5.162877359411438,410,sag,COMPLETE
6242,0.6590785020198712,2023-10-02 12:36:00.597421,2023-10-02 12:36:01.052639,0 days 00:00:00.455218,24962.748673036924,340,sag,COMPLETE
6243,0.6590785020198712,2023-10-02 12:36:01.052639,2023-10-02 12:36:01.429364,0 days 00:00:00.376725,46633.747636537264,470,sag,COMPLETE
6244,0.666120755540998,2023-10-02 12:36:01.444982,2023-10-02 12:36:01.899301,0 days 00:00:00.454319,13475.134750595747,480,sag,COMPLETE
6245,0.6520362484987444,2023-10-02 12:36:01.911825,2023-10-02 12:36:02.289860,0 days 00:00:00.378035,1975.1373911494056,360,sag,COMPLETE
6246,0.5,2023-10-02 12:36:02.291861,2023-10-02 12:36:03.102978,0 days 00:00:00.811117,3.462334581718848e-05,500,sag,COMPLETE
6247,0.637951741456491,2023-10-02 12:36:03.104979,2023-10-02 12:36:03.471430,0 days 00:00:00.366451,519.8717665619716,350,sag,COMPLETE
6248,0.6590785020198712,2023-10-02 12:36:03.471430,2023-10-02 12:36:03.926641,0 days 00:00:00.455211,4422.612033884633,490,sag,COMPLETE
6249,0.6541653018888526,2023-10-02 12:36:03.942332,2023-10-02 12:36:04.241263,0 days 00:00:00.298931,30.90511203500495,380,sag,COMPLETE
6250,0.6520362484987444,2023-10-02 12:36:04.241263,2023-10-02 12:36:04.716731,0 days 00:00:00.475468,8285.885186681926,480,sag,COMPLETE
6251,0.637951741456491,2023-10-02 12:36:04.716731,2023-10-02 12:36:05.032441,0 days 00:00:00.315710,30405.611205617653,450,newton-cg,COMPLETE
6252,0.5,2023-10-02 12:36:05.048062,2023-10-02 12:36:05.703827,0 days 00:00:00.655765,4.424177199508965e-05,500,sag,COMPLETE
6253,0.6457036794409869,2023-10-02 12:36:05.705836,2023-10-02 12:36:06.071901,0 days 00:00:00.366065,203.39467328074832,470,sag,COMPLETE
6254,0.6418277104487389,2023-10-02 12:36:06.073910,2023-10-02 12:36:06.556740,0 days 00:00:00.482830,306.9424911796288,440,sag,COMPLETE
6255,0.637951741456491,2023-10-02 12:36:06.556740,2023-10-02 12:36:06.944688,0 days 00:00:00.387948,1206.940541867404,490,sag,COMPLETE
6256,0.6267059722677149,2023-10-02 12:36:06.945654,2023-10-02 12:36:07.376703,0 days 00:00:00.431049,10.546002265663107,460,sag,COMPLETE
6257,0.637951741456491,2023-10-02 12:36:07.376703,2023-10-02 12:36:07.694730,0 days 00:00:00.318027,16883.793952049076,480,liblinear,COMPLETE
6258,0.6534556174254831,2023-10-02 12:36:07.694730,2023-10-02 12:36:08.099325,0 days 00:00:00.404595,54.732428250144785,500,sag,COMPLETE
6259,0.5,2023-10-02 12:36:08.099325,2023-10-02 12:36:08.428015,0 days 00:00:00.328690,0.06868769328711276,360,sag,COMPLETE
6260,0.6520362484987444,2023-10-02 12:36:08.428015,2023-10-02 12:36:08.871594,0 days 00:00:00.443579,65372.910773216056,330,sag,COMPLETE
6261,0.6481602795064964,2023-10-02 12:36:08.871594,2023-10-02 12:36:09.332433,0 days 00:00:00.460839,38556.15754895134,320,sag,COMPLETE
6262,0.5,2023-10-02 12:36:09.334429,2023-10-02 12:36:09.647856,0 days 00:00:00.313427,0.0038603448462068576,390,sag,COMPLETE
6263,0.5,2023-10-02 12:36:09.663476,2023-10-02 12:36:10.085887,0 days 00:00:00.422411,0.00022078601710673814,490,sag,COMPLETE
6264,0.637951741456491,2023-10-02 12:36:10.085887,2023-10-02 12:36:10.449140,0 days 00:00:00.363253,10263.237507091624,470,lbfgs,COMPLETE
6265,0.5,2023-10-02 12:36:10.449140,2023-10-02 12:36:10.850158,0 days 00:00:00.401018,0.010636469428005996,340,sag,COMPLETE
6266,0.6552025330276231,2023-10-02 12:36:10.850158,2023-10-02 12:36:11.206309,0 days 00:00:00.356151,4250.627578202017,100,sag,COMPLETE
6267,0.6520362484987444,2023-10-02 12:36:11.208301,2023-10-02 12:36:11.658739,0 days 00:00:00.450438,19363.344113136704,430,sag,COMPLETE
6268,0.5,2023-10-02 12:36:11.658739,2023-10-02 12:36:11.982370,0 days 00:00:00.323631,0.000843926257288622,500,sag,COMPLETE
6269,0.5,2023-10-02 12:36:11.982370,2023-10-02 12:36:12.399750,0 days 00:00:00.417380,0.0003214545834696413,370,sag,COMPLETE
6270,0.6203734032099574,2023-10-02 12:36:12.411505,2023-10-02 12:36:12.729624,0 days 00:00:00.318119,8.083400020991574,460,sag,COMPLETE
6271,0.637951741456491,2023-10-02 12:36:12.729624,2023-10-02 12:36:13.173230,0 days 00:00:00.443606,6383.524367158022,350,sag,COMPLETE
6272,0.6590785020198712,2023-10-02 12:36:13.173230,2023-10-02 12:36:13.559459,0 days 00:00:00.386229,99896.35611656196,480,sag,COMPLETE
6273,0.6520362484987444,2023-10-02 12:36:13.559459,2023-10-02 12:36:14.029984,0 days 00:00:00.470525,46373.93626436166,490,sag,COMPLETE
6274,0.6590785020198712,2023-10-02 12:36:14.029984,2023-10-02 12:36:14.444617,0 days 00:00:00.414633,26525.62787827136,480,sag,COMPLETE
6275,0.6629544710121192,2023-10-02 12:36:14.444617,2023-10-02 12:36:14.907400,0 days 00:00:00.462783,3124.0428280504184,290,sag,COMPLETE
6276,0.637951741456491,2023-10-02 12:36:14.907400,2023-10-02 12:36:15.230374,0 days 00:00:00.322974,13149.072528012042,490,newton-cg,COMPLETE
6277,0.6534556174254831,2023-10-02 12:36:15.230374,2023-10-02 12:36:15.669896,0 days 00:00:00.439522,92.4016094326756,500,sag,COMPLETE
6278,0.5925865269134185,2023-10-02 12:36:15.669896,2023-10-02 12:36:16.062006,0 days 00:00:00.392110,1.3715899870562231,470,sag,COMPLETE
6279,0.637951741456491,2023-10-02 12:36:16.062006,2023-10-02 12:36:16.376193,0 days 00:00:00.314187,45525.819747124566,450,liblinear,COMPLETE
6280,0.5,2023-10-02 12:36:16.379025,2023-10-02 12:36:16.767811,0 days 00:00:00.388786,0.11103313540221169,490,sag,COMPLETE
6281,0.6707064089966154,2023-10-02 12:36:16.783440,2023-10-02 12:36:17.148914,0 days 00:00:00.365474,63606.51080251598,420,sag,COMPLETE
6282,0.666120755540998,2023-10-02 12:36:17.148914,2023-10-02 12:36:17.632187,0 days 00:00:00.483273,71391.26599769303,430,sag,COMPLETE
6283,0.6559122174909924,2023-10-02 12:36:17.632187,2023-10-02 12:36:18.030961,0 days 00:00:00.398774,71406.3281190304,420,sag,COMPLETE
6284,0.6590785020198712,2023-10-02 12:36:18.032476,2023-10-02 12:36:18.499435,0 days 00:00:00.466959,98586.07494184142,430,sag,COMPLETE
6285,0.6590785020198712,2023-10-02 12:36:18.499435,2023-10-02 12:36:18.920814,0 days 00:00:00.421379,65679.8560684392,400,sag,COMPLETE
6286,0.6590785020198712,2023-10-02 12:36:18.920814,2023-10-02 12:36:19.409254,0 days 00:00:00.488440,71104.40253943208,420,sag,COMPLETE
6287,0.6559122174909924,2023-10-02 12:36:19.411245,2023-10-02 12:36:19.787232,0 days 00:00:00.375987,66255.53687522864,430,sag,COMPLETE
6288,0.6590785020198712,2023-10-02 12:36:19.787232,2023-10-02 12:36:20.263873,0 days 00:00:00.476641,47631.163156274415,400,sag,COMPLETE
6289,0.6520362484987444,2023-10-02 12:36:20.265873,2023-10-02 12:36:20.694469,0 days 00:00:00.428596,55127.00528634357,430,sag,COMPLETE
6290,0.637951741456491,2023-10-02 12:36:20.696472,2023-10-02 12:36:21.138223,0 days 00:00:00.441751,70248.57235939417,420,lbfgs,COMPLETE
6291,0.6449939949776177,2023-10-02 12:36:21.138223,2023-10-02 12:36:21.625846,0 days 00:00:00.487623,48498.46056923183,420,sag,COMPLETE
6292,0.6590785020198712,2023-10-02 12:36:21.627838,2023-10-02 12:36:21.997702,0 days 00:00:00.369864,48377.707376109065,420,sag,COMPLETE
6293,0.666120755540998,2023-10-02 12:36:21.997702,2023-10-02 12:36:22.505997,0 days 00:00:00.508295,66381.63124525017,400,sag,COMPLETE
6294,0.6552025330276231,2023-10-02 12:36:22.505997,2023-10-02 12:36:22.903609,0 days 00:00:00.397612,64857.53436565818,430,sag,COMPLETE
6295,0.6520362484987444,2023-10-02 12:36:22.903609,2023-10-02 12:36:23.382147,0 days 00:00:00.478538,41409.616422792154,430,sag,COMPLETE
6296,0.6590785020198712,2023-10-02 12:36:23.382147,2023-10-02 12:36:23.784045,0 days 00:00:00.401898,96805.35264958756,410,sag,COMPLETE
6297,0.6590785020198712,2023-10-02 12:36:23.784045,2023-10-02 12:36:24.250271,0 days 00:00:00.466226,65484.830731557486,430,sag,COMPLETE
6298,0.6629544710121192,2023-10-02 12:36:24.267045,2023-10-02 12:36:24.676809,0 days 00:00:00.409764,40552.34961202056,440,sag,COMPLETE
6299,0.6520362484987444,2023-10-02 12:36:24.676809,2023-10-02 12:36:25.170325,0 days 00:00:00.493516,97206.02871652036,430,sag,COMPLETE
6300,0.6590785020198712,2023-10-02 12:36:25.172322,2023-10-02 12:36:25.575650,0 days 00:00:00.403328,34077.17448500731,410,sag,COMPLETE
6301,0.5,2023-10-02 12:36:25.577651,2023-10-02 12:36:26.215497,0 days 00:00:00.637846,4.725217734145426e-05,420,sag,COMPLETE
6302,0.6449939949776177,2023-10-02 12:36:26.215497,2023-10-02 12:36:26.547689,0 days 00:00:00.332192,45849.971281004146,410,newton-cg,COMPLETE
6303,0.6520362484987444,2023-10-02 12:36:26.547689,2023-10-02 12:36:27.001737,0 days 00:00:00.454048,98874.4214134851,420,sag,COMPLETE
6304,0.637951741456491,2023-10-02 12:36:27.001737,2023-10-02 12:36:27.315531,0 days 00:00:00.313794,70578.80469341794,410,liblinear,COMPLETE
6305,0.6590785020198712,2023-10-02 12:36:27.315531,2023-10-02 12:36:27.770810,0 days 00:00:00.455279,35038.21472873398,410,sag,COMPLETE
6306,0.6629544710121192,2023-10-02 12:36:27.770810,2023-10-02 12:36:28.226031,0 days 00:00:00.455221,66788.75858235014,420,sag,COMPLETE
6307,0.6590785020198712,2023-10-02 12:36:28.226031,2023-10-02 12:36:28.603352,0 days 00:00:00.377321,44472.07745403476,450,sag,COMPLETE
6308,0.6552025330276231,2023-10-02 12:36:28.603352,2023-10-02 12:36:29.049792,0 days 00:00:00.446440,36960.82196139512,430,sag,COMPLETE
6309,0.6552025330276231,2023-10-02 12:36:29.058847,2023-10-02 12:36:29.420386,0 days 00:00:00.361539,52176.809289078985,450,sag,COMPLETE
6310,0.6590785020198712,2023-10-02 12:36:29.435824,2023-10-02 12:36:29.891577,0 days 00:00:00.455753,30988.201299027536,420,sag,COMPLETE
6311,0.6520362484987444,2023-10-02 12:36:29.891577,2023-10-02 12:36:30.268389,0 days 00:00:00.376812,50642.372160481325,440,sag,COMPLETE
6312,0.5,2023-10-02 12:36:30.268389,2023-10-02 12:36:30.661398,0 days 00:00:00.393009,0.1594966880554202,410,sag,COMPLETE
6313,0.6520362484987444,2023-10-02 12:36:30.661398,2023-10-02 12:36:31.037931,0 days 00:00:00.376533,62123.675021095514,420,sag,COMPLETE
6314,0.637951741456491,2023-10-02 12:36:31.037931,2023-10-02 12:36:31.454903,0 days 00:00:00.416972,34647.27312270604,410,lbfgs,COMPLETE
6315,0.6552025330276231,2023-10-02 12:36:31.454903,2023-10-02 12:36:31.840589,0 days 00:00:00.385686,96779.04105886612,440,sag,COMPLETE
6316,0.6418277104487389,2023-10-02 12:36:31.840589,2023-10-02 12:36:32.286033,0 days 00:00:00.445444,327.4207485934715,430,sag,COMPLETE
6317,0.6559122174909924,2023-10-02 12:36:32.288028,2023-10-02 12:36:32.804087,0 days 00:00:00.516059,65069.70761726942,420,sag,COMPLETE
6318,0.669996724533246,2023-10-02 12:36:32.807095,2023-10-02 12:36:33.221075,0 days 00:00:00.413980,31987.71062589909,440,sag,COMPLETE
6319,0.6520362484987444,2023-10-02 12:36:33.221075,2023-10-02 12:36:33.693382,0 days 00:00:00.472307,32774.716208210586,430,sag,COMPLETE
6320,0.666120755540998,2023-10-02 12:36:33.693382,2023-10-02 12:36:34.076882,0 days 00:00:00.383500,62337.53883569927,440,sag,COMPLETE
6321,0.6590785020198712,2023-10-02 12:36:34.076882,2023-10-02 12:36:34.560401,0 days 00:00:00.483519,27912.323479442923,430,sag,COMPLETE
6322,0.6520362484987444,2023-10-02 12:36:34.560401,2023-10-02 12:36:34.958957,0 days 00:00:00.398556,66869.57344207838,430,sag,COMPLETE
6323,0.5,2023-10-02 12:36:34.960958,2023-10-02 12:36:35.361352,0 days 00:00:00.400394,0.023333856573680648,440,sag,COMPLETE
6324,0.6013756960366853,2023-10-02 12:36:35.361352,2023-10-02 12:36:35.679047,0 days 00:00:00.317695,2.488919080843338,400,sag,COMPLETE
6325,0.6520362484987444,2023-10-02 12:36:35.679047,2023-10-02 12:36:36.221418,0 days 00:00:00.542371,99370.95337052461,420,sag,COMPLETE
6326,0.6369145103177202,2023-10-02 12:36:36.221418,2023-10-02 12:36:36.571317,0 days 00:00:00.349899,22.52602466900816,420,sag,COMPLETE
6327,0.6590785020198712,2023-10-02 12:36:36.571317,2023-10-02 12:36:37.118481,0 days 00:00:00.547164,98997.30217920177,440,sag,COMPLETE
6328,0.6449939949776177,2023-10-02 12:36:37.120482,2023-10-02 12:36:37.572913,0 days 00:00:00.452431,46904.76337011732,420,newton-cg,COMPLETE
6329,0.5,2023-10-02 12:36:37.574013,2023-10-02 12:36:37.907414,0 days 00:00:00.333401,0.17810332299357734,440,liblinear,COMPLETE
6330,0.5,2023-10-02 12:36:37.907414,2023-10-02 12:36:38.856405,0 days 00:00:00.948991,2.2005221908032304e-05,430,sag,COMPLETE
6331,0.6502893328966044,2023-10-02 12:36:38.856405,2023-10-02 12:36:39.201442,0 days 00:00:00.345037,36.621643572952124,400,sag,COMPLETE
6332,0.6449939949776177,2023-10-02 12:36:39.201442,2023-10-02 12:36:39.670453,0 days 00:00:00.469011,25442.79131599623,440,sag,COMPLETE
6333,0.6590785020198712,2023-10-02 12:36:39.670453,2023-10-02 12:36:40.048083,0 days 00:00:00.377630,36359.995015103785,420,sag,COMPLETE
6334,0.6534556174254831,2023-10-02 12:36:40.048083,2023-10-02 12:36:40.473520,0 days 00:00:00.425437,81.72285226994768,410,sag,COMPLETE
6335,0.637951741456491,2023-10-02 12:36:40.473520,2023-10-02 12:36:40.851002,0 days 00:00:00.377482,680.1500315269783,430,sag,COMPLETE
6336,0.666120755540998,2023-10-02 12:36:40.851002,2023-10-02 12:36:41.353899,0 days 00:00:00.502897,43566.53728836839,430,sag,COMPLETE
6337,0.6668304400043672,2023-10-02 12:36:41.353899,2023-10-02 12:36:41.750488,0 days 00:00:00.396589,24741.02116202282,440,sag,COMPLETE
6338,0.5,2023-10-02 12:36:41.752487,2023-10-02 12:36:43.375768,0 days 00:00:01.623281,1.0402642016372812e-05,440,sag,COMPLETE
6339,0.6520362484987444,2023-10-02 12:36:43.375768,2023-10-02 12:36:43.752847,0 days 00:00:00.377079,98799.68880654179,450,sag,COMPLETE
