number,value,datetime_start,datetime_complete,duration,params_C,params_max_iter,params_solver,state
9600,0.6457036794409869,2023-10-02 13:05:31.710646,2023-10-02 13:05:32.331532,0 days 00:00:00.620886,172.22531168623075,470,sag,COMPLETE
9601,0.6520362484987444,2023-10-02 13:05:32.331532,2023-10-02 13:05:32.981289,0 days 00:00:00.649757,99809.05268825486,450,sag,COMPLETE
9602,0.5,2023-10-02 13:05:32.981289,2023-10-02 13:05:34.095067,0 days 00:00:01.113778,1.7611880144469636e-05,490,sag,COMPLETE
9603,0.6520362484987444,2023-10-02 13:05:34.095067,2023-10-02 13:05:34.736395,0 days 00:00:00.641328,1446.0958136962593,460,sag,COMPLETE
9604,0.637951741456491,2023-10-02 13:05:34.736395,2023-10-02 13:05:35.319104,0 days 00:00:00.582709,99669.1393246281,390,liblinear,COMPLETE
9605,0.6534556174254831,2023-10-02 13:05:35.319104,2023-10-02 13:05:35.915824,0 days 00:00:00.596720,68.82700053530087,490,newton-cg,COMPLETE
9606,0.6481602795064964,2023-10-02 13:05:35.915824,2023-10-02 13:05:36.557128,0 days 00:00:00.641304,21338.754649750805,470,sag,COMPLETE
9607,0.5,2023-10-02 13:05:36.557128,2023-10-02 13:05:37.136957,0 days 00:00:00.579829,0.0025266985483163983,370,sag,COMPLETE
9608,0.6590785020198712,2023-10-02 13:05:37.136957,2023-10-02 13:05:37.787871,0 days 00:00:00.650914,12195.034500604595,500,sag,COMPLETE
9609,0.6520362484987444,2023-10-02 13:05:37.787871,2023-10-02 13:05:38.345105,0 days 00:00:00.557234,46524.69151962675,480,sag,COMPLETE
9610,0.666120755540998,2023-10-02 13:05:38.360736,2023-10-02 13:05:39.020140,0 days 00:00:00.659404,25945.051565515336,450,sag,COMPLETE
9611,0.6449939949776177,2023-10-02 13:05:39.020140,2023-10-02 13:05:39.646981,0 days 00:00:00.626841,63549.133290784426,400,sag,COMPLETE
9612,0.5,2023-10-02 13:05:39.646981,2023-10-02 13:05:40.228696,0 days 00:00:00.581715,0.006073215571335073,470,sag,COMPLETE
9613,0.6552025330276231,2023-10-02 13:05:40.228696,2023-10-02 13:05:40.891718,0 days 00:00:00.663022,16598.31982730987,460,sag,COMPLETE
9614,0.6449939949776177,2023-10-02 13:05:40.891718,2023-10-02 13:05:41.571637,0 days 00:00:00.679919,33850.09278403721,480,sag,COMPLETE
9615,0.6062888961677039,2023-10-02 13:05:41.588727,2023-10-02 13:05:42.172165,0 days 00:00:00.583438,5.972229548060965,490,lbfgs,COMPLETE
9616,0.6534556174254831,2023-10-02 13:05:42.172165,2023-10-02 13:05:42.675640,0 days 00:00:00.503475,113.14203920863795,380,sag,COMPLETE
9617,0.6520362484987444,2023-10-02 13:05:42.675640,2023-10-02 13:05:43.349314,0 days 00:00:00.673674,64580.0471552314,500,sag,COMPLETE
9618,0.5,2023-10-02 13:05:43.349314,2023-10-02 13:05:43.946013,0 days 00:00:00.596699,0.0002869565987142492,440,sag,COMPLETE
9619,0.6449939949776177,2023-10-02 13:05:43.946013,2023-10-02 13:05:44.588970,0 days 00:00:00.642957,47836.092120703936,370,saga,COMPLETE
9620,0.5,2023-10-02 13:05:44.588970,2023-10-02 13:05:45.173168,0 days 00:00:00.584198,0.0018086712310423408,230,sag,COMPLETE
9621,0.6449939949776177,2023-10-02 13:05:45.173168,2023-10-02 13:05:45.827615,0 days 00:00:00.654447,12417.499272962461,490,sag,COMPLETE
9622,0.5,2023-10-02 13:05:45.827615,2023-10-02 13:05:46.438229,0 days 00:00:00.610614,0.00043344566254485244,470,sag,COMPLETE
9623,0.5,2023-10-02 13:05:46.438229,2023-10-02 13:05:47.098841,0 days 00:00:00.660612,5.947174845022373e-05,480,sag,COMPLETE
9624,0.6520362484987444,2023-10-02 13:05:47.103363,2023-10-02 13:05:47.717397,0 days 00:00:00.614034,26235.535770550003,390,sag,COMPLETE
9625,0.5,2023-10-02 13:05:47.717397,2023-10-02 13:05:48.291171,0 days 00:00:00.573774,0.029626932281842405,500,sag,COMPLETE
9626,0.669996724533246,2023-10-02 13:05:48.291171,2023-10-02 13:05:48.948979,0 days 00:00:00.657808,10375.092264806875,490,sag,COMPLETE
9627,0.666120755540998,2023-10-02 13:05:48.948979,2023-10-02 13:05:49.594410,0 days 00:00:00.645431,2069.3135056594356,460,sag,COMPLETE
9628,0.6590785020198712,2023-10-02 13:05:49.594410,2023-10-02 13:05:50.229642,0 days 00:00:00.635232,43152.166222476015,400,sag,COMPLETE
9629,0.6449939949776177,2023-10-02 13:05:50.229642,2023-10-02 13:05:50.817681,0 days 00:00:00.588039,65738.51701165175,440,newton-cg,COMPLETE
9630,0.5,2023-10-02 13:05:50.817681,2023-10-02 13:05:51.993814,0 days 00:00:01.176133,1.6021825591764605e-05,480,sag,COMPLETE
9631,0.6369145103177202,2023-10-02 13:05:51.993814,2023-10-02 13:05:52.572698,0 days 00:00:00.578884,19.233930872928465,500,liblinear,COMPLETE
9632,0.6534556174254831,2023-10-02 13:05:52.572698,2023-10-02 13:05:53.169271,0 days 00:00:00.596573,102.32327284374911,410,sag,COMPLETE
9633,0.528169014084507,2023-10-02 13:05:53.169271,2023-10-02 13:05:53.750459,0 days 00:00:00.581188,0.4641933269348991,420,sag,COMPLETE
9634,0.6449939949776177,2023-10-02 13:05:53.750459,2023-10-02 13:05:54.415078,0 days 00:00:00.664619,19790.92933350701,450,sag,COMPLETE
9635,0.6590785020198712,2023-10-02 13:05:54.424605,2023-10-02 13:05:55.076375,0 days 00:00:00.651770,31686.83225865892,470,sag,COMPLETE
9636,0.5792117043345343,2023-10-02 13:05:55.092008,2023-10-02 13:05:55.663022,0 days 00:00:00.571014,1.1008997701133543,370,sag,COMPLETE
9637,0.6590785020198712,2023-10-02 13:05:55.663022,2023-10-02 13:05:56.218994,0 days 00:00:00.555972,63959.61426518453,480,sag,COMPLETE
9638,0.5,2023-10-02 13:05:56.218994,2023-10-02 13:05:56.777311,0 days 00:00:00.558317,0.14333688726202323,380,sag,COMPLETE
9639,0.5,2023-10-02 13:05:56.777311,2023-10-02 13:05:57.796095,0 days 00:00:01.018784,3.0214109666226447e-05,490,sag,COMPLETE
9640,0.6449939949776177,2023-10-02 13:05:57.796095,2023-10-02 13:05:58.442904,0 days 00:00:00.646809,10168.46447633383,460,sag,COMPLETE
9641,0.666120755540998,2023-10-02 13:05:58.442904,2023-10-02 13:05:59.114294,0 days 00:00:00.671390,18570.190164091324,500,sag,COMPLETE
9642,0.6386614259198603,2023-10-02 13:05:59.114294,2023-10-02 13:05:59.737641,0 days 00:00:00.623347,359.0803667316631,480,lbfgs,COMPLETE
9643,0.6534556174254831,2023-10-02 13:05:59.737641,2023-10-02 13:06:00.337217,0 days 00:00:00.599576,55.08819344166731,490,sag,COMPLETE
9644,0.6590785020198712,2023-10-02 13:06:00.337217,2023-10-02 13:06:00.906453,0 days 00:00:00.569236,37849.4578800737,470,saga,COMPLETE
9645,0.5,2023-10-02 13:06:00.906453,2023-10-02 13:06:01.467943,0 days 00:00:00.561490,0.1045692257141945,440,sag,COMPLETE
9646,0.608417949557812,2023-10-02 13:06:01.467943,2023-10-02 13:06:02.046989,0 days 00:00:00.579046,3.007773332187165,370,sag,COMPLETE
9647,0.6418277104487389,2023-10-02 13:06:02.046989,2023-10-02 13:06:02.723032,0 days 00:00:00.676043,608.1446897883915,490,sag,COMPLETE
9648,0.6298722567965934,2023-10-02 13:06:02.723032,2023-10-02 13:06:03.292431,0 days 00:00:00.569399,16.997577183540745,450,sag,COMPLETE
9649,0.5,2023-10-02 13:06:03.292431,2023-10-02 13:06:03.852614,0 days 00:00:00.560183,0.007731989374696999,500,sag,COMPLETE
9650,0.6520362484987444,2023-10-02 13:06:03.852614,2023-10-02 13:06:04.380835,0 days 00:00:00.528221,1520.1737419540586,390,sag,COMPLETE
9651,0.6520362484987444,2023-10-02 13:06:04.396082,2023-10-02 13:06:05.014092,0 days 00:00:00.618010,67016.90091209779,380,sag,COMPLETE
9652,0.619663718746588,2023-10-02 13:06:05.014092,2023-10-02 13:06:05.581770,0 days 00:00:00.567678,9.593060071266144,470,sag,COMPLETE
9653,0.5823779888634131,2023-10-02 13:06:05.598966,2023-10-02 13:06:06.173034,0 days 00:00:00.574068,1.2187933752224922,480,sag,COMPLETE
9654,0.6590785020198712,2023-10-02 13:06:06.173034,2023-10-02 13:06:06.846879,0 days 00:00:00.673845,23246.290606528302,460,sag,COMPLETE
9655,0.5,2023-10-02 13:06:06.846879,2023-10-02 13:06:07.412614,0 days 00:00:00.565735,0.025932254443797507,500,sag,COMPLETE
9656,0.637951741456491,2023-10-02 13:06:07.412614,2023-10-02 13:06:07.982338,0 days 00:00:00.569724,43743.68035308544,490,liblinear,COMPLETE
9657,0.637951741456491,2023-10-02 13:06:07.982338,2023-10-02 13:06:08.479151,0 days 00:00:00.496813,14736.112867580527,370,newton-cg,COMPLETE
9658,0.5,2023-10-02 13:06:08.479151,2023-10-02 13:06:09.044102,0 days 00:00:00.564951,0.047805650405787145,450,sag,COMPLETE
9659,0.5,2023-10-02 13:06:09.044102,2023-10-02 13:06:09.625974,0 days 00:00:00.581872,0.22383118972774857,480,sag,COMPLETE
9660,0.5,2023-10-02 13:06:09.625974,2023-10-02 13:06:10.204406,0 days 00:00:00.578432,0.0010474029320840159,470,sag,COMPLETE
9661,0.6590785020198712,2023-10-02 13:06:10.204406,2023-10-02 13:06:10.909922,0 days 00:00:00.705516,34474.14960406102,410,sag,COMPLETE
9662,0.6013756960366853,2023-10-02 13:06:10.925562,2023-10-02 13:06:11.507043,0 days 00:00:00.581481,2.2519002842319416,460,sag,COMPLETE
9663,0.6541653018888526,2023-10-02 13:06:11.507043,2023-10-02 13:06:12.103731,0 days 00:00:00.596688,28.982289971134993,490,sag,COMPLETE
9664,0.5,2023-10-02 13:06:12.103731,2023-10-02 13:06:12.621148,0 days 00:00:00.517417,0.0002625456086766243,500,sag,COMPLETE
9665,0.6559122174909924,2023-10-02 13:06:12.621148,2023-10-02 13:06:13.263849,0 days 00:00:00.642701,65651.10289499318,480,sag,COMPLETE
9666,0.5,2023-10-02 13:06:13.263849,2023-10-02 13:06:14.050311,0 days 00:00:00.786462,5.325498870410717e-05,430,sag,COMPLETE
9667,0.5,2023-10-02 13:06:14.050311,2023-10-02 13:06:14.612532,0 days 00:00:00.562221,0.08962347657105871,400,lbfgs,COMPLETE
9668,0.5,2023-10-02 13:06:14.612532,2023-10-02 13:06:15.233229,0 days 00:00:00.620697,0.00018941230042487743,500,sag,COMPLETE
9669,0.5,2023-10-02 13:06:15.233229,2023-10-02 13:06:15.883291,0 days 00:00:00.650062,0.0009429891971571739,380,saga,COMPLETE
9670,0.5,2023-10-02 13:06:15.883291,2023-10-02 13:06:16.402504,0 days 00:00:00.519213,0.00038206265134229825,470,sag,COMPLETE
9671,0.669996724533246,2023-10-02 13:06:16.402504,2023-10-02 13:06:16.998049,0 days 00:00:00.595545,99802.25290862046,170,sag,COMPLETE
9672,0.6520362484987444,2023-10-02 13:06:16.998049,2023-10-02 13:06:17.649695,0 days 00:00:00.651646,1160.373447341767,450,sag,COMPLETE
9673,0.6449939949776177,2023-10-02 13:06:17.655715,2023-10-02 13:06:18.298835,0 days 00:00:00.643120,99952.82443845685,420,sag,COMPLETE
9674,0.6520362484987444,2023-10-02 13:06:18.298835,2023-10-02 13:06:18.928936,0 days 00:00:00.630101,10354.607476815107,370,sag,COMPLETE
9675,0.5,2023-10-02 13:06:18.928936,2023-10-02 13:06:19.492217,0 days 00:00:00.563281,0.28843313633080164,440,sag,COMPLETE
9676,0.666120755540998,2023-10-02 13:06:19.492217,2023-10-02 13:06:20.148868,0 days 00:00:00.656651,23546.513126073743,490,sag,COMPLETE
9677,0.6590785020198712,2023-10-02 13:06:20.148868,2023-10-02 13:06:20.714553,0 days 00:00:00.565685,45430.66872486648,460,sag,COMPLETE
9678,0.6520362484987444,2023-10-02 13:06:20.714553,2023-10-02 13:06:21.362499,0 days 00:00:00.647946,2050.6159800078026,480,sag,COMPLETE
9679,0.649579648433235,2023-10-02 13:06:21.362499,2023-10-02 13:06:21.937900,0 days 00:00:00.575401,232.50375100958738,490,newton-cg,COMPLETE
9680,0.6552025330276231,2023-10-02 13:06:21.937900,2023-10-02 13:06:22.565834,0 days 00:00:00.627934,16828.69864545695,370,sag,COMPLETE
9681,0.5,2023-10-02 13:06:22.565834,2023-10-02 13:06:23.130367,0 days 00:00:00.564533,0.3343923430429739,480,sag,COMPLETE
9682,0.637951741456491,2023-10-02 13:06:23.130367,2023-10-02 13:06:23.769078,0 days 00:00:00.638711,8500.9298662727,440,sag,COMPLETE
9683,0.6534556174254831,2023-10-02 13:06:23.778628,2023-10-02 13:06:24.354844,0 days 00:00:00.576216,51.49873280371406,500,sag,COMPLETE
9684,0.6449939949776177,2023-10-02 13:06:24.354844,2023-10-02 13:06:24.821340,0 days 00:00:00.466496,30005.343705059713,390,liblinear,COMPLETE
9685,0.5,2023-10-02 13:06:24.821340,2023-10-02 13:06:25.404456,0 days 00:00:00.583116,0.0032258944060934457,490,sag,COMPLETE
9686,0.6520362484987444,2023-10-02 13:06:25.404456,2023-10-02 13:06:26.073741,0 days 00:00:00.669285,48568.49857396385,470,sag,COMPLETE
9687,0.5,2023-10-02 13:06:26.084757,2023-10-02 13:06:27.190437,0 days 00:00:01.105680,2.1704803463151484e-05,450,sag,COMPLETE
9688,0.6369145103177202,2023-10-02 13:06:27.206798,2023-10-02 13:06:27.776591,0 days 00:00:00.569793,22.69385876840073,480,sag,COMPLETE
9689,0.5,2023-10-02 13:06:27.788608,2023-10-02 13:06:28.840327,0 days 00:00:01.051719,2.553824401393761e-05,460,sag,COMPLETE
9690,0.5,2023-10-02 13:06:28.855960,2023-10-02 13:06:29.498859,0 days 00:00:00.642899,0.00012746138564009225,380,sag,COMPLETE
9691,0.5,2023-10-02 13:06:29.498859,2023-10-02 13:06:30.063006,0 days 00:00:00.564147,0.000100070583007141,500,sag,COMPLETE
9692,0.6520362484987444,2023-10-02 13:06:30.063006,2023-10-02 13:06:30.706929,0 days 00:00:00.643923,64165.258760566845,490,sag,COMPLETE
9693,0.5619609127634021,2023-10-02 13:06:30.722557,2023-10-02 13:06:31.302918,0 days 00:00:00.580361,1.0055616064137975,370,sag,COMPLETE
9694,0.5,2023-10-02 13:06:31.302918,2023-10-02 13:06:31.868475,0 days 00:00:00.565557,0.002352469013989987,290,lbfgs,COMPLETE
9695,0.649579648433235,2023-10-02 13:06:31.868475,2023-10-02 13:06:32.527425,0 days 00:00:00.658950,107.74033233122925,430,saga,COMPLETE
9696,0.5,2023-10-02 13:06:32.527425,2023-10-02 13:06:33.467794,0 days 00:00:00.940369,3.449156553549754e-05,460,sag,COMPLETE
9697,0.6069985806310733,2023-10-02 13:06:33.467794,2023-10-02 13:06:34.033184,0 days 00:00:00.565390,4.668886876233143,470,sag,COMPLETE
9698,0.6520362484987444,2023-10-02 13:06:34.033184,2023-10-02 13:06:34.597995,0 days 00:00:00.564811,8132.540917668094,490,sag,COMPLETE
9699,0.6520362484987444,2023-10-02 13:06:34.597995,2023-10-02 13:06:35.223893,0 days 00:00:00.625898,2724.495855398778,390,sag,COMPLETE
9700,0.5,2023-10-02 13:06:35.239525,2023-10-02 13:06:35.829891,0 days 00:00:00.590366,0.0006870455084758945,500,sag,COMPLETE
9701,0.637951741456491,2023-10-02 13:06:35.845519,2023-10-02 13:06:36.494601,0 days 00:00:00.649082,676.9006686755731,450,sag,COMPLETE
9702,0.6520362484987444,2023-10-02 13:06:36.494601,2023-10-02 13:06:37.185240,0 days 00:00:00.690639,15201.636636158062,480,sag,COMPLETE
9703,0.6559122174909924,2023-10-02 13:06:37.185240,2023-10-02 13:06:37.859738,0 days 00:00:00.674498,27503.784231810554,410,sag,COMPLETE
9704,0.6418277104487389,2023-10-02 13:06:37.859738,2023-10-02 13:06:38.487191,0 days 00:00:00.627453,290.29144099032095,470,sag,COMPLETE
9705,0.6590785020198712,2023-10-02 13:06:38.487191,2023-10-02 13:06:39.020899,0 days 00:00:00.533708,64425.460808116564,370,sag,COMPLETE
9706,0.6449939949776177,2023-10-02 13:06:39.020899,2023-10-02 13:06:39.604223,0 days 00:00:00.583324,38480.551736033085,490,newton-cg,COMPLETE
9707,0.5,2023-10-02 13:06:39.604223,2023-10-02 13:06:40.199497,0 days 00:00:00.595274,0.0049045878281298964,500,sag,COMPLETE
9708,0.6590785020198712,2023-10-02 13:06:40.199497,2023-10-02 13:06:40.838924,0 days 00:00:00.639427,18087.557451995624,380,sag,COMPLETE
9709,0.6277432034064855,2023-10-02 13:06:40.838924,2023-10-02 13:06:41.421797,0 days 00:00:00.582873,1009.3591824028847,480,liblinear,COMPLETE
9710,0.6449939949776177,2023-10-02 13:06:41.421797,2023-10-02 13:06:42.102837,0 days 00:00:00.681040,10028.26291831596,460,sag,COMPLETE
9711,0.6020853805000546,2023-10-02 13:06:42.110857,2023-10-02 13:06:42.675485,0 days 00:00:00.564628,1.8185782054171675,420,sag,COMPLETE
9712,0.6520362484987444,2023-10-02 13:06:42.675485,2023-10-02 13:06:43.207988,0 days 00:00:00.532503,27954.729321599872,400,sag,COMPLETE
9713,0.6449939949776177,2023-10-02 13:06:43.207988,2023-10-02 13:06:43.852561,0 days 00:00:00.644573,64388.77991184524,470,sag,COMPLETE
9714,0.6590785020198712,2023-10-02 13:06:43.852561,2023-10-02 13:06:44.510243,0 days 00:00:00.657682,1942.359193808645,440,sag,COMPLETE
9715,0.5,2023-10-02 13:06:44.525886,2023-10-02 13:06:45.092011,0 days 00:00:00.566125,0.03891566406081492,500,sag,COMPLETE
9716,0.619663718746588,2023-10-02 13:06:45.109148,2023-10-02 13:06:45.670875,0 days 00:00:00.561727,9.726543352738208,490,sag,COMPLETE
9717,0.5313352986133857,2023-10-02 13:06:45.670875,2023-10-02 13:06:46.238156,0 days 00:00:00.567281,0.4926161765399061,480,sag,COMPLETE
9718,0.5,2023-10-02 13:06:46.238156,2023-10-02 13:06:46.815262,0 days 00:00:00.577106,0.008411536410460814,450,lbfgs,COMPLETE
9719,0.6418277104487389,2023-10-02 13:06:46.815262,2023-10-02 13:06:47.350725,0 days 00:00:00.535463,430.75587565764494,370,sag,COMPLETE
9720,0.666120755540998,2023-10-02 13:06:47.350725,2023-10-02 13:06:47.993443,0 days 00:00:00.642718,6896.7791633260695,390,sag,COMPLETE
9721,0.5,2023-10-02 13:06:47.993443,2023-10-02 13:06:48.544226,0 days 00:00:00.550783,0.020785578028996516,490,saga,COMPLETE
9722,0.6590785020198712,2023-10-02 13:06:48.544226,2023-10-02 13:06:49.216816,0 days 00:00:00.672590,39725.22067521595,470,sag,COMPLETE
9723,0.5,2023-10-02 13:06:49.216816,2023-10-02 13:06:49.782354,0 days 00:00:00.565538,0.011097699403099586,440,sag,COMPLETE
9724,0.649579648433235,2023-10-02 13:06:49.782354,2023-10-02 13:06:50.408851,0 days 00:00:00.626497,137.39990971512174,500,sag,COMPLETE
9725,0.5,2023-10-02 13:06:50.408851,2023-10-02 13:06:50.879717,0 days 00:00:00.470866,0.169577771776532,430,sag,COMPLETE
9726,0.6449939949776177,2023-10-02 13:06:50.879717,2023-10-02 13:06:51.553086,0 days 00:00:00.673369,13417.65192832823,460,sag,COMPLETE
9727,0.6449939949776177,2023-10-02 13:06:51.553086,2023-10-02 13:06:52.198104,0 days 00:00:00.645018,4605.21167180032,380,sag,COMPLETE
9728,0.5,2023-10-02 13:06:52.198104,2023-10-02 13:06:52.761671,0 days 00:00:00.563567,0.01094893660432214,480,sag,COMPLETE
9729,0.6520362484987444,2023-10-02 13:06:52.777297,2023-10-02 13:06:53.373936,0 days 00:00:00.596639,23126.585911099446,280,sag,COMPLETE
9730,0.6552025330276231,2023-10-02 13:06:53.389573,2023-10-02 13:06:54.047275,0 days 00:00:00.657702,64963.23358876559,490,sag,COMPLETE
9731,0.6449939949776177,2023-10-02 13:06:54.047275,2023-10-02 13:06:54.644710,0 days 00:00:00.597435,98649.89357397995,470,newton-cg,COMPLETE
9732,0.6520362484987444,2023-10-02 13:06:54.644710,2023-10-02 13:06:55.192607,0 days 00:00:00.547897,38112.96376251661,370,sag,COMPLETE
9733,0.666120755540998,2023-10-02 13:06:55.192607,2023-10-02 13:06:55.868209,0 days 00:00:00.675602,15792.090860935814,500,sag,COMPLETE
9734,0.5,2023-10-02 13:06:55.868209,2023-10-02 13:06:56.684475,0 days 00:00:00.816266,4.27331317777272e-05,450,sag,COMPLETE
9735,0.637951741456491,2023-10-02 13:06:56.684475,2023-10-02 13:06:57.359240,0 days 00:00:00.674765,3288.1954054662556,480,sag,COMPLETE
9736,0.6590785020198712,2023-10-02 13:06:57.359240,2023-10-02 13:06:58.016505,0 days 00:00:00.657265,51032.60408451567,460,sag,COMPLETE
9737,0.6337482257888415,2023-10-02 13:06:58.032144,2023-10-02 13:06:58.622397,0 days 00:00:00.590253,15.140523708870674,490,sag,COMPLETE
9738,0.66224478654875,2023-10-02 13:06:58.622397,2023-10-02 13:06:59.286546,0 days 00:00:00.664149,8881.551034206974,400,sag,COMPLETE
9739,0.6411180259853696,2023-10-02 13:06:59.286546,2023-10-02 13:06:59.851699,0 days 00:00:00.565153,24657.245186918364,480,sag,COMPLETE
9740,0.637951741456491,2023-10-02 13:06:59.851699,2023-10-02 13:07:00.448295,0 days 00:00:00.596596,99546.81765203392,500,liblinear,COMPLETE
9741,0.6449939949776177,2023-10-02 13:07:00.448295,2023-10-02 13:07:01.058629,0 days 00:00:00.610334,45572.383179656885,270,sag,COMPLETE
9742,0.6520362484987444,2023-10-02 13:07:01.058629,2023-10-02 13:07:01.742824,0 days 00:00:00.684195,12636.14202799636,490,sag,COMPLETE
9743,0.6369145103177202,2023-10-02 13:07:01.750836,2023-10-02 13:07:02.318563,0 days 00:00:00.567727,23.599809317788665,420,sag,COMPLETE
9744,0.5,2023-10-02 13:07:02.318563,2023-10-02 13:07:02.895252,0 days 00:00:00.576689,0.07179883274569597,370,lbfgs,COMPLETE
9745,0.5,2023-10-02 13:07:02.895252,2023-10-02 13:07:03.471537,0 days 00:00:00.576285,0.012139274423832816,460,sag,COMPLETE
9746,0.5,2023-10-02 13:07:03.471537,2023-10-02 13:07:03.948027,0 days 00:00:00.476490,0.04998764973152945,440,sag,COMPLETE
9747,0.6590785020198712,2023-10-02 13:07:03.961041,2023-10-02 13:07:04.604256,0 days 00:00:00.643215,5103.233162391318,470,sag,COMPLETE
9748,0.5,2023-10-02 13:07:04.604256,2023-10-02 13:07:05.264141,0 days 00:00:00.659885,0.0009084559752754496,480,saga,COMPLETE
9749,0.6481602795064964,2023-10-02 13:07:05.279788,2023-10-02 13:07:05.906115,0 days 00:00:00.626327,24139.014445581914,380,sag,COMPLETE
9750,0.5,2023-10-02 13:07:05.906115,2023-10-02 13:07:06.487991,0 days 00:00:00.581876,0.014521296709192178,490,sag,COMPLETE
9751,0.5,2023-10-02 13:07:06.503616,2023-10-02 13:07:07.073012,0 days 00:00:00.569396,0.24554106807875523,450,sag,COMPLETE
9752,0.666120755540998,2023-10-02 13:07:07.073012,2023-10-02 13:07:07.601591,0 days 00:00:00.528579,99462.87365036637,390,sag,COMPLETE
9753,0.6534556174254831,2023-10-02 13:07:07.601591,2023-10-02 13:07:08.194930,0 days 00:00:00.593339,51.02021074477854,500,sag,COMPLETE
9754,0.6449939949776177,2023-10-02 13:07:08.194930,2023-10-02 13:07:08.872339,0 days 00:00:00.677409,2338.3164726425507,470,sag,COMPLETE
9755,0.6337482257888415,2023-10-02 13:07:08.872339,2023-10-02 13:07:09.436099,0 days 00:00:00.563760,13.680981016275762,430,sag,COMPLETE
9756,0.6520362484987444,2023-10-02 13:07:09.436099,2023-10-02 13:07:10.079936,0 days 00:00:00.643837,7427.856164248875,370,sag,COMPLETE
9757,0.6449939949776177,2023-10-02 13:07:10.079936,2023-10-02 13:07:10.690395,0 days 00:00:00.610459,36167.65318904384,490,newton-cg,COMPLETE
9758,0.666120755540998,2023-10-02 13:07:10.690395,2023-10-02 13:07:11.255972,0 days 00:00:00.565577,18156.58942536101,480,sag,COMPLETE
9759,0.666120755540998,2023-10-02 13:07:11.255972,2023-10-02 13:07:11.937290,0 days 00:00:00.681318,99624.28182556192,500,sag,COMPLETE
9760,0.6449939949776177,2023-10-02 13:07:11.937290,2023-10-02 13:07:12.589609,0 days 00:00:00.652319,921.7484864196465,450,sag,COMPLETE
9761,0.669996724533246,2023-10-02 13:07:12.589609,2023-10-02 13:07:13.247893,0 days 00:00:00.658284,64506.62109755734,460,sag,COMPLETE
9762,0.637951741456491,2023-10-02 13:07:13.247893,2023-10-02 13:07:13.829060,0 days 00:00:00.581167,10939.645988108527,380,liblinear,COMPLETE
9763,0.5,2023-10-02 13:07:13.829060,2023-10-02 13:07:14.423967,0 days 00:00:00.594907,0.000536525660949543,410,sag,COMPLETE
