number,value,datetime_start,datetime_complete,duration,params_C,params_max_iter,params_solver,state
1944,0.5925865269134185,2023-10-02 12:14:37.236989,2023-10-02 12:14:37.399196,0 days 00:00:00.162207,1.374894779738611,490,sag,COMPLETE
1945,0.637951741456491,2023-10-02 12:14:37.400198,2023-10-02 12:14:37.583009,0 days 00:00:00.182811,763.7819496157805,500,sag,COMPLETE
1946,0.6520362484987444,2023-10-02 12:14:37.583009,2023-10-02 12:14:37.768583,0 days 00:00:00.185574,4153.068781027792,490,sag,COMPLETE
1947,0.6534556174254831,2023-10-02 12:14:37.768583,2023-10-02 12:14:37.889750,0 days 00:00:00.121167,68.5232765476381,490,sag,COMPLETE
1948,0.6520362484987444,2023-10-02 12:14:37.890751,2023-10-02 12:14:38.059667,0 days 00:00:00.168916,12829.360736228022,400,sag,COMPLETE
1949,0.5,2023-10-02 12:14:38.060669,2023-10-02 12:14:38.158193,0 days 00:00:00.097524,0.010721770326188691,500,sag,COMPLETE
1950,0.6520362484987444,2023-10-02 12:14:38.159195,2023-10-02 12:14:38.340850,0 days 00:00:00.181655,8325.120705456975,500,sag,COMPLETE
1951,0.5,2023-10-02 12:14:38.341847,2023-10-02 12:14:38.437379,0 days 00:00:00.095532,0.09516644649019827,490,sag,COMPLETE
1952,0.66224478654875,2023-10-02 12:14:38.438379,2023-10-02 12:14:38.621357,0 days 00:00:00.182978,39661.28911083687,490,sag,COMPLETE
1953,0.6520362484987444,2023-10-02 12:14:38.621357,2023-10-02 12:14:38.806331,0 days 00:00:00.184974,5836.837138611339,500,sag,COMPLETE
1954,0.5,2023-10-02 12:14:38.807329,2023-10-02 12:14:38.901938,0 days 00:00:00.094609,0.24375357334886663,480,sag,COMPLETE
1955,0.5,2023-10-02 12:14:38.902941,2023-10-02 12:14:39.063379,0 days 00:00:00.160438,0.10908104730752907,500,sag,COMPLETE
1956,0.5,2023-10-02 12:14:39.064378,2023-10-02 12:14:39.180805,0 days 00:00:00.116427,0.0010225421147602948,490,sag,COMPLETE
1957,0.6520362484987444,2023-10-02 12:14:39.181801,2023-10-02 12:14:39.359217,0 days 00:00:00.177416,2463.3858050227077,480,sag,COMPLETE
1958,0.6590785020198712,2023-10-02 12:14:39.360215,2023-10-02 12:14:39.539453,0 days 00:00:00.179238,17643.15965391178,490,sag,COMPLETE
1959,0.6590785020198712,2023-10-02 12:14:39.540515,2023-10-02 12:14:39.724686,0 days 00:00:00.184171,29001.085102310648,500,sag,COMPLETE
1960,0.637951741456491,2023-10-02 12:14:39.724686,2023-10-02 12:14:39.845089,0 days 00:00:00.120403,9867.242979027365,480,newton-cg,COMPLETE
1961,0.6590785020198712,2023-10-02 12:14:39.845089,2023-10-02 12:14:40.025756,0 days 00:00:00.180667,4251.23109028988,490,sag,COMPLETE
1962,0.5,2023-10-02 12:14:40.026756,2023-10-02 12:14:40.276030,0 days 00:00:00.249274,7.549167914167368e-05,500,sag,COMPLETE
1963,0.637951741456491,2023-10-02 12:14:40.276030,2023-10-02 12:14:40.371408,0 days 00:00:00.095378,7564.846281508677,480,liblinear,COMPLETE
1964,0.6520362484987444,2023-10-02 12:14:40.371408,2023-10-02 12:14:40.555916,0 days 00:00:00.184508,16713.45576040089,490,sag,COMPLETE
1965,0.6590785020198712,2023-10-02 12:14:40.556919,2023-10-02 12:14:40.738534,0 days 00:00:00.181615,1591.5896879867796,500,sag,COMPLETE
1966,0.6590785020198712,2023-10-02 12:14:40.739535,2023-10-02 12:14:40.923912,0 days 00:00:00.184377,3064.645439968933,490,sag,COMPLETE
1967,0.6590785020198712,2023-10-02 12:14:40.924907,2023-10-02 12:14:41.093180,0 days 00:00:00.168273,49259.787053694854,390,sag,COMPLETE
1968,0.6520362484987444,2023-10-02 12:14:41.093180,2023-10-02 12:14:41.343449,0 days 00:00:00.250269,12489.894393772158,480,sag,COMPLETE
1969,0.6534556174254831,2023-10-02 12:14:41.344448,2023-10-02 12:14:41.472080,0 days 00:00:00.127632,94.40438696141743,500,sag,COMPLETE
1970,0.5943334425155585,2023-10-02 12:14:41.473079,2023-10-02 12:14:41.571139,0 days 00:00:00.098060,2.011449364238538,490,sag,COMPLETE
1971,0.5,2023-10-02 12:14:41.572140,2023-10-02 12:14:41.702183,0 days 00:00:00.130043,0.00025360491820504926,480,sag,COMPLETE
1972,0.5,2023-10-02 12:14:41.703185,2023-10-02 12:14:41.809715,0 days 00:00:00.106530,0.0022993194633471707,500,sag,COMPLETE
1973,0.6418277104487389,2023-10-02 12:14:41.810714,2023-10-02 12:14:41.974566,0 days 00:00:00.163852,294.3318700579254,480,sag,COMPLETE
1974,0.6418277104487389,2023-10-02 12:14:41.975576,2023-10-02 12:14:42.162221,0 days 00:00:00.186645,575.1463349652288,490,sag,COMPLETE
1975,0.6590785020198712,2023-10-02 12:14:42.163221,2023-10-02 12:14:42.344384,0 days 00:00:00.181163,28005.858506340264,470,sag,COMPLETE
1976,0.5,2023-10-02 12:14:42.344384,2023-10-02 12:14:42.466945,0 days 00:00:00.122561,0.00044715295108477016,500,sag,COMPLETE
1977,0.6590785020198712,2023-10-02 12:14:42.466945,2023-10-02 12:14:42.650101,0 days 00:00:00.183156,5900.625378633179,490,sag,COMPLETE
1978,0.6590785020198712,2023-10-02 12:14:42.651100,2023-10-02 12:14:42.836645,0 days 00:00:00.185545,9755.000476775176,480,sag,COMPLETE
1979,0.6559122174909924,2023-10-02 12:14:42.836645,2023-10-02 12:14:43.090215,0 days 00:00:00.253570,4673.916250983443,500,sag,COMPLETE
1980,0.6534556174254831,2023-10-02 12:14:43.091214,2023-10-02 12:14:43.208259,0 days 00:00:00.117045,148.05435069500265,490,newton-cg,COMPLETE
1981,0.6520362484987444,2023-10-02 12:14:43.208259,2023-10-02 12:14:43.394309,0 days 00:00:00.186050,22383.41510398123,470,sag,COMPLETE
1982,0.5211267605633803,2023-10-02 12:14:43.394309,2023-10-02 12:14:43.500110,0 days 00:00:00.105801,0.3686897399261204,490,sag,COMPLETE
1983,0.5,2023-10-02 12:14:43.501120,2023-10-02 12:14:43.603198,0 days 00:00:00.102078,1.7827103985818807e-05,500,liblinear,COMPLETE
1984,0.5478764057211486,2023-10-02 12:14:43.604198,2023-10-02 12:14:43.700135,0 days 00:00:00.095937,0.7063981753594242,480,sag,COMPLETE
1985,0.5,2023-10-02 12:14:43.701133,2023-10-02 12:14:43.803225,0 days 00:00:00.102092,0.0045602998869078,500,sag,COMPLETE
1986,0.6457036794409869,2023-10-02 12:14:43.804228,2023-10-02 12:14:43.958025,0 days 00:00:00.153797,194.76501432166486,480,sag,COMPLETE
1987,0.6449939949776177,2023-10-02 12:14:43.959025,2023-10-02 12:14:44.139306,0 days 00:00:00.180281,58341.900993295705,470,sag,COMPLETE
1988,0.6449939949776177,2023-10-02 12:14:44.139306,2023-10-02 12:14:44.323656,0 days 00:00:00.184350,2063.737454614701,490,sag,COMPLETE
1989,0.666120755540998,2023-10-02 12:14:44.324661,2023-10-02 12:14:44.511603,0 days 00:00:00.186942,13298.694418055664,450,sag,COMPLETE
1990,0.6203734032099574,2023-10-02 12:14:44.512603,2023-10-02 12:14:44.626142,0 days 00:00:00.113539,7.489768988765479,500,sag,COMPLETE
1991,0.5,2023-10-02 12:14:44.627142,2023-10-02 12:14:44.726676,0 days 00:00:00.099534,0.01238731026886788,480,sag,COMPLETE
1992,0.5,2023-10-02 12:14:44.727678,2023-10-02 12:14:44.904240,0 days 00:00:00.176562,0.032920452986116275,460,sag,COMPLETE
1993,0.6520362484987444,2023-10-02 12:14:44.905253,2023-10-02 12:14:45.098896,0 days 00:00:00.193643,3841.134553572947,490,sag,COMPLETE
1994,0.6590785020198712,2023-10-02 12:14:45.099897,2023-10-02 12:14:45.291213,0 days 00:00:00.191316,35961.806423028145,500,sag,COMPLETE
1995,0.6520362484987444,2023-10-02 12:14:45.292212,2023-10-02 12:14:45.488906,0 days 00:00:00.196694,7694.996469364914,490,sag,COMPLETE
1996,0.5,2023-10-02 12:14:45.489969,2023-10-02 12:14:45.712124,0 days 00:00:00.222155,8.586935192466812e-05,480,sag,COMPLETE
1997,0.5,2023-10-02 12:14:45.713124,2023-10-02 12:14:45.807899,0 days 00:00:00.094775,0.2392126826664999,470,sag,COMPLETE
1998,0.6449939949776177,2023-10-02 12:14:45.808899,2023-10-02 12:14:45.996864,0 days 00:00:00.187965,995.2836563995454,500,sag,COMPLETE
1999,0.5,2023-10-02 12:14:45.997864,2023-10-02 12:14:46.106384,0 days 00:00:00.108520,0.059772671306744664,490,sag,COMPLETE
2000,0.6059613494923026,2023-10-02 12:14:46.107384,2023-10-02 12:14:46.204003,0 days 00:00:00.096619,1.604524423553731,490,sag,COMPLETE
2001,0.6101648651599519,2023-10-02 12:14:46.205005,2023-10-02 12:14:46.316590,0 days 00:00:00.111585,5.3886100572737625,480,newton-cg,COMPLETE
2002,0.5,2023-10-02 12:14:46.317588,2023-10-02 12:14:46.477736,0 days 00:00:00.160148,0.00018495661569849263,460,sag,COMPLETE
2003,0.637951741456491,2023-10-02 12:14:46.478734,2023-10-02 12:14:46.643847,0 days 00:00:00.165113,16191.498697851139,440,liblinear,COMPLETE
2004,0.6590785020198712,2023-10-02 12:14:46.644849,2023-10-02 12:14:46.815559,0 days 00:00:00.170710,2838.4625247757763,420,sag,COMPLETE
2005,0.6449939949776177,2023-10-02 12:14:46.816563,2023-10-02 12:14:47.004188,0 days 00:00:00.187625,6299.959970370246,500,sag,COMPLETE
2006,0.6520362484987444,2023-10-02 12:14:47.005193,2023-10-02 12:14:47.186454,0 days 00:00:00.181261,10232.649611119916,470,sag,COMPLETE
2007,0.666120755540998,2023-10-02 12:14:47.187454,2023-10-02 12:14:47.372560,0 days 00:00:00.185106,22859.528991311792,490,sag,COMPLETE
2008,0.5,2023-10-02 12:14:47.373627,2023-10-02 12:14:47.472722,0 days 00:00:00.099095,0.026432913494302594,500,sag,COMPLETE
2009,0.6077082650944426,2023-10-02 12:14:47.473718,2023-10-02 12:14:47.573249,0 days 00:00:00.099531,3.963787811115814,480,sag,COMPLETE
2010,0.6449939949776177,2023-10-02 12:14:47.574248,2023-10-02 12:14:47.758156,0 days 00:00:00.183908,68174.920729296,490,sag,COMPLETE
2011,0.6534556174254831,2023-10-02 12:14:47.759156,2023-10-02 12:14:47.885664,0 days 00:00:00.126508,73.91516695625128,500,sag,COMPLETE
2012,0.6590785020198712,2023-10-02 12:14:47.885664,2023-10-02 12:14:48.079397,0 days 00:00:00.193733,4207.280875851801,480,sag,COMPLETE
2013,0.6309094879353642,2023-10-02 12:14:48.080404,2023-10-02 12:14:48.260766,0 days 00:00:00.180362,1404.7708755390408,490,sag,COMPLETE
2014,0.6590785020198712,2023-10-02 12:14:48.261766,2023-10-02 12:14:48.446320,0 days 00:00:00.184554,34881.77747323786,470,sag,COMPLETE
2015,0.6590785020198712,2023-10-02 12:14:48.447317,2023-10-02 12:14:48.633488,0 days 00:00:00.186171,7034.2699556654925,500,sag,COMPLETE
2016,0.6590785020198712,2023-10-02 12:14:48.633488,2023-10-02 12:14:48.883376,0 days 00:00:00.249888,96095.38701415677,490,sag,COMPLETE
2017,0.6520362484987444,2023-10-02 12:14:48.883376,2023-10-02 12:14:49.066972,0 days 00:00:00.183596,15338.700408971989,480,sag,COMPLETE
2018,0.6520362484987444,2023-10-02 12:14:49.066972,2023-10-02 12:14:49.262913,0 days 00:00:00.195941,2061.820546488369,500,sag,COMPLETE
2019,0.5,2023-10-02 12:14:49.263911,2023-10-02 12:14:50.406217,0 days 00:00:01.142306,1.2416160992169419e-05,480,sag,COMPLETE
2020,0.6520362484987444,2023-10-02 12:14:50.407313,2023-10-02 12:14:50.588809,0 days 00:00:00.181496,10301.408102203313,470,sag,COMPLETE
2021,0.5274593296211376,2023-10-02 12:14:50.589880,2023-10-02 12:14:50.698448,0 days 00:00:00.108568,0.551162044289775,490,newton-cg,COMPLETE
2022,0.6520362484987444,2023-10-02 12:14:50.699441,2023-10-02 12:14:50.874426,0 days 00:00:00.174985,3388.8803897608914,450,sag,COMPLETE
2023,0.6013756960366853,2023-10-02 12:14:50.875425,2023-10-02 12:14:50.973951,0 days 00:00:00.098526,2.3681295451915814,500,sag,COMPLETE
2024,0.5,2023-10-02 12:14:50.974949,2023-10-02 12:14:51.071478,0 days 00:00:00.096529,3.1634533309084e-05,490,liblinear,COMPLETE
2025,0.6520362484987444,2023-10-02 12:14:51.072476,2023-10-02 12:14:51.260213,0 days 00:00:00.187737,22764.70639520044,480,sag,COMPLETE
2026,0.6520362484987444,2023-10-02 12:14:51.261212,2023-10-02 12:14:51.445113,0 days 00:00:00.183901,5479.429658620357,500,sag,COMPLETE
2027,0.6449939949776177,2023-10-02 12:14:51.446113,2023-10-02 12:14:51.675253,0 days 00:00:00.229140,757.9665939464015,380,sag,COMPLETE
2028,0.6418277104487389,2023-10-02 12:14:51.676253,2023-10-02 12:14:51.846933,0 days 00:00:00.170680,364.6699964969357,460,sag,COMPLETE
2029,0.6267059722677149,2023-10-02 12:14:51.847928,2023-10-02 12:14:51.956458,0 days 00:00:00.108530,13.321770149832007,490,sag,COMPLETE
2030,0.637951741456491,2023-10-02 12:14:51.957456,2023-10-02 12:14:52.141951,0 days 00:00:00.184495,9580.005835320067,500,sag,COMPLETE
2031,0.643956763838847,2023-10-02 12:14:52.143013,2023-10-02 12:14:52.251715,0 days 00:00:00.108702,25.22544787608989,480,sag,COMPLETE
2032,0.666120755540998,2023-10-02 12:14:52.252709,2023-10-02 12:14:52.433950,0 days 00:00:00.181241,37319.84321074553,470,sag,COMPLETE
2033,0.6520362484987444,2023-10-02 12:14:52.435015,2023-10-02 12:14:52.618458,0 days 00:00:00.183443,18117.876718125994,490,sag,COMPLETE
2034,0.6520362484987444,2023-10-02 12:14:52.619458,2023-10-02 12:14:52.822534,0 days 00:00:00.203076,5568.725078971678,500,sag,COMPLETE
2035,0.5,2023-10-02 12:14:52.823525,2023-10-02 12:14:52.938521,0 days 00:00:00.114996,0.0010016450916034423,480,sag,COMPLETE
2036,0.6520362484987444,2023-10-02 12:14:52.938521,2023-10-02 12:14:53.123052,0 days 00:00:00.184531,3594.851999494075,490,sag,COMPLETE
2037,0.6552025330276231,2023-10-02 12:14:53.124058,2023-10-02 12:14:53.308013,0 days 00:00:00.183955,10490.463601673435,470,sag,COMPLETE
2038,0.649579648433235,2023-10-02 12:14:53.309019,2023-10-02 12:14:53.453662,0 days 00:00:00.144643,141.6288178450333,500,sag,COMPLETE
2039,0.5,2023-10-02 12:14:53.454667,2023-10-02 12:14:53.576209,0 days 00:00:00.121542,0.01770591601768182,490,sag,COMPLETE
2040,0.6520362484987444,2023-10-02 12:14:53.577213,2023-10-02 12:14:53.831747,0 days 00:00:00.254534,25566.572332001324,480,sag,COMPLETE
2041,0.6449939949776177,2023-10-02 12:14:53.832744,2023-10-02 12:14:53.976425,0 days 00:00:00.143681,54853.90913246947,500,newton-cg,COMPLETE
2042,0.6590785020198712,2023-10-02 12:14:53.977437,2023-10-02 12:14:54.178099,0 days 00:00:00.200662,13546.693387229474,490,sag,COMPLETE
2043,0.5,2023-10-02 12:14:54.179098,2023-10-02 12:14:54.290766,0 days 00:00:00.111668,0.001303116404802063,480,sag,COMPLETE
2044,0.6238672344142374,2023-10-02 12:14:54.291766,2023-10-02 12:14:54.391289,0 days 00:00:00.099523,2178.2544333054348,470,liblinear,COMPLETE
2045,0.6520362484987444,2023-10-02 12:14:54.391289,2023-10-02 12:14:54.579141,0 days 00:00:00.187852,99955.41498885369,500,sag,COMPLETE
2046,0.6337482257888415,2023-10-02 12:14:54.581288,2023-10-02 12:14:54.697912,0 days 00:00:00.116624,15.376885992248061,490,sag,COMPLETE
2047,0.5,2023-10-02 12:14:54.698895,2023-10-02 12:14:54.801414,0 days 00:00:00.102519,0.006896533374381431,460,sag,COMPLETE
2048,0.5,2023-10-02 12:14:54.801414,2023-10-02 12:14:54.907959,0 days 00:00:00.106545,0.004693895624545345,480,sag,COMPLETE
2049,0.5,2023-10-02 12:14:54.908955,2023-10-02 12:14:55.009473,0 days 00:00:00.100518,0.13692148267037096,490,sag,COMPLETE
2050,0.6629544710121192,2023-10-02 12:14:55.009473,2023-10-02 12:14:55.204049,0 days 00:00:00.194576,6952.430450061607,500,sag,COMPLETE
2051,0.6520362484987444,2023-10-02 12:14:55.205226,2023-10-02 12:14:55.481159,0 days 00:00:00.275933,3443.830981043157,490,sag,COMPLETE
2052,0.5,2023-10-02 12:14:55.482160,2023-10-02 12:14:55.612808,0 days 00:00:00.130648,0.00038232234240555605,500,sag,COMPLETE
2053,0.5478764057211486,2023-10-02 12:14:55.613805,2023-10-02 12:14:55.715625,0 days 00:00:00.101820,0.7446865932270517,470,sag,COMPLETE
2054,0.6449939949776177,2023-10-02 12:14:55.716625,2023-10-02 12:14:55.912242,0 days 00:00:00.195617,1338.3954569981483,480,sag,COMPLETE
2055,0.6590785020198712,2023-10-02 12:14:55.913244,2023-10-02 12:14:56.107310,0 days 00:00:00.194066,40505.481897054895,500,sag,COMPLETE
2056,0.6520362484987444,2023-10-02 12:14:56.108314,2023-10-02 12:14:56.297315,0 days 00:00:00.189001,15822.4764170263,490,sag,COMPLETE
2057,0.5,2023-10-02 12:14:56.298423,2023-10-02 12:14:56.398980,0 days 00:00:00.100557,0.031706741111851906,480,sag,COMPLETE
2058,0.6590785020198712,2023-10-02 12:14:56.399980,2023-10-02 12:14:56.584794,0 days 00:00:00.184814,7742.891534002714,490,sag,COMPLETE
2059,0.6449939949776177,2023-10-02 12:14:56.586300,2023-10-02 12:14:56.773919,0 days 00:00:00.187619,5142.364118250299,470,sag,COMPLETE
2060,0.6449939949776177,2023-10-02 12:14:56.774927,2023-10-02 12:14:56.967781,0 days 00:00:00.192854,22407.572729793035,500,sag,COMPLETE
2061,0.5,2023-10-02 12:14:56.968783,2023-10-02 12:14:57.086467,0 days 00:00:00.117684,0.0015314159267553705,430,sag,COMPLETE
2062,0.6386614259198603,2023-10-02 12:14:57.087056,2023-10-02 12:14:57.200644,0 days 00:00:00.113588,423.649121739215,450,newton-cg,COMPLETE
2063,0.5,2023-10-02 12:14:57.201644,2023-10-02 12:14:57.327108,0 days 00:00:00.125464,0.0007197419545622542,480,sag,COMPLETE
2064,0.6449939949776177,2023-10-02 12:14:57.328096,2023-10-02 12:14:57.614091,0 days 00:00:00.285995,10282.516981996576,500,sag,COMPLETE
2065,0.6238672344142374,2023-10-02 12:14:57.614091,2023-10-02 12:14:57.714720,0 days 00:00:00.100629,2410.8177068396194,460,liblinear,COMPLETE
2066,0.6203734032099574,2023-10-02 12:14:57.715721,2023-10-02 12:14:57.840336,0 days 00:00:00.124615,7.689388597977605,490,sag,COMPLETE
2067,0.6559122174909924,2023-10-02 12:14:57.841336,2023-10-02 12:14:58.038784,0 days 00:00:00.197448,28383.406838523886,480,sag,COMPLETE
2068,0.6590785020198712,2023-10-02 12:14:58.039784,2023-10-02 12:14:58.229518,0 days 00:00:00.189734,4898.099487544235,440,sag,COMPLETE
2069,0.6520362484987444,2023-10-02 12:14:58.230615,2023-10-02 12:14:58.416746,0 days 00:00:00.186131,12213.373344840267,490,sag,COMPLETE
2070,0.6457036794409869,2023-10-02 12:14:58.417750,2023-10-02 12:14:58.578105,0 days 00:00:00.160355,191.49353864425385,500,sag,COMPLETE
2071,0.528169014084507,2023-10-02 12:14:58.579101,2023-10-02 12:14:58.678352,0 days 00:00:00.099251,0.4150521191178568,470,sag,COMPLETE
2072,0.6552025330276231,2023-10-02 12:14:58.679350,2023-10-02 12:14:58.863718,0 days 00:00:00.184368,50170.53965526333,490,sag,COMPLETE
2073,0.5996287804345454,2023-10-02 12:14:58.864718,2023-10-02 12:14:58.966250,0 days 00:00:00.101532,1.4649571678608164,480,sag,COMPLETE
2074,0.6590785020198712,2023-10-02 12:14:58.966250,2023-10-02 12:14:59.167544,0 days 00:00:00.201294,7228.280467289118,500,sag,COMPLETE
2075,0.6069985806310733,2023-10-02 12:14:59.168537,2023-10-02 12:14:59.279659,0 days 00:00:00.111122,4.392577467251503,490,sag,COMPLETE
2076,0.5,2023-10-02 12:14:59.280670,2023-10-02 12:14:59.448106,0 days 00:00:00.167436,0.25871860120214096,470,sag,COMPLETE
2077,0.666120755540998,2023-10-02 12:14:59.449107,2023-10-02 12:14:59.647250,0 days 00:00:00.198143,3266.7469118809863,500,sag,COMPLETE
2078,0.5,2023-10-02 12:14:59.648255,2023-10-02 12:14:59.770968,0 days 00:00:00.122713,0.002754482748876578,490,sag,COMPLETE
2079,0.6520362484987444,2023-10-02 12:14:59.770968,2023-10-02 12:14:59.958510,0 days 00:00:00.187542,16166.481638728472,480,sag,COMPLETE
2080,0.5,2023-10-02 12:14:59.958510,2023-10-02 12:15:00.115052,0 days 00:00:00.156542,0.00017168707804910061,500,sag,COMPLETE
2081,0.5,2023-10-02 12:15:00.116120,2023-10-02 12:15:00.219196,0 days 00:00:00.103076,0.0932759728332925,480,sag,COMPLETE
2082,0.6457036794409869,2023-10-02 12:15:00.219196,2023-10-02 12:15:00.338284,0 days 00:00:00.119088,300.6231071326541,460,newton-cg,COMPLETE
2083,0.6590785020198712,2023-10-02 12:15:00.339281,2023-10-02 12:15:00.537208,0 days 00:00:00.197927,30466.969886513685,490,sag,COMPLETE
2084,0.6449939949776177,2023-10-02 12:15:00.538214,2023-10-02 12:15:00.765170,0 days 00:00:00.226956,917.2343797901709,500,sag,COMPLETE
2085,0.637951741456491,2023-10-02 12:15:00.766158,2023-10-02 12:15:00.910333,0 days 00:00:00.144175,8844.231294019388,480,liblinear,COMPLETE
2086,0.666120755540998,2023-10-02 12:15:00.911340,2023-10-02 12:15:01.134374,0 days 00:00:00.223034,4868.117749125354,490,sag,COMPLETE
2087,0.6520362484987444,2023-10-02 12:15:01.135376,2023-10-02 12:15:01.405270,0 days 00:00:00.269894,17654.253536814616,470,sag,COMPLETE
2088,0.6520362484987444,2023-10-02 12:15:01.406273,2023-10-02 12:15:01.592318,0 days 00:00:00.186045,2171.771557460023,500,sag,COMPLETE
2089,0.6534556174254831,2023-10-02 12:15:01.593319,2023-10-02 12:15:01.715289,0 days 00:00:00.121970,56.33693847116023,490,sag,COMPLETE
2090,0.6449939949776177,2023-10-02 12:15:01.716290,2023-10-02 12:15:01.909546,0 days 00:00:00.193256,1347.162615684521,480,sag,COMPLETE
2091,0.6520362484987444,2023-10-02 12:15:01.910605,2023-10-02 12:15:02.110556,0 days 00:00:00.199951,6741.646395012539,500,sag,COMPLETE
2092,0.6590785020198712,2023-10-02 12:15:02.111603,2023-10-02 12:15:02.296719,0 days 00:00:00.185116,55642.0429315014,470,sag,COMPLETE
2093,0.6520362484987444,2023-10-02 12:15:02.297719,2023-10-02 12:15:02.469036,0 days 00:00:00.171317,11372.99667712134,360,sag,COMPLETE
2094,0.5,2023-10-02 12:15:02.470041,2023-10-02 12:15:02.820109,0 days 00:00:00.350068,4.65580737520876e-05,490,sag,COMPLETE
2095,0.6520362484987444,2023-10-02 12:15:02.821109,2023-10-02 12:15:03.068916,0 days 00:00:00.247807,3547.044595957315,460,sag,COMPLETE
2096,0.6369145103177202,2023-10-02 12:15:03.069915,2023-10-02 12:15:03.182196,0 days 00:00:00.112281,22.443998209967297,480,sag,COMPLETE
2097,0.6418277104487389,2023-10-02 12:15:03.183196,2023-10-02 12:15:03.380291,0 days 00:00:00.197095,486.8418654197798,500,sag,COMPLETE
2098,0.6590785020198712,2023-10-02 12:15:03.380291,2023-10-02 12:15:03.580520,0 days 00:00:00.200229,19004.457662457808,490,sag,COMPLETE
2099,0.6590785020198712,2023-10-02 12:15:03.581517,2023-10-02 12:15:03.782112,0 days 00:00:00.200595,33589.54411046039,500,sag,COMPLETE
2100,0.5,2023-10-02 12:15:03.782112,2023-10-02 12:15:03.893648,0 days 00:00:00.111536,0.0157896048100282,400,sag,COMPLETE
2101,0.5,2023-10-02 12:15:03.894646,2023-10-02 12:15:03.997171,0 days 00:00:00.102525,0.06615534278923908,480,sag,COMPLETE
2102,0.6590785020198712,2023-10-02 12:15:03.997171,2023-10-02 12:15:04.201359,0 days 00:00:00.204188,6822.169341383209,490,sag,COMPLETE
2103,0.637951741456491,2023-10-02 12:15:04.202358,2023-10-02 12:15:04.387883,0 days 00:00:00.185525,11731.236198487595,470,newton-cg,COMPLETE
2104,0.666120755540998,2023-10-02 12:15:04.388883,2023-10-02 12:15:04.579804,0 days 00:00:00.190921,1934.3666911277135,490,sag,COMPLETE
2105,0.6534556174254831,2023-10-02 12:15:04.579804,2023-10-02 12:15:04.713249,0 days 00:00:00.133445,101.88233877004599,500,sag,COMPLETE
2106,0.6309094879353642,2023-10-02 12:15:04.714250,2023-10-02 12:15:04.815938,0 days 00:00:00.101688,4197.374138603987,480,liblinear,COMPLETE
