number,value,datetime_start,datetime_complete,duration,params_C,params_max_iter,params_solver,state
4385,0.5408341522000218,2023-10-02 12:24:25.747378,2023-10-02 12:24:26.047586,0 days 00:00:00.300208,0.6539727563364317,370,sag,COMPLETE
4386,0.6629544710121192,2023-10-02 12:24:26.049095,2023-10-02 12:24:26.325362,0 days 00:00:00.276267,3803.6437649006302,350,sag,COMPLETE
4387,0.6629544710121192,2023-10-02 12:24:26.327037,2023-10-02 12:24:26.598471,0 days 00:00:00.271434,8331.483431904033,380,sag,COMPLETE
4388,0.6062888961677039,2023-10-02 12:24:26.598471,2023-10-02 12:24:26.899961,0 days 00:00:00.301490,5.994006669033128,360,sag,COMPLETE
4389,0.666120755540998,2023-10-02 12:24:26.900960,2023-10-02 12:24:27.177277,0 days 00:00:00.276317,4092.395091248159,360,sag,COMPLETE
4390,0.6520362484987444,2023-10-02 12:24:27.177277,2023-10-02 12:24:27.460831,0 days 00:00:00.283554,9518.093676074912,350,sag,COMPLETE
4391,0.6457036794409869,2023-10-02 12:24:27.461845,2023-10-02 12:24:27.798288,0 days 00:00:00.336443,241.34558655951435,370,sag,COMPLETE
4392,0.5690031662845288,2023-10-02 12:24:27.799288,2023-10-02 12:24:28.006273,0 days 00:00:00.206985,1.0569516432508879,370,sag,COMPLETE
4393,0.6520362484987444,2023-10-02 12:24:28.006273,2023-10-02 12:24:28.273515,0 days 00:00:00.267242,5076.306770873635,360,sag,COMPLETE
4394,0.6488699639698657,2023-10-02 12:24:28.273515,2023-10-02 12:24:28.602706,0 days 00:00:00.329191,1743.124347503145,360,sag,COMPLETE
4395,0.6590785020198712,2023-10-02 12:24:28.602706,2023-10-02 12:24:28.885454,0 days 00:00:00.282748,66966.25888722218,350,sag,COMPLETE
4396,0.6449939949776177,2023-10-02 12:24:28.885454,2023-10-02 12:24:29.136364,0 days 00:00:00.250910,99481.04403466938,330,sag,COMPLETE
4397,0.5,2023-10-02 12:24:29.136364,2023-10-02 12:24:29.623175,0 days 00:00:00.486811,6.283021293709156e-05,370,sag,COMPLETE
4398,0.5,2023-10-02 12:24:29.623175,2023-10-02 12:24:30.876158,0 days 00:00:01.252983,1.2286107384902496e-05,360,sag,COMPLETE
4399,0.6520362484987444,2023-10-02 12:24:30.876158,2023-10-02 12:24:31.158620,0 days 00:00:00.282462,11048.810283897676,350,sag,COMPLETE
4400,0.6418277104487389,2023-10-02 12:24:31.158620,2023-10-02 12:24:31.558015,0 days 00:00:00.399395,336.7031384178634,370,sag,COMPLETE
4401,0.6590785020198712,2023-10-02 12:24:31.558015,2023-10-02 12:24:31.927154,0 days 00:00:00.369139,2345.17647523459,350,sag,COMPLETE
4402,0.6309094879353642,2023-10-02 12:24:31.942784,2023-10-02 12:24:32.209689,0 days 00:00:00.266905,558.4668534307748,370,sag,COMPLETE
4403,0.5,2023-10-02 12:24:32.209689,2023-10-02 12:24:32.507991,0 days 00:00:00.298302,0.006608909944892078,370,sag,COMPLETE
4404,0.5,2023-10-02 12:24:32.507991,2023-10-02 12:24:32.712037,0 days 00:00:00.204046,0.17735922445246366,360,sag,COMPLETE
4405,0.5,2023-10-02 12:24:32.712037,2023-10-02 12:24:32.947265,0 days 00:00:00.235228,0.0010608985572568908,360,sag,COMPLETE
4406,0.6481602795064964,2023-10-02 12:24:32.947265,2023-10-02 12:24:33.307949,0 days 00:00:00.360684,47463.01902241439,380,sag,COMPLETE
4407,0.6590785020198712,2023-10-02 12:24:33.307949,2023-10-02 12:24:33.590479,0 days 00:00:00.282530,98517.14672084889,370,sag,COMPLETE
4408,0.6590785020198712,2023-10-02 12:24:33.590479,2023-10-02 12:24:33.841550,0 days 00:00:00.251071,46581.664356466754,350,sag,COMPLETE
4409,0.6534556174254831,2023-10-02 12:24:33.856967,2023-10-02 12:24:34.186152,0 days 00:00:00.329185,79.22398709065664,340,sag,COMPLETE
4410,0.5,2023-10-02 12:24:34.187144,2023-10-02 12:24:34.390389,0 days 00:00:00.203245,0.3022291687659611,360,sag,COMPLETE
4411,0.643956763838847,2023-10-02 12:24:34.391390,2023-10-02 12:24:34.622890,0 days 00:00:00.231500,25.50562874755767,360,sag,COMPLETE
4412,0.5,2023-10-02 12:24:34.624887,2023-10-02 12:24:34.909160,0 days 00:00:00.284273,0.03807391856116894,350,sag,COMPLETE
4413,0.6520362484987444,2023-10-02 12:24:34.911160,2023-10-02 12:24:35.192257,0 days 00:00:00.281097,6058.08453365165,390,sag,COMPLETE
4414,0.6013756960366853,2023-10-02 12:24:35.192257,2023-10-02 12:24:35.395792,0 days 00:00:00.203535,2.237528199985931,370,sag,COMPLETE
4415,0.5,2023-10-02 12:24:35.395792,2023-10-02 12:24:35.694490,0 days 00:00:00.298698,0.0024604384015351265,340,sag,COMPLETE
4416,0.6590785020198712,2023-10-02 12:24:35.694490,2023-10-02 12:24:35.965808,0 days 00:00:00.271318,31755.05469403118,350,sag,COMPLETE
4417,0.6590785020198712,2023-10-02 12:24:35.976821,2023-10-02 12:24:36.322429,0 days 00:00:00.345608,11559.338069105333,380,sag,COMPLETE
4418,0.5,2023-10-02 12:24:36.322429,2023-10-02 12:24:36.526446,0 days 00:00:00.204017,0.005808118701002433,360,sag,COMPLETE
4419,0.6337482257888415,2023-10-02 12:24:36.526446,2023-10-02 12:24:36.746423,0 days 00:00:00.219977,15.240496662329484,350,sag,COMPLETE
4420,0.5,2023-10-02 12:24:36.746423,2023-10-02 12:24:37.029528,0 days 00:00:00.283105,0.05115580716927768,380,sag,COMPLETE
4421,0.669996724533246,2023-10-02 12:24:37.045176,2023-10-02 12:24:37.312565,0 days 00:00:00.267389,66355.3622073333,350,sag,COMPLETE
4422,0.6552025330276231,2023-10-02 12:24:37.312565,2023-10-02 12:24:37.595419,0 days 00:00:00.282854,63355.2578468832,360,sag,COMPLETE
4423,0.6481602795064964,2023-10-02 12:24:37.595419,2023-10-02 12:24:37.956510,0 days 00:00:00.361091,66825.00646425245,350,sag,COMPLETE
4424,0.6520362484987444,2023-10-02 12:24:37.958546,2023-10-02 12:24:38.241404,0 days 00:00:00.282858,71283.31579121579,350,sag,COMPLETE
4425,0.6552025330276231,2023-10-02 12:24:38.241404,2023-10-02 12:24:38.523926,0 days 00:00:00.282522,98750.91310854783,360,sag,COMPLETE
4426,0.6559122174909924,2023-10-02 12:24:38.523926,2023-10-02 12:24:38.871460,0 days 00:00:00.347534,65098.63137436634,360,sag,COMPLETE
4427,0.5,2023-10-02 12:24:38.884480,2023-10-02 12:24:40.328305,0 days 00:00:01.443825,1.0319916036045697e-05,360,sag,COMPLETE
4428,0.6203734032099574,2023-10-02 12:24:40.328305,2023-10-02 12:24:40.626766,0 days 00:00:00.298461,7.683726196349837,360,sag,COMPLETE
4429,0.5,2023-10-02 12:24:40.626766,2023-10-02 12:24:40.875245,0 days 00:00:00.248479,0.00035697299934986127,350,sag,COMPLETE
4430,0.6481602795064964,2023-10-02 12:24:40.875245,2023-10-02 12:24:41.129601,0 days 00:00:00.254356,70280.00109666704,340,sag,COMPLETE
4431,0.6411180259853696,2023-10-02 12:24:41.129601,2023-10-02 12:24:41.520796,0 days 00:00:00.391195,46037.53597630558,380,sag,COMPLETE
4432,0.6534556174254831,2023-10-02 12:24:41.522809,2023-10-02 12:24:41.760889,0 days 00:00:00.238080,61.623309799512235,340,sag,COMPLETE
4433,0.6590785020198712,2023-10-02 12:24:41.762896,2023-10-02 12:24:42.029788,0 days 00:00:00.266892,97854.04539444954,350,sag,COMPLETE
4434,0.6520362484987444,2023-10-02 12:24:42.030787,2023-10-02 12:24:42.384159,0 days 00:00:00.353372,47259.7761642005,340,sag,COMPLETE
4435,0.6520362484987444,2023-10-02 12:24:42.384159,2023-10-02 12:24:42.670887,0 days 00:00:00.286728,1056.9020154395753,370,sag,COMPLETE
4436,0.5,2023-10-02 12:24:42.672887,2023-10-02 12:24:43.108124,0 days 00:00:00.435237,4.7946311838598575e-05,340,sag,COMPLETE
4437,0.528169014084507,2023-10-02 12:24:43.108124,2023-10-02 12:24:43.419135,0 days 00:00:00.311011,0.4468256417700255,350,sag,COMPLETE
4438,0.6369145103177202,2023-10-02 12:24:43.421131,2023-10-02 12:24:43.649138,0 days 00:00:00.228007,20.85353613998879,350,sag,COMPLETE
4439,0.608417949557812,2023-10-02 12:24:43.650656,2023-10-02 12:24:43.935030,0 days 00:00:00.284374,2.618573164897954,370,sag,COMPLETE
4440,0.6520362484987444,2023-10-02 12:24:43.935030,2023-10-02 12:24:44.236192,0 days 00:00:00.301162,4131.378558639502,350,sag,COMPLETE
4441,0.6520362484987444,2023-10-02 12:24:44.237186,2023-10-02 12:24:44.568770,0 days 00:00:00.331584,2038.2898985375246,350,sag,COMPLETE
4442,0.6520362484987444,2023-10-02 12:24:44.570764,2023-10-02 12:24:44.951170,0 days 00:00:00.380406,67085.16581151492,360,sag,COMPLETE
4443,0.666120755540998,2023-10-02 12:24:44.953180,2023-10-02 12:24:45.218357,0 days 00:00:00.265177,41873.25763895585,360,sag,COMPLETE
4444,0.6520362484987444,2023-10-02 12:24:45.218357,2023-10-02 12:24:45.617453,0 days 00:00:00.399096,6687.57077484004,350,sag,COMPLETE
4445,0.5,2023-10-02 12:24:45.619179,2023-10-02 12:24:45.951468,0 days 00:00:00.332289,0.0036932875891608308,370,sag,COMPLETE
4446,0.6629544710121192,2023-10-02 12:24:45.952614,2023-10-02 12:24:46.231326,0 days 00:00:00.278712,65882.37470053672,370,sag,COMPLETE
4447,0.6520362484987444,2023-10-02 12:24:46.232326,2023-10-02 12:24:46.518979,0 days 00:00:00.286653,99103.66018625755,340,sag,COMPLETE
4448,0.6520362484987444,2023-10-02 12:24:46.534618,2023-10-02 12:24:46.890028,0 days 00:00:00.355410,97382.67507156034,360,sag,COMPLETE
4449,0.5,2023-10-02 12:24:46.890028,2023-10-02 12:24:47.117108,0 days 00:00:00.227080,0.20754200619189236,360,sag,COMPLETE
4450,0.6457036794409869,2023-10-02 12:24:47.118764,2023-10-02 12:24:47.407590,0 days 00:00:00.288826,277.2533175284163,360,sag,COMPLETE
4451,0.6520362484987444,2023-10-02 12:24:47.409589,2023-10-02 12:24:47.754303,0 days 00:00:00.344714,30523.11379851796,350,sag,COMPLETE
4452,0.669996724533246,2023-10-02 12:24:47.756309,2023-10-02 12:24:48.022305,0 days 00:00:00.265996,41874.432232572515,340,sag,COMPLETE
4453,0.5,2023-10-02 12:24:48.024299,2023-10-02 12:24:48.310717,0 days 00:00:00.286418,0.009272819056576386,340,sag,COMPLETE
4454,0.5,2023-10-02 12:24:48.312716,2023-10-02 12:24:48.519280,0 days 00:00:00.206564,0.10712230322006644,350,sag,COMPLETE
4455,0.6457036794409869,2023-10-02 12:24:48.519280,2023-10-02 12:24:48.786074,0 days 00:00:00.266794,170.35673200003967,330,sag,COMPLETE
4456,0.6590785020198712,2023-10-02 12:24:48.786074,2023-10-02 12:24:49.145658,0 days 00:00:00.359584,65665.72942711845,340,sag,COMPLETE
4457,0.6520362484987444,2023-10-02 12:24:49.146665,2023-10-02 12:24:49.413598,0 days 00:00:00.266933,42275.55744809765,350,sag,COMPLETE
4458,0.5,2023-10-02 12:24:49.429230,2023-10-02 12:24:49.727445,0 days 00:00:00.298215,0.00011596143760673676,340,sag,COMPLETE
4459,0.6449939949776177,2023-10-02 12:24:49.727445,2023-10-02 12:24:50.072499,0 days 00:00:00.345054,52045.764773786665,340,sag,COMPLETE
4460,0.666120755540998,2023-10-02 12:24:50.072499,2023-10-02 12:24:50.339701,0 days 00:00:00.267202,68268.82652600353,350,sag,COMPLETE
4461,0.6590785020198712,2023-10-02 12:24:50.339701,2023-10-02 12:24:50.606816,0 days 00:00:00.267115,99859.16500112403,340,sag,COMPLETE
4462,0.5,2023-10-02 12:24:50.606816,2023-10-02 12:24:50.951672,0 days 00:00:00.344856,0.0001599187846283226,330,sag,COMPLETE
4463,0.5996287804345454,2023-10-02 12:24:50.951672,2023-10-02 12:24:51.156238,0 days 00:00:00.204566,1.4543284474550766,350,sag,COMPLETE
4464,0.634075772464243,2023-10-02 12:24:51.171957,2023-10-02 12:24:51.533530,0 days 00:00:00.361573,44610.63353207605,340,sag,COMPLETE
4465,0.6449939949776177,2023-10-02 12:24:51.533530,2023-10-02 12:24:51.816018,0 days 00:00:00.282488,3062.265267916478,330,sag,COMPLETE
4466,0.5,2023-10-02 12:24:51.816018,2023-10-02 12:24:52.035614,0 days 00:00:00.219596,0.10526626606997923,340,sag,COMPLETE
4467,0.5,2023-10-02 12:24:52.035614,2023-10-02 12:24:52.318163,0 days 00:00:00.282549,0.015588517406204273,340,sag,COMPLETE
4468,0.5,2023-10-02 12:24:52.318163,2023-10-02 12:24:52.536987,0 days 00:00:00.218824,0.001618907790437725,340,sag,COMPLETE
4469,0.6629544710121192,2023-10-02 12:24:52.536987,2023-10-02 12:24:52.804168,0 days 00:00:00.267181,45511.68545943807,330,sag,COMPLETE
4470,0.5,2023-10-02 12:24:52.804168,2023-10-02 12:24:53.091526,0 days 00:00:00.287358,0.017017257607131943,330,sag,COMPLETE
4471,0.6520362484987444,2023-10-02 12:24:53.102578,2023-10-02 12:24:53.368917,0 days 00:00:00.266339,99298.73663037714,350,sag,COMPLETE
4472,0.6520362484987444,2023-10-02 12:24:53.368917,2023-10-02 12:24:53.636079,0 days 00:00:00.267162,32779.40104396596,350,sag,COMPLETE
4473,0.5619609127634021,2023-10-02 12:24:53.636079,2023-10-02 12:24:53.918634,0 days 00:00:00.282555,0.8723618356986956,340,sag,COMPLETE
4474,0.6457036794409869,2023-10-02 12:24:53.918634,2023-10-02 12:24:54.169664,0 days 00:00:00.251030,166.7261070712255,340,sag,COMPLETE
4475,0.6006660115733159,2023-10-02 12:24:54.169664,2023-10-02 12:24:54.468047,0 days 00:00:00.298383,3.362394646273649,330,sag,COMPLETE
4476,0.5478764057211486,2023-10-02 12:24:54.468047,2023-10-02 12:24:54.696457,0 days 00:00:00.228410,0.7418119413586645,350,sag,COMPLETE
4477,0.6411180259853696,2023-10-02 12:24:54.696457,2023-10-02 12:24:54.970529,0 days 00:00:00.274072,98444.3246253802,340,sag,COMPLETE
4478,0.6534556174254831,2023-10-02 12:24:54.970529,2023-10-02 12:24:55.300407,0 days 00:00:00.329878,121.67180385303557,350,sag,COMPLETE
4479,0.66224478654875,2023-10-02 12:24:55.300407,2023-10-02 12:24:55.582690,0 days 00:00:00.282283,53360.578698127494,330,sag,COMPLETE
4480,0.6590785020198712,2023-10-02 12:24:55.582690,2023-10-02 12:24:55.849614,0 days 00:00:00.266924,26973.54625273604,340,sag,COMPLETE
4481,0.6449939949776177,2023-10-02 12:24:55.849614,2023-10-02 12:24:56.194980,0 days 00:00:00.345366,910.0424424828009,340,sag,COMPLETE
4482,0.5,2023-10-02 12:24:56.200536,2023-10-02 12:24:56.417827,0 days 00:00:00.217291,0.16399569230912026,360,sag,COMPLETE
4483,0.5,2023-10-02 12:24:56.419826,2023-10-02 12:24:56.657093,0 days 00:00:00.237267,0.004420228720743446,350,sag,COMPLETE
4484,0.5,2023-10-02 12:24:56.659122,2023-10-02 12:24:56.976000,0 days 00:00:00.316878,0.0014382693728981146,330,sag,COMPLETE
4485,0.6133311496888305,2023-10-02 12:24:56.978004,2023-10-02 12:24:57.206696,0 days 00:00:00.228692,7.15683214002578,360,sag,COMPLETE
4486,0.5,2023-10-02 12:24:57.206696,2023-10-02 12:24:57.432920,0 days 00:00:00.226224,0.009647366013045368,330,sag,COMPLETE
4487,0.5,2023-10-02 12:24:57.434919,2023-10-02 12:24:57.913111,0 days 00:00:00.478192,6.430857930012318e-05,360,sag,COMPLETE
4488,0.6590785020198712,2023-10-02 12:24:57.913111,2023-10-02 12:24:58.195246,0 days 00:00:00.282135,66873.90634271373,360,sag,COMPLETE
4489,0.5,2023-10-02 12:24:58.195246,2023-10-02 12:24:58.539011,0 days 00:00:00.343765,0.00027745247845594573,350,sag,COMPLETE
4490,0.666120755540998,2023-10-02 12:24:58.540920,2023-10-02 12:24:58.824412,0 days 00:00:00.283492,36554.732368079116,350,sag,COMPLETE
4491,0.6502893328966044,2023-10-02 12:24:58.825408,2023-10-02 12:24:59.045133,0 days 00:00:00.219725,36.42607453873996,350,sag,COMPLETE
4492,0.6552025330276231,2023-10-02 12:24:59.056698,2023-10-02 12:24:59.415983,0 days 00:00:00.359285,4250.912802458786,340,sag,COMPLETE
4493,0.637951741456491,2023-10-02 12:24:59.416990,2023-10-02 12:24:59.673594,0 days 00:00:00.256604,527.8316059204054,350,sag,COMPLETE
4494,0.5,2023-10-02 12:24:59.690343,2023-10-02 12:24:59.892841,0 days 00:00:00.202498,0.12856333157731056,360,sag,COMPLETE
4495,0.6270335189431162,2023-10-02 12:24:59.892841,2023-10-02 12:25:00.282923,0 days 00:00:00.390082,23022.6494323265,330,sag,COMPLETE
4496,0.6449939949776177,2023-10-02 12:25:00.283922,2023-10-02 12:25:00.554794,0 days 00:00:00.270872,2120.604353313275,340,sag,COMPLETE
4497,0.66224478654875,2023-10-02 12:25:00.556801,2023-10-02 12:25:00.903973,0 days 00:00:00.347172,49803.67542931917,350,sag,COMPLETE
4498,0.5,2023-10-02 12:25:00.903973,2023-10-02 12:25:01.229393,0 days 00:00:00.325420,0.0005575700075013416,340,sag,COMPLETE
4499,0.666120755540998,2023-10-02 12:25:01.230393,2023-10-02 12:25:01.504480,0 days 00:00:00.274087,20530.910876047306,350,sag,COMPLETE
4500,0.6590785020198712,2023-10-02 12:25:01.504480,2023-10-02 12:25:01.863790,0 days 00:00:00.359310,8140.2107714203385,360,sag,COMPLETE
4501,0.5,2023-10-02 12:25:01.863790,2023-10-02 12:25:02.098839,0 days 00:00:00.235049,0.04660156171402911,360,sag,COMPLETE
4502,0.5,2023-10-02 12:25:02.098839,2023-10-02 12:25:02.318841,0 days 00:00:00.220002,0.05710156933379962,340,sag,COMPLETE
4503,0.6520362484987444,2023-10-02 12:25:02.318841,2023-10-02 12:25:02.664265,0 days 00:00:00.345424,69091.983020171,340,sag,COMPLETE
4504,0.6590785020198712,2023-10-02 12:25:02.664265,2023-10-02 12:25:02.947101,0 days 00:00:00.282836,32900.9525767885,370,sag,COMPLETE
4505,0.5,2023-10-02 12:25:02.947101,2023-10-02 12:25:03.496378,0 days 00:00:00.549277,3.6986654880913e-05,360,sag,COMPLETE
4506,0.5,2023-10-02 12:25:03.496378,2023-10-02 12:25:03.810376,0 days 00:00:00.313998,0.0008289004556029497,360,sag,COMPLETE
4507,0.6077082650944426,2023-10-02 12:25:03.810376,2023-10-02 12:25:04.042556,0 days 00:00:00.232180,3.6809617715488576,350,sag,COMPLETE
4508,0.6590785020198712,2023-10-02 12:25:04.043561,2023-10-02 12:25:04.322187,0 days 00:00:00.278626,99695.45962142217,330,sag,COMPLETE
4509,0.6559122174909924,2023-10-02 12:25:04.324183,2023-10-02 12:25:04.687113,0 days 00:00:00.362930,5267.7718630163445,370,sag,COMPLETE
4510,0.6590785020198712,2023-10-02 12:25:04.689107,2023-10-02 12:25:04.953700,0 days 00:00:00.264593,12611.102050202511,340,sag,COMPLETE
4511,0.5,2023-10-02 12:25:04.953700,2023-10-02 12:25:05.252020,0 days 00:00:00.298320,0.2663029959727037,350,sag,COMPLETE
4512,0.6590785020198712,2023-10-02 12:25:05.252020,2023-10-02 12:25:05.534575,0 days 00:00:00.282555,99160.90956129895,350,sag,COMPLETE
4513,0.5,2023-10-02 12:25:05.534575,2023-10-02 12:25:05.784939,0 days 00:00:00.250364,0.00038949870635716336,370,sag,COMPLETE
4514,0.6559122174909924,2023-10-02 12:25:05.784939,2023-10-02 12:25:06.146042,0 days 00:00:00.361103,1425.582222653576,370,sag,COMPLETE
4515,0.6590785020198712,2023-10-02 12:25:06.146042,2023-10-02 12:25:06.460943,0 days 00:00:00.314901,45934.79428570426,320,sag,COMPLETE
4516,0.637951741456491,2023-10-02 12:25:06.460943,2023-10-02 12:25:06.760308,0 days 00:00:00.299365,2907.7958919927833,340,sag,COMPLETE
4517,0.6520362484987444,2023-10-02 12:25:06.762347,2023-10-02 12:25:07.128677,0 days 00:00:00.366330,22876.598869536203,360,sag,COMPLETE
4518,0.6411180259853696,2023-10-02 12:25:07.130677,2023-10-02 12:25:07.407614,0 days 00:00:00.276937,8409.925290317156,330,sag,COMPLETE
4519,0.528169014084507,2023-10-02 12:25:07.409620,2023-10-02 12:25:07.626007,0 days 00:00:00.216387,0.43479052718628014,360,sag,COMPLETE
4520,0.6534556174254831,2023-10-02 12:25:07.626782,2023-10-02 12:25:08.066809,0 days 00:00:00.440027,102.63561228061198,360,sag,COMPLETE
4521,0.5,2023-10-02 12:25:08.068805,2023-10-02 12:25:08.358590,0 days 00:00:00.289785,0.03189651856882309,340,sag,COMPLETE
4522,0.6369145103177202,2023-10-02 12:25:08.360588,2023-10-02 12:25:08.645083,0 days 00:00:00.284495,18.92782276141986,350,sag,COMPLETE
4523,0.666120755540998,2023-10-02 12:25:08.645083,2023-10-02 12:25:09.043567,0 days 00:00:00.398484,48751.168909296925,350,sag,COMPLETE
4524,0.6590785020198712,2023-10-02 12:25:09.046570,2023-10-02 12:25:09.364226,0 days 00:00:00.317656,16728.458883112984,330,sag,COMPLETE
4525,0.6013756960366853,2023-10-02 12:25:09.365223,2023-10-02 12:25:09.678911,0 days 00:00:00.313688,2.521299604117481,360,sag,COMPLETE
4526,0.6520362484987444,2023-10-02 12:25:09.678911,2023-10-02 12:25:09.987803,0 days 00:00:00.308892,32220.579979869286,370,sag,COMPLETE
4527,0.5,2023-10-02 12:25:09.988803,2023-10-02 12:25:10.266886,0 days 00:00:00.278083,0.07897503090727595,350,sag,COMPLETE
4528,0.5,2023-10-02 12:25:10.268886,2023-10-02 12:25:10.727470,0 days 00:00:00.458584,0.00016238664990176824,330,sag,COMPLETE
4529,0.5957528114422973,2023-10-02 12:25:10.730473,2023-10-02 12:25:10.994896,0 days 00:00:00.264423,1.5018352277421534,340,sag,COMPLETE
4530,0.637951741456491,2023-10-02 12:25:10.996372,2023-10-02 12:25:11.316408,0 days 00:00:00.320036,716.7067549278854,370,sag,COMPLETE
4531,0.6520362484987444,2023-10-02 12:25:11.316408,2023-10-02 12:25:11.703660,0 days 00:00:00.387252,4835.603659690379,360,sag,COMPLETE
4532,0.5,2023-10-02 12:25:11.705659,2023-10-02 12:25:12.972914,0 days 00:00:01.267255,1.477668000445196e-05,350,sag,COMPLETE
4533,0.5,2023-10-02 12:25:12.973912,2023-10-02 12:25:13.380611,0 days 00:00:00.406699,9.181390106880044e-05,500,sag,COMPLETE
4534,0.6418277104487389,2023-10-02 12:25:13.381613,2023-10-02 12:25:13.749021,0 days 00:00:00.367408,301.96308273560044,350,sag,COMPLETE
4535,0.6573315864177312,2023-10-02 12:25:13.751021,2023-10-02 12:25:13.988383,0 days 00:00:00.237362,36.980737149901664,370,sag,COMPLETE
4536,0.5,2023-10-02 12:25:13.990375,2023-10-02 12:25:14.295380,0 days 00:00:00.305005,0.01159489381809003,340,sag,COMPLETE
4537,0.6590785020198712,2023-10-02 12:25:14.296510,2023-10-02 12:25:14.563174,0 days 00:00:00.266664,58954.43390108599,360,sag,COMPLETE
4538,0.6590785020198712,2023-10-02 12:25:14.563174,2023-10-02 12:25:14.845601,0 days 00:00:00.282427,13257.225741272005,320,sag,COMPLETE
4539,0.5,2023-10-02 12:25:14.846718,2023-10-02 12:25:15.146842,0 days 00:00:00.300124,0.0018737674395047329,330,sag,COMPLETE
4540,0.6520362484987444,2023-10-02 12:25:15.146842,2023-10-02 12:25:15.430722,0 days 00:00:00.283880,31381.569730865744,370,sag,COMPLETE
4541,0.634075772464243,2023-10-02 12:25:15.446238,2023-10-02 12:25:15.729048,0 days 00:00:00.282810,63640.801142862736,350,sag,COMPLETE
4542,0.6590785020198712,2023-10-02 12:25:15.730290,2023-10-02 12:25:16.099967,0 days 00:00:00.369677,6899.4439224668395,360,sag,COMPLETE
4543,0.5619609127634021,2023-10-02 12:25:16.101971,2023-10-02 12:25:16.330504,0 days 00:00:00.228533,0.9876623213970106,360,sag,COMPLETE
4544,0.6590785020198712,2023-10-02 12:25:16.331832,2023-10-02 12:25:16.650584,0 days 00:00:00.318752,18817.96886209864,320,sag,COMPLETE
4545,0.6369145103177202,2023-10-02 12:25:16.650584,2023-10-02 12:25:16.964138,0 days 00:00:00.313554,20.215257496424037,370,sag,COMPLETE
4546,0.6520362484987444,2023-10-02 12:25:16.964138,2023-10-02 12:25:17.265647,0 days 00:00:00.301509,36554.11455299891,340,sag,COMPLETE
4547,0.6062888961677039,2023-10-02 12:25:17.265647,2023-10-02 12:25:17.753945,0 days 00:00:00.488298,6.38727401303007,340,sag,COMPLETE
4548,0.6520362484987444,2023-10-02 12:25:17.754949,2023-10-02 12:25:18.094143,0 days 00:00:00.339194,3144.6381317208225,350,sag,COMPLETE
