number,value,datetime_start,datetime_complete,duration,params_C,params_max_iter,params_solver,state
7156,0.6520362484987444,2023-10-02 12:42:53.284425,2023-10-02 12:42:53.803997,0 days 00:00:00.519572,5428.809290551427,330,sag,COMPLETE
7157,0.5,2023-10-02 12:42:53.803997,2023-10-02 12:42:54.155883,0 days 00:00:00.351886,0.006764915078633831,480,sag,COMPLETE
7158,0.5,2023-10-02 12:42:54.172280,2023-10-02 12:42:54.650560,0 days 00:00:00.478280,0.0004197876348197714,430,sag,COMPLETE
7159,0.5,2023-10-02 12:42:54.650560,2023-10-02 12:42:55.742290,0 days 00:00:01.091730,1.708095462488415e-05,500,sag,COMPLETE
7160,0.6386614259198603,2023-10-02 12:42:55.756437,2023-10-02 12:42:56.207127,0 days 00:00:00.450690,350.3361575317693,390,lbfgs,COMPLETE
7161,0.6203734032099574,2023-10-02 12:42:56.207127,2023-10-02 12:42:56.642113,0 days 00:00:00.434986,7.464382885923398,490,sag,COMPLETE
7162,0.6270335189431162,2023-10-02 12:42:56.642113,2023-10-02 12:42:57.157343,0 days 00:00:00.515230,23824.269405785577,370,sag,COMPLETE
7163,0.5478764057211486,2023-10-02 12:42:57.157343,2023-10-02 12:42:57.507900,0 days 00:00:00.350557,0.7001522129693123,470,sag,COMPLETE
7164,0.6267059722677149,2023-10-02 12:42:57.507900,2023-10-02 12:42:58.024972,0 days 00:00:00.517072,12.052024928573848,350,sag,COMPLETE
7165,0.6449939949776177,2023-10-02 12:42:58.024972,2023-10-02 12:42:58.521218,0 days 00:00:00.496246,1400.0456977747383,500,sag,COMPLETE
7166,0.666120755540998,2023-10-02 12:42:58.523213,2023-10-02 12:42:59.209310,0 days 00:00:00.686097,14695.244584319447,450,sag,COMPLETE
7167,0.5,2023-10-02 12:42:59.209310,2023-10-02 12:42:59.691486,0 days 00:00:00.482176,0.20522479738329058,490,sag,COMPLETE
7168,0.6449939949776177,2023-10-02 12:42:59.691486,2023-10-02 12:43:00.217942,0 days 00:00:00.526456,40462.17362858008,340,sag,COMPLETE
7169,0.6520362484987444,2023-10-02 12:43:00.217942,2023-10-02 12:43:00.761177,0 days 00:00:00.543235,3150.4581745293867,460,sag,COMPLETE
7170,0.5,2023-10-02 12:43:00.761177,2023-10-02 12:43:01.296190,0 days 00:00:00.535013,8.800194667554618e-05,470,sag,COMPLETE
7171,0.634075772464243,2023-10-02 12:43:01.298172,2023-10-02 12:43:01.844958,0 days 00:00:00.546786,7854.851294532221,360,sag,COMPLETE
7172,0.649579648433235,2023-10-02 12:43:01.853481,2023-10-02 12:43:02.341325,0 days 00:00:00.487844,141.70244363331895,380,sag,COMPLETE
7173,0.5,2023-10-02 12:43:02.345843,2023-10-02 12:43:02.702735,0 days 00:00:00.356892,0.0013096296219770366,480,newton-cg,COMPLETE
7174,0.5,2023-10-02 12:43:02.702735,2023-10-02 12:43:03.424192,0 days 00:00:00.721457,4.2980449621361917e-05,490,sag,COMPLETE
7175,0.5,2023-10-02 12:43:03.424192,2023-10-02 12:43:03.768772,0 days 00:00:00.344580,0.0031466151134474573,420,liblinear,COMPLETE
7176,0.6520362484987444,2023-10-02 12:43:03.768772,2023-10-02 12:43:04.302356,0 days 00:00:00.533584,30692.277706452576,440,sag,COMPLETE
7177,0.666120755540998,2023-10-02 12:43:04.302356,2023-10-02 12:43:04.853821,0 days 00:00:00.551465,17019.42197790049,500,sag,COMPLETE
7178,0.5943334425155585,2023-10-02 12:43:04.853821,2023-10-02 12:43:05.239905,0 days 00:00:00.386084,2.1070483628782872,480,sag,COMPLETE
7179,0.6590785020198712,2023-10-02 12:43:05.241899,2023-10-02 12:43:05.750966,0 days 00:00:00.509067,71296.06237085689,360,sag,COMPLETE
7180,0.6534556174254831,2023-10-02 12:43:05.750966,2023-10-02 12:43:06.122652,0 days 00:00:00.371686,49.936583082453375,460,sag,COMPLETE
7181,0.5,2023-10-02 12:43:06.122652,2023-10-02 12:43:06.577015,0 days 00:00:00.454363,0.3338277345236345,370,sag,COMPLETE
7182,0.6369145103177202,2023-10-02 12:43:06.577015,2023-10-02 12:43:07.031493,0 days 00:00:00.454478,23.174919911334502,490,sag,COMPLETE
7183,0.6520362484987444,2023-10-02 12:43:07.031493,2023-10-02 12:43:07.471411,0 days 00:00:00.439918,5510.060834861456,470,sag,COMPLETE
7184,0.608417949557812,2023-10-02 12:43:07.487049,2023-10-02 12:43:07.958023,0 days 00:00:00.470974,2.674973059737654,310,lbfgs,COMPLETE
7185,0.5,2023-10-02 12:43:07.958023,2023-10-02 12:43:09.117207,0 days 00:00:01.159184,1.6732037186593663e-05,500,sag,COMPLETE
7186,0.6590785020198712,2023-10-02 12:43:09.117207,2023-10-02 12:43:09.572330,0 days 00:00:00.455123,47456.86615738652,340,sag,COMPLETE
7187,0.6520362484987444,2023-10-02 12:43:09.572855,2023-10-02 12:43:10.129294,0 days 00:00:00.556439,1964.6563349661276,450,sag,COMPLETE
7188,0.637951741456491,2023-10-02 12:43:10.129294,2023-10-02 12:43:10.607291,0 days 00:00:00.477997,565.5916532603522,380,sag,COMPLETE
7189,0.6520362484987444,2023-10-02 12:43:10.609286,2023-10-02 12:43:11.185094,0 days 00:00:00.575808,9577.937142544917,350,sag,COMPLETE
7190,0.6520362484987444,2023-10-02 12:43:11.185094,2023-10-02 12:43:11.724145,0 days 00:00:00.539051,23873.110252727925,480,sag,COMPLETE
7191,0.5,2023-10-02 12:43:11.726148,2023-10-02 12:43:12.086206,0 days 00:00:00.360058,0.10048873741448604,330,sag,COMPLETE
7192,0.6590785020198712,2023-10-02 12:43:12.086206,2023-10-02 12:43:12.604532,0 days 00:00:00.518326,62755.40274326494,490,sag,COMPLETE
7193,0.6590785020198712,2023-10-02 12:43:12.604532,2023-10-02 12:43:13.043372,0 days 00:00:00.438840,99038.24024130193,480,sag,COMPLETE
7194,0.666120755540998,2023-10-02 12:43:13.043372,2023-10-02 12:43:13.566695,0 days 00:00:00.523323,12457.131130926675,500,sag,COMPLETE
7195,0.6267059722677149,2023-10-02 12:43:13.566695,2023-10-02 12:43:14.001149,0 days 00:00:00.434454,11.621758462278928,470,sag,COMPLETE
7196,0.6488699639698657,2023-10-02 12:43:14.001149,2023-10-02 12:43:14.439174,0 days 00:00:00.438025,30658.77392778979,390,sag,COMPLETE
7197,0.637951741456491,2023-10-02 12:43:14.442227,2023-10-02 12:43:14.893655,0 days 00:00:00.451428,5791.209134517696,370,newton-cg,COMPLETE
7198,0.6449939949776177,2023-10-02 12:43:14.893655,2023-10-02 12:43:15.424694,0 days 00:00:00.531039,4075.4980576893568,490,sag,COMPLETE
7199,0.6069985806310733,2023-10-02 12:43:15.424694,2023-10-02 12:43:15.769747,0 days 00:00:00.345053,4.769273475739817,440,sag,COMPLETE
7200,0.637951741456491,2023-10-02 12:43:15.769747,2023-10-02 12:43:16.209148,0 days 00:00:00.439401,41869.72203532845,460,liblinear,COMPLETE
7201,0.6488699639698657,2023-10-02 12:43:16.209148,2023-10-02 12:43:16.648492,0 days 00:00:00.439344,19234.817886491142,500,sag,COMPLETE
7202,0.5,2023-10-02 12:43:16.648492,2023-10-02 12:43:17.088903,0 days 00:00:00.440411,0.11485581598558486,350,sag,COMPLETE
7203,0.6520362484987444,2023-10-02 12:43:17.088903,2023-10-02 12:43:17.591227,0 days 00:00:00.502324,2614.1038299445013,360,sag,COMPLETE
7204,0.6590785020198712,2023-10-02 12:43:17.591227,2023-10-02 12:43:17.983782,0 days 00:00:00.392555,11425.04241859567,330,sag,COMPLETE
7205,0.6520362484987444,2023-10-02 12:43:17.999421,2023-10-02 12:43:18.486126,0 days 00:00:00.486705,66036.89324160149,430,sag,COMPLETE
7206,0.5,2023-10-02 12:43:18.486126,2023-10-02 12:43:20.065733,0 days 00:00:01.579607,1.0337469156956793e-05,470,sag,COMPLETE
7207,0.634075772464243,2023-10-02 12:43:20.065733,2023-10-02 12:43:20.580451,0 days 00:00:00.514718,45599.31399128879,490,sag,COMPLETE
7208,0.6534556174254831,2023-10-02 12:43:20.580451,2023-10-02 12:43:21.039281,0 days 00:00:00.458830,79.29490727455571,450,sag,COMPLETE
7209,0.6520362484987444,2023-10-02 12:43:21.039281,2023-10-02 12:43:21.447622,0 days 00:00:00.408341,27194.028648995452,410,sag,COMPLETE
7210,0.5,2023-10-02 12:43:21.447622,2023-10-02 12:43:21.887731,0 days 00:00:00.440109,0.2871033993534456,480,sag,COMPLETE
7211,0.6590785020198712,2023-10-02 12:43:21.887731,2023-10-02 12:43:22.389485,0 days 00:00:00.501754,7903.60344830612,360,sag,COMPLETE
7212,0.6457036794409869,2023-10-02 12:43:22.389485,2023-10-02 12:43:22.808798,0 days 00:00:00.419313,216.97478675515993,400,sag,COMPLETE
7213,0.666120755540998,2023-10-02 12:43:22.808798,2023-10-02 12:43:23.335480,0 days 00:00:00.526682,17331.261312651994,500,sag,COMPLETE
7214,0.637951741456491,2023-10-02 12:43:23.335480,2023-10-02 12:43:23.818912,0 days 00:00:00.483432,99561.12255990121,320,lbfgs,COMPLETE
7215,0.6298722567965934,2023-10-02 12:43:23.818912,2023-10-02 12:43:24.177806,0 days 00:00:00.358894,18.11134199110889,340,sag,COMPLETE
7216,0.6590785020198712,2023-10-02 12:43:24.177806,2023-10-02 12:43:24.718480,0 days 00:00:00.540674,33634.569041480034,480,sag,COMPLETE
7217,0.5,2023-10-02 12:43:24.718480,2023-10-02 12:43:25.078777,0 days 00:00:00.360297,0.055801772340962084,240,sag,COMPLETE
7218,0.6590785020198712,2023-10-02 12:43:25.078777,2023-10-02 12:43:25.588546,0 days 00:00:00.509769,4002.889275772255,370,sag,COMPLETE
7219,0.637951741456491,2023-10-02 12:43:25.592561,2023-10-02 12:43:26.102665,0 days 00:00:00.510104,889.1922416032901,440,sag,COMPLETE
7220,0.5,2023-10-02 12:43:26.102665,2023-10-02 12:43:26.455536,0 days 00:00:00.352871,0.017715997401477397,490,sag,COMPLETE
7221,0.6552025330276231,2023-10-02 12:43:26.455536,2023-10-02 12:43:26.956318,0 days 00:00:00.500782,65358.03915712614,380,sag,COMPLETE
7222,0.5,2023-10-02 12:43:26.956318,2023-10-02 12:43:27.411934,0 days 00:00:00.455616,0.0032553037926698076,460,sag,COMPLETE
7223,0.637951741456491,2023-10-02 12:43:27.411934,2023-10-02 12:43:27.772580,0 days 00:00:00.360646,13361.057215323657,500,newton-cg,COMPLETE
7224,0.6520362484987444,2023-10-02 12:43:27.772580,2023-10-02 12:43:28.297104,0 days 00:00:00.524524,8090.84483058171,470,sag,COMPLETE
7225,0.6520362484987444,2023-10-02 12:43:28.297104,2023-10-02 12:43:28.697732,0 days 00:00:00.400628,2105.3857462698857,350,sag,COMPLETE
7226,0.637951741456491,2023-10-02 12:43:28.713251,2023-10-02 12:43:29.184753,0 days 00:00:00.471502,24050.928159551095,450,liblinear,COMPLETE
7227,0.6520362484987444,2023-10-02 12:43:29.187290,2023-10-02 12:43:29.783325,0 days 00:00:00.596035,1260.8514621053764,490,sag,COMPLETE
7228,0.6418277104487389,2023-10-02 12:43:29.785331,2023-10-02 12:43:30.221347,0 days 00:00:00.436016,315.8485037398374,480,sag,COMPLETE
7229,0.5,2023-10-02 12:43:30.221347,2023-10-02 12:43:30.987456,0 days 00:00:00.766109,4.1462426864071675e-05,490,sag,COMPLETE
7230,0.6520362484987444,2023-10-02 12:43:30.987456,2023-10-02 12:43:31.533242,0 days 00:00:00.545786,43803.63711530243,370,sag,COMPLETE
7231,0.637951741456491,2023-10-02 12:43:31.535245,2023-10-02 12:43:31.983443,0 days 00:00:00.448198,538.1281069139015,350,sag,COMPLETE
7232,0.6590785020198712,2023-10-02 12:43:31.985438,2023-10-02 12:43:32.521758,0 days 00:00:00.536320,4525.999187111323,480,sag,COMPLETE
7233,0.666120755540998,2023-10-02 12:43:32.521758,2023-10-02 12:43:33.038263,0 days 00:00:00.516505,65076.589756549525,460,sag,COMPLETE
7234,0.666120755540998,2023-10-02 12:43:33.054361,2023-10-02 12:43:33.488413,0 days 00:00:00.434052,14110.07743784283,500,sag,COMPLETE
7235,0.637951741456491,2023-10-02 12:43:33.488413,2023-10-02 12:43:33.988795,0 days 00:00:00.500382,33061.58883106556,470,lbfgs,COMPLETE
7236,0.5478764057211486,2023-10-02 12:43:33.988795,2023-10-02 12:43:34.355698,0 days 00:00:00.366903,0.6898818265949397,420,sag,COMPLETE
7237,0.6133311496888305,2023-10-02 12:43:34.355698,2023-10-02 12:43:34.814035,0 days 00:00:00.458337,6.818075675876883,340,sag,COMPLETE
7238,0.649579648433235,2023-10-02 12:43:34.817030,2023-10-02 12:43:35.289220,0 days 00:00:00.472190,121.07411766980499,450,sag,COMPLETE
7239,0.6520362484987444,2023-10-02 12:43:35.289220,2023-10-02 12:43:35.722716,0 days 00:00:00.433496,8448.16247063893,360,sag,COMPLETE
7240,0.6590785020198712,2023-10-02 12:43:35.722716,2023-10-02 12:43:36.256161,0 days 00:00:00.533445,20347.341394838993,490,sag,COMPLETE
7241,0.5,2023-10-02 12:43:36.272269,2023-10-02 12:43:36.723236,0 days 00:00:00.450967,0.012261299256834654,500,sag,COMPLETE
7242,0.6020853805000546,2023-10-02 12:43:36.723236,2023-10-02 12:43:37.090372,0 days 00:00:00.367136,1.8416258601463187,440,sag,COMPLETE
7243,0.669996724533246,2023-10-02 12:43:37.090372,2023-10-02 12:43:37.606061,0 days 00:00:00.515689,99383.46416449446,390,sag,COMPLETE
7244,0.666120755540998,2023-10-02 12:43:37.606887,2023-10-02 12:43:38.107009,0 days 00:00:00.500122,2909.914621882245,380,sag,COMPLETE
7245,0.666120755540998,2023-10-02 12:43:38.107009,2023-10-02 12:43:38.540479,0 days 00:00:00.433470,47155.05117524758,480,sag,COMPLETE
7246,0.5,2023-10-02 12:43:38.557234,2023-10-02 12:43:39.008287,0 days 00:00:00.451053,0.00020513094524616813,370,newton-cg,COMPLETE
7247,0.5823779888634131,2023-10-02 12:43:39.008287,2023-10-02 12:43:39.391749,0 days 00:00:00.383462,1.1924912720637346,460,sag,COMPLETE
7248,0.6590785020198712,2023-10-02 12:43:39.391749,2023-10-02 12:43:39.974984,0 days 00:00:00.583235,5600.524497237204,490,sag,COMPLETE
7249,0.6520362484987444,2023-10-02 12:43:39.974984,2023-10-02 12:43:40.491370,0 days 00:00:00.516386,27361.382864978754,280,sag,COMPLETE
7250,0.6520362484987444,2023-10-02 12:43:40.491370,2023-10-02 12:43:40.925081,0 days 00:00:00.433711,65460.84147269854,330,sag,COMPLETE
7251,0.608417949557812,2023-10-02 12:43:40.925081,2023-10-02 12:43:41.421390,0 days 00:00:00.496309,3.0155860722734733,500,sag,COMPLETE
7252,0.637951741456491,2023-10-02 12:43:41.423390,2023-10-02 12:43:41.892078,0 days 00:00:00.468688,12730.558661384415,470,liblinear,COMPLETE
7253,0.637951741456491,2023-10-02 12:43:41.892078,2023-10-02 12:43:42.325366,0 days 00:00:00.433288,1579.6027428978173,360,sag,COMPLETE
7254,0.6629544710121192,2023-10-02 12:43:42.325366,2023-10-02 12:43:42.875597,0 days 00:00:00.550231,45247.93140316589,430,sag,COMPLETE
7255,0.6541653018888526,2023-10-02 12:43:42.875597,2023-10-02 12:43:43.275714,0 days 00:00:00.400117,32.73693136994667,320,sag,COMPLETE
7256,0.5619609127634021,2023-10-02 12:43:43.275714,2023-10-02 12:43:43.743322,0 days 00:00:00.467608,0.9017037976505432,480,sag,COMPLETE
7257,0.6629544710121192,2023-10-02 12:43:43.743322,2023-10-02 12:43:44.309501,0 days 00:00:00.566179,18345.586461052324,350,sag,COMPLETE
7258,0.6267059722677149,2023-10-02 12:43:44.325169,2023-10-02 12:43:44.726544,0 days 00:00:00.401375,12.73565200463304,500,lbfgs,COMPLETE
7259,0.637951741456491,2023-10-02 12:43:44.743211,2023-10-02 12:43:45.309914,0 days 00:00:00.566703,6490.550583918687,490,sag,COMPLETE
7260,0.5,2023-10-02 12:43:45.309914,2023-10-02 12:43:45.776989,0 days 00:00:00.467075,0.28305021750678366,340,sag,COMPLETE
7261,0.666120755540998,2023-10-02 12:43:45.776989,2023-10-02 12:43:46.226944,0 days 00:00:00.449955,31204.942200348483,460,sag,COMPLETE
7262,0.6481602795064964,2023-10-02 12:43:46.243629,2023-10-02 12:43:46.793897,0 days 00:00:00.550268,9542.347361740212,470,sag,COMPLETE
7263,0.6520362484987444,2023-10-02 12:43:46.793897,2023-10-02 12:43:47.360899,0 days 00:00:00.567002,68909.1658139737,450,sag,COMPLETE
7264,0.6520362484987444,2023-10-02 12:43:47.360899,2023-10-02 12:43:47.810909,0 days 00:00:00.450010,4342.952837303175,370,sag,COMPLETE
7265,0.6520362484987444,2023-10-02 12:43:47.827673,2023-10-02 12:43:48.411367,0 days 00:00:00.583694,18877.606899059934,490,sag,COMPLETE
7266,0.5,2023-10-02 12:43:48.411367,2023-10-02 12:43:48.811381,0 days 00:00:00.400014,0.021389746277318173,480,sag,COMPLETE
7267,0.5,2023-10-02 12:43:48.811381,2023-10-02 12:43:49.295013,0 days 00:00:00.483632,0.07417740407631823,350,sag,COMPLETE
7268,0.6449939949776177,2023-10-02 12:43:49.295013,2023-10-02 12:43:49.878404,0 days 00:00:00.583391,45109.04326662286,500,sag,COMPLETE
7269,0.619663718746588,2023-10-02 12:43:49.878404,2023-10-02 12:43:50.295291,0 days 00:00:00.416887,9.471928063008594,360,sag,COMPLETE
7270,0.6520362484987444,2023-10-02 12:43:50.295291,2023-10-02 12:43:50.845511,0 days 00:00:00.550220,2237.0591429141905,380,sag,COMPLETE
7271,0.5,2023-10-02 12:43:50.862243,2023-10-02 12:43:51.329181,0 days 00:00:00.466938,0.0004714645344294357,440,newton-cg,COMPLETE
7272,0.649579648433235,2023-10-02 12:43:51.329181,2023-10-02 12:43:51.762615,0 days 00:00:00.433434,161.40632478357475,480,sag,COMPLETE
7273,0.6552025330276231,2023-10-02 12:43:51.762615,2023-10-02 12:43:52.312089,0 days 00:00:00.549474,98906.43927003111,500,sag,COMPLETE
7274,0.5,2023-10-02 12:43:52.312941,2023-10-02 12:43:52.787220,0 days 00:00:00.474279,0.0043872183770001585,450,liblinear,COMPLETE
7275,0.5,2023-10-02 12:43:52.790215,2023-10-02 12:43:53.175854,0 days 00:00:00.385639,0.04132878417326454,470,sag,COMPLETE
7276,0.608417949557812,2023-10-02 12:43:53.175854,2023-10-02 12:43:53.661878,0 days 00:00:00.486024,2.7342244887494838,490,sag,COMPLETE
7277,0.6471230483677258,2023-10-02 12:43:53.661878,2023-10-02 12:43:54.054192,0 days 00:00:00.392314,28.53953695014379,340,sag,COMPLETE
7278,0.6590785020198712,2023-10-02 12:43:54.054192,2023-10-02 12:43:54.603218,0 days 00:00:00.549026,27591.26816305779,420,sag,COMPLETE
7279,0.6069985806310733,2023-10-02 12:43:54.603218,2023-10-02 12:43:55.074099,0 days 00:00:00.470881,4.622720306063857,490,sag,COMPLETE
7280,0.666120755540998,2023-10-02 12:43:55.074099,2023-10-02 12:43:55.519325,0 days 00:00:00.445226,11283.845792112694,330,sag,COMPLETE
7281,0.5,2023-10-02 12:43:55.519325,2023-10-02 12:43:56.020483,0 days 00:00:00.501158,0.001634469199691276,390,sag,COMPLETE
7282,0.6418277104487389,2023-10-02 12:43:56.020483,2023-10-02 12:43:56.573067,0 days 00:00:00.552584,278.30024234052775,480,sag,COMPLETE
7283,0.6309094879353642,2023-10-02 12:43:56.573067,2023-10-02 12:43:57.028301,0 days 00:00:00.455234,3680.0402894380823,460,lbfgs,COMPLETE
7284,0.5,2023-10-02 12:43:57.028301,2023-10-02 12:43:57.498279,0 days 00:00:00.469978,0.02798514175481906,360,sag,COMPLETE
7285,0.5,2023-10-02 12:43:57.498279,2023-10-02 12:43:57.980151,0 days 00:00:00.481872,0.009426167704873032,430,sag,COMPLETE
7286,0.6520362484987444,2023-10-02 12:43:57.982144,2023-10-02 12:43:58.422644,0 days 00:00:00.440500,49866.67938471967,370,sag,COMPLETE
7287,0.5,2023-10-02 12:43:58.424155,2023-10-02 12:43:58.906866,0 days 00:00:00.482711,0.0016756013122069266,500,sag,COMPLETE
7288,0.6449939949776177,2023-10-02 12:43:58.908867,2023-10-02 12:43:59.420123,0 days 00:00:00.511256,1015.7412763154642,490,sag,COMPLETE
7289,0.5313352986133857,2023-10-02 12:43:59.422115,2023-10-02 12:43:59.898455,0 days 00:00:00.476340,0.5261156657710424,350,sag,COMPLETE
7290,0.6590785020198712,2023-10-02 12:43:59.901452,2023-10-02 12:44:00.476893,0 days 00:00:00.575441,6438.087543412029,470,sag,COMPLETE
7291,0.6481602795064964,2023-10-02 12:44:00.478890,2023-10-02 12:44:00.926862,0 days 00:00:00.447972,18008.427982698475,480,sag,COMPLETE
7292,0.6534556174254831,2023-10-02 12:44:00.928861,2023-10-02 12:44:01.417663,0 days 00:00:00.488802,93.7326121492214,500,sag,COMPLETE
7293,0.6590785020198712,2023-10-02 12:44:01.420658,2023-10-02 12:44:01.969844,0 days 00:00:00.549186,27008.65555671332,400,sag,COMPLETE
7294,0.6418277104487389,2023-10-02 12:44:01.971831,2023-10-02 12:44:02.429483,0 days 00:00:00.457652,483.47485471543973,450,sag,COMPLETE
7295,0.6449939949776177,2023-10-02 12:44:02.431481,2023-10-02 12:44:02.937341,0 days 00:00:00.505860,45780.76973829767,490,newton-cg,COMPLETE
7296,0.5,2023-10-02 12:44:02.939341,2023-10-02 12:44:03.388745,0 days 00:00:00.449404,0.0001452582327595671,340,sag,COMPLETE
7297,0.6488699639698657,2023-10-02 12:44:03.390751,2023-10-02 12:44:03.936900,0 days 00:00:00.546149,12457.068982175491,470,sag,COMPLETE
7298,0.6449939949776177,2023-10-02 12:44:03.938893,2023-10-02 12:44:04.462664,0 days 00:00:00.523771,65602.4638568029,170,sag,COMPLETE
7299,0.5,2023-10-02 12:44:04.464654,2023-10-02 12:44:05.460970,0 days 00:00:00.996316,2.3343917169177862e-05,360,sag,COMPLETE
7300,0.637951741456491,2023-10-02 12:44:05.462966,2023-10-02 12:44:05.929633,0 days 00:00:00.466667,98764.3367900673,380,liblinear,COMPLETE
7301,0.6520362484987444,2023-10-02 12:44:05.931630,2023-10-02 12:44:06.492292,0 days 00:00:00.560662,3011.7954989007076,440,sag,COMPLETE
7302,0.669996724533246,2023-10-02 12:44:06.494288,2023-10-02 12:44:06.999147,0 days 00:00:00.504859,7963.942178658408,500,sag,COMPLETE
7303,0.5,2023-10-02 12:44:07.002146,2023-10-02 12:44:07.576670,0 days 00:00:00.574524,0.0001276204741537475,480,sag,COMPLETE
7304,0.6520362484987444,2023-10-02 12:44:07.578659,2023-10-02 12:44:08.156101,0 days 00:00:00.577442,38304.14026127539,460,sag,COMPLETE
7305,0.6590785020198712,2023-10-02 12:44:08.158099,2023-10-02 12:44:08.596252,0 days 00:00:00.438153,19714.00705199136,410,sag,COMPLETE
7306,0.6590785020198712,2023-10-02 12:44:08.598244,2023-10-02 12:44:09.145090,0 days 00:00:00.546846,5474.034194935577,370,sag,COMPLETE
7307,0.5,2023-10-02 12:44:09.147086,2023-10-02 12:44:09.530712,0 days 00:00:00.383626,0.0053234935749020594,490,sag,COMPLETE
7308,0.5,2023-10-02 12:44:09.533243,2023-10-02 12:44:10.002428,0 days 00:00:00.469185,0.0003844019488098112,350,lbfgs,COMPLETE
7309,0.6369145103177202,2023-10-02 12:44:10.004418,2023-10-02 12:44:10.485293,0 days 00:00:00.480875,21.585941319024933,490,sag,COMPLETE
7310,0.6590785020198712,2023-10-02 12:44:10.487291,2023-10-02 12:44:10.914390,0 days 00:00:00.427099,31267.513764709583,260,sag,COMPLETE
7311,0.5,2023-10-02 12:44:10.916386,2023-10-02 12:44:11.392251,0 days 00:00:00.475865,0.007531708976028051,330,sag,COMPLETE
7312,0.669996724533246,2023-10-02 12:44:11.394248,2023-10-02 12:44:11.960454,0 days 00:00:00.566206,99130.31450454523,470,sag,COMPLETE
7313,0.5,2023-10-02 12:44:11.962453,2023-10-02 12:44:12.359131,0 days 00:00:00.396678,0.2573818732393116,310,sag,COMPLETE
7314,0.634075772464243,2023-10-02 12:44:12.361133,2023-10-02 12:44:12.911759,0 days 00:00:00.550626,13092.194072227348,500,sag,COMPLETE
7315,0.6449939949776177,2023-10-02 12:44:12.913757,2023-10-02 12:44:13.451936,0 days 00:00:00.538179,2021.4502394031097,360,sag,COMPLETE
7316,0.6481602795064964,2023-10-02 12:44:13.453936,2023-10-02 12:44:13.912027,0 days 00:00:00.458091,48993.14247128514,480,sag,COMPLETE
7317,0.6449939949776177,2023-10-02 12:44:13.914035,2023-10-02 12:44:14.450471,0 days 00:00:00.536436,822.0690693758536,380,sag,COMPLETE
7318,0.6520362484987444,2023-10-02 12:44:14.453465,2023-10-02 12:44:14.907596,0 days 00:00:00.454131,8554.9901510739,460,sag,COMPLETE
