number,value,datetime_start,datetime_complete,duration,params_C,params_max_iter,params_solver,state
9927,0.5,2023-10-02 13:08:59.969579,2023-10-02 13:09:00.771112,0 days 00:00:00.801533,0.0051920846999170015,430,sag,COMPLETE
9928,0.6534556174254831,2023-10-02 13:09:00.771112,2023-10-02 13:09:01.472490,0 days 00:00:00.701378,77.5287349438383,400,sag,COMPLETE
9929,0.5,2023-10-02 13:09:01.472490,2023-10-02 13:09:02.284248,0 days 00:00:00.811758,0.155251663621288,490,saga,COMPLETE
9930,0.5943334425155585,2023-10-02 13:09:02.284248,2023-10-02 13:09:03.053730,0 days 00:00:00.769482,2.121165397301457,480,sag,COMPLETE
9931,0.6629544710121192,2023-10-02 13:09:03.053730,2023-10-02 13:09:03.932089,0 days 00:00:00.878359,68044.0998974493,500,sag,COMPLETE
9932,0.6534556174254831,2023-10-02 13:09:03.932089,2023-10-02 13:09:04.700870,0 days 00:00:00.768781,74.83826793095184,490,sag,COMPLETE
9933,0.5,2023-10-02 13:09:04.716496,2023-10-02 13:09:05.485037,0 days 00:00:00.768541,0.0004972816480721216,460,sag,COMPLETE
9934,0.6629544710121192,2023-10-02 13:09:05.500691,2023-10-02 13:09:06.362495,0 days 00:00:00.861804,17855.653900641806,470,sag,COMPLETE
9935,0.6520362484987444,2023-10-02 13:09:06.362495,2023-10-02 13:09:07.146325,0 days 00:00:00.783830,99687.00594946831,380,sag,COMPLETE
9936,0.6629544710121192,2023-10-02 13:09:07.161950,2023-10-02 13:09:08.071687,0 days 00:00:00.909737,46171.258766732644,440,sag,COMPLETE
9937,0.5,2023-10-02 13:09:08.071687,2023-10-02 13:09:09.330654,0 days 00:00:01.258967,3.280547085064749e-05,480,sag,COMPLETE
9938,0.5376678676711432,2023-10-02 13:09:09.330654,2023-10-02 13:09:10.017722,0 days 00:00:00.687068,0.6282923164090399,420,sag,COMPLETE
9939,0.5,2023-10-02 13:09:10.017722,2023-10-02 13:09:10.790326,0 days 00:00:00.772604,0.0035800119021692596,370,newton-cg,COMPLETE
9940,0.6520362484987444,2023-10-02 13:09:10.801337,2023-10-02 13:09:11.509006,0 days 00:00:00.707669,6284.136938678964,120,sag,COMPLETE
9941,0.6386614259198603,2023-10-02 13:09:11.509006,2023-10-02 13:09:12.072303,0 days 00:00:00.563297,521.8772846209813,450,liblinear,COMPLETE
9942,0.6520362484987444,2023-10-02 13:09:12.087930,2023-10-02 13:09:12.965550,0 days 00:00:00.877620,3268.1668964058863,360,sag,COMPLETE
9943,0.6590785020198712,2023-10-02 13:09:12.981176,2023-10-02 13:09:13.829179,0 days 00:00:00.848003,32858.941665424434,490,sag,COMPLETE
9944,0.5,2023-10-02 13:09:13.829179,2023-10-02 13:09:14.660477,0 days 00:00:00.831298,0.0323991290441837,500,sag,COMPLETE
9945,0.6203734032099574,2023-10-02 13:09:14.660477,2023-10-02 13:09:15.427124,0 days 00:00:00.766647,7.688818159098816,480,sag,COMPLETE
9946,0.6520362484987444,2023-10-02 13:09:15.442742,2023-10-02 13:09:16.324468,0 days 00:00:00.881726,12925.731412654517,500,sag,COMPLETE
9947,0.666120755540998,2023-10-02 13:09:16.324468,2023-10-02 13:09:17.202097,0 days 00:00:00.877629,21715.3108106799,470,sag,COMPLETE
9948,0.6590785020198712,2023-10-02 13:09:17.202097,2023-10-02 13:09:17.954076,0 days 00:00:00.751979,66277.73882036904,390,sag,COMPLETE
9949,0.637951741456491,2023-10-02 13:09:17.954076,2023-10-02 13:09:18.775844,0 days 00:00:00.821768,741.9517984456511,360,sag,COMPLETE
9950,0.6449939949776177,2023-10-02 13:09:18.775844,2023-10-02 13:09:19.491893,0 days 00:00:00.716049,4385.515552136832,450,sag,COMPLETE
9951,0.637951741456491,2023-10-02 13:09:19.491893,2023-10-02 13:09:20.119485,0 days 00:00:00.627592,48170.25924444823,490,lbfgs,COMPLETE
9952,0.6449939949776177,2023-10-02 13:09:20.119485,2023-10-02 13:09:20.809442,0 days 00:00:00.689957,1789.1611648886874,460,sag,COMPLETE
9953,0.6520362484987444,2023-10-02 13:09:20.810431,2023-10-02 13:09:21.468109,0 days 00:00:00.657678,12270.568366997608,370,sag,COMPLETE
9954,0.5,2023-10-02 13:09:21.468109,2023-10-02 13:09:22.080434,0 days 00:00:00.612325,0.009698551721161606,480,saga,COMPLETE
9955,0.6449939949776177,2023-10-02 13:09:22.080434,2023-10-02 13:09:22.802301,0 days 00:00:00.721867,32818.24739255389,400,sag,COMPLETE
9956,0.6520362484987444,2023-10-02 13:09:22.802301,2023-10-02 13:09:23.414407,0 days 00:00:00.612106,6591.498572082929,500,sag,COMPLETE
9957,0.6520362484987444,2023-10-02 13:09:23.414407,2023-10-02 13:09:24.072255,0 days 00:00:00.657848,19712.192724426528,430,sag,COMPLETE
9958,0.6449939949776177,2023-10-02 13:09:24.072255,2023-10-02 13:09:24.731966,0 days 00:00:00.659711,46403.97740638902,380,sag,COMPLETE
9959,0.6534556174254831,2023-10-02 13:09:24.747615,2023-10-02 13:09:25.359172,0 days 00:00:00.611557,49.622470985996145,490,sag,COMPLETE
9960,0.669996724533246,2023-10-02 13:09:25.359172,2023-10-02 13:09:26.027499,0 days 00:00:00.668327,65586.17650710569,440,sag,COMPLETE
9961,0.5,2023-10-02 13:09:26.027499,2023-10-02 13:09:26.630114,0 days 00:00:00.602615,0.002501101522342273,470,sag,COMPLETE
9962,0.6534556174254831,2023-10-02 13:09:26.630114,2023-10-02 13:09:27.259586,0 days 00:00:00.629472,116.91037882181887,460,sag,COMPLETE
9963,0.6520362484987444,2023-10-02 13:09:27.259586,2023-10-02 13:09:27.822945,0 days 00:00:00.563359,9333.26817575411,480,sag,COMPLETE
9964,0.637951741456491,2023-10-02 13:09:27.838001,2023-10-02 13:09:28.428909,0 days 00:00:00.590908,26969.27355887527,410,newton-cg,COMPLETE
9965,0.5,2023-10-02 13:09:28.428909,2023-10-02 13:09:29.029316,0 days 00:00:00.600407,0.053032954059752495,470,sag,COMPLETE
9966,0.6449939949776177,2023-10-02 13:09:29.044987,2023-10-02 13:09:29.706983,0 days 00:00:00.661996,99533.29280869334,360,sag,COMPLETE
9967,0.6309094879353642,2023-10-02 13:09:29.706983,2023-10-02 13:09:30.301369,0 days 00:00:00.594386,3350.1854918288245,490,liblinear,COMPLETE
9968,0.5,2023-10-02 13:09:30.301369,2023-10-02 13:09:30.895284,0 days 00:00:00.593915,0.0011248912493417543,500,sag,COMPLETE
9969,0.6590785020198712,2023-10-02 13:09:30.895284,2023-10-02 13:09:31.571774,0 days 00:00:00.676490,15676.767080224805,450,sag,COMPLETE
9970,0.666120755540998,2023-10-02 13:09:31.571774,2023-10-02 13:09:32.140458,0 days 00:00:00.568684,34666.78320853694,380,sag,COMPLETE
9971,0.6520362484987444,2023-10-02 13:09:32.140458,2023-10-02 13:09:32.794859,0 days 00:00:00.654401,49373.16001611299,370,sag,COMPLETE
9972,0.6457036794409869,2023-10-02 13:09:32.794859,2023-10-02 13:09:33.450453,0 days 00:00:00.655594,200.44785683564336,480,sag,COMPLETE
9973,0.5,2023-10-02 13:09:33.450453,2023-10-02 13:09:34.065819,0 days 00:00:00.615366,0.0003224348124564291,490,sag,COMPLETE
9974,0.6449939949776177,2023-10-02 13:09:34.065819,2023-10-02 13:09:34.739590,0 days 00:00:00.673771,2100.663541694589,500,sag,COMPLETE
9975,0.5,2023-10-02 13:09:34.755274,2023-10-02 13:09:35.336185,0 days 00:00:00.580911,0.058472545191660265,360,sag,COMPLETE
9976,0.6590785020198712,2023-10-02 13:09:35.338696,2023-10-02 13:09:35.994299,0 days 00:00:00.655603,7423.372394829256,470,sag,COMPLETE
9977,0.6481602795064964,2023-10-02 13:09:36.010276,2023-10-02 13:09:36.575863,0 days 00:00:00.565587,21145.808446006584,480,sag,COMPLETE
9978,0.5,2023-10-02 13:09:36.575863,2023-10-02 13:09:37.177501,0 days 00:00:00.601638,0.0001014191928344591,390,lbfgs,COMPLETE
9979,0.6059613494923026,2023-10-02 13:09:37.177501,2023-10-02 13:09:37.767299,0 days 00:00:00.589798,1.652820919669204,460,sag,COMPLETE
9980,0.5478764057211486,2023-10-02 13:09:37.782962,2023-10-02 13:09:38.363588,0 days 00:00:00.580626,0.7178676558658417,420,sag,COMPLETE
9981,0.6590785020198712,2023-10-02 13:09:38.363588,2023-10-02 13:09:39.046729,0 days 00:00:00.683141,63249.1567991868,490,sag,COMPLETE
9982,0.5,2023-10-02 13:09:39.054784,2023-10-02 13:09:39.633522,0 days 00:00:00.578738,0.023436211290780367,450,sag,COMPLETE
9983,0.5,2023-10-02 13:09:39.649560,2023-10-02 13:09:41.203144,0 days 00:00:01.553584,1.398533293454424e-05,300,sag,COMPLETE
9984,0.6520362484987444,2023-10-02 13:09:41.203144,2023-10-02 13:09:41.759501,0 days 00:00:00.556357,4411.600145318703,440,saga,COMPLETE
9985,0.6559122174909924,2023-10-02 13:09:41.759501,2023-10-02 13:09:42.394946,0 days 00:00:00.635445,11742.983919281914,190,sag,COMPLETE
9986,0.6534556174254831,2023-10-02 13:09:42.394946,2023-10-02 13:09:43.021346,0 days 00:00:00.626400,63.538655209625965,370,sag,COMPLETE
9987,0.5,2023-10-02 13:09:43.021346,2023-10-02 13:09:44.135289,0 days 00:00:01.113943,2.4524219441540508e-05,470,sag,COMPLETE
9988,0.6449939949776177,2023-10-02 13:09:44.135289,2023-10-02 13:09:44.858351,0 days 00:00:00.723062,66910.73990467914,500,sag,COMPLETE
9989,0.6629544710121192,2023-10-02 13:09:44.858351,2023-10-02 13:09:45.642237,0 days 00:00:00.783886,33460.2259065196,400,sag,COMPLETE
9990,0.6590785020198712,2023-10-02 13:09:45.657877,2023-10-02 13:09:46.434662,0 days 00:00:00.776785,16787.000958821835,490,sag,COMPLETE
9991,0.6449939949776177,2023-10-02 13:09:46.434662,2023-10-02 13:09:47.147019,0 days 00:00:00.712357,46561.48530212633,460,newton-cg,COMPLETE
9992,0.6520362484987444,2023-10-02 13:09:47.147019,2023-10-02 13:09:47.994765,0 days 00:00:00.847746,1510.8871288564628,380,sag,COMPLETE
9993,0.637951741456491,2023-10-02 13:09:47.994765,2023-10-02 13:09:48.622601,0 days 00:00:00.627836,5969.7555066870855,480,liblinear,COMPLETE
9994,0.6573315864177312,2023-10-02 13:09:48.622601,2023-10-02 13:09:49.232711,0 days 00:00:00.610110,38.22069267754103,430,sag,COMPLETE
9995,0.5,2023-10-02 13:09:49.232711,2023-10-02 13:09:49.815779,0 days 00:00:00.583068,0.3389523394974598,360,sag,COMPLETE
9996,0.6457036794409869,2023-10-02 13:09:49.831614,2023-10-02 13:09:50.469325,0 days 00:00:00.637711,203.2477875512855,500,sag,COMPLETE
9997,0.6488699639698657,2023-10-02 13:09:50.469325,2023-10-02 13:09:51.132620,0 days 00:00:00.663295,26938.027740402795,450,sag,COMPLETE
9998,0.6449939949776177,2023-10-02 13:09:51.132620,2023-10-02 13:09:51.712311,0 days 00:00:00.579691,1048.7121753391516,490,sag,COMPLETE
9999,0.5619609127634021,2023-10-02 13:09:51.712311,2023-10-02 13:09:52.308573,0 days 00:00:00.596262,0.8474956357803126,470,sag,COMPLETE
