number,value,datetime_start,datetime_complete,duration,params_C,params_max_iter,params_solver,state
481,0.5,2023-10-02 12:11:07.682518,2023-10-02 12:11:07.722674,0 days 00:00:00.040156,0.0043670009708534725,220,lbfgs,COMPLETE
482,0.6534556174254831,2023-10-02 12:11:07.722674,2023-10-02 12:11:07.806233,0 days 00:00:00.083559,70.55613787668236,170,lbfgs,COMPLETE
483,0.5,2023-10-02 12:11:07.806233,2023-10-02 12:11:07.852237,0 days 00:00:00.046004,0.20442066579799537,200,saga,COMPLETE
484,0.6534556174254831,2023-10-02 12:11:07.853230,2023-10-02 12:11:07.911460,0 days 00:00:00.058230,50.62126512814712,180,sag,COMPLETE
485,0.6502893328966044,2023-10-02 12:11:07.911460,2023-10-02 12:11:07.988813,0 days 00:00:00.077353,35.06876053695806,170,lbfgs,COMPLETE
486,0.649579648433235,2023-10-02 12:11:07.988813,2023-10-02 12:11:08.066385,0 days 00:00:00.077572,232.38377597789844,190,lbfgs,COMPLETE
487,0.6337482257888415,2023-10-02 12:11:08.067382,2023-10-02 12:11:08.124905,0 days 00:00:00.057523,14.576877995539396,160,saga,COMPLETE
488,0.6534556174254831,2023-10-02 12:11:08.125903,2023-10-02 12:11:08.191948,0 days 00:00:00.066045,103.69907785086511,210,lbfgs,COMPLETE
489,0.643956763838847,2023-10-02 12:11:08.192947,2023-10-02 12:11:08.277072,0 days 00:00:00.084125,24.079259876645125,500,lbfgs,COMPLETE
490,0.6309094879353642,2023-10-02 12:11:08.277072,2023-10-02 12:11:08.356379,0 days 00:00:00.079307,3892.7081129584326,190,lbfgs,COMPLETE
491,0.6520362484987444,2023-10-02 12:11:08.356379,2023-10-02 12:11:08.480026,0 days 00:00:00.123647,1337.1258552533434,460,saga,COMPLETE
492,0.6534556174254831,2023-10-02 12:11:08.480026,2023-10-02 12:11:08.559014,0 days 00:00:00.078988,51.895778031589124,220,lbfgs,COMPLETE
493,0.608417949557812,2023-10-02 12:11:08.559014,2023-10-02 12:11:08.596625,0 days 00:00:00.037611,2.9049561604112766,130,sag,COMPLETE
494,0.6502893328966044,2023-10-02 12:11:08.597629,2023-10-02 12:11:08.647707,0 days 00:00:00.050078,34.59629920612988,180,newton-cg,COMPLETE
495,0.5,2023-10-02 12:11:08.648704,2023-10-02 12:11:08.687346,0 days 00:00:00.038642,0.022499466263754996,200,lbfgs,COMPLETE
496,0.649579648433235,2023-10-02 12:11:08.687346,2023-10-02 12:11:08.787560,0 days 00:00:00.100214,81.98405684841306,330,saga,COMPLETE
497,0.6369145103177202,2023-10-02 12:11:08.787560,2023-10-02 12:11:08.861684,0 days 00:00:00.074124,20.735493826370174,170,lbfgs,COMPLETE
498,0.6386614259198603,2023-10-02 12:11:08.861684,2023-10-02 12:11:08.900221,0 days 00:00:00.038537,490.5668435031317,440,liblinear,COMPLETE
499,0.5,2023-10-02 12:11:08.901215,2023-10-02 12:11:08.945204,0 days 00:00:00.043989,0.00033241010178732027,300,lbfgs,COMPLETE
500,0.5943334425155585,2023-10-02 12:11:08.945204,2023-10-02 12:11:09.012714,0 days 00:00:00.067510,2.1006951478632647,200,lbfgs,COMPLETE
501,0.5,2023-10-02 12:11:09.013714,2023-10-02 12:11:09.245824,0 days 00:00:00.232110,3.956663635325641e-05,420,saga,COMPLETE
502,0.6203734032099574,2023-10-02 12:11:09.245824,2023-10-02 12:11:09.305323,0 days 00:00:00.059499,7.9196801046857255,490,lbfgs,COMPLETE
503,0.6534556174254831,2023-10-02 12:11:09.306323,2023-10-02 12:11:09.373864,0 days 00:00:00.067541,47.42513506610655,140,lbfgs,COMPLETE
504,0.6457036794409869,2023-10-02 12:11:09.373864,2023-10-02 12:11:09.435773,0 days 00:00:00.061909,145.41289999902665,150,sag,COMPLETE
505,0.6298722567965934,2023-10-02 12:11:09.435773,2023-10-02 12:11:09.506381,0 days 00:00:00.070608,14.664924627717568,160,saga,COMPLETE
506,0.6541653018888526,2023-10-02 12:11:09.507392,2023-10-02 12:11:09.583184,0 days 00:00:00.075792,29.427377793227272,220,lbfgs,COMPLETE
507,0.6534556174254831,2023-10-02 12:11:09.584698,2023-10-02 12:11:09.653830,0 days 00:00:00.069132,66.10459504272312,180,lbfgs,COMPLETE
508,0.6534556174254831,2023-10-02 12:11:09.653830,2023-10-02 12:11:09.739970,0 days 00:00:00.086140,42.848210588622294,200,lbfgs,COMPLETE
509,0.6509990173599738,2023-10-02 12:11:09.739970,2023-10-02 12:11:09.815221,0 days 00:00:00.075251,24.095450929190562,210,saga,COMPLETE
510,0.6534556174254831,2023-10-02 12:11:09.816218,2023-10-02 12:11:09.882450,0 days 00:00:00.066232,96.22825016218839,450,lbfgs,COMPLETE
511,0.6267059722677149,2023-10-02 12:11:09.883443,2023-10-02 12:11:10.000035,0 days 00:00:00.116592,11.056750443719624,480,lbfgs,COMPLETE
512,0.6573315864177312,2023-10-02 12:11:10.001033,2023-10-02 12:11:10.060113,0 days 00:00:00.059080,38.44547081161523,190,sag,COMPLETE
513,0.649579648433235,2023-10-02 12:11:10.060113,2023-10-02 12:11:10.171660,0 days 00:00:00.111547,198.87587541955642,370,lbfgs,COMPLETE
514,0.6590785020198712,2023-10-02 12:11:10.171660,2023-10-02 12:11:10.253173,0 days 00:00:00.081513,16387.257783018496,230,saga,COMPLETE
515,0.5619609127634021,2023-10-02 12:11:10.254173,2023-10-02 12:11:10.293929,0 days 00:00:00.039756,0.9713312757716897,230,saga,COMPLETE
516,0.6552025330276231,2023-10-02 12:11:10.294929,2023-10-02 12:11:10.372938,0 days 00:00:00.078009,61088.31547903112,230,saga,COMPLETE
517,0.6411180259853696,2023-10-02 12:11:10.372938,2023-10-02 12:11:10.468485,0 days 00:00:00.095547,5150.965007154461,240,saga,COMPLETE
518,0.6481602795064964,2023-10-02 12:11:10.468485,2023-10-02 12:11:10.553590,0 days 00:00:00.085105,1305.3771131542157,250,saga,COMPLETE
519,0.6449939949776177,2023-10-02 12:11:10.553590,2023-10-02 12:11:10.632826,0 days 00:00:00.079236,284.2451620920887,230,saga,COMPLETE
520,0.6418277104487389,2023-10-02 12:11:10.632826,2023-10-02 12:11:10.722351,0 days 00:00:00.089525,736.7387244373302,270,saga,COMPLETE
521,0.6552025330276231,2023-10-02 12:11:10.722351,2023-10-02 12:11:10.803693,0 days 00:00:00.081342,7482.2268191804105,220,saga,COMPLETE
522,0.6449939949776177,2023-10-02 12:11:10.804700,2023-10-02 12:11:10.883961,0 days 00:00:00.079261,2461.6650737201912,220,saga,COMPLETE
523,0.6520362484987444,2023-10-02 12:11:10.885008,2023-10-02 12:11:10.970698,0 days 00:00:00.085690,13951.734075370261,240,saga,COMPLETE
524,0.637951741456491,2023-10-02 12:11:10.970698,2023-10-02 12:11:11.059945,0 days 00:00:00.089247,19331.4276985723,400,lbfgs,COMPLETE
525,0.6552025330276231,2023-10-02 12:11:11.060009,2023-10-02 12:11:11.140338,0 days 00:00:00.080329,5436.338150985595,210,saga,COMPLETE
526,0.6238672344142374,2023-10-02 12:11:11.141345,2023-10-02 12:11:11.229026,0 days 00:00:00.087681,2588.5299100140855,170,lbfgs,COMPLETE
527,0.6020853805000546,2023-10-02 12:11:11.229026,2023-10-02 12:11:11.288072,0 days 00:00:00.059046,1.7231641175553216,180,lbfgs,COMPLETE
528,0.5,2023-10-02 12:11:11.289070,2023-10-02 12:11:11.336069,0 days 00:00:00.046999,0.030003423326950017,430,lbfgs,COMPLETE
529,0.6481602795064964,2023-10-02 12:11:11.337071,2023-10-02 12:11:11.442591,0 days 00:00:00.105520,13211.027168418748,350,saga,COMPLETE
530,0.637951741456491,2023-10-02 12:11:11.443588,2023-10-02 12:11:11.545504,0 days 00:00:00.101916,8276.44101100322,200,lbfgs,COMPLETE
531,0.6277432034064855,2023-10-02 12:11:11.546496,2023-10-02 12:11:11.587210,0 days 00:00:00.040714,808.780544925669,230,liblinear,COMPLETE
532,0.637951741456491,2023-10-02 12:11:11.588220,2023-10-02 12:11:11.645626,0 days 00:00:00.057406,4625.903472679689,190,newton-cg,COMPLETE
533,0.6386614259198603,2023-10-02 12:11:11.645626,2023-10-02 12:11:11.725212,0 days 00:00:00.079586,413.7091364008072,460,lbfgs,COMPLETE
534,0.6449939949776177,2023-10-02 12:11:11.726211,2023-10-02 12:11:11.861702,0 days 00:00:00.135491,1118.7968307442704,500,saga,COMPLETE
535,0.5,2023-10-02 12:11:11.861702,2023-10-02 12:11:11.909335,0 days 00:00:00.047633,0.1270909224813389,210,lbfgs,COMPLETE
536,0.6069985806310733,2023-10-02 12:11:11.910336,2023-10-02 12:11:11.977351,0 days 00:00:00.067015,4.769299220648843,180,lbfgs,COMPLETE
537,0.5313352986133857,2023-10-02 12:11:11.978349,2023-10-02 12:11:12.026129,0 days 00:00:00.047780,0.5038952531608737,190,saga,COMPLETE
538,0.6238672344142374,2023-10-02 12:11:12.027117,2023-10-02 12:11:12.102304,0 days 00:00:00.075187,2127.6772064880784,320,lbfgs,COMPLETE
539,0.637951741456491,2023-10-02 12:11:12.102304,2023-10-02 12:11:12.185209,0 days 00:00:00.082905,26932.250573800782,240,lbfgs,COMPLETE
540,0.637951741456491,2023-10-02 12:11:12.185209,2023-10-02 12:11:12.275610,0 days 00:00:00.090401,26825.80779387943,470,lbfgs,COMPLETE
541,0.6552025330276231,2023-10-02 12:11:12.276612,2023-10-02 12:11:12.345129,0 days 00:00:00.068517,11612.301757310484,170,saga,COMPLETE
542,0.6238672344142374,2023-10-02 12:11:12.345129,2023-10-02 12:11:12.431758,0 days 00:00:00.086629,2191.4352564618275,490,lbfgs,COMPLETE
543,0.637951741456491,2023-10-02 12:11:12.431758,2023-10-02 12:11:12.528437,0 days 00:00:00.096679,9947.551535740497,210,lbfgs,COMPLETE
544,0.6590785020198712,2023-10-02 12:11:12.529434,2023-10-02 12:11:12.619557,0 days 00:00:00.090123,89650.17433743794,290,saga,COMPLETE
545,0.6481602795064964,2023-10-02 12:11:12.620557,2023-10-02 12:11:12.701181,0 days 00:00:00.080624,15116.234885016283,230,saga,COMPLETE
546,0.6481602795064964,2023-10-02 12:11:12.702180,2023-10-02 12:11:12.783922,0 days 00:00:00.081742,40993.033950828714,220,saga,COMPLETE
547,0.6449939949776177,2023-10-02 12:11:12.784922,2023-10-02 12:11:12.878423,0 days 00:00:00.093501,340.95670620608894,300,saga,COMPLETE
548,0.6552025330276231,2023-10-02 12:11:12.878423,2023-10-02 12:11:12.968002,0 days 00:00:00.089579,10266.172061774945,260,saga,COMPLETE
549,0.5,2023-10-02 12:11:12.969000,2023-10-02 12:11:13.011672,0 days 00:00:00.042672,0.010411230659717049,320,saga,COMPLETE
550,0.6481602795064964,2023-10-02 12:11:13.012668,2023-10-02 12:11:13.104254,0 days 00:00:00.091586,87701.62655615083,290,saga,COMPLETE
551,0.6481602795064964,2023-10-02 12:11:13.104254,2023-10-02 12:11:13.201351,0 days 00:00:00.097097,97410.47897296686,290,saga,COMPLETE
552,0.6590785020198712,2023-10-02 12:11:13.201351,2023-10-02 12:11:13.297046,0 days 00:00:00.095695,92246.33930890002,310,saga,COMPLETE
553,0.6520362484987444,2023-10-02 12:11:13.298044,2023-10-02 12:11:13.393817,0 days 00:00:00.095773,54536.89352860078,300,saga,COMPLETE
554,0.6449939949776177,2023-10-02 12:11:13.394822,2023-10-02 12:11:13.492803,0 days 00:00:00.097981,1178.658788692526,310,saga,COMPLETE
555,0.6449939949776177,2023-10-02 12:11:13.492803,2023-10-02 12:11:13.595324,0 days 00:00:00.102521,99389.55816128236,300,saga,COMPLETE
556,0.5,2023-10-02 12:11:13.595324,2023-10-02 12:11:13.638423,0 days 00:00:00.043099,0.07956515999782957,280,saga,COMPLETE
557,0.6520362484987444,2023-10-02 12:11:13.639424,2023-10-02 12:11:13.732036,0 days 00:00:00.092612,39970.88274529803,290,saga,COMPLETE
558,0.6590785020198712,2023-10-02 12:11:13.732036,2023-10-02 12:11:13.844992,0 days 00:00:00.112956,11952.10537927115,390,saga,COMPLETE
559,0.6481602795064964,2023-10-02 12:11:13.845994,2023-10-02 12:11:13.950631,0 days 00:00:00.104637,30080.509254856737,340,saga,COMPLETE
560,0.634075772464243,2023-10-02 12:11:13.951628,2023-10-02 12:11:14.041218,0 days 00:00:00.089590,12735.378045870259,280,saga,COMPLETE
561,0.6449939949776177,2023-10-02 12:11:14.042299,2023-10-02 12:11:14.123763,0 days 00:00:00.081464,51713.25075861194,220,saga,COMPLETE
562,0.6449939949776177,2023-10-02 12:11:14.123763,2023-10-02 12:11:14.243247,0 days 00:00:00.119484,1707.1342350532689,400,saga,COMPLETE
563,0.6481602795064964,2023-10-02 12:11:14.243247,2023-10-02 12:11:14.339633,0 days 00:00:00.096386,71417.10869616515,280,saga,COMPLETE
564,0.6411180259853696,2023-10-02 12:11:14.340683,2023-10-02 12:11:14.438896,0 days 00:00:00.098213,36561.11937007668,310,saga,COMPLETE
565,0.6590785020198712,2023-10-02 12:11:14.438896,2023-10-02 12:11:14.537776,0 days 00:00:00.098880,19267.36370639885,310,saga,COMPLETE
566,0.6481602795064964,2023-10-02 12:11:14.537776,2023-10-02 12:11:14.639301,0 days 00:00:00.101525,21880.712238364787,310,saga,COMPLETE
567,0.6552025330276231,2023-10-02 12:11:14.639301,2023-10-02 12:11:14.738445,0 days 00:00:00.099144,25788.8033516386,330,saga,COMPLETE
568,0.6520362484987444,2023-10-02 12:11:14.739457,2023-10-02 12:11:14.843984,0 days 00:00:00.104527,3537.0728929303796,310,saga,COMPLETE
569,0.6520362484987444,2023-10-02 12:11:14.844984,2023-10-02 12:11:14.944506,0 days 00:00:00.099522,56847.82937687081,320,saga,COMPLETE
570,0.6552025330276231,2023-10-02 12:11:14.944506,2023-10-02 12:11:15.042848,0 days 00:00:00.098342,29905.468978604713,300,saga,COMPLETE
571,0.6411180259853696,2023-10-02 12:11:15.043914,2023-10-02 12:11:15.154560,0 days 00:00:00.110646,18501.11363414639,370,saga,COMPLETE
572,0.6520362484987444,2023-10-02 12:11:15.155596,2023-10-02 12:11:15.253662,0 days 00:00:00.098066,55145.18620306124,300,saga,COMPLETE
573,0.6520362484987444,2023-10-02 12:11:15.253662,2023-10-02 12:11:15.340261,0 days 00:00:00.086599,95531.30266219426,250,saga,COMPLETE
574,0.6449939949776177,2023-10-02 12:11:15.340261,2023-10-02 12:11:15.437443,0 days 00:00:00.097182,5006.680477114053,290,saga,COMPLETE
575,0.651326564035375,2023-10-02 12:11:15.437443,2023-10-02 12:11:15.552058,0 days 00:00:00.114615,44075.25412004715,390,saga,COMPLETE
576,0.6590785020198712,2023-10-02 12:11:15.553064,2023-10-02 12:11:15.649322,0 days 00:00:00.096258,19885.836997683393,290,saga,COMPLETE
577,0.6449939949776177,2023-10-02 12:11:15.650319,2023-10-02 12:11:15.755119,0 days 00:00:00.104800,16397.12326828013,310,saga,COMPLETE
578,0.6481602795064964,2023-10-02 12:11:15.755119,2023-10-02 12:11:15.850861,0 days 00:00:00.095742,7336.198946351736,290,saga,COMPLETE
579,0.6411180259853696,2023-10-02 12:11:15.851863,2023-10-02 12:11:15.952406,0 days 00:00:00.100543,25053.93225618423,310,saga,COMPLETE
580,0.6481602795064964,2023-10-02 12:11:15.953406,2023-10-02 12:11:16.042211,0 days 00:00:00.088805,17985.046114261608,270,saga,COMPLETE
581,0.6552025330276231,2023-10-02 12:11:16.043211,2023-10-02 12:11:16.138820,0 days 00:00:00.095609,31870.985546950957,290,saga,COMPLETE
582,0.6552025330276231,2023-10-02 12:11:16.139817,2023-10-02 12:11:16.232336,0 days 00:00:00.092519,68783.6149165837,280,saga,COMPLETE
583,0.6481602795064964,2023-10-02 12:11:16.233337,2023-10-02 12:11:16.329444,0 days 00:00:00.096107,36573.85205406833,300,saga,COMPLETE
584,0.6520362484987444,2023-10-02 12:11:16.329444,2023-10-02 12:11:16.429048,0 days 00:00:00.099604,9428.558889201331,310,saga,COMPLETE
585,0.6552025330276231,2023-10-02 12:11:16.430043,2023-10-02 12:11:16.515563,0 days 00:00:00.085520,7247.557019160141,250,saga,COMPLETE
586,0.6520362484987444,2023-10-02 12:11:16.516563,2023-10-02 12:11:16.611509,0 days 00:00:00.094946,40158.11425073669,290,saga,COMPLETE
587,0.6552025330276231,2023-10-02 12:11:16.612507,2023-10-02 12:11:16.726765,0 days 00:00:00.114258,64975.79073072734,390,saga,COMPLETE
588,0.6449939949776177,2023-10-02 12:11:16.726765,2023-10-02 12:11:16.857669,0 days 00:00:00.130904,19592.89039433719,480,saga,COMPLETE
589,0.6411180259853696,2023-10-02 12:11:16.857669,2023-10-02 12:11:16.958191,0 days 00:00:00.100522,8716.448120094146,320,saga,COMPLETE
590,0.6552025330276231,2023-10-02 12:11:16.959189,2023-10-02 12:11:17.096247,0 days 00:00:00.137058,12956.35442312192,500,saga,COMPLETE
591,0.6411180259853696,2023-10-02 12:11:17.097253,2023-10-02 12:11:17.187352,0 days 00:00:00.090099,3653.512507732545,270,saga,COMPLETE
592,0.6552025330276231,2023-10-02 12:11:17.187352,2023-10-02 12:11:17.307691,0 days 00:00:00.120339,20291.906717010046,380,saga,COMPLETE
593,0.6449939949776177,2023-10-02 12:11:17.308692,2023-10-02 12:11:17.412140,0 days 00:00:00.103448,500.0746434322381,300,saga,COMPLETE
594,0.6449939949776177,2023-10-02 12:11:17.413140,2023-10-02 12:11:17.483241,0 days 00:00:00.070101,92751.11525353233,240,newton-cg,COMPLETE
595,0.6481602795064964,2023-10-02 12:11:17.483241,2023-10-02 12:11:17.571571,0 days 00:00:00.088330,59816.90910620079,230,saga,COMPLETE
596,0.5,2023-10-02 12:11:17.571571,2023-10-02 12:11:17.609101,0 days 00:00:00.037530,0.3095225202321912,360,liblinear,COMPLETE
597,0.6520362484987444,2023-10-02 12:11:17.610101,2023-10-02 12:11:17.709733,0 days 00:00:00.099632,3144.2296162983675,320,saga,COMPLETE
598,0.6520362484987444,2023-10-02 12:11:17.709733,2023-10-02 12:11:17.815956,0 days 00:00:00.106223,13382.430773218683,330,saga,COMPLETE
599,0.6481602795064964,2023-10-02 12:11:17.816956,2023-10-02 12:11:17.895479,0 days 00:00:00.078523,5673.475985330173,210,saga,COMPLETE
600,0.6520362484987444,2023-10-02 12:11:17.895479,2023-10-02 12:11:17.978493,0 days 00:00:00.083014,30689.668515861405,220,saga,COMPLETE
601,0.6449939949776177,2023-10-02 12:11:17.978493,2023-10-02 12:11:18.102408,0 days 00:00:00.123915,27991.273343468958,410,saga,COMPLETE
602,0.6488699639698657,2023-10-02 12:11:18.102408,2023-10-02 12:11:18.181664,0 days 00:00:00.079256,922.8042974242896,200,saga,COMPLETE
603,0.6481602795064964,2023-10-02 12:11:18.181664,2023-10-02 12:11:18.273193,0 days 00:00:00.091529,76487.17709168472,260,saga,COMPLETE
604,0.6449939949776177,2023-10-02 12:11:18.274191,2023-10-02 12:11:18.398269,0 days 00:00:00.124078,8514.502473805727,420,saga,COMPLETE
605,0.604541980565564,2023-10-02 12:11:18.398269,2023-10-02 12:11:18.455378,0 days 00:00:00.057109,2.9852955215784833,210,saga,COMPLETE
606,0.6449939949776177,2023-10-02 12:11:18.456378,2023-10-02 12:11:18.593117,0 days 00:00:00.136739,50195.512226331426,490,saga,COMPLETE
607,0.5,2023-10-02 12:11:18.593117,2023-10-02 12:11:18.642215,0 days 00:00:00.049098,0.03961895891896706,220,newton-cg,COMPLETE
608,0.6411180259853696,2023-10-02 12:11:18.643216,2023-10-02 12:11:18.745667,0 days 00:00:00.102451,1943.4984384360616,290,saga,COMPLETE
609,0.5,2023-10-02 12:11:18.745667,2023-10-02 12:11:18.790679,0 days 00:00:00.045012,0.07265314582224867,280,liblinear,COMPLETE
610,0.6520362484987444,2023-10-02 12:11:18.790679,2023-10-02 12:11:18.929916,0 days 00:00:00.139237,3571.36780936077,480,saga,COMPLETE
611,0.6481602795064964,2023-10-02 12:11:18.929916,2023-10-02 12:11:19.040533,0 days 00:00:00.110617,20537.685398964877,300,saga,COMPLETE
612,0.6481602795064964,2023-10-02 12:11:19.040533,2023-10-02 12:11:19.123607,0 days 00:00:00.083074,5835.297203173635,200,saga,COMPLETE
613,0.5690031662845288,2023-10-02 12:11:19.124606,2023-10-02 12:11:19.170606,0 days 00:00:00.046000,1.0189956900003803,340,saga,COMPLETE
614,0.6140408341522,2023-10-02 12:11:19.170606,2023-10-02 12:11:19.228687,0 days 00:00:00.058081,4.899735551545983,230,saga,COMPLETE
615,0.6418277104487389,2023-10-02 12:11:19.228687,2023-10-02 12:11:19.327210,0 days 00:00:00.098523,236.77536943771568,310,saga,COMPLETE
616,0.6481602795064964,2023-10-02 12:11:19.328213,2023-10-02 12:11:19.404731,0 days 00:00:00.076518,98021.48710352833,200,saga,COMPLETE
617,0.5,2023-10-02 12:11:19.405733,2023-10-02 12:11:19.486214,0 days 00:00:00.080481,0.0021525881413276965,350,saga,COMPLETE
618,0.6552025330276231,2023-10-02 12:11:19.487214,2023-10-02 12:11:19.566215,0 days 00:00:00.079001,10968.318510838033,210,saga,COMPLETE
619,0.6449939949776177,2023-10-02 12:11:19.567210,2023-10-02 12:11:19.702922,0 days 00:00:00.135712,1491.8445178605039,500,saga,COMPLETE
620,0.637951741456491,2023-10-02 12:11:19.703913,2023-10-02 12:11:19.764891,0 days 00:00:00.060978,16967.365428077952,210,newton-cg,COMPLETE
621,0.6449939949776177,2023-10-02 12:11:19.765891,2023-10-02 12:11:19.847561,0 days 00:00:00.081670,30644.568640380872,220,saga,COMPLETE
622,0.6020853805000546,2023-10-02 12:11:19.847561,2023-10-02 12:11:19.886565,0 days 00:00:00.039004,1.7364028182442188,200,liblinear,COMPLETE
623,0.5478764057211486,2023-10-02 12:11:19.887567,2023-10-02 12:11:19.930182,0 days 00:00:00.042615,0.7307688871314217,270,saga,COMPLETE
624,0.6481602795064964,2023-10-02 12:11:19.931230,2023-10-02 12:11:20.028867,0 days 00:00:00.097637,46052.67594904746,300,saga,COMPLETE
625,0.6062888961677039,2023-10-02 12:11:20.028867,2023-10-02 12:11:20.088875,0 days 00:00:00.060008,6.154885736777737,240,lbfgs,COMPLETE
626,0.6449939949776177,2023-10-02 12:11:20.089882,2023-10-02 12:11:20.225372,0 days 00:00:00.135490,520.7231007429334,470,saga,COMPLETE
627,0.6316191723987334,2023-10-02 12:11:20.226374,2023-10-02 12:11:20.324058,0 days 00:00:00.097684,684.6509077334606,320,lbfgs,COMPLETE
628,0.6418277104487389,2023-10-02 12:11:20.325054,2023-10-02 12:11:20.408902,0 days 00:00:00.083848,175.39200247507523,220,saga,COMPLETE
629,0.637951741456491,2023-10-02 12:11:20.408902,2023-10-02 12:11:20.492908,0 days 00:00:00.084006,42223.88365209908,450,lbfgs,COMPLETE
630,0.6411180259853696,2023-10-02 12:11:20.493906,2023-10-02 12:11:20.610409,0 days 00:00:00.116503,12043.179340548651,400,saga,COMPLETE
631,0.5,2023-10-02 12:11:20.611409,2023-10-02 12:11:20.666026,0 days 00:00:00.054617,0.2650328714300334,290,lbfgs,COMPLETE
632,0.6411180259853696,2023-10-02 12:11:20.666026,2023-10-02 12:11:20.744469,0 days 00:00:00.078443,2752.993568955156,190,saga,COMPLETE
633,0.637951741456491,2023-10-02 12:11:20.744469,2023-10-02 12:11:20.828016,0 days 00:00:00.083547,21014.15908752388,490,lbfgs,COMPLETE
634,0.5,2023-10-02 12:11:20.829014,2023-10-02 12:11:20.874962,0 days 00:00:00.045948,0.14249007749343806,330,saga,COMPLETE
635,0.6277432034064855,2023-10-02 12:11:20.875963,2023-10-02 12:11:20.962748,0 days 00:00:00.086785,1121.9846361152463,310,lbfgs,COMPLETE
636,0.5,2023-10-02 12:11:20.962748,2023-10-02 12:11:21.012106,0 days 00:00:00.049358,0.012613239193418507,280,saga,COMPLETE
637,0.6457036794409869,2023-10-02 12:11:21.013113,2023-10-02 12:11:21.110629,0 days 00:00:00.097516,311.6762279548304,210,lbfgs,COMPLETE
638,0.5,2023-10-02 12:11:21.111634,2023-10-02 12:11:21.160748,0 days 00:00:00.049114,0.0009762084761901656,230,lbfgs,COMPLETE
639,0.6274156567310841,2023-10-02 12:11:21.161745,2023-10-02 12:11:21.224495,0 days 00:00:00.062750,7.675152363536718,440,saga,COMPLETE
640,0.637951741456491,2023-10-02 12:11:21.224495,2023-10-02 12:11:21.301711,0 days 00:00:00.077216,65861.16137788456,200,lbfgs,COMPLETE
641,0.6069985806310733,2023-10-02 12:11:21.302716,2023-10-02 12:11:21.365819,0 days 00:00:00.063103,3.9802661689153997,410,saga,COMPLETE
