number,value,datetime_start,datetime_complete,duration,params_C,params_max_iter,params_solver,state
5200,0.6520362484987444,2023-10-02 12:29:07.862909,2023-10-02 12:29:08.256990,0 days 00:00:00.394081,4773.583540356494,340,sag,COMPLETE
5201,0.5,2023-10-02 12:29:08.258987,2023-10-02 12:29:08.504395,0 days 00:00:00.245408,0.030383106679830768,490,sag,COMPLETE
5202,0.6629544710121192,2023-10-02 12:29:08.506401,2023-10-02 12:29:08.836843,0 days 00:00:00.330442,19773.43664000389,480,sag,COMPLETE
5203,0.6457036794409869,2023-10-02 12:29:08.838846,2023-10-02 12:29:09.210743,0 days 00:00:00.371897,176.77352600032265,330,sag,COMPLETE
5204,0.5,2023-10-02 12:29:09.212739,2023-10-02 12:29:09.460739,0 days 00:00:00.248000,0.2443236504943379,400,sag,COMPLETE
5205,0.5,2023-10-02 12:29:09.460739,2023-10-02 12:29:09.827283,0 days 00:00:00.366544,0.003681368003168512,500,sag,COMPLETE
5206,0.5,2023-10-02 12:29:09.828283,2023-10-02 12:29:10.099231,0 days 00:00:00.270948,0.11328864075666288,480,sag,COMPLETE
5207,0.669996724533246,2023-10-02 12:29:10.101229,2023-10-02 12:29:10.521121,0 days 00:00:00.419892,13680.408365207059,490,sag,COMPLETE
5208,0.5,2023-10-02 12:29:10.522121,2023-10-02 12:29:10.776507,0 days 00:00:00.254386,0.04687241947995733,500,newton-cg,COMPLETE
5209,0.6534556174254831,2023-10-02 12:29:10.777507,2023-10-02 12:29:11.052769,0 days 00:00:00.275262,91.54236527382828,350,sag,COMPLETE
5210,0.6277432034064855,2023-10-02 12:29:11.054764,2023-10-02 12:29:11.387629,0 days 00:00:00.332865,1161.7868996255847,130,liblinear,COMPLETE
5211,0.6520362484987444,2023-10-02 12:29:11.387629,2023-10-02 12:29:11.752723,0 days 00:00:00.365094,3482.8005132901053,490,sag,COMPLETE
5212,0.634075772464243,2023-10-02 12:29:11.754724,2023-10-02 12:29:12.191925,0 days 00:00:00.437201,7806.427452629786,480,sag,COMPLETE
5213,0.528169014084507,2023-10-02 12:29:12.195944,2023-10-02 12:29:12.471696,0 days 00:00:00.275752,0.41828628585108374,500,sag,COMPLETE
5214,0.6590785020198712,2023-10-02 12:29:12.472696,2023-10-02 12:29:12.893166,0 days 00:00:00.420470,1446.7337028476757,480,sag,COMPLETE
5215,0.643956763838847,2023-10-02 12:29:12.895159,2023-10-02 12:29:13.151002,0 days 00:00:00.255843,26.227681172705676,500,sag,COMPLETE
5216,0.6590785020198712,2023-10-02 12:29:13.151002,2023-10-02 12:29:13.477604,0 days 00:00:00.326602,21438.04615393441,390,sag,COMPLETE
5217,0.5,2023-10-02 12:29:13.478604,2023-10-02 12:29:13.848013,0 days 00:00:00.369409,0.0002800703840145775,340,sag,COMPLETE
5218,0.5,2023-10-02 12:29:13.849017,2023-10-02 12:29:14.104126,0 days 00:00:00.255109,0.308593452948131,320,sag,COMPLETE
5219,0.6590785020198712,2023-10-02 12:29:14.105125,2023-10-02 12:29:14.540690,0 days 00:00:00.435565,12205.856579159465,490,sag,COMPLETE
5220,0.6386614259198603,2023-10-02 12:29:14.542725,2023-10-02 12:29:14.843927,0 days 00:00:00.301202,388.3540550291716,420,lbfgs,COMPLETE
5221,0.6203734032099574,2023-10-02 12:29:14.843927,2023-10-02 12:29:15.177299,0 days 00:00:00.333372,8.164214675974478,490,sag,COMPLETE
5222,0.5,2023-10-02 12:29:15.177299,2023-10-02 12:29:15.428339,0 days 00:00:00.251040,0.009178166307276789,350,sag,COMPLETE
5223,0.5313352986133857,2023-10-02 12:29:15.428339,2023-10-02 12:29:15.759811,0 days 00:00:00.331472,0.5213782683735483,480,sag,COMPLETE
5224,0.6590785020198712,2023-10-02 12:29:15.759811,2023-10-02 12:29:16.093208,0 days 00:00:00.333397,6286.041998894397,490,sag,COMPLETE
5225,0.6590785020198712,2023-10-02 12:29:16.093208,2023-10-02 12:29:16.448480,0 days 00:00:00.355272,20144.850687295875,500,sag,COMPLETE
5226,0.5,2023-10-02 12:29:16.449481,2023-10-02 12:29:16.794600,0 days 00:00:00.345119,0.10827057556259369,480,sag,COMPLETE
5227,0.5,2023-10-02 12:29:16.794600,2023-10-02 12:29:17.093041,0 days 00:00:00.298441,0.0002549205434806747,490,sag,COMPLETE
5228,0.5,2023-10-02 12:29:17.094128,2023-10-02 12:29:17.461540,0 days 00:00:00.367412,0.0009166351882671153,330,sag,COMPLETE
5229,0.649579648433235,2023-10-02 12:29:17.461540,2023-10-02 12:29:17.759090,0 days 00:00:00.297550,137.94212771689678,360,sag,COMPLETE
5230,0.6449939949776177,2023-10-02 12:29:17.760988,2023-10-02 12:29:18.175054,0 days 00:00:00.414066,2190.842674637084,500,sag,COMPLETE
5231,0.6520362484987444,2023-10-02 12:29:18.176054,2023-10-02 12:29:18.530898,0 days 00:00:00.354844,12969.083850762609,480,sag,COMPLETE
5232,0.6309094879353642,2023-10-02 12:29:18.530898,2023-10-02 12:29:18.905595,0 days 00:00:00.374697,4353.156272939495,260,newton-cg,COMPLETE
5233,0.6457036794409869,2023-10-02 12:29:18.906595,2023-10-02 12:29:19.294540,0 days 00:00:00.387945,250.08954075465925,500,sag,COMPLETE
5234,0.6449939949776177,2023-10-02 12:29:19.294540,2023-10-02 12:29:19.628040,0 days 00:00:00.333500,903.6651170306994,340,sag,COMPLETE
5235,0.637951741456491,2023-10-02 12:29:19.628040,2023-10-02 12:29:19.982630,0 days 00:00:00.354590,22736.21901038751,350,liblinear,COMPLETE
5236,0.6590785020198712,2023-10-02 12:29:19.983630,2023-10-02 12:29:20.331138,0 days 00:00:00.347508,10654.495296465757,490,sag,COMPLETE
5237,0.6457036794409869,2023-10-02 12:29:20.332135,2023-10-02 12:29:20.726252,0 days 00:00:00.394117,167.14629318471276,490,sag,COMPLETE
5238,0.6520362484987444,2023-10-02 12:29:20.729072,2023-10-02 12:29:21.084281,0 days 00:00:00.355209,7315.214177871781,480,sag,COMPLETE
5239,0.5,2023-10-02 12:29:21.085276,2023-10-02 12:29:21.737631,0 days 00:00:00.652355,3.299831144486003e-05,500,sag,COMPLETE
5240,0.6369145103177202,2023-10-02 12:29:21.738627,2023-10-02 12:29:22.081374,0 days 00:00:00.342747,19.30635874497521,480,sag,COMPLETE
5241,0.6590785020198712,2023-10-02 12:29:22.082374,2023-10-02 12:29:22.411860,0 days 00:00:00.329486,2988.7100993893323,350,sag,COMPLETE
5242,0.5,2023-10-02 12:29:22.413864,2023-10-02 12:29:22.773177,0 days 00:00:00.359313,0.001639665889639012,490,sag,COMPLETE
5243,0.5,2023-10-02 12:29:22.774174,2023-10-02 12:29:23.080634,0 days 00:00:00.306460,0.00015949444726691268,410,sag,COMPLETE
5244,0.5,2023-10-02 12:29:23.080634,2023-10-02 12:29:23.579083,0 days 00:00:00.498449,7.250342779842014e-05,330,sag,COMPLETE
5245,0.637951741456491,2023-10-02 12:29:23.580012,2023-10-02 12:29:23.873587,0 days 00:00:00.293575,26366.916857307395,360,lbfgs,COMPLETE
5246,0.6534556174254831,2023-10-02 12:29:23.875587,2023-10-02 12:29:24.154810,0 days 00:00:00.279223,105.83525891149587,500,sag,COMPLETE
5247,0.5,2023-10-02 12:29:24.156805,2023-10-02 12:29:24.490469,0 days 00:00:00.333664,0.05796333310878497,380,sag,COMPLETE
5248,0.6298722567965934,2023-10-02 12:29:24.492469,2023-10-02 12:29:24.744402,0 days 00:00:00.251933,16.180153617400208,480,sag,COMPLETE
5249,0.6449939949776177,2023-10-02 12:29:24.746408,2023-10-02 12:29:25.141804,0 days 00:00:00.395396,14699.082589538304,390,sag,COMPLETE
5250,0.6418277104487389,2023-10-02 12:29:25.143804,2023-10-02 12:29:25.448141,0 days 00:00:00.304337,272.0181440403102,490,sag,COMPLETE
5251,0.6267059722677149,2023-10-02 12:29:25.448141,2023-10-02 12:29:25.781571,0 days 00:00:00.333430,10.958755995422003,500,sag,COMPLETE
5252,0.5,2023-10-02 12:29:25.781571,2023-10-02 12:29:26.037624,0 days 00:00:00.256053,0.004471597268002728,480,sag,COMPLETE
5253,0.666120755540998,2023-10-02 12:29:26.037624,2023-10-02 12:29:26.350778,0 days 00:00:00.313154,6208.291317285828,360,sag,COMPLETE
5254,0.5,2023-10-02 12:29:26.352772,2023-10-02 12:29:26.897592,0 days 00:00:00.544820,4.9440642979775035e-05,340,sag,COMPLETE
5255,0.5,2023-10-02 12:29:26.897592,2023-10-02 12:29:27.152132,0 days 00:00:00.254540,0.018430248118494433,500,sag,COMPLETE
5256,0.6520362484987444,2023-10-02 12:29:27.154143,2023-10-02 12:29:27.583957,0 days 00:00:00.429814,25995.037890377942,490,sag,COMPLETE
5257,0.5619609127634021,2023-10-02 12:29:27.583957,2023-10-02 12:29:27.864718,0 days 00:00:00.280761,0.8442220059269432,490,newton-cg,COMPLETE
5258,0.5,2023-10-02 12:29:27.866920,2023-10-02 12:29:28.446464,0 days 00:00:00.579544,5.252268729940985e-05,480,sag,COMPLETE
5259,0.666120755540998,2023-10-02 12:29:28.446464,2023-10-02 12:29:28.760024,0 days 00:00:00.313560,3488.3864954162955,310,sag,COMPLETE
5260,0.5,2023-10-02 12:29:28.760024,2023-10-02 12:29:29.010848,0 days 00:00:00.250824,0.035981395312556855,290,sag,COMPLETE
5261,0.637951741456491,2023-10-02 12:29:29.010848,2023-10-02 12:29:29.346577,0 days 00:00:00.335729,9476.069752980435,350,liblinear,COMPLETE
5262,0.6449939949776177,2023-10-02 12:29:29.362226,2023-10-02 12:29:29.671113,0 days 00:00:00.308887,1728.3611611104086,320,sag,COMPLETE
5263,0.5,2023-10-02 12:29:29.671113,2023-10-02 12:29:30.031248,0 days 00:00:00.360135,0.010929907661408755,500,sag,COMPLETE
5264,0.666120755540998,2023-10-02 12:29:30.031248,2023-10-02 12:29:30.361266,0 days 00:00:00.330018,19423.482972612986,480,sag,COMPLETE
5265,0.6481602795064964,2023-10-02 12:29:30.361266,2023-10-02 12:29:30.784587,0 days 00:00:00.423321,29882.41028565994,380,sag,COMPLETE
5266,0.6534556174254831,2023-10-02 12:29:30.784587,2023-10-02 12:29:31.067087,0 days 00:00:00.282500,82.43974596402347,340,sag,COMPLETE
5267,0.6590785020198712,2023-10-02 12:29:31.067087,2023-10-02 12:29:31.427750,0 days 00:00:00.360663,14128.074480192608,490,sag,COMPLETE
5268,0.6520362484987444,2023-10-02 12:29:31.427750,2023-10-02 12:29:31.898076,0 days 00:00:00.470326,6525.37282824429,500,sag,COMPLETE
5269,0.5,2023-10-02 12:29:31.898076,2023-10-02 12:29:32.149353,0 days 00:00:00.251277,0.013712647004425737,360,sag,COMPLETE
5270,0.5996287804345454,2023-10-02 12:29:32.149353,2023-10-02 12:29:32.498554,0 days 00:00:00.349201,1.4300200292757865,490,sag,COMPLETE
5271,0.6277432034064855,2023-10-02 12:29:32.498554,2023-10-02 12:29:32.818170,0 days 00:00:00.319616,999.1452458346184,480,lbfgs,COMPLETE
5272,0.6590785020198712,2023-10-02 12:29:32.818170,2023-10-02 12:29:33.401439,0 days 00:00:00.583269,30861.84194115428,500,sag,COMPLETE
5273,0.608417949557812,2023-10-02 12:29:33.401439,2023-10-02 12:29:33.663959,0 days 00:00:00.262520,2.6317939169897047,480,sag,COMPLETE
5274,0.5313352986133857,2023-10-02 12:29:33.665959,2023-10-02 12:29:33.919708,0 days 00:00:00.253749,0.514235361078547,490,sag,COMPLETE
5275,0.5,2023-10-02 12:29:33.919708,2023-10-02 12:29:34.278831,0 days 00:00:00.359123,0.0020722032652197176,330,sag,COMPLETE
5276,0.666120755540998,2023-10-02 12:29:34.278831,2023-10-02 12:29:34.626115,0 days 00:00:00.347284,5029.362802028313,350,sag,COMPLETE
5277,0.6590785020198712,2023-10-02 12:29:34.626115,2023-10-02 12:29:35.051753,0 days 00:00:00.425638,9531.13449984044,500,sag,COMPLETE
5278,0.6020853805000546,2023-10-02 12:29:35.051753,2023-10-02 12:29:35.299988,0 days 00:00:00.248235,1.8110546563402696,480,sag,COMPLETE
5279,0.6203734032099574,2023-10-02 12:29:35.299988,2023-10-02 12:29:35.652253,0 days 00:00:00.352265,7.566253210124133,490,sag,COMPLETE
5280,0.6069985806310733,2023-10-02 12:29:35.652253,2023-10-02 12:29:35.919092,0 days 00:00:00.266839,4.204724078224143,500,sag,COMPLETE
5281,0.6520362484987444,2023-10-02 12:29:35.919092,2023-10-02 12:29:36.252418,0 days 00:00:00.333326,2597.454481887527,360,sag,COMPLETE
5282,0.637951741456491,2023-10-02 12:29:36.252418,2023-10-02 12:29:36.604454,0 days 00:00:00.352036,17745.530873705447,490,newton-cg,COMPLETE
5283,0.6534556174254831,2023-10-02 12:29:36.604454,2023-10-02 12:29:36.889984,0 days 00:00:00.285530,62.91672126937319,350,sag,COMPLETE
5284,0.6298722567965934,2023-10-02 12:29:36.891984,2023-10-02 12:29:37.216849,0 days 00:00:00.324865,18.58962690316966,380,sag,COMPLETE
5285,0.6590785020198712,2023-10-02 12:29:37.232473,2023-10-02 12:29:37.546530,0 days 00:00:00.314057,27540.92851789759,340,sag,COMPLETE
5286,0.5,2023-10-02 12:29:37.555079,2023-10-02 12:29:37.877848,0 days 00:00:00.322769,0.00020764108582043908,480,liblinear,COMPLETE
5287,0.6520362484987444,2023-10-02 12:29:37.877848,2023-10-02 12:29:38.223076,0 days 00:00:00.345228,10667.84575214137,490,sag,COMPLETE
5288,0.666120755540998,2023-10-02 12:29:38.223076,2023-10-02 12:29:38.555958,0 days 00:00:00.332882,4238.012078267661,500,sag,COMPLETE
5289,0.6411180259853696,2023-10-02 12:29:38.569007,2023-10-02 12:29:38.998185,0 days 00:00:00.429178,35037.37180120436,480,sag,COMPLETE
5290,0.6590785020198712,2023-10-02 12:29:38.999185,2023-10-02 12:29:39.328849,0 days 00:00:00.329664,15801.307876488609,370,sag,COMPLETE
5291,0.6629544710121192,2023-10-02 12:29:39.329859,2023-10-02 12:29:39.721218,0 days 00:00:00.391359,7714.645884540724,400,sag,COMPLETE
5292,0.6534556174254831,2023-10-02 12:29:39.721218,2023-10-02 12:29:39.999739,0 days 00:00:00.278521,44.52863274253599,490,sag,COMPLETE
5293,0.6590785020198712,2023-10-02 12:29:39.999739,2023-10-02 12:29:40.425488,0 days 00:00:00.425749,22864.200973997846,500,sag,COMPLETE
5294,0.5,2023-10-02 12:29:40.426683,2023-10-02 12:29:40.670751,0 days 00:00:00.244068,0.24133010895047893,480,sag,COMPLETE
5295,0.6277432034064855,2023-10-02 12:29:40.670751,2023-10-02 12:29:41.031850,0 days 00:00:00.361099,830.2820224714202,340,lbfgs,COMPLETE
5296,0.5,2023-10-02 12:29:41.031850,2023-10-02 12:29:41.299091,0 days 00:00:00.267241,0.0016445621472964541,420,sag,COMPLETE
5297,0.6520362484987444,2023-10-02 12:29:41.299091,2023-10-02 12:29:41.643723,0 days 00:00:00.344632,37387.4727956203,470,sag,COMPLETE
5298,0.6534556174254831,2023-10-02 12:29:41.643723,2023-10-02 12:29:41.989225,0 days 00:00:00.345502,48.126151893946556,330,sag,COMPLETE
5299,0.6449939949776177,2023-10-02 12:29:41.989225,2023-10-02 12:29:42.319269,0 days 00:00:00.330044,11628.441376189952,500,sag,COMPLETE
5300,0.6449939949776177,2023-10-02 12:29:42.334859,2023-10-02 12:29:42.727696,0 days 00:00:00.392837,20429.48193097848,360,sag,COMPLETE
5301,0.5,2023-10-02 12:29:42.727696,2023-10-02 12:29:42.978922,0 days 00:00:00.251226,0.007549228074442375,490,sag,COMPLETE
5302,0.5,2023-10-02 12:29:42.978922,2023-10-02 12:29:43.308425,0 days 00:00:00.329503,0.11982063801850901,500,sag,COMPLETE
5303,0.6449939949776177,2023-10-02 12:29:43.308425,2023-10-02 12:29:43.653952,0 days 00:00:00.345527,4969.66570382519,490,sag,COMPLETE
5304,0.6520362484987444,2023-10-02 12:29:43.653952,2023-10-02 12:29:43.952774,0 days 00:00:00.298822,98734.020899033,350,sag,COMPLETE
5305,0.6520362484987444,2023-10-02 12:29:43.952774,2023-10-02 12:29:44.377218,0 days 00:00:00.424444,1991.7741733227815,480,sag,COMPLETE
5306,0.6552025330276231,2023-10-02 12:29:44.377218,2023-10-02 12:29:44.691362,0 days 00:00:00.314144,40529.45482594199,370,sag,COMPLETE
5307,0.6238672344142374,2023-10-02 12:29:44.706678,2023-10-02 12:29:45.114071,0 days 00:00:00.407393,2830.8324522060398,470,newton-cg,COMPLETE
5308,0.666120755540998,2023-10-02 12:29:45.114071,2023-10-02 12:29:45.522422,0 days 00:00:00.408351,9244.339376165322,360,sag,COMPLETE
5309,0.5,2023-10-02 12:29:45.522422,2023-10-02 12:29:46.023032,0 days 00:00:00.500610,0.0008170739248930162,390,sag,COMPLETE
5310,0.6062888961677039,2023-10-02 12:29:46.023032,2023-10-02 12:29:46.376064,0 days 00:00:00.353032,5.442440511693787,480,liblinear,COMPLETE
5311,0.666120755540998,2023-10-02 12:29:46.376064,2023-10-02 12:29:46.840098,0 days 00:00:00.464034,15682.718082228153,500,sag,COMPLETE
5312,0.637951741456491,2023-10-02 12:29:46.840256,2023-10-02 12:29:47.402261,0 days 00:00:00.562005,6235.141697541175,490,sag,COMPLETE
5313,0.5,2023-10-02 12:29:47.405258,2023-10-02 12:29:47.730720,0 days 00:00:00.325462,0.0012852676806046155,340,sag,COMPLETE
5314,0.5,2023-10-02 12:29:47.732724,2023-10-02 12:29:48.079112,0 days 00:00:00.346388,0.0032237137753964224,480,sag,COMPLETE
5315,0.5,2023-10-02 12:29:48.081108,2023-10-02 12:29:48.407322,0 days 00:00:00.326214,0.029026658363859044,380,sag,COMPLETE
5316,0.6059613494923026,2023-10-02 12:29:48.407322,2023-10-02 12:29:48.824235,0 days 00:00:00.416913,1.6456863126989036,320,sag,COMPLETE
5317,0.6520362484987444,2023-10-02 12:29:48.824235,2023-10-02 12:29:49.190811,0 days 00:00:00.366576,99572.73860449917,490,sag,COMPLETE
5318,0.666120755540998,2023-10-02 12:29:49.190811,2023-10-02 12:29:49.550445,0 days 00:00:00.359634,27686.958168440637,470,sag,COMPLETE
5319,0.637951741456491,2023-10-02 12:29:49.551445,2023-10-02 12:29:49.957905,0 days 00:00:00.406460,651.0834468635346,430,sag,COMPLETE
5320,0.5,2023-10-02 12:29:49.957905,2023-10-02 12:29:50.969369,0 days 00:00:01.011464,1.663206595953007e-05,500,sag,COMPLETE
5321,0.6534556174254831,2023-10-02 12:29:50.970369,2023-10-02 12:29:51.391744,0 days 00:00:00.421375,168.37345777940652,500,lbfgs,COMPLETE
5322,0.6449939949776177,2023-10-02 12:29:51.391744,2023-10-02 12:29:51.844245,0 days 00:00:00.452501,49387.855983425776,490,sag,COMPLETE
5323,0.5,2023-10-02 12:29:51.846239,2023-10-02 12:29:52.286642,0 days 00:00:00.440403,0.0006545585801195837,330,sag,COMPLETE
5324,0.6418277104487389,2023-10-02 12:29:52.287642,2023-10-02 12:29:52.614110,0 days 00:00:00.326468,305.3535463424918,300,sag,COMPLETE
5325,0.6069985806310733,2023-10-02 12:29:52.616112,2023-10-02 12:29:52.900843,0 days 00:00:00.284731,4.685691339484395,160,sag,COMPLETE
5326,0.5,2023-10-02 12:29:52.902848,2023-10-02 12:29:53.288547,0 days 00:00:00.385699,0.000502550271106625,490,sag,COMPLETE
5327,0.5,2023-10-02 12:29:53.290539,2023-10-02 12:29:53.568750,0 days 00:00:00.278211,0.2775528437085847,350,sag,COMPLETE
5328,0.6534556174254831,2023-10-02 12:29:53.570750,2023-10-02 12:29:53.998637,0 days 00:00:00.427887,116.81603126934769,480,sag,COMPLETE
5329,0.6449939949776177,2023-10-02 12:29:54.000642,2023-10-02 12:29:54.395043,0 days 00:00:00.394401,1445.0195606178518,360,sag,COMPLETE
5330,0.6449939949776177,2023-10-02 12:29:54.397044,2023-10-02 12:29:55.027052,0 days 00:00:00.630008,3955.8811020609046,500,sag,COMPLETE
5331,0.6449939949776177,2023-10-02 12:29:55.027052,2023-10-02 12:29:55.542450,0 days 00:00:00.515398,12853.280451796278,370,sag,COMPLETE
5332,0.637951741456491,2023-10-02 12:29:55.542450,2023-10-02 12:29:56.085769,0 days 00:00:00.543319,25867.118502301953,470,newton-cg,COMPLETE
5333,0.6267059722677149,2023-10-02 12:29:56.088771,2023-10-02 12:29:56.654345,0 days 00:00:00.565574,10.127632180940443,480,sag,COMPLETE
5334,0.5,2023-10-02 12:29:56.656343,2023-10-02 12:29:58.567074,0 days 00:00:01.910731,1.1869934941112949e-05,490,sag,COMPLETE
5335,0.5,2023-10-02 12:29:58.569074,2023-10-02 12:29:58.927215,0 days 00:00:00.358141,6.011699348487492e-05,340,liblinear,COMPLETE
5336,0.6590785020198712,2023-10-02 12:29:58.929214,2023-10-02 12:29:59.306386,0 days 00:00:00.377172,67522.92947647363,500,sag,COMPLETE
5337,0.5,2023-10-02 12:29:59.308384,2023-10-02 12:29:59.872107,0 days 00:00:00.563723,0.003131534214765263,350,sag,COMPLETE
5338,0.6590785020198712,2023-10-02 12:29:59.873107,2023-10-02 12:30:00.288772,0 days 00:00:00.415665,7332.2172353521855,470,sag,COMPLETE
5339,0.6590785020198712,2023-10-02 12:30:00.289772,2023-10-02 12:30:00.729999,0 days 00:00:00.440227,38879.197956446274,280,sag,COMPLETE
5340,0.6520362484987444,2023-10-02 12:30:00.731990,2023-10-02 12:30:01.109111,0 days 00:00:00.377121,21016.189570818733,490,sag,COMPLETE
5341,0.666120755540998,2023-10-02 12:30:01.111111,2023-10-02 12:30:01.471740,0 days 00:00:00.360629,14318.836227030599,480,sag,COMPLETE
5342,0.6369145103177202,2023-10-02 12:30:01.473735,2023-10-02 12:30:01.842345,0 days 00:00:00.368610,21.11446590181016,500,sag,COMPLETE
5343,0.6449939949776177,2023-10-02 12:30:01.844343,2023-10-02 12:30:02.193459,0 days 00:00:00.349116,4537.043349942319,370,sag,COMPLETE
5344,0.5,2023-10-02 12:30:02.194459,2023-10-02 12:30:02.552084,0 days 00:00:00.357625,0.0066253496431616975,430,sag,COMPLETE
5345,0.637951741456491,2023-10-02 12:30:02.554080,2023-10-02 12:30:02.873695,0 days 00:00:00.319615,67036.81321384117,380,lbfgs,COMPLETE
5346,0.6418277104487389,2023-10-02 12:30:02.875688,2023-10-02 12:30:03.331355,0 days 00:00:00.455667,471.7835591278097,490,sag,COMPLETE
5347,0.6590785020198712,2023-10-02 12:30:03.333345,2023-10-02 12:30:03.700033,0 days 00:00:00.366688,9016.031511451485,480,sag,COMPLETE
5348,0.5274593296211376,2023-10-02 12:30:03.702033,2023-10-02 12:30:04.064266,0 days 00:00:00.362233,0.5469451742810074,330,sag,COMPLETE
5349,0.6267059722677149,2023-10-02 12:30:04.066262,2023-10-02 12:30:04.369901,0 days 00:00:00.303639,11.865420098203336,360,sag,COMPLETE
5350,0.5,2023-10-02 12:30:04.371901,2023-10-02 12:30:04.729542,0 days 00:00:00.357641,0.00013642778374783646,470,sag,COMPLETE
5351,0.666120755540998,2023-10-02 12:30:04.729542,2023-10-02 12:30:05.201558,0 days 00:00:00.472016,99654.52908103254,500,sag,COMPLETE
5352,0.6590785020198712,2023-10-02 12:30:05.203556,2023-10-02 12:30:05.577908,0 days 00:00:00.374352,35299.6923877848,490,sag,COMPLETE
5353,0.6488699639698657,2023-10-02 12:30:05.579902,2023-10-02 12:30:05.984467,0 days 00:00:00.404565,3084.8767249666953,310,sag,COMPLETE
5354,0.6552025330276231,2023-10-02 12:30:05.997831,2023-10-02 12:30:06.314618,0 days 00:00:00.316787,23779.58180581794,320,sag,COMPLETE
5355,0.5943334425155585,2023-10-02 12:30:06.330292,2023-10-02 12:30:06.685971,0 days 00:00:00.355679,2.1137188529539035,480,sag,COMPLETE
5356,0.6309094879353642,2023-10-02 12:30:06.685971,2023-10-02 12:30:07.039780,0 days 00:00:00.353809,45132.3475215715,350,sag,COMPLETE
5357,0.5345015831422644,2023-10-02 12:30:07.040780,2023-10-02 12:30:07.397879,0 days 00:00:00.357099,0.5679802770487957,410,newton-cg,COMPLETE
5358,0.5,2023-10-02 12:30:07.399877,2023-10-02 12:30:07.663991,0 days 00:00:00.264114,0.06067742861296019,500,sag,COMPLETE
5359,0.640080794846599,2023-10-02 12:30:07.663991,2023-10-02 12:30:07.956957,0 days 00:00:00.292966,27.682146225557567,470,sag,COMPLETE
5360,0.637951741456491,2023-10-02 12:30:07.958957,2023-10-02 12:30:08.316122,0 days 00:00:00.357165,13791.95273579592,490,liblinear,COMPLETE
5361,0.6449939949776177,2023-10-02 12:30:08.316122,2023-10-02 12:30:08.663546,0 days 00:00:00.347424,1638.4094531699122,360,sag,COMPLETE
5362,0.6590785020198712,2023-10-02 12:30:08.665530,2023-10-02 12:30:09.093389,0 days 00:00:00.427859,5681.859178907611,400,sag,COMPLETE
