number,value,datetime_start,datetime_complete,duration,params_C,params_max_iter,params_solver,state
4712,0.5,2023-10-02 12:26:11.931924,2023-10-02 12:26:12.231525,0 days 00:00:00.299601,0.20887023694868978,370,sag,COMPLETE
4713,0.637951741456491,2023-10-02 12:26:12.232525,2023-10-02 12:26:12.472120,0 days 00:00:00.239595,14858.144360414446,380,liblinear,COMPLETE
4714,0.6520362484987444,2023-10-02 12:26:12.474120,2023-10-02 12:26:12.851983,0 days 00:00:00.377863,2658.1714947645382,350,sag,COMPLETE
4715,0.6520362484987444,2023-10-02 12:26:12.852986,2023-10-02 12:26:13.191724,0 days 00:00:00.338738,10912.879962377474,360,sag,COMPLETE
4716,0.637951741456491,2023-10-02 12:26:13.193724,2023-10-02 12:26:13.492321,0 days 00:00:00.298597,1045.7967585302413,350,sag,COMPLETE
4717,0.6520362484987444,2023-10-02 12:26:13.494322,2023-10-02 12:26:13.865429,0 days 00:00:00.371107,66988.64864851387,340,sag,COMPLETE
4718,0.5690031662845288,2023-10-02 12:26:13.867429,2023-10-02 12:26:14.111387,0 days 00:00:00.243958,1.055792261130447,370,sag,COMPLETE
4719,0.6449939949776177,2023-10-02 12:26:14.112387,2023-10-02 12:26:14.485533,0 days 00:00:00.373146,4145.535378679546,360,sag,COMPLETE
4720,0.6559122174909924,2023-10-02 12:26:14.486533,2023-10-02 12:26:14.769264,0 days 00:00:00.282731,20262.894676452717,340,sag,COMPLETE
4721,0.6552025330276231,2023-10-02 12:26:14.771257,2023-10-02 12:26:15.059790,0 days 00:00:00.288533,36483.83449318943,360,sag,COMPLETE
4722,0.5,2023-10-02 12:26:15.061823,2023-10-02 12:26:15.379377,0 days 00:00:00.317554,0.0032551592959085907,380,sag,COMPLETE
4723,0.6101648651599519,2023-10-02 12:26:15.380377,2023-10-02 12:26:15.649448,0 days 00:00:00.269071,5.235795487588779,340,lbfgs,COMPLETE
4724,0.66224478654875,2023-10-02 12:26:15.650445,2023-10-02 12:26:16.027141,0 days 00:00:00.376696,70092.22563921413,350,sag,COMPLETE
4725,0.6552025330276231,2023-10-02 12:26:16.029147,2023-10-02 12:26:16.341735,0 days 00:00:00.312588,24915.700315144204,390,sag,COMPLETE
4726,0.6449939949776177,2023-10-02 12:26:16.343735,2023-10-02 12:26:16.641328,0 days 00:00:00.297593,7146.906730286589,370,sag,COMPLETE
4727,0.5,2023-10-02 12:26:16.643332,2023-10-02 12:26:17.042089,0 days 00:00:00.398757,0.00013582961134485223,330,sag,COMPLETE
4728,0.6590785020198712,2023-10-02 12:26:17.044094,2023-10-02 12:26:17.334682,0 days 00:00:00.290588,99638.40801790872,350,sag,COMPLETE
4729,0.5,2023-10-02 12:26:17.336681,2023-10-02 12:26:17.647269,0 days 00:00:00.310588,0.00011492173484472077,360,sag,COMPLETE
4730,0.6534556174254831,2023-10-02 12:26:17.649275,2023-10-02 12:26:17.998386,0 days 00:00:00.349111,109.63851935424813,360,sag,COMPLETE
4731,0.6298722567965934,2023-10-02 12:26:18.000382,2023-10-02 12:26:18.235851,0 days 00:00:00.235469,18.542472655803838,370,sag,COMPLETE
4732,0.6520362484987444,2023-10-02 12:26:18.236851,2023-10-02 12:26:18.635952,0 days 00:00:00.399101,48641.29502830591,380,sag,COMPLETE
4733,0.66224478654875,2023-10-02 12:26:18.637949,2023-10-02 12:26:18.931538,0 days 00:00:00.293589,14942.8106556406,350,sag,COMPLETE
4734,0.6583688175565019,2023-10-02 12:26:18.932535,2023-10-02 12:26:19.226109,0 days 00:00:00.293574,33939.55558724162,320,sag,COMPLETE
4735,0.6277432034064855,2023-10-02 12:26:19.228109,2023-10-02 12:26:19.552702,0 days 00:00:00.324593,1702.2354484322323,390,newton-cg,COMPLETE
4736,0.5,2023-10-02 12:26:19.554696,2023-10-02 12:26:19.779265,0 days 00:00:00.224569,0.10661607876244511,340,sag,COMPLETE
4737,0.637951741456491,2023-10-02 12:26:19.780258,2023-10-02 12:26:20.017331,0 days 00:00:00.237073,10544.496527327656,330,liblinear,COMPLETE
4738,0.6590785020198712,2023-10-02 12:26:20.018323,2023-10-02 12:26:20.415668,0 days 00:00:00.397345,5483.32467059126,370,sag,COMPLETE
4739,0.6559122174909924,2023-10-02 12:26:20.417669,2023-10-02 12:26:20.745850,0 days 00:00:00.328181,22584.2428011067,380,sag,COMPLETE
4740,0.5,2023-10-02 12:26:20.746850,2023-10-02 12:26:22.221182,0 days 00:00:01.474332,1.1653205839213563e-05,400,sag,COMPLETE
4741,0.5,2023-10-02 12:26:22.222192,2023-10-02 12:26:22.528488,0 days 00:00:00.306296,0.0004443249804340573,360,sag,COMPLETE
4742,0.6337482257888415,2023-10-02 12:26:22.530484,2023-10-02 12:26:22.786568,0 days 00:00:00.256084,13.565367709152042,370,sag,COMPLETE
4743,0.6590785020198712,2023-10-02 12:26:22.787567,2023-10-02 12:26:23.228793,0 days 00:00:00.441226,49110.47582160667,320,sag,COMPLETE
4744,0.6573315864177312,2023-10-02 12:26:23.231786,2023-10-02 12:26:23.593941,0 days 00:00:00.362155,39.307269259738476,360,sag,COMPLETE
4745,0.5,2023-10-02 12:26:23.595939,2023-10-02 12:26:24.018665,0 days 00:00:00.422726,0.0019351098011964952,350,sag,COMPLETE
4746,0.6457036794409869,2023-10-02 12:26:24.022674,2023-10-02 12:26:24.376763,0 days 00:00:00.354089,271.658226919626,340,sag,COMPLETE
4747,0.5,2023-10-02 12:26:24.379768,2023-10-02 12:26:24.685382,0 days 00:00:00.305614,2.661402593024095e-05,380,lbfgs,COMPLETE
4748,0.666120755540998,2023-10-02 12:26:24.687380,2023-10-02 12:26:25.214869,0 days 00:00:00.527489,3760.0463392939523,350,sag,COMPLETE
4749,0.6534556174254831,2023-10-02 12:26:25.216869,2023-10-02 12:26:25.529460,0 days 00:00:00.312591,72.93518837310023,370,sag,COMPLETE
4750,0.6520362484987444,2023-10-02 12:26:25.531452,2023-10-02 12:26:25.982172,0 days 00:00:00.450720,8793.384102151049,160,sag,COMPLETE
4751,0.5478764057211486,2023-10-02 12:26:25.984167,2023-10-02 12:26:26.314410,0 days 00:00:00.330243,0.778211250081361,360,sag,COMPLETE
4752,0.6442843105142483,2023-10-02 12:26:26.316405,2023-10-02 12:26:26.691236,0 days 00:00:00.374831,62254.4925021592,340,sag,COMPLETE
4753,0.637951741456491,2023-10-02 12:26:26.693221,2023-10-02 12:26:27.119643,0 days 00:00:00.426422,99366.03859249523,370,sag,COMPLETE
4754,0.6411180259853696,2023-10-02 12:26:27.120631,2023-10-02 12:26:27.507767,0 days 00:00:00.387136,18050.092177010734,330,sag,COMPLETE
4755,0.5,2023-10-02 12:26:27.508767,2023-10-02 12:26:27.862363,0 days 00:00:00.353596,0.014100611488447849,360,sag,COMPLETE
4756,0.666120755540998,2023-10-02 12:26:27.864363,2023-10-02 12:26:28.376531,0 days 00:00:00.512168,99570.56568305353,350,sag,COMPLETE
4757,0.6457036794409869,2023-10-02 12:26:28.378523,2023-10-02 12:26:28.746398,0 days 00:00:00.367875,170.7476356193659,380,sag,COMPLETE
4758,0.637951741456491,2023-10-02 12:26:28.748398,2023-10-02 12:26:29.097743,0 days 00:00:00.349345,32462.30361157445,360,newton-cg,COMPLETE
4759,0.5211267605633803,2023-10-02 12:26:29.099742,2023-10-02 12:26:29.339441,0 days 00:00:00.239699,0.3671023349121224,330,sag,COMPLETE
4760,0.6590785020198712,2023-10-02 12:26:29.340440,2023-10-02 12:26:29.641641,0 days 00:00:00.301201,49254.61711929104,350,sag,COMPLETE
4761,0.5,2023-10-02 12:26:29.643635,2023-10-02 12:26:29.964465,0 days 00:00:00.320830,0.16631914678035328,390,sag,COMPLETE
4762,0.6520362484987444,2023-10-02 12:26:29.966991,2023-10-02 12:26:30.267045,0 days 00:00:00.300054,2388.888253965874,370,sag,COMPLETE
4763,0.5,2023-10-02 12:26:30.268040,2023-10-02 12:26:30.591605,0 days 00:00:00.323565,0.016927968866346736,380,liblinear,COMPLETE
4764,0.6520362484987444,2023-10-02 12:26:30.592605,2023-10-02 12:26:30.891589,0 days 00:00:00.298984,14154.668184722574,360,sag,COMPLETE
4765,0.6013756960366853,2023-10-02 12:26:30.893593,2023-10-02 12:26:31.130614,0 days 00:00:00.237021,2.3987311075032505,350,sag,COMPLETE
4766,0.6449939949776177,2023-10-02 12:26:31.131614,2023-10-02 12:26:31.505548,0 days 00:00:00.373934,814.1295336244691,340,sag,COMPLETE
4767,0.5,2023-10-02 12:26:31.506548,2023-10-02 12:26:31.758543,0 days 00:00:00.251995,0.0006165380327547086,360,sag,COMPLETE
4768,0.5,2023-10-02 12:26:31.758543,2023-10-02 12:26:31.994210,0 days 00:00:00.235667,0.009123540636052271,310,sag,COMPLETE
4769,0.6481602795064964,2023-10-02 12:26:31.994210,2023-10-02 12:26:32.374713,0 days 00:00:00.380503,24771.36878446805,370,sag,COMPLETE
4770,0.6520362484987444,2023-10-02 12:26:32.376717,2023-10-02 12:26:32.663771,0 days 00:00:00.287054,4470.124224868348,320,sag,COMPLETE
4771,0.5,2023-10-02 12:26:32.664771,2023-10-02 12:26:32.975858,0 days 00:00:00.311087,0.007538781159216184,350,sag,COMPLETE
4772,0.5,2023-10-02 12:26:32.977862,2023-10-02 12:26:33.212902,0 days 00:00:00.235040,0.025328638521602893,100,sag,COMPLETE
4773,0.637951741456491,2023-10-02 12:26:33.213901,2023-10-02 12:26:33.506503,0 days 00:00:00.292602,7460.774468449758,340,lbfgs,COMPLETE
4774,0.6590785020198712,2023-10-02 12:26:33.508500,2023-10-02 12:26:33.904722,0 days 00:00:00.396222,36701.07008191696,400,sag,COMPLETE
4775,0.6411180259853696,2023-10-02 12:26:33.906719,2023-10-02 12:26:34.212320,0 days 00:00:00.305601,67664.80746005576,370,sag,COMPLETE
4776,0.6062888961677039,2023-10-02 12:26:34.213323,2023-10-02 12:26:34.524911,0 days 00:00:00.311588,6.076582325211563,340,sag,COMPLETE
4777,0.6590785020198712,2023-10-02 12:26:34.525910,2023-10-02 12:26:34.856232,0 days 00:00:00.330322,11282.824887130626,330,sag,COMPLETE
4778,0.6629544710121192,2023-10-02 12:26:34.858233,2023-10-02 12:26:35.207372,0 days 00:00:00.349139,20657.54829137986,360,sag,COMPLETE
4779,0.6590785020198712,2023-10-02 12:26:35.208372,2023-10-02 12:26:35.580469,0 days 00:00:00.372097,39877.30046912777,350,sag,COMPLETE
4780,0.6520362484987444,2023-10-02 12:26:35.581469,2023-10-02 12:26:35.878064,0 days 00:00:00.296595,3364.501450080135,390,sag,COMPLETE
4781,0.5,2023-10-02 12:26:35.879065,2023-10-02 12:26:36.542708,0 days 00:00:00.663643,3.203434953164324e-05,380,sag,COMPLETE
4782,0.6369145103177202,2023-10-02 12:26:36.543708,2023-10-02 12:26:36.884684,0 days 00:00:00.340976,21.223864046847428,370,sag,COMPLETE
4783,0.6449939949776177,2023-10-02 12:26:36.886684,2023-10-02 12:26:37.161347,0 days 00:00:00.274663,66402.51674559999,360,newton-cg,COMPLETE
4784,0.6590785020198712,2023-10-02 12:26:37.162347,2023-10-02 12:26:37.545465,0 days 00:00:00.383118,6098.272960145139,340,sag,COMPLETE
4785,0.6559122174909924,2023-10-02 12:26:37.546465,2023-10-02 12:26:37.935577,0 days 00:00:00.389112,29650.95016959578,360,sag,COMPLETE
4786,0.666120755540998,2023-10-02 12:26:37.938588,2023-10-02 12:26:38.247399,0 days 00:00:00.308811,13524.93556358196,370,sag,COMPLETE
4787,0.6534556174254831,2023-10-02 12:26:38.248399,2023-10-02 12:26:38.565981,0 days 00:00:00.317582,50.76495701677288,380,liblinear,COMPLETE
4788,0.5478764057211486,2023-10-02 12:26:38.566981,2023-10-02 12:26:38.817537,0 days 00:00:00.250556,0.686812752320749,350,sag,COMPLETE
4789,0.6590785020198712,2023-10-02 12:26:38.818537,2023-10-02 12:26:39.200660,0 days 00:00:00.382123,47335.13550006622,330,sag,COMPLETE
4790,0.6520362484987444,2023-10-02 12:26:39.202669,2023-10-02 12:26:39.517297,0 days 00:00:00.314628,1319.8558487801986,360,sag,COMPLETE
4791,0.5,2023-10-02 12:26:39.518299,2023-10-02 12:26:39.893398,0 days 00:00:00.375099,8.388751758647047e-05,350,sag,COMPLETE
4792,0.5,2023-10-02 12:26:39.895398,2023-10-02 12:26:40.212241,0 days 00:00:00.316843,0.0052884281019056276,390,sag,COMPLETE
4793,0.5,2023-10-02 12:26:40.213241,2023-10-02 12:26:40.517864,0 days 00:00:00.304623,0.04894675183327703,340,sag,COMPLETE
4794,0.6481602795064964,2023-10-02 12:26:40.518861,2023-10-02 12:26:40.909612,0 days 00:00:00.390751,98912.45416276758,410,sag,COMPLETE
4795,0.6235396877388361,2023-10-02 12:26:40.911607,2023-10-02 12:26:41.223158,0 days 00:00:00.311551,8.95322395120211,370,sag,COMPLETE
4796,0.6077082650944426,2023-10-02 12:26:41.224157,2023-10-02 12:26:41.499797,0 days 00:00:00.275640,4.006686783780284,310,lbfgs,COMPLETE
4797,0.5,2023-10-02 12:26:41.500790,2023-10-02 12:26:41.830365,0 days 00:00:00.329575,0.16856567029086444,330,sag,COMPLETE
4798,0.637951741456491,2023-10-02 12:26:41.832363,2023-10-02 12:26:42.150742,0 days 00:00:00.318379,21460.45162309849,360,sag,COMPLETE
4799,0.6590785020198712,2023-10-02 12:26:42.152736,2023-10-02 12:26:42.486848,0 days 00:00:00.334112,7644.3461837260975,400,sag,COMPLETE
4800,0.5,2023-10-02 12:26:42.487843,2023-10-02 12:26:44.139237,0 days 00:00:01.651394,1.0368935325198345e-05,340,sag,COMPLETE
4801,0.5,2023-10-02 12:26:44.141233,2023-10-02 12:26:44.406821,0 days 00:00:00.265588,0.00023932704827941338,350,sag,COMPLETE
4802,0.637951741456491,2023-10-02 12:26:44.407827,2023-10-02 12:26:44.818485,0 days 00:00:00.410658,600.4258795375159,320,sag,COMPLETE
4803,0.6369145103177202,2023-10-02 12:26:44.820481,2023-10-02 12:26:45.119384,0 days 00:00:00.298903,23.365062811981346,300,sag,COMPLETE
4804,0.6457036794409869,2023-10-02 12:26:45.121376,2023-10-02 12:26:45.508045,0 days 00:00:00.386669,220.3022410200206,380,sag,COMPLETE
4805,0.6449939949776177,2023-10-02 12:26:45.509017,2023-10-02 12:26:45.925101,0 days 00:00:00.416084,10855.12317024298,370,sag,COMPLETE
4806,0.6590785020198712,2023-10-02 12:26:45.927091,2023-10-02 12:26:46.215261,0 days 00:00:00.288170,45622.76205146099,350,sag,COMPLETE
4807,0.5,2023-10-02 12:26:46.216258,2023-10-02 12:26:46.549813,0 days 00:00:00.333555,0.0017967114800280794,360,sag,COMPLETE
4808,0.637951741456491,2023-10-02 12:26:46.551809,2023-10-02 12:26:46.820431,0 days 00:00:00.268622,27937.866328114433,390,newton-cg,COMPLETE
4809,0.6418277104487389,2023-10-02 12:26:46.821432,2023-10-02 12:26:47.115246,0 days 00:00:00.293814,458.10051678649756,370,sag,COMPLETE
4810,0.6590785020198712,2023-10-02 12:26:47.117240,2023-10-02 12:26:47.509373,0 days 00:00:00.392133,2788.1668457800492,340,sag,COMPLETE
4811,0.6520362484987444,2023-10-02 12:26:47.510375,2023-10-02 12:26:47.825952,0 days 00:00:00.315577,99111.60366205878,380,sag,COMPLETE
4812,0.5,2023-10-02 12:26:47.826951,2023-10-02 12:26:48.053207,0 days 00:00:00.226256,2.0076992212286846e-05,350,liblinear,COMPLETE
4813,0.6590785020198712,2023-10-02 12:26:48.054209,2023-10-02 12:26:48.500506,0 days 00:00:00.446297,16601.71820845217,360,sag,COMPLETE
4814,0.6590785020198712,2023-10-02 12:26:48.502509,2023-10-02 12:26:48.869133,0 days 00:00:00.366624,64759.313885305586,370,sag,COMPLETE
4815,0.666120755540998,2023-10-02 12:26:48.870139,2023-10-02 12:26:49.314814,0 days 00:00:00.444675,5010.452067944638,380,sag,COMPLETE
4816,0.5,2023-10-02 12:26:49.315813,2023-10-02 12:26:49.587384,0 days 00:00:00.271571,0.005950948477542377,330,sag,COMPLETE
4817,0.6267059722677149,2023-10-02 12:26:49.588384,2023-10-02 12:26:49.910996,0 days 00:00:00.322612,10.105693325888781,350,sag,COMPLETE
4818,0.666120755540998,2023-10-02 12:26:49.912000,2023-10-02 12:26:50.351774,0 days 00:00:00.439774,30411.308398200727,360,sag,COMPLETE
4819,0.6590785020198712,2023-10-02 12:26:50.353772,2023-10-02 12:26:50.693826,0 days 00:00:00.340054,17085.731458096776,500,sag,COMPLETE
4820,0.6566219019543618,2023-10-02 12:26:50.694824,2023-10-02 12:26:51.031645,0 days 00:00:00.336821,1955.8360174038005,140,sag,COMPLETE
4821,0.5,2023-10-02 12:26:51.032646,2023-10-02 12:26:51.424731,0 days 00:00:00.392085,7.921560260679983e-05,340,sag,COMPLETE
4822,0.5792117043345343,2023-10-02 12:26:51.425731,2023-10-02 12:26:51.656775,0 days 00:00:00.231044,1.123814548131954,310,sag,COMPLETE
4823,0.637951741456491,2023-10-02 12:26:51.658775,2023-10-02 12:26:52.009971,0 days 00:00:00.351196,9544.903200663382,500,lbfgs,COMPLETE
4824,0.5,2023-10-02 12:26:52.011157,2023-10-02 12:26:52.565722,0 days 00:00:00.554565,3.905253986000504e-05,370,sag,COMPLETE
4825,0.6449939949776177,2023-10-02 12:26:52.566721,2023-10-02 12:26:52.958359,0 days 00:00:00.391638,47245.5196814862,500,sag,COMPLETE
4826,0.5,2023-10-02 12:26:52.960355,2023-10-02 12:26:53.183780,0 days 00:00:00.223425,0.24059722724354332,320,sag,COMPLETE
4827,0.6520362484987444,2023-10-02 12:26:53.183780,2023-10-02 12:26:53.500101,0 days 00:00:00.316321,26304.130588011423,350,sag,COMPLETE
4828,0.649579648433235,2023-10-02 12:26:53.515733,2023-10-02 12:26:53.900180,0 days 00:00:00.384447,132.80754824043248,370,sag,COMPLETE
4829,0.6590785020198712,2023-10-02 12:26:53.900180,2023-10-02 12:26:54.182643,0 days 00:00:00.282463,66256.44735074227,360,sag,COMPLETE
4830,0.6449939949776177,2023-10-02 12:26:54.182643,2023-10-02 12:26:54.506952,0 days 00:00:00.324309,6301.434736359868,500,sag,COMPLETE
4831,0.5,2023-10-02 12:26:54.506952,2023-10-02 12:26:54.835049,0 days 00:00:00.328097,0.004543451451945155,400,sag,COMPLETE
4832,0.6629544710121192,2023-10-02 12:26:54.837045,2023-10-02 12:26:55.140109,0 days 00:00:00.303064,15755.362841089354,360,sag,COMPLETE
4833,0.5,2023-10-02 12:26:55.142104,2023-10-02 12:26:55.483905,0 days 00:00:00.341801,0.0011300681276253256,330,sag,COMPLETE
4834,0.637951741456491,2023-10-02 12:26:55.485899,2023-10-02 12:26:55.787146,0 days 00:00:00.301247,1059.359441029987,340,sag,COMPLETE
4835,0.6449939949776177,2023-10-02 12:26:55.787917,2023-10-02 12:26:56.035985,0 days 00:00:00.248068,37118.721878232565,380,newton-cg,COMPLETE
4836,0.6309094879353642,2023-10-02 12:26:56.035985,2023-10-02 12:26:56.375395,0 days 00:00:00.339410,3844.1354934820465,500,liblinear,COMPLETE
4837,0.666120755540998,2023-10-02 12:26:56.376399,2023-10-02 12:26:56.683191,0 days 00:00:00.306792,10450.853618886023,430,sag,COMPLETE
4838,0.5,2023-10-02 12:26:56.683191,2023-10-02 12:26:57.040254,0 days 00:00:00.357063,0.08640460927934215,500,sag,COMPLETE
4839,0.6520362484987444,2023-10-02 12:26:57.042269,2023-10-02 12:26:57.480560,0 days 00:00:00.438291,63839.233046047826,360,sag,COMPLETE
4840,0.6520362484987444,2023-10-02 12:26:57.482572,2023-10-02 12:26:57.789515,0 days 00:00:00.306943,22295.289197294624,420,sag,COMPLETE
4841,0.6449939949776177,2023-10-02 12:26:57.804473,2023-10-02 12:26:58.183878,0 days 00:00:00.379405,46776.81826497213,350,sag,COMPLETE
4842,0.6520362484987444,2023-10-02 12:26:58.183878,2023-10-02 12:26:58.524412,0 days 00:00:00.340534,99269.23567637772,500,sag,COMPLETE
4843,0.6457036794409869,2023-10-02 12:26:58.524412,2023-10-02 12:26:58.823211,0 days 00:00:00.298799,251.01896700472574,370,sag,COMPLETE
4844,0.5,2023-10-02 12:26:58.823211,2023-10-02 12:26:59.234741,0 days 00:00:00.411530,0.06535415503640415,500,sag,COMPLETE
4845,0.5,2023-10-02 12:26:59.236745,2023-10-02 12:26:59.535954,0 days 00:00:00.299209,0.01042118989471801,380,sag,COMPLETE
4846,0.637951741456491,2023-10-02 12:26:59.537954,2023-10-02 12:26:59.921916,0 days 00:00:00.383962,30008.196086526743,390,lbfgs,COMPLETE
4847,0.6534556174254831,2023-10-02 12:26:59.923925,2023-10-02 12:27:00.200855,0 days 00:00:00.276930,74.38577034910713,350,sag,COMPLETE
4848,0.5,2023-10-02 12:27:00.201854,2023-10-02 12:27:00.422789,0 days 00:00:00.220935,0.018266431026935342,500,sag,COMPLETE
4849,0.5,2023-10-02 12:27:00.422789,2023-10-02 12:27:01.180422,0 days 00:00:00.757633,3.0195332948559925e-05,340,sag,COMPLETE
4850,0.6449939949776177,2023-10-02 12:27:01.181416,2023-10-02 12:27:01.467450,0 days 00:00:00.286034,1801.349317929681,360,sag,COMPLETE
4851,0.666120755540998,2023-10-02 12:27:01.467450,2023-10-02 12:27:01.857477,0 days 00:00:00.390027,7441.307908703882,320,sag,COMPLETE
4852,0.6520362484987444,2023-10-02 12:27:01.857477,2023-10-02 12:27:02.257236,0 days 00:00:00.399759,13509.59588315982,500,sag,COMPLETE
4853,0.5,2023-10-02 12:27:02.273638,2023-10-02 12:27:03.504051,0 days 00:00:01.230413,2.2221227457263646e-05,370,sag,COMPLETE
4854,0.6559122174909924,2023-10-02 12:27:03.506055,2023-10-02 12:27:03.971968,0 days 00:00:00.465913,3133.101403722168,350,sag,COMPLETE
4855,0.6590785020198712,2023-10-02 12:27:03.973969,2023-10-02 12:27:04.412950,0 days 00:00:00.438981,46841.94679547808,500,sag,COMPLETE
4856,0.6449939949776177,2023-10-02 12:27:04.413947,2023-10-02 12:27:04.922980,0 days 00:00:00.509033,18806.584694570418,330,sag,COMPLETE
4857,0.6573315864177312,2023-10-02 12:27:04.925132,2023-10-02 12:27:05.322949,0 days 00:00:00.397817,38.59995965139613,500,sag,COMPLETE
4858,0.637951741456491,2023-10-02 12:27:05.324959,2023-10-02 12:27:05.591428,0 days 00:00:00.266469,5514.603562410765,300,newton-cg,COMPLETE
4859,0.6449939949776177,2023-10-02 12:27:05.592490,2023-10-02 12:27:05.974224,0 days 00:00:00.381734,32080.84807748648,430,sag,COMPLETE
4860,0.6449939949776177,2023-10-02 12:27:05.974224,2023-10-02 12:27:06.271618,0 days 00:00:00.297394,67851.65845950482,380,sag,COMPLETE
4861,0.5,2023-10-02 12:27:06.287248,2023-10-02 12:27:06.529273,0 days 00:00:00.242025,0.028521805607516708,360,liblinear,COMPLETE
4862,0.6590785020198712,2023-10-02 12:27:06.531240,2023-10-02 12:27:06.923114,0 days 00:00:00.391874,10368.923697276274,340,sag,COMPLETE
4863,0.6520362484987444,2023-10-02 12:27:06.925125,2023-10-02 12:27:07.225669,0 days 00:00:00.300544,23897.853486095602,420,sag,COMPLETE
4864,0.5,2023-10-02 12:27:07.241575,2023-10-02 12:27:07.592879,0 days 00:00:00.351304,0.0003309248826439738,410,sag,COMPLETE
4865,0.6520362484987444,2023-10-02 12:27:07.592879,2023-10-02 12:27:07.926271,0 days 00:00:00.333392,48789.191902938896,500,sag,COMPLETE
4866,0.649579648433235,2023-10-02 12:27:07.926271,2023-10-02 12:27:08.225246,0 days 00:00:00.298975,133.45328751225287,370,sag,COMPLETE
4867,0.6449939949776177,2023-10-02 12:27:08.225246,2023-10-02 12:27:08.685544,0 days 00:00:00.460298,14070.463037166162,350,sag,COMPLETE
4868,0.6520362484987444,2023-10-02 12:27:08.686544,2023-10-02 12:27:09.085690,0 days 00:00:00.399146,65853.26476462117,290,sag,COMPLETE
4869,0.5,2023-10-02 12:27:09.087686,2023-10-02 12:27:09.369447,0 days 00:00:00.281761,0.0008981078492078955,440,sag,COMPLETE
4870,0.6449939949776177,2023-10-02 12:27:09.371448,2023-10-02 12:27:09.848637,0 days 00:00:00.477189,4743.870179262894,500,sag,COMPLETE
4871,0.6449939949776177,2023-10-02 12:27:09.850642,2023-10-02 12:27:10.220296,0 days 00:00:00.369654,37892.99453486519,360,sag,COMPLETE
4872,0.637951741456491,2023-10-02 12:27:10.221295,2023-10-02 12:27:10.623055,0 days 00:00:00.401760,8179.022159380841,500,lbfgs,COMPLETE
4873,0.666120755540998,2023-10-02 12:27:10.625062,2023-10-02 12:27:10.930367,0 days 00:00:00.305305,17307.1166944564,320,sag,COMPLETE
4874,0.6006660115733159,2023-10-02 12:27:10.930367,2023-10-02 12:27:11.184659,0 days 00:00:00.254292,3.4156656966970784,340,sag,COMPLETE
