number,value,datetime_start,datetime_complete,duration,params_C,params_max_iter,params_solver,state
6667,0.666120755540998,2023-10-02 12:39:06.422781,2023-10-02 12:39:06.836425,0 days 00:00:00.413644,2434.259478357214,440,sag,COMPLETE
6668,0.5,2023-10-02 12:39:06.838421,2023-10-02 12:39:07.248749,0 days 00:00:00.410328,0.013118817050149308,360,sag,COMPLETE
6669,0.5,2023-10-02 12:39:07.248749,2023-10-02 12:39:07.583476,0 days 00:00:00.334727,0.2297557869660443,310,sag,COMPLETE
6670,0.6520362484987444,2023-10-02 12:39:07.583476,2023-10-02 12:39:08.078927,0 days 00:00:00.495451,62905.22078990529,470,sag,COMPLETE
6671,0.666120755540998,2023-10-02 12:39:08.078927,2023-10-02 12:39:08.482854,0 days 00:00:00.403927,19059.99575235891,380,sag,COMPLETE
6672,0.6520362484987444,2023-10-02 12:39:08.484906,2023-10-02 12:39:08.977029,0 days 00:00:00.492123,4315.438087873294,490,sag,COMPLETE
6673,0.6590785020198712,2023-10-02 12:39:08.978565,2023-10-02 12:39:09.530940,0 days 00:00:00.552375,46645.753455543585,450,sag,COMPLETE
6674,0.637951741456491,2023-10-02 12:39:09.532503,2023-10-02 12:39:09.883647,0 days 00:00:00.351144,8149.080331046523,370,newton-cg,COMPLETE
6675,0.6559122174909924,2023-10-02 12:39:09.884749,2023-10-02 12:39:10.349318,0 days 00:00:00.464569,24516.51958484876,350,sag,COMPLETE
6676,0.5,2023-10-02 12:39:10.364963,2023-10-02 12:39:10.715442,0 days 00:00:00.350479,0.0015913302028647404,470,sag,COMPLETE
6677,0.637951741456491,2023-10-02 12:39:10.715442,2023-10-02 12:39:11.149187,0 days 00:00:00.433745,13973.905228606902,430,liblinear,COMPLETE
6678,0.6449939949776177,2023-10-02 12:39:11.151822,2023-10-02 12:39:11.583674,0 days 00:00:00.431852,38954.40147521468,480,sag,COMPLETE
6679,0.5,2023-10-02 12:39:11.583674,2023-10-02 12:39:12.049803,0 days 00:00:00.466129,0.010445612701654675,330,sag,COMPLETE
6680,0.528169014084507,2023-10-02 12:39:12.049803,2023-10-02 12:39:12.483496,0 days 00:00:00.433693,0.3798330898203523,490,sag,COMPLETE
6681,0.6449939949776177,2023-10-02 12:39:12.483496,2023-10-02 12:39:12.916966,0 days 00:00:00.433470,1911.795034772757,490,sag,COMPLETE
6682,0.5,2023-10-02 12:39:12.916966,2023-10-02 12:39:13.332710,0 days 00:00:00.415744,0.07836991752976553,460,sag,COMPLETE
6683,0.6552025330276231,2023-10-02 12:39:13.333766,2023-10-02 12:39:13.750472,0 days 00:00:00.416706,66165.73970316838,480,sag,COMPLETE
6684,0.5,2023-10-02 12:39:13.750472,2023-10-02 12:39:14.184006,0 days 00:00:00.433534,0.0010595603133910063,340,sag,COMPLETE
6685,0.6590785020198712,2023-10-02 12:39:14.184006,2023-10-02 12:39:14.600942,0 days 00:00:00.416936,5525.33393290191,420,sag,COMPLETE
6686,0.6590785020198712,2023-10-02 12:39:14.617683,2023-10-02 12:39:15.141666,0 days 00:00:00.523983,27050.754701156246,360,sag,COMPLETE
6687,0.5,2023-10-02 12:39:15.141666,2023-10-02 12:39:15.697436,0 days 00:00:00.555770,0.0003509492738948249,490,sag,COMPLETE
6688,0.637951741456491,2023-10-02 12:39:15.699432,2023-10-02 12:39:16.116398,0 days 00:00:00.416966,9749.696060418853,440,lbfgs,COMPLETE
6689,0.6534556174254831,2023-10-02 12:39:16.118301,2023-10-02 12:39:16.620719,0 days 00:00:00.502418,114.4779844868474,470,sag,COMPLETE
6690,0.6552025330276231,2023-10-02 12:39:16.622718,2023-10-02 12:39:17.020829,0 days 00:00:00.398111,64295.99805135078,370,sag,COMPLETE
6691,0.637951741456491,2023-10-02 12:39:17.020829,2023-10-02 12:39:17.526573,0 days 00:00:00.505744,738.9617601014567,490,sag,COMPLETE
6692,0.6590785020198712,2023-10-02 12:39:17.528573,2023-10-02 12:39:17.917223,0 days 00:00:00.388650,17538.270954542255,350,sag,COMPLETE
6693,0.6590785020198712,2023-10-02 12:39:17.917223,2023-10-02 12:39:18.405278,0 days 00:00:00.488055,3457.0460240370508,470,sag,COMPLETE
6694,0.6590785020198712,2023-10-02 12:39:18.405278,2023-10-02 12:39:18.914455,0 days 00:00:00.509177,38803.92822257233,480,sag,COMPLETE
6695,0.5,2023-10-02 12:39:18.916455,2023-10-02 12:39:19.408456,0 days 00:00:00.492001,7.973346477812764e-05,450,sag,COMPLETE
6696,0.6449939949776177,2023-10-02 12:39:19.408456,2023-10-02 12:39:19.893892,0 days 00:00:00.485436,1178.8926668885254,460,sag,COMPLETE
6697,0.666120755540998,2023-10-02 12:39:19.895892,2023-10-02 12:39:20.328520,0 days 00:00:00.432628,7322.942778602806,490,sag,COMPLETE
6698,0.637951741456491,2023-10-02 12:39:20.329564,2023-10-02 12:39:20.757459,0 days 00:00:00.427895,12550.29558159257,480,newton-cg,COMPLETE
6699,0.5,2023-10-02 12:39:20.757459,2023-10-02 12:39:21.075296,0 days 00:00:00.317837,0.17500847563134792,380,sag,COMPLETE
6700,0.5313352986133857,2023-10-02 12:39:21.090920,2023-10-02 12:39:21.498855,0 days 00:00:00.407935,0.48151484790795773,340,sag,COMPLETE
6701,0.6590785020198712,2023-10-02 12:39:21.508875,2023-10-02 12:39:21.909817,0 days 00:00:00.400942,68515.72562445015,360,sag,COMPLETE
6702,0.5478764057211486,2023-10-02 12:39:21.909817,2023-10-02 12:39:22.315209,0 days 00:00:00.405392,0.7367784893938101,390,liblinear,COMPLETE
6703,0.6457036794409869,2023-10-02 12:39:22.315209,2023-10-02 12:39:22.785707,0 days 00:00:00.470498,188.49566416507076,490,sag,COMPLETE
6704,0.6590785020198712,2023-10-02 12:39:22.785707,2023-10-02 12:39:23.162443,0 days 00:00:00.376736,98970.76024423425,350,sag,COMPLETE
6705,0.6062888961677039,2023-10-02 12:39:23.162443,2023-10-02 12:39:23.585520,0 days 00:00:00.423077,5.820916679475169,330,sag,COMPLETE
6706,0.6449939949776177,2023-10-02 12:39:23.585520,2023-10-02 12:39:23.979457,0 days 00:00:00.393937,33515.22686093841,400,sag,COMPLETE
6707,0.5,2023-10-02 12:39:23.981652,2023-10-02 12:39:24.452724,0 days 00:00:00.471072,0.00016968284010152707,460,sag,COMPLETE
6708,0.5,2023-10-02 12:39:24.452724,2023-10-02 12:39:24.781605,0 days 00:00:00.328881,0.11949278320100441,490,sag,COMPLETE
6709,0.66224478654875,2023-10-02 12:39:24.781605,2023-10-02 12:39:25.282330,0 days 00:00:00.500725,18252.90550265179,450,sag,COMPLETE
6710,0.6488699639698657,2023-10-02 12:39:25.282330,2023-10-02 12:39:25.784859,0 days 00:00:00.502529,24928.653112325355,470,sag,COMPLETE
6711,0.5,2023-10-02 12:39:25.784859,2023-10-02 12:39:26.130286,0 days 00:00:00.345427,0.023823619472379515,480,sag,COMPLETE
6712,0.643956763838847,2023-10-02 12:39:26.130286,2023-10-02 12:39:26.538545,0 days 00:00:00.408259,24.639558176379857,440,sag,COMPLETE
6713,0.6590785020198712,2023-10-02 12:39:26.538545,2023-10-02 12:39:26.919446,0 days 00:00:00.380901,50172.19496178857,320,sag,COMPLETE
6714,0.5,2023-10-02 12:39:26.919446,2023-10-02 12:39:27.347015,0 days 00:00:00.427569,0.0005414122671827632,430,lbfgs,COMPLETE
6715,0.5,2023-10-02 12:39:27.349012,2023-10-02 12:39:27.669791,0 days 00:00:00.320779,0.0043314790755051204,370,sag,COMPLETE
6716,0.6481602795064964,2023-10-02 12:39:27.669791,2023-10-02 12:39:28.187254,0 days 00:00:00.517463,4963.689333401922,490,sag,COMPLETE
6717,0.6520362484987444,2023-10-02 12:39:28.187254,2023-10-02 12:39:28.673755,0 days 00:00:00.486501,1425.2899686129235,480,sag,COMPLETE
6718,0.5,2023-10-02 12:39:28.689389,2023-10-02 12:39:29.238718,0 days 00:00:00.549329,5.312993395667265e-05,360,sag,COMPLETE
6719,0.6534556174254831,2023-10-02 12:39:29.238718,2023-10-02 12:39:29.687747,0 days 00:00:00.449029,85.42824495962303,340,sag,COMPLETE
6720,0.6309094879353642,2023-10-02 12:39:29.689922,2023-10-02 12:39:30.095951,0 days 00:00:00.406029,2521.459230782047,410,sag,COMPLETE
6721,0.6590785020198712,2023-10-02 12:39:30.097951,2023-10-02 12:39:30.585299,0 days 00:00:00.487348,12030.193352111539,460,sag,COMPLETE
6722,0.6520362484987444,2023-10-02 12:39:30.600924,2023-10-02 12:39:31.026057,0 days 00:00:00.425133,42197.73631421787,490,sag,COMPLETE
6723,0.637951741456491,2023-10-02 12:39:31.026057,2023-10-02 12:39:31.469243,0 days 00:00:00.443186,7492.848970411468,470,newton-cg,COMPLETE
6724,0.6534556174254831,2023-10-02 12:39:31.471243,2023-10-02 12:39:31.846829,0 days 00:00:00.375586,67.79741457659138,350,sag,COMPLETE
6725,0.6418277104487389,2023-10-02 12:39:31.848824,2023-10-02 12:39:32.346034,0 days 00:00:00.497210,558.9304250542476,450,sag,COMPLETE
6726,0.5,2023-10-02 12:39:32.357512,2023-10-02 12:39:32.805998,0 days 00:00:00.448486,0.00852714919407205,480,sag,COMPLETE
6727,0.637951741456491,2023-10-02 12:39:32.805998,2023-10-02 12:39:33.139847,0 days 00:00:00.333849,99197.45763440258,470,liblinear,COMPLETE
6728,0.5,2023-10-02 12:39:33.139847,2023-10-02 12:39:33.556581,0 days 00:00:00.416734,0.016464294556261378,490,sag,COMPLETE
6729,0.6590785020198712,2023-10-02 12:39:33.556581,2023-10-02 12:39:33.991496,0 days 00:00:00.434915,21691.903945405495,440,sag,COMPLETE
6730,0.6738726935254942,2023-10-02 12:39:33.991496,2023-10-02 12:39:34.458292,0 days 00:00:00.466796,3880.880943341972,370,sag,COMPLETE
6731,0.6449939949776177,2023-10-02 12:39:34.475270,2023-10-02 12:39:34.892552,0 days 00:00:00.417282,1328.8220910487998,380,sag,COMPLETE
6732,0.6449939949776177,2023-10-02 12:39:34.892552,2023-10-02 12:39:35.377939,0 days 00:00:00.485387,804.7662853054736,380,sag,COMPLETE
6733,0.6590785020198712,2023-10-02 12:39:35.377939,2023-10-02 12:39:35.892934,0 days 00:00:00.514995,3531.5718010719906,370,sag,COMPLETE
6734,0.6449939949776177,2023-10-02 12:39:35.894682,2023-10-02 12:39:36.309030,0 days 00:00:00.414348,2499.4634825667927,390,sag,COMPLETE
6735,0.6449939949776177,2023-10-02 12:39:36.324663,2023-10-02 12:39:36.826599,0 days 00:00:00.501936,2571.6283958214035,380,sag,COMPLETE
6736,0.6449939949776177,2023-10-02 12:39:36.826599,2023-10-02 12:39:37.230103,0 days 00:00:00.403504,2008.1263367879317,370,sag,COMPLETE
6737,0.6309094879353642,2023-10-02 12:39:37.230103,2023-10-02 12:39:37.709706,0 days 00:00:00.479603,3884.408108151454,380,lbfgs,COMPLETE
6738,0.6449939949776177,2023-10-02 12:39:37.710130,2023-10-02 12:39:38.193654,0 days 00:00:00.483524,1818.0762340953336,380,sag,COMPLETE
6739,0.6520362484987444,2023-10-02 12:39:38.193654,2023-10-02 12:39:38.593728,0 days 00:00:00.400074,2428.736135967085,390,sag,COMPLETE
6740,0.6449939949776177,2023-10-02 12:39:38.593728,2023-10-02 12:39:39.077471,0 days 00:00:00.483743,2548.8824692240737,370,sag,COMPLETE
6741,0.6449939949776177,2023-10-02 12:39:39.077471,2023-10-02 12:39:39.490759,0 days 00:00:00.413288,1269.8521785791409,390,sag,COMPLETE
6742,0.6520362484987444,2023-10-02 12:39:39.492754,2023-10-02 12:39:39.977914,0 days 00:00:00.485160,2478.878925832247,370,sag,COMPLETE
6743,0.6590785020198712,2023-10-02 12:39:39.977914,2023-10-02 12:39:40.379050,0 days 00:00:00.401136,4358.044785068271,380,sag,COMPLETE
6744,0.6449939949776177,2023-10-02 12:39:40.379050,2023-10-02 12:39:40.900317,0 days 00:00:00.521267,3338.101741798703,380,sag,COMPLETE
6745,0.6449939949776177,2023-10-02 12:39:40.902318,2023-10-02 12:39:41.469268,0 days 00:00:00.566950,3395.078897547987,370,sag,COMPLETE
6746,0.6449939949776177,2023-10-02 12:39:41.472252,2023-10-02 12:39:41.911910,0 days 00:00:00.439658,1407.5656572853106,360,sag,COMPLETE
6747,0.6520362484987444,2023-10-02 12:39:41.911910,2023-10-02 12:39:42.439774,0 days 00:00:00.527864,4035.565974748044,380,sag,COMPLETE
6748,0.6449939949776177,2023-10-02 12:39:42.441771,2023-10-02 12:39:42.845161,0 days 00:00:00.403390,1845.3149619721855,370,sag,COMPLETE
6749,0.6238672344142374,2023-10-02 12:39:42.845161,2023-10-02 12:39:43.321411,0 days 00:00:00.476250,2096.1214695175763,370,newton-cg,COMPLETE
6750,0.5,2023-10-02 12:39:43.323402,2023-10-02 12:39:44.109395,0 days 00:00:00.785993,3.0554407936560954e-05,370,sag,COMPLETE
6751,0.6520362484987444,2023-10-02 12:39:44.112389,2023-10-02 12:39:44.593589,0 days 00:00:00.481200,3852.683010555283,380,sag,COMPLETE
6752,0.6309094879353642,2023-10-02 12:39:44.593589,2023-10-02 12:39:45.068100,0 days 00:00:00.474511,4684.929815291335,380,liblinear,COMPLETE
6753,0.6520362484987444,2023-10-02 12:39:45.070163,2023-10-02 12:39:45.558688,0 days 00:00:00.488525,1898.8932359701607,390,sag,COMPLETE
6754,0.6449939949776177,2023-10-02 12:39:45.558688,2023-10-02 12:39:46.148651,0 days 00:00:00.589963,1489.2585313094512,380,sag,COMPLETE
6755,0.6418277104487389,2023-10-02 12:39:46.151217,2023-10-02 12:39:46.626732,0 days 00:00:00.475515,404.3109816788964,370,sag,COMPLETE
6756,0.6449939949776177,2023-10-02 12:39:46.626732,2023-10-02 12:39:47.168587,0 days 00:00:00.541855,660.0417495589757,360,sag,COMPLETE
6757,0.6449939949776177,2023-10-02 12:39:47.170583,2023-10-02 12:39:47.712628,0 days 00:00:00.542045,1114.8894745319922,370,sag,COMPLETE
6758,0.6449939949776177,2023-10-02 12:39:47.712628,2023-10-02 12:39:48.108608,0 days 00:00:00.395980,2897.389277742231,370,sag,COMPLETE
6759,0.608417949557812,2023-10-02 12:39:48.108608,2023-10-02 12:39:48.541649,0 days 00:00:00.433041,2.9358452229300473,380,sag,COMPLETE
6760,0.5,2023-10-02 12:39:48.541649,2023-10-02 12:39:48.886572,0 days 00:00:00.344923,0.05133380623028516,370,sag,COMPLETE
6761,0.6277432034064855,2023-10-02 12:39:48.894238,2023-10-02 12:39:49.358556,0 days 00:00:00.464318,1178.3427136607477,370,lbfgs,COMPLETE
6762,0.6590785020198712,2023-10-02 12:39:49.358556,2023-10-02 12:39:49.875285,0 days 00:00:00.516729,5479.199003455872,380,sag,COMPLETE
6763,0.6481602795064964,2023-10-02 12:39:49.877279,2023-10-02 12:39:50.278843,0 days 00:00:00.401564,69848.08232579997,360,sag,COMPLETE
6764,0.5,2023-10-02 12:39:50.281594,2023-10-02 12:39:50.765438,0 days 00:00:00.483844,0.0002910467793086105,370,sag,COMPLETE
6765,0.619663718746588,2023-10-02 12:39:50.765438,2023-10-02 12:39:51.094035,0 days 00:00:00.328597,9.63337547875961,390,sag,COMPLETE
6766,0.6520362484987444,2023-10-02 12:39:51.094035,2023-10-02 12:39:51.586312,0 days 00:00:00.492277,3957.650226514797,360,sag,COMPLETE
6767,0.6449939949776177,2023-10-02 12:39:51.598606,2023-10-02 12:39:52.013028,0 days 00:00:00.414422,871.2494777119348,380,sag,COMPLETE
6768,0.66224478654875,2023-10-02 12:39:52.015388,2023-10-02 12:39:52.488814,0 days 00:00:00.473426,55510.51331209376,360,sag,COMPLETE
6769,0.6590785020198712,2023-10-02 12:39:52.488814,2023-10-02 12:39:52.991141,0 days 00:00:00.502327,5744.037878530908,370,sag,COMPLETE
6770,0.6457036794409869,2023-10-02 12:39:52.991141,2023-10-02 12:39:53.401557,0 days 00:00:00.410416,261.31995021501046,380,sag,COMPLETE
6771,0.6520362484987444,2023-10-02 12:39:53.403558,2023-10-02 12:39:53.873174,0 days 00:00:00.469616,2701.0455035897908,370,sag,COMPLETE
6772,0.6590785020198712,2023-10-02 12:39:53.873174,2023-10-02 12:39:54.266872,0 days 00:00:00.393698,63013.19213959344,360,sag,COMPLETE
6773,0.6369145103177202,2023-10-02 12:39:54.266872,2023-10-02 12:39:54.701586,0 days 00:00:00.434714,19.56161178655363,360,newton-cg,COMPLETE
6774,0.6590785020198712,2023-10-02 12:39:54.701586,2023-10-02 12:39:55.217927,0 days 00:00:00.516341,47443.42786261714,390,sag,COMPLETE
6775,0.6590785020198712,2023-10-02 12:39:55.217927,2023-10-02 12:39:55.634935,0 days 00:00:00.417008,1804.0565229527774,360,sag,COMPLETE
6776,0.6590785020198712,2023-10-02 12:39:55.634935,2023-10-02 12:39:56.139662,0 days 00:00:00.504727,5345.2559417695375,370,sag,COMPLETE
6777,0.5070422535211268,2023-10-02 12:39:56.141661,2023-10-02 12:39:56.464814,0 days 00:00:00.323153,0.351501748295317,370,liblinear,COMPLETE
6778,0.6590785020198712,2023-10-02 12:39:56.464814,2023-10-02 12:39:56.982998,0 days 00:00:00.518184,64867.86367199521,390,sag,COMPLETE
6779,0.5996287804345454,2023-10-02 12:39:56.985001,2023-10-02 12:39:57.431393,0 days 00:00:00.446392,1.4423936712245777,360,sag,COMPLETE
6780,0.5,2023-10-02 12:39:57.434394,2023-10-02 12:39:58.298572,0 days 00:00:00.864178,2.3498521098802398e-05,370,sag,COMPLETE
6781,0.6449939949776177,2023-10-02 12:39:58.300568,2023-10-02 12:39:58.786962,0 days 00:00:00.486394,3497.065356767126,380,sag,COMPLETE
6782,0.5,2023-10-02 12:39:58.788951,2023-10-02 12:39:59.354273,0 days 00:00:00.565322,5.755668253393569e-05,380,sag,COMPLETE
6783,0.637951741456491,2023-10-02 12:39:59.356266,2023-10-02 12:39:59.919246,0 days 00:00:00.562980,587.0380518123842,360,sag,COMPLETE
6784,0.6590785020198712,2023-10-02 12:39:59.919246,2023-10-02 12:40:00.314808,0 days 00:00:00.395562,37540.67207236502,360,sag,COMPLETE
6785,0.6235396877388361,2023-10-02 12:40:00.316803,2023-10-02 12:40:00.772663,0 days 00:00:00.455860,8.505117858820514,390,sag,COMPLETE
6786,0.5,2023-10-02 12:40:00.775655,2023-10-02 12:40:01.272113,0 days 00:00:00.496458,0.12116902593470462,370,lbfgs,COMPLETE
6787,0.5619609127634021,2023-10-02 12:40:01.272113,2023-10-02 12:40:01.672289,0 days 00:00:00.400176,0.9654575954916114,370,sag,COMPLETE
6788,0.666120755540998,2023-10-02 12:40:01.674289,2023-10-02 12:40:02.220011,0 days 00:00:00.545722,64816.40623242144,360,sag,COMPLETE
6789,0.5,2023-10-02 12:40:02.220011,2023-10-02 12:40:02.591218,0 days 00:00:00.371207,0.015929284030581168,380,sag,COMPLETE
6790,0.6520362484987444,2023-10-02 12:40:02.591218,2023-10-02 12:40:03.087004,0 days 00:00:00.495786,99902.23971621557,350,sag,COMPLETE
6791,0.6418277104487389,2023-10-02 12:40:03.087004,2023-10-02 12:40:03.638183,0 days 00:00:00.551179,424.76270196481454,380,sag,COMPLETE
6792,0.6629544710121192,2023-10-02 12:40:03.654332,2023-10-02 12:40:04.072436,0 days 00:00:00.418104,99608.94497693311,360,sag,COMPLETE
6793,0.5,2023-10-02 12:40:04.075429,2023-10-02 12:40:04.520047,0 days 00:00:00.444618,0.2819133181496653,370,sag,COMPLETE
6794,0.6520362484987444,2023-10-02 12:40:04.520047,2023-10-02 12:40:05.012964,0 days 00:00:00.492917,5675.162919208477,360,sag,COMPLETE
6795,0.6590785020198712,2023-10-02 12:40:05.012964,2023-10-02 12:40:05.499404,0 days 00:00:00.486440,35674.363138873,370,sag,COMPLETE
6796,0.6062888961677039,2023-10-02 12:40:05.499404,2023-10-02 12:40:05.961878,0 days 00:00:00.462474,6.537201819692786,360,sag,COMPLETE
6797,0.637951741456491,2023-10-02 12:40:05.961878,2023-10-02 12:40:06.387341,0 days 00:00:00.425463,2641.768866058147,390,sag,COMPLETE
6798,0.5,2023-10-02 12:40:06.387341,2023-10-02 12:40:06.850410,0 days 00:00:00.463069,0.0008088647621904973,380,sag,COMPLETE
6799,0.6502893328966044,2023-10-02 12:40:06.850410,2023-10-02 12:40:07.214763,0 days 00:00:00.364353,33.7801079825429,370,newton-cg,COMPLETE
6800,0.5,2023-10-02 12:40:07.214763,2023-10-02 12:40:07.663994,0 days 00:00:00.449231,0.001930952484578065,350,sag,COMPLETE
6801,0.5,2023-10-02 12:40:07.663994,2023-10-02 12:40:08.799522,0 days 00:00:01.135528,1.4206764104845615e-05,360,sag,COMPLETE
6802,0.5982094115078066,2023-10-02 12:40:08.799522,2023-10-02 12:40:09.223433,0 days 00:00:00.423911,1.941585407474513,400,liblinear,COMPLETE
6803,0.5,2023-10-02 12:40:09.223433,2023-10-02 12:40:09.647002,0 days 00:00:00.423569,0.040474798340421544,360,sag,COMPLETE
6804,0.6520362484987444,2023-10-02 12:40:09.647002,2023-10-02 12:40:10.054956,0 days 00:00:00.407954,961.7169546629054,380,sag,COMPLETE
6805,0.6457036794409869,2023-10-02 12:40:10.054956,2023-10-02 12:40:10.510346,0 days 00:00:00.455390,166.0351773752008,390,sag,COMPLETE
6806,0.5,2023-10-02 12:40:10.510346,2023-10-02 12:40:10.871432,0 days 00:00:00.361086,0.008457272292459525,350,sag,COMPLETE
6807,0.5,2023-10-02 12:40:10.871432,2023-10-02 12:40:11.295056,0 days 00:00:00.423624,0.24497536019082478,370,sag,COMPLETE
6808,0.6590785020198712,2023-10-02 12:40:11.295056,2023-10-02 12:40:11.782138,0 days 00:00:00.487082,44284.86123437056,350,sag,COMPLETE
6809,0.6534556174254831,2023-10-02 12:40:11.782138,2023-10-02 12:40:12.141314,0 days 00:00:00.359176,70.25308480929061,360,sag,COMPLETE
6810,0.6520362484987444,2023-10-02 12:40:12.143309,2023-10-02 12:40:12.643107,0 days 00:00:00.499798,7204.623107534461,350,sag,COMPLETE
6811,0.5,2023-10-02 12:40:12.643107,2023-10-02 12:40:13.019789,0 days 00:00:00.376682,0.0001435725154264231,370,sag,COMPLETE
6812,0.637951741456491,2023-10-02 12:40:13.035423,2023-10-02 12:40:13.487055,0 days 00:00:00.451632,68352.71532868975,380,lbfgs,COMPLETE
6813,0.6077082650944426,2023-10-02 12:40:13.489059,2023-10-02 12:40:13.916412,0 days 00:00:00.427353,3.7692934451222593,360,sag,COMPLETE
6814,0.528169014084507,2023-10-02 12:40:13.916412,2023-10-02 12:40:14.246822,0 days 00:00:00.330410,0.37695107481380813,380,sag,COMPLETE
6815,0.6520362484987444,2023-10-02 12:40:14.262451,2023-10-02 12:40:14.733312,0 days 00:00:00.470861,1652.1214920644256,370,sag,COMPLETE
6816,0.5,2023-10-02 12:40:14.748943,2023-10-02 12:40:15.094009,0 days 00:00:00.345066,0.003960311377656517,130,sag,COMPLETE
6817,0.5,2023-10-02 12:40:15.094009,2023-10-02 12:40:16.741601,0 days 00:00:01.647592,1.0396423399690174e-05,400,sag,COMPLETE
6818,0.6590785020198712,2023-10-02 12:40:16.741601,2023-10-02 12:40:17.212513,0 days 00:00:00.470912,99740.7167347451,350,sag,COMPLETE
6819,0.6590785020198712,2023-10-02 12:40:17.212513,2023-10-02 12:40:17.636117,0 days 00:00:00.423604,31651.40895419751,360,sag,COMPLETE
6820,0.5,2023-10-02 12:40:17.636117,2023-10-02 12:40:18.044058,0 days 00:00:00.407941,0.03958809581875619,370,sag,COMPLETE
6821,0.5,2023-10-02 12:40:18.044058,2023-10-02 12:40:18.385455,0 days 00:00:00.341397,0.0056941143428054924,350,sag,COMPLETE
6822,0.5,2023-10-02 12:40:18.388982,2023-10-02 12:40:18.953591,0 days 00:00:00.564609,7.813491474173655e-05,380,sag,COMPLETE
6823,0.5,2023-10-02 12:40:18.953591,2023-10-02 12:40:19.282994,0 days 00:00:00.329403,0.001326736868709923,400,newton-cg,COMPLETE
6824,0.6590785020198712,2023-10-02 12:40:19.287524,2023-10-02 12:40:19.758537,0 days 00:00:00.471013,3414.807910351166,370,sag,COMPLETE
6825,0.666120755540998,2023-10-02 12:40:19.761523,2023-10-02 12:40:20.234220,0 days 00:00:00.472697,47591.36196354466,350,sag,COMPLETE
6826,0.637951741456491,2023-10-02 12:40:20.234220,2023-10-02 12:40:20.563663,0 days 00:00:00.329443,5924.093180659193,370,liblinear,COMPLETE
6827,0.6449939949776177,2023-10-02 12:40:20.563663,2023-10-02 12:40:21.050249,0 days 00:00:00.486586,31695.84362782755,390,sag,COMPLETE
6828,0.6298722567965934,2023-10-02 12:40:21.050249,2023-10-02 12:40:21.395254,0 days 00:00:00.345005,16.502345483078237,360,sag,COMPLETE
6829,0.6590785020198712,2023-10-02 12:40:21.395254,2023-10-02 12:40:21.897775,0 days 00:00:00.502521,47551.55217580533,360,sag,COMPLETE
