number,value,datetime_start,datetime_complete,duration,params_C,params_max_iter,params_solver,state
4549,0.5,2023-10-02 12:25:18.095142,2023-10-02 12:25:18.440165,0 days 00:00:00.345023,9.605582647322658e-05,330,sag,COMPLETE
4550,0.6449939949776177,2023-10-02 12:25:18.441166,2023-10-02 12:25:18.816253,0 days 00:00:00.375087,11526.105396383899,370,sag,COMPLETE
4551,0.5,2023-10-02 12:25:18.816253,2023-10-02 12:25:19.123419,0 days 00:00:00.307166,0.00017216812719094413,360,sag,COMPLETE
4552,0.6481602795064964,2023-10-02 12:25:19.123419,2023-10-02 12:25:19.451735,0 days 00:00:00.328316,24753.734244863892,350,sag,COMPLETE
4553,0.6590785020198712,2023-10-02 12:25:19.453739,2023-10-02 12:25:19.882036,0 days 00:00:00.428297,45870.93024548151,370,sag,COMPLETE
4554,0.6629544710121192,2023-10-02 12:25:19.882036,2023-10-02 12:25:20.165421,0 days 00:00:00.283385,62291.44369792608,360,sag,COMPLETE
4555,0.6520362484987444,2023-10-02 12:25:20.181094,2023-10-02 12:25:20.448853,0 days 00:00:00.267759,98457.05036185081,340,sag,COMPLETE
4556,0.6235396877388361,2023-10-02 12:25:20.448853,2023-10-02 12:25:20.765659,0 days 00:00:00.316806,8.821605867107516,350,sag,COMPLETE
4557,0.5,2023-10-02 12:25:20.765659,2023-10-02 12:25:20.998276,0 days 00:00:00.232617,0.0012364342274550836,380,sag,COMPLETE
4558,0.6534556174254831,2023-10-02 12:25:20.999147,2023-10-02 12:25:21.249224,0 days 00:00:00.250077,41.79704678400159,330,sag,COMPLETE
4559,0.6449939949776177,2023-10-02 12:25:21.249224,2023-10-02 12:25:21.616036,0 days 00:00:00.366812,1623.9399078507327,360,sag,COMPLETE
4560,0.6449939949776177,2023-10-02 12:25:21.616036,2023-10-02 12:25:21.899482,0 days 00:00:00.283446,8918.1597528615,370,sag,COMPLETE
4561,0.6481602795064964,2023-10-02 12:25:21.899482,2023-10-02 12:25:22.265157,0 days 00:00:00.365675,19707.64982387393,350,sag,COMPLETE
4562,0.5,2023-10-02 12:25:22.266273,2023-10-02 12:25:22.483102,0 days 00:00:00.216829,0.021572613183766538,340,sag,COMPLETE
4563,0.6488699639698657,2023-10-02 12:25:22.483102,2023-10-02 12:25:22.783138,0 days 00:00:00.300036,5577.613722462444,380,sag,COMPLETE
4564,0.6590785020198712,2023-10-02 12:25:22.783138,2023-10-02 12:25:23.166722,0 days 00:00:00.383584,33219.12139597726,360,sag,COMPLETE
4565,0.6520362484987444,2023-10-02 12:25:23.166722,2023-10-02 12:25:23.449976,0 days 00:00:00.283254,15388.162776413988,320,sag,COMPLETE
4566,0.6590785020198712,2023-10-02 12:25:23.449976,2023-10-02 12:25:23.732387,0 days 00:00:00.282411,61695.53459492698,340,sag,COMPLETE
4567,0.666120755540998,2023-10-02 12:25:23.733524,2023-10-02 12:25:24.082768,0 days 00:00:00.349244,30206.270818750007,360,sag,COMPLETE
4568,0.6520362484987444,2023-10-02 12:25:24.083719,2023-10-02 12:25:24.367218,0 days 00:00:00.283499,2244.984175382607,370,sag,COMPLETE
4569,0.5,2023-10-02 12:25:24.367218,2023-10-02 12:25:24.640532,0 days 00:00:00.273314,0.0002795902971270567,330,sag,COMPLETE
4570,0.5,2023-10-02 12:25:24.642532,2023-10-02 12:25:24.934050,0 days 00:00:00.291518,0.015385142079039784,350,sag,COMPLETE
4571,0.6534556174254831,2023-10-02 12:25:24.934050,2023-10-02 12:25:25.168244,0 days 00:00:00.234194,69.71575338371618,370,sag,COMPLETE
4572,0.6590785020198712,2023-10-02 12:25:25.168244,2023-10-02 12:25:25.534306,0 days 00:00:00.366062,3720.3660236279547,330,sag,COMPLETE
4573,0.6418277104487389,2023-10-02 12:25:25.534306,2023-10-02 12:25:25.817743,0 days 00:00:00.283437,312.89076830178084,350,sag,COMPLETE
4574,0.6418277104487389,2023-10-02 12:25:25.817743,2023-10-02 12:25:26.110876,0 days 00:00:00.293133,505.84322741308125,380,sag,COMPLETE
4575,0.619663718746588,2023-10-02 12:25:26.113226,2023-10-02 12:25:26.428164,0 days 00:00:00.314938,9.373445396576175,360,sag,COMPLETE
4576,0.5,2023-10-02 12:25:26.433673,2023-10-02 12:25:26.855417,0 days 00:00:00.421744,6.423669867082776e-05,350,sag,COMPLETE
4577,0.6590785020198712,2023-10-02 12:25:26.857420,2023-10-02 12:25:27.184924,0 days 00:00:00.327504,9902.288922285474,340,sag,COMPLETE
4578,0.6534556174254831,2023-10-02 12:25:27.184924,2023-10-02 12:25:27.529365,0 days 00:00:00.344441,65.87792703401867,370,sag,COMPLETE
4579,0.637951741456491,2023-10-02 12:25:27.529365,2023-10-02 12:25:27.818413,0 days 00:00:00.289048,42812.87181822372,340,sag,COMPLETE
4580,0.5,2023-10-02 12:25:27.818413,2023-10-02 12:25:28.068624,0 days 00:00:00.250211,0.002431548949969661,360,lbfgs,COMPLETE
4581,0.6520362484987444,2023-10-02 12:25:28.068624,2023-10-02 12:25:28.435403,0 days 00:00:00.366779,1074.595876126034,320,sag,COMPLETE
4582,0.5415438366633912,2023-10-02 12:25:28.435403,2023-10-02 12:25:28.686413,0 days 00:00:00.251010,0.5753307838029174,350,sag,COMPLETE
4583,0.6449939949776177,2023-10-02 12:25:28.686413,2023-10-02 12:25:29.085709,0 days 00:00:00.399296,22236.195445774436,380,sag,COMPLETE
4584,0.6590785020198712,2023-10-02 12:25:29.085709,2023-10-02 12:25:29.402457,0 days 00:00:00.316748,61257.74476825105,360,sag,COMPLETE
4585,0.669996724533246,2023-10-02 12:25:29.402457,2023-10-02 12:25:29.702588,0 days 00:00:00.300131,7295.079726331037,370,sag,COMPLETE
4586,0.6559122174909924,2023-10-02 12:25:29.702588,2023-10-02 12:25:30.086161,0 days 00:00:00.383573,6029.482323342659,370,sag,COMPLETE
4587,0.6590785020198712,2023-10-02 12:25:30.086161,2023-10-02 12:25:30.402920,0 days 00:00:00.316759,4354.63524892938,370,sag,COMPLETE
4588,0.6590785020198712,2023-10-02 12:25:30.402920,2023-10-02 12:25:30.769697,0 days 00:00:00.366777,3662.7262906038163,380,sag,COMPLETE
4589,0.666120755540998,2023-10-02 12:25:30.769697,2023-10-02 12:25:31.286764,0 days 00:00:00.517067,6364.216667130749,380,sag,COMPLETE
4590,0.6488699639698657,2023-10-02 12:25:31.286764,2023-10-02 12:25:31.686753,0 days 00:00:00.399989,4522.6475123603905,380,sag,COMPLETE
4591,0.6488699639698657,2023-10-02 12:25:31.686753,2023-10-02 12:25:32.101425,0 days 00:00:00.414672,3742.8383437806906,380,sag,COMPLETE
4592,0.6590785020198712,2023-10-02 12:25:32.103430,2023-10-02 12:25:32.525175,0 days 00:00:00.421745,6709.142608742599,370,sag,COMPLETE
4593,0.6449939949776177,2023-10-02 12:25:32.527174,2023-10-02 12:25:32.858319,0 days 00:00:00.331145,2009.3121494873674,380,sag,COMPLETE
4594,0.6590785020198712,2023-10-02 12:25:32.859325,2023-10-02 12:25:33.258945,0 days 00:00:00.399620,3191.097575525007,370,sag,COMPLETE
4595,0.6597881864832406,2023-10-02 12:25:33.259944,2023-10-02 12:25:33.610173,0 days 00:00:00.350229,6989.886250121463,360,sag,COMPLETE
4596,0.6590785020198712,2023-10-02 12:25:33.611261,2023-10-02 12:25:33.896753,0 days 00:00:00.285492,4930.241128721374,390,sag,COMPLETE
4597,0.6449939949776177,2023-10-02 12:25:33.898872,2023-10-02 12:25:34.286039,0 days 00:00:00.387167,2149.1712067230937,380,sag,COMPLETE
4598,0.6520362484987444,2023-10-02 12:25:34.287041,2023-10-02 12:25:34.582638,0 days 00:00:00.295597,10123.852760287507,370,sag,COMPLETE
4599,0.6449939949776177,2023-10-02 12:25:34.583638,2023-10-02 12:25:34.883984,0 days 00:00:00.300346,6864.816400088019,370,sag,COMPLETE
4600,0.6590785020198712,2023-10-02 12:25:34.885987,2023-10-02 12:25:35.252068,0 days 00:00:00.366081,3472.9135209447268,370,sag,COMPLETE
4601,0.666120755540998,2023-10-02 12:25:35.254064,2023-10-02 12:25:35.546083,0 days 00:00:00.292019,8487.718730838453,380,sag,COMPLETE
4602,0.6449939949776177,2023-10-02 12:25:35.548086,2023-10-02 12:25:35.839730,0 days 00:00:00.291644,6875.59670242156,390,sag,COMPLETE
4603,0.6520362484987444,2023-10-02 12:25:35.840735,2023-10-02 12:25:36.212365,0 days 00:00:00.371630,1367.591921737363,370,sag,COMPLETE
4604,0.5982094115078066,2023-10-02 12:25:36.213493,2023-10-02 12:25:36.444084,0 days 00:00:00.230591,1.9592765401325243,370,sag,COMPLETE
4605,0.6590785020198712,2023-10-02 12:25:36.445084,2023-10-02 12:25:36.811214,0 days 00:00:00.366130,4562.517636753809,360,sag,COMPLETE
4606,0.6520362484987444,2023-10-02 12:25:36.813314,2023-10-02 12:25:37.106727,0 days 00:00:00.293413,2925.125822090741,380,sag,COMPLETE
4607,0.5,2023-10-02 12:25:37.108733,2023-10-02 12:25:37.335646,0 days 00:00:00.226913,0.05395543762847916,360,sag,COMPLETE
4608,0.6590785020198712,2023-10-02 12:25:37.336649,2023-10-02 12:25:37.714799,0 days 00:00:00.378150,9694.971603246018,360,sag,COMPLETE
4609,0.649579648433235,2023-10-02 12:25:37.715898,2023-10-02 12:25:37.993132,0 days 00:00:00.277234,151.95251161073952,360,sag,COMPLETE
4610,0.6590785020198712,2023-10-02 12:25:37.994132,2023-10-02 12:25:38.285218,0 days 00:00:00.291086,11761.060701930364,390,sag,COMPLETE
4611,0.6534556174254831,2023-10-02 12:25:38.287220,2023-10-02 12:25:38.616092,0 days 00:00:00.328872,52.44950941444116,370,sag,COMPLETE
4612,0.6541653018888526,2023-10-02 12:25:38.617095,2023-10-02 12:25:38.848954,0 days 00:00:00.231859,29.85803240763345,370,sag,COMPLETE
4613,0.6590785020198712,2023-10-02 12:25:38.849959,2023-10-02 12:25:39.132214,0 days 00:00:00.282255,5707.260621045031,380,sag,COMPLETE
4614,0.5,2023-10-02 12:25:39.133214,2023-10-02 12:25:39.441873,0 days 00:00:00.308659,0.027236188414580118,360,sag,COMPLETE
4615,0.6590785020198712,2023-10-02 12:25:39.442873,2023-10-02 12:25:39.742002,0 days 00:00:00.299129,2034.679910936566,380,sag,COMPLETE
4616,0.637951741456491,2023-10-02 12:25:39.743002,2023-10-02 12:25:40.034670,0 days 00:00:00.291668,634.9920161244663,370,sag,COMPLETE
4617,0.5,2023-10-02 12:25:40.036182,2023-10-02 12:25:40.343762,0 days 00:00:00.307580,0.2878173059605881,390,sag,COMPLETE
4618,0.6457036794409869,2023-10-02 12:25:40.344760,2023-10-02 12:25:40.616870,0 days 00:00:00.272110,217.49329438353067,370,sag,COMPLETE
4619,0.6520362484987444,2023-10-02 12:25:40.618871,2023-10-02 12:25:40.986722,0 days 00:00:00.367851,8645.036693653266,360,sag,COMPLETE
4620,0.6590785020198712,2023-10-02 12:25:40.987790,2023-10-02 12:25:41.282977,0 days 00:00:00.295187,11829.587102428535,350,sag,COMPLETE
4621,0.6590785020198712,2023-10-02 12:25:41.284976,2023-10-02 12:25:41.589165,0 days 00:00:00.304189,5667.852985083629,370,sag,COMPLETE
4622,0.5,2023-10-02 12:25:41.591171,2023-10-02 12:25:42.522706,0 days 00:00:00.931535,1.7704230688650618e-05,380,sag,COMPLETE
4623,0.637951741456491,2023-10-02 12:25:42.524718,2023-10-02 12:25:42.812441,0 days 00:00:00.287723,2636.506835680879,360,sag,COMPLETE
4624,0.5,2023-10-02 12:25:42.813440,2023-10-02 12:25:43.043385,0 days 00:00:00.229945,0.010271363812144047,350,sag,COMPLETE
4625,0.666120755540998,2023-10-02 12:25:43.045379,2023-10-02 12:25:43.403290,0 days 00:00:00.357911,12916.465471764111,360,sag,COMPLETE
4626,0.528169014084507,2023-10-02 12:25:43.405385,2023-10-02 12:25:43.643620,0 days 00:00:00.238235,0.4635754318715936,380,sag,COMPLETE
4627,0.6520362484987444,2023-10-02 12:25:43.645621,2023-10-02 12:25:43.936845,0 days 00:00:00.291224,3754.0258592514056,370,sag,COMPLETE
4628,0.5,2023-10-02 12:25:43.937852,2023-10-02 12:25:44.240643,0 days 00:00:00.302791,0.08110998856925275,350,sag,COMPLETE
4629,0.6418277104487389,2023-10-02 12:25:44.241649,2023-10-02 12:25:44.544336,0 days 00:00:00.302687,469.2389449245597,390,sag,COMPLETE
4630,0.6062888961677039,2023-10-02 12:25:44.546333,2023-10-02 12:25:44.861206,0 days 00:00:00.314873,5.83551519963575,360,sag,COMPLETE
4631,0.5,2023-10-02 12:25:44.862207,2023-10-02 12:25:45.094535,0 days 00:00:00.232328,0.0037387703860148895,370,sag,COMPLETE
4632,0.6520362484987444,2023-10-02 12:25:45.095537,2023-10-02 12:25:45.376402,0 days 00:00:00.280865,1421.5823255038104,350,sag,COMPLETE
4633,0.5,2023-10-02 12:25:45.378401,2023-10-02 12:25:45.702779,0 days 00:00:00.324378,0.0005101707856903778,350,sag,COMPLETE
4634,0.6449939949776177,2023-10-02 12:25:45.704780,2023-10-02 12:25:45.987203,0 days 00:00:00.282423,837.6521550380642,370,sag,COMPLETE
4635,0.608417949557812,2023-10-02 12:25:45.989207,2023-10-02 12:25:46.218674,0 days 00:00:00.229467,2.954948671591909,360,sag,COMPLETE
4636,0.5,2023-10-02 12:25:46.219667,2023-10-02 12:25:46.532128,0 days 00:00:00.312461,0.08515004338870771,390,sag,COMPLETE
4637,0.6038322961021946,2023-10-02 12:25:46.534115,2023-10-02 12:25:46.764999,0 days 00:00:00.230884,4.120840577708242,380,sag,COMPLETE
4638,0.6559122174909924,2023-10-02 12:25:46.765999,2023-10-02 12:25:47.053822,0 days 00:00:00.287823,99961.28244857208,360,sag,COMPLETE
4639,0.6369145103177202,2023-10-02 12:25:47.055821,2023-10-02 12:25:47.387651,0 days 00:00:00.331830,23.647917429547743,360,sag,COMPLETE
4640,0.5,2023-10-02 12:25:47.388652,2023-10-02 12:25:47.642381,0 days 00:00:00.253729,0.0008922584268753033,350,sag,COMPLETE
4641,0.666120755540998,2023-10-02 12:25:47.644390,2023-10-02 12:25:48.040972,0 days 00:00:00.396582,8372.756263502984,380,sag,COMPLETE
4642,0.6534556174254831,2023-10-02 12:25:48.043071,2023-10-02 12:25:48.339256,0 days 00:00:00.296185,105.42471265529946,340,sag,COMPLETE
4643,0.6449939949776177,2023-10-02 12:25:48.340255,2023-10-02 12:25:48.678745,0 days 00:00:00.338490,5457.991712267605,370,sag,COMPLETE
4644,0.5,2023-10-02 12:25:48.680743,2023-10-02 12:25:48.997362,0 days 00:00:00.316619,0.11734105107761303,350,sag,COMPLETE
4645,0.666120755540998,2023-10-02 12:25:48.998367,2023-10-02 12:25:49.312024,0 days 00:00:00.313657,13070.250654897229,340,sag,COMPLETE
4646,0.5,2023-10-02 12:25:49.314021,2023-10-02 12:25:49.584576,0 days 00:00:00.270555,0.017794809227107113,360,sag,COMPLETE
4647,0.6267059722677149,2023-10-02 12:25:49.585577,2023-10-02 12:25:49.920135,0 days 00:00:00.334558,11.867056945250917,380,sag,COMPLETE
4648,0.5,2023-10-02 12:25:49.921132,2023-10-02 12:25:50.183903,0 days 00:00:00.262771,0.00018603032023630832,340,sag,COMPLETE
4649,0.6520362484987444,2023-10-02 12:25:50.185900,2023-10-02 12:25:50.561697,0 days 00:00:00.375797,15621.392094370016,370,sag,COMPLETE
4650,0.6590785020198712,2023-10-02 12:25:50.562690,2023-10-02 12:25:50.852820,0 days 00:00:00.290130,2540.609848581939,350,sag,COMPLETE
4651,0.5,2023-10-02 12:25:50.854820,2023-10-02 12:25:51.124704,0 days 00:00:00.269884,0.00022117315101294942,360,sag,COMPLETE
4652,0.6552025330276231,2023-10-02 12:25:51.125706,2023-10-02 12:25:51.487298,0 days 00:00:00.361592,8969.837608001093,330,sag,COMPLETE
4653,0.5651271972922809,2023-10-02 12:25:51.488366,2023-10-02 12:25:51.720880,0 days 00:00:00.232514,1.0629649690711966,370,sag,COMPLETE
4654,0.6629544710121192,2023-10-02 12:25:51.721882,2023-10-02 12:25:52.006721,0 days 00:00:00.284839,16427.352173124542,360,sag,COMPLETE
4655,0.6590785020198712,2023-10-02 12:25:52.007724,2023-10-02 12:25:52.385611,0 days 00:00:00.377887,4596.308831536763,390,sag,COMPLETE
4656,0.5,2023-10-02 12:25:52.386611,2023-10-02 12:25:52.651586,0 days 00:00:00.264975,0.005497398525395175,340,sag,COMPLETE
4657,0.666120755540998,2023-10-02 12:25:52.652587,2023-10-02 12:25:53.031113,0 days 00:00:00.378526,65206.43358807673,350,sag,COMPLETE
4658,0.6534556174254831,2023-10-02 12:25:53.032113,2023-10-02 12:25:53.380024,0 days 00:00:00.347911,65.19605059813529,370,sag,COMPLETE
4659,0.6013756960366853,2023-10-02 12:25:53.382020,2023-10-02 12:25:53.639240,0 days 00:00:00.257220,2.3537323132930252,380,sag,COMPLETE
4660,0.5,2023-10-02 12:25:53.640236,2023-10-02 12:25:53.949804,0 days 00:00:00.309568,0.3411031455632188,370,sag,COMPLETE
4661,0.5,2023-10-02 12:25:53.950804,2023-10-02 12:25:54.170748,0 days 00:00:00.219944,0.002245356493162882,330,liblinear,COMPLETE
4662,0.6337482257888415,2023-10-02 12:25:54.172747,2023-10-02 12:25:54.492503,0 days 00:00:00.319756,14.585797597105723,340,newton-cg,COMPLETE
4663,0.5376678676711432,2023-10-02 12:25:54.494504,2023-10-02 12:25:54.753308,0 days 00:00:00.258804,0.6000735340047603,350,sag,COMPLETE
4664,0.6520362484987444,2023-10-02 12:25:54.754303,2023-10-02 12:25:55.105739,0 days 00:00:00.351436,7989.240722919192,370,sag,COMPLETE
4665,0.637951741456491,2023-10-02 12:25:55.106739,2023-10-02 12:25:55.492873,0 days 00:00:00.386134,1188.677048676619,360,sag,COMPLETE
4666,0.666120755540998,2023-10-02 12:25:55.494873,2023-10-02 12:25:55.805468,0 days 00:00:00.310595,99182.14531079281,350,sag,COMPLETE
4667,0.5,2023-10-02 12:25:55.807470,2023-10-02 12:25:56.118125,0 days 00:00:00.310655,0.004366799001664319,350,sag,COMPLETE
4668,0.5,2023-10-02 12:25:56.119134,2023-10-02 12:25:56.497989,0 days 00:00:00.378855,0.05881038920713489,380,sag,COMPLETE
4669,0.5894202423845398,2023-10-02 12:25:56.499996,2023-10-02 12:25:56.738967,0 days 00:00:00.238971,1.2426152900596492,390,sag,COMPLETE
4670,0.6520362484987444,2023-10-02 12:25:56.740957,2023-10-02 12:25:57.135816,0 days 00:00:00.394859,19853.33881026531,360,sag,COMPLETE
4671,0.6449939949776177,2023-10-02 12:25:57.136816,2023-10-02 12:25:57.431968,0 days 00:00:00.295152,3408.9298187201653,340,sag,COMPLETE
4672,0.649579648433235,2023-10-02 12:25:57.432962,2023-10-02 12:25:57.715571,0 days 00:00:00.282609,206.17152531550272,320,lbfgs,COMPLETE
4673,0.5,2023-10-02 12:25:57.716566,2023-10-02 12:25:58.209248,0 days 00:00:00.492682,6.715589366643144e-05,360,sag,COMPLETE
4674,0.6267059722677149,2023-10-02 12:25:58.211250,2023-10-02 12:25:58.435360,0 days 00:00:00.224110,10.687952307501934,380,sag,COMPLETE
4675,0.6520362484987444,2023-10-02 12:25:58.437357,2023-10-02 12:25:58.780903,0 days 00:00:00.343546,45051.837093040165,330,sag,COMPLETE
4676,0.6552025330276231,2023-10-02 12:25:58.780903,2023-10-02 12:25:59.108245,0 days 00:00:00.327342,11298.179177234078,400,sag,COMPLETE
4677,0.6481602795064964,2023-10-02 12:25:59.109240,2023-10-02 12:25:59.398449,0 days 00:00:00.289209,67394.17178695454,360,sag,COMPLETE
4678,0.66224478654875,2023-10-02 12:25:59.399443,2023-10-02 12:25:59.782288,0 days 00:00:00.382845,99894.0040172398,370,sag,COMPLETE
4679,0.6590785020198712,2023-10-02 12:25:59.783282,2023-10-02 12:26:00.081449,0 days 00:00:00.298167,5312.099056301711,340,sag,COMPLETE
4680,0.6411180259853696,2023-10-02 12:26:00.081449,2023-10-02 12:26:00.450765,0 days 00:00:00.369316,23910.809891621753,350,sag,COMPLETE
4681,0.5,2023-10-02 12:26:00.450765,2023-10-02 12:26:00.681764,0 days 00:00:00.230999,0.028748321198207374,370,sag,COMPLETE
4682,0.6559122174909924,2023-10-02 12:26:00.681764,2023-10-02 12:26:00.951046,0 days 00:00:00.269282,14404.546609308147,350,sag,COMPLETE
4683,0.6590785020198712,2023-10-02 12:26:00.965042,2023-10-02 12:26:01.329298,0 days 00:00:00.364256,2593.562346757459,360,sag,COMPLETE
4684,0.637951741456491,2023-10-02 12:26:01.331297,2023-10-02 12:26:01.577866,0 days 00:00:00.246569,7350.452171461452,320,newton-cg,COMPLETE
4685,0.649579648433235,2023-10-02 12:26:01.579866,2023-10-02 12:26:01.843935,0 days 00:00:00.264069,170.89758046809925,340,sag,COMPLETE
4686,0.6534556174254831,2023-10-02 12:26:01.844935,2023-10-02 12:26:02.151473,0 days 00:00:00.306538,48.159162016936016,370,sag,COMPLETE
4687,0.6449939949776177,2023-10-02 12:26:02.151473,2023-10-02 12:26:02.449082,0 days 00:00:00.297609,43296.16803745645,360,sag,COMPLETE
4688,0.6418277104487389,2023-10-02 12:26:02.449082,2023-10-02 12:26:02.799176,0 days 00:00:00.350094,370.1217826790716,330,sag,COMPLETE
4689,0.6077082650944426,2023-10-02 12:26:02.799176,2023-10-02 12:26:03.032751,0 days 00:00:00.233575,3.8254911226594865,360,sag,COMPLETE
4690,0.637951741456491,2023-10-02 12:26:03.032751,2023-10-02 12:26:03.252063,0 days 00:00:00.219312,28951.685328104377,360,liblinear,COMPLETE
4691,0.6020853805000546,2023-10-02 12:26:03.252063,2023-10-02 12:26:03.636896,0 days 00:00:00.384833,1.784441285948924,350,sag,COMPLETE
4692,0.6552025330276231,2023-10-02 12:26:03.638910,2023-10-02 12:26:04.056842,0 days 00:00:00.417932,63305.68327172337,380,sag,COMPLETE
4693,0.6520362484987444,2023-10-02 12:26:04.058849,2023-10-02 12:26:04.353233,0 days 00:00:00.294384,1733.0758363390962,390,sag,COMPLETE
4694,0.6590785020198712,2023-10-02 12:26:04.353233,2023-10-02 12:26:04.733417,0 days 00:00:00.380184,10900.288267654407,350,sag,COMPLETE
4695,0.5,2023-10-02 12:26:04.733417,2023-10-02 12:26:05.256208,0 days 00:00:00.522791,4.3654443247054294e-05,380,sag,COMPLETE
4696,0.6449939949776177,2023-10-02 12:26:05.257208,2023-10-02 12:26:05.643815,0 days 00:00:00.386607,16592.118789699856,370,sag,COMPLETE
4697,0.6590785020198712,2023-10-02 12:26:05.645815,2023-10-02 12:26:05.948954,0 days 00:00:00.303139,4977.200624821632,370,sag,COMPLETE
4698,0.6411180259853696,2023-10-02 12:26:05.950959,2023-10-02 12:26:06.252528,0 days 00:00:00.301569,38178.74858493654,360,sag,COMPLETE
4699,0.6418277104487389,2023-10-02 12:26:06.253525,2023-10-02 12:26:06.641809,0 days 00:00:00.388284,67051.22059158697,350,sag,COMPLETE
4700,0.6316191723987334,2023-10-02 12:26:06.642812,2023-10-02 12:26:06.939388,0 days 00:00:00.296576,715.3980507693495,340,lbfgs,COMPLETE
4701,0.6520362484987444,2023-10-02 12:26:06.942399,2023-10-02 12:26:07.303075,0 days 00:00:00.360676,22059.107045841745,340,sag,COMPLETE
4702,0.666120755540998,2023-10-02 12:26:07.303075,2023-10-02 12:26:07.655222,0 days 00:00:00.352147,7400.740249937258,370,sag,COMPLETE
4703,0.5,2023-10-02 12:26:07.666734,2023-10-02 12:26:07.917920,0 days 00:00:00.251186,0.0382485569169488,390,sag,COMPLETE
4704,0.5,2023-10-02 12:26:07.917920,2023-10-02 12:26:08.328994,0 days 00:00:00.411074,0.00039217887777296334,380,sag,COMPLETE
4705,0.6534556174254831,2023-10-02 12:26:08.330988,2023-10-02 12:26:08.728166,0 days 00:00:00.397178,113.76261237727522,330,sag,COMPLETE
4706,0.6418277104487389,2023-10-02 12:26:08.730164,2023-10-02 12:26:09.195634,0 days 00:00:00.465470,468.9816666116395,310,sag,COMPLETE
4707,0.5,2023-10-02 12:26:09.198640,2023-10-02 12:26:09.504867,0 days 00:00:00.306227,0.26178991816435454,350,sag,COMPLETE
4708,0.666120755540998,2023-10-02 12:26:09.506851,2023-10-02 12:26:09.922975,0 days 00:00:00.416124,45768.91561672524,320,sag,COMPLETE
4709,0.5,2023-10-02 12:26:09.924973,2023-10-02 12:26:10.314126,0 days 00:00:00.389153,1.8228753142214642e-05,330,newton-cg,COMPLETE
4710,0.5,2023-10-02 12:26:10.318109,2023-10-02 12:26:11.646338,0 days 00:00:01.328229,1.232968271908054e-05,400,sag,COMPLETE
4711,0.6590785020198712,2023-10-02 12:26:11.648337,2023-10-02 12:26:11.929924,0 days 00:00:00.281587,30485.14886400765,360,sag,COMPLETE
