number,value,datetime_start,datetime_complete,duration,params_C,params_max_iter,params_solver,state
8297,0.666120755540998,2023-10-02 12:52:41.823660,2023-10-02 12:52:42.401909,0 days 00:00:00.578249,34192.54976599976,470,sag,COMPLETE
8298,0.5,2023-10-02 12:52:42.404951,2023-10-02 12:52:42.919901,0 days 00:00:00.514950,0.0014133208267276252,480,sag,COMPLETE
8299,0.6449939949776177,2023-10-02 12:52:42.921908,2023-10-02 12:52:43.471233,0 days 00:00:00.549325,1006.3947184845315,310,sag,COMPLETE
8300,0.6534556174254831,2023-10-02 12:52:43.473233,2023-10-02 12:52:43.929771,0 days 00:00:00.456538,93.92663373946858,500,sag,COMPLETE
8301,0.637951741456491,2023-10-02 12:52:43.932772,2023-10-02 12:52:44.498607,0 days 00:00:00.565835,16695.454890080484,350,sag,COMPLETE
8302,0.6534556174254831,2023-10-02 12:52:44.501722,2023-10-02 12:52:45.067601,0 days 00:00:00.565879,166.44280636173477,460,lbfgs,COMPLETE
8303,0.6590785020198712,2023-10-02 12:52:45.069726,2023-10-02 12:52:45.652310,0 days 00:00:00.582584,47706.203351509284,490,sag,COMPLETE
8304,0.6590785020198712,2023-10-02 12:52:45.654310,2023-10-02 12:52:46.135956,0 days 00:00:00.481646,2659.6544327247557,370,sag,COMPLETE
8305,0.5,2023-10-02 12:52:46.139185,2023-10-02 12:52:46.656769,0 days 00:00:00.517584,0.001340933505245264,340,sag,COMPLETE
8306,0.5,2023-10-02 12:52:46.658765,2023-10-02 12:52:47.163966,0 days 00:00:00.505201,0.006399322834154268,500,sag,COMPLETE
8307,0.6590785020198712,2023-10-02 12:52:47.166962,2023-10-02 12:52:47.657575,0 days 00:00:00.490613,25128.433332122644,490,sag,COMPLETE
8308,0.6629544710121192,2023-10-02 12:52:47.659570,2023-10-02 12:52:48.250549,0 days 00:00:00.590979,99768.8420712827,440,sag,COMPLETE
8309,0.6203734032099574,2023-10-02 12:52:48.252549,2023-10-02 12:52:48.776758,0 days 00:00:00.524209,7.903889179687929,420,sag,COMPLETE
8310,0.6590785020198712,2023-10-02 12:52:48.779760,2023-10-02 12:52:49.362166,0 days 00:00:00.582406,4679.560724415772,480,sag,COMPLETE
8311,0.6488699639698657,2023-10-02 12:52:49.365161,2023-10-02 12:52:49.822459,0 days 00:00:00.457298,9564.432364972394,320,sag,COMPLETE
8312,0.6590785020198712,2023-10-02 12:52:49.825452,2023-10-02 12:52:50.412236,0 days 00:00:00.586784,65997.85026282923,460,sag,COMPLETE
8313,0.6449939949776177,2023-10-02 12:52:50.415335,2023-10-02 12:52:50.989911,0 days 00:00:00.574576,601.6602825908166,360,sag,COMPLETE
8314,0.6449939949776177,2023-10-02 12:52:50.992910,2023-10-02 12:52:51.578829,0 days 00:00:00.585919,34564.30505629322,480,sag,COMPLETE
8315,0.528169014084507,2023-10-02 12:52:51.581829,2023-10-02 12:52:52.000156,0 days 00:00:00.418327,0.4313261426334363,330,newton-cg,COMPLETE
8316,0.6520362484987444,2023-10-02 12:52:52.002154,2023-10-02 12:52:52.592998,0 days 00:00:00.590844,13356.246743005908,450,sag,COMPLETE
8317,0.6418277104487389,2023-10-02 12:52:52.595003,2023-10-02 12:52:53.180427,0 days 00:00:00.585424,329.164181879435,470,sag,COMPLETE
8318,0.637951741456491,2023-10-02 12:52:53.182431,2023-10-02 12:52:53.588786,0 days 00:00:00.406355,21264.005361620526,380,liblinear,COMPLETE
8319,0.5823779888634131,2023-10-02 12:52:53.591296,2023-10-02 12:52:54.089684,0 days 00:00:00.498388,1.21886887602925,500,sag,COMPLETE
8320,0.6590785020198712,2023-10-02 12:52:54.092188,2023-10-02 12:52:54.678933,0 days 00:00:00.586745,7125.889020696686,490,sag,COMPLETE
8321,0.6449939949776177,2023-10-02 12:52:54.681053,2023-10-02 12:52:55.217999,0 days 00:00:00.536946,45723.12487742165,130,sag,COMPLETE
8322,0.604541980565564,2023-10-02 12:52:55.220001,2023-10-02 12:52:55.644125,0 days 00:00:00.424124,3.2520289807996896,350,sag,COMPLETE
8323,0.6552025330276231,2023-10-02 12:52:55.647119,2023-10-02 12:52:56.219757,0 days 00:00:00.572638,29398.04778506302,340,sag,COMPLETE
8324,0.6520362484987444,2023-10-02 12:52:56.221764,2023-10-02 12:52:56.790285,0 days 00:00:00.568521,67921.97606817883,370,sag,COMPLETE
8325,0.5,2023-10-02 12:52:56.792792,2023-10-02 12:52:57.214611,0 days 00:00:00.421819,0.12824981730449778,480,sag,COMPLETE
8326,0.6520362484987444,2023-10-02 12:52:57.217609,2023-10-02 12:52:57.806642,0 days 00:00:00.589033,3348.0083896605174,470,sag,COMPLETE
8327,0.6277432034064855,2023-10-02 12:52:57.808641,2023-10-02 12:52:58.379069,0 days 00:00:00.570428,1408.7070201319991,500,lbfgs,COMPLETE
8328,0.5,2023-10-02 12:52:58.381076,2023-10-02 12:52:58.887395,0 days 00:00:00.506319,0.013823958687288612,490,sag,COMPLETE
8329,0.637951741456491,2023-10-02 12:52:58.890396,2023-10-02 12:52:59.392413,0 days 00:00:00.502017,99555.50982995644,450,sag,COMPLETE
8330,0.6488699639698657,2023-10-02 12:52:59.395415,2023-10-02 12:52:59.991384,0 days 00:00:00.595969,5481.586084431698,360,sag,COMPLETE
8331,0.6520362484987444,2023-10-02 12:52:59.993390,2023-10-02 12:53:00.607689,0 days 00:00:00.614299,11094.902603444356,500,sag,COMPLETE
8332,0.6590785020198712,2023-10-02 12:53:00.610811,2023-10-02 12:53:01.227747,0 days 00:00:00.616936,18550.3932913356,400,sag,COMPLETE
8333,0.5,2023-10-02 12:53:01.230797,2023-10-02 12:53:01.923549,0 days 00:00:00.692752,5.9266757593434856e-05,430,sag,COMPLETE
8334,0.5,2023-10-02 12:53:01.926546,2023-10-02 12:53:02.487577,0 days 00:00:00.561031,0.21813928080692654,480,sag,COMPLETE
8335,0.5,2023-10-02 12:53:02.489578,2023-10-02 12:53:04.289095,0 days 00:00:01.799517,1.0502387119413588e-05,460,sag,COMPLETE
8336,0.666120755540998,2023-10-02 12:53:04.292090,2023-10-02 12:53:04.794542,0 days 00:00:00.502452,47594.50284732509,390,sag,COMPLETE
8337,0.6481602795064964,2023-10-02 12:53:04.796539,2023-10-02 12:53:05.473517,0 days 00:00:00.676978,32283.983922058305,490,sag,COMPLETE
8338,0.5,2023-10-02 12:53:05.475515,2023-10-02 12:53:06.062089,0 days 00:00:00.586574,0.0036787302944483245,350,sag,COMPLETE
8339,0.6238672344142374,2023-10-02 12:53:06.065087,2023-10-02 12:53:06.751435,0 days 00:00:00.686348,1830.3598600601972,470,newton-cg,COMPLETE
8340,0.5,2023-10-02 12:53:06.755443,2023-10-02 12:53:07.206672,0 days 00:00:00.451229,0.006412727523273945,330,sag,COMPLETE
8341,0.6520362484987444,2023-10-02 12:53:07.209666,2023-10-02 12:53:07.862272,0 days 00:00:00.652606,8835.924696158687,440,sag,COMPLETE
8342,0.6267059722677149,2023-10-02 12:53:07.864271,2023-10-02 12:53:08.511181,0 days 00:00:00.646910,12.04325190912226,490,liblinear,COMPLETE
8343,0.5,2023-10-02 12:53:08.513180,2023-10-02 12:53:09.077983,0 days 00:00:00.564803,0.00040691967410420827,370,sag,COMPLETE
8344,0.6411180259853696,2023-10-02 12:53:09.079981,2023-10-02 12:53:09.573523,0 days 00:00:00.493542,15822.038118635832,360,sag,COMPLETE
8345,0.6534556174254831,2023-10-02 12:53:09.576605,2023-10-02 12:53:10.121543,0 days 00:00:00.544938,75.0482391614529,380,sag,COMPLETE
8346,0.6077082650944426,2023-10-02 12:53:10.124535,2023-10-02 12:53:10.638651,0 days 00:00:00.514116,3.7706160507097093,500,sag,COMPLETE
8347,0.5,2023-10-02 12:53:10.641651,2023-10-02 12:53:11.138720,0 days 00:00:00.497069,0.00013429452364428359,470,sag,COMPLETE
8348,0.5,2023-10-02 12:53:11.140719,2023-10-02 12:53:11.647756,0 days 00:00:00.507037,0.045392293795799975,480,sag,COMPLETE
8349,0.6590785020198712,2023-10-02 12:53:11.649757,2023-10-02 12:53:12.240924,0 days 00:00:00.591167,4973.154327207918,460,sag,COMPLETE
8350,0.6449939949776177,2023-10-02 12:53:12.243920,2023-10-02 12:53:12.836944,0 days 00:00:00.593024,811.4594589440912,490,sag,COMPLETE
8351,0.649579648433235,2023-10-02 12:53:12.838946,2023-10-02 12:53:13.286119,0 days 00:00:00.447173,136.51640293700785,480,sag,COMPLETE
8352,0.6520362484987444,2023-10-02 12:53:13.289120,2023-10-02 12:53:13.869737,0 days 00:00:00.580617,61628.5526582693,450,sag,COMPLETE
8353,0.6457036794409869,2023-10-02 12:53:13.871752,2023-10-02 12:53:14.416638,0 days 00:00:00.544886,255.79115937031872,350,lbfgs,COMPLETE
8354,0.6534556174254831,2023-10-02 12:53:14.418638,2023-10-02 12:53:14.950293,0 days 00:00:00.531655,56.69254189445783,500,sag,COMPLETE
8355,0.6590785020198712,2023-10-02 12:53:14.953293,2023-10-02 12:53:15.433389,0 days 00:00:00.480096,23365.946805550913,340,sag,COMPLETE
8356,0.6449939949776177,2023-10-02 12:53:15.436392,2023-10-02 12:53:16.016298,0 days 00:00:00.579906,2314.964170177233,490,sag,COMPLETE
8357,0.666120755540998,2023-10-02 12:53:16.019346,2023-10-02 12:53:16.586186,0 days 00:00:00.566840,47833.56580279475,360,sag,COMPLETE
8358,0.666120755540998,2023-10-02 12:53:16.588241,2023-10-02 12:53:17.064442,0 days 00:00:00.476201,31344.155328808025,380,sag,COMPLETE
8359,0.6534556174254831,2023-10-02 12:53:17.066447,2023-10-02 12:53:17.583236,0 days 00:00:00.516789,42.424667570543605,500,sag,COMPLETE
8360,0.6442843105142483,2023-10-02 12:53:17.586236,2023-10-02 12:53:18.169591,0 days 00:00:00.583355,10231.00974849971,450,sag,COMPLETE
8361,0.5,2023-10-02 12:53:18.171662,2023-10-02 12:53:18.681336,0 days 00:00:00.509674,0.002198888613982206,460,sag,COMPLETE
8362,0.6590785020198712,2023-10-02 12:53:18.683336,2023-10-02 12:53:19.157046,0 days 00:00:00.473710,3565.079290419063,420,sag,COMPLETE
8363,0.6520362484987444,2023-10-02 12:53:19.159157,2023-10-02 12:53:19.744657,0 days 00:00:00.585500,67538.80417558878,470,sag,COMPLETE
8364,0.5,2023-10-02 12:53:19.747653,2023-10-02 12:53:20.373252,0 days 00:00:00.625599,9.483901369114784e-05,440,sag,COMPLETE
8365,0.637951741456491,2023-10-02 12:53:20.376249,2023-10-02 12:53:20.903005,0 days 00:00:00.526756,6657.863817864849,330,newton-cg,COMPLETE
8366,0.5,2023-10-02 12:53:20.905005,2023-10-02 12:53:21.366473,0 days 00:00:00.461468,0.00017653988781075048,480,sag,COMPLETE
8367,0.666120755540998,2023-10-02 12:53:21.369479,2023-10-02 12:53:21.927018,0 days 00:00:00.557539,14895.32720391428,320,sag,COMPLETE
8368,0.5,2023-10-02 12:53:21.929018,2023-10-02 12:53:22.427954,0 days 00:00:00.498936,1.744602297297298e-05,490,liblinear,COMPLETE
8369,0.6298722567965934,2023-10-02 12:53:22.431113,2023-10-02 12:53:22.840765,0 days 00:00:00.409652,15.798181512224952,430,sag,COMPLETE
8370,0.6520362484987444,2023-10-02 12:53:22.843766,2023-10-02 12:53:23.399395,0 days 00:00:00.555629,32360.35844216153,350,sag,COMPLETE
8371,0.634075772464243,2023-10-02 12:53:23.402394,2023-10-02 12:53:23.969040,0 days 00:00:00.566646,67638.05301522471,410,sag,COMPLETE
8372,0.5,2023-10-02 12:53:23.971040,2023-10-02 12:53:24.473235,0 days 00:00:00.502195,0.12741816827086763,370,sag,COMPLETE
8373,0.6590785020198712,2023-10-02 12:53:24.477235,2023-10-02 12:53:24.983441,0 days 00:00:00.506206,20747.339630087386,500,sag,COMPLETE
8374,0.6062888961677039,2023-10-02 12:53:24.986439,2023-10-02 12:53:25.506119,0 days 00:00:00.519680,5.613435918744262,480,sag,COMPLETE
8375,0.6559122174909924,2023-10-02 12:53:25.508111,2023-10-02 12:53:26.068355,0 days 00:00:00.560244,41961.54738950366,340,sag,COMPLETE
8376,0.5619609127634021,2023-10-02 12:53:26.071350,2023-10-02 12:53:26.572794,0 days 00:00:00.501444,0.9974770993419649,490,sag,COMPLETE
8377,0.6020853805000546,2023-10-02 12:53:26.575788,2023-10-02 12:53:26.985282,0 days 00:00:00.409494,1.7800378668191996,360,sag,COMPLETE
8378,0.5,2023-10-02 12:53:26.988274,2023-10-02 12:53:27.502004,0 days 00:00:00.513730,0.26770599833362013,460,sag,COMPLETE
8379,0.637951741456491,2023-10-02 12:53:27.504015,2023-10-02 12:53:28.078175,0 days 00:00:00.574160,8266.281490407617,500,lbfgs,COMPLETE
8380,0.6590785020198712,2023-10-02 12:53:28.080167,2023-10-02 12:53:28.632936,0 days 00:00:00.552769,15540.288342777738,250,sag,COMPLETE
8381,0.6520362484987444,2023-10-02 12:53:28.636010,2023-10-02 12:53:29.139762,0 days 00:00:00.503752,5456.014395185977,480,sag,COMPLETE
8382,0.6449939949776177,2023-10-02 12:53:29.141761,2023-10-02 12:53:29.730724,0 days 00:00:00.588963,1234.4529780211078,470,sag,COMPLETE
8383,0.5,2023-10-02 12:53:29.732728,2023-10-02 12:53:30.247292,0 days 00:00:00.514564,0.024519567198837994,440,sag,COMPLETE
8384,0.6590785020198712,2023-10-02 12:53:30.250292,2023-10-02 12:53:30.842756,0 days 00:00:00.592464,2894.927119780787,490,sag,COMPLETE
8385,0.6590785020198712,2023-10-02 12:53:30.845870,2023-10-02 12:53:31.324371,0 days 00:00:00.478501,24367.98445940354,370,sag,COMPLETE
8386,0.6590785020198712,2023-10-02 12:53:31.326371,2023-10-02 12:53:31.892559,0 days 00:00:00.566188,47723.51063027686,340,sag,COMPLETE
8387,0.6520362484987444,2023-10-02 12:53:31.895557,2023-10-02 12:53:32.492949,0 days 00:00:00.597392,99735.7578337487,500,sag,COMPLETE
8388,0.637951741456491,2023-10-02 12:53:32.494957,2023-10-02 12:53:33.019416,0 days 00:00:00.524459,10749.145973165938,390,newton-cg,COMPLETE
8389,0.5,2023-10-02 12:53:33.021924,2023-10-02 12:53:34.505586,0 days 00:00:01.483662,1.1992142021044598e-05,480,sag,COMPLETE
8390,0.6590785020198712,2023-10-02 12:53:34.507595,2023-10-02 12:53:35.089381,0 days 00:00:00.581786,66189.92710036856,450,sag,COMPLETE
8391,0.5,2023-10-02 12:53:35.092381,2023-10-02 12:53:35.603620,0 days 00:00:00.511239,0.021066837204448862,360,sag,COMPLETE
8392,0.637951741456491,2023-10-02 12:53:35.605615,2023-10-02 12:53:36.113677,0 days 00:00:00.508062,32920.36426518685,350,liblinear,COMPLETE
8393,0.6590785020198712,2023-10-02 12:53:36.115668,2023-10-02 12:53:36.643858,0 days 00:00:00.528190,4229.796538282705,470,sag,COMPLETE
8394,0.6457036794409869,2023-10-02 12:53:36.645858,2023-10-02 12:53:37.194508,0 days 00:00:00.548650,193.25336776346248,380,sag,COMPLETE
8395,0.6590785020198712,2023-10-02 12:53:37.197517,2023-10-02 12:53:37.792284,0 days 00:00:00.594767,23284.213757022397,490,sag,COMPLETE
8396,0.6552025330276231,2023-10-02 12:53:37.795284,2023-10-02 12:53:38.388016,0 days 00:00:00.592732,99757.93037167657,460,sag,COMPLETE
8397,0.6520362484987444,2023-10-02 12:53:38.390124,2023-10-02 12:53:38.896407,0 days 00:00:00.506283,2139.156375247785,500,sag,COMPLETE
8398,0.5,2023-10-02 12:53:38.899405,2023-10-02 12:53:39.855658,0 days 00:00:00.956253,2.8040998579628477e-05,450,sag,COMPLETE
8399,0.5,2023-10-02 12:53:39.857656,2023-10-02 12:53:41.020509,0 days 00:00:01.162853,1.9003969008111613e-05,490,sag,COMPLETE
8400,0.6590785020198712,2023-10-02 12:53:41.022553,2023-10-02 12:53:41.590148,0 days 00:00:00.567595,13304.438382653043,370,sag,COMPLETE
8401,0.6559122174909924,2023-10-02 12:53:41.592150,2023-10-02 12:53:42.083323,0 days 00:00:00.491173,6941.6214994843685,400,sag,COMPLETE
8402,0.6316191723987334,2023-10-02 12:53:42.086441,2023-10-02 12:53:42.639011,0 days 00:00:00.552570,589.7514149445384,480,lbfgs,COMPLETE
8403,0.6590785020198712,2023-10-02 12:53:42.642011,2023-10-02 12:53:43.235598,0 days 00:00:00.593587,37629.34632661191,470,sag,COMPLETE
8404,0.6520362484987444,2023-10-02 12:53:43.238593,2023-10-02 12:53:43.814414,0 days 00:00:00.575821,64601.04165522102,360,sag,COMPLETE
8405,0.5,2023-10-02 12:53:43.816421,2023-10-02 12:53:44.230113,0 days 00:00:00.413692,0.0031443450984839074,330,sag,COMPLETE
8406,0.637951741456491,2023-10-02 12:53:44.233200,2023-10-02 12:53:44.804692,0 days 00:00:00.571492,17467.90701218855,350,sag,COMPLETE
8407,0.6006660115733159,2023-10-02 12:53:44.806803,2023-10-02 12:53:45.327166,0 days 00:00:00.520363,3.456348023083712,490,sag,COMPLETE
8408,0.6629544710121192,2023-10-02 12:53:45.329160,2023-10-02 12:53:45.902568,0 days 00:00:00.573408,8249.12163002939,440,sag,COMPLETE
8409,0.6449939949776177,2023-10-02 12:53:45.904568,2023-10-02 12:53:46.399659,0 days 00:00:00.495091,48605.10431739923,500,sag,COMPLETE
8410,0.5,2023-10-02 12:53:46.402659,2023-10-02 12:53:48.122536,0 days 00:00:01.719877,1.0408366925555524e-05,340,sag,COMPLETE
8411,0.6520362484987444,2023-10-02 12:53:48.124535,2023-10-02 12:53:48.715087,0 days 00:00:00.590552,4020.7818009188973,420,sag,COMPLETE
8412,0.6590785020198712,2023-10-02 12:53:48.718087,2023-10-02 12:53:49.213732,0 days 00:00:00.495645,27998.397847138593,470,sag,COMPLETE
8413,0.6534556174254831,2023-10-02 12:53:49.216727,2023-10-02 12:53:49.731595,0 days 00:00:00.514868,129.56844267081206,490,newton-cg,COMPLETE
8414,0.528169014084507,2023-10-02 12:53:49.733595,2023-10-02 12:53:50.241194,0 days 00:00:00.507599,0.40443923187886494,370,sag,COMPLETE
8415,0.6520362484987444,2023-10-02 12:53:50.243191,2023-10-02 12:53:50.824749,0 days 00:00:00.581558,13642.079692218254,460,sag,COMPLETE
8416,0.5,2023-10-02 12:53:50.827746,2023-10-02 12:53:51.255304,0 days 00:00:00.427558,0.04133187515608142,480,sag,COMPLETE
8417,0.5,2023-10-02 12:53:51.257299,2023-10-02 12:53:51.763277,0 days 00:00:00.505978,0.004614437061091718,430,liblinear,COMPLETE
8418,0.6520362484987444,2023-10-02 12:53:51.766274,2023-10-02 12:53:52.360218,0 days 00:00:00.593944,46921.40400641294,380,sag,COMPLETE
8419,0.6449939949776177,2023-10-02 12:53:52.362210,2023-10-02 12:53:53.003312,0 days 00:00:00.641102,953.1276902348733,500,sag,COMPLETE
8420,0.6267059722677149,2023-10-02 12:53:53.007310,2023-10-02 12:53:53.449974,0 days 00:00:00.442664,10.68899118530386,480,sag,COMPLETE
8421,0.5,2023-10-02 12:53:53.452975,2023-10-02 12:53:53.970430,0 days 00:00:00.517455,0.2105202342681814,320,sag,COMPLETE
8422,0.6590785020198712,2023-10-02 12:53:53.973430,2023-10-02 12:53:54.569105,0 days 00:00:00.595675,66684.12587734284,350,sag,COMPLETE
8423,0.6520362484987444,2023-10-02 12:53:54.571108,2023-10-02 12:53:55.166064,0 days 00:00:00.594956,5536.087618548408,500,sag,COMPLETE
8424,0.6449939949776177,2023-10-02 12:53:55.169143,2023-10-02 12:53:55.664147,0 days 00:00:00.495004,19108.393550085686,450,sag,COMPLETE
8425,0.5,2023-10-02 12:53:55.667147,2023-10-02 12:53:56.382561,0 days 00:00:00.715414,5.815091021090597e-05,490,sag,COMPLETE
8426,0.5,2023-10-02 12:53:56.385561,2023-10-02 12:53:56.911942,0 days 00:00:00.526381,0.00844908557974614,360,lbfgs,COMPLETE
8427,0.643956763838847,2023-10-02 12:53:56.913942,2023-10-02 12:53:57.448729,0 days 00:00:00.534787,25.645190719951334,470,sag,COMPLETE
8428,0.6449939949776177,2023-10-02 12:53:57.450729,2023-10-02 12:53:58.029821,0 days 00:00:00.579092,3080.929684061863,300,sag,COMPLETE
8429,0.6418277104487389,2023-10-02 12:53:58.032868,2023-10-02 12:53:58.532084,0 days 00:00:00.499216,534.8670368320734,390,sag,COMPLETE
8430,0.6449939949776177,2023-10-02 12:53:58.535084,2023-10-02 12:53:59.144392,0 days 00:00:00.609308,99735.4324792067,460,sag,COMPLETE
8431,0.6502893328966044,2023-10-02 12:53:59.147399,2023-10-02 12:53:59.698502,0 days 00:00:00.551103,34.61837940775788,480,sag,COMPLETE
8432,0.6590785020198712,2023-10-02 12:53:59.701502,2023-10-02 12:54:00.281881,0 days 00:00:00.580379,9850.362343601912,370,sag,COMPLETE
8433,0.666120755540998,2023-10-02 12:54:00.283882,2023-10-02 12:54:00.798556,0 days 00:00:00.514674,32804.81049827172,490,sag,COMPLETE
8434,0.5,2023-10-02 12:54:00.800636,2023-10-02 12:54:01.339923,0 days 00:00:00.539287,0.10262907058045474,500,sag,COMPLETE
8435,0.6668304400043672,2023-10-02 12:54:01.342973,2023-10-02 12:54:01.957268,0 days 00:00:00.614295,46600.23037631968,440,sag,COMPLETE
8436,0.637951741456491,2023-10-02 12:54:01.960260,2023-10-02 12:54:02.477247,0 days 00:00:00.516987,22858.190543306115,480,sag,COMPLETE
8437,0.637951741456491,2023-10-02 12:54:02.480252,2023-10-02 12:54:03.109460,0 days 00:00:00.629208,1586.675860323989,360,sag,COMPLETE
8438,0.5,2023-10-02 12:54:03.112450,2023-10-02 12:54:03.623583,0 days 00:00:00.511133,0.08674526113695058,340,sag,COMPLETE
8439,0.5549186592422753,2023-10-02 12:54:03.626583,2023-10-02 12:54:04.173070,0 days 00:00:00.546487,0.8086243508991452,450,newton-cg,COMPLETE
8440,0.5,2023-10-02 12:54:04.176070,2023-10-02 12:54:04.696530,0 days 00:00:00.520460,0.0009057580506372757,490,sag,COMPLETE
8441,0.5,2023-10-02 12:54:04.698529,2023-10-02 12:54:05.138711,0 days 00:00:00.440182,0.0013613934589702661,350,sag,COMPLETE
8442,0.637951741456491,2023-10-02 12:54:05.141716,2023-10-02 12:54:05.652092,0 days 00:00:00.510376,12079.41478371218,470,liblinear,COMPLETE
8443,0.6520362484987444,2023-10-02 12:54:05.655086,2023-10-02 12:54:06.203439,0 days 00:00:00.548353,5963.215170514414,160,sag,COMPLETE
8444,0.6520362484987444,2023-10-02 12:54:06.205446,2023-10-02 12:54:06.766370,0 days 00:00:00.560924,66093.77520754653,380,sag,COMPLETE
8445,0.6457036794409869,2023-10-02 12:54:06.768373,2023-10-02 12:54:07.450220,0 days 00:00:00.681847,210.50800553101715,110,sag,COMPLETE
8446,0.6590785020198712,2023-10-02 12:54:07.453222,2023-10-02 12:54:08.076870,0 days 00:00:00.623648,32819.13994332586,500,sag,COMPLETE
8447,0.6298722567965934,2023-10-02 12:54:08.079871,2023-10-02 12:54:08.625375,0 days 00:00:00.545504,15.958358448391095,460,sag,COMPLETE
8448,0.6552025330276231,2023-10-02 12:54:08.629387,2023-10-02 12:54:09.242191,0 days 00:00:00.612804,2596.6125631649343,430,sag,COMPLETE
8449,0.6481602795064964,2023-10-02 12:54:09.244190,2023-10-02 12:54:09.739146,0 days 00:00:00.494956,16450.240560272916,330,sag,COMPLETE
8450,0.6590785020198712,2023-10-02 12:54:09.741146,2023-10-02 12:54:10.340665,0 days 00:00:00.599519,99973.48205724858,490,sag,COMPLETE
8451,0.6534556174254831,2023-10-02 12:54:10.342865,2023-10-02 12:54:10.904919,0 days 00:00:00.562054,97.9145606117514,480,sag,COMPLETE
8452,0.6534556174254831,2023-10-02 12:54:10.906919,2023-10-02 12:54:11.345682,0 days 00:00:00.438763,52.0657825998248,340,sag,COMPLETE
8453,0.6457036794409869,2023-10-02 12:54:11.347684,2023-10-02 12:54:11.908861,0 days 00:00:00.561177,266.5176570605334,450,lbfgs,COMPLETE
8454,0.6520362484987444,2023-10-02 12:54:11.911854,2023-10-02 12:54:12.488975,0 days 00:00:00.577121,8012.5699632217875,370,sag,COMPLETE
8455,0.666120755540998,2023-10-02 12:54:12.490974,2023-10-02 12:54:13.104837,0 days 00:00:00.613863,4274.407331308411,500,sag,COMPLETE
8456,0.5,2023-10-02 12:54:13.107942,2023-10-02 12:54:13.660928,0 days 00:00:00.552986,0.00029101819205020916,470,sag,COMPLETE
8457,0.5478764057211486,2023-10-02 12:54:13.662929,2023-10-02 12:54:14.086589,0 days 00:00:00.423660,0.7910664092018207,350,sag,COMPLETE
8458,0.5,2023-10-02 12:54:14.089586,2023-10-02 12:54:14.812077,0 days 00:00:00.722491,5.705018392476246e-05,480,sag,COMPLETE
8459,0.6520362484987444,2023-10-02 12:54:14.815281,2023-10-02 12:54:15.407746,0 days 00:00:00.592465,37657.57974726573,400,sag,COMPLETE
