number,value,datetime_start,datetime_complete,duration,params_C,params_max_iter,params_solver,state
1455,0.6520362484987444,2023-10-02 12:13:13.725181,2023-10-02 12:13:13.888371,0 days 00:00:00.163190,12192.746602488383,480,sag,COMPLETE
1456,0.5,2023-10-02 12:13:13.889370,2023-10-02 12:13:13.984914,0 days 00:00:00.095544,0.06588422871917411,500,sag,COMPLETE
1457,0.6077082650944426,2023-10-02 12:13:13.985913,2023-10-02 12:13:14.072908,0 days 00:00:00.086995,3.7035543431024074,470,sag,COMPLETE
1458,0.6520362484987444,2023-10-02 12:13:14.073914,2023-10-02 12:13:14.233972,0 days 00:00:00.160058,4934.442585650155,480,sag,COMPLETE
1459,0.5855442733922918,2023-10-02 12:13:14.234976,2023-10-02 12:13:14.323498,0 days 00:00:00.088522,1.2570207343970015,490,sag,COMPLETE
1460,0.5,2023-10-02 12:13:14.324503,2023-10-02 12:13:14.400024,0 days 00:00:00.075521,0.21980492083452044,490,sag,COMPLETE
1461,0.5478764057211486,2023-10-02 12:13:14.400024,2023-10-02 12:13:14.480038,0 days 00:00:00.080014,0.774927957951544,500,sag,COMPLETE
1462,0.6520362484987444,2023-10-02 12:13:14.481037,2023-10-02 12:13:14.660566,0 days 00:00:00.179529,17838.177046403896,500,sag,COMPLETE
1463,0.5,2023-10-02 12:13:14.660566,2023-10-02 12:13:14.764988,0 days 00:00:00.104422,0.04341346187760914,470,sag,COMPLETE
1464,0.6449939949776177,2023-10-02 12:13:14.765989,2023-10-02 12:13:14.954166,0 days 00:00:00.188177,2061.0935919668077,490,sag,COMPLETE
1465,0.6590785020198712,2023-10-02 12:13:14.955166,2023-10-02 12:13:15.162132,0 days 00:00:00.206966,7203.567360181465,480,sag,COMPLETE
1466,0.6520362484987444,2023-10-02 12:13:15.163132,2023-10-02 12:13:15.337189,0 days 00:00:00.174057,3706.1830628150988,500,sag,COMPLETE
1467,0.637951741456491,2023-10-02 12:13:15.337189,2023-10-02 12:13:15.436723,0 days 00:00:00.099534,10462.467405905889,490,newton-cg,COMPLETE
1468,0.637951741456491,2023-10-02 12:13:15.437723,2023-10-02 12:13:15.513251,0 days 00:00:00.075528,6787.323125187171,490,liblinear,COMPLETE
1469,0.637951741456491,2023-10-02 12:13:15.514251,2023-10-02 12:13:15.718411,0 days 00:00:00.204160,2488.6980464045687,470,sag,COMPLETE
1470,0.6559122174909924,2023-10-02 12:13:15.719408,2023-10-02 12:13:15.962120,0 days 00:00:00.242712,19806.51259571641,480,sag,COMPLETE
1471,0.5,2023-10-02 12:13:15.962120,2023-10-02 12:13:16.076652,0 days 00:00:00.114532,0.00019949991306215118,500,sag,COMPLETE
1472,0.6590785020198712,2023-10-02 12:13:16.076652,2023-10-02 12:13:16.242724,0 days 00:00:00.166072,4486.278158889244,480,sag,COMPLETE
1473,0.6590785020198712,2023-10-02 12:13:16.242724,2023-10-02 12:13:16.412143,0 days 00:00:00.169419,10837.762089773323,490,sag,COMPLETE
1474,0.6418277104487389,2023-10-02 12:13:16.413135,2023-10-02 12:13:16.571798,0 days 00:00:00.158663,354.67211462750845,500,sag,COMPLETE
1475,0.6449939949776177,2023-10-02 12:13:16.572797,2023-10-02 12:13:16.736534,0 days 00:00:00.163737,1090.7286210408927,490,sag,COMPLETE
1476,0.6590785020198712,2023-10-02 12:13:16.736534,2023-10-02 12:13:16.922934,0 days 00:00:00.186400,16718.11249552226,500,sag,COMPLETE
1477,0.6449939949776177,2023-10-02 12:13:16.923039,2023-10-02 12:13:17.084920,0 days 00:00:00.161881,7527.440048352626,470,sag,COMPLETE
1478,0.6520362484987444,2023-10-02 12:13:17.084920,2023-10-02 12:13:17.270133,0 days 00:00:00.185213,1648.8263288309063,480,sag,COMPLETE
1479,0.5,2023-10-02 12:13:17.271162,2023-10-02 12:13:17.574437,0 days 00:00:00.303275,5.104251273760053e-05,490,sag,COMPLETE
1480,0.6590785020198712,2023-10-02 12:13:17.574437,2023-10-02 12:13:17.742443,0 days 00:00:00.168006,3534.559801527196,500,sag,COMPLETE
1481,0.5,2023-10-02 12:13:17.743439,2023-10-02 12:13:17.830097,0 days 00:00:00.086658,0.1015570425841141,480,sag,COMPLETE
1482,0.5,2023-10-02 12:13:17.830097,2023-10-02 12:13:17.916633,0 days 00:00:00.086536,0.017319322995452822,490,sag,COMPLETE
1483,0.6520362484987444,2023-10-02 12:13:17.916633,2023-10-02 12:13:18.090313,0 days 00:00:00.173680,5512.999095157241,500,sag,COMPLETE
1484,0.6101648651599519,2023-10-02 12:13:18.090313,2023-10-02 12:13:18.184061,0 days 00:00:00.093748,5.511490861901891,470,sag,COMPLETE
1485,0.6457036794409869,2023-10-02 12:13:18.185061,2023-10-02 12:13:18.310125,0 days 00:00:00.125064,172.16103468841345,490,sag,COMPLETE
1486,0.637951741456491,2023-10-02 12:13:18.311125,2023-10-02 12:13:18.439489,0 days 00:00:00.128364,10982.99798188118,500,newton-cg,COMPLETE
1487,0.6418277104487389,2023-10-02 12:13:18.440491,2023-10-02 12:13:18.617549,0 days 00:00:00.177058,501.1217367680847,480,sag,COMPLETE
1488,0.5,2023-10-02 12:13:18.617549,2023-10-02 12:13:18.691559,0 days 00:00:00.074010,0.00415588325600731,500,liblinear,COMPLETE
1489,0.6520362484987444,2023-10-02 12:13:18.692567,2023-10-02 12:13:18.863620,0 days 00:00:00.171053,21250.62669518434,490,sag,COMPLETE
1490,0.6520362484987444,2023-10-02 12:13:18.864613,2023-10-02 12:13:19.044874,0 days 00:00:00.180261,3081.467208663569,480,sag,COMPLETE
1491,0.6488699639698657,2023-10-02 12:13:19.044874,2023-10-02 12:13:19.321486,0 days 00:00:00.276612,6828.186171625606,490,sag,COMPLETE
1492,0.637951741456491,2023-10-02 12:13:19.322609,2023-10-02 12:13:19.489411,0 days 00:00:00.166802,12744.714875266185,470,sag,COMPLETE
1493,0.6590785020198712,2023-10-02 12:13:19.490411,2023-10-02 12:13:19.662363,0 days 00:00:00.171952,4694.8731685183375,500,sag,COMPLETE
1494,0.637951741456491,2023-10-02 12:13:19.662363,2023-10-02 12:13:19.826917,0 days 00:00:00.164554,1806.0411694809618,480,sag,COMPLETE
1495,0.666120755540998,2023-10-02 12:13:19.826917,2023-10-02 12:13:19.990568,0 days 00:00:00.163651,8702.04656040551,490,sag,COMPLETE
1496,0.5,2023-10-02 12:13:19.991555,2023-10-02 12:13:20.100770,0 days 00:00:00.109215,0.0004200609694923296,500,sag,COMPLETE
1497,0.5,2023-10-02 12:13:20.100770,2023-10-02 12:13:20.188783,0 days 00:00:00.088013,0.001667254578195049,480,sag,COMPLETE
1498,0.5,2023-10-02 12:13:20.189783,2023-10-02 12:13:20.997881,0 days 00:00:00.808098,1.6317086189291415e-05,490,sag,COMPLETE
1499,0.66224478654875,2023-10-02 12:13:20.998881,2023-10-02 12:13:21.163171,0 days 00:00:00.164290,16690.062275399967,500,sag,COMPLETE
1500,0.6203734032099574,2023-10-02 12:13:21.164170,2023-10-02 12:13:21.262296,0 days 00:00:00.098126,7.568121095496967,490,sag,COMPLETE
1501,0.6520362484987444,2023-10-02 12:13:21.262296,2023-10-02 12:13:21.439350,0 days 00:00:00.177054,989.6219703450085,470,sag,COMPLETE
1502,0.5,2023-10-02 12:13:21.440349,2023-10-02 12:13:21.526907,0 days 00:00:00.086558,0.12600264414952836,500,sag,COMPLETE
1503,0.5,2023-10-02 12:13:21.527908,2023-10-02 12:13:21.615612,0 days 00:00:00.087704,0.045331484017820445,480,sag,COMPLETE
1504,0.6520362484987444,2023-10-02 12:13:21.616605,2023-10-02 12:13:21.781141,0 days 00:00:00.164536,2584.5716300949475,490,sag,COMPLETE
1505,0.6590785020198712,2023-10-02 12:13:21.782171,2023-10-02 12:13:21.956195,0 days 00:00:00.174024,4502.307292177682,500,sag,COMPLETE
1506,0.6629544710121192,2023-10-02 12:13:21.957194,2023-10-02 12:13:22.147580,0 days 00:00:00.190386,8761.116179595369,490,sag,COMPLETE
1507,0.5,2023-10-02 12:13:22.147580,2023-10-02 12:13:22.225902,0 days 00:00:00.078322,0.0005005709758228355,470,newton-cg,COMPLETE
1508,0.5,2023-10-02 12:13:22.226902,2023-10-02 12:13:22.848888,0 days 00:00:00.621986,2.283396026517225e-05,480,sag,COMPLETE
1509,0.637951741456491,2023-10-02 12:13:22.849886,2023-10-02 12:13:22.925472,0 days 00:00:00.075586,20329.186928162926,500,liblinear,COMPLETE
1510,0.6520362484987444,2023-10-02 12:13:22.925472,2023-10-02 12:13:23.098948,0 days 00:00:00.173476,12724.233250663818,490,sag,COMPLETE
1511,0.5,2023-10-02 12:13:23.099949,2023-10-02 12:13:23.193111,0 days 00:00:00.093162,0.009451268181709879,480,sag,COMPLETE
1512,0.6520362484987444,2023-10-02 12:13:23.193111,2023-10-02 12:13:23.464669,0 days 00:00:00.271558,6232.230880984952,500,sag,COMPLETE
1513,0.5,2023-10-02 12:13:23.465669,2023-10-02 12:13:23.551340,0 days 00:00:00.085671,0.004628374797048463,490,sag,COMPLETE
1514,0.6520362484987444,2023-10-02 12:13:23.552344,2023-10-02 12:13:23.738455,0 days 00:00:00.186111,3225.186157643898,490,sag,COMPLETE
1515,0.666120755540998,2023-10-02 12:13:23.739492,2023-10-02 12:13:23.933287,0 days 00:00:00.193795,20090.519561232377,470,sag,COMPLETE
1516,0.6590785020198712,2023-10-02 12:13:23.934287,2023-10-02 12:13:24.108721,0 days 00:00:00.174434,9363.860442139392,500,sag,COMPLETE
1517,0.5,2023-10-02 12:13:24.108721,2023-10-02 12:13:24.286903,0 days 00:00:00.178182,0.00010920800061776215,480,sag,COMPLETE
1518,0.5,2023-10-02 12:13:24.286903,2023-10-02 12:13:24.420406,0 days 00:00:00.133503,0.023121402085638818,500,sag,COMPLETE
1519,0.5,2023-10-02 12:13:24.421401,2023-10-02 12:13:24.520043,0 days 00:00:00.098642,0.28239521167107584,490,sag,COMPLETE
1520,0.6520362484987444,2023-10-02 12:13:24.521044,2023-10-02 12:13:24.720359,0 days 00:00:00.199315,4774.847647378255,470,sag,COMPLETE
1521,0.6449939949776177,2023-10-02 12:13:24.721359,2023-10-02 12:13:24.887059,0 days 00:00:00.165700,1798.0982171874348,480,sag,COMPLETE
1522,0.6590785020198712,2023-10-02 12:13:24.887059,2023-10-02 12:13:24.984941,0 days 00:00:00.097882,6707.098245342609,100,sag,COMPLETE
1523,0.5,2023-10-02 12:13:24.985940,2023-10-02 12:13:25.078485,0 days 00:00:00.092545,0.00133091738686992,500,sag,COMPLETE
1524,0.6629544710121192,2023-10-02 12:13:25.079483,2023-10-02 12:13:25.289217,0 days 00:00:00.209734,12818.782982745424,490,sag,COMPLETE
1525,0.5,2023-10-02 12:13:25.289217,2023-10-02 12:13:25.722883,0 days 00:00:00.433666,3.928852663266254e-05,480,sag,COMPLETE
1526,0.5,2023-10-02 12:13:25.723879,2023-10-02 12:13:25.809541,0 days 00:00:00.085662,0.0027772937314490074,500,sag,COMPLETE
1527,0.5,2023-10-02 12:13:25.809541,2023-10-02 12:13:25.890489,0 days 00:00:00.080948,0.0072684288325707185,490,sag,COMPLETE
1528,0.637951741456491,2023-10-02 12:13:25.890489,2023-10-02 12:13:25.993507,0 days 00:00:00.103018,24158.21650990103,470,liblinear,COMPLETE
1529,0.6449939949776177,2023-10-02 12:13:25.994505,2023-10-02 12:13:26.173546,0 days 00:00:00.179041,3288.1061281457523,490,sag,COMPLETE
1530,0.5478764057211486,2023-10-02 12:13:26.174546,2023-10-02 12:13:26.291458,0 days 00:00:00.116912,0.7579509081305966,500,newton-cg,COMPLETE
1531,0.637951741456491,2023-10-02 12:13:26.292462,2023-10-02 12:13:26.461439,0 days 00:00:00.168977,912.0361264434702,480,sag,COMPLETE
1532,0.6520362484987444,2023-10-02 12:13:26.462491,2023-10-02 12:13:26.663534,0 days 00:00:00.201043,8634.01837371464,500,sag,COMPLETE
1533,0.6590785020198712,2023-10-02 12:13:26.664534,2023-10-02 12:13:26.916753,0 days 00:00:00.252219,2380.300149384495,480,sag,COMPLETE
1534,0.6457036794409869,2023-10-02 12:13:26.916753,2023-10-02 12:13:27.048384,0 days 00:00:00.131631,194.7873087402481,490,sag,COMPLETE
1535,0.6520362484987444,2023-10-02 12:13:27.049382,2023-10-02 12:13:27.245549,0 days 00:00:00.196167,4330.424747430662,500,sag,COMPLETE
1536,0.6590785020198712,2023-10-02 12:13:27.246556,2023-10-02 12:13:27.469463,0 days 00:00:00.222907,16649.698222403913,470,sag,COMPLETE
1537,0.6559122174909924,2023-10-02 12:13:27.470460,2023-10-02 12:13:27.642931,0 days 00:00:00.172471,7023.756796217147,490,sag,COMPLETE
1538,0.6520362484987444,2023-10-02 12:13:27.643985,2023-10-02 12:13:27.810229,0 days 00:00:00.166244,12231.839589620418,480,sag,COMPLETE
1539,0.6449939949776177,2023-10-02 12:13:27.810229,2023-10-02 12:13:27.997020,0 days 00:00:00.186791,23692.17833969645,490,sag,COMPLETE
1540,0.608417949557812,2023-10-02 12:13:27.998020,2023-10-02 12:13:28.079784,0 days 00:00:00.081764,3.145993246293904,500,sag,COMPLETE
1541,0.528169014084507,2023-10-02 12:13:28.079784,2023-10-02 12:13:28.171330,0 days 00:00:00.091546,0.3749035059354343,480,sag,COMPLETE
1542,0.6520362484987444,2023-10-02 12:13:28.172331,2023-10-02 12:13:28.350793,0 days 00:00:00.178462,4807.849924242566,490,sag,COMPLETE
1543,0.6418277104487389,2023-10-02 12:13:28.351793,2023-10-02 12:13:28.538358,0 days 00:00:00.186565,568.5802033635011,470,sag,COMPLETE
1544,0.6449939949776177,2023-10-02 12:13:28.539357,2023-10-02 12:13:28.726235,0 days 00:00:00.186878,1440.1986804801459,500,sag,COMPLETE
1545,0.6449939949776177,2023-10-02 12:13:28.726235,2023-10-02 12:13:28.891756,0 days 00:00:00.165521,2688.6644610064923,480,sag,COMPLETE
1546,0.5943334425155585,2023-10-02 12:13:28.891756,2023-10-02 12:13:28.978274,0 days 00:00:00.086518,2.0072901869466198,500,sag,COMPLETE
1547,0.637951741456491,2023-10-02 12:13:28.979278,2023-10-02 12:13:29.098980,0 days 00:00:00.119702,9132.169108718661,490,newton-cg,COMPLETE
1548,0.5,2023-10-02 12:13:29.099980,2023-10-02 12:13:29.211585,0 days 00:00:00.111605,0.00028590262921719125,500,sag,COMPLETE
1549,0.5,2023-10-02 12:13:29.212585,2023-10-02 12:13:29.324104,0 days 00:00:00.111519,0.015234218601298229,490,sag,COMPLETE
1550,0.637951741456491,2023-10-02 12:13:29.325104,2023-10-02 12:13:29.414335,0 days 00:00:00.089231,5873.40086188108,470,liblinear,COMPLETE
1551,0.5651271972922809,2023-10-02 12:13:29.415331,2023-10-02 12:13:29.516087,0 days 00:00:00.100756,1.0728636727374983,480,sag,COMPLETE
1552,0.6481602795064964,2023-10-02 12:13:29.517083,2023-10-02 12:13:29.706969,0 days 00:00:00.189886,13193.92883484704,500,sag,COMPLETE
1553,0.6449939949776177,2023-10-02 12:13:29.707969,2023-10-02 12:13:29.874617,0 days 00:00:00.166648,21252.25070379415,490,sag,COMPLETE
1554,0.6449939949776177,2023-10-02 12:13:29.874617,2023-10-02 12:13:30.047672,0 days 00:00:00.173055,3893.31411774131,480,sag,COMPLETE
1555,0.5,2023-10-02 12:13:30.048669,2023-10-02 12:13:30.275435,0 days 00:00:00.226766,0.0001321302768023395,500,sag,COMPLETE
1556,0.6520362484987444,2023-10-02 12:13:30.276435,2023-10-02 12:13:30.446808,0 days 00:00:00.170373,7548.302559340691,490,sag,COMPLETE
1557,0.5,2023-10-02 12:13:30.447807,2023-10-02 12:13:30.545766,0 days 00:00:00.097959,0.0006521300158469932,480,sag,COMPLETE
1558,0.5,2023-10-02 12:13:30.546765,2023-10-02 12:13:30.625393,0 days 00:00:00.078628,0.051604022468108364,470,sag,COMPLETE
1559,0.637951741456491,2023-10-02 12:13:30.626392,2023-10-02 12:13:30.825666,0 days 00:00:00.199274,12861.899574259287,500,sag,COMPLETE
1560,0.6449939949776177,2023-10-02 12:13:30.826722,2023-10-02 12:13:31.000440,0 days 00:00:00.173718,2132.614237386323,490,sag,COMPLETE
1561,0.637951741456491,2023-10-02 12:13:31.001435,2023-10-02 12:13:31.167061,0 days 00:00:00.165626,5411.6556607943885,500,sag,COMPLETE
1562,0.6481602795064964,2023-10-02 12:13:31.168061,2023-10-02 12:13:31.368769,0 days 00:00:00.200708,3321.8398609654087,480,sag,COMPLETE
1563,0.6668304400043672,2023-10-02 12:13:31.368769,2023-10-02 12:13:31.543750,0 days 00:00:00.174981,23493.237214066157,490,sag,COMPLETE
1564,0.6449939949776177,2023-10-02 12:13:31.544750,2023-10-02 12:13:31.708224,0 days 00:00:00.163474,29104.431362167077,470,sag,COMPLETE
1565,0.6520362484987444,2023-10-02 12:13:31.708224,2023-10-02 12:13:31.873931,0 days 00:00:00.165707,21366.746045249383,480,sag,COMPLETE
1566,0.5,2023-10-02 12:13:31.873931,2023-10-02 12:13:31.969659,0 days 00:00:00.095728,0.0011190264948008947,470,sag,COMPLETE
1567,0.6418277104487389,2023-10-02 12:13:31.969659,2023-10-02 12:13:32.150069,0 days 00:00:00.180410,371.21772046100176,480,sag,COMPLETE
1568,0.6481602795064964,2023-10-02 12:13:32.150069,2023-10-02 12:13:32.326833,0 days 00:00:00.176764,26462.656621129667,480,sag,COMPLETE
1569,0.6013756960366853,2023-10-02 12:13:32.327876,2023-10-02 12:13:32.419348,0 days 00:00:00.091472,2.4126119847274152,490,newton-cg,COMPLETE
1570,0.6590785020198712,2023-10-02 12:13:32.420348,2023-10-02 12:13:32.589364,0 days 00:00:00.169016,16394.699042438493,460,sag,COMPLETE
1571,0.637951741456491,2023-10-02 12:13:32.590415,2023-10-02 12:13:32.684240,0 days 00:00:00.093825,23391.967804473163,470,liblinear,COMPLETE
1572,0.666120755540998,2023-10-02 12:13:32.685241,2023-10-02 12:13:32.856657,0 days 00:00:00.171416,16504.3956196193,490,sag,COMPLETE
1573,0.6457036794409869,2023-10-02 12:13:32.857658,2023-10-02 12:13:33.014576,0 days 00:00:00.156918,281.9950347692559,490,sag,COMPLETE
1574,0.608417949557812,2023-10-02 12:13:33.014576,2023-10-02 12:13:33.099792,0 days 00:00:00.085216,3.0526822350623273,480,sag,COMPLETE
1575,0.6520362484987444,2023-10-02 12:13:33.100790,2023-10-02 12:13:33.271938,0 days 00:00:00.171148,10945.611811322391,490,sag,COMPLETE
1576,0.5,2023-10-02 12:13:33.272996,2023-10-02 12:13:33.430112,0 days 00:00:00.157116,0.031065329774577176,480,sag,COMPLETE
1577,0.6590785020198712,2023-10-02 12:13:33.431115,2023-10-02 12:13:33.596823,0 days 00:00:00.165708,27522.111855316074,470,sag,COMPLETE
1578,0.5,2023-10-02 12:13:33.597820,2023-10-02 12:13:33.725412,0 days 00:00:00.127592,0.0007702789908292015,490,sag,COMPLETE
1579,0.6449939949776177,2023-10-02 12:13:33.726507,2023-10-02 12:13:33.892067,0 days 00:00:00.165560,13162.577798887156,490,sag,COMPLETE
1580,0.6449939949776177,2023-10-02 12:13:33.893067,2023-10-02 12:13:34.065366,0 days 00:00:00.172299,9372.252458726858,480,sag,COMPLETE
1581,0.5,2023-10-02 12:13:34.065366,2023-10-02 12:13:34.526876,0 days 00:00:00.461510,3.4984204346053156e-05,460,sag,COMPLETE
1582,0.5,2023-10-02 12:13:34.527876,2023-10-02 12:13:34.610509,0 days 00:00:00.082633,0.13725559555136901,490,sag,COMPLETE
1583,0.6457036794409869,2023-10-02 12:13:34.611508,2023-10-02 12:13:34.737385,0 days 00:00:00.125877,182.29000911141097,500,sag,COMPLETE
1584,0.637951741456491,2023-10-02 12:13:34.738381,2023-10-02 12:13:34.913139,0 days 00:00:00.174758,697.8325544318876,470,sag,COMPLETE
1585,0.5,2023-10-02 12:13:34.913139,2023-10-02 12:13:35.063792,0 days 00:00:00.150653,0.00020904005564778598,500,sag,COMPLETE
1586,0.6520362484987444,2023-10-02 12:13:35.064792,2023-10-02 12:13:35.233255,0 days 00:00:00.168463,28216.208424205008,490,sag,COMPLETE
1587,0.637951741456491,2023-10-02 12:13:35.234308,2023-10-02 12:13:35.406980,0 days 00:00:00.172672,17317.130476847942,480,sag,COMPLETE
1588,0.6059613494923026,2023-10-02 12:13:35.406980,2023-10-02 12:13:35.497542,0 days 00:00:00.090562,1.6684245815752443,500,sag,COMPLETE
1589,0.637951741456491,2023-10-02 12:13:35.498546,2023-10-02 12:13:35.603888,0 days 00:00:00.105342,8713.56243706586,480,newton-cg,COMPLETE
1590,0.6520362484987444,2023-10-02 12:13:35.604888,2023-10-02 12:13:35.770516,0 days 00:00:00.165628,27909.094775466318,470,sag,COMPLETE
1591,0.5,2023-10-02 12:13:35.770516,2023-10-02 12:13:36.416735,0 days 00:00:00.646219,2.1146531689119266e-05,490,sag,COMPLETE
1592,0.666120755540998,2023-10-02 12:13:36.417803,2023-10-02 12:13:36.586458,0 days 00:00:00.168655,12093.650167807107,490,sag,COMPLETE
1593,0.6520362484987444,2023-10-02 12:13:36.587458,2023-10-02 12:13:36.771510,0 days 00:00:00.184052,17145.82491461687,500,sag,COMPLETE
1594,0.5,2023-10-02 12:13:36.772510,2023-10-02 12:13:36.850135,0 days 00:00:00.077625,0.31453611374134266,480,liblinear,COMPLETE
1595,0.6449939949776177,2023-10-02 12:13:36.850135,2023-10-02 12:13:37.049862,0 days 00:00:00.199727,7090.482197919106,500,sag,COMPLETE
1596,0.6590785020198712,2023-10-02 12:13:37.050921,2023-10-02 12:13:37.309028,0 days 00:00:00.258107,6419.618167669249,490,sag,COMPLETE
1597,0.6449939949776177,2023-10-02 12:13:37.310028,2023-10-02 12:13:37.478486,0 days 00:00:00.168458,1276.5833707927322,480,sag,COMPLETE
1598,0.5,2023-10-02 12:13:37.479479,2023-10-02 12:13:37.576412,0 days 00:00:00.096933,0.0017517888892035155,500,sag,COMPLETE
1599,0.5,2023-10-02 12:13:37.576412,2023-10-02 12:13:37.787862,0 days 00:00:00.211450,9.252604602996554e-05,460,sag,COMPLETE
1600,0.6449939949776177,2023-10-02 12:13:37.788932,2023-10-02 12:13:37.961429,0 days 00:00:00.172497,10949.434577320486,490,sag,COMPLETE
1601,0.5,2023-10-02 12:13:37.962429,2023-10-02 12:13:38.075020,0 days 00:00:00.112591,0.002842188761325253,470,sag,COMPLETE
1602,0.6235396877388361,2023-10-02 12:13:38.076025,2023-10-02 12:13:38.163674,0 days 00:00:00.087649,8.8635483416774,480,sag,COMPLETE
1603,0.6418277104487389,2023-10-02 12:13:38.163674,2023-10-02 12:13:38.331472,0 days 00:00:00.167798,428.27328291494416,490,sag,COMPLETE
1604,0.6481602795064964,2023-10-02 12:13:38.332472,2023-10-02 12:13:38.508971,0 days 00:00:00.176499,31313.402530994463,500,sag,COMPLETE
1605,0.5792117043345343,2023-10-02 12:13:38.509975,2023-10-02 12:13:38.610504,0 days 00:00:00.100529,1.1078065623541218,500,sag,COMPLETE
1606,0.666120755540998,2023-10-02 12:13:38.611509,2023-10-02 12:13:38.798529,0 days 00:00:00.187020,19273.961794102288,490,sag,COMPLETE
1607,0.5,2023-10-02 12:13:38.799529,2023-10-02 12:13:39.060439,0 days 00:00:00.260910,7.392752219920789e-05,470,sag,COMPLETE
1608,0.5,2023-10-02 12:13:39.061505,2023-10-02 12:13:39.154176,0 days 00:00:00.092671,0.08194573805919501,480,sag,COMPLETE
1609,0.5352112676056338,2023-10-02 12:13:39.155181,2023-10-02 12:13:39.242701,0 days 00:00:00.087520,0.4737952598207853,490,newton-cg,COMPLETE
1610,0.5376678676711432,2023-10-02 12:13:39.243702,2023-10-02 12:13:39.324223,0 days 00:00:00.080521,0.6217699324357969,500,sag,COMPLETE
1611,0.666120755540998,2023-10-02 12:13:39.325223,2023-10-02 12:13:39.514483,0 days 00:00:00.189260,7516.541347289469,480,sag,COMPLETE
1612,0.6101648651599519,2023-10-02 12:13:39.514483,2023-10-02 12:13:39.599670,0 days 00:00:00.085187,5.365542530438011,500,liblinear,COMPLETE
1613,0.6062888961677039,2023-10-02 12:13:39.600749,2023-10-02 12:13:39.718839,0 days 00:00:00.118090,6.504803796354409,490,sag,COMPLETE
1614,0.6590785020198712,2023-10-02 12:13:39.719855,2023-10-02 12:13:39.883383,0 days 00:00:00.163528,5087.024408181421,460,sag,COMPLETE
1615,0.5,2023-10-02 12:13:39.883383,2023-10-02 12:13:39.990922,0 days 00:00:00.107539,0.0006626488273591367,480,sag,COMPLETE
1616,0.6590785020198712,2023-10-02 12:13:39.990922,2023-10-02 12:13:40.162047,0 days 00:00:00.171125,14876.568295424091,490,sag,COMPLETE
1617,0.6520362484987444,2023-10-02 12:13:40.163047,2023-10-02 12:13:40.419246,0 days 00:00:00.256199,2737.0626825508716,470,sag,COMPLETE
