number,value,datetime_start,datetime_complete,duration,params_C,params_max_iter,params_solver,state
6340,0.6629544710121192,2023-10-02 12:36:43.752847,2023-10-02 12:36:44.208401,0 days 00:00:00.455554,66794.0110842444,440,sag,COMPLETE
6341,0.528169014084507,2023-10-02 12:36:44.208401,2023-10-02 12:36:44.589727,0 days 00:00:00.381326,0.4446218467851935,400,lbfgs,COMPLETE
6342,0.5,2023-10-02 12:36:44.605408,2023-10-02 12:36:44.928814,0 days 00:00:00.323406,0.005837306043934387,440,sag,COMPLETE
6343,0.6418277104487389,2023-10-02 12:36:44.930813,2023-10-02 12:36:45.408511,0 days 00:00:00.477698,450.56715893612784,440,sag,COMPLETE
6344,0.6449939949776177,2023-10-02 12:36:45.408511,2023-10-02 12:36:45.785640,0 days 00:00:00.377129,1247.7594236310374,420,sag,COMPLETE
6345,0.6101648651599519,2023-10-02 12:36:45.785640,2023-10-02 12:36:46.193553,0 days 00:00:00.407913,5.340262290593661,450,sag,COMPLETE
6346,0.5408341522000218,2023-10-02 12:36:46.193553,2023-10-02 12:36:46.492099,0 days 00:00:00.298546,0.6691966866276227,390,sag,COMPLETE
6347,0.6590785020198712,2023-10-02 12:36:46.492099,2023-10-02 12:36:46.946961,0 days 00:00:00.454862,44451.411993491245,400,sag,COMPLETE
6348,0.5792117043345343,2023-10-02 12:36:46.962590,2023-10-02 12:36:47.260734,0 days 00:00:00.298144,1.1477570632329597,390,sag,COMPLETE
6349,0.5,2023-10-02 12:36:47.260734,2023-10-02 12:36:47.652967,0 days 00:00:00.392233,0.05480072056576255,430,sag,COMPLETE
6350,0.5,2023-10-02 12:36:47.652967,2023-10-02 12:36:47.966774,0 days 00:00:00.313807,0.002453163597333781,450,sag,COMPLETE
6351,0.637951741456491,2023-10-02 12:36:47.966774,2023-10-02 12:36:48.391250,0 days 00:00:00.424476,23725.27450637484,410,newton-cg,COMPLETE
6352,0.5,2023-10-02 12:36:48.391250,2023-10-02 12:36:48.705067,0 days 00:00:00.313817,0.010815061287446928,440,sag,COMPLETE
6353,0.5,2023-10-02 12:36:48.705067,2023-10-02 12:36:49.084374,0 days 00:00:00.379307,0.02394538070389392,450,sag,COMPLETE
6354,0.6369145103177202,2023-10-02 12:36:49.084374,2023-10-02 12:36:49.395542,0 days 00:00:00.311168,21.28943844799194,410,liblinear,COMPLETE
6355,0.666120755540998,2023-10-02 12:36:49.395542,2023-10-02 12:36:49.865004,0 days 00:00:00.469462,98647.64103409101,430,sag,COMPLETE
6356,0.6559122174909924,2023-10-02 12:36:49.867008,2023-10-02 12:36:50.372468,0 days 00:00:00.505460,26587.783807564505,450,sag,COMPLETE
6357,0.6457036794409869,2023-10-02 12:36:50.374467,2023-10-02 12:36:50.770050,0 days 00:00:00.395583,251.38115680431815,440,sag,COMPLETE
6358,0.6534556174254831,2023-10-02 12:36:50.772054,2023-10-02 12:36:51.207855,0 days 00:00:00.435801,128.0096031237567,390,sag,COMPLETE
6359,0.6590785020198712,2023-10-02 12:36:51.209861,2023-10-02 12:36:51.629884,0 days 00:00:00.420023,46410.311297366025,450,sag,COMPLETE
6360,0.6520362484987444,2023-10-02 12:36:51.629884,2023-10-02 12:36:52.151475,0 days 00:00:00.521591,65610.32738054288,450,sag,COMPLETE
6361,0.666120755540998,2023-10-02 12:36:52.152956,2023-10-02 12:36:52.558410,0 days 00:00:00.405454,23539.991755344054,440,sag,COMPLETE
6362,0.6629544710121192,2023-10-02 12:36:52.558410,2023-10-02 12:36:53.046127,0 days 00:00:00.487717,32386.193367714153,430,sag,COMPLETE
6363,0.6520362484987444,2023-10-02 12:36:53.046127,2023-10-02 12:36:53.428582,0 days 00:00:00.382455,1744.6146553654844,390,sag,COMPLETE
6364,0.5,2023-10-02 12:36:53.444210,2023-10-02 12:36:53.843679,0 days 00:00:00.399469,0.03964429569005758,380,sag,COMPLETE
6365,0.637951741456491,2023-10-02 12:36:53.843679,2023-10-02 12:36:54.190225,0 days 00:00:00.346546,45104.05367875403,440,lbfgs,COMPLETE
6366,0.5,2023-10-02 12:36:54.204747,2023-10-02 12:36:54.623650,0 days 00:00:00.418903,0.0003932759783746813,450,sag,COMPLETE
6367,0.666120755540998,2023-10-02 12:36:54.625646,2023-10-02 12:36:55.109597,0 days 00:00:00.483951,68733.91330366173,420,sag,COMPLETE
6368,0.6520362484987444,2023-10-02 12:36:55.109597,2023-10-02 12:36:55.511243,0 days 00:00:00.401646,98251.97082068361,430,sag,COMPLETE
6369,0.5,2023-10-02 12:36:55.526260,2023-10-02 12:36:55.907585,0 days 00:00:00.381325,0.008957846448821537,410,sag,COMPLETE
6370,0.6534556174254831,2023-10-02 12:36:55.907585,2023-10-02 12:36:56.247841,0 days 00:00:00.340256,42.20202572838997,450,sag,COMPLETE
6371,0.619663718746588,2023-10-02 12:36:56.249841,2023-10-02 12:36:56.654492,0 days 00:00:00.404651,9.706501241677866,170,sag,COMPLETE
6372,0.5,2023-10-02 12:36:56.654492,2023-10-02 12:36:57.024862,0 days 00:00:00.370370,0.00019792044475809881,440,sag,COMPLETE
6373,0.6590785020198712,2023-10-02 12:36:57.026861,2023-10-02 12:36:57.493295,0 days 00:00:00.466434,20660.814108337116,400,sag,COMPLETE
6374,0.637951741456491,2023-10-02 12:36:57.495825,2023-10-02 12:36:57.875953,0 days 00:00:00.380128,883.4981792450241,450,sag,COMPLETE
6375,0.5,2023-10-02 12:36:57.891583,2023-10-02 12:36:58.283056,0 days 00:00:00.391473,0.0008851935401792403,390,newton-cg,COMPLETE
6376,0.5,2023-10-02 12:36:58.283056,2023-10-02 12:36:58.596711,0 days 00:00:00.313655,0.0757938838691314,380,sag,COMPLETE
6377,0.6077082650944426,2023-10-02 12:36:58.596711,2023-10-02 12:36:59.004707,0 days 00:00:00.407996,3.790715490194528,430,sag,COMPLETE
6378,0.6298722567965934,2023-10-02 12:36:59.004707,2023-10-02 12:36:59.398639,0 days 00:00:00.393932,17.630218988506353,440,sag,COMPLETE
6379,0.528169014084507,2023-10-02 12:36:59.398639,2023-10-02 12:36:59.708356,0 days 00:00:00.309717,0.3762363961579683,450,sag,COMPLETE
6380,0.5415438366633912,2023-10-02 12:36:59.708356,2023-10-02 12:37:00.111524,0 days 00:00:00.403168,0.578265880663934,380,sag,COMPLETE
6381,0.6520362484987444,2023-10-02 12:37:00.127178,2023-10-02 12:37:00.527714,0 days 00:00:00.400536,40757.86895554862,460,sag,COMPLETE
6382,0.637951741456491,2023-10-02 12:37:00.529709,2023-10-02 12:37:00.938971,0 days 00:00:00.409262,20319.44154726732,450,liblinear,COMPLETE
6383,0.5,2023-10-02 12:37:00.938971,2023-10-02 12:37:01.256651,0 days 00:00:00.317680,0.3126703808414259,440,sag,COMPLETE
6384,0.6534556174254831,2023-10-02 12:37:01.256651,2023-10-02 12:37:01.685208,0 days 00:00:00.428557,113.33139018745989,420,sag,COMPLETE
6385,0.666120755540998,2023-10-02 12:37:01.686215,2023-10-02 12:37:02.084129,0 days 00:00:00.397914,48206.60629666373,450,sag,COMPLETE
6386,0.5,2023-10-02 12:37:02.086139,2023-10-02 12:37:02.510122,0 days 00:00:00.423983,0.001086303082159219,380,sag,COMPLETE
6387,0.5,2023-10-02 12:37:02.525768,2023-10-02 12:37:02.839540,0 days 00:00:00.313772,0.0005150239425405726,460,sag,COMPLETE
6388,0.637951741456491,2023-10-02 12:37:02.855165,2023-10-02 12:37:03.278796,0 days 00:00:00.423631,28098.088368141925,460,lbfgs,COMPLETE
6389,0.6520362484987444,2023-10-02 12:37:03.278796,2023-10-02 12:37:03.733681,0 days 00:00:00.454885,63024.90112512859,370,sag,COMPLETE
6390,0.649579648433235,2023-10-02 12:37:03.733681,2023-10-02 12:37:04.115833,0 days 00:00:00.382152,164.4491853784367,440,sag,COMPLETE
6391,0.5,2023-10-02 12:37:04.115833,2023-10-02 12:37:04.508182,0 days 00:00:00.392349,0.039251548613507846,400,sag,COMPLETE
6392,0.6590785020198712,2023-10-02 12:37:04.508182,2023-10-02 12:37:04.896741,0 days 00:00:00.388559,32592.33749256565,460,sag,COMPLETE
6393,0.6449939949776177,2023-10-02 12:37:04.896741,2023-10-02 12:37:05.393763,0 days 00:00:00.497022,2208.796647439669,460,sag,COMPLETE
6394,0.6590785020198712,2023-10-02 12:37:05.393763,2023-10-02 12:37:05.791933,0 days 00:00:00.398170,99054.08946550469,370,sag,COMPLETE
6395,0.6481602795064964,2023-10-02 12:37:05.791933,2023-10-02 12:37:06.262842,0 days 00:00:00.470909,21719.13817560306,450,sag,COMPLETE
6396,0.6062888961677039,2023-10-02 12:37:06.262842,2023-10-02 12:37:06.577039,0 days 00:00:00.314197,6.153858129111437,430,sag,COMPLETE
6397,0.5,2023-10-02 12:37:06.577039,2023-10-02 12:37:08.240703,0 days 00:00:01.663664,1.0111407798929587e-05,390,sag,COMPLETE
6398,0.6534556174254831,2023-10-02 12:37:08.240703,2023-10-02 12:37:08.601390,0 days 00:00:00.360687,66.69010809851348,460,sag,COMPLETE
6399,0.6590785020198712,2023-10-02 12:37:08.601390,2023-10-02 12:37:09.101143,0 days 00:00:00.499753,64896.839196334644,410,sag,COMPLETE
6400,0.6449939949776177,2023-10-02 12:37:09.103156,2023-10-02 12:37:09.443561,0 days 00:00:00.340405,99344.57181991443,360,newton-cg,COMPLETE
6401,0.5,2023-10-02 12:37:09.443561,2023-10-02 12:37:09.891890,0 days 00:00:00.448329,0.0016813690052309063,440,sag,COMPLETE
6402,0.6449939949776177,2023-10-02 12:37:09.893884,2023-10-02 12:37:10.386852,0 days 00:00:00.492968,1118.9824951314927,420,sag,COMPLETE
6403,0.6418277104487389,2023-10-02 12:37:10.388847,2023-10-02 12:37:10.803512,0 days 00:00:00.414665,458.50315821323625,450,sag,COMPLETE
6404,0.637951741456491,2023-10-02 12:37:10.817320,2023-10-02 12:37:11.269710,0 days 00:00:00.452390,18343.80817515664,370,liblinear,COMPLETE
6405,0.6590785020198712,2023-10-02 12:37:11.269710,2023-10-02 12:37:11.693270,0 days 00:00:00.423560,35983.668546442976,450,sag,COMPLETE
6406,0.5,2023-10-02 12:37:11.693270,2023-10-02 12:37:12.083038,0 days 00:00:00.389768,0.0032599828876098864,380,sag,COMPLETE
6407,0.5,2023-10-02 12:37:12.083038,2023-10-02 12:37:12.437586,0 days 00:00:00.354548,0.22466784415396057,460,sag,COMPLETE
6408,0.666120755540998,2023-10-02 12:37:12.453119,2023-10-02 12:37:12.937069,0 days 00:00:00.483950,42576.36979000747,430,sag,COMPLETE
6409,0.6267059722677149,2023-10-02 12:37:12.937069,2023-10-02 12:37:13.269303,0 days 00:00:00.332234,10.500886923913212,370,sag,COMPLETE
6410,0.6629544710121192,2023-10-02 12:37:13.269303,2023-10-02 12:37:13.746028,0 days 00:00:00.476725,2370.5033344889102,360,sag,COMPLETE
6411,0.6418277104487389,2023-10-02 12:37:13.748027,2023-10-02 12:37:14.122745,0 days 00:00:00.374718,341.28746351619947,460,sag,COMPLETE
6412,0.608417949557812,2023-10-02 12:37:14.122745,2023-10-02 12:37:14.513877,0 days 00:00:00.391132,2.774867308072299,350,sag,COMPLETE
6413,0.637951741456491,2023-10-02 12:37:14.513877,2023-10-02 12:37:14.956346,0 days 00:00:00.442469,18185.262429734034,380,lbfgs,COMPLETE
6414,0.666120755540998,2023-10-02 12:37:14.958348,2023-10-02 12:37:15.360032,0 days 00:00:00.401684,50912.57143175655,440,sag,COMPLETE
6415,0.6457036794409869,2023-10-02 12:37:15.360032,2023-10-02 12:37:15.820760,0 days 00:00:00.460728,203.89835843726965,360,sag,COMPLETE
6416,0.5,2023-10-02 12:37:15.822755,2023-10-02 12:37:16.155719,0 days 00:00:00.332964,0.0005658124516053042,450,sag,COMPLETE
6417,0.5,2023-10-02 12:37:16.155719,2023-10-02 12:37:16.704271,0 days 00:00:00.548552,7.989530736532535e-05,460,sag,COMPLETE
6418,0.6411180259853696,2023-10-02 12:37:16.704271,2023-10-02 12:37:17.071068,0 days 00:00:00.366797,28240.909738036153,350,sag,COMPLETE
6419,0.6590785020198712,2023-10-02 12:37:17.071068,2023-10-02 12:37:17.537281,0 days 00:00:00.466213,48063.21027213235,430,sag,COMPLETE
6420,0.5,2023-10-02 12:37:17.552915,2023-10-02 12:37:17.872243,0 days 00:00:00.319328,0.013610046414082541,390,sag,COMPLETE
6421,0.6520362484987444,2023-10-02 12:37:17.872243,2023-10-02 12:37:18.341491,0 days 00:00:00.469248,19031.05318417804,460,sag,COMPLETE
6422,0.6520362484987444,2023-10-02 12:37:18.341491,2023-10-02 12:37:18.805062,0 days 00:00:00.463571,99726.01708643684,360,sag,COMPLETE
6423,0.5,2023-10-02 12:37:18.805062,2023-10-02 12:37:19.129322,0 days 00:00:00.324260,0.0013134301170728865,440,sag,COMPLETE
6424,0.5,2023-10-02 12:37:19.137332,2023-10-02 12:37:19.532462,0 days 00:00:00.395130,0.004585530243706659,370,sag,COMPLETE
6425,0.6590785020198712,2023-10-02 12:37:19.532462,2023-10-02 12:37:19.904801,0 days 00:00:00.372339,67913.01771735099,340,sag,COMPLETE
6426,0.5,2023-10-02 12:37:19.904801,2023-10-02 12:37:20.316748,0 days 00:00:00.411947,0.20532652010563485,410,newton-cg,COMPLETE
6427,0.5,2023-10-02 12:37:20.316748,2023-10-02 12:37:20.632071,0 days 00:00:00.315323,0.09473794089231188,450,sag,COMPLETE
6428,0.5,2023-10-02 12:37:20.632071,2023-10-02 12:37:21.622879,0 days 00:00:00.990808,1.9605113704378127e-05,460,sag,COMPLETE
6429,0.637951741456491,2023-10-02 12:37:21.622879,2023-10-02 12:37:21.949678,0 days 00:00:00.326799,34398.765808986915,380,liblinear,COMPLETE
6430,0.6069985806310733,2023-10-02 12:37:21.949678,2023-10-02 12:37:22.397150,0 days 00:00:00.447472,4.197945109965589,420,sag,COMPLETE
6431,0.5,2023-10-02 12:37:22.397150,2023-10-02 12:37:22.750592,0 days 00:00:00.353442,0.015951097831882973,350,sag,COMPLETE
6432,0.5792117043345343,2023-10-02 12:37:22.752597,2023-10-02 12:37:23.174619,0 days 00:00:00.422022,1.1141412537834259,400,sag,COMPLETE
6433,0.6590785020198712,2023-10-02 12:37:23.176620,2023-10-02 12:37:23.589872,0 days 00:00:00.413252,3074.598207295425,440,sag,COMPLETE
6434,0.6520362484987444,2023-10-02 12:37:23.589872,2023-10-02 12:37:24.071914,0 days 00:00:00.482042,1252.6782583995757,370,sag,COMPLETE
6435,0.6520362484987444,2023-10-02 12:37:24.073629,2023-10-02 12:37:24.473861,0 days 00:00:00.400232,18627.181842631453,450,sag,COMPLETE
6436,0.6520362484987444,2023-10-02 12:37:24.473861,2023-10-02 12:37:24.940435,0 days 00:00:00.466574,65747.9814217303,360,sag,COMPLETE
6437,0.5,2023-10-02 12:37:24.955449,2023-10-02 12:37:25.417597,0 days 00:00:00.462148,0.00022068670026122137,340,sag,COMPLETE
6438,0.6534556174254831,2023-10-02 12:37:25.417597,2023-10-02 12:37:25.804478,0 days 00:00:00.386881,104.95771808663518,350,lbfgs,COMPLETE
6439,0.6488699639698657,2023-10-02 12:37:25.806478,2023-10-02 12:37:26.373960,0 days 00:00:00.567482,33294.544535955974,460,sag,COMPLETE
6440,0.666120755540998,2023-10-02 12:37:26.375966,2023-10-02 12:37:26.791808,0 days 00:00:00.415842,14726.49636664561,370,sag,COMPLETE
6441,0.6418277104487389,2023-10-02 12:37:26.799849,2023-10-02 12:37:27.247733,0 days 00:00:00.447884,349.88100449455084,390,sag,COMPLETE
6442,0.5855442733922918,2023-10-02 12:37:27.247733,2023-10-02 12:37:27.561621,0 days 00:00:00.313888,1.342846470724106,430,sag,COMPLETE
6443,0.5,2023-10-02 12:37:27.577249,2023-10-02 12:37:27.969547,0 days 00:00:00.392298,0.03462253365533337,460,sag,COMPLETE
6444,0.6573315864177312,2023-10-02 12:37:27.969547,2023-10-02 12:37:28.300112,0 days 00:00:00.330565,40.93691522728935,360,sag,COMPLETE
6445,0.5,2023-10-02 12:37:28.302107,2023-10-02 12:37:28.715049,0 days 00:00:00.412942,0.15598179298544468,450,sag,COMPLETE
6446,0.5,2023-10-02 12:37:28.718055,2023-10-02 12:37:29.055414,0 days 00:00:00.337359,0.0005307637812168585,440,sag,COMPLETE
6447,0.6449939949776177,2023-10-02 12:37:29.055414,2023-10-02 12:37:29.523850,0 days 00:00:00.468436,1990.3826404186348,340,sag,COMPLETE
6448,0.6590785020198712,2023-10-02 12:37:29.526855,2023-10-02 12:37:29.919870,0 days 00:00:00.393015,28137.730321558654,450,sag,COMPLETE
6449,0.6449939949776177,2023-10-02 12:37:29.935511,2023-10-02 12:37:30.390119,0 days 00:00:00.454608,99862.09938539297,330,sag,COMPLETE
6450,0.5,2023-10-02 12:37:30.405746,2023-10-02 12:37:30.812783,0 days 00:00:00.407037,0.002352701491927252,350,newton-cg,COMPLETE
6451,0.637951741456491,2023-10-02 12:37:30.812783,2023-10-02 12:37:31.187673,0 days 00:00:00.374890,700.0321740031803,380,sag,COMPLETE
6452,0.6590785020198712,2023-10-02 12:37:31.187673,2023-10-02 12:37:31.676592,0 days 00:00:00.488919,47151.12999235785,460,sag,COMPLETE
6453,0.6309094879353642,2023-10-02 12:37:31.676592,2023-10-02 12:37:32.011470,0 days 00:00:00.334878,3931.4210118123488,410,liblinear,COMPLETE
6454,0.6590785020198712,2023-10-02 12:37:32.011470,2023-10-02 12:37:32.493492,0 days 00:00:00.482022,14217.892923389918,360,sag,COMPLETE
6455,0.6590785020198712,2023-10-02 12:37:32.493492,2023-10-02 12:37:32.909679,0 days 00:00:00.416187,61030.050812319176,370,sag,COMPLETE
6456,0.6298722567965934,2023-10-02 12:37:32.912542,2023-10-02 12:37:33.361166,0 days 00:00:00.448624,15.967976196655329,460,sag,COMPLETE
6457,0.5,2023-10-02 12:37:33.361166,2023-10-02 12:37:33.910691,0 days 00:00:00.549525,5.8455245507628165e-05,350,sag,COMPLETE
6458,0.5,2023-10-02 12:37:33.910691,2023-10-02 12:37:34.327553,0 days 00:00:00.416862,0.26074092882645233,440,sag,COMPLETE
6459,0.6481602795064964,2023-10-02 12:37:34.327553,2023-10-02 12:37:34.711639,0 days 00:00:00.384086,26026.21685701787,340,sag,COMPLETE
6460,0.6534556174254831,2023-10-02 12:37:34.711639,2023-10-02 12:37:35.135210,0 days 00:00:00.423571,59.691469302837405,470,sag,COMPLETE
6461,0.6590785020198712,2023-10-02 12:37:35.150226,2023-10-02 12:37:35.610692,0 days 00:00:00.460466,5097.662340674699,460,sag,COMPLETE
6462,0.6534556174254831,2023-10-02 12:37:35.625708,2023-10-02 12:37:35.961541,0 days 00:00:00.335833,83.12724480682759,430,sag,COMPLETE
6463,0.666120755540998,2023-10-02 12:37:35.961541,2023-10-02 12:37:36.416410,0 days 00:00:00.454869,16560.49481918853,370,sag,COMPLETE
6464,0.637951741456491,2023-10-02 12:37:36.416410,2023-10-02 12:37:36.762078,0 days 00:00:00.345668,51548.32643013748,330,lbfgs,COMPLETE
6465,0.6590785020198712,2023-10-02 12:37:36.762078,2023-10-02 12:37:37.258968,0 days 00:00:00.496890,9423.462563775229,470,sag,COMPLETE
6466,0.6369145103177202,2023-10-02 12:37:37.258968,2023-10-02 12:37:37.587207,0 days 00:00:00.328239,23.397670108916994,360,sag,COMPLETE
6467,0.5,2023-10-02 12:37:37.587207,2023-10-02 12:37:38.016919,0 days 00:00:00.429712,0.0002591291604297385,450,sag,COMPLETE
6468,0.6133311496888305,2023-10-02 12:37:38.018915,2023-10-02 12:37:38.356151,0 days 00:00:00.337236,6.985299707065209,400,sag,COMPLETE
6469,0.6629544710121192,2023-10-02 12:37:38.358146,2023-10-02 12:37:38.839660,0 days 00:00:00.481514,2781.8484407831847,380,sag,COMPLETE
6470,0.6520362484987444,2023-10-02 12:37:38.839660,2023-10-02 12:37:39.218260,0 days 00:00:00.378600,99446.44997129236,350,sag,COMPLETE
6471,0.5721694508134076,2023-10-02 12:37:39.218260,2023-10-02 12:37:39.620710,0 days 00:00:00.402450,1.0862038879176001,440,sag,COMPLETE
6472,0.5,2023-10-02 12:37:39.622710,2023-10-02 12:37:40.036528,0 days 00:00:00.413818,0.008017670137211693,340,sag,COMPLETE
6473,0.6481602795064964,2023-10-02 12:37:40.037527,2023-10-02 12:37:40.436560,0 days 00:00:00.399033,33197.42226887774,390,sag,COMPLETE
6474,0.5,2023-10-02 12:37:40.436560,2023-10-02 12:37:40.947178,0 days 00:00:00.510618,0.00010235503735676291,470,sag,COMPLETE
6475,0.5,2023-10-02 12:37:40.949173,2023-10-02 12:37:41.316077,0 days 00:00:00.366904,5.123891717691163e-05,470,newton-cg,COMPLETE
6476,0.5,2023-10-02 12:37:41.321376,2023-10-02 12:37:41.980691,0 days 00:00:00.659315,5.293609835764311e-05,460,sag,COMPLETE
6477,0.5,2023-10-02 12:37:41.980691,2023-10-02 12:37:42.297514,0 days 00:00:00.316823,0.02095602406324968,450,sag,COMPLETE
6478,0.5,2023-10-02 12:37:42.297514,2023-10-02 12:37:42.719857,0 days 00:00:00.422343,0.28526529511405946,420,sag,COMPLETE
6479,0.5,2023-10-02 12:37:42.720856,2023-10-02 12:37:43.514284,0 days 00:00:00.793428,2.679027129317474e-05,350,sag,COMPLETE
6480,0.637951741456491,2023-10-02 12:37:43.514284,2023-10-02 12:37:43.906172,0 days 00:00:00.391888,21749.862448934626,360,liblinear,COMPLETE
6481,0.6590785020198712,2023-10-02 12:37:43.921799,2023-10-02 12:37:44.329753,0 days 00:00:00.407954,66066.35436090475,460,sag,COMPLETE
6482,0.637951741456491,2023-10-02 12:37:44.329753,2023-10-02 12:37:44.785021,0 days 00:00:00.455268,6681.21353843532,370,sag,COMPLETE
6483,0.6552025330276231,2023-10-02 12:37:44.800646,2023-10-02 12:37:45.192963,0 days 00:00:00.392317,12916.247912858289,470,sag,COMPLETE
6484,0.608417949557812,2023-10-02 12:37:45.192963,2023-10-02 12:37:45.616482,0 days 00:00:00.423519,2.6332486410117735,430,sag,COMPLETE
6485,0.6267059722677149,2023-10-02 12:37:45.616482,2023-10-02 12:37:46.055789,0 days 00:00:00.439307,10.916056456188262,330,sag,COMPLETE
6486,0.5376678676711432,2023-10-02 12:37:46.055789,2023-10-02 12:37:46.385608,0 days 00:00:00.329819,0.6257926645294913,360,sag,COMPLETE
6487,0.5,2023-10-02 12:37:46.401255,2023-10-02 12:37:46.872233,0 days 00:00:00.470978,0.00014549886247480372,450,sag,COMPLETE
6488,0.6277432034064855,2023-10-02 12:37:46.872233,2023-10-02 12:37:47.232830,0 days 00:00:00.360597,1542.006886036791,380,lbfgs,COMPLETE
6489,0.637951741456491,2023-10-02 12:37:47.232830,2023-10-02 12:37:47.734950,0 days 00:00:00.502120,787.9935639851892,470,sag,COMPLETE
6490,0.5,2023-10-02 12:37:47.734950,2023-10-02 12:37:48.158538,0 days 00:00:00.423588,0.0001064908675501217,340,sag,COMPLETE
6491,0.5,2023-10-02 12:37:48.158538,2023-10-02 12:37:48.723099,0 days 00:00:00.564561,7.35012756106142e-05,440,sag,COMPLETE
6492,0.649579648433235,2023-10-02 12:37:48.723099,2023-10-02 12:37:49.099788,0 days 00:00:00.376689,158.99487763668148,460,sag,COMPLETE
6493,0.6590785020198712,2023-10-02 12:37:49.099788,2023-10-02 12:37:49.555117,0 days 00:00:00.455329,33600.0117128264,350,sag,COMPLETE
6494,0.6541653018888526,2023-10-02 12:37:49.570746,2023-10-02 12:37:49.994725,0 days 00:00:00.423979,32.035908463239174,150,sag,COMPLETE
6495,0.6457036794409869,2023-10-02 12:37:49.994725,2023-10-02 12:37:50.355379,0 days 00:00:00.360654,234.07468621191055,390,sag,COMPLETE
6496,0.6590785020198712,2023-10-02 12:37:50.355379,2023-10-02 12:37:50.857591,0 days 00:00:00.502212,22373.89422283735,450,sag,COMPLETE
6497,0.6597881864832406,2023-10-02 12:37:50.857591,2023-10-02 12:37:51.265563,0 days 00:00:00.407972,46429.626489614195,470,sag,COMPLETE
6498,0.6520362484987444,2023-10-02 12:37:51.265563,2023-10-02 12:37:51.737019,0 days 00:00:00.471456,99848.6062202247,370,sag,COMPLETE
6499,0.5,2023-10-02 12:37:51.737019,2023-10-02 12:37:52.066427,0 days 00:00:00.329408,0.07751422565688666,420,sag,COMPLETE
6500,0.5,2023-10-02 12:37:52.066427,2023-10-02 12:37:52.480081,0 days 00:00:00.413654,0.11102366668151348,340,sag,COMPLETE
6501,0.637951741456491,2023-10-02 12:37:52.482072,2023-10-02 12:37:52.819928,0 days 00:00:00.337856,8590.68546267648,320,newton-cg,COMPLETE
6502,0.6590785020198712,2023-10-02 12:37:52.819928,2023-10-02 12:37:53.305884,0 days 00:00:00.485956,3298.7090589835425,360,sag,COMPLETE
6503,0.6520362484987444,2023-10-02 12:37:53.305884,2023-10-02 12:37:53.713833,0 days 00:00:00.407949,13463.40429037823,470,sag,COMPLETE
