number,value,datetime_start,datetime_complete,duration,params_C,params_max_iter,params_solver,state
5527,0.6590785020198712,2023-10-02 12:31:11.621555,2023-10-02 12:31:12.061412,0 days 00:00:00.439857,67276.19329714023,490,sag,COMPLETE
5528,0.6552025330276231,2023-10-02 12:31:12.061412,2023-10-02 12:31:12.422249,0 days 00:00:00.360837,22083.607287385916,500,sag,COMPLETE
5529,0.6520362484987444,2023-10-02 12:31:12.422249,2023-10-02 12:31:12.876971,0 days 00:00:00.454722,5945.2399242223255,470,sag,COMPLETE
5530,0.5,2023-10-02 12:31:12.876971,2023-10-02 12:31:13.144172,0 days 00:00:00.267201,6.230778080047191e-05,390,newton-cg,COMPLETE
5531,0.6520362484987444,2023-10-02 12:31:13.144172,2023-10-02 12:31:13.488734,0 days 00:00:00.344562,10527.998244658356,480,sag,COMPLETE
5532,0.669996724533246,2023-10-02 12:31:13.488734,2023-10-02 12:31:13.874446,0 days 00:00:00.385712,31877.897408611916,100,sag,COMPLETE
5533,0.6520362484987444,2023-10-02 12:31:13.874446,2023-10-02 12:31:14.272344,0 days 00:00:00.397898,2249.8914470390855,490,sag,COMPLETE
5534,0.6590785020198712,2023-10-02 12:31:14.272344,2023-10-02 12:31:14.720480,0 days 00:00:00.448136,15025.137460054984,490,sag,COMPLETE
5535,0.637951741456491,2023-10-02 12:31:14.720480,2023-10-02 12:31:14.986853,0 days 00:00:00.266373,65510.408054693886,330,liblinear,COMPLETE
5536,0.5,2023-10-02 12:31:14.986853,2023-10-02 12:31:15.737368,0 days 00:00:00.750515,3.4386554812323144e-05,350,sag,COMPLETE
5537,0.637951741456491,2023-10-02 12:31:15.737368,2023-10-02 12:31:16.192591,0 days 00:00:00.455223,783.1603039281836,430,sag,COMPLETE
5538,0.637951741456491,2023-10-02 12:31:16.192591,2023-10-02 12:31:16.650890,0 days 00:00:00.458299,662.7349326063926,450,sag,COMPLETE
5539,0.666120755540998,2023-10-02 12:31:16.650890,2023-10-02 12:31:17.011951,0 days 00:00:00.361061,97910.71994353751,500,sag,COMPLETE
5540,0.6590785020198712,2023-10-02 12:31:17.027578,2023-10-02 12:31:17.463348,0 days 00:00:00.435770,3510.8054148989345,380,sag,COMPLETE
5541,0.6552025330276231,2023-10-02 12:31:17.465348,2023-10-02 12:31:17.808097,0 days 00:00:00.342749,21976.095180598877,470,sag,COMPLETE
5542,0.6449939949776177,2023-10-02 12:31:17.808097,2023-10-02 12:31:18.153119,0 days 00:00:00.345022,39873.19807194436,370,sag,COMPLETE
5543,0.637951741456491,2023-10-02 12:31:18.169144,2023-10-02 12:31:18.561074,0 days 00:00:00.391930,8681.193099568702,460,lbfgs,COMPLETE
5544,0.6457036794409869,2023-10-02 12:31:18.569093,2023-10-02 12:31:18.875260,0 days 00:00:00.306167,179.52758419911532,480,sag,COMPLETE
5545,0.6520362484987444,2023-10-02 12:31:18.875260,2023-10-02 12:31:19.314483,0 days 00:00:00.439223,1628.1866821962037,500,sag,COMPLETE
5546,0.6457036794409869,2023-10-02 12:31:19.330108,2023-10-02 12:31:19.658998,0 days 00:00:00.328890,263.17911752857424,360,sag,COMPLETE
5547,0.6449939949776177,2023-10-02 12:31:19.658998,2023-10-02 12:31:20.122665,0 days 00:00:00.463667,17216.707071995846,490,sag,COMPLETE
5548,0.6629544710121192,2023-10-02 12:31:20.124665,2023-10-02 12:31:20.463240,0 days 00:00:00.338575,5127.049851665704,340,sag,COMPLETE
5549,0.5,2023-10-02 12:31:20.465240,2023-10-02 12:31:20.824328,0 days 00:00:00.359088,0.01007988643271908,300,sag,COMPLETE
5550,0.5,2023-10-02 12:31:20.826328,2023-10-02 12:31:21.175418,0 days 00:00:00.349090,0.0001362007393230476,480,sag,COMPLETE
5551,0.5,2023-10-02 12:31:21.177423,2023-10-02 12:31:21.545021,0 days 00:00:00.367598,0.10225970468975895,470,sag,COMPLETE
5552,0.5,2023-10-02 12:31:21.547013,2023-10-02 12:31:22.193675,0 days 00:00:00.646662,3.5689876574391676e-05,500,sag,COMPLETE
5553,0.6541653018888526,2023-10-02 12:31:22.195679,2023-10-02 12:31:22.485624,0 days 00:00:00.289945,29.639625292285817,490,sag,COMPLETE
5554,0.6203734032099574,2023-10-02 12:31:22.487620,2023-10-02 12:31:22.861217,0 days 00:00:00.373597,8.051317686301969,450,sag,COMPLETE
5555,0.6449939949776177,2023-10-02 12:31:22.863210,2023-10-02 12:31:23.167788,0 days 00:00:00.304578,44108.69229019737,350,newton-cg,COMPLETE
5556,0.6590785020198712,2023-10-02 12:31:23.169781,2023-10-02 12:31:23.613396,0 days 00:00:00.443615,26458.425973552443,420,sag,COMPLETE
5557,0.6590785020198712,2023-10-02 12:31:23.615390,2023-10-02 12:31:23.999495,0 days 00:00:00.384105,8344.091724237673,500,sag,COMPLETE
5558,0.6418277104487389,2023-10-02 12:31:24.001494,2023-10-02 12:31:24.452618,0 days 00:00:00.451124,490.51597419369483,440,sag,COMPLETE
5559,0.637951741456491,2023-10-02 12:31:24.454618,2023-10-02 12:31:24.747193,0 days 00:00:00.292575,66148.23407134783,490,liblinear,COMPLETE
5560,0.6481602795064964,2023-10-02 12:31:24.749192,2023-10-02 12:31:25.197817,0 days 00:00:00.448625,13481.781403938885,460,sag,COMPLETE
5561,0.6534556174254831,2023-10-02 12:31:25.198813,2023-10-02 12:31:25.513027,0 days 00:00:00.314214,86.49249026645542,320,sag,COMPLETE
5562,0.6534556174254831,2023-10-02 12:31:25.515017,2023-10-02 12:31:25.918133,0 days 00:00:00.403116,65.9553712559024,330,sag,COMPLETE
5563,0.6449939949776177,2023-10-02 12:31:25.920133,2023-10-02 12:31:26.287891,0 days 00:00:00.367758,98780.89312997692,480,sag,COMPLETE
5564,0.6590785020198712,2023-10-02 12:31:26.288885,2023-10-02 12:31:26.637474,0 days 00:00:00.348589,30273.583110415824,400,sag,COMPLETE
5565,0.6449939949776177,2023-10-02 12:31:26.639468,2023-10-02 12:31:27.069595,0 days 00:00:00.430127,3927.0816898364983,270,sag,COMPLETE
5566,0.5313352986133857,2023-10-02 12:31:27.070594,2023-10-02 12:31:27.359178,0 days 00:00:00.288584,0.5196102559611017,470,sag,COMPLETE
5567,0.6590785020198712,2023-10-02 12:31:27.360172,2023-10-02 12:31:27.823799,0 days 00:00:00.463627,47433.50900321831,500,sag,COMPLETE
5568,0.6337482257888415,2023-10-02 12:31:27.824799,2023-10-02 12:31:28.136376,0 days 00:00:00.311577,13.705446547658852,360,lbfgs,COMPLETE
5569,0.5,2023-10-02 12:31:28.138383,2023-10-02 12:31:28.501500,0 days 00:00:00.363117,0.21040580125033637,490,sag,COMPLETE
5570,0.6235396877388361,2023-10-02 12:31:28.503497,2023-10-02 12:31:28.788071,0 days 00:00:00.284574,9.035375949573476,310,sag,COMPLETE
5571,0.608417949557812,2023-10-02 12:31:28.790065,2023-10-02 12:31:29.167349,0 days 00:00:00.377284,2.7331497766456936,370,sag,COMPLETE
5572,0.66224478654875,2023-10-02 12:31:29.168356,2023-10-02 12:31:29.550695,0 days 00:00:00.382339,14860.559364723635,480,sag,COMPLETE
5573,0.666120755540998,2023-10-02 12:31:29.551699,2023-10-02 12:31:30.019686,0 days 00:00:00.467987,7709.430430993671,490,sag,COMPLETE
5574,0.6449939949776177,2023-10-02 12:31:30.021681,2023-10-02 12:31:30.394768,0 days 00:00:00.373087,23349.831277341593,470,sag,COMPLETE
5575,0.6520362484987444,2023-10-02 12:31:30.396768,2023-10-02 12:31:30.834885,0 days 00:00:00.438117,65730.8644783428,350,sag,COMPLETE
5576,0.5,2023-10-02 12:31:30.836881,2023-10-02 12:31:31.122440,0 days 00:00:00.285559,0.0039894411990168775,340,sag,COMPLETE
5577,0.6520362484987444,2023-10-02 12:31:31.124440,2023-10-02 12:31:31.507531,0 days 00:00:00.383091,5143.831764908368,500,sag,COMPLETE
5578,0.6449939949776177,2023-10-02 12:31:31.509532,2023-10-02 12:31:31.968670,0 days 00:00:00.459138,2973.2500753244835,480,sag,COMPLETE
5579,0.6552025330276231,2023-10-02 12:31:31.969671,2023-10-02 12:31:32.340765,0 days 00:00:00.371094,98826.64495082144,460,sag,COMPLETE
5580,0.6140408341522,2023-10-02 12:31:32.342760,2023-10-02 12:31:32.713852,0 days 00:00:00.371092,5.001523781446527,380,newton-cg,COMPLETE
5581,0.6520362484987444,2023-10-02 12:31:32.715860,2023-10-02 12:31:33.087950,0 days 00:00:00.372090,1400.2468864682849,450,sag,COMPLETE
5582,0.6449939949776177,2023-10-02 12:31:33.089943,2023-10-02 12:31:33.553047,0 days 00:00:00.463104,10922.59413612447,500,sag,COMPLETE
5583,0.6418277104487389,2023-10-02 12:31:33.554048,2023-10-02 12:31:33.930143,0 days 00:00:00.376095,376.7963592102058,490,sag,COMPLETE
5584,0.637951741456491,2023-10-02 12:31:33.931143,2023-10-02 12:31:34.293239,0 days 00:00:00.362096,42027.126898485876,470,liblinear,COMPLETE
5585,0.6520362484987444,2023-10-02 12:31:34.295239,2023-10-02 12:31:34.664822,0 days 00:00:00.369583,19398.946547723495,480,sag,COMPLETE
5586,0.66224478654875,2023-10-02 12:31:34.667818,2023-10-02 12:31:35.110481,0 days 00:00:00.442663,27213.49452962223,360,sag,COMPLETE
5587,0.5,2023-10-02 12:31:35.112480,2023-10-02 12:31:35.408066,0 days 00:00:00.295586,0.02639332123851476,390,sag,COMPLETE
5588,0.6520362484987444,2023-10-02 12:31:35.410058,2023-10-02 12:31:35.853170,0 days 00:00:00.443112,5992.094390068317,440,sag,COMPLETE
5589,0.6552025330276231,2023-10-02 12:31:35.855173,2023-10-02 12:31:36.226262,0 days 00:00:00.371089,43216.553175030145,500,sag,COMPLETE
5590,0.604541980565564,2023-10-02 12:31:36.227262,2023-10-02 12:31:36.590362,0 days 00:00:00.363100,3.2915548368314007,490,sag,COMPLETE
5591,0.5,2023-10-02 12:31:36.592368,2023-10-02 12:31:36.890940,0 days 00:00:00.298572,0.016427427265404925,350,sag,COMPLETE
5592,0.6559122174909924,2023-10-02 12:31:36.891940,2023-10-02 12:31:37.318093,0 days 00:00:00.426153,11426.64274584004,370,sag,COMPLETE
5593,0.5,2023-10-02 12:31:37.320090,2023-10-02 12:31:37.614660,0 days 00:00:00.294570,0.0014213956518475837,480,sag,COMPLETE
5594,0.5,2023-10-02 12:31:37.615660,2023-10-02 12:31:37.910227,0 days 00:00:00.294567,0.0924229490626514,460,sag,COMPLETE
5595,0.5996287804345454,2023-10-02 12:31:37.911227,2023-10-02 12:31:38.282297,0 days 00:00:00.371070,1.4660792977829018,490,sag,COMPLETE
5596,0.5478764057211486,2023-10-02 12:31:38.284306,2023-10-02 12:31:38.588796,0 days 00:00:00.304490,0.6909932052796296,330,lbfgs,COMPLETE
5597,0.5,2023-10-02 12:31:38.590791,2023-10-02 12:31:38.955794,0 days 00:00:00.365003,0.15098963575220195,340,sag,COMPLETE
5598,0.6449939949776177,2023-10-02 12:31:38.957792,2023-10-02 12:31:39.329809,0 days 00:00:00.372017,68372.67339375053,430,sag,COMPLETE
5599,0.6449939949776177,2023-10-02 12:31:39.331807,2023-10-02 12:31:39.787487,0 days 00:00:00.455680,2076.8033844095976,500,sag,COMPLETE
5600,0.6629544710121192,2023-10-02 12:31:39.789487,2023-10-02 12:31:40.165079,0 days 00:00:00.375592,17015.935473961257,480,sag,COMPLETE
5601,0.6590785020198712,2023-10-02 12:31:40.167079,2023-10-02 12:31:40.622681,0 days 00:00:00.455602,32411.542643360448,450,sag,COMPLETE
5602,0.6590785020198712,2023-10-02 12:31:40.624681,2023-10-02 12:31:40.976286,0 days 00:00:00.351605,7423.716011358455,380,sag,COMPLETE
5603,0.666120755540998,2023-10-02 12:31:40.978287,2023-10-02 12:31:41.438929,0 days 00:00:00.460642,49330.525196076,470,sag,COMPLETE
5604,0.6520362484987444,2023-10-02 12:31:41.440924,2023-10-02 12:31:41.824017,0 days 00:00:00.383093,4123.813451422051,490,sag,COMPLETE
5605,0.528169014084507,2023-10-02 12:31:41.826017,2023-10-02 12:31:42.205126,0 days 00:00:00.379109,0.44749178172859977,500,newton-cg,COMPLETE
5606,0.6629544710121192,2023-10-02 12:31:42.207125,2023-10-02 12:31:42.565744,0 days 00:00:00.358619,17019.933324768717,360,sag,COMPLETE
5607,0.6552025330276231,2023-10-02 12:31:42.567744,2023-10-02 12:31:43.033400,0 days 00:00:00.465656,10209.088932676957,490,sag,COMPLETE
5608,0.637951741456491,2023-10-02 12:31:43.036406,2023-10-02 12:31:43.319991,0 days 00:00:00.283585,31381.899267207213,480,liblinear,COMPLETE
5609,0.666120755540998,2023-10-02 12:31:43.321985,2023-10-02 12:31:43.787617,0 days 00:00:00.465632,99030.5633237293,500,sag,COMPLETE
5610,0.637951741456491,2023-10-02 12:31:43.789616,2023-10-02 12:31:44.181737,0 days 00:00:00.392121,602.7542808110327,460,sag,COMPLETE
5611,0.6520362484987444,2023-10-02 12:31:44.182737,2023-10-02 12:31:44.612851,0 days 00:00:00.430114,3014.934823921539,350,sag,COMPLETE
5612,0.6552025330276231,2023-10-02 12:31:44.614851,2023-10-02 12:31:44.925433,0 days 00:00:00.310582,23332.84021853025,150,sag,COMPLETE
5613,0.6369145103177202,2023-10-02 12:31:44.927432,2023-10-02 12:31:45.309547,0 days 00:00:00.382115,20.019610356512093,470,sag,COMPLETE
5614,0.6590785020198712,2023-10-02 12:31:45.311546,2023-10-02 12:31:45.689674,0 days 00:00:00.378128,65983.90292143701,490,sag,COMPLETE
5615,0.6481602795064964,2023-10-02 12:31:45.691674,2023-10-02 12:31:46.057157,0 days 00:00:00.365483,6221.302593397047,440,sag,COMPLETE
5616,0.5,2023-10-02 12:31:46.060171,2023-10-02 12:31:46.569085,0 days 00:00:00.508914,7.932410607148406e-05,370,sag,COMPLETE
5617,0.6457036794409869,2023-10-02 12:31:46.569085,2023-10-02 12:31:46.898903,0 days 00:00:00.329818,186.52659249354127,320,sag,COMPLETE
5618,0.6298722567965934,2023-10-02 12:31:46.898903,2023-10-02 12:31:47.311218,0 days 00:00:00.412315,18.061542933063993,340,lbfgs,COMPLETE
5619,0.6449939949776177,2023-10-02 12:31:47.311218,2023-10-02 12:31:47.687906,0 days 00:00:00.376688,50196.185677600675,480,sag,COMPLETE
5620,0.6101648651599519,2023-10-02 12:31:47.687906,2023-10-02 12:31:48.048562,0 days 00:00:00.360656,5.285371559683058,500,sag,COMPLETE
5621,0.666120755540998,2023-10-02 12:31:48.048562,2023-10-02 12:31:48.425244,0 days 00:00:00.376682,99297.0507996843,490,sag,COMPLETE
5622,0.5,2023-10-02 12:31:48.425244,2023-10-02 12:31:48.801956,0 days 00:00:00.376712,0.010562853519866442,290,sag,COMPLETE
5623,0.6534556174254831,2023-10-02 12:31:48.801956,2023-10-02 12:31:49.115765,0 days 00:00:00.313809,60.796537635801265,470,sag,COMPLETE
5624,0.649579648433235,2023-10-02 12:31:49.115765,2023-10-02 12:31:49.508107,0 days 00:00:00.392342,138.80158178678496,360,sag,COMPLETE
5625,0.6590785020198712,2023-10-02 12:31:49.508107,2023-10-02 12:31:49.868943,0 days 00:00:00.360836,12207.773636880982,450,sag,COMPLETE
5626,0.5,2023-10-02 12:31:49.868943,2023-10-02 12:31:50.276879,0 days 00:00:00.407936,0.0004333037291611864,500,sag,COMPLETE
5627,0.6481602795064964,2023-10-02 12:31:50.276879,2023-10-02 12:31:50.670761,0 days 00:00:00.393882,31183.180521981627,480,sag,COMPLETE
5628,0.5,2023-10-02 12:31:50.672765,2023-10-02 12:31:51.049183,0 days 00:00:00.376418,0.0019171324463506333,490,sag,COMPLETE
5629,0.6520362484987444,2023-10-02 12:31:51.049183,2023-10-02 12:31:51.410156,0 days 00:00:00.360973,17249.684262859286,410,sag,COMPLETE
5630,0.5,2023-10-02 12:31:51.410156,2023-10-02 12:31:51.815155,0 days 00:00:00.404999,0.03248774250834565,330,newton-cg,COMPLETE
5631,0.6573315864177312,2023-10-02 12:31:51.830787,2023-10-02 12:31:52.128926,0 days 00:00:00.298139,38.23394732676218,460,sag,COMPLETE
5632,0.6449939949776177,2023-10-02 12:31:52.128926,2023-10-02 12:31:52.571976,0 days 00:00:00.443050,1164.5489404751304,350,sag,COMPLETE
5633,0.5,2023-10-02 12:31:52.573971,2023-10-02 12:31:52.869574,0 days 00:00:00.295603,0.06681884907605525,490,sag,COMPLETE
5634,0.5,2023-10-02 12:31:52.871574,2023-10-02 12:31:53.227595,0 days 00:00:00.356021,2.581974927283537e-05,480,liblinear,COMPLETE
5635,0.6520362484987444,2023-10-02 12:31:53.227595,2023-10-02 12:31:53.594205,0 days 00:00:00.366610,6633.236195592634,500,sag,COMPLETE
5636,0.5,2023-10-02 12:31:53.595204,2023-10-02 12:31:53.871386,0 days 00:00:00.276182,0.0048637956680051605,470,sag,COMPLETE
5637,0.666120755540998,2023-10-02 12:31:53.873395,2023-10-02 12:31:54.291033,0 days 00:00:00.417638,48605.767564357266,370,sag,COMPLETE
5638,0.6418277104487389,2023-10-02 12:31:54.292032,2023-10-02 12:31:54.612416,0 days 00:00:00.320384,292.1689859136957,340,sag,COMPLETE
5639,0.6534556174254831,2023-10-02 12:31:54.628037,2023-10-02 12:31:55.020389,0 days 00:00:00.392352,104.01217550059872,380,sag,COMPLETE
5640,0.6520362484987444,2023-10-02 12:31:55.020389,2023-10-02 12:31:55.381051,0 days 00:00:00.360662,10417.413687788992,500,sag,COMPLETE
5641,0.5,2023-10-02 12:31:55.381051,2023-10-02 12:31:55.742132,0 days 00:00:00.361081,0.04315617653229755,450,sag,COMPLETE
5642,0.6590785020198712,2023-10-02 12:31:55.742132,2023-10-02 12:31:56.103218,0 days 00:00:00.361086,2621.866859955678,490,sag,COMPLETE
5643,0.5,2023-10-02 12:31:56.103218,2023-10-02 12:31:56.463922,0 days 00:00:00.360704,0.17302405564545745,470,sag,COMPLETE
5644,0.637951741456491,2023-10-02 12:31:56.463922,2023-10-02 12:31:56.777178,0 days 00:00:00.313256,23143.86819470123,480,lbfgs,COMPLETE
5645,0.6077082650944426,2023-10-02 12:31:56.777178,2023-10-02 12:31:57.122629,0 days 00:00:00.345451,3.497260328180296,500,sag,COMPLETE
5646,0.6590785020198712,2023-10-02 12:31:57.138251,2023-10-02 12:31:57.483285,0 days 00:00:00.345034,4841.547851444007,490,sag,COMPLETE
5647,0.6520362484987444,2023-10-02 12:31:57.483285,2023-10-02 12:31:57.907270,0 days 00:00:00.423985,34765.39550565337,360,sag,COMPLETE
5648,0.6520362484987444,2023-10-02 12:31:57.907270,2023-10-02 12:31:58.267941,0 days 00:00:00.360671,16118.897862556505,460,sag,COMPLETE
5649,0.6520362484987444,2023-10-02 12:31:58.267941,2023-10-02 12:31:58.722704,0 days 00:00:00.454763,66845.6406284629,480,sag,COMPLETE
5650,0.5,2023-10-02 12:31:58.722704,2023-10-02 12:31:59.020851,0 days 00:00:00.298147,0.0006181985436967708,440,sag,COMPLETE
5651,0.6449939949776177,2023-10-02 12:31:59.020851,2023-10-02 12:31:59.460098,0 days 00:00:00.439247,7747.460500508069,480,sag,COMPLETE
5652,0.6502893328966044,2023-10-02 12:31:59.460098,2023-10-02 12:31:59.758263,0 days 00:00:00.298165,36.36688434802518,350,sag,COMPLETE
5653,0.6449939949776177,2023-10-02 12:31:59.758263,2023-10-02 12:32:00.181861,0 days 00:00:00.423598,1920.931456642065,390,sag,COMPLETE
5654,0.5,2023-10-02 12:32:00.181861,2023-10-02 12:32:00.479483,0 days 00:00:00.297622,0.3129832841733194,500,sag,COMPLETE
5655,0.5,2023-10-02 12:32:00.479483,2023-10-02 12:32:00.852080,0 days 00:00:00.372597,0.00011710355298398688,490,newton-cg,COMPLETE
5656,0.6027950649634239,2023-10-02 12:32:00.852080,2023-10-02 12:32:01.134612,0 days 00:00:00.282532,1.5727926906681151,430,sag,COMPLETE
5657,0.6590785020198712,2023-10-02 12:32:01.134612,2023-10-02 12:32:01.509073,0 days 00:00:00.374461,46043.62992373467,460,sag,COMPLETE
5658,0.637951741456491,2023-10-02 12:32:01.509073,2023-10-02 12:32:01.869754,0 days 00:00:00.360681,23985.69307178126,330,liblinear,COMPLETE
5659,0.6590785020198712,2023-10-02 12:32:01.869754,2023-10-02 12:32:02.208034,0 days 00:00:00.338280,10168.002600746107,370,sag,COMPLETE
5660,0.6449939949776177,2023-10-02 12:32:02.209040,2023-10-02 12:32:02.616366,0 days 00:00:00.407326,3771.073498613012,340,sag,COMPLETE
5661,0.6520362484987444,2023-10-02 12:32:02.616366,2023-10-02 12:32:02.973061,0 days 00:00:00.356695,14862.832922089301,470,sag,COMPLETE
5662,0.5,2023-10-02 12:32:02.975059,2023-10-02 12:32:03.346427,0 days 00:00:00.371368,0.00145115182370542,300,sag,COMPLETE
5663,0.6520362484987444,2023-10-02 12:32:03.348427,2023-10-02 12:32:03.709451,0 days 00:00:00.361024,34815.95891198923,450,sag,COMPLETE
5664,0.637951741456491,2023-10-02 12:32:03.711452,2023-10-02 12:32:04.136068,0 days 00:00:00.424616,700.1715685798852,500,sag,COMPLETE
5665,0.6520362484987444,2023-10-02 12:32:04.151698,2023-10-02 12:32:04.512858,0 days 00:00:00.361160,66759.11778840597,490,sag,COMPLETE
5666,0.6203734032099574,2023-10-02 12:32:04.512858,2023-10-02 12:32:04.893739,0 days 00:00:00.380881,7.835170498100574,480,sag,COMPLETE
5667,0.5,2023-10-02 12:32:04.895808,2023-10-02 12:32:05.193957,0 days 00:00:00.298149,0.001096025840738342,360,sag,COMPLETE
5668,0.6590785020198712,2023-10-02 12:32:05.193957,2023-10-02 12:32:05.617975,0 days 00:00:00.424018,5121.974656709977,320,sag,COMPLETE
5669,0.637951741456491,2023-10-02 12:32:05.617975,2023-10-02 12:32:05.946875,0 days 00:00:00.328900,22975.8670718015,490,lbfgs,COMPLETE
5670,0.649579648433235,2023-10-02 12:32:05.946875,2023-10-02 12:32:06.366204,0 days 00:00:00.419329,137.08187365405706,500,sag,COMPLETE
5671,0.6449939949776177,2023-10-02 12:32:06.368203,2023-10-02 12:32:06.765606,0 days 00:00:00.397403,65230.345561548726,350,sag,COMPLETE
5672,0.5,2023-10-02 12:32:06.765606,2023-10-02 12:32:07.144341,0 days 00:00:00.378735,0.002677423428268063,480,sag,COMPLETE
5673,0.6590785020198712,2023-10-02 12:32:07.144341,2023-10-02 12:32:07.529306,0 days 00:00:00.384965,9152.028983563134,460,sag,COMPLETE
5674,0.6520362484987444,2023-10-02 12:32:07.529306,2023-10-02 12:32:07.977894,0 days 00:00:00.448588,37471.442912059625,470,sag,COMPLETE
5675,0.6590785020198712,2023-10-02 12:32:07.993523,2023-10-02 12:32:08.352116,0 days 00:00:00.358593,13348.420293060151,400,sag,COMPLETE
5676,0.6298722567965934,2023-10-02 12:32:08.352116,2023-10-02 12:32:08.751014,0 days 00:00:00.398898,16.608349586856303,490,sag,COMPLETE
5677,0.5,2023-10-02 12:32:08.751014,2023-10-02 12:32:09.163056,0 days 00:00:00.412042,0.00019880253820182887,500,sag,COMPLETE
5678,0.604541980565564,2023-10-02 12:32:09.164172,2023-10-02 12:32:09.504836,0 days 00:00:00.340664,3.2773290113077547,480,sag,COMPLETE
5679,0.6238672344142374,2023-10-02 12:32:09.506838,2023-10-02 12:32:10.008288,0 days 00:00:00.501450,2756.724399332691,370,newton-cg,COMPLETE
5680,0.637951741456491,2023-10-02 12:32:10.009293,2023-10-02 12:32:10.392656,0 days 00:00:00.383363,1526.3534282567243,360,sag,COMPLETE
5681,0.6418277104487389,2023-10-02 12:32:10.392656,2023-10-02 12:32:10.844055,0 days 00:00:00.451399,282.76071696142674,340,sag,COMPLETE
5682,0.5478764057211486,2023-10-02 12:32:10.844055,2023-10-02 12:32:11.199488,0 days 00:00:00.355433,0.7267246298716951,450,sag,COMPLETE
5683,0.5,2023-10-02 12:32:11.199488,2023-10-02 12:32:11.605819,0 days 00:00:00.406331,0.022855318970135347,420,sag,COMPLETE
5684,0.5,2023-10-02 12:32:11.605819,2023-10-02 12:32:11.901638,0 days 00:00:00.295819,0.012888654968160947,490,sag,COMPLETE
5685,0.6590785020198712,2023-10-02 12:32:11.901638,2023-10-02 12:32:12.422145,0 days 00:00:00.520507,23308.27204727652,500,sag,COMPLETE
5686,0.637951741456491,2023-10-02 12:32:12.422145,2023-10-02 12:32:12.699169,0 days 00:00:00.277024,47319.596929184416,470,liblinear,COMPLETE
5687,0.6418277104487389,2023-10-02 12:32:12.699169,2023-10-02 12:32:13.191571,0 days 00:00:00.492402,6876.957768031832,380,sag,COMPLETE
5688,0.6590785020198712,2023-10-02 12:32:13.193568,2023-10-02 12:32:13.527227,0 days 00:00:00.333659,66254.70966872109,350,sag,COMPLETE
