number,value,datetime_start,datetime_complete,duration,params_C,params_max_iter,params_solver,state
8134,0.5,2023-10-02 12:51:13.369181,2023-10-02 12:51:13.762345,0 days 00:00:00.393164,0.31282620208524525,380,sag,COMPLETE
8135,0.6629544710121192,2023-10-02 12:51:13.777982,2023-10-02 12:51:14.343273,0 days 00:00:00.565291,64213.067052242564,450,sag,COMPLETE
8136,0.5,2023-10-02 12:51:14.343273,2023-10-02 12:51:14.830455,0 days 00:00:00.487182,0.001692282626337033,320,sag,COMPLETE
8137,0.6449939949776177,2023-10-02 12:51:14.830455,2023-10-02 12:51:15.333168,0 days 00:00:00.502713,42678.52597816739,500,sag,COMPLETE
8138,0.5376678676711432,2023-10-02 12:51:15.333168,2023-10-02 12:51:15.820031,0 days 00:00:00.486863,0.6031541299953151,470,sag,COMPLETE
8139,0.6534556174254831,2023-10-02 12:51:15.820031,2023-10-02 12:51:16.337839,0 days 00:00:00.517808,53.30413083890085,430,sag,COMPLETE
8140,0.5,2023-10-02 12:51:16.337839,2023-10-02 12:51:16.824692,0 days 00:00:00.486853,1.4631122799670456e-05,460,newton-cg,COMPLETE
8141,0.5,2023-10-02 12:51:16.824692,2023-10-02 12:51:17.259665,0 days 00:00:00.434973,0.05658223680054069,490,sag,COMPLETE
8142,0.6449939949776177,2023-10-02 12:51:17.262661,2023-10-02 12:51:17.769866,0 days 00:00:00.507205,2473.8497368915314,180,sag,COMPLETE
8143,0.666120755540998,2023-10-02 12:51:17.769866,2023-10-02 12:51:18.337911,0 days 00:00:00.568045,5091.953742578158,350,sag,COMPLETE
8144,0.637951741456491,2023-10-02 12:51:18.337911,2023-10-02 12:51:18.730207,0 days 00:00:00.392296,98532.3159611377,360,liblinear,COMPLETE
8145,0.6520362484987444,2023-10-02 12:51:18.730207,2023-10-02 12:51:19.303813,0 days 00:00:00.573606,16678.279855715235,480,sag,COMPLETE
8146,0.666120755540998,2023-10-02 12:51:19.310836,2023-10-02 12:51:19.891087,0 days 00:00:00.580251,9007.547358046924,490,sag,COMPLETE
8147,0.5,2023-10-02 12:51:19.891087,2023-10-02 12:51:20.932741,0 days 00:00:01.041654,2.1852185862708223e-05,440,sag,COMPLETE
8148,0.5,2023-10-02 12:51:20.935733,2023-10-02 12:51:21.337184,0 days 00:00:00.401451,0.08863507169834625,300,sag,COMPLETE
8149,0.5,2023-10-02 12:51:21.337184,2023-10-02 12:51:21.823902,0 days 00:00:00.486718,0.08957657581517547,480,sag,COMPLETE
8150,0.5,2023-10-02 12:51:21.823902,2023-10-02 12:51:22.362677,0 days 00:00:00.538775,0.00026828786815856243,370,sag,COMPLETE
8151,0.6449939949776177,2023-10-02 12:51:22.362677,2023-10-02 12:51:22.849127,0 days 00:00:00.486450,1593.9694995393957,500,sag,COMPLETE
8152,0.5,2023-10-02 12:51:22.849127,2023-10-02 12:51:23.373438,0 days 00:00:00.524311,0.001447430495498767,340,sag,COMPLETE
8153,0.637951741456491,2023-10-02 12:51:23.373438,2023-10-02 12:51:23.922484,0 days 00:00:00.549046,30474.43168332796,470,lbfgs,COMPLETE
8154,0.6534556174254831,2023-10-02 12:51:23.922484,2023-10-02 12:51:24.504372,0 days 00:00:00.581888,88.97899953360469,330,sag,COMPLETE
8155,0.6520362484987444,2023-10-02 12:51:24.507380,2023-10-02 12:51:24.977929,0 days 00:00:00.470549,48633.88112051577,390,sag,COMPLETE
8156,0.66224478654875,2023-10-02 12:51:24.977929,2023-10-02 12:51:25.595011,0 days 00:00:00.617082,22548.293284554933,460,sag,COMPLETE
8157,0.6590785020198712,2023-10-02 12:51:25.610645,2023-10-02 12:51:26.201179,0 days 00:00:00.590534,3427.169332161069,500,sag,COMPLETE
8158,0.666120755540998,2023-10-02 12:51:26.216705,2023-10-02 12:51:26.796940,0 days 00:00:00.580235,99849.92484339244,350,sag,COMPLETE
8159,0.6590785020198712,2023-10-02 12:51:26.796940,2023-10-02 12:51:27.299050,0 days 00:00:00.502110,14740.17576700796,450,sag,COMPLETE
8160,0.5,2023-10-02 12:51:27.299050,2023-10-02 12:51:27.833311,0 days 00:00:00.534261,0.00024021739602449166,490,sag,COMPLETE
8161,0.6418277104487389,2023-10-02 12:51:27.833311,2023-10-02 12:51:28.397740,0 days 00:00:00.564429,508.6946817018772,370,sag,COMPLETE
8162,0.6520362484987444,2023-10-02 12:51:28.413366,2023-10-02 12:51:28.922509,0 days 00:00:00.509143,68001.95837385123,470,sag,COMPLETE
8163,0.5,2023-10-02 12:51:28.922509,2023-10-02 12:51:29.523818,0 days 00:00:00.601309,0.00010139151858745837,440,sag,COMPLETE
8164,0.666120755540998,2023-10-02 12:51:29.527330,2023-10-02 12:51:30.128252,0 days 00:00:00.600922,7159.956922060972,480,sag,COMPLETE
8165,0.6520362484987444,2023-10-02 12:51:30.131354,2023-10-02 12:51:30.709780,0 days 00:00:00.578426,26245.14511476284,380,sag,COMPLETE
8166,0.6013756960366853,2023-10-02 12:51:30.711850,2023-10-02 12:51:31.114938,0 days 00:00:00.403088,2.51193474926466,420,newton-cg,COMPLETE
8167,0.6457036794409869,2023-10-02 12:51:31.117938,2023-10-02 12:51:31.666280,0 days 00:00:00.548342,212.75572038440438,490,sag,COMPLETE
8168,0.5,2023-10-02 12:51:31.668280,2023-10-02 12:51:32.197146,0 days 00:00:00.528866,0.1831244341820893,360,liblinear,COMPLETE
8169,0.637951741456491,2023-10-02 12:51:32.200145,2023-10-02 12:51:32.707622,0 days 00:00:00.507477,1116.8234132877765,500,sag,COMPLETE
8170,0.6590785020198712,2023-10-02 12:51:32.710612,2023-10-02 12:51:33.293114,0 days 00:00:00.582502,11536.871745587981,480,sag,COMPLETE
8171,0.6590785020198712,2023-10-02 12:51:33.295169,2023-10-02 12:51:33.881085,0 days 00:00:00.585916,44230.51741704721,460,sag,COMPLETE
8172,0.6267059722677149,2023-10-02 12:51:33.883086,2023-10-02 12:51:34.372837,0 days 00:00:00.489751,10.09731535228983,350,sag,COMPLETE
8173,0.5,2023-10-02 12:51:34.375837,2023-10-02 12:51:34.800456,0 days 00:00:00.424619,0.0028323436576635857,490,sag,COMPLETE
8174,0.666120755540998,2023-10-02 12:51:34.803462,2023-10-02 12:51:35.396146,0 days 00:00:00.592684,4933.118708728497,500,sag,COMPLETE
8175,0.6590785020198712,2023-10-02 12:51:35.399143,2023-10-02 12:51:35.965489,0 days 00:00:00.566346,19585.49571522847,340,sag,COMPLETE
8176,0.6534556174254831,2023-10-02 12:51:35.968483,2023-10-02 12:51:36.563555,0 days 00:00:00.595072,49.29363109501731,360,sag,COMPLETE
8177,0.6267059722677149,2023-10-02 12:51:36.565550,2023-10-02 12:51:37.384142,0 days 00:00:00.818592,10.266662298624347,450,sag,COMPLETE
8178,0.6559122174909924,2023-10-02 12:51:37.384142,2023-10-02 12:51:38.042957,0 days 00:00:00.658815,65851.51113605613,400,sag,COMPLETE
8179,0.6238672344142374,2023-10-02 12:51:38.045951,2023-10-02 12:51:38.661462,0 days 00:00:00.615511,2876.612675000455,480,lbfgs,COMPLETE
8180,0.6471230483677258,2023-10-02 12:51:38.664472,2023-10-02 12:51:39.085442,0 days 00:00:00.420970,27.831984162891494,490,sag,COMPLETE
8181,0.5690031662845288,2023-10-02 12:51:39.087433,2023-10-02 12:51:39.595063,0 days 00:00:00.507630,1.0456537108733333,430,sag,COMPLETE
8182,0.5,2023-10-02 12:51:39.598068,2023-10-02 12:51:40.739179,0 days 00:00:01.141111,1.874141719969103e-05,470,sag,COMPLETE
8183,0.5,2023-10-02 12:51:40.742178,2023-10-02 12:51:41.276769,0 days 00:00:00.534591,0.0007625785535521524,380,sag,COMPLETE
8184,0.6411180259853696,2023-10-02 12:51:41.279775,2023-10-02 12:51:41.782759,0 days 00:00:00.502984,99606.7460351806,490,sag,COMPLETE
8185,0.5,2023-10-02 12:51:41.784753,2023-10-02 12:51:42.305106,0 days 00:00:00.520353,0.010709720805537178,370,sag,COMPLETE
8186,0.6590785020198712,2023-10-02 12:51:42.307104,2023-10-02 12:51:42.900208,0 days 00:00:00.593104,35740.922042558006,460,sag,COMPLETE
8187,0.5,2023-10-02 12:51:42.902209,2023-10-02 12:51:43.398487,0 days 00:00:00.496278,0.23353026861771145,320,sag,COMPLETE
8188,0.6590785020198712,2023-10-02 12:51:43.400476,2023-10-02 12:51:43.919839,0 days 00:00:00.519363,9119.033733784063,500,sag,COMPLETE
8189,0.6457036794409869,2023-10-02 12:51:43.922861,2023-10-02 12:51:44.525457,0 days 00:00:00.602596,177.84017104097194,440,sag,COMPLETE
8190,0.637951741456491,2023-10-02 12:51:44.527452,2023-10-02 12:51:45.060805,0 days 00:00:00.533353,14699.04366223935,340,newton-cg,COMPLETE
8191,0.6590785020198712,2023-10-02 12:51:45.062804,2023-10-02 12:51:45.546922,0 days 00:00:00.484118,46582.933958791604,480,sag,COMPLETE
8192,0.6418277104487389,2023-10-02 12:51:45.548917,2023-10-02 12:51:46.109898,0 days 00:00:00.560981,443.3516916376897,310,sag,COMPLETE
8193,0.666120755540998,2023-10-02 12:51:46.111902,2023-10-02 12:51:46.686624,0 days 00:00:00.574722,6544.6411953473225,330,sag,COMPLETE
8194,0.6238672344142374,2023-10-02 12:51:46.688624,2023-10-02 12:51:47.187323,0 days 00:00:00.498699,2115.3821391010883,360,liblinear,COMPLETE
8195,0.6590785020198712,2023-10-02 12:51:47.190324,2023-10-02 12:51:47.676319,0 days 00:00:00.485995,26392.88316455439,470,sag,COMPLETE
8196,0.586253957855661,2023-10-02 12:51:47.679405,2023-10-02 12:51:48.172946,0 days 00:00:00.493541,1.1528474330237577,500,sag,COMPLETE
8197,0.637951741456491,2023-10-02 12:51:48.175943,2023-10-02 12:51:48.768072,0 days 00:00:00.592129,4056.175886851388,350,sag,COMPLETE
8198,0.5,2023-10-02 12:51:48.771076,2023-10-02 12:51:49.416781,0 days 00:00:00.645705,4.688202190140434e-05,450,sag,COMPLETE
8199,0.6520362484987444,2023-10-02 12:51:49.419777,2023-10-02 12:51:50.023402,0 days 00:00:00.603625,49886.72086629508,490,sag,COMPLETE
8200,0.6520362484987444,2023-10-02 12:51:50.026409,2023-10-02 12:51:50.669482,0 days 00:00:00.643073,10762.242812901297,490,sag,COMPLETE
8201,0.6590785020198712,2023-10-02 12:51:50.671532,2023-10-02 12:51:51.266908,0 days 00:00:00.595376,21322.23857915917,480,sag,COMPLETE
8202,0.6552025330276231,2023-10-02 12:51:51.269996,2023-10-02 12:51:51.747894,0 days 00:00:00.477898,31153.82466685463,370,sag,COMPLETE
8203,0.6590785020198712,2023-10-02 12:51:51.750887,2023-10-02 12:51:52.338819,0 days 00:00:00.587932,69959.29460656672,460,sag,COMPLETE
8204,0.637951741456491,2023-10-02 12:51:52.341374,2023-10-02 12:51:52.906258,0 days 00:00:00.564884,5722.331717633473,500,lbfgs,COMPLETE
8205,0.6520362484987444,2023-10-02 12:51:52.909369,2023-10-02 12:51:53.493097,0 days 00:00:00.583728,15571.50483348148,470,sag,COMPLETE
8206,0.5943334425155585,2023-10-02 12:51:53.496210,2023-10-02 12:51:53.896348,0 days 00:00:00.400138,2.0502740586851096,430,sag,COMPLETE
8207,0.6590785020198712,2023-10-02 12:51:53.898343,2023-10-02 12:51:54.460509,0 days 00:00:00.562166,99191.71529555657,360,sag,COMPLETE
8208,0.643956763838847,2023-10-02 12:51:54.463506,2023-10-02 12:51:54.979160,0 days 00:00:00.515654,23.837457203810228,440,sag,COMPLETE
8209,0.5376678676711432,2023-10-02 12:51:54.981157,2023-10-02 12:51:55.382371,0 days 00:00:00.401214,0.6246604651062844,340,sag,COMPLETE
8210,0.6520362484987444,2023-10-02 12:51:55.385367,2023-10-02 12:51:55.954126,0 days 00:00:00.568759,43161.14914335547,380,sag,COMPLETE
8211,0.637951741456491,2023-10-02 12:51:55.956121,2023-10-02 12:51:56.546624,0 days 00:00:00.590503,969.5597216571556,490,sag,COMPLETE
8212,0.6520362484987444,2023-10-02 12:51:56.549686,2023-10-02 12:51:57.127032,0 days 00:00:00.577346,1361.9225595646556,480,sag,COMPLETE
8213,0.6559122174909924,2023-10-02 12:51:57.130067,2023-10-02 12:51:57.580101,0 days 00:00:00.450034,656.4239296619601,270,sag,COMPLETE
8214,0.5,2023-10-02 12:51:57.582098,2023-10-02 12:51:58.096232,0 days 00:00:00.514134,0.008118327217898793,450,newton-cg,COMPLETE
8215,0.6449939949776177,2023-10-02 12:51:58.098227,2023-10-02 12:51:58.655337,0 days 00:00:00.557110,9408.804062585892,350,sag,COMPLETE
8216,0.6449939949776177,2023-10-02 12:51:58.657334,2023-10-02 12:51:59.223254,0 days 00:00:00.565920,2928.2714174840708,390,sag,COMPLETE
8217,0.6520362484987444,2023-10-02 12:51:59.226348,2023-10-02 12:51:59.719600,0 days 00:00:00.493252,65595.04290288355,500,sag,COMPLETE
8218,0.5,2023-10-02 12:51:59.721600,2023-10-02 12:52:00.241503,0 days 00:00:00.519903,0.03426575268345464,410,liblinear,COMPLETE
8219,0.666120755540998,2023-10-02 12:52:00.243504,2023-10-02 12:52:00.835267,0 days 00:00:00.591763,26298.76135818943,480,sag,COMPLETE
8220,0.5,2023-10-02 12:52:00.838280,2023-10-02 12:52:01.243496,0 days 00:00:00.405216,0.015146592599406074,470,sag,COMPLETE
8221,0.6101648651599519,2023-10-02 12:52:01.246496,2023-10-02 12:52:01.746700,0 days 00:00:00.500204,5.181313240941282,370,sag,COMPLETE
8222,0.6449939949776177,2023-10-02 12:52:01.748697,2023-10-02 12:52:02.329361,0 days 00:00:00.580664,14240.48368915801,490,sag,COMPLETE
8223,0.5,2023-10-02 12:52:02.331357,2023-10-02 12:52:03.286622,0 days 00:00:00.955265,2.6655536435721247e-05,460,sag,COMPLETE
8224,0.6520362484987444,2023-10-02 12:52:03.289617,2023-10-02 12:52:03.784992,0 days 00:00:00.495375,39515.63915635003,500,sag,COMPLETE
8225,0.6449939949776177,2023-10-02 12:52:03.787983,2023-10-02 12:52:04.363470,0 days 00:00:00.575487,5304.368779635287,350,sag,COMPLETE
8226,0.6590785020198712,2023-10-02 12:52:04.366559,2023-10-02 12:52:04.933646,0 days 00:00:00.567087,20199.775239898136,360,sag,COMPLETE
8227,0.5,2023-10-02 12:52:04.935652,2023-10-02 12:52:05.383959,0 days 00:00:00.448307,0.0006251298441458296,330,sag,COMPLETE
8228,0.6267059722677149,2023-10-02 12:52:05.385959,2023-10-02 12:52:05.907055,0 days 00:00:00.521096,12.03306765593451,500,lbfgs,COMPLETE
8229,0.6534556174254831,2023-10-02 12:52:05.910056,2023-10-02 12:52:06.447315,0 days 00:00:00.537259,97.994781405713,480,sag,COMPLETE
8230,0.6590785020198712,2023-10-02 12:52:06.449311,2023-10-02 12:52:07.025746,0 days 00:00:00.576435,67000.51452312632,490,sag,COMPLETE
8231,0.5,2023-10-02 12:52:07.028743,2023-10-02 12:52:07.602851,0 days 00:00:00.574108,7.150898120866211e-05,470,sag,COMPLETE
8232,0.5,2023-10-02 12:52:07.604845,2023-10-02 12:52:08.107143,0 days 00:00:00.502298,0.03362937325624483,450,sag,COMPLETE
8233,0.5,2023-10-02 12:52:08.110136,2023-10-02 12:52:08.620075,0 days 00:00:00.509939,0.004141836951424716,340,sag,COMPLETE
8234,0.5,2023-10-02 12:52:08.624074,2023-10-02 12:52:09.224896,0 days 00:00:00.600822,0.000125700715871661,440,sag,COMPLETE
8235,0.6520362484987444,2023-10-02 12:52:09.226999,2023-10-02 12:52:09.724890,0 days 00:00:00.497891,1857.8713435215739,460,sag,COMPLETE
8236,0.6534556174254831,2023-10-02 12:52:09.726889,2023-10-02 12:52:10.250900,0 days 00:00:00.524011,65.2479914494782,380,sag,COMPLETE
8237,0.5,2023-10-02 12:52:10.252900,2023-10-02 12:52:10.776255,0 days 00:00:00.523355,0.0004248414733970702,370,sag,COMPLETE
8238,0.637951741456491,2023-10-02 12:52:10.779252,2023-10-02 12:52:11.238633,0 days 00:00:00.459381,7958.10279184227,320,sag,COMPLETE
8239,0.637951741456491,2023-10-02 12:52:11.240634,2023-10-02 12:52:11.768190,0 days 00:00:00.527556,32877.55099507624,490,newton-cg,COMPLETE
8240,0.5,2023-10-02 12:52:11.770190,2023-10-02 12:52:12.280833,0 days 00:00:00.510643,0.0023445279781566775,480,sag,COMPLETE
8241,0.6520362484987444,2023-10-02 12:52:12.283818,2023-10-02 12:52:12.838523,0 days 00:00:00.554705,3141.010304861774,300,sag,COMPLETE
8242,0.5,2023-10-02 12:52:12.840515,2023-10-02 12:52:13.299293,0 days 00:00:00.458778,0.00018434131678883052,500,sag,COMPLETE
8243,0.637951741456491,2023-10-02 12:52:13.302278,2023-10-02 12:52:13.809019,0 days 00:00:00.506741,45192.11253853135,490,liblinear,COMPLETE
8244,0.6590785020198712,2023-10-02 12:52:13.811008,2023-10-02 12:52:14.436343,0 days 00:00:00.625335,11205.897591515808,470,sag,COMPLETE
8245,0.6069985806310733,2023-10-02 12:52:14.438343,2023-10-02 12:52:14.945163,0 days 00:00:00.506820,4.954088274036673,420,sag,COMPLETE
8246,0.669996724533246,2023-10-02 12:52:14.947166,2023-10-02 12:52:15.411346,0 days 00:00:00.464180,18841.68716091005,350,sag,COMPLETE
8247,0.6520362484987444,2023-10-02 12:52:15.413343,2023-10-02 12:52:15.980579,0 days 00:00:00.567236,4248.227850948943,360,sag,COMPLETE
8248,0.669996724533246,2023-10-02 12:52:15.983585,2023-10-02 12:52:16.580044,0 days 00:00:00.596459,70437.11749068482,480,sag,COMPLETE
8249,0.6235396877388361,2023-10-02 12:52:16.583040,2023-10-02 12:52:17.015189,0 days 00:00:00.432149,8.56237566846325,500,sag,COMPLETE
8250,0.6488699639698657,2023-10-02 12:52:17.017178,2023-10-02 12:52:17.607373,0 days 00:00:00.590195,98986.88797962328,460,sag,COMPLETE
8251,0.6590785020198712,2023-10-02 12:52:17.610363,2023-10-02 12:52:18.199534,0 days 00:00:00.589171,24284.06779170653,400,sag,COMPLETE
8252,0.637951741456491,2023-10-02 12:52:18.202525,2023-10-02 12:52:18.760233,0 days 00:00:00.557708,7652.626449912279,430,lbfgs,COMPLETE
8253,0.6590785020198712,2023-10-02 12:52:18.763229,2023-10-02 12:52:19.258944,0 days 00:00:00.495715,36530.98048903701,450,sag,COMPLETE
8254,0.6590785020198712,2023-10-02 12:52:19.261939,2023-10-02 12:52:19.855233,0 days 00:00:00.593294,15301.733304983583,490,sag,COMPLETE
8255,0.6520362484987444,2023-10-02 12:52:19.857230,2023-10-02 12:52:20.436906,0 days 00:00:00.579676,48685.91326683532,370,sag,COMPLETE
8256,0.6520362484987444,2023-10-02 12:52:20.439901,2023-10-02 12:52:21.028295,0 days 00:00:00.588394,5885.0921706041445,480,sag,COMPLETE
8257,0.5,2023-10-02 12:52:21.031290,2023-10-02 12:52:21.446430,0 days 00:00:00.415140,0.07353522253379265,340,sag,COMPLETE
8258,0.6520362484987444,2023-10-02 12:52:21.448432,2023-10-02 12:52:22.016901,0 days 00:00:00.568469,1594.8417058251018,390,sag,COMPLETE
8259,0.6541653018888526,2023-10-02 12:52:22.019892,2023-10-02 12:52:22.541571,0 days 00:00:00.521679,31.279014516045727,330,sag,COMPLETE
8260,0.6449939949776177,2023-10-02 12:52:22.543571,2023-10-02 12:52:23.016329,0 days 00:00:00.472758,10781.461475414317,360,sag,COMPLETE
8261,0.6481602795064964,2023-10-02 12:52:23.019330,2023-10-02 12:52:23.613784,0 days 00:00:00.594454,64853.51314461997,470,sag,COMPLETE
8262,0.6418277104487389,2023-10-02 12:52:23.615781,2023-10-02 12:52:24.219975,0 days 00:00:00.604194,513.5017554847118,500,sag,COMPLETE
8263,0.6520362484987444,2023-10-02 12:52:24.221964,2023-10-02 12:52:24.810190,0 days 00:00:00.588226,21550.95658175886,490,sag,COMPLETE
8264,0.5,2023-10-02 12:52:24.813186,2023-10-02 12:52:25.238300,0 days 00:00:00.425114,0.1495565383983817,440,sag,COMPLETE
8265,0.637951741456491,2023-10-02 12:52:25.240295,2023-10-02 12:52:25.785487,0 days 00:00:00.545192,30101.148707355478,470,newton-cg,COMPLETE
8266,0.6590785020198712,2023-10-02 12:52:25.788479,2023-10-02 12:52:26.360736,0 days 00:00:00.572257,4310.265069637864,380,sag,COMPLETE
8267,0.666120755540998,2023-10-02 12:52:26.363736,2023-10-02 12:52:26.840362,0 days 00:00:00.476626,45021.5556902196,350,sag,COMPLETE
8268,0.6238672344142374,2023-10-02 12:52:26.843363,2023-10-02 12:52:27.347110,0 days 00:00:00.503747,2087.741995164926,490,liblinear,COMPLETE
8269,0.649579648433235,2023-10-02 12:52:27.349109,2023-10-02 12:52:27.904886,0 days 00:00:00.555777,150.90761530590754,480,sag,COMPLETE
8270,0.6520362484987444,2023-10-02 12:52:27.907873,2023-10-02 12:52:28.482109,0 days 00:00:00.574236,99242.2465460467,370,sag,COMPLETE
8271,0.6337482257888415,2023-10-02 12:52:28.484105,2023-10-02 12:52:28.904503,0 days 00:00:00.420398,14.535841083953821,460,sag,COMPLETE
8272,0.6559122174909924,2023-10-02 12:52:28.906492,2023-10-02 12:52:29.471175,0 days 00:00:00.564683,13385.117228916366,230,sag,COMPLETE
8273,0.5,2023-10-02 12:52:29.473684,2023-10-02 12:52:30.017381,0 days 00:00:00.543697,0.0011075678739360434,500,sag,COMPLETE
8274,0.5,2023-10-02 12:52:30.020385,2023-10-02 12:52:30.548055,0 days 00:00:00.527670,0.018881166801186292,500,sag,COMPLETE
8275,0.666120755540998,2023-10-02 12:52:30.551049,2023-10-02 12:52:31.050585,0 days 00:00:00.499536,7674.170191204066,450,sag,COMPLETE
8276,0.6418277104487389,2023-10-02 12:52:31.053578,2023-10-02 12:52:31.626790,0 days 00:00:00.573212,298.0996995578808,480,sag,COMPLETE
8277,0.6386614259198603,2023-10-02 12:52:31.628791,2023-10-02 12:52:32.158501,0 days 00:00:00.529710,334.48322088441677,350,lbfgs,COMPLETE
8278,0.6590785020198712,2023-10-02 12:52:32.161507,2023-10-02 12:52:32.664164,0 days 00:00:00.502657,27832.87726639266,490,sag,COMPLETE
8279,0.5,2023-10-02 12:52:32.667161,2023-10-02 12:52:33.183373,0 days 00:00:00.516212,0.24128331317660653,360,sag,COMPLETE
8280,0.6552025330276231,2023-10-02 12:52:33.186373,2023-10-02 12:52:33.738502,0 days 00:00:00.552129,66673.65619272897,340,sag,COMPLETE
8281,0.6013756960366853,2023-10-02 12:52:33.741498,2023-10-02 12:52:34.245445,0 days 00:00:00.503947,2.2067869353575533,410,sag,COMPLETE
8282,0.6590785020198712,2023-10-02 12:52:34.248445,2023-10-02 12:52:34.710403,0 days 00:00:00.461958,3367.5435230999583,290,sag,COMPLETE
8283,0.6411180259853696,2023-10-02 12:52:34.713483,2023-10-02 12:52:35.282700,0 days 00:00:00.569217,99903.26051489844,380,sag,COMPLETE
8284,0.6573315864177312,2023-10-02 12:52:35.285701,2023-10-02 12:52:35.816617,0 days 00:00:00.530916,40.11848682432673,460,sag,COMPLETE
8285,0.5,2023-10-02 12:52:35.819617,2023-10-02 12:52:36.346442,0 days 00:00:00.526825,0.0002969803130313743,470,sag,COMPLETE
8286,0.6077082650944426,2023-10-02 12:52:36.348433,2023-10-02 12:52:36.768259,0 days 00:00:00.419826,3.6964666512156072,330,sag,COMPLETE
8287,0.5996287804345454,2023-10-02 12:52:36.771249,2023-10-02 12:52:37.269393,0 days 00:00:00.498144,1.4587343409172753,500,sag,COMPLETE
8288,0.5619609127634021,2023-10-02 12:52:37.271389,2023-10-02 12:52:37.769992,0 days 00:00:00.498603,0.8384457766048211,490,sag,COMPLETE
8289,0.637951741456491,2023-10-02 12:52:37.771980,2023-10-02 12:52:38.201552,0 days 00:00:00.429572,19299.660816303873,440,newton-cg,COMPLETE
8290,0.5,2023-10-02 12:52:38.203545,2023-10-02 12:52:38.714420,0 days 00:00:00.510875,0.3087889084910787,480,sag,COMPLETE
8291,0.6590785020198712,2023-10-02 12:52:38.717420,2023-10-02 12:52:39.330046,0 days 00:00:00.612626,50105.740499299085,370,sag,COMPLETE
8292,0.669996724533246,2023-10-02 12:52:39.333141,2023-10-02 12:52:39.907609,0 days 00:00:00.574468,11497.216090802109,450,sag,COMPLETE
8293,0.6534556174254831,2023-10-02 12:52:39.909609,2023-10-02 12:52:40.323964,0 days 00:00:00.414355,71.24297988900224,430,liblinear,COMPLETE
8294,0.6590785020198712,2023-10-02 12:52:40.325963,2023-10-02 12:52:40.892196,0 days 00:00:00.566233,6650.432815728308,360,sag,COMPLETE
8295,0.5,2023-10-02 12:52:40.894196,2023-10-02 12:52:41.406918,0 days 00:00:00.512722,0.032704928597228865,490,sag,COMPLETE
8296,0.5313352986133857,2023-10-02 12:52:41.409914,2023-10-02 12:52:41.820660,0 days 00:00:00.410746,0.5262355424558367,390,sag,COMPLETE
