number,value,datetime_start,datetime_complete,duration,params_C,params_max_iter,params_solver,state
3571,0.6372420569931216,2023-10-02 12:20:28.710688,2023-10-02 12:20:28.943042,0 days 00:00:00.232354,99603.21125541611,330,saga,COMPLETE
3572,0.6590785020198712,2023-10-02 12:20:28.943042,2023-10-02 12:20:29.174844,0 days 00:00:00.231802,99884.38351602356,350,sag,COMPLETE
3573,0.6449939949776177,2023-10-02 12:20:29.175844,2023-10-02 12:20:29.433585,0 days 00:00:00.257741,43596.740701748604,370,sag,COMPLETE
3574,0.6590785020198712,2023-10-02 12:20:29.433585,2023-10-02 12:20:29.779182,0 days 00:00:00.345597,22281.341839612858,350,sag,COMPLETE
3575,0.5,2023-10-02 12:20:29.781181,2023-10-02 12:20:29.956497,0 days 00:00:00.175316,0.29430012554901386,340,sag,COMPLETE
3576,0.6020853805000546,2023-10-02 12:20:29.956497,2023-10-02 12:20:30.128964,0 days 00:00:00.172467,1.6412921015724944,360,saga,COMPLETE
3577,0.637951741456491,2023-10-02 12:20:30.128964,2023-10-02 12:20:30.500263,0 days 00:00:00.371299,23265.878527478882,330,sag,COMPLETE
3578,0.6520362484987444,2023-10-02 12:20:30.501263,2023-10-02 12:20:30.729632,0 days 00:00:00.228369,38733.483293795754,330,sag,COMPLETE
3579,0.5,2023-10-02 12:20:30.745253,2023-10-02 12:20:31.009139,0 days 00:00:00.263886,0.004398355213830497,370,sag,COMPLETE
3580,0.6449939949776177,2023-10-02 12:20:31.011136,2023-10-02 12:20:31.211996,0 days 00:00:00.200860,67440.06773271643,340,newton-cg,COMPLETE
3581,0.6449939949776177,2023-10-02 12:20:31.211996,2023-10-02 12:20:31.523993,0 days 00:00:00.311997,20416.011831260046,300,sag,COMPLETE
3582,0.6590785020198712,2023-10-02 12:20:31.524991,2023-10-02 12:20:31.776713,0 days 00:00:00.251722,54020.65543929091,380,saga,COMPLETE
3583,0.5,2023-10-02 12:20:31.777713,2023-10-02 12:20:31.949560,0 days 00:00:00.171847,0.06284009063944505,370,sag,COMPLETE
3584,0.6069985806310733,2023-10-02 12:20:31.950882,2023-10-02 12:20:32.117432,0 days 00:00:00.166550,4.7705404754307565,310,liblinear,COMPLETE
3585,0.604541980565564,2023-10-02 12:20:32.117432,2023-10-02 12:20:32.384747,0 days 00:00:00.267315,3.2504900627747735,360,sag,COMPLETE
3586,0.5,2023-10-02 12:20:32.384747,2023-10-02 12:20:32.597652,0 days 00:00:00.212905,0.0002455319910662082,310,sag,COMPLETE
3587,0.6520362484987444,2023-10-02 12:20:32.599721,2023-10-02 12:20:32.864565,0 days 00:00:00.264844,30183.631953010026,390,sag,COMPLETE
3588,0.6449939949776177,2023-10-02 12:20:32.865566,2023-10-02 12:20:33.183452,0 days 00:00:00.317886,19171.676728256436,290,saga,COMPLETE
3589,0.5,2023-10-02 12:20:33.183452,2023-10-02 12:20:33.366688,0 days 00:00:00.183236,0.002553325797383007,340,sag,COMPLETE
3590,0.5,2023-10-02 12:20:33.367704,2023-10-02 12:20:33.596442,0 days 00:00:00.228738,0.0015522362690993704,360,sag,COMPLETE
3591,0.6449939949776177,2023-10-02 12:20:33.596442,2023-10-02 12:20:33.832416,0 days 00:00:00.235974,61699.547828892166,380,sag,COMPLETE
3592,0.6590785020198712,2023-10-02 12:20:33.832416,2023-10-02 12:20:34.208178,0 days 00:00:00.375762,41341.97039074492,320,sag,COMPLETE
3593,0.666120755540998,2023-10-02 12:20:34.210177,2023-10-02 12:20:34.450799,0 days 00:00:00.240622,29956.139463114334,370,sag,COMPLETE
3594,0.6552025330276231,2023-10-02 12:20:34.452058,2023-10-02 12:20:34.720534,0 days 00:00:00.268476,18799.56054295497,280,saga,COMPLETE
3595,0.6590785020198712,2023-10-02 12:20:34.721536,2023-10-02 12:20:35.039780,0 days 00:00:00.318244,99849.89912378853,320,sag,COMPLETE
3596,0.6418277104487389,2023-10-02 12:20:35.039780,2023-10-02 12:20:35.366448,0 days 00:00:00.326668,292.4848817942856,300,sag,COMPLETE
3597,0.637951741456491,2023-10-02 12:20:35.366448,2023-10-02 12:20:35.585184,0 days 00:00:00.218736,52650.63320669789,320,lbfgs,COMPLETE
3598,0.666120755540998,2023-10-02 12:20:35.586197,2023-10-02 12:20:35.832933,0 days 00:00:00.246736,29063.54586037948,340,sag,COMPLETE
3599,0.6590785020198712,2023-10-02 12:20:35.832933,2023-10-02 12:20:36.164882,0 days 00:00:00.331949,17055.40137378911,360,sag,COMPLETE
3600,0.6481602795064964,2023-10-02 12:20:36.165881,2023-10-02 12:20:36.414250,0 days 00:00:00.248369,65082.235462816025,330,saga,COMPLETE
3601,0.6629544710121192,2023-10-02 12:20:36.415249,2023-10-02 12:20:36.666991,0 days 00:00:00.251742,99798.25909566617,330,sag,COMPLETE
3602,0.6520362484987444,2023-10-02 12:20:36.666991,2023-10-02 12:20:36.936706,0 days 00:00:00.269715,45810.6635751961,350,sag,COMPLETE
3603,0.6520362484987444,2023-10-02 12:20:36.938703,2023-10-02 12:20:37.261105,0 days 00:00:00.322402,24617.505480063577,340,sag,COMPLETE
3604,0.6013756960366853,2023-10-02 12:20:37.261105,2023-10-02 12:20:37.430823,0 days 00:00:00.169718,2.2925391573334157,360,sag,COMPLETE
3605,0.6369145103177202,2023-10-02 12:20:37.430823,2023-10-02 12:20:37.700979,0 days 00:00:00.270156,20.83861994816708,380,saga,COMPLETE
3606,0.6534556174254831,2023-10-02 12:20:37.700979,2023-10-02 12:20:37.937698,0 days 00:00:00.236719,52.76371049401011,380,sag,COMPLETE
3607,0.6386614259198603,2023-10-02 12:20:37.938689,2023-10-02 12:20:38.287855,0 days 00:00:00.349166,399.8108079602665,360,newton-cg,COMPLETE
3608,0.6534556174254831,2023-10-02 12:20:38.288856,2023-10-02 12:20:38.601122,0 days 00:00:00.312266,96.8478907723127,350,sag,COMPLETE
3609,0.6534556174254831,2023-10-02 12:20:38.602131,2023-10-02 12:20:38.873463,0 days 00:00:00.271332,159.2062618597883,350,liblinear,COMPLETE
3610,0.6235396877388361,2023-10-02 12:20:38.873463,2023-10-02 12:20:39.228337,0 days 00:00:00.354874,8.890888734685937,440,sag,COMPLETE
3611,0.6520362484987444,2023-10-02 12:20:39.229346,2023-10-02 12:20:39.546454,0 days 00:00:00.317108,36277.56251880592,310,sag,COMPLETE
3612,0.5,2023-10-02 12:20:39.547459,2023-10-02 12:20:39.844373,0 days 00:00:00.296914,0.0011637168600791023,340,saga,COMPLETE
3613,0.5,2023-10-02 12:20:39.846373,2023-10-02 12:20:40.107729,0 days 00:00:00.261356,0.2362096537800833,360,sag,COMPLETE
3614,0.6552025330276231,2023-10-02 12:20:40.108724,2023-10-02 12:20:40.464181,0 days 00:00:00.355457,17386.245993054505,330,sag,COMPLETE
3615,0.5376678676711432,2023-10-02 12:20:40.469629,2023-10-02 12:20:40.647403,0 days 00:00:00.177774,0.6298928742649231,370,sag,COMPLETE
3616,0.6520362484987444,2023-10-02 12:20:40.648403,2023-10-02 12:20:40.900845,0 days 00:00:00.252442,65021.17942544576,390,sag,COMPLETE
3617,0.5,2023-10-02 12:20:40.903049,2023-10-02 12:20:42.103413,0 days 00:00:01.200364,1.3790188680166484e-05,380,sag,COMPLETE
3618,0.6411180259853696,2023-10-02 12:20:42.103413,2023-10-02 12:20:42.431609,0 days 00:00:00.328196,35692.91006253092,320,saga,COMPLETE
3619,0.5,2023-10-02 12:20:42.432609,2023-10-02 12:20:42.619444,0 days 00:00:00.186835,0.04788546063564369,360,sag,COMPLETE
3620,0.6534556174254831,2023-10-02 12:20:42.620439,2023-10-02 12:20:42.820497,0 days 00:00:00.200058,44.59972967981077,300,sag,COMPLETE
3621,0.637951741456491,2023-10-02 12:20:42.821495,2023-10-02 12:20:43.119464,0 days 00:00:00.297969,16170.516740709149,330,lbfgs,COMPLETE
3622,0.6298722567965934,2023-10-02 12:20:43.119464,2023-10-02 12:20:43.300179,0 days 00:00:00.180715,17.08712877544153,330,sag,COMPLETE
3623,0.6013756960366853,2023-10-02 12:20:43.300179,2023-10-02 12:20:43.498070,0 days 00:00:00.197891,2.4898140006537273,340,sag,COMPLETE
3624,0.6411180259853696,2023-10-02 12:20:43.498070,2023-10-02 12:20:43.762356,0 days 00:00:00.264286,99487.68550802735,390,saga,COMPLETE
3625,0.5,2023-10-02 12:20:43.763356,2023-10-02 12:20:44.017755,0 days 00:00:00.254399,0.07094317162636815,360,sag,COMPLETE
3626,0.6449939949776177,2023-10-02 12:20:44.018754,2023-10-02 12:20:44.261186,0 days 00:00:00.242432,42793.06169381539,350,sag,COMPLETE
3627,0.5,2023-10-02 12:20:44.262188,2023-10-02 12:20:44.452228,0 days 00:00:00.190040,0.0081705594673219,260,sag,COMPLETE
3628,0.6590785020198712,2023-10-02 12:20:44.453231,2023-10-02 12:20:44.682789,0 days 00:00:00.229558,23100.128130748835,310,sag,COMPLETE
3629,0.6520362484987444,2023-10-02 12:20:44.684789,2023-10-02 12:20:45.007369,0 days 00:00:00.322580,14066.733194636645,370,saga,COMPLETE
3630,0.6449939949776177,2023-10-02 12:20:45.008369,2023-10-02 12:20:45.219238,0 days 00:00:00.210869,99441.44174220941,290,sag,COMPLETE
3631,0.6520362484987444,2023-10-02 12:20:45.219238,2023-10-02 12:20:45.476492,0 days 00:00:00.257254,56806.288720008684,380,sag,COMPLETE
3632,0.6534556174254831,2023-10-02 12:20:45.477491,2023-10-02 12:20:45.743366,0 days 00:00:00.265875,87.41404178703812,350,newton-cg,COMPLETE
3633,0.6457036794409869,2023-10-02 12:20:45.745366,2023-10-02 12:20:45.976006,0 days 00:00:00.230640,223.5825998266534,400,sag,COMPLETE
3634,0.5,2023-10-02 12:20:45.976006,2023-10-02 12:20:46.156249,0 days 00:00:00.180243,0.01201915779783312,270,sag,COMPLETE
3635,0.5,2023-10-02 12:20:46.157257,2023-10-02 12:20:46.605984,0 days 00:00:00.448727,4.634691674076696e-05,450,sag,COMPLETE
3636,0.5,2023-10-02 12:20:46.605984,2023-10-02 12:20:46.855427,0 days 00:00:00.249443,0.0003692950720040252,410,liblinear,COMPLETE
3637,0.5,2023-10-02 12:20:46.855427,2023-10-02 12:20:47.067965,0 days 00:00:00.212538,0.00019921219695310743,100,saga,COMPLETE
3638,0.6590785020198712,2023-10-02 12:20:47.067965,2023-10-02 12:20:47.302883,0 days 00:00:00.234918,29307.487530346585,310,sag,COMPLETE
3639,0.6069985806310733,2023-10-02 12:20:47.303883,2023-10-02 12:20:47.477510,0 days 00:00:00.173627,4.573673463172789,290,sag,COMPLETE
3640,0.6520362484987444,2023-10-02 12:20:47.477510,2023-10-02 12:20:47.796732,0 days 00:00:00.319222,46057.23535684913,320,sag,COMPLETE
3641,0.6590785020198712,2023-10-02 12:20:47.798732,2023-10-02 12:20:48.052530,0 days 00:00:00.253798,15662.350012427476,450,sag,COMPLETE
3642,0.619663718746588,2023-10-02 12:20:48.053537,2023-10-02 12:20:48.240653,0 days 00:00:00.187116,10.203869172109975,300,saga,COMPLETE
3643,0.5,2023-10-02 12:20:48.241648,2023-10-02 12:20:48.489500,0 days 00:00:00.247852,0.17139899004080347,370,sag,COMPLETE
3644,0.5619609127634021,2023-10-02 12:20:48.489500,2023-10-02 12:20:48.665400,0 days 00:00:00.175900,0.8314820852536725,350,sag,COMPLETE
3645,0.5,2023-10-02 12:20:48.666400,2023-10-02 12:20:48.834260,0 days 00:00:00.167860,0.01982472751163434,410,sag,COMPLETE
3646,0.5996287804345454,2023-10-02 12:20:48.834260,2023-10-02 12:20:49.022892,0 days 00:00:00.188632,1.4732055338361991,440,lbfgs,COMPLETE
3647,0.6520362484987444,2023-10-02 12:20:49.022892,2023-10-02 12:20:49.339693,0 days 00:00:00.316801,29022.862579109955,350,sag,COMPLETE
3648,0.5,2023-10-02 12:20:49.339693,2023-10-02 12:20:49.637890,0 days 00:00:00.298197,0.0005748513103978616,370,saga,COMPLETE
3649,0.6520362484987444,2023-10-02 12:20:49.638892,2023-10-02 12:20:49.875211,0 days 00:00:00.236319,64217.98572447871,320,sag,COMPLETE
3650,0.528169014084507,2023-10-02 12:20:49.877206,2023-10-02 12:20:50.037993,0 days 00:00:00.160787,0.4195910939654401,340,sag,COMPLETE
3651,0.5,2023-10-02 12:20:50.037993,2023-10-02 12:20:50.304679,0 days 00:00:00.266686,0.0008310695329161235,380,sag,COMPLETE
3652,0.6457036794409869,2023-10-02 12:20:50.304679,2023-10-02 12:20:50.522551,0 days 00:00:00.217872,164.29882127702527,330,sag,COMPLETE
3653,0.5,2023-10-02 12:20:50.522551,2023-10-02 12:20:50.805384,0 days 00:00:00.282833,0.0004898666012620855,460,saga,COMPLETE
3654,0.666120755540998,2023-10-02 12:20:50.805384,2023-10-02 12:20:51.129369,0 days 00:00:00.323985,21692.582692869266,430,sag,COMPLETE
3655,0.637951741456491,2023-10-02 12:20:51.130369,2023-10-02 12:20:51.387453,0 days 00:00:00.257084,647.7663291690465,460,sag,COMPLETE
3656,0.643956763838847,2023-10-02 12:20:51.388453,2023-10-02 12:20:51.574476,0 days 00:00:00.186023,26.109654221779827,300,sag,COMPLETE
3657,0.5,2023-10-02 12:20:51.575489,2023-10-02 12:20:51.830749,0 days 00:00:00.255260,0.00012151985790645748,390,sag,COMPLETE
3658,0.6449939949776177,2023-10-02 12:20:51.830749,2023-10-02 12:20:52.097969,0 days 00:00:00.267220,41662.16091374199,450,newton-cg,COMPLETE
3659,0.6552025330276231,2023-10-02 12:20:52.097969,2023-10-02 12:20:52.335957,0 days 00:00:00.237988,14269.704106274048,340,sag,COMPLETE
3660,0.5619609127634021,2023-10-02 12:20:52.336951,2023-10-02 12:20:52.533067,0 days 00:00:00.196116,0.9107269967412239,400,saga,COMPLETE
3661,0.649579648433235,2023-10-02 12:20:52.534066,2023-10-02 12:20:52.716985,0 days 00:00:00.182919,223.0241451590399,440,liblinear,COMPLETE
3662,0.6590785020198712,2023-10-02 12:20:52.717985,2023-10-02 12:20:53.008393,0 days 00:00:00.290408,99767.86344189604,280,sag,COMPLETE
3663,0.5,2023-10-02 12:20:53.008393,2023-10-02 12:20:53.205801,0 days 00:00:00.197408,0.0036274393594311707,460,sag,COMPLETE
3664,0.6502893328966044,2023-10-02 12:20:53.206800,2023-10-02 12:20:53.397714,0 days 00:00:00.190914,36.00847853625141,460,sag,COMPLETE
3665,0.5,2023-10-02 12:20:53.398714,2023-10-02 12:20:53.645529,0 days 00:00:00.246815,0.0018094689995831086,460,sag,COMPLETE
3666,0.6520362484987444,2023-10-02 12:20:53.658153,2023-10-02 12:20:53.919411,0 days 00:00:00.261258,25561.553286924533,450,saga,COMPLETE
3667,0.6590785020198712,2023-10-02 12:20:53.921410,2023-10-02 12:20:54.156783,0 days 00:00:00.235373,60284.47975296913,360,sag,COMPLETE
3668,0.6552025330276231,2023-10-02 12:20:54.156783,2023-10-02 12:20:54.415863,0 days 00:00:00.259080,32920.263590106704,420,sag,COMPLETE
3669,0.6520362484987444,2023-10-02 12:20:54.416861,2023-10-02 12:20:54.747536,0 days 00:00:00.330675,15892.873209716889,450,sag,COMPLETE
3670,0.6520362484987444,2023-10-02 12:20:54.747536,2023-10-02 12:20:54.980171,0 days 00:00:00.232635,43209.07132400205,330,sag,COMPLETE
3671,0.5,2023-10-02 12:20:54.981171,2023-10-02 12:20:55.258893,0 days 00:00:00.277722,0.0005013469102287029,440,saga,COMPLETE
3672,0.6481602795064964,2023-10-02 12:20:55.259905,2023-10-02 12:20:55.515472,0 days 00:00:00.255567,64679.38607218017,460,sag,COMPLETE
3673,0.637951741456491,2023-10-02 12:20:55.516472,2023-10-02 12:20:55.824073,0 days 00:00:00.307601,20469.120322048842,470,lbfgs,COMPLETE
3674,0.6590785020198712,2023-10-02 12:20:55.824073,2023-10-02 12:20:56.078754,0 days 00:00:00.254681,12798.705363502826,430,sag,COMPLETE
3675,0.5,2023-10-02 12:20:56.078754,2023-10-02 12:20:56.420081,0 days 00:00:00.341327,7.455945205546811e-05,390,sag,COMPLETE
3676,0.6267059722677149,2023-10-02 12:20:56.420081,2023-10-02 12:20:56.679453,0 days 00:00:00.259372,12.724911840770433,450,sag,COMPLETE
3677,0.6481602795064964,2023-10-02 12:20:56.679453,2023-10-02 12:20:56.928801,0 days 00:00:00.249348,32042.75830049288,370,saga,COMPLETE
3678,0.6520362484987444,2023-10-02 12:20:56.928801,2023-10-02 12:20:57.195701,0 days 00:00:00.266900,66926.94968947001,460,sag,COMPLETE
3679,0.5,2023-10-02 12:20:57.195701,2023-10-02 12:20:57.368507,0 days 00:00:00.172806,0.041157953963699555,470,sag,COMPLETE
3680,0.6590785020198712,2023-10-02 12:20:57.368507,2023-10-02 12:20:57.682955,0 days 00:00:00.314448,24674.91278815976,470,sag,COMPLETE
3681,0.6534556174254831,2023-10-02 12:20:57.682955,2023-10-02 12:20:57.885756,0 days 00:00:00.202801,55.53801664073144,460,sag,COMPLETE
3682,0.6520362484987444,2023-10-02 12:20:57.885756,2023-10-02 12:20:58.136825,0 days 00:00:00.251069,44987.5514164233,440,sag,COMPLETE
3683,0.6449939949776177,2023-10-02 12:20:58.152464,2023-10-02 12:20:58.388187,0 days 00:00:00.235723,421.24790045099866,470,saga,COMPLETE
3684,0.5,2023-10-02 12:20:58.388187,2023-10-02 12:20:58.654685,0 days 00:00:00.266498,0.0027696918029950814,270,newton-cg,COMPLETE
3685,0.6520362484987444,2023-10-02 12:20:58.654685,2023-10-02 12:20:58.905947,0 days 00:00:00.251262,13479.773174364853,450,sag,COMPLETE
3686,0.5,2023-10-02 12:20:58.905947,2023-10-02 12:20:59.298303,0 days 00:00:00.392356,5.0372978578371776e-05,360,sag,COMPLETE
3687,0.5,2023-10-02 12:20:59.298303,2023-10-02 12:20:59.549305,0 days 00:00:00.251002,1.739977347260605e-05,380,liblinear,COMPLETE
3688,0.6534556174254831,2023-10-02 12:20:59.549305,2023-10-02 12:20:59.769057,0 days 00:00:00.219752,119.74952115237365,470,sag,COMPLETE
3689,0.6298722567965934,2023-10-02 12:20:59.769057,2023-10-02 12:20:59.957403,0 days 00:00:00.188346,18.40289787172655,470,sag,COMPLETE
3690,0.6006660115733159,2023-10-02 12:20:59.957403,2023-10-02 12:21:00.161359,0 days 00:00:00.203956,3.3716496451915345,350,saga,COMPLETE
3691,0.666120755540998,2023-10-02 12:21:00.161359,2023-10-02 12:21:00.526258,0 days 00:00:00.364899,20736.09040529487,460,sag,COMPLETE
3692,0.5313352986133857,2023-10-02 12:21:00.527628,2023-10-02 12:21:00.700318,0 days 00:00:00.172690,0.5226290965964601,450,sag,COMPLETE
3693,0.5,2023-10-02 12:21:00.700318,2023-10-02 12:21:00.872627,0 days 00:00:00.172309,0.33188143650086355,290,sag,COMPLETE
3694,0.6520362484987444,2023-10-02 12:21:00.888283,2023-10-02 12:21:01.140725,0 days 00:00:00.252442,65870.93310710942,470,sag,COMPLETE
3695,0.6590785020198712,2023-10-02 12:21:01.140725,2023-10-02 12:21:01.460077,0 days 00:00:00.319352,33762.90648651109,340,saga,COMPLETE
3696,0.6520362484987444,2023-10-02 12:21:01.460077,2023-10-02 12:21:01.715961,0 days 00:00:00.255884,99244.867652261,440,sag,COMPLETE
3697,0.6520362484987444,2023-10-02 12:21:01.715961,2023-10-02 12:21:01.968285,0 days 00:00:00.252324,11731.980840262713,420,sag,COMPLETE
3698,0.6590785020198712,2023-10-02 12:21:01.969365,2023-10-02 12:21:02.292140,0 days 00:00:00.322775,42335.221140071095,450,sag,COMPLETE
3699,0.637951741456491,2023-10-02 12:21:02.294689,2023-10-02 12:21:02.498849,0 days 00:00:00.204160,21447.645739838943,460,lbfgs,COMPLETE
3700,0.6457036794409869,2023-10-02 12:21:02.498849,2023-10-02 12:21:02.749747,0 days 00:00:00.250898,263.2294313966838,470,sag,COMPLETE
3701,0.6590785020198712,2023-10-02 12:21:02.749747,2023-10-02 12:21:03.001158,0 days 00:00:00.251411,49279.624072956205,430,saga,COMPLETE
3702,0.5982094115078066,2023-10-02 12:21:03.001158,2023-10-02 12:21:03.270158,0 days 00:00:00.269000,1.8785298242801993,460,sag,COMPLETE
3703,0.6559122174909924,2023-10-02 12:21:03.272158,2023-10-02 12:21:03.520231,0 days 00:00:00.248073,11180.434199997562,470,sag,COMPLETE
3704,0.6590785020198712,2023-10-02 12:21:03.520231,2023-10-02 12:21:03.782846,0 days 00:00:00.262615,29517.95745986512,450,sag,COMPLETE
3705,0.6520362484987444,2023-10-02 12:21:03.782846,2023-10-02 12:21:04.005895,0 days 00:00:00.223049,896.4078788856567,310,sag,COMPLETE
3706,0.6481602795064964,2023-10-02 12:21:04.005895,2023-10-02 12:21:04.304306,0 days 00:00:00.298411,17240.097230374875,330,sag,COMPLETE
3707,0.6534556174254831,2023-10-02 12:21:04.304306,2023-10-02 12:21:04.574924,0 days 00:00:00.270618,69.48002409159649,470,saga,COMPLETE
3708,0.5619609127634021,2023-10-02 12:21:04.575927,2023-10-02 12:21:04.752027,0 days 00:00:00.176100,0.8461400390728736,460,sag,COMPLETE
3709,0.5,2023-10-02 12:21:04.752027,2023-10-02 12:21:04.924746,0 days 00:00:00.172719,0.0009722532340085646,440,newton-cg,COMPLETE
3710,0.6520362484987444,2023-10-02 12:21:04.924746,2023-10-02 12:21:05.252136,0 days 00:00:00.327390,64283.39554376748,470,sag,COMPLETE
3711,0.6449939949776177,2023-10-02 12:21:05.252136,2023-10-02 12:21:05.519350,0 days 00:00:00.267214,31760.93500654096,450,sag,COMPLETE
3712,0.6101648651599519,2023-10-02 12:21:05.519350,2023-10-02 12:21:05.700843,0 days 00:00:00.181493,5.354943736380894,470,liblinear,COMPLETE
3713,0.5,2023-10-02 12:21:05.700843,2023-10-02 12:21:06.335943,0 days 00:00:00.635100,3.2330553938896594e-05,300,sag,COMPLETE
3714,0.6481602795064964,2023-10-02 12:21:06.335943,2023-10-02 12:21:06.586790,0 days 00:00:00.250847,98511.15878612737,320,saga,COMPLETE
3715,0.6520362484987444,2023-10-02 12:21:06.586790,2023-10-02 12:21:06.854965,0 days 00:00:00.268175,48463.064301062695,480,sag,COMPLETE
3716,0.5,2023-10-02 12:21:06.856965,2023-10-02 12:21:07.074926,0 days 00:00:00.217961,0.0001794832973727483,460,sag,COMPLETE
3717,0.6590785020198712,2023-10-02 12:21:07.074926,2023-10-02 12:21:07.416719,0 days 00:00:00.341793,12010.78792366517,480,sag,COMPLETE
3718,0.6418277104487389,2023-10-02 12:21:07.417719,2023-10-02 12:21:07.666935,0 days 00:00:00.249216,500.27239520395614,400,sag,COMPLETE
3719,0.5,2023-10-02 12:21:07.666935,2023-10-02 12:21:07.859315,0 days 00:00:00.192380,0.06676097128481574,340,saga,COMPLETE
3720,0.6590785020198712,2023-10-02 12:21:07.860315,2023-10-02 12:21:08.189839,0 days 00:00:00.329524,21977.43802015359,440,sag,COMPLETE
3721,0.6590785020198712,2023-10-02 12:21:08.190839,2023-10-02 12:21:08.459828,0 days 00:00:00.268989,15433.95517235238,460,sag,COMPLETE
3722,0.5,2023-10-02 12:21:08.459828,2023-10-02 12:21:08.688901,0 days 00:00:00.229073,0.0003028589466773397,150,sag,COMPLETE
3723,0.6590785020198712,2023-10-02 12:21:08.689901,2023-10-02 12:21:08.920176,0 days 00:00:00.230275,43649.047412051565,370,sag,COMPLETE
3724,0.637951741456491,2023-10-02 12:21:08.920176,2023-10-02 12:21:09.265235,0 days 00:00:00.345059,28750.793738294193,470,sag,COMPLETE
3725,0.637951741456491,2023-10-02 12:21:09.280855,2023-10-02 12:21:09.507005,0 days 00:00:00.226150,62861.657496939406,480,lbfgs,COMPLETE
3726,0.6520362484987444,2023-10-02 12:21:09.507958,2023-10-02 12:21:09.768787,0 days 00:00:00.260829,21383.786188468017,440,saga,COMPLETE
3727,0.6520362484987444,2023-10-02 12:21:09.770786,2023-10-02 12:21:10.106733,0 days 00:00:00.335947,9248.906747250127,450,sag,COMPLETE
3728,0.6098373184845508,2023-10-02 12:21:10.106733,2023-10-02 12:21:10.287010,0 days 00:00:00.180277,1.581162248236778,430,sag,COMPLETE
3729,0.6590785020198712,2023-10-02 12:21:10.287010,2023-10-02 12:21:10.586588,0 days 00:00:00.299578,63868.478915836065,470,sag,COMPLETE
3730,0.6481602795064964,2023-10-02 12:21:10.587588,2023-10-02 12:21:10.920389,0 days 00:00:00.332801,34620.44034677568,480,sag,COMPLETE
3731,0.637951741456491,2023-10-02 12:21:10.920389,2023-10-02 12:21:11.210762,0 days 00:00:00.290373,691.8124312212879,470,saga,COMPLETE
3732,0.6552025330276231,2023-10-02 12:21:11.212279,2023-10-02 12:21:11.466334,0 days 00:00:00.254055,14507.758423479434,410,sag,COMPLETE
3733,0.5,2023-10-02 12:21:11.467333,2023-10-02 12:21:11.647388,0 days 00:00:00.180055,0.0066684956542528645,460,sag,COMPLETE
