number,value,datetime_start,datetime_complete,duration,params_C,params_max_iter,params_solver,state
4875,0.5478764057211486,2023-10-02 12:27:11.186659,2023-10-02 12:27:11.490737,0 days 00:00:00.304078,0.7157401096687702,370,sag,COMPLETE
4876,0.6502893328966044,2023-10-02 12:27:11.492735,2023-10-02 12:27:11.732612,0 days 00:00:00.239877,33.32577798137982,440,sag,COMPLETE
4877,0.6418277104487389,2023-10-02 12:27:11.748237,2023-10-02 12:27:12.124882,0 days 00:00:00.376645,439.4744953477117,390,sag,COMPLETE
4878,0.6590785020198712,2023-10-02 12:27:12.124882,2023-10-02 12:27:12.463982,0 days 00:00:00.339100,2589.595256162696,500,sag,COMPLETE
4879,0.5,2023-10-02 12:27:12.463982,2023-10-02 12:27:12.708431,0 days 00:00:00.244449,0.049118855955392324,380,sag,COMPLETE
4880,0.5,2023-10-02 12:27:12.708431,2023-10-02 12:27:13.026234,0 days 00:00:00.317803,0.14905578781460221,350,sag,COMPLETE
4881,0.5,2023-10-02 12:27:13.026234,2023-10-02 12:27:13.304088,0 days 00:00:00.277854,0.0011487981012802296,500,sag,COMPLETE
4882,0.637951741456491,2023-10-02 12:27:13.304088,2023-10-02 12:27:13.682154,0 days 00:00:00.378066,890.1925774343806,260,sag,COMPLETE
4883,0.5,2023-10-02 12:27:13.682154,2023-10-02 12:27:13.945446,0 days 00:00:00.263292,0.0008836682932862096,360,newton-cg,COMPLETE
4884,0.528169014084507,2023-10-02 12:27:13.947440,2023-10-02 12:27:14.182625,0 days 00:00:00.235185,0.4144695831666746,500,sag,COMPLETE
4885,0.6411180259853696,2023-10-02 12:27:14.182625,2023-10-02 12:27:14.544684,0 days 00:00:00.362059,26197.92807797381,120,sag,COMPLETE
4886,0.637951741456491,2023-10-02 12:27:14.546693,2023-10-02 12:27:14.782046,0 days 00:00:00.235353,65587.86118598143,340,liblinear,COMPLETE
4887,0.5352112676056338,2023-10-02 12:27:14.795604,2023-10-02 12:27:15.123795,0 days 00:00:00.328191,0.47284553350577824,370,sag,COMPLETE
4888,0.6534556174254831,2023-10-02 12:27:15.125795,2023-10-02 12:27:15.410498,0 days 00:00:00.284703,80.13935455886453,440,sag,COMPLETE
4889,0.6520362484987444,2023-10-02 12:27:15.411643,2023-10-02 12:27:15.702058,0 days 00:00:00.290415,37495.884984434255,350,sag,COMPLETE
4890,0.6559122174909924,2023-10-02 12:27:15.702058,2023-10-02 12:27:16.112928,0 days 00:00:00.410870,10559.925945528545,330,sag,COMPLETE
4891,0.6590785020198712,2023-10-02 12:27:16.113927,2023-10-02 12:27:16.432706,0 days 00:00:00.318779,19472.3611230881,500,sag,COMPLETE
4892,0.6020853805000546,2023-10-02 12:27:16.432706,2023-10-02 12:27:16.767241,0 days 00:00:00.334535,1.8114305442258556,450,sag,COMPLETE
4893,0.6520362484987444,2023-10-02 12:27:16.769238,2023-10-02 12:27:17.082581,0 days 00:00:00.313343,5043.355273660823,360,sag,COMPLETE
4894,0.66224478654875,2023-10-02 12:27:17.082581,2023-10-02 12:27:17.485109,0 days 00:00:00.402528,99060.97339456111,500,sag,COMPLETE
4895,0.6449939949776177,2023-10-02 12:27:17.486109,2023-10-02 12:27:17.786833,0 days 00:00:00.300724,1703.5052673381801,380,sag,COMPLETE
4896,0.637951741456491,2023-10-02 12:27:17.786833,2023-10-02 12:27:18.106609,0 days 00:00:00.319776,44074.3874819128,500,lbfgs,COMPLETE
4897,0.5,2023-10-02 12:27:18.108609,2023-10-02 12:27:18.416889,0 days 00:00:00.308280,0.03639276103433863,350,sag,COMPLETE
4898,0.5,2023-10-02 12:27:18.418889,2023-10-02 12:27:18.716468,0 days 00:00:00.297579,0.003242166593360878,430,sag,COMPLETE
4899,0.6449939949776177,2023-10-02 12:27:18.716468,2023-10-02 12:27:19.108908,0 days 00:00:00.392440,25836.072679294328,370,sag,COMPLETE
4900,0.643956763838847,2023-10-02 12:27:19.111383,2023-10-02 12:27:19.378301,0 days 00:00:00.266918,24.526462308199797,450,sag,COMPLETE
4901,0.6629544710121192,2023-10-02 12:27:19.379908,2023-10-02 12:27:19.754194,0 days 00:00:00.374286,64920.085485744276,500,sag,COMPLETE
4902,0.6590785020198712,2023-10-02 12:27:19.756188,2023-10-02 12:27:20.175512,0 days 00:00:00.419324,9946.803640412198,500,sag,COMPLETE
4903,0.5,2023-10-02 12:27:20.176511,2023-10-02 12:27:20.452516,0 days 00:00:00.276005,0.0024648583752292165,360,sag,COMPLETE
4904,0.5,2023-10-02 12:27:20.454693,2023-10-02 12:27:20.825804,0 days 00:00:00.371111,0.0005077928990638388,370,sag,COMPLETE
4905,0.6267059722677149,2023-10-02 12:27:20.826804,2023-10-02 12:27:21.065942,0 days 00:00:00.239138,10.580355133181646,440,sag,COMPLETE
4906,0.6298722567965934,2023-10-02 12:27:21.067942,2023-10-02 12:27:21.329083,0 days 00:00:00.261141,15.836874498002445,350,sag,COMPLETE
4907,0.6449939949776177,2023-10-02 12:27:21.330723,2023-10-02 12:27:21.751507,0 days 00:00:00.420784,99238.66181607939,400,sag,COMPLETE
4908,0.6238672344142374,2023-10-02 12:27:21.753509,2023-10-02 12:27:22.017325,0 days 00:00:00.263816,3180.9737626865035,500,newton-cg,COMPLETE
4909,0.5,2023-10-02 12:27:22.019326,2023-10-02 12:27:22.343111,0 days 00:00:00.323785,0.0015337523694815298,330,sag,COMPLETE
4910,0.669996724533246,2023-10-02 12:27:22.344111,2023-10-02 12:27:22.635266,0 days 00:00:00.291155,6144.610651881569,340,sag,COMPLETE
4911,0.5,2023-10-02 12:27:22.636267,2023-10-02 12:27:22.883322,0 days 00:00:00.247055,0.0008224571791734786,330,liblinear,COMPLETE
4912,0.6559122174909924,2023-10-02 12:27:22.885322,2023-10-02 12:27:23.252048,0 days 00:00:00.366726,3100.286285275538,330,sag,COMPLETE
4913,0.6449939949776177,2023-10-02 12:27:23.254043,2023-10-02 12:27:23.538548,0 days 00:00:00.284505,1110.806626546525,310,sag,COMPLETE
4914,0.6203734032099574,2023-10-02 12:27:23.540545,2023-10-02 12:27:23.865365,0 days 00:00:00.324820,7.783744046124608,320,sag,COMPLETE
4915,0.6559122174909924,2023-10-02 12:27:23.865365,2023-10-02 12:27:24.164479,0 days 00:00:00.299114,5444.240954012169,330,sag,COMPLETE
4916,0.6077082650944426,2023-10-02 12:27:24.166224,2023-10-02 12:27:24.440060,0 days 00:00:00.273836,3.4882264100539677,320,sag,COMPLETE
4917,0.6449939949776177,2023-10-02 12:27:24.442058,2023-10-02 12:27:24.807692,0 days 00:00:00.365634,1484.287297301521,320,sag,COMPLETE
4918,0.5894202423845398,2023-10-02 12:27:24.809204,2023-10-02 12:27:25.045235,0 days 00:00:00.236031,1.2273112273453606,330,sag,COMPLETE
4919,0.637951741456491,2023-10-02 12:27:25.047229,2023-10-02 12:27:25.411589,0 days 00:00:00.364360,2230.35365282909,310,sag,COMPLETE
4920,0.6520362484987444,2023-10-02 12:27:25.412583,2023-10-02 12:27:25.708146,0 days 00:00:00.295563,46302.9668383198,320,sag,COMPLETE
4921,0.6309094879353642,2023-10-02 12:27:25.710677,2023-10-02 12:27:26.084629,0 days 00:00:00.373952,4001.38154630427,330,lbfgs,COMPLETE
4922,0.6597881864832406,2023-10-02 12:27:26.086629,2023-10-02 12:27:26.383774,0 days 00:00:00.297145,27657.104946431955,330,sag,COMPLETE
4923,0.6590785020198712,2023-10-02 12:27:26.384770,2023-10-02 12:27:26.694756,0 days 00:00:00.309986,61244.401053644215,340,sag,COMPLETE
4924,0.6520362484987444,2023-10-02 12:27:26.696766,2023-10-02 12:27:27.071348,0 days 00:00:00.374582,36875.65667555614,340,sag,COMPLETE
4925,0.608417949557812,2023-10-02 12:27:27.073343,2023-10-02 12:27:27.310341,0 days 00:00:00.236998,2.6897283171290414,330,sag,COMPLETE
4926,0.6590785020198712,2023-10-02 12:27:27.312350,2023-10-02 12:27:27.718489,0 days 00:00:00.406139,16101.711277568143,450,sag,COMPLETE
4927,0.6418277104487389,2023-10-02 12:27:27.718489,2023-10-02 12:27:28.048362,0 days 00:00:00.329873,399.67281006409246,330,sag,COMPLETE
4928,0.6449939949776177,2023-10-02 12:27:28.050037,2023-10-02 12:27:28.355062,0 days 00:00:00.305025,6524.850379895043,320,sag,COMPLETE
4929,0.5313352986133857,2023-10-02 12:27:28.355062,2023-10-02 12:27:28.711023,0 days 00:00:00.355961,0.4761537226430295,340,sag,COMPLETE
4930,0.5,2023-10-02 12:27:28.717867,2023-10-02 12:27:29.048963,0 days 00:00:00.331096,0.00015361321694365473,330,sag,COMPLETE
4931,0.637951741456491,2023-10-02 12:27:29.050451,2023-10-02 12:27:29.423182,0 days 00:00:00.372731,862.6201923981615,340,sag,COMPLETE
4932,0.6449939949776177,2023-10-02 12:27:29.424184,2023-10-02 12:27:29.698026,0 days 00:00:00.273842,66155.47792134859,340,newton-cg,COMPLETE
4933,0.6062888961677039,2023-10-02 12:27:29.699025,2023-10-02 12:27:29.941190,0 days 00:00:00.242165,6.541211563187655,330,sag,COMPLETE
4934,0.666120755540998,2023-10-02 12:27:29.941190,2023-10-02 12:27:30.351436,0 days 00:00:00.410246,32789.59851407541,500,sag,COMPLETE
4935,0.5,2023-10-02 12:27:30.351436,2023-10-02 12:27:30.681356,0 days 00:00:00.329920,0.00020130130162672764,340,sag,COMPLETE
4936,0.6309094879353642,2023-10-02 12:27:30.681356,2023-10-02 12:27:31.033924,0 days 00:00:00.352568,4306.294904416374,320,liblinear,COMPLETE
4937,0.5,2023-10-02 12:27:31.035662,2023-10-02 12:27:31.280062,0 days 00:00:00.244400,0.00916408425772201,340,sag,COMPLETE
4938,0.5,2023-10-02 12:27:31.282061,2023-10-02 12:27:32.064649,0 days 00:00:00.782588,2.429736209491159e-05,330,sag,COMPLETE
4939,0.6449939949776177,2023-10-02 12:27:32.066644,2023-10-02 12:27:32.477436,0 days 00:00:00.410792,2272.787491839891,340,sag,COMPLETE
4940,0.5,2023-10-02 12:27:32.478436,2023-10-02 12:27:32.718656,0 days 00:00:00.240220,0.004915230494549763,330,sag,COMPLETE
4941,0.6559122174909924,2023-10-02 12:27:32.720654,2023-10-02 12:27:33.108040,0 days 00:00:00.387386,99823.09637556804,330,sag,COMPLETE
4942,0.6520362484987444,2023-10-02 12:27:33.110041,2023-10-02 12:27:33.413206,0 days 00:00:00.303165,13068.778151085973,340,sag,COMPLETE
4943,0.5,2023-10-02 12:27:33.414716,2023-10-02 12:27:33.740757,0 days 00:00:00.326041,0.115764539123742,340,sag,COMPLETE
4944,0.5,2023-10-02 12:27:33.741757,2023-10-02 12:27:33.977183,0 days 00:00:00.235426,0.146300645780729,320,sag,COMPLETE
4945,0.6590785020198712,2023-10-02 12:27:33.978183,2023-10-02 12:27:34.278326,0 days 00:00:00.300143,22562.66068846681,340,sag,COMPLETE
4946,0.6590785020198712,2023-10-02 12:27:34.280321,2023-10-02 12:27:34.655726,0 days 00:00:00.375405,41731.14844272669,320,sag,COMPLETE
4947,0.637951741456491,2023-10-02 12:27:34.657726,2023-10-02 12:27:34.953858,0 days 00:00:00.296132,8339.852416914617,340,lbfgs,COMPLETE
4948,0.6534556174254831,2023-10-02 12:27:34.954854,2023-10-02 12:27:35.305950,0 days 00:00:00.351096,108.86324050935988,330,sag,COMPLETE
4949,0.6590785020198712,2023-10-02 12:27:35.306949,2023-10-02 12:27:35.625835,0 days 00:00:00.318886,68150.84211812895,340,sag,COMPLETE
4950,0.6520362484987444,2023-10-02 12:27:35.626998,2023-10-02 12:27:35.930842,0 days 00:00:00.303844,20485.704689171333,320,sag,COMPLETE
4951,0.6457036794409869,2023-10-02 12:27:35.931842,2023-10-02 12:27:36.323314,0 days 00:00:00.391472,267.73570668754724,340,sag,COMPLETE
4952,0.637951741456491,2023-10-02 12:27:36.325314,2023-10-02 12:27:36.623572,0 days 00:00:00.298258,616.8939760065151,330,sag,COMPLETE
4953,0.6098373184845508,2023-10-02 12:27:36.625568,2023-10-02 12:27:36.960416,0 days 00:00:00.334848,1.5794911826108142,490,sag,COMPLETE
4954,0.6520362484987444,2023-10-02 12:27:36.962419,2023-10-02 12:27:37.273085,0 days 00:00:00.310666,48329.585663717284,310,sag,COMPLETE
4955,0.5,2023-10-02 12:27:37.273085,2023-10-02 12:27:37.765652,0 days 00:00:00.492567,4.782647406163789e-05,330,sag,COMPLETE
4956,0.5,2023-10-02 12:27:37.765652,2023-10-02 12:27:38.079401,0 days 00:00:00.313749,0.21086523379747643,340,sag,COMPLETE
4957,0.6534556174254831,2023-10-02 12:27:38.079401,2023-10-02 12:27:38.331242,0 days 00:00:00.251841,57.167480039835496,340,newton-cg,COMPLETE
4958,0.5,2023-10-02 12:27:38.331242,2023-10-02 12:27:38.768669,0 days 00:00:00.437427,0.00010120072327285177,450,sag,COMPLETE
4959,0.6590785020198712,2023-10-02 12:27:38.770678,2023-10-02 12:27:39.094309,0 days 00:00:00.323631,13743.05257004381,420,sag,COMPLETE
4960,0.6629544710121192,2023-10-02 12:27:39.094309,2023-10-02 12:27:39.455772,0 days 00:00:00.361463,99885.87166596978,310,sag,COMPLETE
4961,0.6309094879353642,2023-10-02 12:27:39.455772,2023-10-02 12:27:39.709170,0 days 00:00:00.253398,2832.627343845462,330,liblinear,COMPLETE
4962,0.6590785020198712,2023-10-02 12:27:39.709170,2023-10-02 12:27:40.066860,0 days 00:00:00.357690,6422.542844676175,490,sag,COMPLETE
4963,0.6629544710121192,2023-10-02 12:27:40.068858,2023-10-02 12:27:40.509328,0 days 00:00:00.440470,33095.123750394865,500,sag,COMPLETE
4964,0.6369145103177202,2023-10-02 12:27:40.511175,2023-10-02 12:27:40.805549,0 days 00:00:00.294374,19.081852900098923,300,sag,COMPLETE
4965,0.6520362484987444,2023-10-02 12:27:40.808024,2023-10-02 12:27:41.224253,0 days 00:00:00.416229,20337.72195028058,430,sag,COMPLETE
4966,0.6590785020198712,2023-10-02 12:27:41.226077,2023-10-02 12:27:41.558864,0 days 00:00:00.332787,65016.86698266725,490,sag,COMPLETE
4967,0.6590785020198712,2023-10-02 12:27:41.558864,2023-10-02 12:27:41.939983,0 days 00:00:00.381119,4495.031243826279,490,sag,COMPLETE
4968,0.6590785020198712,2023-10-02 12:27:41.940983,2023-10-02 12:27:42.379415,0 days 00:00:00.438432,9462.91424229568,500,sag,COMPLETE
4969,0.66224478654875,2023-10-02 12:27:42.379415,2023-10-02 12:27:42.773520,0 days 00:00:00.394105,32644.70694857979,340,sag,COMPLETE
4970,0.6534556174254831,2023-10-02 12:27:42.775516,2023-10-02 12:27:43.172356,0 days 00:00:00.396840,173.17229542823057,320,lbfgs,COMPLETE
4971,0.6590785020198712,2023-10-02 12:27:43.173790,2023-10-02 12:27:43.494589,0 days 00:00:00.320799,99536.67418449005,490,sag,COMPLETE
4972,0.5,2023-10-02 12:27:43.496590,2023-10-02 12:27:43.759307,0 days 00:00:00.262717,0.006890045400159157,450,sag,COMPLETE
4973,0.6013756960366853,2023-10-02 12:27:43.761280,2023-10-02 12:27:44.112423,0 days 00:00:00.351143,2.3859543622370376,440,sag,COMPLETE
4974,0.6520362484987444,2023-10-02 12:27:44.114429,2023-10-02 12:27:44.462631,0 days 00:00:00.348202,48022.53047532741,500,sag,COMPLETE
4975,0.6449939949776177,2023-10-02 12:27:44.464631,2023-10-02 12:27:44.909837,0 days 00:00:00.445206,1355.8191339213588,490,sag,COMPLETE
4976,0.5,2023-10-02 12:27:44.910833,2023-10-02 12:27:45.148302,0 days 00:00:00.237469,0.018340061490824195,340,sag,COMPLETE
4977,0.6449939949776177,2023-10-02 12:27:45.150302,2023-10-02 12:27:45.487159,0 days 00:00:00.336857,14740.583088284791,450,sag,COMPLETE
4978,0.6573315864177312,2023-10-02 12:27:45.488159,2023-10-02 12:27:45.855889,0 days 00:00:00.367730,39.29221761397414,490,sag,COMPLETE
4979,0.6337482257888415,2023-10-02 12:27:45.855889,2023-10-02 12:27:46.106748,0 days 00:00:00.250859,15.008557831248769,500,sag,COMPLETE
4980,0.643956763838847,2023-10-02 12:27:46.106748,2023-10-02 12:27:46.436644,0 days 00:00:00.329896,25.1551691636192,440,sag,COMPLETE
4981,0.6590785020198712,2023-10-02 12:27:46.436644,2023-10-02 12:27:46.750414,0 days 00:00:00.313770,26218.14334095998,490,sag,COMPLETE
4982,0.5313352986133857,2023-10-02 12:27:46.766045,2023-10-02 12:27:47.074184,0 days 00:00:00.308139,0.5225102402058261,330,sag,COMPLETE
4983,0.6386614259198603,2023-10-02 12:27:47.074184,2023-10-02 12:27:47.366417,0 days 00:00:00.292233,426.0211578227949,500,newton-cg,COMPLETE
4984,0.5,2023-10-02 12:27:47.366417,2023-10-02 12:27:47.652779,0 days 00:00:00.286362,0.00024164787227663308,340,sag,COMPLETE
4985,0.5894202423845398,2023-10-02 12:27:47.652779,2023-10-02 12:27:47.967035,0 days 00:00:00.314256,1.2069321681259684,310,liblinear,COMPLETE
4986,0.6590785020198712,2023-10-02 12:27:47.967035,2023-10-02 12:27:48.302346,0 days 00:00:00.335311,10043.826791843485,350,sag,COMPLETE
4987,0.6457036794409869,2023-10-02 12:27:48.304345,2023-10-02 12:27:48.729979,0 days 00:00:00.425634,287.437778076324,490,sag,COMPLETE
4988,0.6590785020198712,2023-10-02 12:27:48.729979,2023-10-02 12:27:49.059368,0 days 00:00:00.329389,50623.05897740171,500,sag,COMPLETE
4989,0.6449939949776177,2023-10-02 12:27:49.059368,2023-10-02 12:27:49.418997,0 days 00:00:00.359629,2124.297144120857,450,sag,COMPLETE
4990,0.6520362484987444,2023-10-02 12:27:49.430512,2023-10-02 12:27:49.833328,0 days 00:00:00.402816,3803.4483878563838,410,sag,COMPLETE
4991,0.6590785020198712,2023-10-02 12:27:49.835323,2023-10-02 12:27:50.149440,0 days 00:00:00.314117,18898.92585344671,430,sag,COMPLETE
4992,0.666120755540998,2023-10-02 12:27:50.151440,2023-10-02 12:27:50.561842,0 days 00:00:00.410402,6958.619480442041,490,sag,COMPLETE
4993,0.6590785020198712,2023-10-02 12:27:50.561842,2023-10-02 12:27:50.904892,0 days 00:00:00.343050,67137.83512029398,490,sag,COMPLETE
4994,0.6449939949776177,2023-10-02 12:27:50.904892,2023-10-02 12:27:51.207817,0 days 00:00:00.302925,32054.284512924787,280,sag,COMPLETE
4995,0.6590785020198712,2023-10-02 12:27:51.207817,2023-10-02 12:27:51.608976,0 days 00:00:00.401159,13841.483521434686,500,sag,COMPLETE
4996,0.5,2023-10-02 12:27:51.608976,2023-10-02 12:27:51.844789,0 days 00:00:00.235813,0.012105686244923534,350,lbfgs,COMPLETE
4997,0.5,2023-10-02 12:27:51.860471,2023-10-02 12:27:52.174397,0 days 00:00:00.313926,0.06916563247287305,500,sag,COMPLETE
4998,0.6520362484987444,2023-10-02 12:27:52.174397,2023-10-02 12:27:52.488230,0 days 00:00:00.313833,46949.94340160387,450,sag,COMPLETE
4999,0.6520362484987444,2023-10-02 12:27:52.488230,2023-10-02 12:27:52.849184,0 days 00:00:00.360954,22553.823745222293,490,sag,COMPLETE
5000,0.5,2023-10-02 12:27:52.851184,2023-10-02 12:27:53.333087,0 days 00:00:00.481903,7.125896689292024e-05,320,sag,COMPLETE
5001,0.666120755540998,2023-10-02 12:27:53.335087,2023-10-02 12:27:53.626953,0 days 00:00:00.291866,99494.80124307178,330,sag,COMPLETE
5002,0.6520362484987444,2023-10-02 12:27:53.626953,2023-10-02 12:27:54.019206,0 days 00:00:00.392253,5363.916730388651,440,sag,COMPLETE
5003,0.5,2023-10-02 12:27:54.019206,2023-10-02 12:27:54.269866,0 days 00:00:00.250660,0.00213788925441215,490,sag,COMPLETE
5004,0.5,2023-10-02 12:27:54.269866,2023-10-02 12:27:54.599852,0 days 00:00:00.329986,0.0014046422371957032,500,sag,COMPLETE
5005,0.6520362484987444,2023-10-02 12:27:54.599852,2023-10-02 12:27:54.915761,0 days 00:00:00.315909,33960.071026269055,340,sag,COMPLETE
5006,0.6449939949776177,2023-10-02 12:27:54.917756,2023-10-02 12:27:55.250205,0 days 00:00:00.332449,10682.009048306922,460,sag,COMPLETE
5007,0.5,2023-10-02 12:27:55.253210,2023-10-02 12:27:55.689768,0 days 00:00:00.436558,0.00029907496479565486,490,newton-cg,COMPLETE
5008,0.5,2023-10-02 12:27:55.690772,2023-10-02 12:27:56.047576,0 days 00:00:00.356804,0.033875442679821115,500,sag,COMPLETE
5009,0.6520362484987444,2023-10-02 12:27:56.049573,2023-10-02 12:27:56.567007,0 days 00:00:00.517434,3203.974689586648,450,sag,COMPLETE
5010,0.637951741456491,2023-10-02 12:27:56.568989,2023-10-02 12:27:56.829254,0 days 00:00:00.260265,66145.05741962988,490,liblinear,COMPLETE
5011,0.5,2023-10-02 12:27:56.829254,2023-10-02 12:27:57.073956,0 days 00:00:00.244702,0.12706982863989127,350,sag,COMPLETE
5012,0.6449939949776177,2023-10-02 12:27:57.075956,2023-10-02 12:27:57.529457,0 days 00:00:00.453501,1823.7118764170402,460,sag,COMPLETE
5013,0.649579648433235,2023-10-02 12:27:57.529457,2023-10-02 12:27:57.906391,0 days 00:00:00.376934,163.74919377644383,440,sag,COMPLETE
5014,0.6590785020198712,2023-10-02 12:27:57.908391,2023-10-02 12:27:58.326475,0 days 00:00:00.418084,17602.710253299352,490,sag,COMPLETE
5015,0.5690031662845288,2023-10-02 12:27:58.328705,2023-10-02 12:27:58.597019,0 days 00:00:00.268314,1.024398109587843,500,sag,COMPLETE
5016,0.6552025330276231,2023-10-02 12:27:58.597019,2023-10-02 12:27:58.973539,0 days 00:00:00.376520,48894.539000586476,340,sag,COMPLETE
5017,0.6069985806310733,2023-10-02 12:27:58.975540,2023-10-02 12:27:59.310384,0 days 00:00:00.334844,4.401763517498159,460,sag,COMPLETE
5018,0.637951741456491,2023-10-02 12:27:59.310384,2023-10-02 12:27:59.622681,0 days 00:00:00.312297,655.0257397498818,350,sag,COMPLETE
5019,0.5,2023-10-02 12:27:59.622681,2023-10-02 12:27:59.952474,0 days 00:00:00.329793,0.0006001377073451169,490,sag,COMPLETE
5020,0.6520362484987444,2023-10-02 12:27:59.952474,2023-10-02 12:28:00.312401,0 days 00:00:00.359927,6615.153196664709,500,sag,COMPLETE
5021,0.5478764057211486,2023-10-02 12:28:00.312401,2023-10-02 12:28:00.563186,0 days 00:00:00.250785,0.7924081024439735,450,lbfgs,COMPLETE
5022,0.6534556174254831,2023-10-02 12:28:00.578812,2023-10-02 12:28:00.923857,0 days 00:00:00.345045,62.44809222765303,330,sag,COMPLETE
5023,0.666120755540998,2023-10-02 12:28:00.939497,2023-10-02 12:28:01.254344,0 days 00:00:00.314847,32483.07678010005,490,sag,COMPLETE
5024,0.528169014084507,2023-10-02 12:28:01.254344,2023-10-02 12:28:01.584568,0 days 00:00:00.330224,0.41360850270065275,430,sag,COMPLETE
5025,0.6590785020198712,2023-10-02 12:28:01.584568,2023-10-02 12:28:01.917883,0 days 00:00:00.333315,21922.32773997066,500,sag,COMPLETE
5026,0.6520362484987444,2023-10-02 12:28:01.917883,2023-10-02 12:28:02.237176,0 days 00:00:00.319293,66408.48612657098,490,sag,COMPLETE
5027,0.6481602795064964,2023-10-02 12:28:02.250189,2023-10-02 12:28:02.627137,0 days 00:00:00.376948,12430.87750496697,350,sag,COMPLETE
5028,0.6534556174254831,2023-10-02 12:28:02.627137,2023-10-02 12:28:02.898018,0 days 00:00:00.270881,76.62028079255397,460,sag,COMPLETE
5029,0.6590785020198712,2023-10-02 12:28:02.898018,2023-10-02 12:28:03.315216,0 days 00:00:00.417198,47518.5535383687,450,sag,COMPLETE
5030,0.634075772464243,2023-10-02 12:28:03.315216,2023-10-02 12:28:03.662388,0 days 00:00:00.347172,4623.034835916242,500,sag,COMPLETE
5031,0.5,2023-10-02 12:28:03.662388,2023-10-02 12:28:03.994005,0 days 00:00:00.331617,0.049697791238171,340,sag,COMPLETE
5032,0.5982094115078066,2023-10-02 12:28:03.994005,2023-10-02 12:28:04.254241,0 days 00:00:00.260236,1.8811332449055227,490,sag,COMPLETE
5033,0.5,2023-10-02 12:28:04.254241,2023-10-02 12:28:04.523971,0 days 00:00:00.269730,0.0007994523358898896,500,sag,COMPLETE
5034,0.5,2023-10-02 12:28:04.523971,2023-10-02 12:28:04.875040,0 days 00:00:00.351069,0.28149432341743347,300,newton-cg,COMPLETE
5035,0.5,2023-10-02 12:28:04.890661,2023-10-02 12:28:05.125085,0 days 00:00:00.234424,2.4361858935602842e-05,330,liblinear,COMPLETE
5036,0.6520362484987444,2023-10-02 12:28:05.125085,2023-10-02 12:28:05.538192,0 days 00:00:00.413107,9182.781269591229,440,sag,COMPLETE
5037,0.666120755540998,2023-10-02 12:28:05.553822,2023-10-02 12:28:05.881832,0 days 00:00:00.328010,27642.145796769037,460,sag,COMPLETE
