number,value,datetime_start,datetime_complete,duration,params_C,params_max_iter,params_solver,state
5038,0.5,2023-10-02 12:28:05.881832,2023-10-02 12:28:06.547496,0 days 00:00:00.665664,3.547239457965727e-05,490,sag,COMPLETE
5039,0.6449939949776177,2023-10-02 12:28:06.547496,2023-10-02 12:28:06.920411,0 days 00:00:00.372915,814.8378931699934,350,sag,COMPLETE
5040,0.669996724533246,2023-10-02 12:28:06.920411,2023-10-02 12:28:07.266627,0 days 00:00:00.346216,15771.422636367417,490,sag,COMPLETE
5041,0.6590785020198712,2023-10-02 12:28:07.266627,2023-10-02 12:28:07.771559,0 days 00:00:00.504932,6028.898016857267,320,sag,COMPLETE
5042,0.6520362484987444,2023-10-02 12:28:07.773576,2023-10-02 12:28:08.099362,0 days 00:00:00.325786,7476.158177301212,240,sag,COMPLETE
5043,0.666120755540998,2023-10-02 12:28:08.100449,2023-10-02 12:28:08.411802,0 days 00:00:00.311353,10830.292108028538,460,sag,COMPLETE
5044,0.666120755540998,2023-10-02 12:28:08.411802,2023-10-02 12:28:08.843447,0 days 00:00:00.431645,4674.235298178059,490,sag,COMPLETE
5045,0.6590785020198712,2023-10-02 12:28:08.844453,2023-10-02 12:28:09.126215,0 days 00:00:00.281762,8505.21810256499,270,sag,COMPLETE
5046,0.637951741456491,2023-10-02 12:28:09.126215,2023-10-02 12:28:09.502992,0 days 00:00:00.376777,11155.741285554082,500,lbfgs,COMPLETE
5047,0.666120755540998,2023-10-02 12:28:09.502992,2023-10-02 12:28:09.816789,0 days 00:00:00.313797,3195.535390197645,430,sag,COMPLETE
5048,0.6590785020198712,2023-10-02 12:28:09.816789,2023-10-02 12:28:10.162230,0 days 00:00:00.345441,6489.737074707353,500,sag,COMPLETE
5049,0.6590785020198712,2023-10-02 12:28:10.162230,2023-10-02 12:28:10.538743,0 days 00:00:00.376513,13430.828190688255,350,sag,COMPLETE
5050,0.6449939949776177,2023-10-02 12:28:10.538743,2023-10-02 12:28:10.862629,0 days 00:00:00.323886,14852.389877156302,400,sag,COMPLETE
5051,0.637951741456491,2023-10-02 12:28:10.862629,2023-10-02 12:28:11.281119,0 days 00:00:00.418490,1680.071518245334,450,sag,COMPLETE
5052,0.6449939949776177,2023-10-02 12:28:11.283111,2023-10-02 12:28:11.602187,0 days 00:00:00.319076,3189.2971351536603,420,sag,COMPLETE
5053,0.6590785020198712,2023-10-02 12:28:11.604183,2023-10-02 12:28:11.995398,0 days 00:00:00.391215,8477.124616087001,340,sag,COMPLETE
5054,0.6449939949776177,2023-10-02 12:28:11.997398,2023-10-02 12:28:12.331750,0 days 00:00:00.334352,4586.676331900466,490,sag,COMPLETE
5055,0.6457036794409869,2023-10-02 12:28:12.331750,2023-10-02 12:28:12.633187,0 days 00:00:00.301437,241.00839616583298,460,sag,COMPLETE
5056,0.6552025330276231,2023-10-02 12:28:12.633187,2023-10-02 12:28:13.075015,0 days 00:00:00.441828,16540.988692562474,440,sag,COMPLETE
5057,0.5,2023-10-02 12:28:13.075015,2023-10-02 12:28:13.403572,0 days 00:00:00.328557,0.00010685151319069279,480,newton-cg,COMPLETE
5058,0.5,2023-10-02 12:28:13.406059,2023-10-02 12:28:13.962188,0 days 00:00:00.556129,0.011878916730193983,500,sag,COMPLETE
5059,0.6520362484987444,2023-10-02 12:28:13.964185,2023-10-02 12:28:14.297507,0 days 00:00:00.333322,2466.654415419958,480,sag,COMPLETE
5060,0.6267059722677149,2023-10-02 12:28:14.298506,2023-10-02 12:28:14.545322,0 days 00:00:00.246816,11.593346405381899,490,sag,COMPLETE
5061,0.5,2023-10-02 12:28:14.547317,2023-10-02 12:28:14.915146,0 days 00:00:00.367829,0.0037577830157621097,490,liblinear,COMPLETE
5062,0.666120755540998,2023-10-02 12:28:14.916137,2023-10-02 12:28:15.376065,0 days 00:00:00.459928,7199.360890817859,450,sag,COMPLETE
5063,0.643956763838847,2023-10-02 12:28:15.377056,2023-10-02 12:28:15.861494,0 days 00:00:00.484438,25.34310036695218,460,sag,COMPLETE
5064,0.5,2023-10-02 12:28:15.863486,2023-10-02 12:28:17.740138,0 days 00:00:01.876652,1.0569792752995442e-05,500,sag,COMPLETE
5065,0.649579648433235,2023-10-02 12:28:17.742141,2023-10-02 12:28:18.040384,0 days 00:00:00.298243,140.08064550685356,340,sag,COMPLETE
5066,0.6020853805000546,2023-10-02 12:28:18.040384,2023-10-02 12:28:18.412640,0 days 00:00:00.372256,1.7251898941535868,480,sag,COMPLETE
5067,0.6449939949776177,2023-10-02 12:28:18.415637,2023-10-02 12:28:18.754236,0 days 00:00:00.338599,1026.0014764127313,310,sag,COMPLETE
5068,0.6534556174254831,2023-10-02 12:28:18.756246,2023-10-02 12:28:19.121520,0 days 00:00:00.365274,92.54629476976302,330,sag,COMPLETE
5069,0.6449939949776177,2023-10-02 12:28:19.122965,2023-10-02 12:28:19.453870,0 days 00:00:00.330905,15403.818094839477,490,sag,COMPLETE
5070,0.6541653018888526,2023-10-02 12:28:19.453870,2023-10-02 12:28:19.729290,0 days 00:00:00.275420,30.862939810880228,350,sag,COMPLETE
5071,0.5,2023-10-02 12:28:19.731290,2023-10-02 12:28:20.040012,0 days 00:00:00.308722,0.19477591628631336,500,sag,COMPLETE
5072,0.5,2023-10-02 12:28:20.040012,2023-10-02 12:28:20.300355,0 days 00:00:00.260343,0.0028522699996166596,450,lbfgs,COMPLETE
5073,0.669996724533246,2023-10-02 12:28:20.301355,2023-10-02 12:28:20.698193,0 days 00:00:00.396838,10423.860198333454,490,sag,COMPLETE
5074,0.666120755540998,2023-10-02 12:28:20.698193,2023-10-02 12:28:21.031001,0 days 00:00:00.332808,7931.856341713038,490,sag,COMPLETE
5075,0.666120755540998,2023-10-02 12:28:21.031001,2023-10-02 12:28:21.439279,0 days 00:00:00.408278,5084.001605410374,500,sag,COMPLETE
5076,0.666120755540998,2023-10-02 12:28:21.441276,2023-10-02 12:28:21.764489,0 days 00:00:00.323213,7894.865239623835,490,sag,COMPLETE
5077,0.6449939949776177,2023-10-02 12:28:21.764489,2023-10-02 12:28:22.098422,0 days 00:00:00.333933,10243.56680108912,500,sag,COMPLETE
5078,0.6520362484987444,2023-10-02 12:28:22.100422,2023-10-02 12:28:22.504424,0 days 00:00:00.404002,5683.619024625864,490,sag,COMPLETE
5079,0.6411180259853696,2023-10-02 12:28:22.505933,2023-10-02 12:28:22.850304,0 days 00:00:00.344371,9624.17460570384,490,sag,COMPLETE
5080,0.6590785020198712,2023-10-02 12:28:22.851447,2023-10-02 12:28:23.267479,0 days 00:00:00.416032,3791.9997045191653,500,sag,COMPLETE
5081,0.6481602795064964,2023-10-02 12:28:23.269470,2023-10-02 12:28:23.618411,0 days 00:00:00.348941,5456.56434916842,490,sag,COMPLETE
5082,0.6520362484987444,2023-10-02 12:28:23.620410,2023-10-02 12:28:23.937867,0 days 00:00:00.317457,12065.960636968965,500,sag,COMPLETE
5083,0.6481602795064964,2023-10-02 12:28:23.953506,2023-10-02 12:28:24.397121,0 days 00:00:00.443615,7425.750670586463,490,sag,COMPLETE
5084,0.6590785020198712,2023-10-02 12:28:24.399121,2023-10-02 12:28:24.724592,0 days 00:00:00.325471,11333.873212542974,500,sag,COMPLETE
5085,0.6309094879353642,2023-10-02 12:28:24.724592,2023-10-02 12:28:25.084860,0 days 00:00:00.360268,4057.4245584091905,490,newton-cg,COMPLETE
5086,0.637951741456491,2023-10-02 12:28:25.086858,2023-10-02 12:28:25.339749,0 days 00:00:00.252891,6613.502167262347,490,liblinear,COMPLETE
5087,0.669996724533246,2023-10-02 12:28:25.341796,2023-10-02 12:28:25.689451,0 days 00:00:00.347655,10603.957664012434,500,sag,COMPLETE
5088,0.6590785020198712,2023-10-02 12:28:25.691122,2023-10-02 12:28:26.153671,0 days 00:00:00.462549,4965.61580846203,500,sag,COMPLETE
5089,0.6449939949776177,2023-10-02 12:28:26.153671,2023-10-02 12:28:26.531473,0 days 00:00:00.377802,3439.234876468521,500,sag,COMPLETE
5090,0.6552025330276231,2023-10-02 12:28:26.533268,2023-10-02 12:28:26.947586,0 days 00:00:00.414318,7169.18303811208,500,sag,COMPLETE
5091,0.6520362484987444,2023-10-02 12:28:26.947586,2023-10-02 12:28:27.301688,0 days 00:00:00.354102,5279.817737802198,500,sag,COMPLETE
5092,0.6520362484987444,2023-10-02 12:28:27.303687,2023-10-02 12:28:27.659793,0 days 00:00:00.356106,8326.201922514316,500,sag,COMPLETE
5093,0.6520362484987444,2023-10-02 12:28:27.661799,2023-10-02 12:28:28.079067,0 days 00:00:00.417268,2688.618984107857,500,sag,COMPLETE
5094,0.6449939949776177,2023-10-02 12:28:28.079067,2023-10-02 12:28:28.419618,0 days 00:00:00.340551,10639.168184291793,500,sag,COMPLETE
5095,0.6520362484987444,2023-10-02 12:28:28.421618,2023-10-02 12:28:28.842867,0 days 00:00:00.421249,4462.467560320725,500,sag,COMPLETE
5096,0.6520362484987444,2023-10-02 12:28:28.857691,2023-10-02 12:28:29.185411,0 days 00:00:00.327720,6732.918250139367,500,sag,COMPLETE
5097,0.6481602795064964,2023-10-02 12:28:29.185411,2023-10-02 12:28:29.525244,0 days 00:00:00.339833,9592.291602988067,500,sag,COMPLETE
5098,0.637951741456491,2023-10-02 12:28:29.525244,2023-10-02 12:28:29.934388,0 days 00:00:00.409144,6026.534975759913,500,lbfgs,COMPLETE
5099,0.6590785020198712,2023-10-02 12:28:29.934388,2023-10-02 12:28:30.264315,0 days 00:00:00.329927,10855.915093581196,500,sag,COMPLETE
5100,0.6590785020198712,2023-10-02 12:28:30.264315,2023-10-02 12:28:30.727738,0 days 00:00:00.463423,3530.0923892089154,500,sag,COMPLETE
5101,0.6449939949776177,2023-10-02 12:28:30.729738,2023-10-02 12:28:31.187829,0 days 00:00:00.458091,11570.47518696416,500,sag,COMPLETE
5102,0.637951741456491,2023-10-02 12:28:31.189825,2023-10-02 12:28:31.661328,0 days 00:00:00.471503,1859.4856090293297,500,sag,COMPLETE
5103,0.6590785020198712,2023-10-02 12:28:31.662327,2023-10-02 12:28:32.008971,0 days 00:00:00.346644,2926.077537803909,500,sag,COMPLETE
5104,0.6520362484987444,2023-10-02 12:28:32.008971,2023-10-02 12:28:32.349117,0 days 00:00:00.340146,6600.480082586555,500,sag,COMPLETE
5105,0.6520362484987444,2023-10-02 12:28:32.364743,2023-10-02 12:28:32.785106,0 days 00:00:00.420363,12970.153897077282,500,sag,COMPLETE
5106,0.666120755540998,2023-10-02 12:28:32.786680,2023-10-02 12:28:33.156963,0 days 00:00:00.370283,5224.673829460982,490,sag,COMPLETE
5107,0.5,2023-10-02 12:28:33.156963,2023-10-02 12:28:33.560611,0 days 00:00:00.403648,0.08264342035273431,490,sag,COMPLETE
5108,0.6238672344142374,2023-10-02 12:28:33.560611,2023-10-02 12:28:33.827367,0 days 00:00:00.266756,2260.341347958543,500,newton-cg,COMPLETE
5109,0.6590785020198712,2023-10-02 12:28:33.827367,2023-10-02 12:28:34.181532,0 days 00:00:00.354165,9142.83721336685,500,sag,COMPLETE
5110,0.6520362484987444,2023-10-02 12:28:34.182532,2023-10-02 12:28:34.594705,0 days 00:00:00.412173,3847.874342991152,490,sag,COMPLETE
5111,0.6133311496888305,2023-10-02 12:28:34.596701,2023-10-02 12:28:34.848436,0 days 00:00:00.251735,6.915700492018987,490,sag,COMPLETE
5112,0.5,2023-10-02 12:28:34.849437,2023-10-02 12:28:35.183244,0 days 00:00:00.333807,0.020949176102068107,500,liblinear,COMPLETE
5113,0.6590785020198712,2023-10-02 12:28:35.184752,2023-10-02 12:28:35.531337,0 days 00:00:00.346585,13162.421457378272,490,sag,COMPLETE
5114,0.6520362484987444,2023-10-02 12:28:35.533342,2023-10-02 12:28:35.961557,0 days 00:00:00.428215,8059.751303703987,500,sag,COMPLETE
5115,0.6559122174909924,2023-10-02 12:28:35.961557,2023-10-02 12:28:36.294968,0 days 00:00:00.333411,14989.067894764385,490,sag,COMPLETE
5116,0.666120755540998,2023-10-02 12:28:36.294968,2023-10-02 12:28:36.653405,0 days 00:00:00.358437,4151.578069267641,490,sag,COMPLETE
5117,0.669996724533246,2023-10-02 12:28:36.655401,2023-10-02 12:28:37.186216,0 days 00:00:00.530815,10102.416716350263,500,sag,COMPLETE
5118,0.6590785020198712,2023-10-02 12:28:37.195424,2023-10-02 12:28:37.559384,0 days 00:00:00.363960,1590.1228599883643,500,sag,COMPLETE
5119,0.6590785020198712,2023-10-02 12:28:37.561199,2023-10-02 12:28:37.994611,0 days 00:00:00.433412,6695.724246892906,490,sag,COMPLETE
5120,0.6552025330276231,2023-10-02 12:28:37.994611,2023-10-02 12:28:38.342237,0 days 00:00:00.347626,15848.962359313697,490,sag,COMPLETE
5121,0.5,2023-10-02 12:28:38.343237,2023-10-02 12:28:38.676692,0 days 00:00:00.333455,0.005159408800406299,500,lbfgs,COMPLETE
5122,0.5,2023-10-02 12:28:38.678776,2023-10-02 12:28:38.949472,0 days 00:00:00.270696,0.33630126421293466,490,sag,COMPLETE
5123,0.6590785020198712,2023-10-02 12:28:38.951471,2023-10-02 12:28:39.299219,0 days 00:00:00.347748,5094.8718949786,490,sag,COMPLETE
5124,0.5,2023-10-02 12:28:39.301219,2023-10-02 12:28:40.272359,0 days 00:00:00.971140,2.0135091484001977e-05,500,sag,COMPLETE
5125,0.6449939949776177,2023-10-02 12:28:40.273360,2023-10-02 12:28:40.603741,0 days 00:00:00.330381,2672.791854440099,500,sag,COMPLETE
5126,0.5,2023-10-02 12:28:40.605740,2023-10-02 12:28:40.985451,0 days 00:00:00.379711,0.00016039222330775817,490,sag,COMPLETE
5127,0.6449939949776177,2023-10-02 12:28:40.987451,2023-10-02 12:28:41.322152,0 days 00:00:00.334701,1207.9974598906674,500,sag,COMPLETE
5128,0.666120755540998,2023-10-02 12:28:41.324152,2023-10-02 12:28:41.729450,0 days 00:00:00.405298,15143.604004693274,490,sag,COMPLETE
5129,0.604541980565564,2023-10-02 12:28:41.729450,2023-10-02 12:28:41.993494,0 days 00:00:00.264044,3.175135759053224,490,sag,COMPLETE
5130,0.5,2023-10-02 12:28:41.995498,2023-10-02 12:28:42.259740,0 days 00:00:00.264242,0.007755550710548683,500,sag,COMPLETE
5131,0.6590785020198712,2023-10-02 12:28:42.261740,2023-10-02 12:28:42.663162,0 days 00:00:00.401422,8031.136208799812,490,sag,COMPLETE
5132,0.5,2023-10-02 12:28:42.663162,2023-10-02 12:28:42.947670,0 days 00:00:00.284508,0.00042351183759983466,500,sag,COMPLETE
5133,0.6316191723987334,2023-10-02 12:28:42.947670,2023-10-02 12:28:43.330096,0 days 00:00:00.382426,554.3534681717487,490,newton-cg,COMPLETE
5134,0.5,2023-10-02 12:28:43.330096,2023-10-02 12:28:43.590867,0 days 00:00:00.260771,0.06944224755528684,500,sag,COMPLETE
5135,0.6449939949776177,2023-10-02 12:28:43.591866,2023-10-02 12:28:43.997018,0 days 00:00:00.405152,13457.740477576815,490,sag,COMPLETE
5136,0.637951741456491,2023-10-02 12:28:44.012029,2023-10-02 12:28:44.263883,0 days 00:00:00.251854,5094.8604212174,480,liblinear,COMPLETE
5137,0.666120755540998,2023-10-02 12:28:44.263883,2023-10-02 12:28:44.613947,0 days 00:00:00.350064,8155.855843104004,490,sag,COMPLETE
5138,0.6449939949776177,2023-10-02 12:28:44.613947,2023-10-02 12:28:45.062554,0 days 00:00:00.448607,3038.188850587445,500,sag,COMPLETE
5139,0.6101648651599519,2023-10-02 12:28:45.064518,2023-10-02 12:28:45.298635,0 days 00:00:00.234117,5.280555664407727,480,sag,COMPLETE
5140,0.666120755540998,2023-10-02 12:28:45.315389,2023-10-02 12:28:45.754979,0 days 00:00:00.439590,13970.786869195414,500,sag,COMPLETE
5141,0.6449939949776177,2023-10-02 12:28:45.756978,2023-10-02 12:28:46.099129,0 days 00:00:00.342151,9595.635072848852,490,sag,COMPLETE
5142,0.5,2023-10-02 12:28:46.099129,2023-10-02 12:28:46.817885,0 days 00:00:00.718756,4.304679564612223e-05,480,sag,COMPLETE
5143,0.6062888961677039,2023-10-02 12:28:46.817885,2023-10-02 12:28:47.150034,0 days 00:00:00.332149,6.6332232526086905,490,sag,COMPLETE
5144,0.6559122174909924,2023-10-02 12:28:47.150034,2023-10-02 12:28:47.501450,0 days 00:00:00.351416,2034.8457417439356,500,sag,COMPLETE
5145,0.6418277104487389,2023-10-02 12:28:47.501450,2023-10-02 12:28:47.928183,0 days 00:00:00.426733,354.2746758797296,480,sag,COMPLETE
5146,0.6069985806310733,2023-10-02 12:28:47.928183,2023-10-02 12:28:48.214197,0 days 00:00:00.286014,4.91391698035169,250,sag,COMPLETE
5147,0.637951741456491,2023-10-02 12:28:48.216203,2023-10-02 12:28:48.626770,0 days 00:00:00.410567,17354.436781963897,500,lbfgs,COMPLETE
5148,0.6590785020198712,2023-10-02 12:28:48.628770,2023-10-02 12:28:48.984505,0 days 00:00:00.355735,5702.3785571864055,490,sag,COMPLETE
5149,0.6534556174254831,2023-10-02 12:28:48.986498,2023-10-02 12:28:49.330636,0 days 00:00:00.344138,89.94704326430612,490,sag,COMPLETE
5150,0.6559122174909924,2023-10-02 12:28:49.330636,2023-10-02 12:28:49.660076,0 days 00:00:00.329440,3903.490739960333,480,sag,COMPLETE
5151,0.5,2023-10-02 12:28:49.660076,2023-10-02 12:28:50.029371,0 days 00:00:00.369295,0.00010602750663919335,320,sag,COMPLETE
5152,0.669996724533246,2023-10-02 12:28:50.031369,2023-10-02 12:28:50.462903,0 days 00:00:00.431534,15991.6061650095,500,sag,COMPLETE
5153,0.5,2023-10-02 12:28:50.463903,2023-10-02 12:28:50.699730,0 days 00:00:00.235827,0.02087664210120938,480,sag,COMPLETE
5154,0.6481602795064964,2023-10-02 12:28:50.699730,2023-10-02 12:28:51.079449,0 days 00:00:00.379719,8917.18421812238,350,sag,COMPLETE
5155,0.6418277104487389,2023-10-02 12:28:51.079449,2023-10-02 12:28:51.421063,0 days 00:00:00.341614,307.05809782723867,490,sag,COMPLETE
5156,0.5,2023-10-02 12:28:51.422064,2023-10-02 12:28:51.788475,0 days 00:00:00.366411,0.00041292844156353364,340,sag,COMPLETE
5157,0.6449939949776177,2023-10-02 12:28:51.790469,2023-10-02 12:28:52.152762,0 days 00:00:00.362293,1343.4498018683726,500,sag,COMPLETE
5158,0.637951741456491,2023-10-02 12:28:52.154840,2023-10-02 12:28:52.435156,0 days 00:00:00.280316,6531.228080338287,480,newton-cg,COMPLETE
5159,0.634075772464243,2023-10-02 12:28:52.435992,2023-10-02 12:28:52.853657,0 days 00:00:00.417665,16469.60272522728,490,sag,COMPLETE
5160,0.6267059722677149,2023-10-02 12:28:52.853657,2023-10-02 12:28:53.110680,0 days 00:00:00.257023,11.407122909263748,500,sag,COMPLETE
5161,0.6449939949776177,2023-10-02 12:28:53.110680,2023-10-02 12:28:53.523612,0 days 00:00:00.412932,3664.47492408328,480,sag,COMPLETE
5162,0.637951741456491,2023-10-02 12:28:53.525605,2023-10-02 12:28:53.767394,0 days 00:00:00.241789,9956.785664756302,490,liblinear,COMPLETE
5163,0.637951741456491,2023-10-02 12:28:53.767394,2023-10-02 12:28:54.192578,0 days 00:00:00.425184,716.4356792538439,350,sag,COMPLETE
5164,0.6573315864177312,2023-10-02 12:28:54.194578,2023-10-02 12:28:54.468030,0 days 00:00:00.273452,36.95675412786392,500,sag,COMPLETE
5165,0.5,2023-10-02 12:28:54.468030,2023-10-02 12:28:54.744674,0 days 00:00:00.276644,0.07705386719356329,330,sag,COMPLETE
5166,0.5943334425155585,2023-10-02 12:28:54.744674,2023-10-02 12:28:55.119120,0 days 00:00:00.374446,1.9967188229979314,490,sag,COMPLETE
5167,0.5,2023-10-02 12:28:55.119120,2023-10-02 12:28:55.389461,0 days 00:00:00.270341,0.0008111155414470032,410,sag,COMPLETE
5168,0.666120755540998,2023-10-02 12:28:55.389461,2023-10-02 12:28:55.806811,0 days 00:00:00.417350,19611.606007952676,480,sag,COMPLETE
5169,0.6629544710121192,2023-10-02 12:28:55.806811,2023-10-02 12:28:56.136282,0 days 00:00:00.329471,11006.40720450035,500,sag,COMPLETE
5170,0.666120755540998,2023-10-02 12:28:56.136282,2023-10-02 12:28:56.552741,0 days 00:00:00.416459,5641.532193664731,480,sag,COMPLETE
5171,0.6238672344142374,2023-10-02 12:28:56.552741,2023-10-02 12:28:56.858563,0 days 00:00:00.305822,2153.3637287197716,390,lbfgs,COMPLETE
5172,0.6449939949776177,2023-10-02 12:28:56.858563,2023-10-02 12:28:57.297551,0 days 00:00:00.438988,19934.92413379386,490,sag,COMPLETE
5173,0.6534556174254831,2023-10-02 12:28:57.298537,2023-10-02 12:28:57.581422,0 days 00:00:00.282885,45.73884025933369,500,sag,COMPLETE
5174,0.6471230483677258,2023-10-02 12:28:57.583416,2023-10-02 12:28:57.856622,0 days 00:00:00.273206,27.810026086000953,340,sag,COMPLETE
5175,0.6590785020198712,2023-10-02 12:28:57.856622,2023-10-02 12:28:58.338870,0 days 00:00:00.482248,19388.13972193295,350,sag,COMPLETE
5176,0.6520362484987444,2023-10-02 12:28:58.340445,2023-10-02 12:28:58.846116,0 days 00:00:00.505671,3150.4302922886986,490,sag,COMPLETE
5177,0.5,2023-10-02 12:28:58.848121,2023-10-02 12:28:59.234323,0 days 00:00:00.386202,0.14618803774919684,480,sag,COMPLETE
5178,0.6520362484987444,2023-10-02 12:28:59.239781,2023-10-02 12:28:59.725261,0 days 00:00:00.485480,7931.409868616734,500,sag,COMPLETE
5179,0.6590785020198712,2023-10-02 12:28:59.727260,2023-10-02 12:29:00.221350,0 days 00:00:00.494090,11670.577816129786,490,sag,COMPLETE
5180,0.6267059722677149,2023-10-02 12:29:00.223355,2023-10-02 12:29:00.521940,0 days 00:00:00.298585,11.532840903437512,330,sag,COMPLETE
5181,0.6077082650944426,2023-10-02 12:29:00.523844,2023-10-02 12:29:00.803911,0 days 00:00:00.280067,3.691291143524787,390,sag,COMPLETE
5182,0.637951741456491,2023-10-02 12:29:00.804335,2023-10-02 12:29:01.170708,0 days 00:00:00.366373,6140.141587770187,480,newton-cg,COMPLETE
5183,0.5619609127634021,2023-10-02 12:29:01.171485,2023-10-02 12:29:01.412295,0 days 00:00:00.240810,0.9904542431024329,500,sag,COMPLETE
5184,0.6590785020198712,2023-10-02 12:29:01.412295,2023-10-02 12:29:01.821231,0 days 00:00:00.408936,4470.734135289163,490,sag,COMPLETE
5185,0.5,2023-10-02 12:29:01.821231,2023-10-02 12:29:02.213256,0 days 00:00:00.392025,8.253227444623744e-05,350,sag,COMPLETE
5186,0.5,2023-10-02 12:29:02.213256,2023-10-02 12:29:02.535079,0 days 00:00:00.321823,0.20888994177824596,480,liblinear,COMPLETE
5187,0.6520362484987444,2023-10-02 12:29:02.535079,2023-10-02 12:29:02.853342,0 days 00:00:00.318263,21494.012780207,340,sag,COMPLETE
5188,0.6534556174254831,2023-10-02 12:29:02.855343,2023-10-02 12:29:03.114769,0 days 00:00:00.259426,52.264942379509506,290,sag,COMPLETE
5189,0.6629544710121192,2023-10-02 12:29:03.114769,2023-10-02 12:29:03.538719,0 days 00:00:00.423950,11984.762234160184,500,sag,COMPLETE
5190,0.5,2023-10-02 12:29:03.538719,2023-10-02 12:29:03.797558,0 days 00:00:00.258839,0.02014554099989778,490,sag,COMPLETE
5191,0.637951741456491,2023-10-02 12:29:03.799559,2023-10-02 12:29:04.200917,0 days 00:00:00.401358,602.7870200391741,480,sag,COMPLETE
5192,0.6520362484987444,2023-10-02 12:29:04.200917,2023-10-02 12:29:04.549065,0 days 00:00:00.348148,2337.6706138610616,490,sag,COMPLETE
5193,0.6418277104487389,2023-10-02 12:29:04.550065,2023-10-02 12:29:04.959636,0 days 00:00:00.409571,471.1723902571349,500,sag,COMPLETE
5194,0.6590785020198712,2023-10-02 12:29:04.960650,2023-10-02 12:29:05.297042,0 days 00:00:00.336392,17112.31790502104,480,sag,COMPLETE
5195,0.637951741456491,2023-10-02 12:29:05.299036,2023-10-02 12:29:05.587995,0 days 00:00:00.288959,8821.094037798019,350,lbfgs,COMPLETE
5196,0.5,2023-10-02 12:29:05.587995,2023-10-02 12:29:06.403804,0 days 00:00:00.815809,2.3595342009702816e-05,310,sag,COMPLETE
5197,0.608417949557812,2023-10-02 12:29:06.403804,2023-10-02 12:29:06.655059,0 days 00:00:00.251255,2.722323206494144,490,sag,COMPLETE
5198,0.5,2023-10-02 12:29:06.655059,2023-10-02 12:29:07.621732,0 days 00:00:00.966673,1.8944438123162817e-05,500,sag,COMPLETE
5199,0.5690031662845288,2023-10-02 12:29:07.621732,2023-10-02 12:29:07.847279,0 days 00:00:00.225547,1.006736933912888,320,sag,COMPLETE
