number,value,datetime_start,datetime_complete,duration,params_C,params_max_iter,params_solver,state
9275,0.6520362484987444,2023-10-02 13:02:06.169484,2023-10-02 13:02:06.656564,0 days 00:00:00.487080,8935.291697350447,160,sag,COMPLETE
9276,0.6520362484987444,2023-10-02 13:02:06.656564,2023-10-02 13:02:07.284053,0 days 00:00:00.627489,30629.937984241093,480,sag,COMPLETE
9277,0.6520362484987444,2023-10-02 13:02:07.284053,2023-10-02 13:02:07.911801,0 days 00:00:00.627748,4434.372581862897,400,sag,COMPLETE
9278,0.666120755540998,2023-10-02 13:02:07.911801,2023-10-02 13:02:08.537414,0 days 00:00:00.625613,69991.69223016444,470,sag,COMPLETE
9279,0.5,2023-10-02 13:02:08.537414,2023-10-02 13:02:09.103750,0 days 00:00:00.566336,0.0006497654270547625,350,sag,COMPLETE
9280,0.6449939949776177,2023-10-02 13:02:09.103750,2023-10-02 13:02:09.651622,0 days 00:00:00.547872,20398.42949215564,500,sag,COMPLETE
9281,0.637951741456491,2023-10-02 13:02:09.667252,2023-10-02 13:02:10.249078,0 days 00:00:00.581826,29010.112070678595,380,lbfgs,COMPLETE
9282,0.6520362484987444,2023-10-02 13:02:10.249078,2023-10-02 13:02:10.906872,0 days 00:00:00.657794,5998.935392127344,490,saga,COMPLETE
9283,0.6559122174909924,2023-10-02 13:02:10.906872,2023-10-02 13:02:11.503763,0 days 00:00:00.596891,47817.548137196434,340,sag,COMPLETE
9284,0.6590785020198712,2023-10-02 13:02:11.519405,2023-10-02 13:02:12.131131,0 days 00:00:00.611726,11270.325826128146,450,sag,COMPLETE
9285,0.6590785020198712,2023-10-02 13:02:12.131131,2023-10-02 13:02:12.744126,0 days 00:00:00.612995,1971.7828634176708,290,sag,COMPLETE
9286,0.6203734032099574,2023-10-02 13:02:12.744126,2023-10-02 13:02:13.197699,0 days 00:00:00.453573,8.173033962171647,480,sag,COMPLETE
9287,0.5,2023-10-02 13:02:13.197699,2023-10-02 13:02:13.746808,0 days 00:00:00.549109,0.20255571361214358,370,sag,COMPLETE
9288,0.6520362484987444,2023-10-02 13:02:13.762430,2023-10-02 13:02:14.420484,0 days 00:00:00.658054,66600.25051839105,470,sag,COMPLETE
9289,0.608417949557812,2023-10-02 13:02:14.420484,2023-10-02 13:02:14.970847,0 days 00:00:00.550363,2.883009045813442,500,sag,COMPLETE
9290,0.6629544710121192,2023-10-02 13:02:14.986471,2023-10-02 13:02:15.582087,0 days 00:00:00.595616,35908.79447664944,360,sag,COMPLETE
9291,0.6534556174254831,2023-10-02 13:02:15.582087,2023-10-02 13:02:16.147031,0 days 00:00:00.564944,137.901196808832,410,newton-cg,COMPLETE
9292,0.6590785020198712,2023-10-02 13:02:16.147031,2023-10-02 13:02:16.704826,0 days 00:00:00.557795,3788.831335321738,490,sag,COMPLETE
9293,0.6133311496888305,2023-10-02 13:02:16.704826,2023-10-02 13:02:17.260306,0 days 00:00:00.555480,6.908193058546148,350,sag,COMPLETE
9294,0.5,2023-10-02 13:02:17.260306,2023-10-02 13:02:17.810834,0 days 00:00:00.550528,0.13165471834191636,450,sag,COMPLETE
9295,0.5,2023-10-02 13:02:17.810834,2023-10-02 13:02:18.357484,0 days 00:00:00.546650,0.000794450309998523,440,liblinear,COMPLETE
9296,0.6449939949776177,2023-10-02 13:02:18.357484,2023-10-02 13:02:18.969149,0 days 00:00:00.611665,17987.09498992966,370,sag,COMPLETE
9297,0.637951741456491,2023-10-02 13:02:18.984782,2023-10-02 13:02:19.520365,0 days 00:00:00.535583,7604.24153829056,480,sag,COMPLETE
9298,0.6488699639698657,2023-10-02 13:02:19.536141,2023-10-02 13:02:20.133137,0 days 00:00:00.596996,48201.44073359308,380,sag,COMPLETE
9299,0.5855442733922918,2023-10-02 13:02:20.133137,2023-10-02 13:02:20.680191,0 days 00:00:00.547054,1.249571885961671,390,sag,COMPLETE
9300,0.6520362484987444,2023-10-02 13:02:20.680191,2023-10-02 13:02:21.317920,0 days 00:00:00.637729,69309.34173435958,490,sag,COMPLETE
9301,0.5,2023-10-02 13:02:21.317920,2023-10-02 13:02:21.856754,0 days 00:00:00.538834,0.003737267174651105,330,sag,COMPLETE
9302,0.5,2023-10-02 13:02:21.872370,2023-10-02 13:02:22.424039,0 days 00:00:00.551669,0.030876165485325124,460,sag,COMPLETE
9303,0.666120755540998,2023-10-02 13:02:22.424039,2023-10-02 13:02:22.939097,0 days 00:00:00.515058,12079.24430091713,420,sag,COMPLETE
9304,0.5,2023-10-02 13:02:22.954524,2023-10-02 13:02:23.511478,0 days 00:00:00.556954,0.0002743358595803763,480,lbfgs,COMPLETE
9305,0.5,2023-10-02 13:02:23.511478,2023-10-02 13:02:24.066991,0 days 00:00:00.555513,0.007366989837381,500,sag,COMPLETE
9306,0.5,2023-10-02 13:02:24.066991,2023-10-02 13:02:24.602552,0 days 00:00:00.535561,0.01760884657783235,340,sag,COMPLETE
9307,0.6520362484987444,2023-10-02 13:02:24.613605,2023-10-02 13:02:25.217183,0 days 00:00:00.603578,27526.63579260945,360,sag,COMPLETE
9308,0.6520362484987444,2023-10-02 13:02:25.232825,2023-10-02 13:02:25.777797,0 days 00:00:00.544972,99055.1405432962,470,saga,COMPLETE
9309,0.6534556174254831,2023-10-02 13:02:25.777797,2023-10-02 13:02:26.341909,0 days 00:00:00.564112,50.54351476375669,440,sag,COMPLETE
9310,0.6449939949776177,2023-10-02 13:02:26.341909,2023-10-02 13:02:27.002269,0 days 00:00:00.660360,1036.1866543025405,490,sag,COMPLETE
9311,0.637951741456491,2023-10-02 13:02:27.002269,2023-10-02 13:02:27.628767,0 days 00:00:00.626498,3247.4323177100346,500,sag,COMPLETE
9312,0.6590785020198712,2023-10-02 13:02:27.628767,2023-10-02 13:02:28.241626,0 days 00:00:00.612859,17511.80741850809,350,sag,COMPLETE
9313,0.5313352986133857,2023-10-02 13:02:28.241626,2023-10-02 13:02:28.694480,0 days 00:00:00.452854,0.521247719347922,480,sag,COMPLETE
9314,0.5,2023-10-02 13:02:28.694480,2023-10-02 13:02:29.245210,0 days 00:00:00.550730,0.0010531924652082629,460,sag,COMPLETE
9315,0.6590785020198712,2023-10-02 13:02:29.260818,2023-10-02 13:02:29.862956,0 days 00:00:00.602138,6040.834984008212,370,sag,COMPLETE
9316,0.5478764057211486,2023-10-02 13:02:29.862956,2023-10-02 13:02:30.424680,0 days 00:00:00.561724,0.7807859799924411,400,sag,COMPLETE
9317,0.6559122174909924,2023-10-02 13:02:30.424680,2023-10-02 13:02:31.046903,0 days 00:00:00.622223,34106.58589769872,380,sag,COMPLETE
9318,0.528169014084507,2023-10-02 13:02:31.046903,2023-10-02 13:02:31.518255,0 days 00:00:00.471352,0.379103325564347,430,newton-cg,COMPLETE
9319,0.6707064089966154,2023-10-02 13:02:31.527278,2023-10-02 13:02:32.161773,0 days 00:00:00.634495,99212.4664317783,470,sag,COMPLETE
9320,0.6520362484987444,2023-10-02 13:02:32.161773,2023-10-02 13:02:32.806180,0 days 00:00:00.644407,96164.43218265937,470,sag,COMPLETE
9321,0.637951741456491,2023-10-02 13:02:32.806180,2023-10-02 13:02:33.355316,0 days 00:00:00.549136,74974.42108929896,460,liblinear,COMPLETE
9322,0.6520362484987444,2023-10-02 13:02:33.355316,2023-10-02 13:02:33.983100,0 days 00:00:00.627784,73387.62769234827,460,sag,COMPLETE
9323,0.669996724533246,2023-10-02 13:02:33.998932,2023-10-02 13:02:34.531635,0 days 00:00:00.532703,70524.88574824219,470,sag,COMPLETE
9324,0.6449939949776177,2023-10-02 13:02:34.531635,2023-10-02 13:02:35.175461,0 days 00:00:00.643826,72392.59471176652,470,sag,COMPLETE
9325,0.6559122174909924,2023-10-02 13:02:35.175461,2023-10-02 13:02:35.817975,0 days 00:00:00.642514,99826.18812074781,480,sag,COMPLETE
9326,0.6590785020198712,2023-10-02 13:02:35.817975,2023-10-02 13:02:36.445588,0 days 00:00:00.627613,65280.15591110713,470,sag,COMPLETE
9327,0.6590785020198712,2023-10-02 13:02:36.445588,2023-10-02 13:02:37.087120,0 days 00:00:00.641532,68918.34379388572,470,sag,COMPLETE
9328,0.666120755540998,2023-10-02 13:02:37.087120,2023-10-02 13:02:37.621885,0 days 00:00:00.534765,73130.053808121,470,sag,COMPLETE
9329,0.666120755540998,2023-10-02 13:02:37.621885,2023-10-02 13:02:38.250739,0 days 00:00:00.628854,96098.77120728958,470,sag,COMPLETE
9330,0.6449939949776177,2023-10-02 13:02:38.250739,2023-10-02 13:02:38.877076,0 days 00:00:00.626337,73029.16626303822,460,sag,COMPLETE
9331,0.6629544710121192,2023-10-02 13:02:38.877076,2023-10-02 13:02:39.513057,0 days 00:00:00.635981,57910.27022371802,470,sag,COMPLETE
9332,0.637951741456491,2023-10-02 13:02:39.513057,2023-10-02 13:02:40.042478,0 days 00:00:00.529421,95846.81397495979,470,lbfgs,COMPLETE
9333,0.6442843105142483,2023-10-02 13:02:40.042478,2023-10-02 13:02:40.695797,0 days 00:00:00.653319,67945.80021429768,460,saga,COMPLETE
9334,0.6520362484987444,2023-10-02 13:02:40.695797,2023-10-02 13:02:41.345517,0 days 00:00:00.649720,67516.17671259819,470,sag,COMPLETE
9335,0.6590785020198712,2023-10-02 13:02:41.345517,2023-10-02 13:02:41.981364,0 days 00:00:00.635847,51959.08059733962,470,sag,COMPLETE
9336,0.6590785020198712,2023-10-02 13:02:41.997003,2023-10-02 13:02:42.611023,0 days 00:00:00.614020,53397.62224817002,460,sag,COMPLETE
9337,0.6449939949776177,2023-10-02 13:02:42.626734,2023-10-02 13:02:43.249869,0 days 00:00:00.623135,68046.54531188615,460,sag,COMPLETE
9338,0.6559122174909924,2023-10-02 13:02:43.249869,2023-10-02 13:02:43.771933,0 days 00:00:00.522064,97647.50571441754,470,sag,COMPLETE
9339,0.6520362484987444,2023-10-02 13:02:43.787435,2023-10-02 13:02:44.412648,0 days 00:00:00.625213,96413.82717918664,470,sag,COMPLETE
9340,0.6590785020198712,2023-10-02 13:02:44.412648,2023-10-02 13:02:45.041363,0 days 00:00:00.628715,47852.59480368834,460,sag,COMPLETE
9341,0.6590785020198712,2023-10-02 13:02:45.052875,2023-10-02 13:02:45.683993,0 days 00:00:00.631118,50440.58972956423,470,sag,COMPLETE
9342,0.6411180259853696,2023-10-02 13:02:45.683993,2023-10-02 13:02:46.313370,0 days 00:00:00.629377,68607.44696715326,460,sag,COMPLETE
9343,0.6590785020198712,2023-10-02 13:02:46.313370,2023-10-02 13:02:46.844975,0 days 00:00:00.531605,48696.197831344354,480,sag,COMPLETE
9344,0.6449939949776177,2023-10-02 13:02:46.855522,2023-10-02 13:02:47.411018,0 days 00:00:00.555496,99202.87430548717,470,newton-cg,COMPLETE
9345,0.6449939949776177,2023-10-02 13:02:47.426643,2023-10-02 13:02:48.052466,0 days 00:00:00.625823,46627.35595355452,470,sag,COMPLETE
9346,0.6449939949776177,2023-10-02 13:02:48.059001,2023-10-02 13:02:48.727190,0 days 00:00:00.668189,48115.071904331446,460,sag,COMPLETE
9347,0.637951741456491,2023-10-02 13:02:48.727190,2023-10-02 13:02:49.275946,0 days 00:00:00.548756,71572.06840570999,470,liblinear,COMPLETE
9348,0.666120755540998,2023-10-02 13:02:49.275946,2023-10-02 13:02:49.810790,0 days 00:00:00.534844,70637.56274968083,460,sag,COMPLETE
9349,0.6520362484987444,2023-10-02 13:02:49.810790,2023-10-02 13:02:50.437462,0 days 00:00:00.626672,51077.96792939643,460,sag,COMPLETE
9350,0.666120755540998,2023-10-02 13:02:50.437462,2023-10-02 13:02:51.080921,0 days 00:00:00.643459,98715.19765735918,470,sag,COMPLETE
9351,0.6449939949776177,2023-10-02 13:02:51.080921,2023-10-02 13:02:51.723240,0 days 00:00:00.642319,96810.16075151891,470,sag,COMPLETE
9352,0.6590785020198712,2023-10-02 13:02:51.738872,2023-10-02 13:02:52.370396,0 days 00:00:00.631524,44005.29136268177,460,sag,COMPLETE
9353,0.6520362484987444,2023-10-02 13:02:52.370396,2023-10-02 13:02:52.915147,0 days 00:00:00.544751,41502.34409112543,470,sag,COMPLETE
9354,0.666120755540998,2023-10-02 13:02:52.915147,2023-10-02 13:02:53.543223,0 days 00:00:00.628076,65413.28261284434,460,sag,COMPLETE
9355,0.6449939949776177,2023-10-02 13:02:53.543223,2023-10-02 13:02:54.186455,0 days 00:00:00.643232,38102.082159225516,470,sag,COMPLETE
9356,0.6552025330276231,2023-10-02 13:02:54.186455,2023-10-02 13:02:54.820569,0 days 00:00:00.634114,68802.19024002833,460,sag,COMPLETE
9357,0.6590785020198712,2023-10-02 13:02:54.820569,2023-10-02 13:02:55.457557,0 days 00:00:00.636988,38227.525305159375,470,sag,COMPLETE
9358,0.6411180259853696,2023-10-02 13:02:55.457557,2023-10-02 13:02:56.005192,0 days 00:00:00.547635,68709.45876224995,470,saga,COMPLETE
9359,0.637951741456491,2023-10-02 13:02:56.005192,2023-10-02 13:02:56.587467,0 days 00:00:00.582275,99375.23546991918,460,lbfgs,COMPLETE
9360,0.6520362484987444,2023-10-02 13:02:56.587467,2023-10-02 13:02:57.221696,0 days 00:00:00.634229,99454.72762332184,470,sag,COMPLETE
9361,0.6590785020198712,2023-10-02 13:02:57.221696,2023-10-02 13:02:57.856390,0 days 00:00:00.634694,46969.292197629664,460,sag,COMPLETE
9362,0.6520362484987444,2023-10-02 13:02:57.856390,2023-10-02 13:02:58.485468,0 days 00:00:00.629078,99156.38503664205,470,sag,COMPLETE
9363,0.66224478654875,2023-10-02 13:02:58.485468,2023-10-02 13:02:59.017975,0 days 00:00:00.532507,37545.12106361252,460,sag,COMPLETE
9364,0.6590785020198712,2023-10-02 13:02:59.017975,2023-10-02 13:02:59.653568,0 days 00:00:00.635593,98326.26686804695,470,sag,COMPLETE
9365,0.6590785020198712,2023-10-02 13:02:59.653568,2023-10-02 13:03:00.303677,0 days 00:00:00.650109,47490.81258915091,470,sag,COMPLETE
9366,0.6629544710121192,2023-10-02 13:03:00.303677,2023-10-02 13:03:00.948125,0 days 00:00:00.644448,98376.49917261198,460,sag,COMPLETE
9367,0.6520362484987444,2023-10-02 13:03:00.948125,2023-10-02 13:03:01.590350,0 days 00:00:00.642225,36348.292126253036,470,sag,COMPLETE
9368,0.6590785020198712,2023-10-02 13:03:01.606025,2023-10-02 13:03:02.149280,0 days 00:00:00.543255,57213.489158304066,460,sag,COMPLETE
9369,0.637951741456491,2023-10-02 13:03:02.149280,2023-10-02 13:03:02.719601,0 days 00:00:00.570321,34625.52668185273,460,newton-cg,COMPLETE
9370,0.666120755540998,2023-10-02 13:03:02.719601,2023-10-02 13:03:03.364864,0 days 00:00:00.645263,99038.39608405092,480,sag,COMPLETE
9371,0.6590785020198712,2023-10-02 13:03:03.364864,2023-10-02 13:03:04.006242,0 days 00:00:00.641378,49406.211849104424,470,sag,COMPLETE
9372,0.6520362484987444,2023-10-02 13:03:04.006242,2023-10-02 13:03:04.632656,0 days 00:00:00.626414,55669.646409557834,480,sag,COMPLETE
9373,0.637951741456491,2023-10-02 13:03:04.648422,2023-10-02 13:03:05.092781,0 days 00:00:00.444359,32708.85705250742,470,liblinear,COMPLETE
9374,0.6590785020198712,2023-10-02 13:03:05.092781,2023-10-02 13:03:05.719540,0 days 00:00:00.626759,28501.9889157764,480,sag,COMPLETE
9375,0.669996724533246,2023-10-02 13:03:05.719540,2023-10-02 13:03:06.359041,0 days 00:00:00.639501,54439.023421332895,460,sag,COMPLETE
9376,0.6629544710121192,2023-10-02 13:03:06.359041,2023-10-02 13:03:06.998765,0 days 00:00:00.639724,32080.434041164062,470,sag,COMPLETE
9377,0.6590785020198712,2023-10-02 13:03:07.014442,2023-10-02 13:03:07.644824,0 days 00:00:00.630382,55352.72136160407,480,sag,COMPLETE
9378,0.6590785020198712,2023-10-02 13:03:07.644824,2023-10-02 13:03:08.182830,0 days 00:00:00.538006,97927.2375032106,460,sag,COMPLETE
9379,0.6520362484987444,2023-10-02 13:03:08.182830,2023-10-02 13:03:09.000138,0 days 00:00:00.817308,32599.211807394484,480,sag,COMPLETE
9380,0.6590785020198712,2023-10-02 13:03:09.000138,2023-10-02 13:03:10.042475,0 days 00:00:01.042337,66890.6820118542,470,sag,COMPLETE
9381,0.669996724533246,2023-10-02 13:03:10.042475,2023-10-02 13:03:11.207207,0 days 00:00:01.164732,33425.84771206665,480,sag,COMPLETE
9382,0.6520362484987444,2023-10-02 13:03:11.207207,2023-10-02 13:03:12.006082,0 days 00:00:00.798875,54500.16528233556,460,sag,COMPLETE
9383,0.637951741456491,2023-10-02 13:03:12.006082,2023-10-02 13:03:12.762067,0 days 00:00:00.755985,33620.698231144284,470,lbfgs,COMPLETE
9384,0.6369145103177202,2023-10-02 13:03:12.762067,2023-10-02 13:03:13.355601,0 days 00:00:00.593534,21.128063463742787,460,sag,COMPLETE
9385,0.5,2023-10-02 13:03:13.355601,2023-10-02 13:03:14.029194,0 days 00:00:00.673593,0.06243281013376704,470,saga,COMPLETE
9386,0.6590785020198712,2023-10-02 13:03:14.029194,2023-10-02 13:03:14.767970,0 days 00:00:00.738776,65475.23790995416,480,sag,COMPLETE
9387,0.6520362484987444,2023-10-02 13:03:14.767970,2023-10-02 13:03:15.542302,0 days 00:00:00.774332,97838.84868605169,480,sag,COMPLETE
9388,0.6520362484987444,2023-10-02 13:03:15.542302,2023-10-02 13:03:16.321136,0 days 00:00:00.778834,49826.75547615032,480,sag,COMPLETE
9389,0.6590785020198712,2023-10-02 13:03:16.321136,2023-10-02 13:03:17.072732,0 days 00:00:00.751596,26095.279249746633,460,sag,COMPLETE
9390,0.6590785020198712,2023-10-02 13:03:17.072732,2023-10-02 13:03:17.723515,0 days 00:00:00.650783,27929.032421742926,480,sag,COMPLETE
9391,0.5,2023-10-02 13:03:17.723515,2023-10-02 13:03:18.595399,0 days 00:00:00.871884,8.968822216340597e-05,470,sag,COMPLETE
9392,0.643956763838847,2023-10-02 13:03:18.611035,2023-10-02 13:03:19.348361,0 days 00:00:00.737326,24.034062399628173,450,sag,COMPLETE
9393,0.666120755540998,2023-10-02 13:03:19.348361,2023-10-02 13:03:20.202809,0 days 00:00:00.854448,98818.05765760073,460,sag,COMPLETE
9394,0.6520362484987444,2023-10-02 13:03:20.202809,2023-10-02 13:03:21.057936,0 days 00:00:00.855127,64764.499863378565,470,sag,COMPLETE
9395,0.5,2023-10-02 13:03:21.057936,2023-10-02 13:03:21.722590,0 days 00:00:00.664654,0.009861349116080925,480,newton-cg,COMPLETE
9396,0.6520362484987444,2023-10-02 13:03:21.732101,2023-10-02 13:03:22.329444,0 days 00:00:00.597343,43405.94776079436,480,sag,COMPLETE
9397,0.6590785020198712,2023-10-02 13:03:22.345109,2023-10-02 13:03:23.113488,0 days 00:00:00.768379,37935.70513422662,460,sag,COMPLETE
9398,0.6534556174254831,2023-10-02 13:03:23.113488,2023-10-02 13:03:23.803720,0 days 00:00:00.690232,115.20719368145643,450,sag,COMPLETE
9399,0.6418277104487389,2023-10-02 13:03:23.819357,2023-10-02 13:03:24.524786,0 days 00:00:00.705429,302.80745424706674,470,sag,COMPLETE
9400,0.666120755540998,2023-10-02 13:03:24.528316,2023-10-02 13:03:25.292055,0 days 00:00:00.763739,63555.02490051321,480,sag,COMPLETE
9401,0.5,2023-10-02 13:03:25.307690,2023-10-02 13:03:25.889450,0 days 00:00:00.581760,0.04493527731623713,480,sag,COMPLETE
9402,0.637951741456491,2023-10-02 13:03:25.905065,2023-10-02 13:03:26.579342,0 days 00:00:00.674277,23868.87107944536,470,liblinear,COMPLETE
9403,0.6520362484987444,2023-10-02 13:03:26.579342,2023-10-02 13:03:27.265057,0 days 00:00:00.685715,25289.98202403071,450,sag,COMPLETE
9404,0.6590785020198712,2023-10-02 13:03:27.280687,2023-10-02 13:03:27.976103,0 days 00:00:00.695416,98359.4418484015,480,sag,COMPLETE
9405,0.6457036794409869,2023-10-02 13:03:27.976103,2023-10-02 13:03:28.685204,0 days 00:00:00.709101,268.9667892454947,460,sag,COMPLETE
9406,0.6502893328966044,2023-10-02 13:03:28.685204,2023-10-02 13:03:29.356422,0 days 00:00:00.671218,33.90751433518148,470,sag,COMPLETE
9407,0.5,2023-10-02 13:03:29.372049,2023-10-02 13:03:29.915891,0 days 00:00:00.543842,0.0002657244702893692,480,sag,COMPLETE
9408,0.6418277104487389,2023-10-02 13:03:29.915891,2023-10-02 13:03:30.690397,0 days 00:00:00.774506,485.0172441214375,450,sag,COMPLETE
9409,0.6629544710121192,2023-10-02 13:03:30.690397,2023-10-02 13:03:31.411189,0 days 00:00:00.720792,46870.54470329212,480,sag,COMPLETE
9410,0.637951741456491,2023-10-02 13:03:31.411189,2023-10-02 13:03:32.225875,0 days 00:00:00.814686,65732.59570191715,460,lbfgs,COMPLETE
9411,0.6629544710121192,2023-10-02 13:03:32.242998,2023-10-02 13:03:33.136055,0 days 00:00:00.893057,39571.26717105336,460,sag,COMPLETE
9412,0.6449939949776177,2023-10-02 13:03:33.136055,2023-10-02 13:03:33.857892,0 days 00:00:00.721837,22510.94821118507,480,saga,COMPLETE
9413,0.6449939949776177,2023-10-02 13:03:33.873531,2023-10-02 13:03:34.639187,0 days 00:00:00.765656,98289.27234064548,470,sag,COMPLETE
9414,0.6267059722677149,2023-10-02 13:03:34.639187,2023-10-02 13:03:35.332969,0 days 00:00:00.693782,11.733045827939227,450,sag,COMPLETE
9415,0.5,2023-10-02 13:03:35.332969,2023-10-02 13:03:35.959904,0 days 00:00:00.626935,0.017734515734433354,480,sag,COMPLETE
9416,0.6668304400043672,2023-10-02 13:03:35.959904,2023-10-02 13:03:36.682169,0 days 00:00:00.722265,33060.57079443213,460,sag,COMPLETE
9417,0.6590785020198712,2023-10-02 13:03:36.682169,2023-10-02 13:03:37.435111,0 days 00:00:00.752942,47219.659879775834,470,sag,COMPLETE
9418,0.5,2023-10-02 13:03:37.435111,2023-10-02 13:03:38.209481,0 days 00:00:00.774370,5.759777845810969e-05,480,sag,COMPLETE
9419,0.5,2023-10-02 13:03:38.225105,2023-10-02 13:03:38.862389,0 days 00:00:00.637284,0.3285853833271599,450,sag,COMPLETE
9420,0.6552025330276231,2023-10-02 13:03:38.878026,2023-10-02 13:03:39.787927,0 days 00:00:00.909901,25632.547891130285,470,sag,COMPLETE
9421,0.5,2023-10-02 13:03:39.787927,2023-10-02 13:03:40.437655,0 days 00:00:00.649728,0.00014931961300043605,480,newton-cg,COMPLETE
9422,0.6590785020198712,2023-10-02 13:03:40.437655,2023-10-02 13:03:41.199456,0 days 00:00:00.761801,50162.209807320236,460,sag,COMPLETE
9423,0.6590785020198712,2023-10-02 13:03:41.199456,2023-10-02 13:03:41.936865,0 days 00:00:00.737409,67115.91069788863,450,sag,COMPLETE
9424,0.5823779888634131,2023-10-02 13:03:41.936865,2023-10-02 13:03:42.661763,0 days 00:00:00.724898,1.2113587732113533,470,sag,COMPLETE
9425,0.637951741456491,2023-10-02 13:03:42.661763,2023-10-02 13:03:43.332609,0 days 00:00:00.670846,23756.424289831888,480,liblinear,COMPLETE
9426,0.5,2023-10-02 13:03:43.332609,2023-10-02 13:03:44.446514,0 days 00:00:01.113905,2.8101597702956662e-05,480,sag,COMPLETE
9427,0.5,2023-10-02 13:03:44.446514,2023-10-02 13:03:45.043283,0 days 00:00:00.596769,0.0024613208759332607,470,sag,COMPLETE
9428,0.6133311496888305,2023-10-02 13:03:45.058912,2023-10-02 13:03:45.716728,0 days 00:00:00.657816,7.020343691195449,460,sag,COMPLETE
9429,0.5,2023-10-02 13:03:45.732364,2023-10-02 13:03:46.423889,0 days 00:00:00.691525,7.158430717466618e-05,480,sag,COMPLETE
9430,0.6552025330276231,2023-10-02 13:03:46.423889,2023-10-02 13:03:47.113413,0 days 00:00:00.689524,34735.3793055894,450,sag,COMPLETE
9431,0.5,2023-10-02 13:03:47.113413,2023-10-02 13:03:47.771444,0 days 00:00:00.658031,0.23040410477302453,480,sag,COMPLETE
9432,0.6520362484987444,2023-10-02 13:03:47.771444,2023-10-02 13:03:48.493623,0 days 00:00:00.722179,66736.57727353083,460,sag,COMPLETE
9433,0.6520362484987444,2023-10-02 13:03:48.493623,2023-10-02 13:03:49.183478,0 days 00:00:00.689855,25569.180182431614,470,sag,COMPLETE
9434,0.637951741456491,2023-10-02 13:03:49.199122,2023-10-02 13:03:49.906031,0 days 00:00:00.706909,47176.30511893333,450,lbfgs,COMPLETE
9435,0.6534556174254831,2023-10-02 13:03:49.906031,2023-10-02 13:03:50.485113,0 days 00:00:00.579082,81.9262824951457,480,sag,COMPLETE
9436,0.6590785020198712,2023-10-02 13:03:50.485113,2023-10-02 13:03:51.226298,0 days 00:00:00.741185,62785.194952125734,470,sag,COMPLETE
