number,value,datetime_start,datetime_complete,duration,params_C,params_max_iter,params_solver,state
320,0.6369145103177202,2023-10-02 12:10:57.407273,2023-10-02 12:10:57.449261,0 days 00:00:00.041988,20.1885954804824,200,sag,COMPLETE
321,0.5313352986133857,2023-10-02 12:10:57.450263,2023-10-02 12:10:57.488788,0 days 00:00:00.038525,0.522920049051721,180,lbfgs,COMPLETE
322,0.6541653018888526,2023-10-02 12:10:57.489793,2023-10-02 12:10:57.532064,0 days 00:00:00.042271,32.043171723937405,190,newton-cg,COMPLETE
323,0.5943334425155585,2023-10-02 12:10:57.532064,2023-10-02 12:10:57.576595,0 days 00:00:00.044531,2.1377156912062523,440,lbfgs,COMPLETE
324,0.6534556174254831,2023-10-02 12:10:57.576595,2023-10-02 12:10:57.604981,0 days 00:00:00.028386,75.12158015775643,480,liblinear,COMPLETE
325,0.6573315864177312,2023-10-02 12:10:57.604981,2023-10-02 12:10:57.687960,0 days 00:00:00.082979,36.99622069723855,170,lbfgs,COMPLETE
326,0.6267059722677149,2023-10-02 12:10:57.688956,2023-10-02 12:10:57.748110,0 days 00:00:00.059154,13.522772928579878,190,lbfgs,COMPLETE
327,0.6534556174254831,2023-10-02 12:10:57.748110,2023-10-02 12:10:57.810747,0 days 00:00:00.062637,48.96583220208464,170,lbfgs,COMPLETE
328,0.6369145103177202,2023-10-02 12:10:57.810747,2023-10-02 12:10:57.849189,0 days 00:00:00.038442,19.859688831496342,200,sag,COMPLETE
329,0.6534556174254831,2023-10-02 12:10:57.850198,2023-10-02 12:10:57.943423,0 days 00:00:00.093225,180.4318266673105,160,lbfgs,COMPLETE
330,0.6062888961677039,2023-10-02 12:10:57.943423,2023-10-02 12:10:57.994412,0 days 00:00:00.050989,6.4280004972891005,490,lbfgs,COMPLETE
331,0.6534556174254831,2023-10-02 12:10:57.994412,2023-10-02 12:10:58.067485,0 days 00:00:00.073073,85.13271907949958,180,lbfgs,COMPLETE
332,0.640080794846599,2023-10-02 12:10:58.068484,2023-10-02 12:10:58.165020,0 days 00:00:00.096536,28.30939743912238,200,lbfgs,COMPLETE
333,0.6534556174254831,2023-10-02 12:10:58.165020,2023-10-02 12:10:58.231295,0 days 00:00:00.066275,52.174088461038586,150,lbfgs,COMPLETE
334,0.6337482257888415,2023-10-02 12:10:58.232295,2023-10-02 12:10:58.306523,0 days 00:00:00.074228,14.903410786953645,190,lbfgs,COMPLETE
335,0.649579648433235,2023-10-02 12:10:58.306523,2023-10-02 12:10:58.372788,0 days 00:00:00.066265,117.96848348898138,180,sag,COMPLETE
336,0.6502893328966044,2023-10-02 12:10:58.373810,2023-10-02 12:10:58.463364,0 days 00:00:00.089554,35.08942293628634,450,lbfgs,COMPLETE
337,0.5,2023-10-02 12:10:58.463364,2023-10-02 12:10:58.498885,0 days 00:00:00.035521,0.0018560405382528683,420,lbfgs,COMPLETE
338,0.5,2023-10-02 12:10:58.498885,2023-10-02 12:10:58.546106,0 days 00:00:00.047221,0.06449473706592497,210,lbfgs,COMPLETE
339,0.6534556174254831,2023-10-02 12:10:58.547106,2023-10-02 12:10:58.629976,0 days 00:00:00.082870,65.16880370057395,180,lbfgs,COMPLETE
340,0.6316191723987334,2023-10-02 12:10:58.629976,2023-10-02 12:10:58.705605,0 days 00:00:00.075629,553.5338535686985,170,lbfgs,COMPLETE
341,0.6369145103177202,2023-10-02 12:10:58.705605,2023-10-02 12:10:58.777717,0 days 00:00:00.072112,23.324322076204613,120,lbfgs,COMPLETE
342,0.6573315864177312,2023-10-02 12:10:58.777717,2023-10-02 12:10:58.828894,0 days 00:00:00.051177,39.337030851137335,210,newton-cg,COMPLETE
343,0.6534556174254831,2023-10-02 12:10:58.828894,2023-10-02 12:10:58.887610,0 days 00:00:00.058716,74.61610082176749,290,sag,COMPLETE
344,0.6235396877388361,2023-10-02 12:10:58.887610,2023-10-02 12:10:58.940604,0 days 00:00:00.052994,8.726871806189163,480,lbfgs,COMPLETE
345,0.643956763838847,2023-10-02 12:10:58.941604,2023-10-02 12:10:59.011249,0 days 00:00:00.069645,27.026139950764872,500,lbfgs,COMPLETE
346,0.6534556174254831,2023-10-02 12:10:59.011249,2023-10-02 12:10:59.043330,0 days 00:00:00.032081,49.976573575824894,160,liblinear,COMPLETE
347,0.6298722567965934,2023-10-02 12:10:59.043330,2023-10-02 12:10:59.112294,0 days 00:00:00.068964,17.669411784688254,190,lbfgs,COMPLETE
348,0.6534556174254831,2023-10-02 12:10:59.112294,2023-10-02 12:10:59.174889,0 days 00:00:00.062595,115.9601006914726,200,lbfgs,COMPLETE
349,0.6573315864177312,2023-10-02 12:10:59.174889,2023-10-02 12:10:59.243861,0 days 00:00:00.068972,40.605202519617606,180,lbfgs,COMPLETE
350,0.6457036794409869,2023-10-02 12:10:59.244864,2023-10-02 12:10:59.332572,0 days 00:00:00.087708,277.1402579007672,170,lbfgs,COMPLETE
351,0.6267059722677149,2023-10-02 12:10:59.333573,2023-10-02 12:10:59.368661,0 days 00:00:00.035088,11.968482193159126,470,sag,COMPLETE
352,0.6369145103177202,2023-10-02 12:10:59.368661,2023-10-02 12:10:59.433181,0 days 00:00:00.064520,22.377716706248375,310,lbfgs,COMPLETE
353,0.604541980565564,2023-10-02 12:10:59.433181,2023-10-02 12:10:59.493861,0 days 00:00:00.060680,3.19611163302966,460,lbfgs,COMPLETE
354,0.6534556174254831,2023-10-02 12:10:59.493861,2023-10-02 12:10:59.576481,0 days 00:00:00.082620,84.37592941875972,160,lbfgs,COMPLETE
355,0.6534556174254831,2023-10-02 12:10:59.577481,2023-10-02 12:10:59.644928,0 days 00:00:00.067447,51.38251634691058,190,lbfgs,COMPLETE
356,0.6101648651599519,2023-10-02 12:10:59.645928,2023-10-02 12:10:59.700472,0 days 00:00:00.054544,5.266857296639454,200,lbfgs,COMPLETE
357,0.6541653018888526,2023-10-02 12:10:59.701473,2023-10-02 12:10:59.746094,0 days 00:00:00.044621,29.565130867518725,400,sag,COMPLETE
358,0.6534556174254831,2023-10-02 12:10:59.746146,2023-10-02 12:10:59.816823,0 days 00:00:00.070677,61.36652610481997,220,lbfgs,COMPLETE
359,0.5943334425155585,2023-10-02 12:10:59.816823,2023-10-02 12:10:59.854183,0 days 00:00:00.037360,1.914113563642023,440,saga,COMPLETE
360,0.6534556174254831,2023-10-02 12:10:59.855183,2023-10-02 12:10:59.948712,0 days 00:00:00.093529,178.57281123099392,190,lbfgs,COMPLETE
361,0.6298722567965934,2023-10-02 12:10:59.948712,2023-10-02 12:11:00.015369,0 days 00:00:00.066657,17.06493736761807,210,lbfgs,COMPLETE
362,0.6502893328966044,2023-10-02 12:11:00.015369,2023-10-02 12:11:00.065520,0 days 00:00:00.050151,35.94227267095986,130,newton-cg,COMPLETE
363,0.6457036794409869,2023-10-02 12:11:00.065520,2023-10-02 12:11:00.128592,0 days 00:00:00.063072,94.82377810589819,170,saga,COMPLETE
364,0.5,2023-10-02 12:11:00.128592,2023-10-02 12:11:00.168841,0 days 00:00:00.040249,0.03707439243384912,180,lbfgs,COMPLETE
365,0.643956763838847,2023-10-02 12:11:00.168841,2023-10-02 12:11:00.236692,0 days 00:00:00.067851,27.250498750627905,330,lbfgs,COMPLETE
366,0.5211267605633803,2023-10-02 12:11:00.236692,2023-10-02 12:11:00.274277,0 days 00:00:00.037585,0.3658764601878339,500,lbfgs,COMPLETE
367,0.6267059722677149,2023-10-02 12:11:00.275286,2023-10-02 12:11:00.304295,0 days 00:00:00.029009,10.450705882157758,490,liblinear,COMPLETE
368,0.6534556174254831,2023-10-02 12:11:00.305368,2023-10-02 12:11:00.375073,0 days 00:00:00.069705,53.43033747644683,200,saga,COMPLETE
369,0.637951741456491,2023-10-02 12:11:00.376097,2023-10-02 12:11:00.458083,0 days 00:00:00.081986,807.8062366860869,210,sag,COMPLETE
370,0.5,2023-10-02 12:11:00.458167,2023-10-02 12:11:00.491787,0 days 00:00:00.033620,9.330081767346731e-05,170,lbfgs,COMPLETE
371,0.6298722567965934,2023-10-02 12:11:00.491787,2023-10-02 12:11:00.565144,0 days 00:00:00.073357,17.68914166652167,360,lbfgs,COMPLETE
372,0.6541653018888526,2023-10-02 12:11:00.566140,2023-10-02 12:11:00.633237,0 days 00:00:00.067097,38.63062915705527,180,saga,COMPLETE
373,0.5792117043345343,2023-10-02 12:11:00.634333,2023-10-02 12:11:00.679126,0 days 00:00:00.044793,1.118934706432024,160,lbfgs,COMPLETE
374,0.6534556174254831,2023-10-02 12:11:00.679126,2023-10-02 12:11:00.820655,0 days 00:00:00.141529,114.14831141785935,430,lbfgs,COMPLETE
375,0.637951741456491,2023-10-02 12:11:00.821662,2023-10-02 12:11:00.903157,0 days 00:00:00.081495,6453.354785712045,190,lbfgs,COMPLETE
376,0.6457036794409869,2023-10-02 12:11:00.903157,2023-10-02 12:11:00.961276,0 days 00:00:00.058119,67.05571926238296,150,saga,COMPLETE
377,0.5,2023-10-02 12:11:00.961276,2023-10-02 12:11:00.994168,0 days 00:00:00.032892,0.011092758259249217,150,sag,COMPLETE
378,0.643956763838847,2023-10-02 12:11:00.995168,2023-10-02 12:11:01.065318,0 days 00:00:00.070150,25.20993583217303,410,lbfgs,COMPLETE
379,0.6534556174254831,2023-10-02 12:11:01.066349,2023-10-02 12:11:01.143586,0 days 00:00:00.077237,45.29219664113633,220,lbfgs,COMPLETE
380,0.5,2023-10-02 12:11:01.143586,2023-10-02 12:11:01.176223,0 days 00:00:00.032637,0.2662489428680506,460,saga,COMPLETE
381,0.6337482257888415,2023-10-02 12:11:01.177218,2023-10-02 12:11:01.234309,0 days 00:00:00.057091,14.449418109698314,200,lbfgs,COMPLETE
382,0.528169014084507,2023-10-02 12:11:01.235307,2023-10-02 12:11:01.274515,0 days 00:00:00.039208,0.44472595452377395,210,lbfgs,COMPLETE
383,0.6534556174254831,2023-10-02 12:11:01.274515,2023-10-02 12:11:01.374219,0 days 00:00:00.099704,164.63081507930545,170,lbfgs,COMPLETE
384,0.5376678676711432,2023-10-02 12:11:01.374219,2023-10-02 12:11:01.408838,0 days 00:00:00.034619,0.6328883288179439,230,saga,COMPLETE
385,0.6203734032099574,2023-10-02 12:11:01.409838,2023-10-02 12:11:01.465350,0 days 00:00:00.055512,7.3555270115967755,480,lbfgs,COMPLETE
386,0.6471230483677258,2023-10-02 12:11:01.465350,2023-10-02 12:11:01.510101,0 days 00:00:00.044751,28.184804520027363,190,sag,COMPLETE
387,0.6534556174254831,2023-10-02 12:11:01.510101,2023-10-02 12:11:01.591301,0 days 00:00:00.081200,68.36235935017834,180,lbfgs,COMPLETE
388,0.6534556174254831,2023-10-02 12:11:01.592301,2023-10-02 12:11:01.672724,0 days 00:00:00.080423,44.8999016464803,200,saga,COMPLETE
389,0.6369145103177202,2023-10-02 12:11:01.673729,2023-10-02 12:11:01.746245,0 days 00:00:00.072516,19.18585558478601,160,lbfgs,COMPLETE
390,0.5,2023-10-02 12:11:01.746245,2023-10-02 12:11:01.783467,0 days 00:00:00.037222,0.0031789956885513015,450,newton-cg,COMPLETE
391,0.5478764057211486,2023-10-02 12:11:01.783467,2023-10-02 12:11:01.830623,0 days 00:00:00.047156,0.713450947039746,190,lbfgs,COMPLETE
392,0.6534556174254831,2023-10-02 12:11:01.830623,2023-10-02 12:11:01.896240,0 days 00:00:00.065617,83.41492624191547,270,lbfgs,COMPLETE
393,0.5,2023-10-02 12:11:01.897240,2023-10-02 12:11:01.928343,0 days 00:00:00.031103,0.11072477380756814,470,liblinear,COMPLETE
394,0.6573315864177312,2023-10-02 12:11:01.928343,2023-10-02 12:11:01.997017,0 days 00:00:00.068674,39.13382535112935,180,saga,COMPLETE
395,0.5855442733922918,2023-10-02 12:11:01.998018,2023-10-02 12:11:02.046005,0 days 00:00:00.047987,1.2876707437079231,490,lbfgs,COMPLETE
396,0.643956763838847,2023-10-02 12:11:02.047005,2023-10-02 12:11:02.106073,0 days 00:00:00.059068,24.361453532351153,200,lbfgs,COMPLETE
397,0.6267059722677149,2023-10-02 12:11:02.106073,2023-10-02 12:11:02.144076,0 days 00:00:00.038003,12.595102867796534,440,sag,COMPLETE
398,0.5,2023-10-02 12:11:02.144076,2023-10-02 12:11:02.255264,0 days 00:00:00.111188,1.8229258320828705e-05,170,saga,COMPLETE
399,0.5,2023-10-02 12:11:02.256263,2023-10-02 12:11:02.294239,0 days 00:00:00.037976,0.1722864743974359,340,lbfgs,COMPLETE
400,0.5,2023-10-02 12:11:02.295239,2023-10-02 12:11:02.330350,0 days 00:00:00.035111,0.0008498961368830781,210,lbfgs,COMPLETE
401,0.6457036794409869,2023-10-02 12:11:02.331349,2023-10-02 12:11:02.435991,0 days 00:00:00.104642,266.1889318439714,220,lbfgs,COMPLETE
402,0.5,2023-10-02 12:11:02.436998,2023-10-02 12:11:02.481741,0 days 00:00:00.044743,0.02725952869896656,140,saga,COMPLETE
403,0.6534556174254831,2023-10-02 12:11:02.482745,2023-10-02 12:11:02.535814,0 days 00:00:00.053069,102.933194023556,190,lbfgs,COMPLETE
404,0.6502893328966044,2023-10-02 12:11:02.536813,2023-10-02 12:11:02.611865,0 days 00:00:00.075052,33.29289719889789,380,lbfgs,COMPLETE
405,0.6449939949776177,2023-10-02 12:11:02.611865,2023-10-02 12:11:02.748591,0 days 00:00:00.136726,1733.6453873819119,500,saga,COMPLETE
406,0.6534556174254831,2023-10-02 12:11:02.748591,2023-10-02 12:11:02.824979,0 days 00:00:00.076388,75.81954260175098,180,lbfgs,COMPLETE
407,0.6534556174254831,2023-10-02 12:11:02.824979,2023-10-02 12:11:02.876603,0 days 00:00:00.051624,44.32572371790764,100,sag,COMPLETE
408,0.6369145103177202,2023-10-02 12:11:02.877612,2023-10-02 12:11:02.939602,0 days 00:00:00.061990,22.016419731616793,160,lbfgs,COMPLETE
409,0.6077082650944426,2023-10-02 12:11:02.940601,2023-10-02 12:11:02.990215,0 days 00:00:00.049614,3.9257342565249536,170,lbfgs,COMPLETE
410,0.649579648433235,2023-10-02 12:11:02.991216,2023-10-02 12:11:03.060002,0 days 00:00:00.068786,58.0956932725852,200,saga,COMPLETE
411,0.6235396877388361,2023-10-02 12:11:03.060002,2023-10-02 12:11:03.132125,0 days 00:00:00.072123,8.411093122895483,430,lbfgs,COMPLETE
412,0.6534556174254831,2023-10-02 12:11:03.132125,2023-10-02 12:11:03.204142,0 days 00:00:00.072017,140.58952385205902,220,lbfgs,COMPLETE
413,0.6541653018888526,2023-10-02 12:11:03.204142,2023-10-02 12:11:03.277890,0 days 00:00:00.073748,31.56621435136308,230,saga,COMPLETE
414,0.6238672344142374,2023-10-02 12:11:03.277890,2023-10-02 12:11:03.375814,0 days 00:00:00.097924,3011.2082841546567,210,lbfgs,COMPLETE
415,0.6337482257888415,2023-10-02 12:11:03.375814,2023-10-02 12:11:03.418409,0 days 00:00:00.042595,15.01895363799817,180,sag,COMPLETE
416,0.6277432034064855,2023-10-02 12:11:03.418409,2023-10-02 12:11:03.470718,0 days 00:00:00.052309,965.3842195496222,190,newton-cg,COMPLETE
417,0.6534556174254831,2023-10-02 12:11:03.471720,2023-10-02 12:11:03.558543,0 days 00:00:00.086823,57.326713420249106,170,lbfgs,COMPLETE
418,0.643956763838847,2023-10-02 12:11:03.559539,2023-10-02 12:11:03.625603,0 days 00:00:00.066064,25.347829366586108,160,lbfgs,COMPLETE
419,0.5,2023-10-02 12:11:03.626603,2023-10-02 12:11:03.741654,0 days 00:00:00.115051,0.000523924985746027,200,saga,COMPLETE
420,0.6573315864177312,2023-10-02 12:11:03.741654,2023-10-02 12:11:03.822183,0 days 00:00:00.080529,39.673415443218424,460,lbfgs,COMPLETE
421,0.6386614259198603,2023-10-02 12:11:03.822183,2023-10-02 12:11:03.853180,0 days 00:00:00.030997,427.56842802238293,150,liblinear,COMPLETE
422,0.6534556174254831,2023-10-02 12:11:03.854181,2023-10-02 12:11:03.932674,0 days 00:00:00.078493,92.43385481802476,420,lbfgs,COMPLETE
423,0.6418277104487389,2023-10-02 12:11:03.932674,2023-10-02 12:11:04.006276,0 days 00:00:00.073602,184.3695442484812,210,saga,COMPLETE
424,0.6298722567965934,2023-10-02 12:11:04.007274,2023-10-02 12:11:04.084704,0 days 00:00:00.077430,17.44012343774604,180,lbfgs,COMPLETE
425,0.5,2023-10-02 12:11:04.085702,2023-10-02 12:11:04.128706,0 days 00:00:00.043004,0.19007447276854741,480,lbfgs,COMPLETE
426,0.6534556174254831,2023-10-02 12:11:04.129702,2023-10-02 12:11:04.186758,0 days 00:00:00.057056,63.1952853770909,190,sag,COMPLETE
427,0.6502893328966044,2023-10-02 12:11:04.186758,2023-10-02 12:11:04.261868,0 days 00:00:00.075110,35.070757259198665,300,lbfgs,COMPLETE
428,0.619663718746588,2023-10-02 12:11:04.262877,2023-10-02 12:11:04.319100,0 days 00:00:00.056223,9.345252673709197,240,saga,COMPLETE
429,0.637951741456491,2023-10-02 12:11:04.319100,2023-10-02 12:11:04.391234,0 days 00:00:00.072134,47078.42844158363,320,lbfgs,COMPLETE
430,0.6369145103177202,2023-10-02 12:11:04.391234,2023-10-02 12:11:04.456370,0 days 00:00:00.065136,21.268665107445454,500,lbfgs,COMPLETE
431,0.6534556174254831,2023-10-02 12:11:04.456370,2023-10-02 12:11:04.528637,0 days 00:00:00.072267,52.37136185396259,260,saga,COMPLETE
432,0.637951741456491,2023-10-02 12:11:04.529637,2023-10-02 12:11:04.605244,0 days 00:00:00.075607,16964.920395877773,360,lbfgs,COMPLETE
433,0.5,2023-10-02 12:11:04.605244,2023-10-02 12:11:04.646990,0 days 00:00:00.041746,3.2558617336641905e-05,190,lbfgs,COMPLETE
434,0.6534556174254831,2023-10-02 12:11:04.647996,2023-10-02 12:11:04.730532,0 days 00:00:00.082536,123.26435557519645,280,lbfgs,COMPLETE
435,0.6471230483677258,2023-10-02 12:11:04.730532,2023-10-02 12:11:04.774752,0 days 00:00:00.044220,28.32551175257871,170,sag,COMPLETE
436,0.649579648433235,2023-10-02 12:11:04.775755,2023-10-02 12:11:04.849357,0 days 00:00:00.073602,77.90887781336158,220,saga,COMPLETE
437,0.6337482257888415,2023-10-02 12:11:04.850355,2023-10-02 12:11:04.922845,0 days 00:00:00.072490,13.802441322445043,450,lbfgs,COMPLETE
438,0.6573315864177312,2023-10-02 12:11:04.922845,2023-10-02 12:11:04.988478,0 days 00:00:00.065633,39.62186295250419,180,lbfgs,COMPLETE
439,0.6006660115733159,2023-10-02 12:11:04.988478,2023-10-02 12:11:05.044476,0 days 00:00:00.055998,3.419339058914055,200,lbfgs,COMPLETE
440,0.6062888961677039,2023-10-02 12:11:05.045477,2023-10-02 12:11:05.086017,0 days 00:00:00.040540,5.779937313703883,150,saga,COMPLETE
441,0.6369145103177202,2023-10-02 12:11:05.087012,2023-10-02 12:11:05.166158,0 days 00:00:00.079146,23.030054633986563,470,lbfgs,COMPLETE
442,0.6534556174254831,2023-10-02 12:11:05.166158,2023-10-02 12:11:05.217746,0 days 00:00:00.051588,51.73502192520406,140,newton-cg,COMPLETE
443,0.6457036794409869,2023-10-02 12:11:05.217746,2023-10-02 12:11:05.308005,0 days 00:00:00.090259,252.54958798714074,210,lbfgs,COMPLETE
444,0.6457036794409869,2023-10-02 12:11:05.308005,2023-10-02 12:11:05.374031,0 days 00:00:00.066026,94.75968784972169,160,saga,COMPLETE
445,0.6502893328966044,2023-10-02 12:11:05.375033,2023-10-02 12:11:05.423632,0 days 00:00:00.048599,33.554467986945795,490,sag,COMPLETE
446,0.6267059722677149,2023-10-02 12:11:05.424633,2023-10-02 12:11:05.458645,0 days 00:00:00.034012,12.45681601752762,120,liblinear,COMPLETE
447,0.6534556174254831,2023-10-02 12:11:05.458645,2023-10-02 12:11:05.521153,0 days 00:00:00.062508,44.68978314990515,410,lbfgs,COMPLETE
448,0.6369145103177202,2023-10-02 12:11:05.521153,2023-10-02 12:11:05.596316,0 days 00:00:00.075163,19.748890306420154,170,lbfgs,COMPLETE
449,0.6534556174254831,2023-10-02 12:11:05.597315,2023-10-02 12:11:05.701287,0 days 00:00:00.103972,62.38028263498531,200,lbfgs,COMPLETE
450,0.6541653018888526,2023-10-02 12:11:05.702286,2023-10-02 12:11:05.763957,0 days 00:00:00.061671,28.12468903849267,440,saga,COMPLETE
451,0.5996287804345454,2023-10-02 12:11:05.764956,2023-10-02 12:11:05.821111,0 days 00:00:00.056155,1.4932639075202796,390,lbfgs,COMPLETE
452,0.6534556174254831,2023-10-02 12:11:05.821111,2023-10-02 12:11:05.894166,0 days 00:00:00.073055,114.10261790619474,180,lbfgs,COMPLETE
453,0.5619609127634021,2023-10-02 12:11:05.894166,2023-10-02 12:11:05.931299,0 days 00:00:00.037133,0.9323898381795539,230,saga,COMPLETE
454,0.6534556174254831,2023-10-02 12:11:05.932301,2023-10-02 12:11:06.018626,0 days 00:00:00.086325,67.03555555283896,190,lbfgs,COMPLETE
455,0.6573315864177312,2023-10-02 12:11:06.018626,2023-10-02 12:11:06.075631,0 days 00:00:00.057005,37.847069035567216,220,sag,COMPLETE
456,0.6337482257888415,2023-10-02 12:11:06.075631,2023-10-02 12:11:06.146708,0 days 00:00:00.071077,14.13570072656673,200,lbfgs,COMPLETE
457,0.643956763838847,2023-10-02 12:11:06.146708,2023-10-02 12:11:06.240321,0 days 00:00:00.093613,24.109033088487266,170,lbfgs,COMPLETE
458,0.6418277104487389,2023-10-02 12:11:06.240321,2023-10-02 12:11:06.312613,0 days 00:00:00.072292,161.54902925049808,190,saga,COMPLETE
459,0.5,2023-10-02 12:11:06.313609,2023-10-02 12:11:06.355809,0 days 00:00:00.042200,0.04808797989661743,210,lbfgs,COMPLETE
460,0.5,2023-10-02 12:11:06.355809,2023-10-02 12:11:06.398430,0 days 00:00:00.042621,0.00013199281837428554,180,lbfgs,COMPLETE
461,0.637951741456491,2023-10-02 12:11:06.399427,2023-10-02 12:11:06.467136,0 days 00:00:00.067709,368.2470062053993,160,saga,COMPLETE
462,0.6534556174254831,2023-10-02 12:11:06.468143,2023-10-02 12:11:06.537567,0 days 00:00:00.069424,52.53350910239904,490,lbfgs,COMPLETE
463,0.6502893328966044,2023-10-02 12:11:06.537567,2023-10-02 12:11:06.606180,0 days 00:00:00.068613,32.94933050647384,170,lbfgs,COMPLETE
464,0.619663718746588,2023-10-02 12:11:06.606180,2023-10-02 12:11:06.651936,0 days 00:00:00.045756,9.179282603526504,250,sag,COMPLETE
465,0.6534556174254831,2023-10-02 12:11:06.651936,2023-10-02 12:11:06.734148,0 days 00:00:00.082212,90.01379731631573,180,lbfgs,COMPLETE
466,0.5,2023-10-02 12:11:06.734148,2023-10-02 12:11:06.770255,0 days 00:00:00.036107,0.13949096753946477,450,saga,COMPLETE
467,0.6298722567965934,2023-10-02 12:11:06.771254,2023-10-02 12:11:06.909780,0 days 00:00:00.138526,17.830907059950757,500,lbfgs,COMPLETE
468,0.6534556174254831,2023-10-02 12:11:06.909780,2023-10-02 12:11:06.961169,0 days 00:00:00.051389,50.42955632794789,200,newton-cg,COMPLETE
469,0.6541653018888526,2023-10-02 12:11:06.962224,2023-10-02 12:11:07.028851,0 days 00:00:00.066627,29.694258658304996,190,lbfgs,COMPLETE
470,0.6062888961677039,2023-10-02 12:11:07.028851,2023-10-02 12:11:07.081134,0 days 00:00:00.052283,5.362592317555469,480,saga,COMPLETE
471,0.5,2023-10-02 12:11:07.081134,2023-10-02 12:11:07.119716,0 days 00:00:00.038582,0.018538454322171646,210,lbfgs,COMPLETE
472,0.6534556174254831,2023-10-02 12:11:07.120712,2023-10-02 12:11:07.157715,0 days 00:00:00.037003,130.19638238761812,470,liblinear,COMPLETE
473,0.6534556174254831,2023-10-02 12:11:07.157715,2023-10-02 12:11:07.243285,0 days 00:00:00.085570,72.39484476043337,160,lbfgs,COMPLETE
474,0.6316191723987334,2023-10-02 12:11:07.244289,2023-10-02 12:11:07.332810,0 days 00:00:00.088521,648.3857401258031,430,lbfgs,COMPLETE
475,0.6369145103177202,2023-10-02 12:11:07.333815,2023-10-02 12:11:07.391345,0 days 00:00:00.057530,18.035962984921763,190,saga,COMPLETE
476,0.6573315864177312,2023-10-02 12:11:07.392344,2023-10-02 12:11:07.448159,0 days 00:00:00.055815,39.13086180864928,150,sag,COMPLETE
477,0.6267059722677149,2023-10-02 12:11:07.449160,2023-10-02 12:11:07.502977,0 days 00:00:00.053817,10.16748475829873,240,lbfgs,COMPLETE
478,0.5,2023-10-02 12:11:07.503974,2023-10-02 12:11:07.550054,0 days 00:00:00.046080,0.3153024291963586,210,lbfgs,COMPLETE
479,0.6509990173599738,2023-10-02 12:11:07.551047,2023-10-02 12:11:07.633522,0 days 00:00:00.082475,24.11944142190572,180,saga,COMPLETE
480,0.5313352986133857,2023-10-02 12:11:07.633522,2023-10-02 12:11:07.681518,0 days 00:00:00.047996,0.5048241877892162,230,lbfgs,COMPLETE
