number,value,datetime_start,datetime_complete,duration,params_C,params_max_iter,params_solver,state
6015,0.5,2023-10-02 12:34:24.774665,2023-10-02 12:34:25.274030,0 days 00:00:00.499365,0.00013468582534120486,340,sag,COMPLETE
6016,0.5,2023-10-02 12:34:25.274030,2023-10-02 12:34:25.608102,0 days 00:00:00.334072,0.1239429196962627,440,sag,COMPLETE
6017,0.6449939949776177,2023-10-02 12:34:25.610094,2023-10-02 12:34:26.074431,0 days 00:00:00.464337,1459.0109579659008,410,sag,COMPLETE
6018,0.5,2023-10-02 12:34:26.074431,2023-10-02 12:34:26.384011,0 days 00:00:00.309580,0.03631631440655531,350,lbfgs,COMPLETE
6019,0.6337482257888415,2023-10-02 12:34:26.384011,2023-10-02 12:34:26.775759,0 days 00:00:00.391748,14.860169086022603,500,sag,COMPLETE
6020,0.6481602795064964,2023-10-02 12:34:26.775759,2023-10-02 12:34:27.235556,0 days 00:00:00.459797,43095.75343987415,480,sag,COMPLETE
6021,0.5,2023-10-02 12:34:27.237503,2023-10-02 12:34:28.836336,0 days 00:00:01.598833,1.2013789799239432e-05,450,sag,COMPLETE
6022,0.6520362484987444,2023-10-02 12:34:28.836336,2023-10-02 12:34:29.248880,0 days 00:00:00.412544,16137.512513500693,500,sag,COMPLETE
6023,0.6590785020198712,2023-10-02 12:34:29.250881,2023-10-02 12:34:29.715617,0 days 00:00:00.464736,26845.166175484625,490,sag,COMPLETE
6024,0.5,2023-10-02 12:34:29.715617,2023-10-02 12:34:30.028266,0 days 00:00:00.312649,0.054412878193626155,470,sag,COMPLETE
6025,0.6520362484987444,2023-10-02 12:34:30.031271,2023-10-02 12:34:30.493316,0 days 00:00:00.462045,10736.753177475774,330,sag,COMPLETE
6026,0.6520362484987444,2023-10-02 12:34:30.495311,2023-10-02 12:34:30.902443,0 days 00:00:00.407132,4667.019166205998,460,sag,COMPLETE
6027,0.5894202423845398,2023-10-02 12:34:30.905442,2023-10-02 12:34:31.300660,0 days 00:00:00.395218,1.2384520950642415,500,sag,COMPLETE
6028,0.6449939949776177,2023-10-02 12:34:31.300660,2023-10-02 12:34:31.628322,0 days 00:00:00.327662,98768.37894567856,490,newton-cg,COMPLETE
6029,0.66224478654875,2023-10-02 12:34:31.628322,2023-10-02 12:34:32.081767,0 days 00:00:00.453445,43655.23448969573,390,sag,COMPLETE
6030,0.5,2023-10-02 12:34:32.081767,2023-10-02 12:34:32.383376,0 days 00:00:00.301609,0.02694402276188981,480,sag,COMPLETE
6031,0.5,2023-10-02 12:34:32.383376,2023-10-02 12:34:33.197256,0 days 00:00:00.813880,2.820808497505191e-05,360,sag,COMPLETE
6032,0.6534556174254831,2023-10-02 12:34:33.197256,2023-10-02 12:34:33.526703,0 days 00:00:00.329447,65.77410685321124,370,sag,COMPLETE
6033,0.637951741456491,2023-10-02 12:34:33.526703,2023-10-02 12:34:33.903514,0 days 00:00:00.376811,7378.438824333534,350,liblinear,COMPLETE
6034,0.669996724533246,2023-10-02 12:34:33.903514,2023-10-02 12:34:34.285295,0 days 00:00:00.381781,22363.636314401007,430,sag,COMPLETE
6035,0.5,2023-10-02 12:34:34.285295,2023-10-02 12:34:34.703804,0 days 00:00:00.418509,0.0003827579760568416,480,sag,COMPLETE
6036,0.666120755540998,2023-10-02 12:34:34.703804,2023-10-02 12:34:35.080115,0 days 00:00:00.376311,64747.03028470298,490,sag,COMPLETE
6037,0.6590785020198712,2023-10-02 12:34:35.080115,2023-10-02 12:34:35.550471,0 days 00:00:00.470356,13654.5143461121,470,sag,COMPLETE
6038,0.637951741456491,2023-10-02 12:34:35.550471,2023-10-02 12:34:35.927175,0 days 00:00:00.376704,730.2630241658595,500,sag,COMPLETE
6039,0.6449939949776177,2023-10-02 12:34:35.927175,2023-10-02 12:34:36.398025,0 days 00:00:00.470850,34577.1197028869,490,sag,COMPLETE
6040,0.634075772464243,2023-10-02 12:34:36.398025,2023-10-02 12:34:36.758698,0 days 00:00:00.360673,5472.417852858323,340,sag,COMPLETE
6041,0.637951741456491,2023-10-02 12:34:36.758698,2023-10-02 12:34:37.214059,0 days 00:00:00.455361,2294.7425088687623,460,sag,COMPLETE
6042,0.637951741456491,2023-10-02 12:34:37.214059,2023-10-02 12:34:37.550961,0 days 00:00:00.336902,63094.79699579755,480,lbfgs,COMPLETE
6043,0.6488699639698657,2023-10-02 12:34:37.566581,2023-10-02 12:34:38.010764,0 days 00:00:00.444183,9930.890308541584,440,sag,COMPLETE
6044,0.6449939949776177,2023-10-02 12:34:38.022901,2023-10-02 12:34:38.367528,0 days 00:00:00.344627,17015.93552973877,330,sag,COMPLETE
6045,0.666120755540998,2023-10-02 12:34:38.367528,2023-10-02 12:34:38.841026,0 days 00:00:00.473498,30236.392114049333,450,sag,COMPLETE
6046,0.666120755540998,2023-10-02 12:34:38.841026,2023-10-02 12:34:39.237775,0 days 00:00:00.396749,49279.17307067331,500,sag,COMPLETE
6047,0.6590785020198712,2023-10-02 12:34:39.247843,2023-10-02 12:34:39.720725,0 days 00:00:00.472882,3906.40333956267,380,sag,COMPLETE
6048,0.637951741456491,2023-10-02 12:34:39.736344,2023-10-02 12:34:40.273186,0 days 00:00:00.536842,598.9365765483941,470,sag,COMPLETE
6049,0.6590785020198712,2023-10-02 12:34:40.273186,2023-10-02 12:34:40.808601,0 days 00:00:00.535415,22174.505633851775,490,sag,COMPLETE
6050,0.6520362484987444,2023-10-02 12:34:40.808601,2023-10-02 12:34:41.354389,0 days 00:00:00.545788,7959.756034904695,360,sag,COMPLETE
6051,0.5376678676711432,2023-10-02 12:34:41.354389,2023-10-02 12:34:41.707734,0 days 00:00:00.353345,0.5937295488249761,500,sag,COMPLETE
6052,0.5,2023-10-02 12:34:41.707734,2023-10-02 12:34:42.142275,0 days 00:00:00.434541,0.0006572103708517908,480,sag,COMPLETE
6053,0.5,2023-10-02 12:34:42.142275,2023-10-02 12:34:42.782416,0 days 00:00:00.640141,3.910536415730288e-05,490,sag,COMPLETE
6054,0.5,2023-10-02 12:34:42.782416,2023-10-02 12:34:43.175180,0 days 00:00:00.392764,0.006422505104340081,350,newton-cg,COMPLETE
6055,0.66224478654875,2023-10-02 12:34:43.177171,2023-10-02 12:34:43.540279,0 days 00:00:00.363108,70574.93251724602,370,sag,COMPLETE
6056,0.6541653018888526,2023-10-02 12:34:43.540279,2023-10-02 12:34:43.913424,0 days 00:00:00.373145,29.24864442513727,420,sag,COMPLETE
6057,0.6277432034064855,2023-10-02 12:34:43.913424,2023-10-02 12:34:44.216836,0 days 00:00:00.303412,1075.6281565039997,460,liblinear,COMPLETE
6058,0.666120755540998,2023-10-02 12:34:44.216836,2023-10-02 12:34:44.672133,0 days 00:00:00.455297,12922.98004894367,450,sag,COMPLETE
6059,0.6520362484987444,2023-10-02 12:34:44.672133,2023-10-02 12:34:45.049097,0 days 00:00:00.376964,34675.902568335994,480,sag,COMPLETE
6060,0.6590785020198712,2023-10-02 12:34:45.049097,2023-10-02 12:34:45.520013,0 days 00:00:00.470916,1881.167415309665,500,sag,COMPLETE
6061,0.6418277104487389,2023-10-02 12:34:45.520013,2023-10-02 12:34:45.865069,0 days 00:00:00.345056,300.9394006191753,310,sag,COMPLETE
6062,0.6502893328966044,2023-10-02 12:34:45.865069,2023-10-02 12:34:46.262640,0 days 00:00:00.397571,36.45241905666684,470,sag,COMPLETE
6063,0.6520362484987444,2023-10-02 12:34:46.263453,2023-10-02 12:34:46.620552,0 days 00:00:00.357099,2971.464064377209,340,sag,COMPLETE
6064,0.5,2023-10-02 12:34:46.620552,2023-10-02 12:34:46.986101,0 days 00:00:00.365549,0.29428413538849413,490,sag,COMPLETE
6065,0.637951741456491,2023-10-02 12:34:46.986101,2023-10-02 12:34:47.325691,0 days 00:00:00.339590,98394.622398115,490,lbfgs,COMPLETE
6066,0.6520362484987444,2023-10-02 12:34:47.327696,2023-10-02 12:34:47.804053,0 days 00:00:00.476357,19967.234310242267,500,sag,COMPLETE
6067,0.6534556174254831,2023-10-02 12:34:47.806560,2023-10-02 12:34:48.110141,0 days 00:00:00.303581,89.41389744341326,470,sag,COMPLETE
6068,0.6590785020198712,2023-10-02 12:34:48.125787,2023-10-02 12:34:48.608930,0 days 00:00:00.483143,5354.970158568999,480,sag,COMPLETE
6069,0.6418277104487389,2023-10-02 12:34:48.624572,2023-10-02 12:34:48.987069,0 days 00:00:00.362497,325.33180324843954,350,sag,COMPLETE
6070,0.6449939949776177,2023-10-02 12:34:48.987069,2023-10-02 12:34:49.441936,0 days 00:00:00.454867,47213.746802114605,360,sag,COMPLETE
6071,0.66224478654875,2023-10-02 12:34:49.441936,2023-10-02 12:34:49.828098,0 days 00:00:00.386162,11747.9642621526,330,sag,COMPLETE
6072,0.5,2023-10-02 12:34:49.828098,2023-10-02 12:34:50.209809,0 days 00:00:00.381711,0.04364674081093648,440,sag,COMPLETE
6073,0.6590785020198712,2023-10-02 12:34:50.209809,2023-10-02 12:34:50.688348,0 days 00:00:00.478539,30242.176563125984,490,sag,COMPLETE
6074,0.6457036794409869,2023-10-02 12:34:50.689355,2023-10-02 12:34:51.020449,0 days 00:00:00.331094,168.30710854785988,500,sag,COMPLETE
6075,0.6449939949776177,2023-10-02 12:34:51.020449,2023-10-02 12:34:51.486428,0 days 00:00:00.465979,7698.281611710727,390,sag,COMPLETE
6076,0.5,2023-10-02 12:34:51.487580,2023-10-02 12:34:51.810294,0 days 00:00:00.322714,0.0015090706056989655,460,sag,COMPLETE
6077,0.637951741456491,2023-10-02 12:34:51.812372,2023-10-02 12:34:52.226688,0 days 00:00:00.414316,17522.874340793955,480,newton-cg,COMPLETE
6078,0.5,2023-10-02 12:34:52.228694,2023-10-02 12:34:52.527747,0 days 00:00:00.299053,0.002248508524691923,370,sag,COMPLETE
6079,0.6552025330276231,2023-10-02 12:34:52.527747,2023-10-02 12:34:52.997092,0 days 00:00:00.469345,63227.364434903975,490,sag,COMPLETE
6080,0.637951741456491,2023-10-02 12:34:52.999075,2023-10-02 12:34:53.288069,0 days 00:00:00.288994,27933.91267998939,470,liblinear,COMPLETE
6081,0.6520362484987444,2023-10-02 12:34:53.288069,2023-10-02 12:34:53.774964,0 days 00:00:00.486895,3730.2246824154886,500,sag,COMPLETE
6082,0.666120755540998,2023-10-02 12:34:53.774964,2023-10-02 12:34:54.169659,0 days 00:00:00.394695,40758.782938692086,380,sag,COMPLETE
6083,0.6481602795064964,2023-10-02 12:34:54.169659,2023-10-02 12:34:54.614239,0 days 00:00:00.444580,9841.226270468589,320,sag,COMPLETE
6084,0.6590785020198712,2023-10-02 12:34:54.614239,2023-10-02 12:34:54.984538,0 days 00:00:00.370299,6239.741076730203,480,sag,COMPLETE
6085,0.5,2023-10-02 12:34:54.984538,2023-10-02 12:34:55.358415,0 days 00:00:00.373877,0.06670289098019166,450,sag,COMPLETE
6086,0.666120755540998,2023-10-02 12:34:55.358415,2023-10-02 12:34:55.735133,0 days 00:00:00.376718,66920.58007531063,500,sag,COMPLETE
6087,0.5,2023-10-02 12:34:55.735133,2023-10-02 12:34:56.158407,0 days 00:00:00.423274,0.0003553055107351593,430,sag,COMPLETE
6088,0.5,2023-10-02 12:34:56.158407,2023-10-02 12:34:56.456741,0 days 00:00:00.298334,0.0038356697771856187,340,sag,COMPLETE
6089,0.6203734032099574,2023-10-02 12:34:56.472363,2023-10-02 12:34:56.849684,0 days 00:00:00.377321,7.813208185200086,490,sag,COMPLETE
6090,0.6267059722677149,2023-10-02 12:34:56.849684,2023-10-02 12:34:57.163463,0 days 00:00:00.313779,10.306074223963014,460,sag,COMPLETE
6091,0.6369145103177202,2023-10-02 12:34:57.179082,2023-10-02 12:34:57.555919,0 days 00:00:00.376837,21.578287190653736,360,sag,COMPLETE
6092,0.637951741456491,2023-10-02 12:34:57.555919,2023-10-02 12:34:57.885476,0 days 00:00:00.329557,14832.371616984174,470,lbfgs,COMPLETE
6093,0.6013756960366853,2023-10-02 12:34:57.885476,2023-10-02 12:34:58.277840,0 days 00:00:00.392364,2.4576469831251972,350,sag,COMPLETE
6094,0.5,2023-10-02 12:34:58.277840,2023-10-02 12:34:58.560395,0 days 00:00:00.282555,0.01915811449673699,490,sag,COMPLETE
6095,0.6337482257888415,2023-10-02 12:34:58.576022,2023-10-02 12:34:58.952988,0 days 00:00:00.376966,15.005573549656717,480,sag,COMPLETE
6096,0.666120755540998,2023-10-02 12:34:58.952988,2023-10-02 12:34:59.408063,0 days 00:00:00.455075,21357.54386561809,500,sag,COMPLETE
6097,0.637951741456491,2023-10-02 12:34:59.423820,2023-10-02 12:34:59.770362,0 days 00:00:00.346542,45808.23236396916,370,sag,COMPLETE
6098,0.5,2023-10-02 12:34:59.770362,2023-10-02 12:35:00.242034,0 days 00:00:00.471672,0.00011818131544723262,480,sag,COMPLETE
6099,0.6552025330276231,2023-10-02 12:35:00.242034,2023-10-02 12:35:00.625560,0 days 00:00:00.383526,99535.55282248954,500,sag,COMPLETE
6100,0.6418277104487389,2023-10-02 12:35:00.625560,2023-10-02 12:35:01.126653,0 days 00:00:00.501093,416.74666726141726,490,sag,COMPLETE
6101,0.637951741456491,2023-10-02 12:35:01.126653,2023-10-02 12:35:01.497313,0 days 00:00:00.370660,2029.6698460312562,450,sag,COMPLETE
6102,0.6316191723987334,2023-10-02 12:35:01.497313,2023-10-02 12:35:01.875184,0 days 00:00:00.377871,740.7087053054158,340,newton-cg,COMPLETE
6103,0.666120755540998,2023-10-02 12:35:01.875184,2023-10-02 12:35:02.236918,0 days 00:00:00.361734,10476.139949237704,360,sag,COMPLETE
6104,0.6520362484987444,2023-10-02 12:35:02.236918,2023-10-02 12:35:02.676221,0 days 00:00:00.439303,5180.624669500075,460,sag,COMPLETE
6105,0.666120755540998,2023-10-02 12:35:02.676221,2023-10-02 12:35:03.068736,0 days 00:00:00.392515,27841.369926585405,470,sag,COMPLETE
6106,0.637951741456491,2023-10-02 12:35:03.068736,2023-10-02 12:35:03.445151,0 days 00:00:00.376415,45789.34738121404,490,liblinear,COMPLETE
6107,0.6488699639698657,2023-10-02 12:35:03.445151,2023-10-02 12:35:03.837842,0 days 00:00:00.392691,1426.4713106811412,480,sag,COMPLETE
6108,0.6520362484987444,2023-10-02 12:35:03.837842,2023-10-02 12:35:04.277376,0 days 00:00:00.439534,15292.055036369384,400,sag,COMPLETE
6109,0.6520362484987444,2023-10-02 12:35:04.277376,2023-10-02 12:35:04.653776,0 days 00:00:00.376400,3095.6789479032677,440,sag,COMPLETE
6110,0.6520362484987444,2023-10-02 12:35:04.653776,2023-10-02 12:35:05.077627,0 days 00:00:00.423851,65968.43420545134,290,sag,COMPLETE
6111,0.6013756960366853,2023-10-02 12:35:05.077627,2023-10-02 12:35:05.391413,0 days 00:00:00.313786,2.179421303765664,500,sag,COMPLETE
6112,0.5,2023-10-02 12:35:05.391413,2023-10-02 12:35:06.694688,0 days 00:00:01.303275,1.2334586677405483e-05,230,sag,COMPLETE
6113,0.6108745496233213,2023-10-02 12:35:06.694688,2023-10-02 12:35:06.993048,0 days 00:00:00.298360,4.149351917390039,350,sag,COMPLETE
6114,0.6590785020198712,2023-10-02 12:35:06.993048,2023-10-02 12:35:07.445340,0 days 00:00:00.452292,7566.682343910132,330,sag,COMPLETE
6115,0.5,2023-10-02 12:35:07.447335,2023-10-02 12:35:07.754935,0 days 00:00:00.307600,0.02447416036468047,490,sag,COMPLETE
6116,0.6534556174254831,2023-10-02 12:35:07.756932,2023-10-02 12:35:08.186321,0 days 00:00:00.429389,52.354673430742814,380,lbfgs,COMPLETE
6117,0.5619609127634021,2023-10-02 12:35:08.202787,2023-10-02 12:35:08.503088,0 days 00:00:00.300301,0.9627779397862544,480,sag,COMPLETE
6118,0.6590785020198712,2023-10-02 12:35:08.503088,2023-10-02 12:35:08.985829,0 days 00:00:00.482741,23864.812952884975,500,sag,COMPLETE
6119,0.6590785020198712,2023-10-02 12:35:08.985829,2023-10-02 12:35:09.488746,0 days 00:00:00.502917,35704.45011937147,490,sag,COMPLETE
6120,0.5,2023-10-02 12:35:09.488746,2023-10-02 12:35:09.802699,0 days 00:00:00.313953,0.2303214631978409,370,sag,COMPLETE
6121,0.6590785020198712,2023-10-02 12:35:09.802699,2023-10-02 12:35:10.302254,0 days 00:00:00.499555,13560.128667425162,470,sag,COMPLETE
6122,0.637951741456491,2023-10-02 12:35:10.302997,2023-10-02 12:35:10.719783,0 days 00:00:00.416786,4577.278438404027,460,sag,COMPLETE
6123,0.6534556174254831,2023-10-02 12:35:10.719783,2023-10-02 12:35:11.171588,0 days 00:00:00.451805,91.106002316951,480,sag,COMPLETE
6124,0.637951741456491,2023-10-02 12:35:11.173584,2023-10-02 12:35:11.562653,0 days 00:00:00.389069,557.4075406467513,450,sag,COMPLETE
6125,0.6520362484987444,2023-10-02 12:35:11.562653,2023-10-02 12:35:12.047135,0 days 00:00:00.484482,8492.489806779902,500,sag,COMPLETE
6126,0.6590785020198712,2023-10-02 12:35:12.049144,2023-10-02 12:35:12.409802,0 days 00:00:00.360658,66234.79528560037,360,sag,COMPLETE
6127,0.637951741456491,2023-10-02 12:35:12.425427,2023-10-02 12:35:12.833397,0 days 00:00:00.407970,19847.45696809584,340,newton-cg,COMPLETE
6128,0.6411180259853696,2023-10-02 12:35:12.833397,2023-10-02 12:35:13.206421,0 days 00:00:00.373024,99113.13589930485,320,sag,COMPLETE
6129,0.6590785020198712,2023-10-02 12:35:13.208415,2023-10-02 12:35:13.705671,0 days 00:00:00.497256,34695.98500209687,440,sag,COMPLETE
6130,0.5313352986133857,2023-10-02 12:35:13.707663,2023-10-02 12:35:14.015935,0 days 00:00:00.308272,0.5071581183825019,490,liblinear,COMPLETE
6131,0.6457036794409869,2023-10-02 12:35:14.017935,2023-10-02 12:35:14.462977,0 days 00:00:00.445042,217.5357077622646,470,sag,COMPLETE
6132,0.666120755540998,2023-10-02 12:35:14.462977,2023-10-02 12:35:14.823358,0 days 00:00:00.360381,3199.459077544281,350,sag,COMPLETE
6133,0.6520362484987444,2023-10-02 12:35:14.839006,2023-10-02 12:35:15.357630,0 days 00:00:00.518624,53772.86634895773,390,sag,COMPLETE
6134,0.6077082650944426,2023-10-02 12:35:15.357630,2023-10-02 12:35:15.690355,0 days 00:00:00.332725,3.731373941022222,500,sag,COMPLETE
6135,0.6629544710121192,2023-10-02 12:35:15.704611,2023-10-02 12:35:16.242050,0 days 00:00:00.537439,11988.545977520866,480,sag,COMPLETE
6136,0.6629544710121192,2023-10-02 12:35:16.244048,2023-10-02 12:35:16.690011,0 days 00:00:00.445963,23946.219597337255,490,sag,COMPLETE
6137,0.5,2023-10-02 12:35:16.690011,2023-10-02 12:35:17.140128,0 days 00:00:00.450117,0.0022878409689491286,460,sag,COMPLETE
6138,0.6369145103177202,2023-10-02 12:35:17.140128,2023-10-02 12:35:17.568121,0 days 00:00:00.427993,19.409598857002596,490,sag,COMPLETE
6139,0.637951741456491,2023-10-02 12:35:17.570119,2023-10-02 12:35:18.059689,0 days 00:00:00.489570,6615.565043209018,500,sag,COMPLETE
6140,0.637951741456491,2023-10-02 12:35:18.061693,2023-10-02 12:35:18.406929,0 days 00:00:00.345236,99630.9802127954,330,lbfgs,COMPLETE
6141,0.6590785020198712,2023-10-02 12:35:18.406929,2023-10-02 12:35:18.892844,0 days 00:00:00.485915,48731.445769707956,480,sag,COMPLETE
6142,0.6629544710121192,2023-10-02 12:35:18.894625,2023-10-02 12:35:19.348479,0 days 00:00:00.453854,17595.035807178465,370,sag,COMPLETE
6143,0.5,2023-10-02 12:35:19.350479,2023-10-02 12:35:19.649403,0 days 00:00:00.298924,0.008850687955902983,470,sag,COMPLETE
6144,0.6590785020198712,2023-10-02 12:35:19.651403,2023-10-02 12:35:20.108253,0 days 00:00:00.456850,31017.130460255317,450,sag,COMPLETE
6145,0.5,2023-10-02 12:35:20.108253,2023-10-02 12:35:20.946097,0 days 00:00:00.837844,2.3264782515426733e-05,350,sag,COMPLETE
6146,0.6449939949776177,2023-10-02 12:35:20.957612,2023-10-02 12:35:21.397060,0 days 00:00:00.439448,4497.326004768984,430,sag,COMPLETE
6147,0.5,2023-10-02 12:35:21.397060,2023-10-02 12:35:21.708016,0 days 00:00:00.310956,0.0010649964734501414,500,sag,COMPLETE
6148,0.6449939949776177,2023-10-02 12:35:21.708016,2023-10-02 12:35:22.166951,0 days 00:00:00.458935,1630.0192406785698,480,sag,COMPLETE
6149,0.5,2023-10-02 12:35:22.166951,2023-10-02 12:35:22.497080,0 days 00:00:00.330129,0.0004534324680559423,490,sag,COMPLETE
6150,0.6590785020198712,2023-10-02 12:35:22.497080,2023-10-02 12:35:22.939023,0 days 00:00:00.441943,11982.1158722403,360,sag,COMPLETE
6151,0.5,2023-10-02 12:35:22.940951,2023-10-02 12:35:23.227224,0 days 00:00:00.286273,0.3258352697658108,500,sag,COMPLETE
6152,0.6552025330276231,2023-10-02 12:35:23.241698,2023-10-02 12:35:23.687203,0 days 00:00:00.445505,7749.308485438961,340,sag,COMPLETE
6153,0.5,2023-10-02 12:35:23.687203,2023-10-02 12:35:24.001850,0 days 00:00:00.314647,1.0974271625405093e-05,480,newton-cg,COMPLETE
6154,0.6520362484987444,2023-10-02 12:35:24.001850,2023-10-02 12:35:24.461362,0 days 00:00:00.459512,46796.906432018324,460,sag,COMPLETE
6155,0.6552025330276231,2023-10-02 12:35:24.461362,2023-10-02 12:35:24.810520,0 days 00:00:00.349158,99250.6639471062,300,sag,COMPLETE
6156,0.6590785020198712,2023-10-02 12:35:24.810520,2023-10-02 12:35:25.262095,0 days 00:00:00.451575,19130.97323005714,380,sag,COMPLETE
6157,0.6277432034064855,2023-10-02 12:35:25.262095,2023-10-02 12:35:25.562600,0 days 00:00:00.300505,1028.6385382596775,490,liblinear,COMPLETE
6158,0.6101648651599519,2023-10-02 12:35:25.562600,2023-10-02 12:35:25.950238,0 days 00:00:00.387638,5.185243017764767,420,sag,COMPLETE
6159,0.6541653018888526,2023-10-02 12:35:25.952237,2023-10-02 12:35:26.259856,0 days 00:00:00.307619,29.246360203824594,500,sag,COMPLETE
6160,0.6520362484987444,2023-10-02 12:35:26.263879,2023-10-02 12:35:26.715346,0 days 00:00:00.451467,30412.29355288882,470,sag,COMPLETE
6161,0.5,2023-10-02 12:35:26.715346,2023-10-02 12:35:27.013484,0 days 00:00:00.298138,0.001830321356714667,490,sag,COMPLETE
6162,0.5,2023-10-02 12:35:27.013484,2023-10-02 12:35:27.394565,0 days 00:00:00.381081,0.052862770780779,450,sag,COMPLETE
6163,0.6520362484987444,2023-10-02 12:35:27.394565,2023-10-02 12:35:27.774755,0 days 00:00:00.380190,3161.871659049966,480,sag,COMPLETE
6164,0.6013756960366853,2023-10-02 12:35:27.774755,2023-10-02 12:35:28.167400,0 days 00:00:00.392645,2.398398731941883,360,sag,COMPLETE
6165,0.6449939949776177,2023-10-02 12:35:28.167400,2023-10-02 12:35:28.562938,0 days 00:00:00.395538,63261.223609873006,500,sag,COMPLETE
6166,0.5,2023-10-02 12:35:28.562938,2023-10-02 12:35:28.943543,0 days 00:00:00.380605,0.016266622041318273,490,sag,COMPLETE
6167,0.6203734032099574,2023-10-02 12:35:28.945570,2023-10-02 12:35:29.335232,0 days 00:00:00.389662,7.725941815014318,440,sag,COMPLETE
6168,0.6449939949776177,2023-10-02 12:35:29.335232,2023-10-02 12:35:29.710431,0 days 00:00:00.375199,10053.389100740485,470,sag,COMPLETE
6169,0.666120755540998,2023-10-02 12:35:29.712477,2023-10-02 12:35:30.146855,0 days 00:00:00.434378,5592.985326153004,330,sag,COMPLETE
6170,0.5478764057211486,2023-10-02 12:35:30.148855,2023-10-02 12:35:30.448644,0 days 00:00:00.299789,0.7845115899682757,410,lbfgs,COMPLETE
6171,0.6590785020198712,2023-10-02 12:35:30.448644,2023-10-02 12:35:30.912604,0 days 00:00:00.463960,16030.171087375205,370,sag,COMPLETE
6172,0.5,2023-10-02 12:35:30.912604,2023-10-02 12:35:31.224755,0 days 00:00:00.312151,0.08660749652196618,320,sag,COMPLETE
6173,0.666120755540998,2023-10-02 12:35:31.228665,2023-10-02 12:35:31.696592,0 days 00:00:00.467927,39177.15865067821,460,sag,COMPLETE
6174,0.5,2023-10-02 12:35:31.698592,2023-10-02 12:35:32.113102,0 days 00:00:00.414510,0.0001241419940441035,490,sag,COMPLETE
6175,0.5,2023-10-02 12:35:32.115101,2023-10-02 12:35:32.495295,0 days 00:00:00.380194,0.00544096498716018,350,sag,COMPLETE
6176,0.6520362484987444,2023-10-02 12:35:32.495295,2023-10-02 12:35:32.876939,0 days 00:00:00.381644,21999.046664480375,480,sag,COMPLETE
6177,0.5,2023-10-02 12:35:32.876939,2023-10-02 12:35:33.280449,0 days 00:00:00.403510,0.00030466373104877094,500,newton-cg,COMPLETE
