number,value,datetime_start,datetime_complete,duration,params_C,params_max_iter,params_solver,state
5852,0.6309094879353642,2023-10-02 12:33:19.511116,2023-10-02 12:33:19.903427,0 days 00:00:00.392311,755.2843069341327,440,sag,COMPLETE
5853,0.637951741456491,2023-10-02 12:33:19.903427,2023-10-02 12:33:20.295767,0 days 00:00:00.392340,4766.708146000468,330,newton-cg,COMPLETE
5854,0.6552025330276231,2023-10-02 12:33:20.295767,2023-10-02 12:33:20.656307,0 days 00:00:00.360540,67159.70799289078,450,sag,COMPLETE
5855,0.6449939949776177,2023-10-02 12:33:20.656307,2023-10-02 12:33:21.095528,0 days 00:00:00.439221,7599.400394002432,470,sag,COMPLETE
5856,0.5,2023-10-02 12:33:21.095528,2023-10-02 12:33:21.566363,0 days 00:00:00.470835,7.48885945679301e-05,410,sag,COMPLETE
5857,0.66224478654875,2023-10-02 12:33:21.566363,2023-10-02 12:33:22.036824,0 days 00:00:00.470461,14934.956972263994,500,sag,COMPLETE
5858,0.5478764057211486,2023-10-02 12:33:22.036824,2023-10-02 12:33:22.319365,0 days 00:00:00.282541,0.7442784025899584,490,liblinear,COMPLETE
5859,0.5,2023-10-02 12:33:22.319365,2023-10-02 12:33:22.944178,0 days 00:00:00.624813,4.507664656497528e-05,480,sag,COMPLETE
5860,0.6590785020198712,2023-10-02 12:33:22.944178,2023-10-02 12:33:23.305256,0 days 00:00:00.361078,35072.168978999536,360,sag,COMPLETE
5861,0.5943334425155585,2023-10-02 12:33:23.305256,2023-10-02 12:33:23.681951,0 days 00:00:00.376695,2.1018976702277405,340,sag,COMPLETE
5862,0.6457036794409869,2023-10-02 12:33:23.681951,2023-10-02 12:33:24.033848,0 days 00:00:00.351897,255.0329715221445,460,sag,COMPLETE
5863,0.6590785020198712,2023-10-02 12:33:24.033848,2023-10-02 12:33:24.500369,0 days 00:00:00.466521,21569.790887649888,490,sag,COMPLETE
5864,0.5,2023-10-02 12:33:24.502369,2023-10-02 12:33:24.793274,0 days 00:00:00.290905,0.02499457661936038,420,sag,COMPLETE
5865,0.5,2023-10-02 12:33:24.793274,2023-10-02 12:33:25.169438,0 days 00:00:00.376164,0.0018162137173447263,480,sag,COMPLETE
5866,0.6590785020198712,2023-10-02 12:33:25.169438,2023-10-02 12:33:25.566864,0 days 00:00:00.397426,3106.796527039083,500,sag,COMPLETE
5867,0.6520362484987444,2023-10-02 12:33:25.566864,2023-10-02 12:33:26.000981,0 days 00:00:00.434117,64420.91053032311,350,sag,COMPLETE
5868,0.5,2023-10-02 12:33:26.000981,2023-10-02 12:33:26.314737,0 days 00:00:00.313756,0.00020899876739187225,470,sag,COMPLETE
5869,0.637951741456491,2023-10-02 12:33:26.314737,2023-10-02 12:33:26.722703,0 days 00:00:00.407966,11232.929584112919,500,lbfgs,COMPLETE
5870,0.5,2023-10-02 12:33:26.722703,2023-10-02 12:33:27.020332,0 days 00:00:00.297629,0.0058443735182645475,490,sag,COMPLETE
5871,0.6449939949776177,2023-10-02 12:33:27.020332,2023-10-02 12:33:27.459535,0 days 00:00:00.439203,1779.7509046204236,370,sag,COMPLETE
5872,0.5,2023-10-02 12:33:27.459535,2023-10-02 12:33:27.742093,0 days 00:00:00.282558,0.08558777243090644,480,sag,COMPLETE
5873,0.6534556174254831,2023-10-02 12:33:27.742093,2023-10-02 12:33:28.118783,0 days 00:00:00.376690,42.125273541233724,450,sag,COMPLETE
5874,0.6590785020198712,2023-10-02 12:33:28.118783,2023-10-02 12:33:28.479829,0 days 00:00:00.361046,6126.652337670689,490,sag,COMPLETE
5875,0.6520362484987444,2023-10-02 12:33:28.495471,2023-10-02 12:33:28.918543,0 days 00:00:00.423072,33407.70556708104,380,sag,COMPLETE
5876,0.6527459329621137,2023-10-02 12:33:28.918543,2023-10-02 12:33:29.263555,0 days 00:00:00.345012,46860.60337486968,360,sag,COMPLETE
5877,0.5,2023-10-02 12:33:29.263555,2023-10-02 12:33:29.640267,0 days 00:00:00.376712,0.08881475134875262,500,sag,COMPLETE
5878,0.5,2023-10-02 12:33:29.640267,2023-10-02 12:33:29.938423,0 days 00:00:00.298156,3.053266069903666e-05,460,newton-cg,COMPLETE
5879,0.5,2023-10-02 12:33:29.938423,2023-10-02 12:33:30.958143,0 days 00:00:01.019720,1.7778137554231384e-05,470,sag,COMPLETE
5880,0.6590785020198712,2023-10-02 12:33:30.958143,2023-10-02 12:33:31.319248,0 days 00:00:00.361105,17269.50021039714,430,sag,COMPLETE
5881,0.6534556174254831,2023-10-02 12:33:31.319248,2023-10-02 12:33:31.727246,0 days 00:00:00.407998,113.33432919817368,490,sag,COMPLETE
5882,0.6418277104487389,2023-10-02 12:33:31.727246,2023-10-02 12:33:32.072280,0 days 00:00:00.345034,457.01276995186254,350,sag,COMPLETE
5883,0.637951741456491,2023-10-02 12:33:32.081296,2023-10-02 12:33:32.464560,0 days 00:00:00.383264,9860.025622878491,310,liblinear,COMPLETE
5884,0.5,2023-10-02 12:33:32.464560,2023-10-02 12:33:32.778323,0 days 00:00:00.313763,0.006681559707494469,480,sag,COMPLETE
5885,0.6449939949776177,2023-10-02 12:33:32.782840,2023-10-02 12:33:33.217938,0 days 00:00:00.435098,1107.5094087962127,340,sag,COMPLETE
5886,0.5619609127634021,2023-10-02 12:33:33.217938,2023-10-02 12:33:33.515582,0 days 00:00:00.297644,0.9749792070362072,490,sag,COMPLETE
5887,0.5,2023-10-02 12:33:33.531211,2023-10-02 12:33:33.923533,0 days 00:00:00.392322,0.001078890741162924,500,sag,COMPLETE
5888,0.666120755540998,2023-10-02 12:33:33.923533,2023-10-02 12:33:34.286178,0 days 00:00:00.362645,65841.77464126276,440,sag,COMPLETE
5889,0.6590785020198712,2023-10-02 12:33:34.286178,2023-10-02 12:33:34.756659,0 days 00:00:00.470481,4216.832804860635,470,sag,COMPLETE
5890,0.6559122174909924,2023-10-02 12:33:34.756659,2023-10-02 12:33:35.102097,0 days 00:00:00.345438,23962.692634774998,330,sag,COMPLETE
5891,0.637951741456491,2023-10-02 12:33:35.102097,2023-10-02 12:33:35.494439,0 days 00:00:00.392342,34092.288803972006,480,lbfgs,COMPLETE
5892,0.669996724533246,2023-10-02 12:33:35.510087,2023-10-02 12:33:35.870727,0 days 00:00:00.360640,99599.90905190645,500,sag,COMPLETE
5893,0.5823779888634131,2023-10-02 12:33:35.870727,2023-10-02 12:33:36.246935,0 days 00:00:00.376208,1.1816303903306042,400,sag,COMPLETE
5894,0.666120755540998,2023-10-02 12:33:36.246935,2023-10-02 12:33:36.608016,0 days 00:00:00.361081,13704.073410569867,460,sag,COMPLETE
5895,0.5,2023-10-02 12:33:36.608016,2023-10-02 12:33:37.172632,0 days 00:00:00.564616,6.056608252358132e-05,480,sag,COMPLETE
5896,0.6298722567965934,2023-10-02 12:33:37.188260,2023-10-02 12:33:37.470774,0 days 00:00:00.282514,15.818093529678345,370,sag,COMPLETE
5897,0.6449939949776177,2023-10-02 12:33:37.486400,2023-10-02 12:33:37.909886,0 days 00:00:00.423486,7453.231341963113,350,sag,COMPLETE
5898,0.5,2023-10-02 12:33:37.909886,2023-10-02 12:33:38.208027,0 days 00:00:00.298141,0.004516906799415704,490,sag,COMPLETE
5899,0.6590785020198712,2023-10-02 12:33:38.208027,2023-10-02 12:33:38.647254,0 days 00:00:00.439227,47031.30001220682,500,sag,COMPLETE
5900,0.6457036794409869,2023-10-02 12:33:38.647254,2023-10-02 12:33:39.039596,0 days 00:00:00.392342,323.0960843795403,450,sag,COMPLETE
5901,0.6449939949776177,2023-10-02 12:33:39.039596,2023-10-02 12:33:39.478807,0 days 00:00:00.439211,2572.5820066504148,390,sag,COMPLETE
5902,0.6520362484987444,2023-10-02 12:33:39.478807,2023-10-02 12:33:39.839388,0 days 00:00:00.360581,20234.338670010726,360,sag,COMPLETE
5903,0.5,2023-10-02 12:33:39.839388,2023-10-02 12:33:40.216099,0 days 00:00:00.376711,0.015779411209798384,490,newton-cg,COMPLETE
5904,0.5,2023-10-02 12:33:40.216099,2023-10-02 12:33:40.529891,0 days 00:00:00.313792,0.032692842820258694,470,sag,COMPLETE
5905,0.6449939949776177,2023-10-02 12:33:40.529891,2023-10-02 12:33:41.001138,0 days 00:00:00.471247,5219.60054741101,490,sag,COMPLETE
5906,0.637951741456491,2023-10-02 12:33:41.001138,2023-10-02 12:33:41.301808,0 days 00:00:00.300670,66675.61478273764,500,liblinear,COMPLETE
5907,0.6590785020198712,2023-10-02 12:33:41.301808,2023-10-02 12:33:41.767210,0 days 00:00:00.465402,99663.73705178907,460,sag,COMPLETE
5908,0.6520362484987444,2023-10-02 12:33:41.782726,2023-10-02 12:33:42.133103,0 days 00:00:00.350377,32317.077533636253,280,sag,COMPLETE
5909,0.5,2023-10-02 12:33:42.134867,2023-10-02 12:33:42.515248,0 days 00:00:00.380381,0.09237997051580656,480,sag,COMPLETE
5910,0.6552025330276231,2023-10-02 12:33:42.515248,2023-10-02 12:33:42.860289,0 days 00:00:00.345041,12202.912652499894,370,sag,COMPLETE
5911,0.5,2023-10-02 12:33:42.860289,2023-10-02 12:33:43.250566,0 days 00:00:00.390277,0.10940744330656287,330,sag,COMPLETE
5912,0.6520362484987444,2023-10-02 12:33:43.250566,2023-10-02 12:33:43.627276,0 days 00:00:00.376710,22479.82853795791,480,sag,COMPLETE
5913,0.6590785020198712,2023-10-02 12:33:43.627276,2023-10-02 12:33:44.035202,0 days 00:00:00.407926,8324.780637511732,340,sag,COMPLETE
5914,0.6534556174254831,2023-10-02 12:33:44.050821,2023-10-02 12:33:44.367669,0 days 00:00:00.316848,86.04736334896795,500,sag,COMPLETE
5915,0.608417949557812,2023-10-02 12:33:44.367669,2023-10-02 12:33:44.766807,0 days 00:00:00.399138,2.971855254564291,360,sag,COMPLETE
5916,0.5,2023-10-02 12:33:44.766807,2023-10-02 12:33:45.080552,0 days 00:00:00.313745,0.000514542241888493,320,sag,COMPLETE
5917,0.643956763838847,2023-10-02 12:33:45.080552,2023-10-02 12:33:45.488520,0 days 00:00:00.407968,25.243261509278156,470,lbfgs,COMPLETE
5918,0.528169014084507,2023-10-02 12:33:45.488520,2023-10-02 12:33:45.771055,0 days 00:00:00.282535,0.4222517215403927,450,sag,COMPLETE
5919,0.6520362484987444,2023-10-02 12:33:45.771055,2023-10-02 12:33:46.253050,0 days 00:00:00.481995,3391.033699643959,490,sag,COMPLETE
5920,0.6520362484987444,2023-10-02 12:33:46.253050,2023-10-02 12:33:46.614120,0 days 00:00:00.361070,46475.06500445335,430,sag,COMPLETE
5921,0.5,2023-10-02 12:33:46.614120,2023-10-02 12:33:46.990413,0 days 00:00:00.376293,0.002605120850245692,490,sag,COMPLETE
5922,0.5,2023-10-02 12:33:46.990413,2023-10-02 12:33:47.288562,0 days 00:00:00.298149,0.0030646004066496807,380,sag,COMPLETE
5923,0.5982094115078066,2023-10-02 12:33:47.288562,2023-10-02 12:33:47.677886,0 days 00:00:00.389324,1.8719045652229194,350,sag,COMPLETE
5924,0.5,2023-10-02 12:33:47.677886,2023-10-02 12:33:48.086585,0 days 00:00:00.408699,0.0001819534162627538,500,sag,COMPLETE
5925,0.6449939949776177,2023-10-02 12:33:48.086585,2023-10-02 12:33:48.553638,0 days 00:00:00.467053,1627.1345534280692,480,sag,COMPLETE
5926,0.6552025330276231,2023-10-02 12:33:48.553638,2023-10-02 12:33:48.943369,0 days 00:00:00.389731,14975.34631902302,340,sag,COMPLETE
5927,0.637951741456491,2023-10-02 12:33:48.946358,2023-10-02 12:33:49.536139,0 days 00:00:00.589781,5537.376343033838,460,sag,COMPLETE
5928,0.5,2023-10-02 12:33:49.536139,2023-10-02 12:33:49.818152,0 days 00:00:00.282013,0.1870243905278351,480,sag,COMPLETE
5929,0.6062888961677039,2023-10-02 12:33:49.818152,2023-10-02 12:33:50.194920,0 days 00:00:00.376768,6.082074879425693,490,newton-cg,COMPLETE
5930,0.6520362484987444,2023-10-02 12:33:50.194920,2023-10-02 12:33:50.571798,0 days 00:00:00.376878,32809.55834608693,500,sag,COMPLETE
5931,0.6534556174254831,2023-10-02 12:33:50.571798,2023-10-02 12:33:50.948614,0 days 00:00:00.376816,64.8040614590542,470,sag,COMPLETE
5932,0.637951741456491,2023-10-02 12:33:50.948614,2023-10-02 12:33:51.231167,0 days 00:00:00.282553,9499.006704569227,440,liblinear,COMPLETE
5933,0.5376678676711432,2023-10-02 12:33:51.246846,2023-10-02 12:33:51.644769,0 days 00:00:00.397923,0.5929090299366108,350,sag,COMPLETE
5934,0.6267059722677149,2023-10-02 12:33:51.648775,2023-10-02 12:33:51.943464,0 days 00:00:00.294689,12.5184082601709,500,sag,COMPLETE
5935,0.5,2023-10-02 12:33:51.943464,2023-10-02 12:33:52.318645,0 days 00:00:00.375181,0.013170797158026477,370,sag,COMPLETE
5936,0.666120755540998,2023-10-02 12:33:52.320645,2023-10-02 12:33:52.673197,0 days 00:00:00.352552,60174.82577655853,360,sag,COMPLETE
5937,0.6418277104487389,2023-10-02 12:33:52.673197,2023-10-02 12:33:53.114486,0 days 00:00:00.441289,461.2284741509264,470,sag,COMPLETE
5938,0.6203734032099574,2023-10-02 12:33:53.114486,2023-10-02 12:33:53.417168,0 days 00:00:00.302682,8.023150695277483,490,sag,COMPLETE
5939,0.6520362484987444,2023-10-02 12:33:53.419045,2023-10-02 12:33:53.854788,0 days 00:00:00.435743,19942.5041736373,460,sag,COMPLETE
5940,0.637951741456491,2023-10-02 12:33:53.870440,2023-10-02 12:33:54.248982,0 days 00:00:00.378542,976.8220201178344,480,sag,COMPLETE
5941,0.5,2023-10-02 12:33:54.250977,2023-10-02 12:33:54.626307,0 days 00:00:00.375330,0.00014133084804165028,500,lbfgs,COMPLETE
5942,0.6590785020198712,2023-10-02 12:33:54.635828,2023-10-02 12:33:54.997676,0 days 00:00:00.361848,32032.535225739255,490,sag,COMPLETE
5943,0.6590785020198712,2023-10-02 12:33:55.013080,2023-10-02 12:33:55.453312,0 days 00:00:00.440232,64099.09455206211,380,sag,COMPLETE
5944,0.6590785020198712,2023-10-02 12:33:55.453312,2023-10-02 12:33:55.831043,0 days 00:00:00.377731,4168.910733264013,490,sag,COMPLETE
5945,0.6520362484987444,2023-10-02 12:33:55.831043,2023-10-02 12:33:56.270310,0 days 00:00:00.439267,99785.05549660286,450,sag,COMPLETE
5946,0.6590785020198712,2023-10-02 12:33:56.270310,2023-10-02 12:33:56.615609,0 days 00:00:00.345299,9499.333667404026,330,sag,COMPLETE
5947,0.649579648433235,2023-10-02 12:33:56.615609,2023-10-02 12:33:57.023781,0 days 00:00:00.408172,152.87928112450962,480,sag,COMPLETE
5948,0.6583688175565019,2023-10-02 12:33:57.023781,2023-10-02 12:33:57.400570,0 days 00:00:00.376789,14419.624865885165,500,sag,COMPLETE
5949,0.5,2023-10-02 12:33:57.400570,2023-10-02 12:33:57.777294,0 days 00:00:00.376724,0.0597771984391732,440,sag,COMPLETE
5950,0.6590785020198712,2023-10-02 12:33:57.777294,2023-10-02 12:33:58.137850,0 days 00:00:00.360556,44942.15334310975,470,sag,COMPLETE
5951,0.637951741456491,2023-10-02 12:33:58.137850,2023-10-02 12:33:58.561782,0 days 00:00:00.423932,2463.3636511751115,340,sag,COMPLETE
5952,0.666120755540998,2023-10-02 12:33:58.561782,2023-10-02 12:33:58.922657,0 days 00:00:00.360875,23882.68080991385,350,sag,COMPLETE
5953,0.637951741456491,2023-10-02 12:33:58.922657,2023-10-02 12:33:59.299575,0 days 00:00:00.376918,6356.217703131846,460,newton-cg,COMPLETE
5954,0.6534556174254831,2023-10-02 12:33:59.299575,2023-10-02 12:33:59.612220,0 days 00:00:00.312645,43.86695800022882,420,sag,COMPLETE
5955,0.666120755540998,2023-10-02 12:33:59.614220,2023-10-02 12:34:00.105941,0 days 00:00:00.491721,17276.868384329002,490,sag,COMPLETE
5956,0.637951741456491,2023-10-02 12:34:00.107945,2023-10-02 12:34:00.406139,0 days 00:00:00.298194,45220.88517724117,360,liblinear,COMPLETE
5957,0.5,2023-10-02 12:34:00.406139,2023-10-02 12:34:00.791150,0 days 00:00:00.385011,0.010667056432848765,490,sag,COMPLETE
5958,0.6520362484987444,2023-10-02 12:34:00.806784,2023-10-02 12:34:01.181106,0 days 00:00:00.374322,8134.377716866142,480,sag,COMPLETE
5959,0.5,2023-10-02 12:34:01.183106,2023-10-02 12:34:02.056683,0 days 00:00:00.873577,2.3286051396076634e-05,500,sag,COMPLETE
5960,0.6520362484987444,2023-10-02 12:34:02.056683,2023-10-02 12:34:02.401765,0 days 00:00:00.345082,28477.289875966148,320,sag,COMPLETE
5961,0.5982094115078066,2023-10-02 12:34:02.401765,2023-10-02 12:34:02.778445,0 days 00:00:00.376680,1.9306325586132176,450,sag,COMPLETE
5962,0.6520362484987444,2023-10-02 12:34:02.778445,2023-10-02 12:34:03.135807,0 days 00:00:00.357362,62791.76171471211,370,sag,COMPLETE
5963,0.6267059722677149,2023-10-02 12:34:03.137801,2023-10-02 12:34:03.505969,0 days 00:00:00.368168,10.393398179605994,470,sag,COMPLETE
5964,0.6520362484987444,2023-10-02 12:34:03.505969,2023-10-02 12:34:03.884744,0 days 00:00:00.378775,4185.116001471506,500,sag,COMPLETE
5965,0.6520362484987444,2023-10-02 12:34:03.886744,2023-10-02 12:34:04.344963,0 days 00:00:00.458219,12713.331717879615,480,sag,COMPLETE
5966,0.6590785020198712,2023-10-02 12:34:04.344963,2023-10-02 12:34:04.718655,0 days 00:00:00.373692,30698.762754242518,430,sag,COMPLETE
5967,0.637951741456491,2023-10-02 12:34:04.718655,2023-10-02 12:34:05.126600,0 days 00:00:00.407945,67775.56388669278,390,lbfgs,COMPLETE
5968,0.6449939949776177,2023-10-02 12:34:05.126600,2023-10-02 12:34:05.514015,0 days 00:00:00.387415,2551.350443478935,490,sag,COMPLETE
5969,0.666120755540998,2023-10-02 12:34:05.514015,2023-10-02 12:34:05.977631,0 days 00:00:00.463616,6075.318450105855,480,sag,COMPLETE
5970,0.5,2023-10-02 12:34:05.993253,2023-10-02 12:34:06.307317,0 days 00:00:00.314064,0.0008875388318067267,460,sag,COMPLETE
5971,0.6449939949776177,2023-10-02 12:34:06.309320,2023-10-02 12:34:06.812504,0 days 00:00:00.503184,1313.808057647913,360,sag,COMPLETE
5972,0.6541653018888526,2023-10-02 12:34:06.812504,2023-10-02 12:34:07.125946,0 days 00:00:00.313442,29.423481825127485,500,sag,COMPLETE
5973,0.5,2023-10-02 12:34:07.125946,2023-10-02 12:34:07.526692,0 days 00:00:00.400746,0.0006648007982851687,340,sag,COMPLETE
5974,0.6457036794409869,2023-10-02 12:34:07.542312,2023-10-02 12:34:07.874904,0 days 00:00:00.332592,266.2357380839485,350,sag,COMPLETE
5975,0.666120755540998,2023-10-02 12:34:07.890531,2023-10-02 12:34:08.373108,0 days 00:00:00.482577,20184.71043314891,470,sag,COMPLETE
5976,0.666120755540998,2023-10-02 12:34:08.378221,2023-10-02 12:34:08.828975,0 days 00:00:00.450754,44062.56564739476,490,sag,COMPLETE
5977,0.5478764057211486,2023-10-02 12:34:08.829972,2023-10-02 12:34:09.219458,0 days 00:00:00.389486,0.7591036277118269,500,sag,COMPLETE
5978,0.6534556174254831,2023-10-02 12:34:09.221457,2023-10-02 12:34:09.523216,0 days 00:00:00.301759,52.436845316035445,480,sag,COMPLETE
5979,0.637951741456491,2023-10-02 12:34:09.523216,2023-10-02 12:34:09.931081,0 days 00:00:00.407865,11221.97533480034,450,newton-cg,COMPLETE
5980,0.5,2023-10-02 12:34:09.944762,2023-10-02 12:34:10.270866,0 days 00:00:00.326104,0.19953920693740798,380,sag,COMPLETE
5981,0.6449939949776177,2023-10-02 12:34:10.270866,2023-10-02 12:34:10.753683,0 days 00:00:00.482817,17326.954940830998,490,sag,COMPLETE
5982,0.5,2023-10-02 12:34:10.753683,2023-10-02 12:34:11.052914,0 days 00:00:00.299231,0.01048801318886176,480,liblinear,COMPLETE
5983,0.6520362484987444,2023-10-02 12:34:11.052914,2023-10-02 12:34:11.491523,0 days 00:00:00.438609,33803.88767564867,370,sag,COMPLETE
5984,0.6520362484987444,2023-10-02 12:34:11.491523,2023-10-02 12:34:11.883303,0 days 00:00:00.391780,99634.24963766229,470,sag,COMPLETE
5985,0.6449939949776177,2023-10-02 12:34:11.883303,2023-10-02 12:34:12.358475,0 days 00:00:00.475172,8134.335737690078,500,sag,COMPLETE
5986,0.637951741456491,2023-10-02 12:34:12.358475,2023-10-02 12:34:12.716886,0 days 00:00:00.358411,669.9168696251867,330,sag,COMPLETE
5987,0.6449939949776177,2023-10-02 12:34:12.718887,2023-10-02 12:34:13.156373,0 days 00:00:00.437486,3856.474912630513,440,sag,COMPLETE
5988,0.6520362484987444,2023-10-02 12:34:13.156373,2023-10-02 12:34:13.568063,0 days 00:00:00.411690,49093.36156733601,490,sag,COMPLETE
5989,0.5,2023-10-02 12:34:13.570063,2023-10-02 12:34:13.992527,0 days 00:00:00.422464,0.008187606347103308,500,sag,COMPLETE
5990,0.5,2023-10-02 12:34:13.992527,2023-10-02 12:34:14.304986,0 days 00:00:00.312459,0.3195426213719989,460,sag,COMPLETE
5991,0.6101648651599519,2023-10-02 12:34:14.306987,2023-10-02 12:34:14.686394,0 days 00:00:00.379407,5.451044273039919,360,lbfgs,COMPLETE
5992,0.637951741456491,2023-10-02 12:34:14.686394,2023-10-02 12:34:15.045724,0 days 00:00:00.359330,2097.9863883169755,350,sag,COMPLETE
5993,0.6590785020198712,2023-10-02 12:34:15.045724,2023-10-02 12:34:15.519574,0 days 00:00:00.473850,22733.982286572704,480,sag,COMPLETE
5994,0.6449939949776177,2023-10-02 12:34:15.519574,2023-10-02 12:34:15.893066,0 days 00:00:00.373492,14796.010648094329,490,sag,COMPLETE
5995,0.6449939949776177,2023-10-02 12:34:15.893066,2023-10-02 12:34:16.348208,0 days 00:00:00.455142,5486.716418313089,340,sag,COMPLETE
5996,0.66224478654875,2023-10-02 12:34:16.348208,2023-10-02 12:34:16.743601,0 days 00:00:00.395393,67705.62699936556,480,sag,COMPLETE
5997,0.666120755540998,2023-10-02 12:34:16.743601,2023-10-02 12:34:17.193259,0 days 00:00:00.449658,11123.137203328833,310,sag,COMPLETE
5998,0.528169014084507,2023-10-02 12:34:17.193259,2023-10-02 12:34:17.517428,0 days 00:00:00.324169,0.4450732882459091,470,sag,COMPLETE
5999,0.5,2023-10-02 12:34:17.519421,2023-10-02 12:34:17.914171,0 days 00:00:00.394750,0.0038775431924300916,450,sag,COMPLETE
6000,0.6481602795064964,2023-10-02 12:34:17.914171,2023-10-02 12:34:18.345099,0 days 00:00:00.430928,37752.49744585444,500,sag,COMPLETE
6001,0.5996287804345454,2023-10-02 12:34:18.345099,2023-10-02 12:34:18.721852,0 days 00:00:00.376753,1.4569915794257826,490,sag,COMPLETE
6002,0.6534556174254831,2023-10-02 12:34:18.721852,2023-10-02 12:34:19.050347,0 days 00:00:00.328495,123.51547801126623,370,newton-cg,COMPLETE
6003,0.6449939949776177,2023-10-02 12:34:19.050347,2023-10-02 12:34:19.518703,0 days 00:00:00.468356,24490.483789766047,400,sag,COMPLETE
6004,0.666120755540998,2023-10-02 12:34:19.518703,2023-10-02 12:34:19.894870,0 days 00:00:00.376167,7265.495218712025,460,sag,COMPLETE
6005,0.5,2023-10-02 12:34:19.894870,2023-10-02 12:34:20.476323,0 days 00:00:00.581453,6.177191924947877e-05,490,sag,COMPLETE
6006,0.604541980565564,2023-10-02 12:34:20.478323,2023-10-02 12:34:20.782329,0 days 00:00:00.304006,3.1814674048181137,300,liblinear,COMPLETE
6007,0.6559122174909924,2023-10-02 12:34:20.797973,2023-10-02 12:34:21.269003,0 days 00:00:00.471030,3123.3977271322615,470,sag,COMPLETE
6008,0.5,2023-10-02 12:34:21.269003,2023-10-02 12:34:22.224092,0 days 00:00:00.955089,1.760143138464282e-05,380,sag,COMPLETE
6009,0.5,2023-10-02 12:34:22.224092,2023-10-02 12:34:22.632043,0 days 00:00:00.407951,0.0002353806164584321,270,sag,COMPLETE
6010,0.6457036794409869,2023-10-02 12:34:22.632043,2023-10-02 12:34:22.993099,0 days 00:00:00.361056,184.10820527546485,500,sag,COMPLETE
6011,0.666120755540998,2023-10-02 12:34:22.993099,2023-10-02 12:34:23.499861,0 days 00:00:00.506762,69393.64399698484,360,sag,COMPLETE
6012,0.5,2023-10-02 12:34:23.502866,2023-10-02 12:34:23.957986,0 days 00:00:00.455120,0.0012087676165153899,490,sag,COMPLETE
6013,0.6077082650944426,2023-10-02 12:34:23.959992,2023-10-02 12:34:24.399700,0 days 00:00:00.439708,3.8698030194013207,480,sag,COMPLETE
6014,0.5,2023-10-02 12:34:24.401712,2023-10-02 12:34:24.772139,0 days 00:00:00.370427,0.0033004574535443667,320,sag,COMPLETE
