number,value,datetime_start,datetime_complete,duration,params_C,params_max_iter,params_solver,state
3734,0.649579648433235,2023-10-02 12:21:11.648388,2023-10-02 12:21:11.935124,0 days 00:00:00.286736,132.61202560683452,390,sag,COMPLETE
3735,0.6449939949776177,2023-10-02 12:21:11.936126,2023-10-02 12:21:12.136701,0 days 00:00:00.200575,99017.1143597654,480,newton-cg,COMPLETE
3736,0.6590785020198712,2023-10-02 12:21:12.136701,2023-10-02 12:21:12.388516,0 days 00:00:00.251815,45671.33315176969,450,sag,COMPLETE
3737,0.5,2023-10-02 12:21:12.388516,2023-10-02 12:21:12.639721,0 days 00:00:00.251205,0.037802326665816344,360,saga,COMPLETE
3738,0.5,2023-10-02 12:21:12.639721,2023-10-02 12:21:12.827979,0 days 00:00:00.188258,0.0012968048170464831,480,sag,COMPLETE
3739,0.5,2023-10-02 12:21:12.827979,2023-10-02 12:21:13.016274,0 days 00:00:00.188295,0.09892013653996047,480,sag,COMPLETE
3740,0.6520362484987444,2023-10-02 12:21:13.016274,2023-10-02 12:21:13.267364,0 days 00:00:00.251090,23219.828438159242,460,sag,COMPLETE
3741,0.6488699639698657,2023-10-02 12:21:13.267364,2023-10-02 12:21:13.613797,0 days 00:00:00.346433,9348.65178858119,470,sag,COMPLETE
3742,0.6502893328966044,2023-10-02 12:21:13.613797,2023-10-02 12:21:13.785696,0 days 00:00:00.171899,33.29410111213514,470,liblinear,COMPLETE
3743,0.6418277104487389,2023-10-02 12:21:13.785696,2023-10-02 12:21:14.022194,0 days 00:00:00.236498,196.3695667532441,350,saga,COMPLETE
3744,0.5,2023-10-02 12:21:14.023194,2023-10-02 12:21:14.273669,0 days 00:00:00.250475,0.16772004567963092,480,sag,COMPLETE
3745,0.6062888961677039,2023-10-02 12:21:14.275669,2023-10-02 12:21:14.446040,0 days 00:00:00.170371,5.638051619975507,420,sag,COMPLETE
3746,0.6534556174254831,2023-10-02 12:21:14.446040,2023-10-02 12:21:14.671360,0 days 00:00:00.225320,65.13911672563489,450,sag,COMPLETE
3747,0.6203734032099574,2023-10-02 12:21:14.671360,2023-10-02 12:21:14.939655,0 days 00:00:00.268295,7.496645452445285,480,sag,COMPLETE
3748,0.6481602795064964,2023-10-02 12:21:14.940654,2023-10-02 12:21:15.165897,0 days 00:00:00.225243,66629.3591176527,280,sag,COMPLETE
3749,0.6552025330276231,2023-10-02 12:21:15.167517,2023-10-02 12:21:15.430087,0 days 00:00:00.262570,99577.5013569071,460,saga,COMPLETE
3750,0.5,2023-10-02 12:21:15.432086,2023-10-02 12:21:15.610305,0 days 00:00:00.178219,0.011487673468197509,480,sag,COMPLETE
3751,0.637951741456491,2023-10-02 12:21:15.612305,2023-10-02 12:21:15.903933,0 days 00:00:00.291628,33329.92633121657,330,lbfgs,COMPLETE
3752,0.5,2023-10-02 12:21:15.904933,2023-10-02 12:21:16.089446,0 days 00:00:00.184513,0.00540940391281924,440,sag,COMPLETE
3753,0.6449939949776177,2023-10-02 12:21:16.091446,2023-10-02 12:21:16.352280,0 days 00:00:00.260834,15455.720406427601,470,sag,COMPLETE
3754,0.5,2023-10-02 12:21:16.353272,2023-10-02 12:21:16.691433,0 days 00:00:00.338161,0.000146284565123345,460,sag,COMPLETE
3755,0.5855442733922918,2023-10-02 12:21:16.691433,2023-10-02 12:21:16.863649,0 days 00:00:00.172216,1.297252835609222,480,saga,COMPLETE
3756,0.6418277104487389,2023-10-02 12:21:16.879285,2023-10-02 12:21:17.130539,0 days 00:00:00.251254,383.49725618026304,450,sag,COMPLETE
3757,0.6520362484987444,2023-10-02 12:21:17.130539,2023-10-02 12:21:17.486053,0 days 00:00:00.355514,10294.750556370389,480,sag,COMPLETE
3758,0.6520362484987444,2023-10-02 12:21:17.486053,2023-10-02 12:21:17.759380,0 days 00:00:00.273327,23355.284568897718,470,sag,COMPLETE
3759,0.5,2023-10-02 12:21:17.759380,2023-10-02 12:21:18.053008,0 days 00:00:00.293628,0.00012051436584105746,440,sag,COMPLETE
3760,0.5,2023-10-02 12:21:18.053008,2023-10-02 12:21:18.469474,0 days 00:00:00.416466,6.699177179424639e-05,470,saga,COMPLETE
3761,0.5,2023-10-02 12:21:18.485821,2023-10-02 12:21:18.735872,0 days 00:00:00.250051,0.00044678327170478575,460,newton-cg,COMPLETE
3762,0.6559122174909924,2023-10-02 12:21:18.735872,2023-10-02 12:21:19.014649,0 days 00:00:00.278777,46373.59177647242,430,sag,COMPLETE
3763,0.666120755540998,2023-10-02 12:21:19.015659,2023-10-02 12:21:19.336907,0 days 00:00:00.321248,33089.94689000354,480,sag,COMPLETE
3764,0.5478764057211486,2023-10-02 12:21:19.336907,2023-10-02 12:21:19.619271,0 days 00:00:00.282364,0.7319382787922142,480,liblinear,COMPLETE
3765,0.643956763838847,2023-10-02 12:21:19.619271,2023-10-02 12:21:19.842955,0 days 00:00:00.223684,25.520280221460492,450,sag,COMPLETE
3766,0.666120755540998,2023-10-02 12:21:19.844955,2023-10-02 12:21:20.105600,0 days 00:00:00.260645,17051.847915793962,460,sag,COMPLETE
3767,0.5,2023-10-02 12:21:20.106600,2023-10-02 12:21:20.275451,0 days 00:00:00.168851,0.011780669788885017,480,saga,COMPLETE
3768,0.6552025330276231,2023-10-02 12:21:20.275451,2023-10-02 12:21:20.624507,0 days 00:00:00.349056,62040.24307519535,470,sag,COMPLETE
3769,0.5,2023-10-02 12:21:20.625507,2023-10-02 12:21:20.793323,0 days 00:00:00.167816,0.1849731353421253,380,sag,COMPLETE
3770,0.6449939949776177,2023-10-02 12:21:20.793323,2023-10-02 12:21:21.060498,0 days 00:00:00.267175,887.1658582215022,470,sag,COMPLETE
3771,0.6590785020198712,2023-10-02 12:21:21.060498,2023-10-02 12:21:21.405505,0 days 00:00:00.345007,9316.42297447788,450,sag,COMPLETE
3772,0.619663718746588,2023-10-02 12:21:21.405505,2023-10-02 12:21:21.578220,0 days 00:00:00.172715,9.411987274196251,480,sag,COMPLETE
3773,0.5,2023-10-02 12:21:21.593841,2023-10-02 12:21:21.766161,0 days 00:00:00.172320,0.23141282558248333,480,saga,COMPLETE
3774,0.666120755540998,2023-10-02 12:21:21.766161,2023-10-02 12:21:22.033101,0 days 00:00:00.266940,27070.418578638637,440,sag,COMPLETE
3775,0.6590785020198712,2023-10-02 12:21:22.033101,2023-10-02 12:21:22.362706,0 days 00:00:00.329605,46223.24461743796,460,sag,COMPLETE
3776,0.6449939949776177,2023-10-02 12:21:22.362706,2023-10-02 12:21:22.645292,0 days 00:00:00.282586,14602.49507637439,470,sag,COMPLETE
3777,0.5,2023-10-02 12:21:22.645292,2023-10-02 12:21:22.833741,0 days 00:00:00.188449,0.27090692537138866,310,lbfgs,COMPLETE
3778,0.6077082650944426,2023-10-02 12:21:22.833741,2023-10-02 12:21:23.084745,0 days 00:00:00.251004,3.4773858713885315,480,sag,COMPLETE
3779,0.6520362484987444,2023-10-02 12:21:23.084745,2023-10-02 12:21:23.323564,0 days 00:00:00.238819,59139.61272820189,340,saga,COMPLETE
3780,0.5,2023-10-02 12:21:23.323564,2023-10-02 12:21:23.507707,0 days 00:00:00.184143,0.08435318625076706,370,sag,COMPLETE
3781,0.5,2023-10-02 12:21:23.507707,2023-10-02 12:21:23.759064,0 days 00:00:00.251357,0.003939730172783712,350,sag,COMPLETE
3782,0.6013756960366853,2023-10-02 12:21:23.759064,2023-10-02 12:21:23.946284,0 days 00:00:00.187220,2.493202485803513,410,sag,COMPLETE
3783,0.6590785020198712,2023-10-02 12:21:23.946284,2023-10-02 12:21:24.197271,0 days 00:00:00.250987,20911.64849905274,460,sag,COMPLETE
3784,0.5,2023-10-02 12:21:24.197271,2023-10-02 12:21:24.401717,0 days 00:00:00.204446,0.034315895264054076,490,saga,COMPLETE
3785,0.6481602795064964,2023-10-02 12:21:24.401717,2023-10-02 12:21:24.715554,0 days 00:00:00.313837,32525.718119165653,320,sag,COMPLETE
3786,0.6449939949776177,2023-10-02 12:21:24.715554,2023-10-02 12:21:24.967019,0 days 00:00:00.251465,1266.8281369897695,430,sag,COMPLETE
3787,0.666120755540998,2023-10-02 12:21:24.967019,2023-10-02 12:21:25.234040,0 days 00:00:00.267021,8409.594327224611,450,sag,COMPLETE
3788,0.528169014084507,2023-10-02 12:21:25.234040,2023-10-02 12:21:25.498930,0 days 00:00:00.264890,0.42477596150990043,480,newton-cg,COMPLETE
3789,0.6534556174254831,2023-10-02 12:21:25.498930,2023-10-02 12:21:25.718532,0 days 00:00:00.219602,72.15635782435626,470,sag,COMPLETE
3790,0.6337482257888415,2023-10-02 12:21:25.718532,2023-10-02 12:21:25.891249,0 days 00:00:00.172717,14.086815820695614,490,liblinear,COMPLETE
3791,0.6534556174254831,2023-10-02 12:21:25.906874,2023-10-02 12:21:26.189744,0 days 00:00:00.282870,110.096076249109,470,sag,COMPLETE
3792,0.6481602795064964,2023-10-02 12:21:26.189744,2023-10-02 12:21:26.464107,0 days 00:00:00.274363,64294.53883854622,490,saga,COMPLETE
3793,0.5,2023-10-02 12:21:26.465107,2023-10-02 12:21:27.256802,0 days 00:00:00.791695,1.91184982515937e-05,480,sag,COMPLETE
3794,0.6449939949776177,2023-10-02 12:21:27.256802,2023-10-02 12:21:27.508245,0 days 00:00:00.251443,14627.332420831286,450,sag,COMPLETE
3795,0.6534556174254831,2023-10-02 12:21:27.508245,2023-10-02 12:21:27.791474,0 days 00:00:00.283229,44.484097868563325,460,sag,COMPLETE
3796,0.6590785020198712,2023-10-02 12:21:27.791474,2023-10-02 12:21:28.055041,0 days 00:00:00.263567,44307.102252084485,480,sag,COMPLETE
3797,0.5,2023-10-02 12:21:28.055596,2023-10-02 12:21:28.260400,0 days 00:00:00.204804,0.00030117876974477235,490,sag,COMPLETE
3798,0.6298722567965934,2023-10-02 12:21:28.260400,2023-10-02 12:21:28.534339,0 days 00:00:00.273939,16.698454116695135,480,saga,COMPLETE
3799,0.6552025330276231,2023-10-02 12:21:28.543141,2023-10-02 12:21:28.793946,0 days 00:00:00.250805,28599.96419805768,440,sag,COMPLETE
3800,0.6488699639698657,2023-10-02 12:21:28.793946,2023-10-02 12:21:29.045379,0 days 00:00:00.251433,10839.464222580058,490,sag,COMPLETE
3801,0.6449939949776177,2023-10-02 12:21:29.045379,2023-10-02 12:21:29.374494,0 days 00:00:00.329115,19843.275046810995,360,sag,COMPLETE
3802,0.5,2023-10-02 12:21:29.374494,2023-10-02 12:21:29.562335,0 days 00:00:00.187841,0.002199940590652106,400,lbfgs,COMPLETE
3803,0.6520362484987444,2023-10-02 12:21:29.562335,2023-10-02 12:21:29.837756,0 days 00:00:00.275421,50337.18909993023,470,saga,COMPLETE
3804,0.6520362484987444,2023-10-02 12:21:29.837756,2023-10-02 12:21:30.096171,0 days 00:00:00.258415,7397.781233937635,460,sag,COMPLETE
3805,0.6520362484987444,2023-10-02 12:21:30.096171,2023-10-02 12:21:30.410082,0 days 00:00:00.313911,69136.28287902064,320,sag,COMPLETE
3806,0.5,2023-10-02 12:21:30.425706,2023-10-02 12:21:30.614055,0 days 00:00:00.188349,0.003853157662184385,300,sag,COMPLETE
3807,0.6590785020198712,2023-10-02 12:21:30.614055,2023-10-02 12:21:30.880256,0 days 00:00:00.266201,33011.93101465736,490,sag,COMPLETE
3808,0.5996287804345454,2023-10-02 12:21:30.880256,2023-10-02 12:21:31.131270,0 days 00:00:00.251014,1.4361782657421975,450,saga,COMPLETE
3809,0.6629544710121192,2023-10-02 12:21:31.131270,2023-10-02 12:21:31.397650,0 days 00:00:00.266380,99369.73195890209,480,sag,COMPLETE
3810,0.5,2023-10-02 12:21:31.397650,2023-10-02 12:21:31.840989,0 days 00:00:00.443339,4.271186862139973e-05,490,sag,COMPLETE
3811,0.6481602795064964,2023-10-02 12:21:31.840989,2023-10-02 12:21:32.103587,0 days 00:00:00.262598,23521.880529919898,460,sag,COMPLETE
3812,0.6520362484987444,2023-10-02 12:21:32.103587,2023-10-02 12:21:32.448947,0 days 00:00:00.345360,99030.37789417953,470,sag,COMPLETE
3813,0.604541980565564,2023-10-02 12:21:32.448947,2023-10-02 12:21:32.636983,0 days 00:00:00.188036,3.225534984677495,130,newton-cg,COMPLETE
3814,0.6520362484987444,2023-10-02 12:21:32.636983,2023-10-02 12:21:32.902944,0 days 00:00:00.265961,12055.964916340217,490,sag,COMPLETE
3815,0.5,2023-10-02 12:21:32.902944,2023-10-02 12:21:33.369885,0 days 00:00:00.466941,3.394136864759439e-05,430,saga,COMPLETE
3816,0.637951741456491,2023-10-02 12:21:33.370885,2023-10-02 12:21:33.546743,0 days 00:00:00.175858,39616.12938447989,480,liblinear,COMPLETE
3817,0.6520362484987444,2023-10-02 12:21:33.546743,2023-10-02 12:21:33.813251,0 days 00:00:00.266508,17410.865098496277,470,sag,COMPLETE
3818,0.5,2023-10-02 12:21:33.813251,2023-10-02 12:21:34.785805,0 days 00:00:00.972554,1.632165719329707e-05,490,sag,COMPLETE
3819,0.5,2023-10-02 12:21:34.785805,2023-10-02 12:21:34.974725,0 days 00:00:00.188920,0.0020513657808743173,480,sag,COMPLETE
3820,0.608417949557812,2023-10-02 12:21:34.974725,2023-10-02 12:21:35.163287,0 days 00:00:00.188562,2.550357663703458,450,sag,COMPLETE
3821,0.6418277104487389,2023-10-02 12:21:35.163287,2023-10-02 12:21:35.414244,0 days 00:00:00.250957,261.5249974088275,490,saga,COMPLETE
3822,0.637951741456491,2023-10-02 12:21:35.414244,2023-10-02 12:21:35.748211,0 days 00:00:00.333967,658.8375760404695,460,sag,COMPLETE
3823,0.6267059722677149,2023-10-02 12:21:35.758728,2023-10-02 12:21:35.931581,0 days 00:00:00.172853,10.81965586230182,440,sag,COMPLETE
3824,0.6520362484987444,2023-10-02 12:21:35.931581,2023-10-02 12:21:36.198129,0 days 00:00:00.266548,44462.80928663786,480,sag,COMPLETE
3825,0.6590785020198712,2023-10-02 12:21:36.198129,2023-10-02 12:21:36.548580,0 days 00:00:00.350451,99982.16883027102,470,sag,COMPLETE
3826,0.6481602795064964,2023-10-02 12:21:36.550089,2023-10-02 12:21:36.809780,0 days 00:00:00.259691,9035.148555956219,380,saga,COMPLETE
3827,0.6449939949776177,2023-10-02 12:21:36.809780,2023-10-02 12:21:37.075931,0 days 00:00:00.266151,1120.4295686954865,490,sag,COMPLETE
3828,0.637951741456491,2023-10-02 12:21:37.076950,2023-10-02 12:21:37.374995,0 days 00:00:00.298045,19168.563768306904,460,lbfgs,COMPLETE
3829,0.6668304400043672,2023-10-02 12:21:37.374995,2023-10-02 12:21:37.641602,0 days 00:00:00.266607,27330.988617089457,490,sag,COMPLETE
3830,0.6590785020198712,2023-10-02 12:21:37.641602,2023-10-02 12:21:37.893130,0 days 00:00:00.251528,28818.391194830587,470,sag,COMPLETE
3831,0.6590785020198712,2023-10-02 12:21:37.893130,2023-10-02 12:21:38.173915,0 days 00:00:00.280785,34514.218066358844,470,sag,COMPLETE
3832,0.6520362484987444,2023-10-02 12:21:38.173915,2023-10-02 12:21:38.518999,0 days 00:00:00.345084,26525.763773113817,480,sag,COMPLETE
3833,0.6481602795064964,2023-10-02 12:21:38.518999,2023-10-02 12:21:38.738713,0 days 00:00:00.219714,48060.70556146786,260,saga,COMPLETE
3834,0.6481602795064964,2023-10-02 12:21:38.738713,2023-10-02 12:21:39.005972,0 days 00:00:00.267259,62389.08241971825,470,sag,COMPLETE
3835,0.6590785020198712,2023-10-02 12:21:39.005972,2023-10-02 12:21:39.350776,0 days 00:00:00.344804,31665.682666760047,480,sag,COMPLETE
3836,0.6590785020198712,2023-10-02 12:21:39.350776,2023-10-02 12:21:39.617683,0 days 00:00:00.266907,22108.482615295474,480,sag,COMPLETE
3837,0.5,2023-10-02 12:21:39.617683,2023-10-02 12:21:39.805720,0 days 00:00:00.188037,0.15806219709950367,480,sag,COMPLETE
3838,0.6552025330276231,2023-10-02 12:21:39.821351,2023-10-02 12:21:40.088419,0 days 00:00:00.267068,40434.85130977174,470,saga,COMPLETE
3839,0.6520362484987444,2023-10-02 12:21:40.088419,2023-10-02 12:21:40.447483,0 days 00:00:00.359064,22669.72348988189,460,sag,COMPLETE
3840,0.666120755540998,2023-10-02 12:21:40.447483,2023-10-02 12:21:40.714390,0 days 00:00:00.266907,63904.35590853978,470,sag,COMPLETE
3841,0.6520362484987444,2023-10-02 12:21:40.714390,2023-10-02 12:21:40.997744,0 days 00:00:00.283354,40331.84315047678,480,sag,COMPLETE
3842,0.5,2023-10-02 12:21:40.997744,2023-10-02 12:21:41.257785,0 days 00:00:00.260041,2.480880193948905e-05,480,newton-cg,COMPLETE
3843,0.5,2023-10-02 12:21:41.257785,2023-10-02 12:21:41.437044,0 days 00:00:00.179259,0.022894468968244572,450,liblinear,COMPLETE
3844,0.5,2023-10-02 12:21:41.437044,2023-10-02 12:21:41.625408,0 days 00:00:00.188364,0.16457049551611191,420,sag,COMPLETE
3845,0.6520362484987444,2023-10-02 12:21:41.625408,2023-10-02 12:21:41.985688,0 days 00:00:00.360280,64460.64457033522,470,saga,COMPLETE
3846,0.6590785020198712,2023-10-02 12:21:41.985688,2023-10-02 12:21:42.236621,0 days 00:00:00.250933,17999.638203099803,460,sag,COMPLETE
3847,0.6449939949776177,2023-10-02 12:21:42.236621,2023-10-02 12:21:42.519761,0 days 00:00:00.283140,28017.583986260095,480,sag,COMPLETE
3848,0.6590785020198712,2023-10-02 12:21:42.519761,2023-10-02 12:21:42.771022,0 days 00:00:00.251261,43199.16406784815,440,sag,COMPLETE
3849,0.528169014084507,2023-10-02 12:21:42.771022,2023-10-02 12:21:43.036771,0 days 00:00:00.265749,0.3963067395180981,480,sag,COMPLETE
3850,0.6559122174909924,2023-10-02 12:21:43.036771,2023-10-02 12:21:43.288240,0 days 00:00:00.251469,15789.388754123527,350,sag,COMPLETE
3851,0.6520362484987444,2023-10-02 12:21:43.288240,2023-10-02 12:21:43.523448,0 days 00:00:00.235208,62252.34993507408,330,saga,COMPLETE
3852,0.6590785020198712,2023-10-02 12:21:43.523448,2023-10-02 12:21:43.862599,0 days 00:00:00.339151,26796.6650169538,470,sag,COMPLETE
3853,0.6520362484987444,2023-10-02 12:21:43.869151,2023-10-02 12:21:44.166319,0 days 00:00:00.297168,36610.49799274986,480,sag,COMPLETE
3854,0.637951741456491,2023-10-02 12:21:44.166319,2023-10-02 12:21:44.401638,0 days 00:00:00.235319,17085.98661801923,390,lbfgs,COMPLETE
3855,0.6411180259853696,2023-10-02 12:21:44.401638,2023-10-02 12:21:44.731904,0 days 00:00:00.330266,62195.4874707733,450,sag,COMPLETE
3856,0.5478764057211486,2023-10-02 12:21:44.731904,2023-10-02 12:21:44.964265,0 days 00:00:00.232361,0.7153730517522038,460,sag,COMPLETE
3857,0.6590785020198712,2023-10-02 12:21:44.964265,2023-10-02 12:21:45.229142,0 days 00:00:00.264877,23575.659744491924,470,saga,COMPLETE
3858,0.6069985806310733,2023-10-02 12:21:45.229142,2023-10-02 12:21:45.413958,0 days 00:00:00.184816,4.9709558051327996,490,sag,COMPLETE
3859,0.5,2023-10-02 12:21:45.429682,2023-10-02 12:21:45.733336,0 days 00:00:00.303654,0.013424256568225061,370,sag,COMPLETE
3860,0.6449939949776177,2023-10-02 12:21:45.733336,2023-10-02 12:21:46.112645,0 days 00:00:00.379309,44938.3533536674,480,sag,COMPLETE
3861,0.66224478654875,2023-10-02 12:21:46.114105,2023-10-02 12:21:46.380493,0 days 00:00:00.266388,13860.505270065569,490,sag,COMPLETE
3862,0.6520362484987444,2023-10-02 12:21:46.380493,2023-10-02 12:21:46.741158,0 days 00:00:00.360665,68072.04246274104,460,saga,COMPLETE
3863,0.5,2023-10-02 12:21:46.741158,2023-10-02 12:21:46.925455,0 days 00:00:00.184297,0.09943073093797693,480,sag,COMPLETE
3864,0.6590785020198712,2023-10-02 12:21:46.925455,2023-10-02 12:21:47.189627,0 days 00:00:00.264172,27665.19552142217,470,sag,COMPLETE
3865,0.6541653018888526,2023-10-02 12:21:47.189627,2023-10-02 12:21:47.381629,0 days 00:00:00.192002,30.008083255998816,490,sag,COMPLETE
3866,0.5,2023-10-02 12:21:47.381629,2023-10-02 12:21:47.649886,0 days 00:00:00.268257,0.000600995872332648,310,newton-cg,COMPLETE
3867,0.6457036794409869,2023-10-02 12:21:47.649886,2023-10-02 12:21:47.897389,0 days 00:00:00.247503,233.89400847937387,450,sag,COMPLETE
3868,0.5,2023-10-02 12:21:47.897389,2023-10-02 12:21:48.211690,0 days 00:00:00.314301,0.00020611260312758693,480,saga,COMPLETE
3869,0.5823779888634131,2023-10-02 12:21:48.211690,2023-10-02 12:21:48.468250,0 days 00:00:00.256560,1.1540437356606037,460,liblinear,COMPLETE
3870,0.6520362484987444,2023-10-02 12:21:48.468250,2023-10-02 12:21:48.709297,0 days 00:00:00.241047,42919.228060123336,340,sag,COMPLETE
3871,0.5,2023-10-02 12:21:48.709297,2023-10-02 12:21:48.908921,0 days 00:00:00.199624,0.05659966067291468,430,sag,COMPLETE
3872,0.6520362484987444,2023-10-02 12:21:48.910921,2023-10-02 12:21:49.246876,0 days 00:00:00.335955,18437.777771589943,490,sag,COMPLETE
3873,0.6520362484987444,2023-10-02 12:21:49.246876,2023-10-02 12:21:49.519892,0 days 00:00:00.273016,68430.83467875478,440,sag,COMPLETE
3874,0.6629544710121192,2023-10-02 12:21:49.520892,2023-10-02 12:21:49.780619,0 days 00:00:00.259727,32902.12191868566,470,sag,COMPLETE
3875,0.6590785020198712,2023-10-02 12:21:49.780619,2023-10-02 12:21:50.069427,0 days 00:00:00.288808,13278.642519508667,490,saga,COMPLETE
3876,0.6520362484987444,2023-10-02 12:21:50.070936,2023-10-02 12:21:50.462654,0 days 00:00:00.391718,22227.95131958237,480,sag,COMPLETE
3877,0.6590785020198712,2023-10-02 12:21:50.464531,2023-10-02 12:21:50.812979,0 days 00:00:00.348448,67087.37077401833,450,sag,COMPLETE
3878,0.6590785020198712,2023-10-02 12:21:50.813980,2023-10-02 12:21:51.102889,0 days 00:00:00.288909,99649.98645672084,490,sag,COMPLETE
3879,0.6418277104487389,2023-10-02 12:21:51.103885,2023-10-02 12:21:51.445431,0 days 00:00:00.341546,420.18765171763783,470,sag,COMPLETE
3880,0.5,2023-10-02 12:21:51.445431,2023-10-02 12:21:51.640845,0 days 00:00:00.195414,0.0009628436918422518,460,lbfgs,COMPLETE
3881,0.6520362484987444,2023-10-02 12:21:51.641845,2023-10-02 12:21:51.921151,0 days 00:00:00.279306,36033.545616499476,480,saga,COMPLETE
3882,0.6590785020198712,2023-10-02 12:21:51.922152,2023-10-02 12:21:52.178543,0 days 00:00:00.256391,14823.014506855443,440,sag,COMPLETE
3883,0.6590785020198712,2023-10-02 12:21:52.178543,2023-10-02 12:21:52.546920,0 days 00:00:00.368377,40555.886301186845,490,sag,COMPLETE
3884,0.6590785020198712,2023-10-02 12:21:52.546920,2023-10-02 12:21:52.748197,0 days 00:00:00.201277,19658.14075089427,120,sag,COMPLETE
3885,0.6520362484987444,2023-10-02 12:21:52.748197,2023-10-02 12:21:53.031630,0 days 00:00:00.283433,28799.989935491423,490,sag,COMPLETE
3886,0.5619609127634021,2023-10-02 12:21:53.031630,2023-10-02 12:21:53.295620,0 days 00:00:00.263990,0.934178590664802,470,saga,COMPLETE
3887,0.5,2023-10-02 12:21:53.296619,2023-10-02 12:21:54.199855,0 days 00:00:00.903236,1.5170991998230339e-05,360,sag,COMPLETE
3888,0.6590785020198712,2023-10-02 12:21:54.199855,2023-10-02 12:21:54.482502,0 days 00:00:00.282647,11860.790175468333,470,sag,COMPLETE
3889,0.6590785020198712,2023-10-02 12:21:54.482502,2023-10-02 12:21:54.749030,0 days 00:00:00.266528,66444.98774846442,480,sag,COMPLETE
3890,0.6481602795064964,2023-10-02 12:21:54.749030,2023-10-02 12:21:55.184270,0 days 00:00:00.435240,44976.650766341336,490,sag,COMPLETE
3891,0.5,2023-10-02 12:21:55.185263,2023-10-02 12:21:55.424311,0 days 00:00:00.239048,0.14358317466794943,460,newton-cg,COMPLETE
3892,0.666120755540998,2023-10-02 12:21:55.426316,2023-10-02 12:21:55.763505,0 days 00:00:00.337189,21828.87165325079,450,sag,COMPLETE
3893,0.6590785020198712,2023-10-02 12:21:55.764506,2023-10-02 12:21:56.202091,0 days 00:00:00.437585,47050.246553476405,480,saga,COMPLETE
3894,0.5,2023-10-02 12:21:56.216681,2023-10-02 12:21:56.452899,0 days 00:00:00.236218,0.28534150495183686,480,sag,COMPLETE
3895,0.637951741456491,2023-10-02 12:21:56.452899,2023-10-02 12:21:56.678230,0 days 00:00:00.225331,12367.438814807569,290,liblinear,COMPLETE
3896,0.5,2023-10-02 12:21:56.678230,2023-10-02 12:21:57.020245,0 days 00:00:00.342015,0.000310897617418011,490,sag,COMPLETE
