number,value,datetime_start,datetime_complete,duration,params_C,params_max_iter,params_solver,state
2921,0.6277432034064855,2023-10-02 12:17:49.211100,2023-10-02 12:17:49.488518,0 days 00:00:00.277418,1152.4359437319752,430,lbfgs,COMPLETE
2922,0.6520362484987444,2023-10-02 12:17:49.489523,2023-10-02 12:17:49.721796,0 days 00:00:00.232273,14185.743385470561,490,sag,COMPLETE
2923,0.5,2023-10-02 12:17:49.722794,2023-10-02 12:17:49.860897,0 days 00:00:00.138103,0.01899657154675734,500,sag,COMPLETE
2924,0.6481602795064964,2023-10-02 12:17:49.861897,2023-10-02 12:17:50.092495,0 days 00:00:00.230598,7698.780871934523,460,saga,COMPLETE
2925,0.5,2023-10-02 12:17:50.093495,2023-10-02 12:17:50.261693,0 days 00:00:00.168198,0.00045592660441160724,480,sag,COMPLETE
2926,0.5,2023-10-02 12:17:50.263685,2023-10-02 12:17:50.524416,0 days 00:00:00.260731,0.00018564672621785886,480,sag,COMPLETE
2927,0.6449939949776177,2023-10-02 12:17:50.525417,2023-10-02 12:17:50.748053,0 days 00:00:00.222636,3309.461848365565,490,sag,COMPLETE
2928,0.5,2023-10-02 12:17:50.749053,2023-10-02 12:17:50.888583,0 days 00:00:00.139530,0.036522187596840915,500,sag,COMPLETE
2929,0.6411180259853696,2023-10-02 12:17:50.889578,2023-10-02 12:17:51.122679,0 days 00:00:00.233101,21861.004134994262,490,saga,COMPLETE
2930,0.6077082650944426,2023-10-02 12:17:51.124679,2023-10-02 12:17:51.278388,0 days 00:00:00.153709,3.801420272531829,480,newton-cg,COMPLETE
2931,0.6590785020198712,2023-10-02 12:17:51.279378,2023-10-02 12:17:51.510580,0 days 00:00:00.231202,99177.41379729149,500,sag,COMPLETE
2932,0.6418277104487389,2023-10-02 12:17:51.511578,2023-10-02 12:17:51.797543,0 days 00:00:00.285965,319.1753047113209,400,sag,COMPLETE
2933,0.6534556174254831,2023-10-02 12:17:51.798541,2023-10-02 12:17:51.937223,0 days 00:00:00.138682,114.60432801959448,470,liblinear,COMPLETE
2934,0.6520362484987444,2023-10-02 12:17:51.938223,2023-10-02 12:17:52.173459,0 days 00:00:00.235236,6237.558611866144,490,sag,COMPLETE
2935,0.666120755540998,2023-10-02 12:17:52.174530,2023-10-02 12:17:52.407720,0 days 00:00:00.233190,52434.27010386723,500,sag,COMPLETE
2936,0.6590785020198712,2023-10-02 12:17:52.408720,2023-10-02 12:17:52.649881,0 days 00:00:00.241161,13130.48130543404,470,sag,COMPLETE
2937,0.5,2023-10-02 12:17:52.651879,2023-10-02 12:17:53.068801,0 days 00:00:00.416922,0.00014582606408003216,490,saga,COMPLETE
2938,0.666120755540998,2023-10-02 12:17:53.069804,2023-10-02 12:17:53.293532,0 days 00:00:00.223728,32752.55416815469,480,sag,COMPLETE
2939,0.6101648651599519,2023-10-02 12:17:53.294531,2023-10-02 12:17:53.444531,0 days 00:00:00.150000,5.4805382111733,500,sag,COMPLETE
2940,0.528169014084507,2023-10-02 12:17:53.445530,2023-10-02 12:17:53.590050,0 days 00:00:00.144520,0.3812868373210068,460,sag,COMPLETE
2941,0.637951741456491,2023-10-02 12:17:53.591048,2023-10-02 12:17:53.821975,0 days 00:00:00.230927,763.3746661282872,490,sag,COMPLETE
2942,0.6520362484987444,2023-10-02 12:17:53.822973,2023-10-02 12:17:54.129044,0 days 00:00:00.306071,2154.233102992122,480,saga,COMPLETE
2943,0.6520362484987444,2023-10-02 12:17:54.130556,2023-10-02 12:17:54.369378,0 days 00:00:00.238822,8874.63537278611,500,sag,COMPLETE
2944,0.6520362484987444,2023-10-02 12:17:54.370376,2023-10-02 12:17:54.607623,0 days 00:00:00.237247,4526.59135928799,490,sag,COMPLETE
2945,0.5,2023-10-02 12:17:54.608622,2023-10-02 12:17:55.150360,0 days 00:00:00.541738,3.236932034399618e-05,450,sag,COMPLETE
2946,0.5,2023-10-02 12:17:55.151442,2023-10-02 12:17:55.294347,0 days 00:00:00.142905,4.5170210091535195e-05,500,lbfgs,COMPLETE
2947,0.6520362484987444,2023-10-02 12:17:55.295360,2023-10-02 12:17:55.621854,0 days 00:00:00.326494,18251.617807243907,470,sag,COMPLETE
2948,0.6552025330276231,2023-10-02 12:17:55.622856,2023-10-02 12:17:55.869451,0 days 00:00:00.246595,44534.71562258452,480,saga,COMPLETE
2949,0.6471230483677258,2023-10-02 12:17:55.870451,2023-10-02 12:17:56.028575,0 days 00:00:00.158124,28.384300819439385,490,sag,COMPLETE
2950,0.5,2023-10-02 12:17:56.029573,2023-10-02 12:17:56.174265,0 days 00:00:00.144692,0.058388204151162255,500,sag,COMPLETE
2951,0.6559122174909924,2023-10-02 12:17:56.175263,2023-10-02 12:17:56.403637,0 days 00:00:00.228374,6202.385762569614,480,sag,COMPLETE
2952,0.6590785020198712,2023-10-02 12:17:56.404633,2023-10-02 12:17:56.682964,0 days 00:00:00.278331,25392.1950246143,390,sag,COMPLETE
2953,0.6552025330276231,2023-10-02 12:17:56.683966,2023-10-02 12:17:56.910363,0 days 00:00:00.226397,12786.647849812536,420,saga,COMPLETE
2954,0.6590785020198712,2023-10-02 12:17:56.911363,2023-10-02 12:17:57.136498,0 days 00:00:00.225135,3399.07246558012,490,sag,COMPLETE
2955,0.6277432034064855,2023-10-02 12:17:57.137500,2023-10-02 12:17:57.300878,0 days 00:00:00.163378,1345.061240184611,500,newton-cg,COMPLETE
2956,0.5,2023-10-02 12:17:57.301885,2023-10-02 12:17:58.129381,0 days 00:00:00.827496,1.6466991345136075e-05,460,sag,COMPLETE
2957,0.6590785020198712,2023-10-02 12:17:58.130463,2023-10-02 12:17:58.421174,0 days 00:00:00.290711,9320.929805932607,470,sag,COMPLETE
2958,0.5,2023-10-02 12:17:58.422176,2023-10-02 12:17:58.564346,0 days 00:00:00.142170,0.004442599024214964,490,sag,COMPLETE
2959,0.6590785020198712,2023-10-02 12:17:58.566353,2023-10-02 12:17:58.827038,0 days 00:00:00.260685,61493.174712944216,500,sag,COMPLETE
2960,0.637951741456491,2023-10-02 12:17:58.828041,2023-10-02 12:17:58.966720,0 days 00:00:00.138679,17369.697815520114,480,liblinear,COMPLETE
2961,0.5,2023-10-02 12:17:58.967720,2023-10-02 12:17:59.189865,0 days 00:00:00.222145,0.0014496826396112016,490,saga,COMPLETE
2962,0.6027950649634239,2023-10-02 12:17:59.191867,2023-10-02 12:17:59.334091,0 days 00:00:00.142224,1.5642696734221928,480,sag,COMPLETE
2963,0.6449939949776177,2023-10-02 12:17:59.336106,2023-10-02 12:17:59.640585,0 days 00:00:00.304479,31539.06449307599,500,sag,COMPLETE
2964,0.5,2023-10-02 12:17:59.641652,2023-10-02 12:17:59.784189,0 days 00:00:00.142537,0.03345588548934625,440,sag,COMPLETE
2965,0.5478764057211486,2023-10-02 12:17:59.785277,2023-10-02 12:17:59.928855,0 days 00:00:00.143578,0.7270918489976339,320,sag,COMPLETE
2966,0.5,2023-10-02 12:17:59.929938,2023-10-02 12:18:00.085081,0 days 00:00:00.155143,0.006282507666602493,470,saga,COMPLETE
2967,0.6449939949776177,2023-10-02 12:18:00.087080,2023-10-02 12:18:00.315199,0 days 00:00:00.228119,1913.495063586066,490,sag,COMPLETE
2968,0.6449939949776177,2023-10-02 12:18:00.316194,2023-10-02 12:18:00.630694,0 days 00:00:00.314500,4729.828779722537,500,sag,COMPLETE
2969,0.6590785020198712,2023-10-02 12:18:00.631689,2023-10-02 12:18:00.866656,0 days 00:00:00.234967,98922.41159526078,480,sag,COMPLETE
2970,0.6062888961677039,2023-10-02 12:18:00.867656,2023-10-02 12:18:01.009199,0 days 00:00:00.141543,5.8070311086180215,490,sag,COMPLETE
2971,0.5,2023-10-02 12:18:01.010195,2023-10-02 12:18:01.195751,0 days 00:00:00.185556,0.0018620409571275087,500,saga,COMPLETE
2972,0.6520362484987444,2023-10-02 12:18:01.196753,2023-10-02 12:18:01.426711,0 days 00:00:00.229958,7183.9423398487825,480,sag,COMPLETE
2973,0.5,2023-10-02 12:18:01.427712,2023-10-02 12:18:01.645901,0 days 00:00:00.218189,2.5115200754471572e-05,260,lbfgs,COMPLETE
2974,0.6418277104487389,2023-10-02 12:18:01.646898,2023-10-02 12:18:01.856626,0 days 00:00:00.209728,371.4026495195296,490,sag,COMPLETE
2975,0.6337482257888415,2023-10-02 12:18:01.858620,2023-10-02 12:18:02.011882,0 days 00:00:00.153262,15.267352925035254,450,sag,COMPLETE
2976,0.6520362484987444,2023-10-02 12:18:02.012882,2023-10-02 12:18:02.260889,0 days 00:00:00.248007,39159.047708157224,470,sag,COMPLETE
2977,0.6520362484987444,2023-10-02 12:18:02.261889,2023-10-02 12:18:02.574554,0 days 00:00:00.312665,12270.431228687794,500,sag,COMPLETE
2978,0.6520362484987444,2023-10-02 12:18:02.575557,2023-10-02 12:18:02.810258,0 days 00:00:00.234701,3075.6055344161587,490,saga,COMPLETE
2979,0.6534556174254831,2023-10-02 12:18:02.811254,2023-10-02 12:18:02.975094,0 days 00:00:00.163840,59.05188439211951,460,sag,COMPLETE
2980,0.5,2023-10-02 12:18:02.976090,2023-10-02 12:18:03.122768,0 days 00:00:00.146678,0.01753397988873147,480,sag,COMPLETE
2981,0.5,2023-10-02 12:18:03.123775,2023-10-02 12:18:03.278346,0 days 00:00:00.154571,0.0009263059960037299,500,newton-cg,COMPLETE
2982,0.6590785020198712,2023-10-02 12:18:03.279345,2023-10-02 12:18:03.502281,0 days 00:00:00.222936,20570.931096638662,430,sag,COMPLETE
2983,0.637951741456491,2023-10-02 12:18:03.504277,2023-10-02 12:18:03.718613,0 days 00:00:00.214336,8659.18954269329,490,liblinear,COMPLETE
2984,0.6590785020198712,2023-10-02 12:18:03.719616,2023-10-02 12:18:03.950050,0 days 00:00:00.230434,60403.76036939667,470,sag,COMPLETE
2985,0.6442843105142483,2023-10-02 12:18:03.951050,2023-10-02 12:18:04.188180,0 days 00:00:00.237130,31418.844735839757,500,saga,COMPLETE
2986,0.6481602795064964,2023-10-02 12:18:04.189187,2023-10-02 12:18:04.397120,0 days 00:00:00.207933,4579.0367373991,370,sag,COMPLETE
2987,0.637951741456491,2023-10-02 12:18:04.398119,2023-10-02 12:18:04.626433,0 days 00:00:00.228314,16597.859835671636,480,sag,COMPLETE
2988,0.6449939949776177,2023-10-02 12:18:04.627502,2023-10-02 12:18:04.927294,0 days 00:00:00.299792,1756.1547363294342,490,sag,COMPLETE
2989,0.6418277104487389,2023-10-02 12:18:04.928294,2023-10-02 12:18:05.155676,0 days 00:00:00.227382,505.9992032006744,500,sag,COMPLETE
2990,0.5274593296211376,2023-10-02 12:18:05.156670,2023-10-02 12:18:05.299297,0 days 00:00:00.142627,0.5389462524669089,480,saga,COMPLETE
2991,0.6449939949776177,2023-10-02 12:18:05.300291,2023-10-02 12:18:05.506456,0 days 00:00:00.206165,945.9219735892115,330,sag,COMPLETE
2992,0.6590785020198712,2023-10-02 12:18:05.507455,2023-10-02 12:18:05.726905,0 days 00:00:00.219450,6869.940200034777,410,sag,COMPLETE
2993,0.6520362484987444,2023-10-02 12:18:05.727954,2023-10-02 12:18:06.021892,0 days 00:00:00.293938,45323.556326043436,460,sag,COMPLETE
2994,0.6559122174909924,2023-10-02 12:18:06.022892,2023-10-02 12:18:06.249989,0 days 00:00:00.227097,3144.8062311224785,490,sag,COMPLETE
2995,0.6411180259853696,2023-10-02 12:18:06.250989,2023-10-02 12:18:06.504734,0 days 00:00:00.253745,10449.833577219328,500,saga,COMPLETE
2996,0.666120755540998,2023-10-02 12:18:06.505733,2023-10-02 12:18:06.731220,0 days 00:00:00.225487,22762.529290642564,470,sag,COMPLETE
2997,0.6449939949776177,2023-10-02 12:18:06.732220,2023-10-02 12:18:06.961272,0 days 00:00:00.229052,5200.802327076595,490,sag,COMPLETE
2998,0.5,2023-10-02 12:18:06.962272,2023-10-02 12:18:07.105836,0 days 00:00:00.143564,0.04199962595108659,480,sag,COMPLETE
2999,0.6020853805000546,2023-10-02 12:18:07.106837,2023-10-02 12:18:07.328100,0 days 00:00:00.221263,1.817734746928371,500,sag,COMPLETE
3000,0.5,2023-10-02 12:18:07.329091,2023-10-02 12:18:07.476234,0 days 00:00:00.147143,2.58312786937008e-05,490,lbfgs,COMPLETE
3001,0.6534556174254831,2023-10-02 12:18:07.477234,2023-10-02 12:18:07.663890,0 days 00:00:00.186656,91.58086229175983,500,sag,COMPLETE
3002,0.6552025330276231,2023-10-02 12:18:07.664892,2023-10-02 12:18:07.887612,0 days 00:00:00.222720,65244.8361523606,440,saga,COMPLETE
3003,0.5,2023-10-02 12:18:07.888607,2023-10-02 12:18:08.125682,0 days 00:00:00.237075,0.000542965353174595,480,sag,COMPLETE
3004,0.5,2023-10-02 12:18:08.126696,2023-10-02 12:18:08.286231,0 days 00:00:00.159535,0.002378419738153507,470,sag,COMPLETE
3005,0.5,2023-10-02 12:18:08.287233,2023-10-02 12:18:08.673169,0 days 00:00:00.385936,4.785617595990506e-05,490,sag,COMPLETE
3006,0.637951741456491,2023-10-02 12:18:08.674171,2023-10-02 12:18:08.904252,0 days 00:00:00.230081,14278.470020808338,500,sag,COMPLETE
3007,0.6520362484987444,2023-10-02 12:18:08.905247,2023-10-02 12:18:09.140007,0 days 00:00:00.234760,29761.13549115867,480,saga,COMPLETE
3008,0.5,2023-10-02 12:18:09.141532,2023-10-02 12:18:09.367777,0 days 00:00:00.226245,0.2417066775102749,490,newton-cg,COMPLETE
3009,0.6590785020198712,2023-10-02 12:18:09.368779,2023-10-02 12:18:09.598210,0 days 00:00:00.229431,2640.4745801017384,500,sag,COMPLETE
3010,0.637951741456491,2023-10-02 12:18:09.599209,2023-10-02 12:18:09.742932,0 days 00:00:00.143723,9215.239709741263,490,liblinear,COMPLETE
3011,0.6590785020198712,2023-10-02 12:18:09.743935,2023-10-02 12:18:09.968411,0 days 00:00:00.224476,63078.13454118473,450,sag,COMPLETE
3012,0.6590785020198712,2023-10-02 12:18:09.969413,2023-10-02 12:18:10.203273,0 days 00:00:00.233860,17759.829216092745,460,sag,COMPLETE
3013,0.6298722567965934,2023-10-02 12:18:10.204272,2023-10-02 12:18:10.431727,0 days 00:00:00.227455,17.7571678927939,470,sag,COMPLETE
3014,0.6590785020198712,2023-10-02 12:18:10.432727,2023-10-02 12:18:10.661618,0 days 00:00:00.228891,5180.554022014669,480,saga,COMPLETE
3015,0.6418277104487389,2023-10-02 12:18:10.663622,2023-10-02 12:18:10.863632,0 days 00:00:00.200010,260.0908249829113,490,sag,COMPLETE
3016,0.6590785020198712,2023-10-02 12:18:10.864633,2023-10-02 12:18:11.125816,0 days 00:00:00.261183,37302.948228818736,500,sag,COMPLETE
3017,0.6449939949776177,2023-10-02 12:18:11.126826,2023-10-02 12:18:11.347435,0 days 00:00:00.220609,1379.6365571058743,380,sag,COMPLETE
3018,0.5,2023-10-02 12:18:11.348442,2023-10-02 12:18:11.590580,0 days 00:00:00.242138,0.0018704357415930662,480,sag,COMPLETE
3019,0.6449939949776177,2023-10-02 12:18:11.591584,2023-10-02 12:18:11.847291,0 days 00:00:00.255707,11417.096445030087,490,saga,COMPLETE
3020,0.6520362484987444,2023-10-02 12:18:11.848287,2023-10-02 12:18:12.092583,0 days 00:00:00.244296,20821.78731816637,500,sag,COMPLETE
3021,0.608417949557812,2023-10-02 12:18:12.093635,2023-10-02 12:18:12.242049,0 days 00:00:00.148414,2.718854501012775,470,sag,COMPLETE
3022,0.5,2023-10-02 12:18:12.243557,2023-10-02 12:18:13.011195,0 days 00:00:00.767638,2.0989277205197787e-05,480,sag,COMPLETE
3023,0.6520362484987444,2023-10-02 12:18:13.012191,2023-10-02 12:18:13.241578,0 days 00:00:00.229387,3720.1895466685096,490,sag,COMPLETE
3024,0.6520362484987444,2023-10-02 12:18:13.242578,2023-10-02 12:18:13.484292,0 days 00:00:00.241714,7418.334003878561,500,sag,COMPLETE
3025,0.5,2023-10-02 12:18:13.486295,2023-10-02 12:18:13.635260,0 days 00:00:00.148965,0.00037359628043389666,500,lbfgs,COMPLETE
3026,0.5,2023-10-02 12:18:13.636260,2023-10-02 12:18:13.951237,0 days 00:00:00.314977,0.00016103708337082334,480,saga,COMPLETE
3027,0.6559122174909924,2023-10-02 12:18:13.952238,2023-10-02 12:18:14.264957,0 days 00:00:00.312719,42752.959785013685,490,sag,COMPLETE
3028,0.6449939949776177,2023-10-02 12:18:14.265960,2023-10-02 12:18:14.502023,0 days 00:00:00.236063,2405.9975010559915,490,sag,COMPLETE
3029,0.6590785020198712,2023-10-02 12:18:14.503022,2023-10-02 12:18:14.744288,0 days 00:00:00.241266,12959.398006246409,500,sag,COMPLETE
3030,0.5,2023-10-02 12:18:14.745794,2023-10-02 12:18:14.889038,0 days 00:00:00.143244,0.08118915681031694,470,sag,COMPLETE
3031,0.5823779888634131,2023-10-02 12:18:14.890033,2023-10-02 12:18:15.118342,0 days 00:00:00.228309,1.1255285491605784,450,saga,COMPLETE
3032,0.6541653018888526,2023-10-02 12:18:15.119336,2023-10-02 12:18:15.282359,0 days 00:00:00.163023,29.989789362525848,480,sag,COMPLETE
3033,0.6449939949776177,2023-10-02 12:18:15.283367,2023-10-02 12:18:15.455178,0 days 00:00:00.171811,98288.61621181587,460,newton-cg,COMPLETE
3034,0.6520362484987444,2023-10-02 12:18:15.456181,2023-10-02 12:18:15.690575,0 days 00:00:00.234394,28938.91072015948,430,sag,COMPLETE
3035,0.6267059722677149,2023-10-02 12:18:15.691575,2023-10-02 12:18:15.839923,0 days 00:00:00.148348,13.250541816355142,500,sag,COMPLETE
3036,0.637951741456491,2023-10-02 12:18:15.840923,2023-10-02 12:18:16.062435,0 days 00:00:00.221512,6224.526819659091,490,liblinear,COMPLETE
3037,0.5,2023-10-02 12:18:16.063435,2023-10-02 12:18:16.211983,0 days 00:00:00.148548,0.005991538069785968,270,sag,COMPLETE
3038,0.6520362484987444,2023-10-02 12:18:16.212982,2023-10-02 12:18:16.441466,0 days 00:00:00.228484,54121.54239832987,410,saga,COMPLETE
3039,0.637951741456491,2023-10-02 12:18:16.442468,2023-10-02 12:18:16.667491,0 days 00:00:00.225023,634.9541121642857,470,sag,COMPLETE
3040,0.5,2023-10-02 12:18:16.668489,2023-10-02 12:18:16.888516,0 days 00:00:00.220027,0.015402860284374304,490,sag,COMPLETE
3041,0.6534556174254831,2023-10-02 12:18:16.889516,2023-10-02 12:18:17.047655,0 days 00:00:00.158139,41.117839927768095,500,sag,COMPLETE
3042,0.6449939949776177,2023-10-02 12:18:17.048655,2023-10-02 12:18:17.280391,0 days 00:00:00.231736,3945.7396467129092,480,sag,COMPLETE
3043,0.6449939949776177,2023-10-02 12:18:17.281391,2023-10-02 12:18:17.545173,0 days 00:00:00.263782,25758.074891117634,500,sag,COMPLETE
3044,0.6062888961677039,2023-10-02 12:18:17.546171,2023-10-02 12:18:17.751602,0 days 00:00:00.205431,6.080429696305801,480,saga,COMPLETE
3045,0.6077082650944426,2023-10-02 12:18:17.752609,2023-10-02 12:18:18.022166,0 days 00:00:00.269557,3.622590302784637,490,sag,COMPLETE
3046,0.637951741456491,2023-10-02 12:18:18.023237,2023-10-02 12:18:18.319973,0 days 00:00:00.296736,9499.876220583712,460,sag,COMPLETE
3047,0.6590785020198712,2023-10-02 12:18:18.320976,2023-10-02 12:18:18.612358,0 days 00:00:00.291382,16524.915039881067,490,sag,COMPLETE
3048,0.6520362484987444,2023-10-02 12:18:18.614472,2023-10-02 12:18:18.872329,0 days 00:00:00.257857,1955.39631769147,500,sag,COMPLETE
3049,0.5,2023-10-02 12:18:18.873330,2023-10-02 12:18:19.159923,0 days 00:00:00.286593,0.0028259366226819588,480,saga,COMPLETE
3050,0.666120755540998,2023-10-02 12:18:19.160923,2023-10-02 12:18:19.391981,0 days 00:00:00.231058,5692.196578812864,500,sag,COMPLETE
3051,0.637951741456491,2023-10-02 12:18:19.392985,2023-10-02 12:18:19.574902,0 days 00:00:00.181917,37028.813377713326,490,lbfgs,COMPLETE
3052,0.6590785020198712,2023-10-02 12:18:19.575902,2023-10-02 12:18:19.810960,0 days 00:00:00.235058,58646.41827581124,470,sag,COMPLETE
3053,0.6309094879353642,2023-10-02 12:18:19.811959,2023-10-02 12:18:20.053218,0 days 00:00:00.241259,947.9190106959135,490,sag,COMPLETE
3054,0.6520362484987444,2023-10-02 12:18:20.054224,2023-10-02 12:18:20.357864,0 days 00:00:00.303640,12400.219922745691,480,sag,COMPLETE
3055,0.6590785020198712,2023-10-02 12:18:20.358858,2023-10-02 12:18:20.596314,0 days 00:00:00.237456,23083.7660711874,500,saga,COMPLETE
3056,0.5,2023-10-02 12:18:20.597315,2023-10-02 12:18:20.745699,0 days 00:00:00.148384,0.009946366832705854,490,sag,COMPLETE
3057,0.6520362484987444,2023-10-02 12:18:20.746703,2023-10-02 12:18:21.000528,0 days 00:00:00.253825,3097.5872781245635,470,sag,COMPLETE
3058,0.637951741456491,2023-10-02 12:18:21.002517,2023-10-02 12:18:21.243520,0 days 00:00:00.241003,7769.272398447707,450,newton-cg,COMPLETE
3059,0.6457036794409869,2023-10-02 12:18:21.244518,2023-10-02 12:18:21.442584,0 days 00:00:00.198066,196.5447870161522,500,sag,COMPLETE
3060,0.6520362484987444,2023-10-02 12:18:21.443583,2023-10-02 12:18:21.676223,0 days 00:00:00.232640,16533.29750540332,480,sag,COMPLETE
3061,0.5,2023-10-02 12:18:21.678228,2023-10-02 12:18:21.819955,0 days 00:00:00.141727,0.20458134057894456,490,liblinear,COMPLETE
3062,0.5,2023-10-02 12:18:21.820958,2023-10-02 12:18:21.973043,0 days 00:00:00.152085,0.05178087869074209,480,saga,COMPLETE
3063,0.6449939949776177,2023-10-02 12:18:21.974043,2023-10-02 12:18:22.272586,0 days 00:00:00.298543,3611.9721797032425,440,sag,COMPLETE
3064,0.666120755540998,2023-10-02 12:18:22.273586,2023-10-02 12:18:22.518884,0 days 00:00:00.245298,66086.53657844441,500,sag,COMPLETE
3065,0.5,2023-10-02 12:18:22.519914,2023-10-02 12:18:22.695570,0 days 00:00:00.175656,0.0006237321753043859,490,sag,COMPLETE
3066,0.6534556174254831,2023-10-02 12:18:22.696568,2023-10-02 12:18:22.869102,0 days 00:00:00.172534,95.52156356325813,470,sag,COMPLETE
3067,0.6449939949776177,2023-10-02 12:18:22.870138,2023-10-02 12:18:23.156491,0 days 00:00:00.286353,5936.691309601023,360,sag,COMPLETE
3068,0.5,2023-10-02 12:18:23.157490,2023-10-02 12:18:23.458519,0 days 00:00:00.301029,0.00019090118687397012,500,saga,COMPLETE
3069,0.6520362484987444,2023-10-02 12:18:23.459516,2023-10-02 12:18:23.693937,0 days 00:00:00.234421,37367.14132254789,480,sag,COMPLETE
3070,0.6520362484987444,2023-10-02 12:18:23.694939,2023-10-02 12:18:23.927487,0 days 00:00:00.232548,1718.0335459063667,420,sag,COMPLETE
3071,0.5,2023-10-02 12:18:23.928490,2023-10-02 12:18:24.549406,0 days 00:00:00.620916,3.251470638141203e-05,490,sag,COMPLETE
3072,0.6629544710121192,2023-10-02 12:18:24.550483,2023-10-02 12:18:24.780290,0 days 00:00:00.229807,11693.849338828824,460,sag,COMPLETE
3073,0.5,2023-10-02 12:18:24.782293,2023-10-02 12:18:25.150524,0 days 00:00:00.368231,1.3432704213405232e-05,500,saga,COMPLETE
3074,0.6449939949776177,2023-10-02 12:18:25.151526,2023-10-02 12:18:25.385887,0 days 00:00:00.234361,8722.606225722539,490,sag,COMPLETE
3075,0.5352112676056338,2023-10-02 12:18:25.386883,2023-10-02 12:18:25.530489,0 days 00:00:00.143606,0.473224880797671,470,sag,COMPLETE
3076,0.637951741456491,2023-10-02 12:18:25.531489,2023-10-02 12:18:25.806755,0 days 00:00:00.275266,28473.11852161169,480,lbfgs,COMPLETE
3077,0.6590785020198712,2023-10-02 12:18:25.807750,2023-10-02 12:18:26.053317,0 days 00:00:00.245567,5205.175965718737,500,sag,COMPLETE
3078,0.6534556174254831,2023-10-02 12:18:26.054328,2023-10-02 12:18:26.221956,0 days 00:00:00.167628,58.47973035285175,490,sag,COMPLETE
3079,0.5,2023-10-02 12:18:26.223956,2023-10-02 12:18:26.367675,0 days 00:00:00.143719,0.10803254246501978,500,saga,COMPLETE
3080,0.669996724533246,2023-10-02 12:18:26.368676,2023-10-02 12:18:26.598219,0 days 00:00:00.229543,19960.770880298576,480,sag,COMPLETE
3081,0.6520362484987444,2023-10-02 12:18:26.599220,2023-10-02 12:18:26.925203,0 days 00:00:00.325983,22894.21224553289,490,sag,COMPLETE
3082,0.6738726935254942,2023-10-02 12:18:26.926203,2023-10-02 12:18:27.166390,0 days 00:00:00.240187,21486.615153148257,460,sag,COMPLETE
3083,0.6590785020198712,2023-10-02 12:18:27.167393,2023-10-02 12:18:27.391640,0 days 00:00:00.224247,40694.321142050685,460,sag,COMPLETE
