number,value,datetime_start,datetime_complete,duration,params_C,params_max_iter,params_solver,state
9437,0.6069985806310733,2023-10-02 13:03:51.226298,2023-10-02 13:03:51.850166,0 days 00:00:00.623868,4.654632517387312,460,sag,COMPLETE
9438,0.5,2023-10-02 13:03:51.850166,2023-10-02 13:03:52.630742,0 days 00:00:00.780576,5.8267556828664696e-05,480,saga,COMPLETE
9439,0.637951741456491,2023-10-02 13:03:52.630742,2023-10-02 13:03:53.325053,0 days 00:00:00.694311,762.6773957889097,470,sag,COMPLETE
9440,0.6449939949776177,2023-10-02 13:03:53.325053,2023-10-02 13:03:53.881701,0 days 00:00:00.556648,20859.549127567458,480,sag,COMPLETE
9441,0.5,2023-10-02 13:03:53.881701,2023-10-02 13:03:54.439582,0 days 00:00:00.557881,0.04091888433156154,450,sag,COMPLETE
9442,0.6534556174254831,2023-10-02 13:03:54.439582,2023-10-02 13:03:55.207018,0 days 00:00:00.767436,65.81277491900933,460,sag,COMPLETE
9443,0.6418277104487389,2023-10-02 13:03:55.207018,2023-10-02 13:03:56.075204,0 days 00:00:00.868186,446.7367601424266,470,sag,COMPLETE
9444,0.6520362484987444,2023-10-02 13:03:56.075204,2023-10-02 13:03:56.917417,0 days 00:00:00.842213,35071.85183285761,480,sag,COMPLETE
9445,0.5,2023-10-02 13:03:56.917417,2023-10-02 13:03:57.967237,0 days 00:00:01.049820,3.066182867286618e-05,450,sag,COMPLETE
9446,0.6013756960366853,2023-10-02 13:03:57.967237,2023-10-02 13:03:58.444867,0 days 00:00:00.477630,2.29352275867847,490,sag,COMPLETE
9447,0.608417949557812,2023-10-02 13:03:58.444867,2023-10-02 13:03:59.034908,0 days 00:00:00.590041,2.961424240156626,480,newton-cg,COMPLETE
9448,0.6590785020198712,2023-10-02 13:03:59.034908,2023-10-02 13:03:59.677983,0 days 00:00:00.643075,47356.15459403136,460,sag,COMPLETE
9449,0.6298722567965934,2023-10-02 13:03:59.677983,2023-10-02 13:04:00.259275,0 days 00:00:00.581292,16.859729046442958,490,sag,COMPLETE
9450,0.5,2023-10-02 13:04:00.274904,2023-10-02 13:04:00.830339,0 days 00:00:00.555435,0.00893018184368208,480,liblinear,COMPLETE
9451,0.6520362484987444,2023-10-02 13:04:00.830339,2023-10-02 13:04:01.466163,0 days 00:00:00.635824,21380.679716205745,450,sag,COMPLETE
9452,0.6488699639698657,2023-10-02 13:04:01.481791,2023-10-02 13:04:02.030677,0 days 00:00:00.548886,63675.06828832917,490,sag,COMPLETE
9453,0.6590785020198712,2023-10-02 13:04:02.030677,2023-10-02 13:04:02.674604,0 days 00:00:00.643927,67364.75906518113,470,sag,COMPLETE
9454,0.5,2023-10-02 13:04:02.674604,2023-10-02 13:04:03.246860,0 days 00:00:00.572256,0.06109904771940964,460,sag,COMPLETE
9455,0.6481602795064964,2023-10-02 13:04:03.246860,2023-10-02 13:04:03.897687,0 days 00:00:00.650827,32804.71357847216,480,sag,COMPLETE
9456,0.666120755540998,2023-10-02 13:04:03.900209,2023-10-02 13:04:04.557054,0 days 00:00:00.656845,99418.52163574028,470,sag,COMPLETE
9457,0.5,2023-10-02 13:04:04.557054,2023-10-02 13:04:05.137579,0 days 00:00:00.580525,0.006142762233584801,490,sag,COMPLETE
9458,0.6267059722677149,2023-10-02 13:04:05.137579,2023-10-02 13:04:05.616519,0 days 00:00:00.478940,11.843747661639576,470,sag,COMPLETE
9459,0.6481602795064964,2023-10-02 13:04:05.616519,2023-10-02 13:04:06.252176,0 days 00:00:00.635657,22678.186310533674,490,sag,COMPLETE
9460,0.637951741456491,2023-10-02 13:04:06.252176,2023-10-02 13:04:06.863726,0 days 00:00:00.611550,46327.88276424573,450,lbfgs,COMPLETE
9461,0.6534556174254831,2023-10-02 13:04:06.879356,2023-10-02 13:04:07.475220,0 days 00:00:00.595864,129.2142617697197,480,sag,COMPLETE
9462,0.6520362484987444,2023-10-02 13:04:07.475220,2023-10-02 13:04:08.117358,0 days 00:00:00.642138,20794.428603363554,460,sag,COMPLETE
9463,0.5,2023-10-02 13:04:08.133042,2023-10-02 13:04:08.745762,0 days 00:00:00.612720,0.0016325804721463596,490,saga,COMPLETE
9464,0.6573315864177312,2023-10-02 13:04:08.745762,2023-10-02 13:04:09.233741,0 days 00:00:00.487979,37.37554905394491,470,sag,COMPLETE
9465,0.6520362484987444,2023-10-02 13:04:09.233741,2023-10-02 13:04:09.890076,0 days 00:00:00.656335,36445.11676983286,480,sag,COMPLETE
9466,0.5,2023-10-02 13:04:09.890076,2023-10-02 13:04:10.464392,0 days 00:00:00.574316,0.001008931014290638,490,sag,COMPLETE
9467,0.6520362484987444,2023-10-02 13:04:10.464392,2023-10-02 13:04:11.128355,0 days 00:00:00.663963,67700.13077628518,450,sag,COMPLETE
9468,0.66224478654875,2023-10-02 13:04:11.128355,2023-10-02 13:04:11.790400,0 days 00:00:00.662045,98556.16248968484,480,sag,COMPLETE
9469,0.6590785020198712,2023-10-02 13:04:11.790400,2023-10-02 13:04:12.447352,0 days 00:00:00.656952,19309.925113719033,470,sag,COMPLETE
9470,0.6520362484987444,2023-10-02 13:04:12.447352,2023-10-02 13:04:12.995056,0 days 00:00:00.547704,99957.94825064026,460,sag,COMPLETE
9471,0.6534556174254831,2023-10-02 13:04:12.995056,2023-10-02 13:04:13.576567,0 days 00:00:00.581511,54.800729000917684,490,sag,COMPLETE
9472,0.637951741456491,2023-10-02 13:04:13.576567,2023-10-02 13:04:14.223668,0 days 00:00:00.647101,706.9137031011094,480,sag,COMPLETE
9473,0.5478764057211486,2023-10-02 13:04:14.223668,2023-10-02 13:04:14.831396,0 days 00:00:00.607728,0.6956671588838306,460,newton-cg,COMPLETE
9474,0.6590785020198712,2023-10-02 13:04:14.831396,2023-10-02 13:04:15.486340,0 days 00:00:00.654944,36063.26919819107,450,sag,COMPLETE
9475,0.5,2023-10-02 13:04:15.486340,2023-10-02 13:04:16.102185,0 days 00:00:00.615845,0.000134311733571633,490,sag,COMPLETE
9476,0.5690031662845288,2023-10-02 13:04:16.117630,2023-10-02 13:04:16.561331,0 days 00:00:00.443701,0.9956375324074009,490,liblinear,COMPLETE
9477,0.6069985806310733,2023-10-02 13:04:16.561331,2023-10-02 13:04:17.137771,0 days 00:00:00.576440,4.749668944610663,470,sag,COMPLETE
9478,0.5,2023-10-02 13:04:17.137771,2023-10-02 13:04:17.716359,0 days 00:00:00.578588,0.0008977679583840493,480,sag,COMPLETE
9479,0.6573315864177312,2023-10-02 13:04:17.716359,2023-10-02 13:04:18.281758,0 days 00:00:00.565399,38.14171008299506,460,sag,COMPLETE
9480,0.637951741456491,2023-10-02 13:04:18.281758,2023-10-02 13:04:18.915200,0 days 00:00:00.633442,99582.81950322531,480,sag,COMPLETE
9481,0.5,2023-10-02 13:04:18.930756,2023-10-02 13:04:19.474662,0 days 00:00:00.543906,0.17328287398177847,490,sag,COMPLETE
9482,0.649579648433235,2023-10-02 13:04:19.490290,2023-10-02 13:04:19.989430,0 days 00:00:00.499140,152.11883285085142,450,sag,COMPLETE
9483,0.666120755540998,2023-10-02 13:04:19.989430,2023-10-02 13:04:20.635400,0 days 00:00:00.645970,49895.1755171284,470,sag,COMPLETE
9484,0.5376678676711432,2023-10-02 13:04:20.635400,2023-10-02 13:04:21.189868,0 days 00:00:00.554468,0.6239802742027339,490,sag,COMPLETE
9485,0.6590785020198712,2023-10-02 13:04:21.206069,2023-10-02 13:04:21.858604,0 days 00:00:00.652535,16257.733404050488,480,sag,COMPLETE
9486,0.637951741456491,2023-10-02 13:04:21.874242,2023-10-02 13:04:22.454158,0 days 00:00:00.579916,31212.102058175835,460,lbfgs,COMPLETE
9487,0.6077082650944426,2023-10-02 13:04:22.454158,2023-10-02 13:04:23.019627,0 days 00:00:00.565469,3.5058214116400612,490,sag,COMPLETE
9488,0.6457036794409869,2023-10-02 13:04:23.035241,2023-10-02 13:04:23.557046,0 days 00:00:00.521805,245.8969027817709,450,sag,COMPLETE
9489,0.5,2023-10-02 13:04:23.557046,2023-10-02 13:04:24.305913,0 days 00:00:00.748867,3.873711609269692e-05,470,saga,COMPLETE
9490,0.6457036794409869,2023-10-02 13:04:24.305913,2023-10-02 13:04:24.917547,0 days 00:00:00.611634,172.73931891999408,490,sag,COMPLETE
9491,0.6590785020198712,2023-10-02 13:04:24.917547,2023-10-02 13:04:25.563341,0 days 00:00:00.645794,19332.598007344604,470,sag,COMPLETE
9492,0.666120755540998,2023-10-02 13:04:25.578971,2023-10-02 13:04:26.203957,0 days 00:00:00.624986,46995.54617559097,480,sag,COMPLETE
9493,0.6020853805000546,2023-10-02 13:04:26.203957,2023-10-02 13:04:26.768954,0 days 00:00:00.564997,1.7949679548273256,460,sag,COMPLETE
9494,0.5,2023-10-02 13:04:26.768954,2023-10-02 13:04:27.223683,0 days 00:00:00.454729,0.07676442998878238,450,sag,COMPLETE
9495,0.6541653018888526,2023-10-02 13:04:27.223683,2023-10-02 13:04:27.789123,0 days 00:00:00.565440,29.424571617980277,490,sag,COMPLETE
9496,0.6520362484987444,2023-10-02 13:04:27.789123,2023-10-02 13:04:28.424770,0 days 00:00:00.635647,64717.12449486819,480,sag,COMPLETE
9497,0.6449939949776177,2023-10-02 13:04:28.424770,2023-10-02 13:04:29.074650,0 days 00:00:00.649880,28410.64107372128,480,sag,COMPLETE
9498,0.6062888961677039,2023-10-02 13:04:29.074650,2023-10-02 13:04:29.656913,0 days 00:00:00.582263,6.425182702996644,470,newton-cg,COMPLETE
9499,0.5,2023-10-02 13:04:29.656913,2023-10-02 13:04:30.220418,0 days 00:00:00.563505,0.09383603411739469,490,sag,COMPLETE
9500,0.5,2023-10-02 13:04:30.220418,2023-10-02 13:04:30.690804,0 days 00:00:00.470386,0.0034593809398737753,470,sag,COMPLETE
9501,0.6590785020198712,2023-10-02 13:04:30.690804,2023-10-02 13:04:31.332762,0 days 00:00:00.641958,38629.052142741064,460,sag,COMPLETE
9502,0.6590785020198712,2023-10-02 13:04:31.332762,2023-10-02 13:04:31.994140,0 days 00:00:00.661378,15151.601934710949,490,sag,COMPLETE
9503,0.528169014084507,2023-10-02 13:04:31.994140,2023-10-02 13:04:32.555732,0 days 00:00:00.561592,0.4077226352019515,450,liblinear,COMPLETE
9504,0.5,2023-10-02 13:04:32.560262,2023-10-02 13:04:33.153365,0 days 00:00:00.593103,0.000497392878888507,480,sag,COMPLETE
9505,0.5,2023-10-02 13:04:33.161405,2023-10-02 13:04:33.748587,0 days 00:00:00.587182,0.00037105620577376097,480,sag,COMPLETE
9506,0.669996724533246,2023-10-02 13:04:33.748587,2023-10-02 13:04:34.329388,0 days 00:00:00.580801,99533.53640201154,490,sag,COMPLETE
9507,0.637951741456491,2023-10-02 13:04:34.329388,2023-10-02 13:04:34.964316,0 days 00:00:00.634928,25547.78517884131,460,sag,COMPLETE
9508,0.5,2023-10-02 13:04:34.972844,2023-10-02 13:04:35.538559,0 days 00:00:00.565715,0.01022374054282014,490,sag,COMPLETE
9509,0.5,2023-10-02 13:04:35.538559,2023-10-02 13:04:36.118952,0 days 00:00:00.580393,0.0005631818012716586,450,sag,COMPLETE
9510,0.6552025330276231,2023-10-02 13:04:36.118952,2023-10-02 13:04:36.745482,0 days 00:00:00.626530,99374.49833908328,470,sag,COMPLETE
9511,0.6520362484987444,2023-10-02 13:04:36.745482,2023-10-02 13:04:37.387659,0 days 00:00:00.642177,65643.74549499327,480,sag,COMPLETE
9512,0.5,2023-10-02 13:04:37.403293,2023-10-02 13:04:37.869374,0 days 00:00:00.466081,0.036137999382007076,470,sag,COMPLETE
9513,0.637951741456491,2023-10-02 13:04:37.869374,2023-10-02 13:04:38.470502,0 days 00:00:00.601128,47623.9317176954,460,lbfgs,COMPLETE
9514,0.6590785020198712,2023-10-02 13:04:38.470502,2023-10-02 13:04:39.129616,0 days 00:00:00.659114,99703.99075589754,490,sag,COMPLETE
9515,0.5721694508134076,2023-10-02 13:04:39.129616,2023-10-02 13:04:39.694083,0 days 00:00:00.564467,1.05792353475701,480,saga,COMPLETE
9516,0.5,2023-10-02 13:04:39.694083,2023-10-02 13:04:40.259575,0 days 00:00:00.565492,0.004733502912588821,490,sag,COMPLETE
9517,0.666120755540998,2023-10-02 13:04:40.259575,2023-10-02 13:04:40.917211,0 days 00:00:00.657636,17052.64002259595,450,sag,COMPLETE
9518,0.5,2023-10-02 13:04:40.932842,2023-10-02 13:04:41.404230,0 days 00:00:00.471388,0.021570652056080837,500,sag,COMPLETE
9519,0.6418277104487389,2023-10-02 13:04:41.404230,2023-10-02 13:04:42.031062,0 days 00:00:00.626832,382.17702248135254,470,sag,COMPLETE
9520,0.637951741456491,2023-10-02 13:04:42.031062,2023-10-02 13:04:42.680152,0 days 00:00:00.649090,1235.33302352221,490,sag,COMPLETE
9521,0.6481602795064964,2023-10-02 13:04:42.680152,2023-10-02 13:04:43.287183,0 days 00:00:00.607031,33982.037215151926,390,sag,COMPLETE
9522,0.619663718746588,2023-10-02 13:04:43.287183,2023-10-02 13:04:43.866691,0 days 00:00:00.579508,9.432787757147421,460,sag,COMPLETE
9523,0.6298722567965934,2023-10-02 13:04:43.866691,2023-10-02 13:04:44.462747,0 days 00:00:00.596056,17.416375749441126,450,sag,COMPLETE
9524,0.5,2023-10-02 13:04:44.462747,2023-10-02 13:04:44.997398,0 days 00:00:00.534651,0.022861004995907985,480,sag,COMPLETE
9525,0.6559122174909924,2023-10-02 13:04:44.997398,2023-10-02 13:04:45.795897,0 days 00:00:00.798499,24514.68081987441,500,sag,COMPLETE
9526,0.6590785020198712,2023-10-02 13:04:45.795897,2023-10-02 13:04:46.486214,0 days 00:00:00.690317,48116.838438299135,220,sag,COMPLETE
9527,0.6534556174254831,2023-10-02 13:04:46.494733,2023-10-02 13:04:47.159632,0 days 00:00:00.664899,87.98840766827337,480,newton-cg,COMPLETE
9528,0.5,2023-10-02 13:04:47.159632,2023-10-02 13:04:47.944609,0 days 00:00:00.784977,6.168886369706631e-05,490,sag,COMPLETE
9529,0.5,2023-10-02 13:04:47.944609,2023-10-02 13:04:48.510616,0 days 00:00:00.566007,0.12866576083928485,440,sag,COMPLETE
9530,0.649579648433235,2023-10-02 13:04:48.510616,2023-10-02 13:04:48.978989,0 days 00:00:00.468373,189.36675024169236,470,liblinear,COMPLETE
9531,0.6520362484987444,2023-10-02 13:04:48.978989,2023-10-02 13:04:49.623472,0 days 00:00:00.644483,15073.98116356873,490,sag,COMPLETE
9532,0.6520362484987444,2023-10-02 13:04:49.639110,2023-10-02 13:04:50.253164,0 days 00:00:00.614054,50518.07790601667,390,sag,COMPLETE
9533,0.5,2023-10-02 13:04:50.268796,2023-10-02 13:04:50.831138,0 days 00:00:00.562342,0.08957749682676579,470,sag,COMPLETE
9534,0.5,2023-10-02 13:04:50.831138,2023-10-02 13:04:51.406548,0 days 00:00:00.575410,0.2615758514174699,500,sag,COMPLETE
9535,0.5,2023-10-02 13:04:51.406548,2023-10-02 13:04:51.881328,0 days 00:00:00.474780,0.014318138739566815,490,sag,COMPLETE
9536,0.666120755540998,2023-10-02 13:04:51.881328,2023-10-02 13:04:52.527404,0 days 00:00:00.646076,99821.82839235381,480,sag,COMPLETE
9537,0.5,2023-10-02 13:04:52.543036,2023-10-02 13:04:53.190118,0 days 00:00:00.647082,0.13148020653551531,460,sag,COMPLETE
9538,0.637951741456491,2023-10-02 13:04:53.192109,2023-10-02 13:04:53.827822,0 days 00:00:00.635713,28515.729996546328,450,lbfgs,COMPLETE
9539,0.6629544710121192,2023-10-02 13:04:53.830822,2023-10-02 13:04:54.486475,0 days 00:00:00.655653,59838.526937992014,500,sag,COMPLETE
9540,0.666120755540998,2023-10-02 13:04:54.491530,2023-10-02 13:04:55.131186,0 days 00:00:00.639656,15235.199643536671,460,sag,COMPLETE
9541,0.6629544710121192,2023-10-02 13:04:55.131186,2023-10-02 13:04:55.678677,0 days 00:00:00.547491,32032.26768604377,400,sag,COMPLETE
9542,0.6520362484987444,2023-10-02 13:04:55.678677,2023-10-02 13:04:56.320682,0 days 00:00:00.642005,63050.958677967064,490,sag,COMPLETE
9543,0.6520362484987444,2023-10-02 13:04:56.320682,2023-10-02 13:04:56.996486,0 days 00:00:00.675804,21005.845414284697,470,saga,COMPLETE
9544,0.6418277104487389,2023-10-02 13:04:56.996486,2023-10-02 13:04:57.638850,0 days 00:00:00.642364,453.95634914773063,480,sag,COMPLETE
9545,0.6520362484987444,2023-10-02 13:04:57.638850,2023-10-02 13:04:58.236443,0 days 00:00:00.597593,1111.3433018322096,240,sag,COMPLETE
9546,0.6590785020198712,2023-10-02 13:04:58.236443,2023-10-02 13:04:58.892688,0 days 00:00:00.656245,41108.12896327813,490,sag,COMPLETE
9547,0.6418277104487389,2023-10-02 13:04:58.892688,2023-10-02 13:04:59.521859,0 days 00:00:00.629171,545.3668630483141,380,sag,COMPLETE
9548,0.5,2023-10-02 13:04:59.521859,2023-10-02 13:05:00.013239,0 days 00:00:00.491380,0.001427889713341091,440,sag,COMPLETE
9549,0.5,2023-10-02 13:05:00.013239,2023-10-02 13:05:00.588166,0 days 00:00:00.574927,0.003167459423901002,500,sag,COMPLETE
9550,0.6534556174254831,2023-10-02 13:05:00.588166,2023-10-02 13:05:01.293111,0 days 00:00:00.704945,68.10019970855579,390,newton-cg,COMPLETE
9551,0.6520362484987444,2023-10-02 13:05:01.293111,2023-10-02 13:05:01.938417,0 days 00:00:00.645306,64665.16800676729,480,sag,COMPLETE
9552,0.6471230483677258,2023-10-02 13:05:01.938417,2023-10-02 13:05:02.518049,0 days 00:00:00.579632,28.168183530219757,450,sag,COMPLETE
9553,0.5,2023-10-02 13:05:02.518049,2023-10-02 13:05:03.099305,0 days 00:00:00.581256,0.004502453941551436,460,sag,COMPLETE
9554,0.5,2023-10-02 13:05:03.099305,2023-10-02 13:05:03.676968,0 days 00:00:00.577663,0.0019384086836074196,480,liblinear,COMPLETE
9555,0.6534556174254831,2023-10-02 13:05:03.676968,2023-10-02 13:05:04.180426,0 days 00:00:00.503458,56.79390581174539,490,sag,COMPLETE
9556,0.5,2023-10-02 13:05:04.180426,2023-10-02 13:05:04.854431,0 days 00:00:00.674005,0.00010547652183987542,500,sag,COMPLETE
9557,0.5,2023-10-02 13:05:04.870066,2023-10-02 13:05:05.467037,0 days 00:00:00.596971,0.00019587229054837964,470,sag,COMPLETE
9558,0.6520362484987444,2023-10-02 13:05:05.467037,2023-10-02 13:05:06.125714,0 days 00:00:00.658677,14432.334286691264,490,sag,COMPLETE
9559,0.5478764057211486,2023-10-02 13:05:06.125714,2023-10-02 13:05:06.706385,0 days 00:00:00.580671,0.6806426464212205,470,sag,COMPLETE
9560,0.6457036794409869,2023-10-02 13:05:06.706385,2023-10-02 13:05:07.325124,0 days 00:00:00.618739,247.50375623885887,380,sag,COMPLETE
9561,0.5,2023-10-02 13:05:07.325124,2023-10-02 13:05:07.899298,0 days 00:00:00.574174,0.006407968314902503,450,sag,COMPLETE
9562,0.5211267605633803,2023-10-02 13:05:07.914918,2023-10-02 13:05:08.384989,0 days 00:00:00.470071,0.37168101598164005,500,sag,COMPLETE
9563,0.6069985806310733,2023-10-02 13:05:08.384989,2023-10-02 13:05:08.934312,0 days 00:00:00.549323,4.497573013087941,410,sag,COMPLETE
9564,0.6520362484987444,2023-10-02 13:05:08.934312,2023-10-02 13:05:09.607366,0 days 00:00:00.673054,23578.08026052083,480,sag,COMPLETE
9565,0.5,2023-10-02 13:05:09.607366,2023-10-02 13:05:10.173753,0 days 00:00:00.566387,0.04581563090962958,460,saga,COMPLETE
9566,0.637951741456491,2023-10-02 13:05:10.173753,2023-10-02 13:05:10.799601,0 days 00:00:00.625848,38725.971722990194,440,lbfgs,COMPLETE
9567,0.6590785020198712,2023-10-02 13:05:10.799601,2023-10-02 13:05:11.459397,0 days 00:00:00.659796,65019.400196283,490,sag,COMPLETE
9568,0.6552025330276231,2023-10-02 13:05:11.459397,2023-10-02 13:05:12.034039,0 days 00:00:00.574642,98974.49168439406,470,sag,COMPLETE
9569,0.6059613494923026,2023-10-02 13:05:12.034039,2023-10-02 13:05:12.604698,0 days 00:00:00.570659,1.6809894967637546,400,sag,COMPLETE
9570,0.5,2023-10-02 13:05:12.604698,2023-10-02 13:05:13.202596,0 days 00:00:00.597898,0.001201562379905188,500,sag,COMPLETE
9571,0.5,2023-10-02 13:05:13.202596,2023-10-02 13:05:14.862451,0 days 00:00:01.659855,1.2514827932070362e-05,490,sag,COMPLETE
9572,0.666120755540998,2023-10-02 13:05:14.862451,2023-10-02 13:05:15.521296,0 days 00:00:00.658845,13907.262608893961,460,sag,COMPLETE
9573,0.6520362484987444,2023-10-02 13:05:15.521296,2023-10-02 13:05:16.180490,0 days 00:00:00.659194,34289.302440118816,480,sag,COMPLETE
9574,0.6559122174909924,2023-10-02 13:05:16.180490,2023-10-02 13:05:16.807040,0 days 00:00:00.626550,24888.056941681734,380,sag,COMPLETE
9575,0.6449939949776177,2023-10-02 13:05:16.807040,2023-10-02 13:05:17.357883,0 days 00:00:00.550843,47633.13840832826,440,sag,COMPLETE
9576,0.6277432034064855,2023-10-02 13:05:17.373525,2023-10-02 13:05:17.945714,0 days 00:00:00.572189,1398.8141728303049,450,newton-cg,COMPLETE
9577,0.637951741456491,2023-10-02 13:05:17.945714,2023-10-02 13:05:18.596879,0 days 00:00:00.651165,19502.784645685333,480,sag,COMPLETE
9578,0.6552025330276231,2023-10-02 13:05:18.596879,2023-10-02 13:05:19.254139,0 days 00:00:00.657260,66844.37696281773,470,sag,COMPLETE
9579,0.6457036794409869,2023-10-02 13:05:19.269782,2023-10-02 13:05:19.914444,0 days 00:00:00.644662,299.2215883608791,500,sag,COMPLETE
9580,0.637951741456491,2023-10-02 13:05:19.914444,2023-10-02 13:05:20.478221,0 days 00:00:00.563777,12405.168920075932,490,liblinear,COMPLETE
9581,0.6520362484987444,2023-10-02 13:05:20.493854,2023-10-02 13:05:21.121946,0 days 00:00:00.628092,34817.529153149415,390,sag,COMPLETE
9582,0.6590785020198712,2023-10-02 13:05:21.121946,2023-10-02 13:05:21.670418,0 days 00:00:00.548472,62130.36941919027,470,sag,COMPLETE
9583,0.5,2023-10-02 13:05:21.686053,2023-10-02 13:05:22.267812,0 days 00:00:00.581759,0.0001851468243625165,500,sag,COMPLETE
9584,0.6590785020198712,2023-10-02 13:05:22.283448,2023-10-02 13:05:22.925426,0 days 00:00:00.641978,26218.221110303617,480,sag,COMPLETE
9585,0.6502893328966044,2023-10-02 13:05:22.925426,2023-10-02 13:05:23.491579,0 days 00:00:00.566153,35.197687058412306,490,sag,COMPLETE
9586,0.5345015831422644,2023-10-02 13:05:23.491579,2023-10-02 13:05:24.056986,0 days 00:00:00.565407,0.5673710376873533,460,sag,COMPLETE
9587,0.637951741456491,2023-10-02 13:05:24.056986,2023-10-02 13:05:24.715641,0 days 00:00:00.658655,765.4725521381353,450,sag,COMPLETE
9588,0.6411180259853696,2023-10-02 13:05:24.715641,2023-10-02 13:05:25.294105,0 days 00:00:00.578464,17390.219244965992,110,sag,COMPLETE
9589,0.6077082650944426,2023-10-02 13:05:25.294105,2023-10-02 13:05:25.781080,0 days 00:00:00.486975,3.6702296987104477,500,lbfgs,COMPLETE
9590,0.6133311496888305,2023-10-02 13:05:25.781080,2023-10-02 13:05:26.330716,0 days 00:00:00.549636,7.021430436797636,410,sag,COMPLETE
9591,0.6590785020198712,2023-10-02 13:05:26.330716,2023-10-02 13:05:26.974033,0 days 00:00:00.643317,46907.07772085389,480,sag,COMPLETE
9592,0.6449939949776177,2023-10-02 13:05:26.974033,2023-10-02 13:05:27.576947,0 days 00:00:00.602914,10848.994058418477,140,saga,COMPLETE
9593,0.5943334425155585,2023-10-02 13:05:27.576947,2023-10-02 13:05:28.149824,0 days 00:00:00.572877,2.0048733334776934,380,sag,COMPLETE
9594,0.6590785020198712,2023-10-02 13:05:28.149824,2023-10-02 13:05:28.797007,0 days 00:00:00.647183,35614.89301152078,460,sag,COMPLETE
9595,0.6369145103177202,2023-10-02 13:05:28.797007,2023-10-02 13:05:29.267956,0 days 00:00:00.470949,19.003727476002254,490,sag,COMPLETE
9596,0.5,2023-10-02 13:05:29.267956,2023-10-02 13:05:29.812152,0 days 00:00:00.544196,0.018862854140982478,440,sag,COMPLETE
9597,0.637951741456491,2023-10-02 13:05:29.812152,2023-10-02 13:05:30.471311,0 days 00:00:00.659159,755.6231510376882,480,sag,COMPLETE
9598,0.5,2023-10-02 13:05:30.471311,2023-10-02 13:05:31.052332,0 days 00:00:00.581021,0.17073683955030539,500,sag,COMPLETE
9599,0.6520362484987444,2023-10-02 13:05:31.052332,2023-10-02 13:05:31.710646,0 days 00:00:00.658314,98591.73455696518,380,sag,COMPLETE
