number,value,datetime_start,datetime_complete,duration,params_C,params_max_iter,params_solver,state
5689,0.6590785020198712,2023-10-02 12:32:13.527227,2023-10-02 12:32:13.982066,0 days 00:00:00.454839,15633.405835403722,490,sag,COMPLETE
5690,0.5,2023-10-02 12:32:13.982066,2023-10-02 12:32:14.264591,0 days 00:00:00.282525,0.000757418062490352,500,sag,COMPLETE
5691,0.6520362484987444,2023-10-02 12:32:14.264591,2023-10-02 12:32:14.703283,0 days 00:00:00.438692,4345.513069450086,440,sag,COMPLETE
5692,0.637951741456491,2023-10-02 12:32:14.703283,2023-10-02 12:32:15.033121,0 days 00:00:00.329838,30895.782871257747,460,lbfgs,COMPLETE
5693,0.6520362484987444,2023-10-02 12:32:15.048763,2023-10-02 12:32:15.472327,0 days 00:00:00.423564,8757.994432150592,480,sag,COMPLETE
5694,0.6520362484987444,2023-10-02 12:32:15.487948,2023-10-02 12:32:15.849010,0 days 00:00:00.361062,97733.35567798925,490,sag,COMPLETE
5695,0.637951741456491,2023-10-02 12:32:15.849010,2023-10-02 12:32:16.303861,0 days 00:00:00.454851,46754.78843868568,470,sag,COMPLETE
5696,0.6449939949776177,2023-10-02 12:32:16.303861,2023-10-02 12:32:16.632669,0 days 00:00:00.328808,1180.636814442758,330,sag,COMPLETE
5697,0.6590785020198712,2023-10-02 12:32:16.632669,2023-10-02 12:32:17.071257,0 days 00:00:00.438588,17526.887858527454,310,sag,COMPLETE
5698,0.5,2023-10-02 12:32:17.071257,2023-10-02 12:32:17.338138,0 days 00:00:00.266881,0.07478332048263824,480,sag,COMPLETE
5699,0.6013756960366853,2023-10-02 12:32:17.338138,2023-10-02 12:32:17.631771,0 days 00:00:00.293633,2.3540497597383476,500,sag,COMPLETE
5700,0.6418277104487389,2023-10-02 12:32:17.636285,2023-10-02 12:32:18.059881,0 days 00:00:00.423596,409.0759883938268,370,sag,COMPLETE
5701,0.6449939949776177,2023-10-02 12:32:18.059881,2023-10-02 12:32:18.404934,0 days 00:00:00.345053,28764.20869865397,490,sag,COMPLETE
5702,0.5,2023-10-02 12:32:18.420563,2023-10-02 12:32:18.812370,0 days 00:00:00.391807,0.0003680546500101398,430,sag,COMPLETE
5703,0.6133311496888305,2023-10-02 12:32:18.827996,2023-10-02 12:32:19.110508,0 days 00:00:00.282512,6.940737101605581,450,sag,COMPLETE
5704,0.637951741456491,2023-10-02 12:32:19.110508,2023-10-02 12:32:19.471594,0 days 00:00:00.361086,11789.546564134458,360,newton-cg,COMPLETE
5705,0.5,2023-10-02 12:32:19.471594,2023-10-02 12:32:19.785371,0 days 00:00:00.313777,0.00021004939019954669,340,sag,COMPLETE
5706,0.5619609127634021,2023-10-02 12:32:19.785371,2023-10-02 12:32:20.162055,0 days 00:00:00.376684,0.8491547010631599,380,sag,COMPLETE
5707,0.5,2023-10-02 12:32:20.162055,2023-10-02 12:32:21.118483,0 days 00:00:00.956428,1.8657751216471472e-05,460,sag,COMPLETE
5708,0.528169014084507,2023-10-02 12:32:21.118483,2023-10-02 12:32:21.479567,0 days 00:00:00.361084,0.45466641286809717,500,liblinear,COMPLETE
5709,0.5792117043345343,2023-10-02 12:32:21.479567,2023-10-02 12:32:21.762157,0 days 00:00:00.282590,1.0983607680279923,480,sag,COMPLETE
5710,0.6534556174254831,2023-10-02 12:32:21.762157,2023-10-02 12:32:22.154476,0 days 00:00:00.392319,71.41408311436385,490,sag,COMPLETE
5711,0.6457036794409869,2023-10-02 12:32:22.154476,2023-10-02 12:32:22.483388,0 days 00:00:00.328912,212.50042199106687,470,sag,COMPLETE
5712,0.666120755540998,2023-10-02 12:32:22.483388,2023-10-02 12:32:22.891353,0 days 00:00:00.407965,5432.634958955378,350,sag,COMPLETE
5713,0.6590785020198712,2023-10-02 12:32:22.891353,2023-10-02 12:32:23.268057,0 days 00:00:00.376704,48716.41701564155,500,sag,COMPLETE
5714,0.666120755540998,2023-10-02 12:32:23.268057,2023-10-02 12:32:23.707284,0 days 00:00:00.439227,98492.11425460239,440,sag,COMPLETE
5715,0.6520362484987444,2023-10-02 12:32:23.707284,2023-10-02 12:32:24.052699,0 days 00:00:00.345415,2848.4104991712684,490,sag,COMPLETE
5716,0.6411180259853696,2023-10-02 12:32:24.052699,2023-10-02 12:32:24.460158,0 days 00:00:00.407459,8326.996557863251,260,sag,COMPLETE
5717,0.637951741456491,2023-10-02 12:32:24.460158,2023-10-02 12:32:24.789580,0 days 00:00:00.329422,22091.25391902717,480,lbfgs,COMPLETE
5718,0.5823779888634131,2023-10-02 12:32:24.789580,2023-10-02 12:32:25.164192,0 days 00:00:00.374612,1.17479170600156,390,sag,COMPLETE
5719,0.6267059722677149,2023-10-02 12:32:25.164192,2023-10-02 12:32:25.449312,0 days 00:00:00.285120,10.85594491712001,360,sag,COMPLETE
5720,0.6590785020198712,2023-10-02 12:32:25.449312,2023-10-02 12:32:25.807362,0 days 00:00:00.358050,32299.621680166456,500,sag,COMPLETE
5721,0.6552025330276231,2023-10-02 12:32:25.807362,2023-10-02 12:32:26.251079,0 days 00:00:00.443717,66206.22244194323,470,sag,COMPLETE
5722,0.5,2023-10-02 12:32:26.262600,2023-10-02 12:32:26.544718,0 days 00:00:00.282118,0.15939069954996443,330,sag,COMPLETE
5723,0.5,2023-10-02 12:32:26.544718,2023-10-02 12:32:26.983826,0 days 00:00:00.439108,0.00012385809698410496,490,sag,COMPLETE
5724,0.6520362484987444,2023-10-02 12:32:26.983826,2023-10-02 12:32:27.376130,0 days 00:00:00.392304,14324.36985132253,480,sag,COMPLETE
5725,0.6520362484987444,2023-10-02 12:32:27.376130,2023-10-02 12:32:27.815335,0 days 00:00:00.439205,3680.707307324217,460,sag,COMPLETE
5726,0.637951741456491,2023-10-02 12:32:27.815335,2023-10-02 12:32:28.155252,0 days 00:00:00.339917,685.7092235232193,350,sag,COMPLETE
5727,0.6559122174909924,2023-10-02 12:32:28.160766,2023-10-02 12:32:28.568715,0 days 00:00:00.407949,6341.717438835078,340,sag,COMPLETE
5728,0.666120755540998,2023-10-02 12:32:28.584366,2023-10-02 12:32:28.944506,0 days 00:00:00.360140,46354.77544143222,500,sag,COMPLETE
5729,0.5,2023-10-02 12:32:28.944506,2023-10-02 12:32:30.003134,0 days 00:00:01.058628,1.6593008251882252e-05,240,sag,COMPLETE
5730,0.5,2023-10-02 12:32:30.003134,2023-10-02 12:32:30.269483,0 days 00:00:00.266349,0.06436834144075858,450,sag,COMPLETE
5731,0.637951741456491,2023-10-02 12:32:30.285129,2023-10-02 12:32:30.693053,0 days 00:00:00.407924,19646.457068953587,490,newton-cg,COMPLETE
5732,0.5,2023-10-02 12:32:30.693053,2023-10-02 12:32:30.991199,0 days 00:00:00.298146,0.008180897963610963,480,liblinear,COMPLETE
5733,0.6590785020198712,2023-10-02 12:32:30.991199,2023-10-02 12:32:31.462664,0 days 00:00:00.471465,99663.07207317807,470,sag,COMPLETE
5734,0.6590785020198712,2023-10-02 12:32:31.462664,2023-10-02 12:32:31.863238,0 days 00:00:00.400574,9273.932243150482,490,sag,COMPLETE
5735,0.637951741456491,2023-10-02 12:32:31.863238,2023-10-02 12:32:32.291774,0 days 00:00:00.428536,1140.0752769394387,170,sag,COMPLETE
5736,0.6449939949776177,2023-10-02 12:32:32.291774,2023-10-02 12:32:32.856367,0 days 00:00:00.564593,1760.2625324360054,500,sag,COMPLETE
5737,0.6369145103177202,2023-10-02 12:32:32.856367,2023-10-02 12:32:33.327191,0 days 00:00:00.470824,23.379545358888464,480,sag,COMPLETE
5738,0.5,2023-10-02 12:32:33.327191,2023-10-02 12:32:33.746001,0 days 00:00:00.418810,0.001248685472101192,440,sag,COMPLETE
5739,0.5,2023-10-02 12:32:33.746001,2023-10-02 12:32:34.803413,0 days 00:00:01.057412,1.725364012646492e-05,380,sag,COMPLETE
5740,0.6573315864177312,2023-10-02 12:32:34.803413,2023-10-02 12:32:35.226966,0 days 00:00:00.423553,38.441463946743745,360,sag,COMPLETE
5741,0.5,2023-10-02 12:32:35.226966,2023-10-02 12:32:35.525122,0 days 00:00:00.298156,0.019022214061792428,370,sag,COMPLETE
5742,0.637951741456491,2023-10-02 12:32:35.525122,2023-10-02 12:32:35.996117,0 days 00:00:00.470995,29859.898232307227,460,lbfgs,COMPLETE
5743,0.6534556174254831,2023-10-02 12:32:35.996117,2023-10-02 12:32:36.341153,0 days 00:00:00.345036,50.203869786502786,410,sag,COMPLETE
5744,0.6411180259853696,2023-10-02 12:32:36.341153,2023-10-02 12:32:36.811536,0 days 00:00:00.470383,12666.269015979951,500,sag,COMPLETE
5745,0.5,2023-10-02 12:32:36.811536,2023-10-02 12:32:37.109694,0 days 00:00:00.298158,0.004969045481362024,490,sag,COMPLETE
5746,0.666120755540998,2023-10-02 12:32:37.109694,2023-10-02 12:32:37.548895,0 days 00:00:00.439201,53570.05808924296,480,sag,COMPLETE
5747,0.6590785020198712,2023-10-02 12:32:37.548895,2023-10-02 12:32:37.909958,0 days 00:00:00.361063,4185.832606401103,470,sag,COMPLETE
5748,0.666120755540998,2023-10-02 12:32:37.909958,2023-10-02 12:32:38.348651,0 days 00:00:00.438693,22277.019645836157,340,sag,COMPLETE
5749,0.6133311496888305,2023-10-02 12:32:38.348651,2023-10-02 12:32:38.631189,0 days 00:00:00.282538,7.125543233623469,450,sag,COMPLETE
5750,0.6534556174254831,2023-10-02 12:32:38.631189,2023-10-02 12:32:39.078410,0 days 00:00:00.447221,99.87809218246677,350,sag,COMPLETE
5751,0.6481602795064964,2023-10-02 12:32:39.078410,2023-10-02 12:32:39.462747,0 days 00:00:00.384337,39347.467826471904,250,sag,COMPLETE
5752,0.6520362484987444,2023-10-02 12:32:39.462747,2023-10-02 12:32:39.933603,0 days 00:00:00.470856,65080.85388135973,500,sag,COMPLETE
5753,0.6449939949776177,2023-10-02 12:32:39.933603,2023-10-02 12:32:40.294119,0 days 00:00:00.360516,2387.6974031136183,420,sag,COMPLETE
5754,0.637951741456491,2023-10-02 12:32:40.294119,2023-10-02 12:32:40.686460,0 days 00:00:00.392341,7809.813216468267,490,newton-cg,COMPLETE
5755,0.6590785020198712,2023-10-02 12:32:40.686460,2023-10-02 12:32:41.062764,0 days 00:00:00.376304,16041.794280104372,490,sag,COMPLETE
5756,0.5,2023-10-02 12:32:41.078384,2023-10-02 12:32:41.785357,0 days 00:00:00.706973,3.795775178483862e-05,370,sag,COMPLETE
5757,0.637951741456491,2023-10-02 12:32:41.785357,2023-10-02 12:32:42.084613,0 days 00:00:00.299256,98787.73625448935,470,liblinear,COMPLETE
5758,0.6449939949776177,2023-10-02 12:32:42.084613,2023-10-02 12:32:42.538367,0 days 00:00:00.453754,5369.04534970524,500,sag,COMPLETE
5759,0.5,2023-10-02 12:32:42.538367,2023-10-02 12:32:42.820903,0 days 00:00:00.282536,0.055758158011218695,320,sag,COMPLETE
5760,0.6520362484987444,2023-10-02 12:32:42.820903,2023-10-02 12:32:43.187058,0 days 00:00:00.366155,26300.719434036193,480,sag,COMPLETE
5761,0.6520362484987444,2023-10-02 12:32:43.187058,2023-10-02 12:32:43.636819,0 days 00:00:00.449761,11350.179115351359,460,sag,COMPLETE
5762,0.6481602795064964,2023-10-02 12:32:43.636819,2023-10-02 12:32:43.982278,0 days 00:00:00.345459,33736.235328112634,330,sag,COMPLETE
5763,0.6449939949776177,2023-10-02 12:32:43.982278,2023-10-02 12:32:44.426973,0 days 00:00:00.444695,99994.585271508,430,sag,COMPLETE
5764,0.6457036794409869,2023-10-02 12:32:44.442610,2023-10-02 12:32:44.771478,0 days 00:00:00.328868,215.64268140151313,480,sag,COMPLETE
5765,0.6449939949776177,2023-10-02 12:32:44.771478,2023-10-02 12:32:45.245319,0 days 00:00:00.473841,957.19372239558,360,sag,COMPLETE
5766,0.6481602795064964,2023-10-02 12:32:45.245319,2023-10-02 12:32:45.603219,0 days 00:00:00.357900,48669.58470907101,490,sag,COMPLETE
5767,0.637951741456491,2023-10-02 12:32:45.603219,2023-10-02 12:32:46.017423,0 days 00:00:00.414204,17706.029936496274,350,lbfgs,COMPLETE
5768,0.6449939949776177,2023-10-02 12:32:46.019424,2023-10-02 12:32:46.372650,0 days 00:00:00.353226,5560.888089072218,450,sag,COMPLETE
5769,0.6418277104487389,2023-10-02 12:32:46.372650,2023-10-02 12:32:46.812447,0 days 00:00:00.439797,427.1588206432849,500,sag,COMPLETE
5770,0.643956763838847,2023-10-02 12:32:46.812447,2023-10-02 12:32:47.109653,0 days 00:00:00.297206,27.104229852818502,490,sag,COMPLETE
5771,0.6488699639698657,2023-10-02 12:32:47.109653,2023-10-02 12:32:47.564502,0 days 00:00:00.454849,63379.55902418847,470,sag,COMPLETE
5772,0.6449939949776177,2023-10-02 12:32:47.564502,2023-10-02 12:32:47.909716,0 days 00:00:00.345214,3079.3897205772773,380,sag,COMPLETE
5773,0.6020853805000546,2023-10-02 12:32:47.909716,2023-10-02 12:32:48.286186,0 days 00:00:00.376470,1.7687795964679347,500,sag,COMPLETE
5774,0.6590785020198712,2023-10-02 12:32:48.286186,2023-10-02 12:32:48.669288,0 days 00:00:00.383102,10450.313387842481,480,sag,COMPLETE
5775,0.6520362484987444,2023-10-02 12:32:48.671288,2023-10-02 12:32:49.102627,0 days 00:00:00.431339,34086.548293654756,310,sag,COMPLETE
5776,0.66224478654875,2023-10-02 12:32:49.102627,2023-10-02 12:32:49.462433,0 days 00:00:00.359806,18582.83105917239,390,sag,COMPLETE
5777,0.6449939949776177,2023-10-02 12:32:49.462433,2023-10-02 12:32:49.999129,0 days 00:00:00.536696,2025.8931475538018,440,sag,COMPLETE
5778,0.5,2023-10-02 12:32:49.999129,2023-10-02 12:32:50.309883,0 days 00:00:00.310754,0.16964845522623623,340,sag,COMPLETE
5779,0.5,2023-10-02 12:32:50.309883,2023-10-02 12:32:51.988710,0 days 00:00:01.678827,1.1286053943326067e-05,490,sag,COMPLETE
5780,0.6590785020198712,2023-10-02 12:32:51.988710,2023-10-02 12:32:52.366773,0 days 00:00:00.378063,8291.63126597403,370,sag,COMPLETE
5781,0.528169014084507,2023-10-02 12:32:52.368773,2023-10-02 12:32:52.647049,0 days 00:00:00.278276,0.40839563375099636,400,newton-cg,COMPLETE
5782,0.669996724533246,2023-10-02 12:32:52.647049,2023-10-02 12:32:53.105042,0 days 00:00:00.457993,44718.10965097651,460,sag,COMPLETE
5783,0.637951741456491,2023-10-02 12:32:53.105042,2023-10-02 12:32:53.383558,0 days 00:00:00.278516,66822.76504970626,490,liblinear,COMPLETE
5784,0.6077082650944426,2023-10-02 12:32:53.383558,2023-10-02 12:32:53.761093,0 days 00:00:00.377535,3.624736609897157,470,sag,COMPLETE
5785,0.5,2023-10-02 12:32:53.761093,2023-10-02 12:32:54.043721,0 days 00:00:00.282628,0.006329154643185881,500,sag,COMPLETE
5786,0.6101648651599519,2023-10-02 12:32:54.043721,2023-10-02 12:32:54.420425,0 days 00:00:00.376704,5.155623693088075,480,sag,COMPLETE
5787,0.5,2023-10-02 12:32:54.420425,2023-10-02 12:32:54.733329,0 days 00:00:00.312904,0.00039485646479478465,360,sag,COMPLETE
5788,0.6590785020198712,2023-10-02 12:32:54.733329,2023-10-02 12:32:55.209077,0 days 00:00:00.475748,28034.195232786402,500,sag,COMPLETE
5789,0.649579648433235,2023-10-02 12:32:55.209077,2023-10-02 12:32:55.517772,0 days 00:00:00.308695,142.19083309845317,490,sag,COMPLETE
5790,0.5070422535211268,2023-10-02 12:32:55.531782,2023-10-02 12:32:55.910785,0 days 00:00:00.379003,0.35670639163633866,350,sag,COMPLETE
5791,0.6520362484987444,2023-10-02 12:32:55.910785,2023-10-02 12:32:56.254415,0 days 00:00:00.343630,15100.046421579429,320,sag,COMPLETE
5792,0.6590785020198712,2023-10-02 12:32:56.254415,2023-10-02 12:32:56.694385,0 days 00:00:00.439970,3492.8413677129265,450,sag,COMPLETE
5793,0.6559122174909924,2023-10-02 12:32:56.694385,2023-10-02 12:32:57.055472,0 days 00:00:00.361087,6235.220449533574,480,sag,COMPLETE
5794,0.6481602795064964,2023-10-02 12:32:57.071101,2023-10-02 12:32:57.478197,0 days 00:00:00.407096,11578.254000034744,330,sag,COMPLETE
5795,0.666120755540998,2023-10-02 12:32:57.478197,2023-10-02 12:32:57.854439,0 days 00:00:00.376242,23053.248571381846,470,sag,COMPLETE
5796,0.5,2023-10-02 12:32:57.854439,2023-10-02 12:32:58.230820,0 days 00:00:00.376381,0.02177232422049809,460,lbfgs,COMPLETE
5797,0.6590785020198712,2023-10-02 12:32:58.230820,2023-10-02 12:32:58.607135,0 days 00:00:00.376315,48042.63767440382,500,sag,COMPLETE
5798,0.5,2023-10-02 12:32:58.607135,2023-10-02 12:32:58.984651,0 days 00:00:00.377516,0.0007012585097767987,490,sag,COMPLETE
5799,0.6520362484987444,2023-10-02 12:32:58.984651,2023-10-02 12:32:59.345844,0 days 00:00:00.361193,4173.6847275324135,360,sag,COMPLETE
5800,0.666120755540998,2023-10-02 12:32:59.345844,2023-10-02 12:32:59.817419,0 days 00:00:00.471575,33927.63883131914,480,sag,COMPLETE
5801,0.5,2023-10-02 12:32:59.817419,2023-10-02 12:33:00.223751,0 days 00:00:00.406332,0.00010320053232626689,340,sag,COMPLETE
5802,0.6590785020198712,2023-10-02 12:33:00.223751,2023-10-02 12:33:00.693428,0 days 00:00:00.469677,7896.48683198909,440,sag,COMPLETE
5803,0.5,2023-10-02 12:33:00.693428,2023-10-02 12:33:01.149434,0 days 00:00:00.456006,6.85368094944679e-05,500,sag,COMPLETE
5804,0.6520362484987444,2023-10-02 12:33:01.165062,2023-10-02 12:33:01.541959,0 days 00:00:00.376897,62468.20312202158,490,sag,COMPLETE
5805,0.6277432034064855,2023-10-02 12:33:01.541959,2023-10-02 12:33:01.928720,0 days 00:00:00.386761,868.2679736810057,370,newton-cg,COMPLETE
5806,0.6267059722677149,2023-10-02 12:33:01.929720,2023-10-02 12:33:02.221605,0 days 00:00:00.291885,10.148161801619786,470,sag,COMPLETE
5807,0.5,2023-10-02 12:33:02.221605,2023-10-02 12:33:02.591914,0 days 00:00:00.370309,3.7144463079616274e-05,480,liblinear,COMPLETE
5808,0.5,2023-10-02 12:33:02.591914,2023-10-02 12:33:02.921284,0 days 00:00:00.329370,0.04088782656912561,290,sag,COMPLETE
5809,0.5,2023-10-02 12:33:02.922800,2023-10-02 12:33:03.300353,0 days 00:00:00.377553,0.0012454657749122917,490,sag,COMPLETE
5810,0.6590785020198712,2023-10-02 12:33:03.300353,2023-10-02 12:33:03.689277,0 days 00:00:00.388924,17929.764175236363,460,sag,COMPLETE
5811,0.6449939949776177,2023-10-02 12:33:03.691284,2023-10-02 12:33:04.114020,0 days 00:00:00.422736,2045.2645725132447,350,sag,COMPLETE
5812,0.6590785020198712,2023-10-02 12:33:04.114020,2023-10-02 12:33:04.490743,0 days 00:00:00.376723,66738.82545837684,500,sag,COMPLETE
5813,0.5,2023-10-02 12:33:04.490743,2023-10-02 12:33:04.867604,0 days 00:00:00.376861,0.0022763617970242263,380,sag,COMPLETE
5814,0.5,2023-10-02 12:33:04.883230,2023-10-02 12:33:05.164238,0 days 00:00:00.281008,0.2836956925174553,430,sag,COMPLETE
5815,0.6520362484987444,2023-10-02 12:33:05.164238,2023-10-02 12:33:05.611432,0 days 00:00:00.447194,12871.569392572661,450,sag,COMPLETE
5816,0.66224478654875,2023-10-02 12:33:05.613436,2023-10-02 12:33:05.995590,0 days 00:00:00.382154,27619.32384691571,490,sag,COMPLETE
5817,0.637951741456491,2023-10-02 12:33:05.995590,2023-10-02 12:33:06.404229,0 days 00:00:00.408639,5796.483974475568,340,lbfgs,COMPLETE
5818,0.6534556174254831,2023-10-02 12:33:06.404229,2023-10-02 12:33:06.729732,0 days 00:00:00.325503,79.51649972748292,470,sag,COMPLETE
5819,0.5,2023-10-02 12:33:06.729732,2023-10-02 12:33:07.110538,0 days 00:00:00.380806,0.040183056666713894,480,sag,COMPLETE
5820,0.6298722567965934,2023-10-02 12:33:07.126161,2023-10-02 12:33:07.422929,0 days 00:00:00.296768,15.821267339478865,300,sag,COMPLETE
5821,0.5,2023-10-02 12:33:07.422929,2023-10-02 12:33:07.784222,0 days 00:00:00.361293,0.23105091199754976,500,sag,COMPLETE
5822,0.666120755540998,2023-10-02 12:33:07.784222,2023-10-02 12:33:08.145256,0 days 00:00:00.361034,40241.64693017849,360,sag,COMPLETE
5823,0.6520362484987444,2023-10-02 12:33:08.160899,2023-10-02 12:33:08.615944,0 days 00:00:00.455045,20667.06886060455,490,sag,COMPLETE
5824,0.5,2023-10-02 12:33:08.615944,2023-10-02 12:33:08.934366,0 days 00:00:00.318422,0.00033131886119271137,330,sag,COMPLETE
5825,0.6534556174254831,2023-10-02 12:33:08.934366,2023-10-02 12:33:09.347215,0 days 00:00:00.412849,125.67972756582793,500,sag,COMPLETE
5826,0.6520362484987444,2023-10-02 12:33:09.349215,2023-10-02 12:33:09.698143,0 days 00:00:00.348928,10219.328941035434,480,sag,COMPLETE
5827,0.6534556174254831,2023-10-02 12:33:09.698143,2023-10-02 12:33:10.136383,0 days 00:00:00.438240,59.53220504323827,350,sag,COMPLETE
5828,0.6590785020198712,2023-10-02 12:33:10.138896,2023-10-02 12:33:10.498245,0 days 00:00:00.359349,45960.532268608375,370,sag,COMPLETE
5829,0.6520362484987444,2023-10-02 12:33:10.498245,2023-10-02 12:33:10.967743,0 days 00:00:00.469498,69482.37428884485,460,sag,COMPLETE
5830,0.666120755540998,2023-10-02 12:33:10.967743,2023-10-02 12:33:11.360037,0 days 00:00:00.392294,4067.4768311196867,490,sag,COMPLETE
5831,0.643956763838847,2023-10-02 12:33:11.360037,2023-10-02 12:33:11.753092,0 days 00:00:00.393055,27.233153459708724,480,newton-cg,COMPLETE
5832,0.6590785020198712,2023-10-02 12:33:11.753092,2023-10-02 12:33:12.114481,0 days 00:00:00.361389,13032.160974172706,440,sag,COMPLETE
5833,0.5,2023-10-02 12:33:12.130100,2023-10-02 12:33:12.515460,0 days 00:00:00.385360,0.014581872215427977,500,sag,COMPLETE
5834,0.6277432034064855,2023-10-02 12:33:12.517459,2023-10-02 12:33:12.804136,0 days 00:00:00.286677,1461.7720165994258,450,liblinear,COMPLETE
5835,0.666120755540998,2023-10-02 12:33:12.804136,2023-10-02 12:33:13.242830,0 days 00:00:00.438694,99713.68451520322,490,sag,COMPLETE
5836,0.6337482257888415,2023-10-02 12:33:13.242830,2023-10-02 12:33:13.559720,0 days 00:00:00.316890,14.778145221922511,470,sag,COMPLETE
5837,0.6140408341522,2023-10-02 12:33:13.561720,2023-10-02 12:33:13.918066,0 days 00:00:00.356346,4.979987590040704,360,sag,COMPLETE
5838,0.6006660115733159,2023-10-02 12:33:13.918066,2023-10-02 12:33:14.215777,0 days 00:00:00.297711,3.411759247196628,390,sag,COMPLETE
5839,0.6457036794409869,2023-10-02 12:33:14.215777,2023-10-02 12:33:14.654600,0 days 00:00:00.438823,196.01450468501181,320,sag,COMPLETE
5840,0.6418277104487389,2023-10-02 12:33:14.654600,2023-10-02 12:33:15.030899,0 days 00:00:00.376299,424.9698131909428,480,sag,COMPLETE
5841,0.637951741456491,2023-10-02 12:33:15.030899,2023-10-02 12:33:15.460416,0 days 00:00:00.429517,24914.053547336334,340,lbfgs,COMPLETE
5842,0.619663718746588,2023-10-02 12:33:15.462417,2023-10-02 12:33:15.773497,0 days 00:00:00.311080,9.792078809649798,500,sag,COMPLETE
5843,0.66224478654875,2023-10-02 12:33:15.773497,2023-10-02 12:33:16.246587,0 days 00:00:00.473090,6790.021093831898,490,sag,COMPLETE
5844,0.6449939949776177,2023-10-02 12:33:16.246587,2023-10-02 12:33:16.599558,0 days 00:00:00.352971,34844.95168487767,350,sag,COMPLETE
5845,0.6449939949776177,2023-10-02 12:33:16.601563,2023-10-02 12:33:17.063883,0 days 00:00:00.462320,2706.329708410522,470,sag,COMPLETE
5846,0.6449939949776177,2023-10-02 12:33:17.063883,2023-10-02 12:33:17.440193,0 days 00:00:00.376310,16895.153809433836,460,sag,COMPLETE
5847,0.6629544710121192,2023-10-02 12:33:17.440193,2023-10-02 12:33:17.911083,0 days 00:00:00.470890,99898.8605339713,500,sag,COMPLETE
5848,0.6552025330276231,2023-10-02 12:33:17.911083,2023-10-02 12:33:18.272157,0 days 00:00:00.361074,48631.31321278201,380,sag,COMPLETE
5849,0.6449939949776177,2023-10-02 12:33:18.272157,2023-10-02 12:33:18.742600,0 days 00:00:00.470443,9893.321795759106,490,sag,COMPLETE
5850,0.6449939949776177,2023-10-02 12:33:18.742600,2023-10-02 12:33:19.103154,0 days 00:00:00.360554,24748.78073746703,480,sag,COMPLETE
5851,0.5,2023-10-02 12:33:19.103154,2023-10-02 12:33:19.511116,0 days 00:00:00.407962,0.00026721626389482784,370,sag,COMPLETE
