number,value,datetime_start,datetime_complete,duration,params_C,params_max_iter,params_solver,state
2758,0.5,2023-10-02 12:17:14.964159,2023-10-02 12:17:15.255146,0 days 00:00:00.290987,0.0005846923738821011,460,saga,COMPLETE
2759,0.6203734032099574,2023-10-02 12:17:15.256146,2023-10-02 12:17:15.389502,0 days 00:00:00.133356,8.0504566948842,420,sag,COMPLETE
2760,0.666120755540998,2023-10-02 12:17:15.390505,2023-10-02 12:17:15.607380,0 days 00:00:00.216875,51787.53172285009,460,sag,COMPLETE
2761,0.5313352986133857,2023-10-02 12:17:15.608383,2023-10-02 12:17:15.742832,0 days 00:00:00.134449,0.5252389055376262,450,sag,COMPLETE
2762,0.6590785020198712,2023-10-02 12:17:15.743832,2023-10-02 12:17:15.957892,0 days 00:00:00.214060,33297.20627926824,460,sag,COMPLETE
2763,0.6411180259853696,2023-10-02 12:17:15.958890,2023-10-02 12:17:16.174002,0 days 00:00:00.215112,1243.0767136706818,440,saga,COMPLETE
2764,0.6418277104487389,2023-10-02 12:17:16.175002,2023-10-02 12:17:16.373250,0 days 00:00:00.198248,404.76299829556797,370,sag,COMPLETE
2765,0.637951741456491,2023-10-02 12:17:16.374309,2023-10-02 12:17:16.623911,0 days 00:00:00.249602,96444.18382283479,500,lbfgs,COMPLETE
2766,0.6449939949776177,2023-10-02 12:17:16.624913,2023-10-02 12:17:16.840554,0 days 00:00:00.215641,46834.298458882826,500,sag,COMPLETE
2767,0.608417949557812,2023-10-02 12:17:16.841556,2023-10-02 12:17:16.973868,0 days 00:00:00.132312,2.904953238763468,390,sag,COMPLETE
2768,0.637951741456491,2023-10-02 12:17:16.974866,2023-10-02 12:17:17.194069,0 days 00:00:00.219203,776.4060537085811,420,sag,COMPLETE
2769,0.6590785020198712,2023-10-02 12:17:17.195065,2023-10-02 12:17:17.411098,0 days 00:00:00.216033,27236.255333346573,450,saga,COMPLETE
2770,0.5,2023-10-02 12:17:17.412098,2023-10-02 12:17:17.548024,0 days 00:00:00.135926,0.00838043036337808,500,sag,COMPLETE
2771,0.6590785020198712,2023-10-02 12:17:17.549035,2023-10-02 12:17:17.835895,0 days 00:00:00.286860,58052.56999070584,460,sag,COMPLETE
2772,0.6520362484987444,2023-10-02 12:17:17.836983,2023-10-02 12:17:18.056157,0 days 00:00:00.219174,28254.094589662047,500,sag,COMPLETE
2773,0.6559122174909924,2023-10-02 12:17:18.057156,2023-10-02 12:17:18.274735,0 days 00:00:00.217579,44498.499341895396,490,sag,COMPLETE
2774,0.637951741456491,2023-10-02 12:17:18.275739,2023-10-02 12:17:18.428367,0 days 00:00:00.152628,27395.6000649376,490,newton-cg,COMPLETE
2775,0.6534556174254831,2023-10-02 12:17:18.429361,2023-10-02 12:17:18.611984,0 days 00:00:00.182623,55.4697139787851,500,saga,COMPLETE
2776,0.6369145103177202,2023-10-02 12:17:18.612986,2023-10-02 12:17:18.836073,0 days 00:00:00.223087,20.459321541928347,490,sag,COMPLETE
2777,0.6520362484987444,2023-10-02 12:17:18.837076,2023-10-02 12:17:19.058091,0 days 00:00:00.221015,58352.451179456555,500,sag,COMPLETE
2778,0.5,2023-10-02 12:17:19.060085,2023-10-02 12:17:19.204621,0 days 00:00:00.144536,0.020693161349773653,490,liblinear,COMPLETE
2779,0.6590785020198712,2023-10-02 12:17:19.205682,2023-10-02 12:17:19.427523,0 days 00:00:00.221841,23001.24043193012,500,sag,COMPLETE
2780,0.637951741456491,2023-10-02 12:17:19.428523,2023-10-02 12:17:19.638900,0 days 00:00:00.210377,1046.818791990665,460,sag,COMPLETE
2781,0.6520362484987444,2023-10-02 12:17:19.639898,2023-10-02 12:17:19.911504,0 days 00:00:00.271606,99620.72135486804,380,sag,COMPLETE
2782,0.5,2023-10-02 12:17:19.912506,2023-10-02 12:17:20.044037,0 days 00:00:00.131531,0.020186667259030417,490,saga,COMPLETE
2783,0.6418277104487389,2023-10-02 12:17:20.045037,2023-10-02 12:17:20.265398,0 days 00:00:00.220361,469.0428675348669,470,sag,COMPLETE
2784,0.643956763838847,2023-10-02 12:17:20.266400,2023-10-02 12:17:20.410270,0 days 00:00:00.143870,25.993159934222373,500,sag,COMPLETE
2785,0.5,2023-10-02 12:17:20.411270,2023-10-02 12:17:20.548395,0 days 00:00:00.137125,0.06210522816564681,490,sag,COMPLETE
2786,0.5,2023-10-02 12:17:20.549398,2023-10-02 12:17:20.791802,0 days 00:00:00.242404,9.575125989908283e-05,500,sag,COMPLETE
2787,0.6418277104487389,2023-10-02 12:17:20.792804,2023-10-02 12:17:21.068602,0 days 00:00:00.275798,342.20558461102274,480,saga,COMPLETE
2788,0.666120755540998,2023-10-02 12:17:21.069600,2023-10-02 12:17:21.295959,0 days 00:00:00.226359,35945.68551981523,490,sag,COMPLETE
2789,0.604541980565564,2023-10-02 12:17:21.296959,2023-10-02 12:17:21.439905,0 days 00:00:00.142946,3.2736309835004342,500,sag,COMPLETE
2790,0.6590785020198712,2023-10-02 12:17:21.440900,2023-10-02 12:17:21.658504,0 days 00:00:00.217604,21923.723250949697,480,sag,COMPLETE
2791,0.6238672344142374,2023-10-02 12:17:21.660495,2023-10-02 12:17:21.930705,0 days 00:00:00.270210,1964.2600981344476,490,lbfgs,COMPLETE
2792,0.6590785020198712,2023-10-02 12:17:21.931707,2023-10-02 12:17:22.151232,0 days 00:00:00.219525,59698.986734135266,470,sag,COMPLETE
2793,0.6590785020198712,2023-10-02 12:17:22.152236,2023-10-02 12:17:22.382791,0 days 00:00:00.230555,99855.83178190739,490,saga,COMPLETE
2794,0.5,2023-10-02 12:17:22.384783,2023-10-02 12:17:22.528695,0 days 00:00:00.143912,0.03240644414581266,440,sag,COMPLETE
2795,0.6069985806310733,2023-10-02 12:17:22.529698,2023-10-02 12:17:22.669461,0 days 00:00:00.139763,4.243271617321701,470,sag,COMPLETE
2796,0.5313352986133857,2023-10-02 12:17:22.670459,2023-10-02 12:17:22.874511,0 days 00:00:00.204052,0.49600836665946496,500,sag,COMPLETE
2797,0.5,2023-10-02 12:17:22.875512,2023-10-02 12:17:23.013325,0 days 00:00:00.137813,0.015709798699949384,480,sag,COMPLETE
2798,0.5,2023-10-02 12:17:23.014324,2023-10-02 12:17:23.157536,0 days 00:00:00.143212,0.08530551305753932,460,saga,COMPLETE
2799,0.6590785020198712,2023-10-02 12:17:23.158535,2023-10-02 12:17:23.385698,0 days 00:00:00.227163,24434.834275880654,450,sag,COMPLETE
2800,0.5,2023-10-02 12:17:23.386697,2023-10-02 12:17:23.528508,0 days 00:00:00.141811,0.10314027856312732,490,newton-cg,COMPLETE
2801,0.5,2023-10-02 12:17:23.529506,2023-10-02 12:17:23.688125,0 days 00:00:00.158619,0.0014362312687859246,500,sag,COMPLETE
2802,0.6573315864177312,2023-10-02 12:17:23.690125,2023-10-02 12:17:23.909718,0 days 00:00:00.219593,36.93043698637678,480,sag,COMPLETE
2803,0.637951741456491,2023-10-02 12:17:23.910711,2023-10-02 12:17:24.041131,0 days 00:00:00.130420,42033.44758725111,490,liblinear,COMPLETE
2804,0.6449939949776177,2023-10-02 12:17:24.042163,2023-10-02 12:17:24.247251,0 days 00:00:00.205088,1564.0981858123423,400,sag,COMPLETE
2805,0.6590785020198712,2023-10-02 12:17:24.248251,2023-10-02 12:17:24.460238,0 days 00:00:00.211987,2715.96837057682,430,sag,COMPLETE
2806,0.6418277104487389,2023-10-02 12:17:24.461238,2023-10-02 12:17:24.669776,0 days 00:00:00.208538,216.1652117379829,500,saga,COMPLETE
2807,0.5,2023-10-02 12:17:24.670780,2023-10-02 12:17:25.077459,0 days 00:00:00.406679,5.49147200449471e-05,480,sag,COMPLETE
2808,0.666120755540998,2023-10-02 12:17:25.078456,2023-10-02 12:17:25.297730,0 days 00:00:00.219274,32055.98433678714,500,sag,COMPLETE
2809,0.5,2023-10-02 12:17:25.298738,2023-10-02 12:17:25.445701,0 days 00:00:00.146963,0.005537968576800824,490,sag,COMPLETE
2810,0.6520362484987444,2023-10-02 12:17:25.446700,2023-10-02 12:17:25.665813,0 days 00:00:00.219113,22098.661059404836,470,sag,COMPLETE
2811,0.6418277104487389,2023-10-02 12:17:25.666816,2023-10-02 12:17:25.850802,0 days 00:00:00.183986,178.47040655055017,490,saga,COMPLETE
2812,0.6590785020198712,2023-10-02 12:17:25.851800,2023-10-02 12:17:26.143435,0 days 00:00:00.291635,97649.38113758297,500,sag,COMPLETE
2813,0.6520362484987444,2023-10-02 12:17:26.144521,2023-10-02 12:17:26.362145,0 days 00:00:00.217624,59386.66495486035,480,sag,COMPLETE
2814,0.6590785020198712,2023-10-02 12:17:26.363138,2023-10-02 12:17:26.579584,0 days 00:00:00.216446,16754.188287047506,480,sag,COMPLETE
2815,0.666120755540998,2023-10-02 12:17:26.580583,2023-10-02 12:17:26.795812,0 days 00:00:00.215229,3910.6076413433198,500,sag,COMPLETE
2816,0.6449939949776177,2023-10-02 12:17:26.796812,2023-10-02 12:17:27.015432,0 days 00:00:00.218620,682.983228731779,490,saga,COMPLETE
2817,0.6520362484987444,2023-10-02 12:17:27.016508,2023-10-02 12:17:27.230808,0 days 00:00:00.214300,47263.29571429013,470,sag,COMPLETE
2818,0.5,2023-10-02 12:17:27.231811,2023-10-02 12:17:27.441917,0 days 00:00:00.210106,0.00907462454051424,460,sag,COMPLETE
2819,0.5823779888634131,2023-10-02 12:17:27.442923,2023-10-02 12:17:27.587650,0 days 00:00:00.144727,1.169846915412592,500,lbfgs,COMPLETE
2820,0.6457036794409869,2023-10-02 12:17:27.588649,2023-10-02 12:17:27.777730,0 days 00:00:00.189081,193.0196003280577,490,sag,COMPLETE
2821,0.637951741456491,2023-10-02 12:17:27.778728,2023-10-02 12:17:27.999850,0 days 00:00:00.221122,1066.4500875388928,490,sag,COMPLETE
2822,0.6449939949776177,2023-10-02 12:17:28.000850,2023-10-02 12:17:28.218929,0 days 00:00:00.218079,2173.8695951708414,480,sag,COMPLETE
2823,0.649579648433235,2023-10-02 12:17:28.220003,2023-10-02 12:17:28.461057,0 days 00:00:00.241054,69.22832526243215,500,saga,COMPLETE
2824,0.6534556174254831,2023-10-02 12:17:28.462061,2023-10-02 12:17:28.632320,0 days 00:00:00.170259,69.98345630783506,470,sag,COMPLETE
2825,0.5,2023-10-02 12:17:28.633314,2023-10-02 12:17:28.782864,0 days 00:00:00.149550,1.922667933421266e-05,450,newton-cg,COMPLETE
2826,0.6449939949776177,2023-10-02 12:17:28.783862,2023-10-02 12:17:29.008672,0 days 00:00:00.224810,20270.72001640409,490,sag,COMPLETE
2827,0.5,2023-10-02 12:17:29.009675,2023-10-02 12:17:29.169375,0 days 00:00:00.159700,0.000997062169479769,480,sag,COMPLETE
2828,0.637951741456491,2023-10-02 12:17:29.170367,2023-10-02 12:17:29.375020,0 days 00:00:00.204653,38996.6801715261,500,liblinear,COMPLETE
2829,0.6520362484987444,2023-10-02 12:17:29.376022,2023-10-02 12:17:29.597527,0 days 00:00:00.221505,5006.423799782913,500,sag,COMPLETE
2830,0.6372420569931216,2023-10-02 12:17:29.598582,2023-10-02 12:17:29.828098,0 days 00:00:00.229516,28501.33807056098,490,saga,COMPLETE
2831,0.5211267605633803,2023-10-02 12:17:29.829094,2023-10-02 12:17:29.968305,0 days 00:00:00.139211,0.37184284330882145,420,sag,COMPLETE
2832,0.6267059722677149,2023-10-02 12:17:29.969306,2023-10-02 12:17:30.116869,0 days 00:00:00.147563,13.44007891985218,480,sag,COMPLETE
2833,0.6520362484987444,2023-10-02 12:17:30.117866,2023-10-02 12:17:30.406158,0 days 00:00:00.288292,2854.0404025110097,490,sag,COMPLETE
2834,0.6520362484987444,2023-10-02 12:17:30.407162,2023-10-02 12:17:30.629079,0 days 00:00:00.221917,17915.350779691827,500,sag,COMPLETE
2835,0.6520362484987444,2023-10-02 12:17:30.630077,2023-10-02 12:17:30.854420,0 days 00:00:00.224343,65377.111836207565,470,saga,COMPLETE
2836,0.5619609127634021,2023-10-02 12:17:30.855419,2023-10-02 12:17:30.993880,0 days 00:00:00.138461,0.9419767401721936,480,sag,COMPLETE
2837,0.5,2023-10-02 12:17:30.994866,2023-10-02 12:17:31.148362,0 days 00:00:00.153496,0.0008893343836849795,460,sag,COMPLETE
2838,0.5,2023-10-02 12:17:31.149362,2023-10-02 12:17:31.392732,0 days 00:00:00.243370,0.00036290853933146767,440,sag,COMPLETE
2839,0.666120755540998,2023-10-02 12:17:31.393732,2023-10-02 12:17:31.617731,0 days 00:00:00.223999,5534.429471108785,490,sag,COMPLETE
2840,0.5,2023-10-02 12:17:31.618742,2023-10-02 12:17:31.807266,0 days 00:00:00.188524,0.002581816152583736,410,saga,COMPLETE
2841,0.5,2023-10-02 12:17:31.808263,2023-10-02 12:17:31.954120,0 days 00:00:00.145857,0.07188952053655853,500,sag,COMPLETE
2842,0.5478764057211486,2023-10-02 12:17:31.955119,2023-10-02 12:17:32.087738,0 days 00:00:00.132619,0.7379562300736769,490,sag,COMPLETE
2843,0.666120755540998,2023-10-02 12:17:32.088738,2023-10-02 12:17:32.369748,0 days 00:00:00.281010,13454.295962820108,480,sag,COMPLETE
2844,0.6235396877388361,2023-10-02 12:17:32.370743,2023-10-02 12:17:32.806164,0 days 00:00:00.435421,8.501360051273142,500,lbfgs,COMPLETE
2845,0.619663718746588,2023-10-02 12:17:32.808167,2023-10-02 12:17:33.027590,0 days 00:00:00.219423,9.700999026823512,470,sag,COMPLETE
2846,0.6418277104487389,2023-10-02 12:17:33.028593,2023-10-02 12:17:33.201021,0 days 00:00:00.172428,229.94245129406994,140,sag,COMPLETE
2847,0.5,2023-10-02 12:17:33.202024,2023-10-02 12:17:33.550134,0 days 00:00:00.348110,9.874770521360109e-05,490,saga,COMPLETE
2848,0.6418277104487389,2023-10-02 12:17:33.551199,2023-10-02 12:17:33.760355,0 days 00:00:00.209156,429.26334052850643,500,sag,COMPLETE
2849,0.6449939949776177,2023-10-02 12:17:33.761358,2023-10-02 12:17:33.982967,0 days 00:00:00.221609,1423.3637456319132,480,sag,COMPLETE
2850,0.5,2023-10-02 12:17:33.984001,2023-10-02 12:17:34.204692,0 days 00:00:00.220691,0.3100752828745184,330,sag,COMPLETE
2851,0.5792117043345343,2023-10-02 12:17:34.205734,2023-10-02 12:17:34.362891,0 days 00:00:00.157157,1.116164212161856,490,newton-cg,COMPLETE
2852,0.6534556174254831,2023-10-02 12:17:34.363885,2023-10-02 12:17:34.555983,0 days 00:00:00.192098,103.53764649567574,340,sag,COMPLETE
2853,0.6013756960366853,2023-10-02 12:17:34.556984,2023-10-02 12:17:34.710601,0 days 00:00:00.153617,2.318873523463102,460,saga,COMPLETE
2854,0.5,2023-10-02 12:17:34.711602,2023-10-02 12:17:34.904663,0 days 00:00:00.193061,0.00016499836465352292,500,sag,COMPLETE
2855,0.5,2023-10-02 12:17:34.906661,2023-10-02 12:17:35.124305,0 days 00:00:00.217644,0.02604905735985249,480,sag,COMPLETE
2856,0.6062888961677039,2023-10-02 12:17:35.126305,2023-10-02 12:17:35.268913,0 days 00:00:00.142608,6.551414345234458,450,liblinear,COMPLETE
2857,0.5,2023-10-02 12:17:35.269914,2023-10-02 12:17:35.414446,0 days 00:00:00.144532,0.12767269999658515,490,sag,COMPLETE
2858,0.6488699639698657,2023-10-02 12:17:35.415451,2023-10-02 12:17:35.637363,0 days 00:00:00.221912,35885.3901189073,470,sag,COMPLETE
2859,0.6520362484987444,2023-10-02 12:17:35.638412,2023-10-02 12:17:35.872961,0 days 00:00:00.234549,3748.2358468089324,500,saga,COMPLETE
2860,0.6590785020198712,2023-10-02 12:17:35.874037,2023-10-02 12:17:36.197657,0 days 00:00:00.323620,7624.359772865748,490,sag,COMPLETE
2861,0.5,2023-10-02 12:17:36.198660,2023-10-02 12:17:36.375035,0 days 00:00:00.176375,0.3124551420865261,480,sag,COMPLETE
2862,0.6520362484987444,2023-10-02 12:17:36.376029,2023-10-02 12:17:36.689258,0 days 00:00:00.313229,22607.833435893113,500,sag,COMPLETE
2863,0.6520362484987444,2023-10-02 12:17:36.690259,2023-10-02 12:17:36.955592,0 days 00:00:00.265333,11525.097573762036,490,sag,COMPLETE
2864,0.6590785020198712,2023-10-02 12:17:36.956589,2023-10-02 12:17:37.181309,0 days 00:00:00.224720,61669.725760885194,470,saga,COMPLETE
2865,0.6534556174254831,2023-10-02 12:17:37.182309,2023-10-02 12:17:37.408481,0 days 00:00:00.226172,41.6123706319493,480,sag,COMPLETE
2866,0.5,2023-10-02 12:17:37.409484,2023-10-02 12:17:37.555746,0 days 00:00:00.146262,0.003913881053892658,500,sag,COMPLETE
2867,0.5,2023-10-02 12:17:37.556746,2023-10-02 12:17:38.051439,0 days 00:00:00.494693,3.6437271775277756e-05,490,sag,COMPLETE
2868,0.6133311496888305,2023-10-02 12:17:38.052439,2023-10-02 12:17:38.191034,0 days 00:00:00.138595,7.167777653137709,500,sag,COMPLETE
2869,0.6309094879353642,2023-10-02 12:17:38.192034,2023-10-02 12:17:38.422142,0 days 00:00:00.230108,865.0846744113375,460,sag,COMPLETE
2870,0.5,2023-10-02 12:17:38.423142,2023-10-02 12:17:38.641937,0 days 00:00:00.218795,0.0002447322813151761,480,lbfgs,COMPLETE
2871,0.6062888961677039,2023-10-02 12:17:38.642936,2023-10-02 12:17:38.784459,0 days 00:00:00.141523,5.801972216260023,430,saga,COMPLETE
2872,0.5,2023-10-02 12:17:38.785458,2023-10-02 12:17:38.952188,0 days 00:00:00.166730,0.0006349455831542124,490,sag,COMPLETE
2873,0.6298722567965934,2023-10-02 12:17:38.953188,2023-10-02 12:17:39.095716,0 days 00:00:00.142528,16.694881340138913,500,sag,COMPLETE
2874,0.5,2023-10-02 12:17:39.096716,2023-10-02 12:17:39.247786,0 days 00:00:00.151070,0.007962212630300123,480,sag,COMPLETE
2875,0.6520362484987444,2023-10-02 12:17:39.248780,2023-10-02 12:17:39.541318,0 days 00:00:00.292538,2433.112532701269,490,sag,COMPLETE
2876,0.6559122174909924,2023-10-02 12:17:39.542317,2023-10-02 12:17:39.771947,0 days 00:00:00.229630,5736.807922881892,500,saga,COMPLETE
2877,0.6590785020198712,2023-10-02 12:17:39.772949,2023-10-02 12:17:39.995640,0 days 00:00:00.222691,16094.892443562403,470,sag,COMPLETE
2878,0.6449939949776177,2023-10-02 12:17:39.996639,2023-10-02 12:17:40.158595,0 days 00:00:00.161956,41377.92910907478,450,newton-cg,COMPLETE
2879,0.6590785020198712,2023-10-02 12:17:40.159602,2023-10-02 12:17:40.376081,0 days 00:00:00.216479,98735.95500387692,440,sag,COMPLETE
2880,0.5,2023-10-02 12:17:40.377083,2023-10-02 12:17:40.583510,0 days 00:00:00.206427,1.675996059891846e-05,480,liblinear,COMPLETE
2881,0.5,2023-10-02 12:17:40.584505,2023-10-02 12:17:40.724479,0 days 00:00:00.139974,0.14610299694037937,490,sag,COMPLETE
2882,0.66224478654875,2023-10-02 12:17:40.725472,2023-10-02 12:17:40.953999,0 days 00:00:00.228527,27004.255036895396,500,sag,COMPLETE
2883,0.5,2023-10-02 12:17:40.955000,2023-10-02 12:17:41.308669,0 days 00:00:00.353669,1.1135012449672813e-05,470,saga,COMPLETE
2884,0.5,2023-10-02 12:17:41.309668,2023-10-02 12:17:41.451779,0 days 00:00:00.142111,0.003946321920303779,490,sag,COMPLETE
2885,0.6449939949776177,2023-10-02 12:17:41.452779,2023-10-02 12:17:41.755572,0 days 00:00:00.302793,3640.0107181143826,480,sag,COMPLETE
2886,0.6020853805000546,2023-10-02 12:17:41.756571,2023-10-02 12:17:41.897121,0 days 00:00:00.140550,1.7172722871379085,380,sag,COMPLETE
2887,0.5,2023-10-02 12:17:41.899121,2023-10-02 12:17:42.145474,0 days 00:00:00.246353,0.20396764328997088,500,sag,COMPLETE
2888,0.6520362484987444,2023-10-02 12:17:42.146474,2023-10-02 12:17:42.389429,0 days 00:00:00.242955,7589.55354756798,490,saga,COMPLETE
2889,0.6457036794409869,2023-10-02 12:17:42.390419,2023-10-02 12:17:42.586184,0 days 00:00:00.195765,261.12579446690563,490,sag,COMPLETE
2890,0.5478764057211486,2023-10-02 12:17:42.587229,2023-10-02 12:17:42.797956,0 days 00:00:00.210727,0.6887669595211827,480,sag,COMPLETE
2891,0.649579648433235,2023-10-02 12:17:42.798955,2023-10-02 12:17:42.973421,0 days 00:00:00.174466,139.4589560496319,500,sag,COMPLETE
2892,0.6013756960366853,2023-10-02 12:17:42.974419,2023-10-02 12:17:43.121972,0 days 00:00:00.147553,2.295933274576213,460,sag,COMPLETE
2893,0.6520362484987444,2023-10-02 12:17:43.122483,2023-10-02 12:17:43.351804,0 days 00:00:00.229321,1624.6762557402265,500,sag,COMPLETE
2894,0.6573315864177312,2023-10-02 12:17:43.352909,2023-10-02 12:17:43.542755,0 days 00:00:00.189846,40.470846732910864,470,saga,COMPLETE
2895,0.637951741456491,2023-10-02 12:17:43.544757,2023-10-02 12:17:43.737667,0 days 00:00:00.192910,11755.6346458179,490,lbfgs,COMPLETE
2896,0.6629544710121192,2023-10-02 12:17:43.738667,2023-10-02 12:17:44.030730,0 days 00:00:00.292063,44663.82106812903,480,sag,COMPLETE
2897,0.666120755540998,2023-10-02 12:17:44.031988,2023-10-02 12:17:44.255994,0 days 00:00:00.224006,19664.243054199054,500,sag,COMPLETE
2898,0.6590785020198712,2023-10-02 12:17:44.256994,2023-10-02 12:17:44.484981,0 days 00:00:00.227987,4701.684237447265,480,sag,COMPLETE
2899,0.6520362484987444,2023-10-02 12:17:44.485980,2023-10-02 12:17:44.709630,0 days 00:00:00.223650,64953.794597254506,490,sag,COMPLETE
2900,0.6449939949776177,2023-10-02 12:17:44.710633,2023-10-02 12:17:44.930079,0 days 00:00:00.219446,530.5080931988902,500,saga,COMPLETE
2901,0.6590785020198712,2023-10-02 12:17:44.931078,2023-10-02 12:17:45.221121,0 days 00:00:00.290043,10420.25849683511,470,sag,COMPLETE
2902,0.6520362484987444,2023-10-02 12:17:45.222123,2023-10-02 12:17:45.423024,0 days 00:00:00.200901,30631.693588808448,350,sag,COMPLETE
2903,0.6534556174254831,2023-10-02 12:17:45.424029,2023-10-02 12:17:45.590116,0 days 00:00:00.166087,94.93574622662557,490,sag,COMPLETE
2904,0.6238672344142374,2023-10-02 12:17:45.591197,2023-10-02 12:17:45.750698,0 days 00:00:00.159501,2874.3630561095742,450,newton-cg,COMPLETE
2905,0.6520362484987444,2023-10-02 12:17:45.751700,2023-10-02 12:17:45.980879,0 days 00:00:00.229179,6016.882296640754,480,sag,COMPLETE
2906,0.637951741456491,2023-10-02 12:17:45.981882,2023-10-02 12:17:46.201690,0 days 00:00:00.219808,25599.460326964392,360,liblinear,COMPLETE
2907,0.5,2023-10-02 12:17:46.202690,2023-10-02 12:17:46.355230,0 days 00:00:00.152540,0.21648917617476046,500,saga,COMPLETE
2908,0.6590785020198712,2023-10-02 12:17:46.356231,2023-10-02 12:17:46.602401,0 days 00:00:00.246170,99834.85437813566,490,sag,COMPLETE
2909,0.643956763838847,2023-10-02 12:17:46.603400,2023-10-02 12:17:46.751170,0 days 00:00:00.147770,26.69371489663057,460,sag,COMPLETE
2910,0.6520362484987444,2023-10-02 12:17:46.752167,2023-10-02 12:17:46.976225,0 days 00:00:00.224058,17112.388844150883,480,sag,COMPLETE
2911,0.6520362484987444,2023-10-02 12:17:46.977295,2023-10-02 12:17:47.321980,0 days 00:00:00.344685,9728.091804055275,500,sag,COMPLETE
2912,0.6534556174254831,2023-10-02 12:17:47.323039,2023-10-02 12:17:47.585781,0 days 00:00:00.262742,55.29944747644885,440,sag,COMPLETE
2913,0.5,2023-10-02 12:17:47.586775,2023-10-02 12:17:47.739531,0 days 00:00:00.152756,0.012025773600272249,490,saga,COMPLETE
2914,0.6267059722677149,2023-10-02 12:17:47.740532,2023-10-02 12:17:47.894176,0 days 00:00:00.153644,11.742449314552355,470,sag,COMPLETE
2915,0.6449939949776177,2023-10-02 12:17:47.895186,2023-10-02 12:17:48.128714,0 days 00:00:00.233528,2158.588077507266,500,sag,COMPLETE
2916,0.5996287804345454,2023-10-02 12:17:48.129714,2023-10-02 12:17:48.360452,0 days 00:00:00.230738,1.4637879747117555,490,sag,COMPLETE
2917,0.666120755540998,2023-10-02 12:17:48.361450,2023-10-02 12:17:48.597596,0 days 00:00:00.236146,61534.85625472592,480,sag,COMPLETE
2918,0.6520362484987444,2023-10-02 12:17:48.598592,2023-10-02 12:17:48.832616,0 days 00:00:00.234024,4340.930514401871,500,saga,COMPLETE
2919,0.6481602795064964,2023-10-02 12:17:48.834624,2023-10-02 12:17:49.057323,0 days 00:00:00.222699,37857.69821404878,490,sag,COMPLETE
2920,0.5,2023-10-02 12:17:49.059371,2023-10-02 12:17:49.210100,0 days 00:00:00.150729,0.06967985239765936,470,sag,COMPLETE
