number,value,datetime_start,datetime_complete,duration,params_C,params_max_iter,params_solver,state
8786,0.637951741456491,2023-10-02 12:57:20.843765,2023-10-02 12:57:21.300184,0 days 00:00:00.456419,7870.018064755634,370,newton-cg,COMPLETE
8787,0.5,2023-10-02 12:57:21.303184,2023-10-02 12:57:21.835087,0 days 00:00:00.531903,0.09616698904417277,380,sag,COMPLETE
8788,0.5925865269134185,2023-10-02 12:57:21.838084,2023-10-02 12:57:22.360101,0 days 00:00:00.522017,1.371589992596993,370,sag,COMPLETE
8789,0.5,2023-10-02 12:57:22.363101,2023-10-02 12:57:22.898239,0 days 00:00:00.535138,0.006577706316542123,430,sag,COMPLETE
8790,0.6449939949776177,2023-10-02 12:57:22.901239,2023-10-02 12:57:23.405184,0 days 00:00:00.503945,24144.60310995191,410,sag,COMPLETE
8791,0.6277432034064855,2023-10-02 12:57:23.407174,2023-10-02 12:57:23.927937,0 days 00:00:00.520763,1338.347789721473,380,liblinear,COMPLETE
8792,0.5,2023-10-02 12:57:23.930937,2023-10-02 12:57:24.450660,0 days 00:00:00.519723,0.054541014660500244,390,sag,COMPLETE
8793,0.6590785020198712,2023-10-02 12:57:24.453660,2023-10-02 12:57:25.062547,0 days 00:00:00.608887,44648.55697076639,370,sag,COMPLETE
8794,0.6559122174909924,2023-10-02 12:57:25.065543,2023-10-02 12:57:25.579408,0 days 00:00:00.513865,4540.431578339529,400,sag,COMPLETE
8795,0.6590785020198712,2023-10-02 12:57:25.581408,2023-10-02 12:57:26.181266,0 days 00:00:00.599858,16109.093251916767,420,sag,COMPLETE
8796,0.6590785020198712,2023-10-02 12:57:26.183361,2023-10-02 12:57:26.779896,0 days 00:00:00.596535,61723.73025934099,380,sag,COMPLETE
8797,0.6520362484987444,2023-10-02 12:57:26.781896,2023-10-02 12:57:27.384026,0 days 00:00:00.602130,9359.996080636725,370,sag,COMPLETE
8798,0.5313352986133857,2023-10-02 12:57:27.387032,2023-10-02 12:57:27.908462,0 days 00:00:00.521430,0.4841552942256712,430,sag,COMPLETE
8799,0.5,2023-10-02 12:57:27.910456,2023-10-02 12:57:28.578237,0 days 00:00:00.667781,4.473072544490622e-05,370,sag,COMPLETE
8800,0.6457036794409869,2023-10-02 12:57:28.580297,2023-10-02 12:57:29.146168,0 days 00:00:00.565871,267.8545948678866,410,lbfgs,COMPLETE
8801,0.6020853805000546,2023-10-02 12:57:29.148165,2023-10-02 12:57:29.678652,0 days 00:00:00.530487,1.8332217799671002,390,sag,COMPLETE
8802,0.5,2023-10-02 12:57:29.681651,2023-10-02 12:57:30.219536,0 days 00:00:00.537885,0.000719347127697916,400,sag,COMPLETE
8803,0.6590785020198712,2023-10-02 12:57:30.221539,2023-10-02 12:57:30.717803,0 days 00:00:00.496264,28539.010008024357,380,sag,COMPLETE
8804,0.6520362484987444,2023-10-02 12:57:30.720868,2023-10-02 12:57:31.319938,0 days 00:00:00.599070,2085.0996929131006,430,sag,COMPLETE
8805,0.6520362484987444,2023-10-02 12:57:31.321938,2023-10-02 12:57:31.911565,0 days 00:00:00.589627,99545.3209724911,370,sag,COMPLETE
8806,0.6520362484987444,2023-10-02 12:57:31.913565,2023-10-02 12:57:32.496719,0 days 00:00:00.583154,45468.66356209288,390,sag,COMPLETE
8807,0.5,2023-10-02 12:57:32.498815,2023-10-02 12:57:32.955418,0 days 00:00:00.456603,0.0004696523047761144,420,sag,COMPLETE
8808,0.5,2023-10-02 12:57:32.958423,2023-10-02 12:57:33.508406,0 days 00:00:00.549983,0.000609656671074425,420,sag,COMPLETE
8809,0.666120755540998,2023-10-02 12:57:33.511405,2023-10-02 12:57:34.092327,0 days 00:00:00.580922,6351.065093845018,370,sag,COMPLETE
8810,0.6062888961677039,2023-10-02 12:57:34.095322,2023-10-02 12:57:34.630175,0 days 00:00:00.534853,6.275671419219285,380,sag,COMPLETE
8811,0.6013756960366853,2023-10-02 12:57:34.633175,2023-10-02 12:57:35.163724,0 days 00:00:00.530549,2.5364598353925807,440,sag,COMPLETE
8812,0.6267059722677149,2023-10-02 12:57:35.166770,2023-10-02 12:57:35.614058,0 days 00:00:00.447288,11.63913840739768,380,newton-cg,COMPLETE
8813,0.649579648433235,2023-10-02 12:57:35.616052,2023-10-02 12:57:36.185341,0 days 00:00:00.569289,154.8160815398799,430,sag,COMPLETE
8814,0.6520362484987444,2023-10-02 12:57:36.188341,2023-10-02 12:57:36.800163,0 days 00:00:00.611822,20907.537063901895,410,sag,COMPLETE
8815,0.637951741456491,2023-10-02 12:57:36.803163,2023-10-02 12:57:37.328873,0 days 00:00:00.525710,31595.754868585358,400,liblinear,COMPLETE
8816,0.528169014084507,2023-10-02 12:57:37.331872,2023-10-02 12:57:37.766495,0 days 00:00:00.434623,0.4213112217768908,370,sag,COMPLETE
8817,0.5478764057211486,2023-10-02 12:57:37.768496,2023-10-02 12:57:38.320434,0 days 00:00:00.551938,0.7623641615857822,390,sag,COMPLETE
8818,0.6418277104487389,2023-10-02 12:57:38.322434,2023-10-02 12:57:38.919077,0 days 00:00:00.596643,442.48305883456203,370,sag,COMPLETE
8819,0.5,2023-10-02 12:57:38.922077,2023-10-02 12:57:39.453218,0 days 00:00:00.531141,0.11727200242895937,380,sag,COMPLETE
8820,0.5,2023-10-02 12:57:39.456216,2023-10-02 12:57:39.891483,0 days 00:00:00.435267,0.012586207450180943,440,sag,COMPLETE
8821,0.666120755540998,2023-10-02 12:57:39.894492,2023-10-02 12:57:40.487438,0 days 00:00:00.592946,13510.661568732861,370,sag,COMPLETE
8822,0.6520362484987444,2023-10-02 12:57:40.490563,2023-10-02 12:57:41.093005,0 days 00:00:00.602442,66833.98652258173,430,sag,COMPLETE
8823,0.6520362484987444,2023-10-02 12:57:41.096150,2023-10-02 12:57:41.688536,0 days 00:00:00.592386,3276.998212521059,360,sag,COMPLETE
8824,0.5,2023-10-02 12:57:41.691536,2023-10-02 12:57:42.220333,0 days 00:00:00.528797,0.24509006556451737,410,sag,COMPLETE
8825,0.5,2023-10-02 12:57:42.223334,2023-10-02 12:57:43.889556,0 days 00:00:01.666222,1.0224963441601621e-05,390,sag,COMPLETE
8826,0.6520362484987444,2023-10-02 12:57:43.892576,2023-10-02 12:57:44.485069,0 days 00:00:00.592493,38511.41222327606,370,sag,COMPLETE
8827,0.637951741456491,2023-10-02 12:57:44.487125,2023-10-02 12:57:45.069246,0 days 00:00:00.582121,9777.70362198887,360,lbfgs,COMPLETE
8828,0.6590785020198712,2023-10-02 12:57:45.072247,2023-10-02 12:57:45.675096,0 days 00:00:00.602849,5083.758427380567,440,sag,COMPLETE
8829,0.6449939949776177,2023-10-02 12:57:45.678089,2023-10-02 12:57:46.178348,0 days 00:00:00.500259,17614.061089692634,380,sag,COMPLETE
8830,0.5,2023-10-02 12:57:46.181403,2023-10-02 12:57:46.742282,0 days 00:00:00.560879,0.00023072680457326264,360,sag,COMPLETE
8831,0.6298722567965934,2023-10-02 12:57:46.744282,2023-10-02 12:57:47.290505,0 days 00:00:00.546223,17.473888664981477,380,sag,COMPLETE
8832,0.6590785020198712,2023-10-02 12:57:47.292505,2023-10-02 12:57:47.889961,0 days 00:00:00.597456,66082.74671133747,370,sag,COMPLETE
8833,0.6636641554754886,2023-10-02 12:57:47.891962,2023-10-02 12:57:48.408253,0 days 00:00:00.516291,24239.506727713066,440,sag,COMPLETE
8834,0.6449939949776177,2023-10-02 12:57:48.410253,2023-10-02 12:57:49.005915,0 days 00:00:00.595662,1378.1469417906017,430,sag,COMPLETE
8835,0.6520362484987444,2023-10-02 12:57:49.008090,2023-10-02 12:57:49.623519,0 days 00:00:00.615429,2728.9390275295123,390,sag,COMPLETE
8836,0.6059613494923026,2023-10-02 12:57:49.626513,2023-10-02 12:57:50.161805,0 days 00:00:00.535292,1.6477712328393777,360,sag,COMPLETE
8837,0.6449939949776177,2023-10-02 12:57:50.164805,2023-10-02 12:57:50.721647,0 days 00:00:00.556842,48414.032705402395,400,newton-cg,COMPLETE
8838,0.6534556174254831,2023-10-02 12:57:50.723646,2023-10-02 12:57:51.178754,0 days 00:00:00.455108,50.564076593056875,410,sag,COMPLETE
8839,0.6520362484987444,2023-10-02 12:57:51.180754,2023-10-02 12:57:51.786616,0 days 00:00:00.605862,7525.585185260988,420,sag,COMPLETE
8840,0.637951741456491,2023-10-02 12:57:51.789616,2023-10-02 12:57:52.311888,0 days 00:00:00.522272,12541.630322589926,440,liblinear,COMPLETE
8841,0.6590785020198712,2023-10-02 12:57:52.313934,2023-10-02 12:57:52.917887,0 days 00:00:00.603953,33994.729788882534,370,sag,COMPLETE
8842,0.5,2023-10-02 12:57:52.919885,2023-10-02 12:57:53.391286,0 days 00:00:00.471401,0.002587083473357797,400,sag,COMPLETE
8843,0.6590785020198712,2023-10-02 12:57:53.393287,2023-10-02 12:57:53.996140,0 days 00:00:00.602853,66946.16044567633,380,sag,COMPLETE
8844,0.5,2023-10-02 12:57:53.998253,2023-10-02 12:57:54.531092,0 days 00:00:00.532839,0.004071246011085626,360,sag,COMPLETE
8845,0.6309094879353642,2023-10-02 12:57:54.533092,2023-10-02 12:57:55.156407,0 days 00:00:00.623315,930.0741730168152,370,sag,COMPLETE
8846,0.6590785020198712,2023-10-02 12:57:55.158466,2023-10-02 12:57:55.753514,0 days 00:00:00.595048,20231.81854757534,360,sag,COMPLETE
8847,0.637951741456491,2023-10-02 12:57:55.756515,2023-10-02 12:57:56.278955,0 days 00:00:00.522440,4840.012957228601,440,sag,COMPLETE
8848,0.643956763838847,2023-10-02 12:57:56.281950,2023-10-02 12:57:56.825828,0 days 00:00:00.543878,25.03810297876058,430,sag,COMPLETE
8849,0.6520362484987444,2023-10-02 12:57:56.827828,2023-10-02 12:57:57.424064,0 days 00:00:00.596236,40130.03128795098,390,sag,COMPLETE
8850,0.6203734032099574,2023-10-02 12:57:57.427068,2023-10-02 12:57:57.963106,0 days 00:00:00.536038,8.020699546889164,370,sag,COMPLETE
8851,0.6534556174254831,2023-10-02 12:57:57.966105,2023-10-02 12:57:58.696652,0 days 00:00:00.730547,114.88462507153687,360,sag,COMPLETE
8852,0.5,2023-10-02 12:57:58.696652,2023-10-02 12:57:59.213035,0 days 00:00:00.516383,2.893671654473511e-05,380,lbfgs,COMPLETE
8853,0.5,2023-10-02 12:57:59.225078,2023-10-02 12:57:59.826140,0 days 00:00:00.601062,0.00013367315589002455,420,sag,COMPLETE
8854,0.6590785020198712,2023-10-02 12:57:59.841658,2023-10-02 12:58:00.486088,0 days 00:00:00.644430,9253.0414513598,440,sag,COMPLETE
8855,0.5,2023-10-02 12:58:00.486088,2023-10-02 12:58:01.039479,0 days 00:00:00.553391,0.3128979419064908,390,sag,COMPLETE
8856,0.6481602795064964,2023-10-02 12:58:01.039479,2023-10-02 12:58:01.655343,0 days 00:00:00.615864,63912.65937908871,370,sag,COMPLETE
8857,0.6520362484987444,2023-10-02 12:58:01.655343,2023-10-02 12:58:02.161390,0 days 00:00:00.506047,17854.825270940757,430,sag,COMPLETE
8858,0.6590785020198712,2023-10-02 12:58:02.161390,2023-10-02 12:58:02.746052,0 days 00:00:00.584662,3395.605419674356,380,sag,COMPLETE
8859,0.5,2023-10-02 12:58:02.761734,2023-10-02 12:58:03.299024,0 days 00:00:00.537290,0.01996648220724648,400,sag,COMPLETE
8860,0.6520362484987444,2023-10-02 12:58:03.299024,2023-10-02 12:58:03.893685,0 days 00:00:00.594661,25062.727866833855,360,sag,COMPLETE
8861,0.6534556174254831,2023-10-02 12:58:03.895684,2023-10-02 12:58:04.343581,0 days 00:00:00.447897,82.74500761080107,410,sag,COMPLETE
8862,0.6534556174254831,2023-10-02 12:58:04.343581,2023-10-02 12:58:04.877030,0 days 00:00:00.533449,64.35733422785034,440,newton-cg,COMPLETE
8863,0.5,2023-10-02 12:58:04.892533,2023-10-02 12:58:05.430405,0 days 00:00:00.537872,0.016403677589423758,420,sag,COMPLETE
8864,0.5,2023-10-02 12:58:05.430405,2023-10-02 12:58:05.967046,0 days 00:00:00.536641,0.05223862786677976,370,liblinear,COMPLETE
8865,0.6069985806310733,2023-10-02 12:58:05.971886,2023-10-02 12:58:06.490014,0 days 00:00:00.518128,4.634752853845432,360,sag,COMPLETE
8866,0.666120755540998,2023-10-02 12:58:06.490014,2023-10-02 12:58:06.995480,0 days 00:00:00.505466,5857.425165445531,430,sag,COMPLETE
8867,0.6590785020198712,2023-10-02 12:58:07.011110,2023-10-02 12:58:07.599689,0 days 00:00:00.588579,67821.79170779073,360,sag,COMPLETE
8868,0.6418277104487389,2023-10-02 12:58:07.602688,2023-10-02 12:58:08.185803,0 days 00:00:00.583115,498.7395595467115,390,sag,COMPLETE
8869,0.6590785020198712,2023-10-02 12:58:08.201428,2023-10-02 12:58:08.829306,0 days 00:00:00.627878,2271.4133634774207,380,sag,COMPLETE
8870,0.6590785020198712,2023-10-02 12:58:08.829306,2023-10-02 12:58:09.412130,0 days 00:00:00.582824,12859.0421979385,360,sag,COMPLETE
8871,0.5,2023-10-02 12:58:09.412130,2023-10-02 12:58:09.855367,0 days 00:00:00.443237,0.0017009809568382364,370,sag,COMPLETE
8872,0.6520362484987444,2023-10-02 12:58:09.855367,2023-10-02 12:58:10.455521,0 days 00:00:00.600154,36964.14874949875,350,sag,COMPLETE
8873,0.6481602795064964,2023-10-02 12:58:10.471200,2023-10-02 12:58:11.087071,0 days 00:00:00.615871,25304.00182126634,380,sag,COMPLETE
8874,0.5,2023-10-02 12:58:11.087071,2023-10-02 12:58:11.632123,0 days 00:00:00.545052,0.0013194935825179505,440,sag,COMPLETE
8875,0.5,2023-10-02 12:58:11.635123,2023-10-02 12:58:12.154164,0 days 00:00:00.519041,0.03741244572954372,370,sag,COMPLETE
8876,0.5274593296211376,2023-10-02 12:58:12.154164,2023-10-02 12:58:12.596320,0 days 00:00:00.442156,0.54790691898478,400,lbfgs,COMPLETE
8877,0.5619609127634021,2023-10-02 12:58:12.596320,2023-10-02 12:58:13.126737,0 days 00:00:00.530417,0.9934352121298462,410,sag,COMPLETE
8878,0.6520362484987444,2023-10-02 12:58:13.126737,2023-10-02 12:58:13.741290,0 days 00:00:00.614553,46046.73675458646,350,sag,COMPLETE
8879,0.5,2023-10-02 12:58:13.741290,2023-10-02 12:58:15.008166,0 days 00:00:01.266876,1.629568964821095e-05,360,sag,COMPLETE
8880,0.5,2023-10-02 12:58:15.008166,2023-10-02 12:58:15.552781,0 days 00:00:00.544615,0.0005921527911280188,440,sag,COMPLETE
8881,0.6520362484987444,2023-10-02 12:58:15.557031,2023-10-02 12:58:16.054337,0 days 00:00:00.497306,98495.61217655787,420,sag,COMPLETE
8882,0.5,2023-10-02 12:58:16.054337,2023-10-02 12:58:17.847034,0 days 00:00:01.792697,1.0197312819278721e-05,350,sag,COMPLETE
8883,0.6559122174909924,2023-10-02 12:58:17.847034,2023-10-02 12:58:18.443917,0 days 00:00:00.596883,7211.37332863886,430,sag,COMPLETE
8884,0.6449939949776177,2023-10-02 12:58:18.443917,2023-10-02 12:58:19.046949,0 days 00:00:00.603032,15069.98796827057,390,sag,COMPLETE
8885,0.6520362484987444,2023-10-02 12:58:19.046949,2023-10-02 12:58:19.542145,0 days 00:00:00.495196,49125.769115476905,380,sag,COMPLETE
8886,0.6457036794409869,2023-10-02 12:58:19.542145,2023-10-02 12:58:20.121363,0 days 00:00:00.579218,228.2195047833828,450,sag,COMPLETE
8887,0.6520362484987444,2023-10-02 12:58:20.121363,2023-10-02 12:58:20.703393,0 days 00:00:00.582030,1927.9768377685014,360,sag,COMPLETE
8888,0.6309094879353642,2023-10-02 12:58:20.703393,2023-10-02 12:58:21.262563,0 days 00:00:00.559170,4002.894104612455,370,newton-cg,COMPLETE
8889,0.5,2023-10-02 12:58:21.262563,2023-10-02 12:58:21.785474,0 days 00:00:00.522911,0.008721656109488152,440,liblinear,COMPLETE
8890,0.6520362484987444,2023-10-02 12:58:21.785474,2023-10-02 12:58:22.288374,0 days 00:00:00.502900,9987.853185215386,360,sag,COMPLETE
8891,0.6590785020198712,2023-10-02 12:58:22.288374,2023-10-02 12:58:22.884608,0 days 00:00:00.596234,28855.68420289356,350,sag,COMPLETE
8892,0.6520362484987444,2023-10-02 12:58:22.884608,2023-10-02 12:58:23.479748,0 days 00:00:00.595140,17766.78966924211,410,sag,COMPLETE
8893,0.6552025330276231,2023-10-02 12:58:23.479748,2023-10-02 12:58:24.074714,0 days 00:00:00.594966,65517.525897076695,240,sag,COMPLETE
8894,0.666120755540998,2023-10-02 12:58:24.074714,2023-10-02 12:58:24.672748,0 days 00:00:00.598034,99939.39538354,450,sag,COMPLETE
8895,0.6590785020198712,2023-10-02 12:58:24.672748,2023-10-02 12:58:25.157503,0 days 00:00:00.484755,35741.213561537355,370,sag,COMPLETE
8896,0.6418277104487389,2023-10-02 12:58:25.169019,2023-10-02 12:58:25.738800,0 days 00:00:00.569781,277.75025944502534,380,sag,COMPLETE
8897,0.5,2023-10-02 12:58:25.754405,2023-10-02 12:58:27.575724,0 days 00:00:01.821319,1.0038303078774438e-05,390,sag,COMPLETE
8898,0.6481602795064964,2023-10-02 12:58:27.575724,2023-10-02 12:58:28.124596,0 days 00:00:00.548872,1128.8512086994465,170,sag,COMPLETE
8899,0.637951741456491,2023-10-02 12:58:28.124596,2023-10-02 12:58:28.698019,0 days 00:00:00.573423,6448.852964188825,430,lbfgs,COMPLETE
8900,0.6267059722677149,2023-10-02 12:58:28.698019,2023-10-02 12:58:29.126837,0 days 00:00:00.428818,10.128880277288095,420,sag,COMPLETE
8901,0.5,2023-10-02 12:58:29.126837,2023-10-02 12:58:29.646146,0 days 00:00:00.519309,0.16347030702157778,450,sag,COMPLETE
8902,0.6481602795064964,2023-10-02 12:58:29.646146,2023-10-02 12:58:30.225698,0 days 00:00:00.579552,11426.39488314592,350,sag,COMPLETE
8903,0.5,2023-10-02 12:58:30.225698,2023-10-02 12:58:30.882905,0 days 00:00:00.657207,9.137776663991822e-05,360,sag,COMPLETE
8904,0.6552025330276231,2023-10-02 12:58:30.882905,2023-10-02 12:58:31.464865,0 days 00:00:00.581960,24919.419846111494,400,sag,COMPLETE
8905,0.5,2023-10-02 12:58:31.480540,2023-10-02 12:58:31.921730,0 days 00:00:00.441190,0.0015799187540400407,440,sag,COMPLETE
8906,0.6597881864832406,2023-10-02 12:58:31.921730,2023-10-02 12:58:32.530207,0 days 00:00:00.608477,51535.71716268039,370,sag,COMPLETE
8907,0.6590785020198712,2023-10-02 12:58:32.530207,2023-10-02 12:58:33.111325,0 days 00:00:00.581118,3879.0227966212856,370,sag,COMPLETE
8908,0.6418277104487389,2023-10-02 12:58:33.111325,2023-10-02 12:58:33.690681,0 days 00:00:00.579356,457.4886921945312,350,sag,COMPLETE
8909,0.6298722567965934,2023-10-02 12:58:33.690681,2023-10-02 12:58:34.150694,0 days 00:00:00.460013,18.579581135953447,340,sag,COMPLETE
8910,0.5823779888634131,2023-10-02 12:58:34.150694,2023-10-02 12:58:34.694616,0 days 00:00:00.543922,1.182115709642416,380,sag,COMPLETE
8911,0.5,2023-10-02 12:58:34.694616,2023-10-02 12:58:35.243848,0 days 00:00:00.549232,0.006225997057755477,450,newton-cg,COMPLETE
8912,0.6590785020198712,2023-10-02 12:58:35.259474,2023-10-02 12:58:35.823570,0 days 00:00:00.564096,16111.713441573218,190,sag,COMPLETE
8913,0.637951741456491,2023-10-02 12:58:35.823570,2023-10-02 12:58:36.405635,0 days 00:00:00.582065,64569.96212887093,390,sag,COMPLETE
8914,0.6062888961677039,2023-10-02 12:58:36.405635,2023-10-02 12:58:36.848880,0 days 00:00:00.443245,5.736249787175872,360,liblinear,COMPLETE
8915,0.6590785020198712,2023-10-02 12:58:36.848880,2023-10-02 12:58:37.471643,0 days 00:00:00.622763,34237.02088604375,440,sag,COMPLETE
8916,0.6590785020198712,2023-10-02 12:58:37.471643,2023-10-02 12:58:38.065166,0 days 00:00:00.593523,8405.88121877872,350,sag,COMPLETE
8917,0.6590785020198712,2023-10-02 12:58:38.080797,2023-10-02 12:58:38.709533,0 days 00:00:00.628736,99949.19893880257,450,sag,COMPLETE
8918,0.5,2023-10-02 12:58:38.725177,2023-10-02 12:58:39.264547,0 days 00:00:00.539370,0.2784496037031008,380,sag,COMPLETE
8919,0.6449939949776177,2023-10-02 12:58:39.264547,2023-10-02 12:58:39.761976,0 days 00:00:00.497429,2232.29197022729,420,sag,COMPLETE
8920,0.6559122174909924,2023-10-02 12:58:39.761976,2023-10-02 12:58:40.358518,0 days 00:00:00.596542,24337.191781062094,360,sag,COMPLETE
8921,0.5,2023-10-02 12:58:40.358518,2023-10-02 12:58:40.891074,0 days 00:00:00.532556,0.002989175467773046,410,sag,COMPLETE
8922,0.6520362484987444,2023-10-02 12:58:40.891074,2023-10-02 12:58:41.487774,0 days 00:00:00.596700,46210.88492737639,370,sag,COMPLETE
8923,0.637951741456491,2023-10-02 12:58:41.487774,2023-10-02 12:58:42.083453,0 days 00:00:00.595679,691.3836780302031,400,sag,COMPLETE
8924,0.6590785020198712,2023-10-02 12:58:42.083453,2023-10-02 12:58:42.601777,0 days 00:00:00.518324,4277.60574423806,430,sag,COMPLETE
8925,0.5,2023-10-02 12:58:42.604316,2023-10-02 12:58:43.119612,0 days 00:00:00.515296,0.07001065965230707,220,lbfgs,COMPLETE
8926,0.6520362484987444,2023-10-02 12:58:43.119612,2023-10-02 12:58:43.746991,0 days 00:00:00.627379,12799.029040192634,450,sag,COMPLETE
8927,0.6520362484987444,2023-10-02 12:58:43.746991,2023-10-02 12:58:44.358213,0 days 00:00:00.611222,6608.0452861595995,360,sag,COMPLETE
8928,0.6559122174909924,2023-10-02 12:58:44.358213,2023-10-02 12:58:44.875978,0 days 00:00:00.517765,32040.594956885845,370,sag,COMPLETE
8929,0.6457036794409869,2023-10-02 12:58:44.875978,2023-10-02 12:58:45.471157,0 days 00:00:00.595179,203.00035144929413,340,sag,COMPLETE
8930,0.608417949557812,2023-10-02 12:58:45.471157,2023-10-02 12:58:45.989266,0 days 00:00:00.518109,2.80127902407879,440,sag,COMPLETE
8931,0.5721694508134076,2023-10-02 12:58:45.989266,2023-10-02 12:58:46.546157,0 days 00:00:00.556891,1.090943443553308,350,sag,COMPLETE
8932,0.6488699639698657,2023-10-02 12:58:46.546157,2023-10-02 12:58:47.165785,0 days 00:00:00.619628,67918.2784681116,390,sag,COMPLETE
8933,0.669996724533246,2023-10-02 12:58:47.181419,2023-10-02 12:58:47.668529,0 days 00:00:00.487110,19788.74342275577,380,sag,COMPLETE
8934,0.6534556174254831,2023-10-02 12:58:47.684185,2023-10-02 12:58:48.232785,0 days 00:00:00.548600,52.11551222514672,450,sag,COMPLETE
8935,0.6238672344142374,2023-10-02 12:58:48.232785,2023-10-02 12:58:48.789803,0 days 00:00:00.557018,3043.6880258521846,370,newton-cg,COMPLETE
8936,0.6449939949776177,2023-10-02 12:58:48.789803,2023-10-02 12:58:49.393622,0 days 00:00:00.603819,1538.0872544108045,340,sag,COMPLETE
8937,0.6629544710121192,2023-10-02 12:58:49.393622,2023-10-02 12:58:49.990858,0 days 00:00:00.597236,45889.520999553344,390,sag,COMPLETE
8938,0.5,2023-10-02 12:58:49.990858,2023-10-02 12:58:50.445970,0 days 00:00:00.455112,0.0009800869278552816,350,sag,COMPLETE
8939,0.6590785020198712,2023-10-02 12:58:50.445970,2023-10-02 12:58:51.041471,0 days 00:00:00.595501,9848.551341881544,430,sag,COMPLETE
8940,0.637951741456491,2023-10-02 12:58:51.041471,2023-10-02 12:58:51.588514,0 days 00:00:00.547043,18287.32773280558,360,liblinear,COMPLETE
8941,0.5,2023-10-02 12:58:51.588514,2023-10-02 12:58:52.201022,0 days 00:00:00.612508,0.00028166534566474076,340,sag,COMPLETE
8942,0.6590785020198712,2023-10-02 12:58:52.201022,2023-10-02 12:58:52.954287,0 days 00:00:00.753265,32567.57697982025,380,sag,COMPLETE
8943,0.6520362484987444,2023-10-02 12:58:52.954287,2023-10-02 12:58:53.706074,0 days 00:00:00.751787,98759.28009064969,440,sag,COMPLETE
8944,0.6590785020198712,2023-10-02 12:58:53.721704,2023-10-02 12:58:54.304003,0 days 00:00:00.582299,13686.01261738368,350,sag,COMPLETE
8945,0.6267059722677149,2023-10-02 12:58:54.304003,2023-10-02 12:58:54.840161,0 days 00:00:00.536158,12.852417836464777,420,sag,COMPLETE
8946,0.5274593296211376,2023-10-02 12:58:54.840161,2023-10-02 12:58:55.369298,0 days 00:00:00.529137,0.5450369778744505,400,sag,COMPLETE
8947,0.5,2023-10-02 12:58:55.384920,2023-10-02 12:58:55.856702,0 days 00:00:00.471782,0.013001176411427411,450,sag,COMPLETE
8948,0.6590785020198712,2023-10-02 12:58:55.872329,2023-10-02 12:58:56.451884,0 days 00:00:00.579555,67213.41473932398,370,sag,COMPLETE
