number,value,datetime_start,datetime_complete,duration,params_C,params_max_iter,params_solver,state
1128,0.6449939949776177,2023-10-02 12:12:18.730121,2023-10-02 12:12:18.889319,0 days 00:00:00.159198,2895.2220947254114,500,sag,COMPLETE
1129,0.6520362484987444,2023-10-02 12:12:18.889319,2023-10-02 12:12:19.042181,0 days 00:00:00.152862,6154.501606063645,490,sag,COMPLETE
1130,0.666120755540998,2023-10-02 12:12:19.042181,2023-10-02 12:12:19.193876,0 days 00:00:00.151695,3782.86539434151,490,sag,COMPLETE
1131,0.6590785020198712,2023-10-02 12:12:19.194876,2023-10-02 12:12:19.347073,0 days 00:00:00.152197,2456.1285850698996,500,sag,COMPLETE
1132,0.6520362484987444,2023-10-02 12:12:19.348076,2023-10-02 12:12:19.507486,0 days 00:00:00.159410,3531.183564550982,490,sag,COMPLETE
1133,0.6449939949776177,2023-10-02 12:12:19.508488,2023-10-02 12:12:19.743064,0 days 00:00:00.234576,2158.8949924639187,500,sag,COMPLETE
1134,0.6520362484987444,2023-10-02 12:12:19.743064,2023-10-02 12:12:20.001777,0 days 00:00:00.258713,4559.469213432611,490,sag,COMPLETE
1135,0.6449939949776177,2023-10-02 12:12:20.002775,2023-10-02 12:12:20.322726,0 days 00:00:00.319951,1360.4975181686561,490,sag,COMPLETE
1136,0.6590785020198712,2023-10-02 12:12:20.323727,2023-10-02 12:12:20.696341,0 days 00:00:00.372614,7730.42789504763,500,sag,COMPLETE
1137,0.6520362484987444,2023-10-02 12:12:20.697362,2023-10-02 12:12:20.969683,0 days 00:00:00.272321,5784.637393487605,500,sag,COMPLETE
1138,0.6449939949776177,2023-10-02 12:12:20.970829,2023-10-02 12:12:21.170212,0 days 00:00:00.199383,818.5122259200854,490,sag,COMPLETE
1139,0.5,2023-10-02 12:12:21.171212,2023-10-02 12:12:21.239442,0 days 00:00:00.068230,0.09132694704458165,490,sag,COMPLETE
1140,0.6449939949776177,2023-10-02 12:12:21.239442,2023-10-02 12:12:21.433780,0 days 00:00:00.194338,3286.958522056521,500,sag,COMPLETE
1141,0.5,2023-10-02 12:12:21.433780,2023-10-02 12:12:21.513537,0 days 00:00:00.079757,0.00227227228574854,490,sag,COMPLETE
1142,0.6590785020198712,2023-10-02 12:12:21.514535,2023-10-02 12:12:21.683958,0 days 00:00:00.169423,8885.616661358588,500,sag,COMPLETE
1143,0.6449939949776177,2023-10-02 12:12:21.683958,2023-10-02 12:12:21.834495,0 days 00:00:00.150537,4345.9298899591795,490,sag,COMPLETE
1144,0.6590785020198712,2023-10-02 12:12:21.834495,2023-10-02 12:12:22.000459,0 days 00:00:00.165964,2178.3012066413194,500,sag,COMPLETE
1145,0.6520362484987444,2023-10-02 12:12:22.001522,2023-10-02 12:12:22.155678,0 days 00:00:00.154156,8406.791686781908,490,sag,COMPLETE
1146,0.5,2023-10-02 12:12:22.155678,2023-10-02 12:12:22.234818,0 days 00:00:00.079140,0.0014386342612916754,490,sag,COMPLETE
1147,0.637951741456491,2023-10-02 12:12:22.234818,2023-10-02 12:12:22.396876,0 days 00:00:00.162058,1195.5410473797333,500,sag,COMPLETE
1148,0.6590785020198712,2023-10-02 12:12:22.396876,2023-10-02 12:12:22.552928,0 days 00:00:00.156052,5340.950049417709,490,sag,COMPLETE
1149,0.6520362484987444,2023-10-02 12:12:22.553930,2023-10-02 12:12:22.709577,0 days 00:00:00.155647,8820.572870330132,500,sag,COMPLETE
1150,0.6449939949776177,2023-10-02 12:12:22.710577,2023-10-02 12:12:22.867236,0 days 00:00:00.156659,3651.3305351269505,490,sag,COMPLETE
1151,0.5,2023-10-02 12:12:22.867236,2023-10-02 12:12:22.934325,0 days 00:00:00.067089,0.014045475398652234,490,sag,COMPLETE
1152,0.6020853805000546,2023-10-02 12:12:22.934325,2023-10-02 12:12:23.001096,0 days 00:00:00.066771,1.7873084782587776,500,sag,COMPLETE
1153,0.6590785020198712,2023-10-02 12:12:23.001096,2023-10-02 12:12:23.155478,0 days 00:00:00.154382,8811.027732163822,490,sag,COMPLETE
1154,0.6590785020198712,2023-10-02 12:12:23.156478,2023-10-02 12:12:23.311073,0 days 00:00:00.154595,2591.3353462300497,500,sag,COMPLETE
1155,0.6590785020198712,2023-10-02 12:12:23.311073,2023-10-02 12:12:23.463177,0 days 00:00:00.152104,5059.01380905617,500,sag,COMPLETE
1156,0.5855442733922918,2023-10-02 12:12:23.464183,2023-10-02 12:12:23.533371,0 days 00:00:00.069188,1.2611533960583,490,sag,COMPLETE
1157,0.528169014084507,2023-10-02 12:12:23.533371,2023-10-02 12:12:23.596884,0 days 00:00:00.063513,0.43582482326352623,380,sag,COMPLETE
1158,0.6449939949776177,2023-10-02 12:12:23.597887,2023-10-02 12:12:23.748088,0 days 00:00:00.150201,11137.960283213844,490,sag,COMPLETE
1159,0.6449939949776177,2023-10-02 12:12:23.748088,2023-10-02 12:12:23.871337,0 days 00:00:00.123249,1051.3470354769306,330,sag,COMPLETE
1160,0.6411180259853696,2023-10-02 12:12:23.872337,2023-10-02 12:12:23.999955,0 days 00:00:00.127618,1951.0077617280685,360,sag,COMPLETE
1161,0.6590785020198712,2023-10-02 12:12:24.000953,2023-10-02 12:12:24.191757,0 days 00:00:00.190804,6403.950146252944,500,sag,COMPLETE
1162,0.6418277104487389,2023-10-02 12:12:24.192757,2023-10-02 12:12:24.357144,0 days 00:00:00.164387,458.0047268952197,270,sag,COMPLETE
1163,0.6590785020198712,2023-10-02 12:12:24.357144,2023-10-02 12:12:24.532655,0 days 00:00:00.175511,11277.87592347347,490,sag,COMPLETE
1164,0.6520362484987444,2023-10-02 12:12:24.532655,2023-10-02 12:12:24.715558,0 days 00:00:00.182903,3644.316722589272,490,sag,COMPLETE
1165,0.6520362484987444,2023-10-02 12:12:24.716560,2023-10-02 12:12:24.937309,0 days 00:00:00.220749,6614.163831276818,500,sag,COMPLETE
1166,0.6449939949776177,2023-10-02 12:12:24.937309,2023-10-02 12:12:25.098380,0 days 00:00:00.161071,11604.298739513264,350,sag,COMPLETE
1167,0.5,2023-10-02 12:12:25.099377,2023-10-02 12:12:25.219442,0 days 00:00:00.120065,0.0002752005073872912,490,sag,COMPLETE
1168,0.5,2023-10-02 12:12:25.220439,2023-10-02 12:12:25.333201,0 days 00:00:00.112762,0.3349722810978012,500,sag,COMPLETE
1169,0.6520362484987444,2023-10-02 12:12:25.334207,2023-10-02 12:12:25.543290,0 days 00:00:00.209083,4331.723526983309,490,sag,COMPLETE
1170,0.637951741456491,2023-10-02 12:12:25.543290,2023-10-02 12:12:25.727921,0 days 00:00:00.184631,713.4806823312158,500,sag,COMPLETE
1171,0.5,2023-10-02 12:12:25.728923,2023-10-02 12:12:25.854026,0 days 00:00:00.125103,0.0047056737267644365,490,sag,COMPLETE
1172,0.5,2023-10-02 12:12:25.855032,2023-10-02 12:12:26.023550,0 days 00:00:00.168518,0.000349001776924742,500,sag,COMPLETE
1173,0.5,2023-10-02 12:12:26.024552,2023-10-02 12:12:26.137118,0 days 00:00:00.112566,0.07421354675673594,260,sag,COMPLETE
1174,0.5,2023-10-02 12:12:26.138120,2023-10-02 12:12:26.508863,0 days 00:00:00.370743,5.736236081582037e-05,490,sag,COMPLETE
1175,0.6449939949776177,2023-10-02 12:12:26.508863,2023-10-02 12:12:26.725930,0 days 00:00:00.217067,1850.7057657524617,490,sag,COMPLETE
1176,0.5,2023-10-02 12:12:26.726929,2023-10-02 12:12:26.853431,0 days 00:00:00.126502,0.019093247951905538,320,sag,COMPLETE
1177,0.6520362484987444,2023-10-02 12:12:26.854436,2023-10-02 12:12:27.027196,0 days 00:00:00.172760,12231.762116105803,310,sag,COMPLETE
1178,0.6590785020198712,2023-10-02 12:12:27.027196,2023-10-02 12:12:27.216277,0 days 00:00:00.189081,2848.3364451112234,500,sag,COMPLETE
1179,0.6520362484987444,2023-10-02 12:12:27.217270,2023-10-02 12:12:27.354303,0 days 00:00:00.137033,7879.485585793553,280,sag,COMPLETE
1180,0.5,2023-10-02 12:12:27.355308,2023-10-02 12:12:27.443318,0 days 00:00:00.088010,0.002959766812191126,490,sag,COMPLETE
1181,0.5792117043345343,2023-10-02 12:12:27.444315,2023-10-02 12:12:27.530245,0 days 00:00:00.085930,1.129266629861906,390,sag,COMPLETE
1182,0.6590785020198712,2023-10-02 12:12:27.531244,2023-10-02 12:12:27.711310,0 days 00:00:00.180066,5145.394380865904,490,sag,COMPLETE
1183,0.6590785020198712,2023-10-02 12:12:27.712310,2023-10-02 12:12:27.895796,0 days 00:00:00.183486,12477.583712766642,500,sag,COMPLETE
1184,0.6449939949776177,2023-10-02 12:12:27.896795,2023-10-02 12:12:28.031340,0 days 00:00:00.134545,1639.2920296384673,300,sag,COMPLETE
1185,0.5943334425155585,2023-10-02 12:12:28.032339,2023-10-02 12:12:28.101876,0 days 00:00:00.069537,2.061377089566439,480,sag,COMPLETE
1186,0.637951741456491,2023-10-02 12:12:28.101876,2023-10-02 12:12:28.224406,0 days 00:00:00.122530,8643.067913974128,270,sag,COMPLETE
1187,0.6449939949776177,2023-10-02 12:12:28.224406,2023-10-02 12:12:28.393306,0 days 00:00:00.168900,3268.553976306435,500,sag,COMPLETE
1188,0.6520362484987444,2023-10-02 12:12:28.394303,2023-10-02 12:12:28.564345,0 days 00:00:00.170042,13781.700281791349,490,sag,COMPLETE
1189,0.5345015831422644,2023-10-02 12:12:28.564345,2023-10-02 12:12:28.635464,0 days 00:00:00.071119,0.566730964287516,480,sag,COMPLETE
1190,0.6629544710121192,2023-10-02 12:12:28.636464,2023-10-02 12:12:28.793519,0 days 00:00:00.157055,6759.70344608888,490,sag,COMPLETE
1191,0.6449939949776177,2023-10-02 12:12:28.794519,2023-10-02 12:12:28.957592,0 days 00:00:00.163073,4069.2118777348105,500,sag,COMPLETE
1192,0.6590785020198712,2023-10-02 12:12:28.957592,2023-10-02 12:12:29.122243,0 days 00:00:00.164651,6363.1700881982415,500,sag,COMPLETE
1193,0.669996724533246,2023-10-02 12:12:29.123245,2023-10-02 12:12:29.293299,0 days 00:00:00.170054,6014.429952201946,490,sag,COMPLETE
1194,0.6520362484987444,2023-10-02 12:12:29.293299,2023-10-02 12:12:29.449832,0 days 00:00:00.156533,5504.905175335541,490,sag,COMPLETE
1195,0.5,2023-10-02 12:12:29.449832,2023-10-02 12:12:29.520431,0 days 00:00:00.070599,0.17220540005949506,500,sag,COMPLETE
1196,0.5,2023-10-02 12:12:29.521427,2023-10-02 12:12:29.726586,0 days 00:00:00.205159,8.67388399170242e-05,490,sag,COMPLETE
1197,0.6520362484987444,2023-10-02 12:12:29.726586,2023-10-02 12:12:29.888090,0 days 00:00:00.161504,2952.66873833426,500,sag,COMPLETE
1198,0.6559122174909924,2023-10-02 12:12:29.889090,2023-10-02 12:12:30.046079,0 days 00:00:00.156989,7079.094299032426,490,sag,COMPLETE
1199,0.6520362484987444,2023-10-02 12:12:30.047087,2023-10-02 12:12:30.270344,0 days 00:00:00.223257,2418.451251897185,500,sag,COMPLETE
1200,0.6590785020198712,2023-10-02 12:12:30.271401,2023-10-02 12:12:30.435978,0 days 00:00:00.164577,4220.679270278919,490,sag,COMPLETE
1201,0.666120755540998,2023-10-02 12:12:30.436973,2023-10-02 12:12:30.600793,0 days 00:00:00.163820,9113.771539257139,490,sag,COMPLETE
1202,0.5,2023-10-02 12:12:30.601793,2023-10-02 12:12:30.702431,0 days 00:00:00.100638,0.0011870513389713835,500,sag,COMPLETE
1203,0.6590785020198712,2023-10-02 12:12:30.703433,2023-10-02 12:12:30.865779,0 days 00:00:00.162346,6712.437553310581,500,sag,COMPLETE
1204,0.6449939949776177,2023-10-02 12:12:30.866831,2023-10-02 12:12:31.040968,0 days 00:00:00.174137,4215.419521022107,490,sag,COMPLETE
1205,0.5,2023-10-02 12:12:31.040968,2023-10-02 12:12:31.137479,0 days 00:00:00.096511,0.0004375465495160557,500,sag,COMPLETE
1206,0.6590785020198712,2023-10-02 12:12:31.138486,2023-10-02 12:12:31.313818,0 days 00:00:00.175332,9444.824615669067,490,sag,COMPLETE
1207,0.5,2023-10-02 12:12:31.314814,2023-10-02 12:12:31.501829,0 days 00:00:00.187015,0.00010223331527601918,490,sag,COMPLETE
1208,0.666120755540998,2023-10-02 12:12:31.501829,2023-10-02 12:12:31.664877,0 days 00:00:00.163048,6455.793298003413,500,sag,COMPLETE
1209,0.6590785020198712,2023-10-02 12:12:31.664877,2023-10-02 12:12:31.819397,0 days 00:00:00.154520,2188.422022939381,500,sag,COMPLETE
1210,0.6488699639698657,2023-10-02 12:12:31.820397,2023-10-02 12:12:31.984443,0 days 00:00:00.164046,6142.6430473077935,500,sag,COMPLETE
1211,0.637951741456491,2023-10-02 12:12:31.985443,2023-10-02 12:12:32.148722,0 days 00:00:00.163279,1212.5840145472898,500,sag,COMPLETE
1212,0.6559122174909924,2023-10-02 12:12:32.149789,2023-10-02 12:12:32.317802,0 days 00:00:00.168013,4836.785291698818,490,sag,COMPLETE
1213,0.5,2023-10-02 12:12:32.318802,2023-10-02 12:12:32.429330,0 days 00:00:00.110528,0.00043623399945054626,500,sag,COMPLETE
1214,0.637951741456491,2023-10-02 12:12:32.430326,2023-10-02 12:12:32.589391,0 days 00:00:00.159065,3040.614857137665,490,sag,COMPLETE
1215,0.6559122174909924,2023-10-02 12:12:32.589391,2023-10-02 12:12:32.772599,0 days 00:00:00.183208,8143.684088090401,500,sag,COMPLETE
1216,0.6449939949776177,2023-10-02 12:12:32.773602,2023-10-02 12:12:32.937111,0 days 00:00:00.163509,3551.6089797514437,490,sag,COMPLETE
1217,0.5,2023-10-02 12:12:32.938113,2023-10-02 12:12:34.303423,0 days 00:00:01.365310,1.1331876146704756e-05,490,sag,COMPLETE
1218,0.637951741456491,2023-10-02 12:12:34.303423,2023-10-02 12:12:34.467569,0 days 00:00:00.164146,1298.287976688014,500,sag,COMPLETE
1219,0.6418277104487389,2023-10-02 12:12:34.468568,2023-10-02 12:12:34.633251,0 days 00:00:00.164683,575.4256517569926,500,sag,COMPLETE
1220,0.6520362484987444,2023-10-02 12:12:34.633251,2023-10-02 12:12:34.802936,0 days 00:00:00.169685,5873.716056359442,490,sag,COMPLETE
1221,0.5,2023-10-02 12:12:34.803991,2023-10-02 12:12:35.355596,0 days 00:00:00.551605,2.8129268251250004e-05,500,sag,COMPLETE
1222,0.6590785020198712,2023-10-02 12:12:35.356643,2023-10-02 12:12:35.492617,0 days 00:00:00.135974,2071.369913344059,340,sag,COMPLETE
1223,0.6520362484987444,2023-10-02 12:12:35.492617,2023-10-02 12:12:35.638154,0 days 00:00:00.145537,13533.833292109932,320,sag,COMPLETE
1224,0.6590785020198712,2023-10-02 12:12:35.639150,2023-10-02 12:12:35.808349,0 days 00:00:00.169199,9214.712989672327,490,sag,COMPLETE
1225,0.666120755540998,2023-10-02 12:12:35.809393,2023-10-02 12:12:35.985686,0 days 00:00:00.176293,4121.668344848313,480,sag,COMPLETE
1226,0.6520362484987444,2023-10-02 12:12:35.985686,2023-10-02 12:12:36.154229,0 days 00:00:00.168543,5005.777621342406,480,sag,COMPLETE
1227,0.6520362484987444,2023-10-02 12:12:36.154229,2023-10-02 12:12:36.307931,0 days 00:00:00.153702,2708.8491833634407,480,sag,COMPLETE
1228,0.5,2023-10-02 12:12:36.307931,2023-10-02 12:12:36.378570,0 days 00:00:00.070639,0.22793590151681253,490,sag,COMPLETE
1229,0.6449939949776177,2023-10-02 12:12:36.379570,2023-10-02 12:12:36.569418,0 days 00:00:00.189848,9915.959318942478,480,sag,COMPLETE
1230,0.5,2023-10-02 12:12:36.569418,2023-10-02 12:12:36.643533,0 days 00:00:00.074115,0.16751186085533787,480,sag,COMPLETE
1231,0.6449939949776177,2023-10-02 12:12:36.644538,2023-10-02 12:12:36.805115,0 days 00:00:00.160577,6746.892557623807,490,sag,COMPLETE
1232,0.6552025330276231,2023-10-02 12:12:36.805115,2023-10-02 12:12:36.986216,0 days 00:00:00.181101,11986.987793204615,490,sag,COMPLETE
1233,0.637951741456491,2023-10-02 12:12:36.987216,2023-10-02 12:12:37.159459,0 days 00:00:00.172243,937.8756493039086,500,sag,COMPLETE
1234,0.5,2023-10-02 12:12:37.160602,2023-10-02 12:12:37.318580,0 days 00:00:00.157978,0.00012830242241513752,480,sag,COMPLETE
1235,0.6449939949776177,2023-10-02 12:12:37.319575,2023-10-02 12:12:37.481485,0 days 00:00:00.161910,1719.2506033483808,490,sag,COMPLETE
1236,0.6520362484987444,2023-10-02 12:12:37.481485,2023-10-02 12:12:37.640697,0 days 00:00:00.159212,3723.422460172519,500,sag,COMPLETE
1237,0.5,2023-10-02 12:12:37.641709,2023-10-02 12:12:37.988004,0 days 00:00:00.346295,5.9187295960975055e-05,130,sag,COMPLETE
1238,0.666120755540998,2023-10-02 12:12:37.989004,2023-10-02 12:12:38.144639,0 days 00:00:00.155635,7275.652050569449,480,sag,COMPLETE
1239,0.5,2023-10-02 12:12:38.145638,2023-10-02 12:12:38.223470,0 days 00:00:00.077832,0.001626563768673247,480,sag,COMPLETE
1240,0.6520362484987444,2023-10-02 12:12:38.224468,2023-10-02 12:12:38.394984,0 days 00:00:00.170516,8472.961460114637,480,sag,COMPLETE
1241,0.6590785020198712,2023-10-02 12:12:38.395983,2023-10-02 12:12:38.560331,0 days 00:00:00.164348,15372.969750133414,480,sag,COMPLETE
1242,0.5,2023-10-02 12:12:38.561331,2023-10-02 12:12:38.630106,0 days 00:00:00.068775,0.014700112743059305,490,sag,COMPLETE
1243,0.5,2023-10-02 12:12:38.630106,2023-10-02 12:12:38.699493,0 days 00:00:00.069387,0.07646374209552935,480,sag,COMPLETE
1244,0.5,2023-10-02 12:12:38.700491,2023-10-02 12:12:38.785582,0 days 00:00:00.085091,0.01042945218102182,490,sag,COMPLETE
1245,0.5,2023-10-02 12:12:38.786582,2023-10-02 12:12:38.862328,0 days 00:00:00.075746,0.0033135497978615835,480,sag,COMPLETE
1246,0.5,2023-10-02 12:12:38.863444,2023-10-02 12:12:38.961895,0 days 00:00:00.098451,0.0007101839877099858,500,sag,COMPLETE
1247,0.6590785020198712,2023-10-02 12:12:38.961895,2023-10-02 12:12:39.135840,0 days 00:00:00.173945,12540.709688891326,490,sag,COMPLETE
1248,0.5,2023-10-02 12:12:39.136847,2023-10-02 12:12:39.941704,0 days 00:00:00.804857,1.5750464452689216e-05,480,sag,COMPLETE
1249,0.6590785020198712,2023-10-02 12:12:39.942705,2023-10-02 12:12:40.107128,0 days 00:00:00.164423,6437.087732017045,500,sag,COMPLETE
1250,0.666120755540998,2023-10-02 12:12:40.108128,2023-10-02 12:12:40.272198,0 days 00:00:00.164070,13488.111811599661,490,sag,COMPLETE
1251,0.6590785020198712,2023-10-02 12:12:40.273198,2023-10-02 12:12:40.437736,0 days 00:00:00.164538,13154.754742584964,490,sag,COMPLETE
1252,0.6520362484987444,2023-10-02 12:12:40.438732,2023-10-02 12:12:40.598797,0 days 00:00:00.160065,14740.375152927785,480,sag,COMPLETE
1253,0.604541980565564,2023-10-02 12:12:40.599797,2023-10-02 12:12:40.683316,0 days 00:00:00.083519,3.1781355629877854,490,sag,COMPLETE
1254,0.5,2023-10-02 12:12:40.684317,2023-10-02 12:12:40.802836,0 days 00:00:00.118519,0.0001956202778459652,490,sag,COMPLETE
1255,0.666120755540998,2023-10-02 12:12:40.803836,2023-10-02 12:12:40.968467,0 days 00:00:00.164631,9969.071283723079,500,sag,COMPLETE
1256,0.6520362484987444,2023-10-02 12:12:40.968467,2023-10-02 12:12:41.129003,0 days 00:00:00.160536,8881.556960556682,500,sag,COMPLETE
1257,0.6590785020198712,2023-10-02 12:12:41.130005,2023-10-02 12:12:41.290447,0 days 00:00:00.160442,8381.670877865552,500,sag,COMPLETE
1258,0.6481602795064964,2023-10-02 12:12:41.291532,2023-10-02 12:12:41.451085,0 days 00:00:00.159553,14838.784126652776,500,sag,COMPLETE
1259,0.5,2023-10-02 12:12:41.452093,2023-10-02 12:12:41.529239,0 days 00:00:00.077146,0.00579651697490293,490,sag,COMPLETE
1260,0.666120755540998,2023-10-02 12:12:41.529239,2023-10-02 12:12:41.701506,0 days 00:00:00.172267,6705.4029113125725,500,sag,COMPLETE
1261,0.5478764057211486,2023-10-02 12:12:41.702502,2023-10-02 12:12:41.776855,0 days 00:00:00.074353,0.7116073619056086,500,sag,COMPLETE
1262,0.6590785020198712,2023-10-02 12:12:41.777864,2023-10-02 12:12:41.949393,0 days 00:00:00.171529,5992.8143788608695,500,sag,COMPLETE
1263,0.6559122174909924,2023-10-02 12:12:41.950394,2023-10-02 12:12:42.127160,0 days 00:00:00.176766,5268.687039598104,500,sag,COMPLETE
1264,0.6449939949776177,2023-10-02 12:12:42.128160,2023-10-02 12:12:42.303349,0 days 00:00:00.175189,10334.744827411125,490,sag,COMPLETE
1265,0.5,2023-10-02 12:12:42.303349,2023-10-02 12:12:42.370868,0 days 00:00:00.067519,0.09970046967806014,500,sag,COMPLETE
1266,0.5,2023-10-02 12:12:42.371869,2023-10-02 12:12:43.070305,0 days 00:00:00.698436,2.019913593737548e-05,500,sag,COMPLETE
1267,0.5,2023-10-02 12:12:43.070305,2023-10-02 12:12:43.145402,0 days 00:00:00.075097,0.032521717462988785,490,sag,COMPLETE
1268,0.6418277104487389,2023-10-02 12:12:43.145402,2023-10-02 12:12:43.297584,0 days 00:00:00.152182,420.48955110058256,480,sag,COMPLETE
1269,0.5,2023-10-02 12:12:43.298587,2023-10-02 12:12:43.382128,0 days 00:00:00.083541,0.03483067797357808,500,sag,COMPLETE
1270,0.5,2023-10-02 12:12:43.383130,2023-10-02 12:12:43.456518,0 days 00:00:00.073388,0.12243320101471242,490,sag,COMPLETE
1271,0.6449939949776177,2023-10-02 12:12:43.457521,2023-10-02 12:12:43.624518,0 days 00:00:00.166997,3614.951334161451,490,sag,COMPLETE
1272,0.5070422535211268,2023-10-02 12:12:43.625519,2023-10-02 12:12:43.705718,0 days 00:00:00.080199,0.3516450602134929,480,sag,COMPLETE
1273,0.6077082650944426,2023-10-02 12:12:43.705718,2023-10-02 12:12:43.804251,0 days 00:00:00.098533,4.029506999010893,500,sag,COMPLETE
1274,0.6520362484987444,2023-10-02 12:12:43.805246,2023-10-02 12:12:43.977316,0 days 00:00:00.172070,7519.320356341055,490,sag,COMPLETE
1275,0.6488699639698657,2023-10-02 12:12:43.978321,2023-10-02 12:12:44.151864,0 days 00:00:00.173543,5439.328716043409,480,sag,COMPLETE
1276,0.6590785020198712,2023-10-02 12:12:44.152864,2023-10-02 12:12:44.319912,0 days 00:00:00.167048,2635.478356323673,500,sag,COMPLETE
1277,0.6520362484987444,2023-10-02 12:12:44.320916,2023-10-02 12:12:44.493995,0 days 00:00:00.173079,8699.958043355537,490,sag,COMPLETE
1278,0.6590785020198712,2023-10-02 12:12:44.493995,2023-10-02 12:12:44.670068,0 days 00:00:00.176073,3942.8054938453415,480,sag,COMPLETE
1279,0.5,2023-10-02 12:12:44.671068,2023-10-02 12:12:44.743005,0 days 00:00:00.071937,0.02927504033978598,500,sag,COMPLETE
1280,0.5,2023-10-02 12:12:44.743005,2023-10-02 12:12:44.835567,0 days 00:00:00.092562,0.0017976523717038216,490,sag,COMPLETE
1281,0.6590785020198712,2023-10-02 12:12:44.836558,2023-10-02 12:12:45.003008,0 days 00:00:00.166450,11064.637022118046,500,sag,COMPLETE
1282,0.637951741456491,2023-10-02 12:12:45.004007,2023-10-02 12:12:45.184076,0 days 00:00:00.180069,637.2066762522625,480,sag,COMPLETE
1283,0.6590785020198712,2023-10-02 12:12:45.185076,2023-10-02 12:12:45.350614,0 days 00:00:00.165538,6474.880859239361,490,sag,COMPLETE
1284,0.5,2023-10-02 12:12:45.351618,2023-10-02 12:12:45.422138,0 days 00:00:00.070520,0.052966355249717594,480,sag,COMPLETE
1285,0.6449939949776177,2023-10-02 12:12:45.423139,2023-10-02 12:12:45.581201,0 days 00:00:00.158062,14321.696867525397,490,sag,COMPLETE
1286,0.6520362484987444,2023-10-02 12:12:45.582193,2023-10-02 12:12:45.752560,0 days 00:00:00.170367,1781.5672097469433,500,sag,COMPLETE
1287,0.5,2023-10-02 12:12:45.753560,2023-10-02 12:12:45.838172,0 days 00:00:00.084612,0.007462842308678893,490,sag,COMPLETE
1288,0.6590785020198712,2023-10-02 12:12:45.838172,2023-10-02 12:12:45.999247,0 days 00:00:00.161075,5115.622425096054,480,sag,COMPLETE
1289,0.6449939949776177,2023-10-02 12:12:46.000307,2023-10-02 12:12:46.193484,0 days 00:00:00.193177,10193.626776441675,500,sag,COMPLETE
1290,0.6449939949776177,2023-10-02 12:12:46.194557,2023-10-02 12:12:46.374833,0 days 00:00:00.180276,2838.606051308081,500,sag,COMPLETE
1291,0.6449939949776177,2023-10-02 12:12:46.375833,2023-10-02 12:12:46.535158,0 days 00:00:00.159325,963.6598291505414,480,sag,COMPLETE
