number,value,datetime_start,datetime_complete,duration,params_C,params_max_iter,params_solver,state
3897,0.5,2023-10-02 12:21:57.022242,2023-10-02 12:21:57.346257,0 days 00:00:00.324015,8.345619238730796e-05,430,sag,COMPLETE
3898,0.5,2023-10-02 12:21:57.346257,2023-10-02 12:21:57.550519,0 days 00:00:00.204262,0.04677946772337079,490,sag,COMPLETE
3899,0.619663718746588,2023-10-02 12:21:57.550519,2023-10-02 12:21:57.738885,0 days 00:00:00.188366,10.115083108556245,460,saga,COMPLETE
3900,0.6449939949776177,2023-10-02 12:21:57.738885,2023-10-02 12:21:58.092764,0 days 00:00:00.353879,26923.069047456866,470,sag,COMPLETE
3901,0.5,2023-10-02 12:21:58.092764,2023-10-02 12:21:58.281467,0 days 00:00:00.188703,0.0017439373720267038,450,sag,COMPLETE
3902,0.6418277104487389,2023-10-02 12:21:58.281467,2023-10-02 12:21:58.547646,0 days 00:00:00.266179,339.2804493959644,480,sag,COMPLETE
3903,0.6590785020198712,2023-10-02 12:21:58.547646,2023-10-02 12:21:58.950184,0 days 00:00:00.402538,99567.73649278101,410,sag,COMPLETE
3904,0.6552025330276231,2023-10-02 12:21:58.951744,2023-10-02 12:21:59.242324,0 days 00:00:00.290580,98608.62726347396,490,saga,COMPLETE
3905,0.6411180259853696,2023-10-02 12:21:59.243324,2023-10-02 12:21:59.525945,0 days 00:00:00.282621,33775.66396074972,440,sag,COMPLETE
3906,0.6013756960366853,2023-10-02 12:21:59.528927,2023-10-02 12:21:59.841452,0 days 00:00:00.312525,2.388204329207885,470,lbfgs,COMPLETE
3907,0.6449939949776177,2023-10-02 12:21:59.841452,2023-10-02 12:22:00.100618,0 days 00:00:00.259166,16517.736657521087,330,sag,COMPLETE
3908,0.637951741456491,2023-10-02 12:22:00.100618,2023-10-02 12:22:00.501220,0 days 00:00:00.400602,64147.74996729176,480,sag,COMPLETE
3909,0.6590785020198712,2023-10-02 12:22:00.501220,2023-10-02 12:22:00.782723,0 days 00:00:00.281503,12065.504333086292,490,sag,COMPLETE
3910,0.6541653018888526,2023-10-02 12:22:00.782723,2023-10-02 12:22:01.083422,0 days 00:00:00.300699,34.86820385618218,470,saga,COMPLETE
3911,0.6203734032099574,2023-10-02 12:22:01.083422,2023-10-02 12:22:01.275428,0 days 00:00:00.192006,7.610574302969186,350,sag,COMPLETE
3912,0.6369145103177202,2023-10-02 12:22:01.276428,2023-10-02 12:22:01.460748,0 days 00:00:00.184320,21.853551858824343,460,sag,COMPLETE
3913,0.6520362484987444,2023-10-02 12:22:01.460748,2023-10-02 12:22:01.785468,0 days 00:00:00.324720,47881.02505351145,380,sag,COMPLETE
3914,0.5,2023-10-02 12:22:01.791235,2023-10-02 12:22:02.070493,0 days 00:00:00.279258,9.001313957350563e-05,490,sag,COMPLETE
3915,0.5,2023-10-02 12:22:02.086015,2023-10-02 12:22:02.258443,0 days 00:00:00.172428,0.006959732489645588,490,sag,COMPLETE
3916,0.6062888961677039,2023-10-02 12:22:02.258443,2023-10-02 12:22:02.455879,0 days 00:00:00.197436,6.041752353393862,450,saga,COMPLETE
3917,0.5,2023-10-02 12:22:02.456882,2023-10-02 12:22:02.737997,0 days 00:00:00.281115,0.11974079110278112,480,newton-cg,COMPLETE
3918,0.6590785020198712,2023-10-02 12:22:02.737997,2023-10-02 12:22:03.052808,0 days 00:00:00.314811,23073.76124377235,460,sag,COMPLETE
3919,0.6590785020198712,2023-10-02 12:22:03.052808,2023-10-02 12:22:03.352867,0 days 00:00:00.300059,9634.832681627935,490,sag,COMPLETE
3920,0.5345015831422644,2023-10-02 12:22:03.354890,2023-10-02 12:22:03.631920,0 days 00:00:00.277030,0.5656043796477628,480,sag,COMPLETE
3921,0.637951741456491,2023-10-02 12:22:03.632920,2023-10-02 12:22:03.824759,0 days 00:00:00.191839,31881.413655105756,390,liblinear,COMPLETE
3922,0.6520362484987444,2023-10-02 12:22:03.825759,2023-10-02 12:22:04.102285,0 days 00:00:00.276526,64775.17996538542,440,sag,COMPLETE
3923,0.5,2023-10-02 12:22:04.104002,2023-10-02 12:22:04.384029,0 days 00:00:00.280027,0.030456998398793962,470,saga,COMPLETE
3924,0.6534556174254831,2023-10-02 12:22:04.385029,2023-10-02 12:22:04.751608,0 days 00:00:00.366579,125.33810209238915,480,sag,COMPLETE
3925,0.5,2023-10-02 12:22:04.753513,2023-10-02 12:22:05.048374,0 days 00:00:00.294861,0.000597587958095304,490,sag,COMPLETE
3926,0.5943334425155585,2023-10-02 12:22:05.050363,2023-10-02 12:22:05.355675,0 days 00:00:00.305312,2.086184922334732,470,sag,COMPLETE
3927,0.666120755540998,2023-10-02 12:22:05.357414,2023-10-02 12:22:05.760897,0 days 00:00:00.403483,18866.94945366764,420,sag,COMPLETE
3928,0.6552025330276231,2023-10-02 12:22:05.761897,2023-10-02 12:22:06.046450,0 days 00:00:00.284553,46719.07237487236,460,saga,COMPLETE
3929,0.6077082650944426,2023-10-02 12:22:06.046450,2023-10-02 12:22:06.234805,0 days 00:00:00.188355,3.9286694727590725,490,sag,COMPLETE
3930,0.5,2023-10-02 12:22:06.234805,2023-10-02 12:22:06.501678,0 days 00:00:00.266873,0.34335385918903094,450,sag,COMPLETE
3931,0.637951741456491,2023-10-02 12:22:06.501678,2023-10-02 12:22:06.768280,0 days 00:00:00.266602,682.8171178278815,430,sag,COMPLETE
3932,0.6369145103177202,2023-10-02 12:22:06.768280,2023-10-02 12:22:06.987965,0 days 00:00:00.219685,20.72520885762113,480,lbfgs,COMPLETE
3933,0.666120755540998,2023-10-02 12:22:06.987965,2023-10-02 12:22:07.254841,0 days 00:00:00.266876,29346.30874585963,490,sag,COMPLETE
3934,0.6481602795064964,2023-10-02 12:22:07.254841,2023-10-02 12:22:07.631710,0 days 00:00:00.376869,12250.101721819921,460,saga,COMPLETE
3935,0.5,2023-10-02 12:22:07.631710,2023-10-02 12:22:07.820075,0 days 00:00:00.188365,0.013295584186808101,370,sag,COMPLETE
3936,0.637951741456491,2023-10-02 12:22:07.820075,2023-10-02 12:22:08.097036,0 days 00:00:00.276961,65450.91894341793,470,sag,COMPLETE
3937,0.6337482257888415,2023-10-02 12:22:08.097036,2023-10-02 12:22:08.353751,0 days 00:00:00.256715,14.759621535461939,250,sag,COMPLETE
3938,0.5,2023-10-02 12:22:08.353751,2023-10-02 12:22:08.557737,0 days 00:00:00.203986,0.009637463499496143,480,sag,COMPLETE
3939,0.6629544710121192,2023-10-02 12:22:08.557737,2023-10-02 12:22:08.843795,0 days 00:00:00.286058,18942.491656828308,490,sag,COMPLETE
3940,0.5,2023-10-02 12:22:08.844879,2023-10-02 12:22:09.156821,0 days 00:00:00.311942,0.003558365797590456,450,saga,COMPLETE
3941,0.5,2023-10-02 12:22:09.156821,2023-10-02 12:22:09.389650,0 days 00:00:00.232829,0.10639088418129877,490,sag,COMPLETE
3942,0.6520362484987444,2023-10-02 12:22:09.391646,2023-10-02 12:22:09.655840,0 days 00:00:00.264194,7912.089193134369,470,sag,COMPLETE
3943,0.5,2023-10-02 12:22:09.655840,2023-10-02 12:22:10.889227,0 days 00:00:01.233387,1.328025484766638e-05,480,sag,COMPLETE
3944,0.6386614259198603,2023-10-02 12:22:10.889227,2023-10-02 12:22:11.177920,0 days 00:00:00.288693,373.5456346176895,340,newton-cg,COMPLETE
3945,0.6449939949776177,2023-10-02 12:22:11.178920,2023-10-02 12:22:11.440317,0 days 00:00:00.261397,35318.434808918035,460,sag,COMPLETE
3946,0.637951741456491,2023-10-02 12:22:11.440317,2023-10-02 12:22:11.639543,0 days 00:00:00.199226,47918.24984405105,360,liblinear,COMPLETE
3947,0.6552025330276231,2023-10-02 12:22:11.641146,2023-10-02 12:22:11.989075,0 days 00:00:00.347929,22327.005204753394,320,saga,COMPLETE
3948,0.6457036794409869,2023-10-02 12:22:11.991079,2023-10-02 12:22:12.224244,0 days 00:00:00.233165,262.97112425323076,490,sag,COMPLETE
3949,0.6590785020198712,2023-10-02 12:22:12.239706,2023-10-02 12:22:12.512498,0 days 00:00:00.272792,12863.508702180003,440,sag,COMPLETE
3950,0.6449939949776177,2023-10-02 12:22:12.513498,2023-10-02 12:22:12.856800,0 days 00:00:00.343302,69836.83311473347,400,sag,COMPLETE
3951,0.666120755540998,2023-10-02 12:22:12.857805,2023-10-02 12:22:13.151133,0 days 00:00:00.293328,27845.30662572824,480,sag,COMPLETE
3952,0.5,2023-10-02 12:22:13.152133,2023-10-02 12:22:13.360072,0 days 00:00:00.207939,0.0235021452844679,470,saga,COMPLETE
3953,0.6534556174254831,2023-10-02 12:22:13.361071,2023-10-02 12:22:13.557534,0 days 00:00:00.196463,67.08393766880336,500,sag,COMPLETE
3954,0.649579648433235,2023-10-02 12:22:13.557534,2023-10-02 12:22:13.869175,0 days 00:00:00.311641,146.89341077149535,480,sag,COMPLETE
3955,0.5,2023-10-02 12:22:13.871174,2023-10-02 12:22:14.291780,0 days 00:00:00.420606,5.484266639150784e-05,490,sag,COMPLETE
3956,0.6449939949776177,2023-10-02 12:22:14.291780,2023-10-02 12:22:14.577673,0 days 00:00:00.285893,8653.408648748933,440,sag,COMPLETE
3957,0.5894202423845398,2023-10-02 12:22:14.579686,2023-10-02 12:22:14.958985,0 days 00:00:00.379299,1.2283887540542509,460,lbfgs,COMPLETE
3958,0.637951741456491,2023-10-02 12:22:14.959988,2023-10-02 12:22:15.408516,0 days 00:00:00.448528,581.8814504533981,490,sag,COMPLETE
3959,0.6418277104487389,2023-10-02 12:22:15.408516,2023-10-02 12:22:15.804644,0 days 00:00:00.396128,209.34727792034903,450,saga,COMPLETE
3960,0.5,2023-10-02 12:22:15.806153,2023-10-02 12:22:16.119821,0 days 00:00:00.313668,0.0008545253278001799,500,sag,COMPLETE
3961,0.6590785020198712,2023-10-02 12:22:16.120822,2023-10-02 12:22:16.392051,0 days 00:00:00.271229,39057.11039679109,480,sag,COMPLETE
3962,0.6559122174909924,2023-10-02 12:22:16.392051,2023-10-02 12:22:16.693527,0 days 00:00:00.301476,16938.32559784845,470,sag,COMPLETE
3963,0.6449939949776177,2023-10-02 12:22:16.695525,2023-10-02 12:22:17.042207,0 days 00:00:00.346682,60137.1028245243,490,sag,COMPLETE
3964,0.5,2023-10-02 12:22:17.057855,2023-10-02 12:22:17.248743,0 days 00:00:00.190888,0.027714852958015644,480,saga,COMPLETE
3965,0.6590785020198712,2023-10-02 12:22:17.249743,2023-10-02 12:22:17.525991,0 days 00:00:00.276248,29553.379177757946,470,sag,COMPLETE
3966,0.528169014084507,2023-10-02 12:22:17.525991,2023-10-02 12:22:17.793585,0 days 00:00:00.267594,0.38987384999033625,500,sag,COMPLETE
3967,0.5,2023-10-02 12:22:17.793585,2023-10-02 12:22:18.010852,0 days 00:00:00.217267,0.0016011959794099784,450,sag,COMPLETE
3968,0.637951741456491,2023-10-02 12:22:18.012835,2023-10-02 12:22:18.242481,0 days 00:00:00.229646,7681.734233333889,460,newton-cg,COMPLETE
3969,0.6520362484987444,2023-10-02 12:22:18.243731,2023-10-02 12:22:18.642837,0 days 00:00:00.399106,69211.23782462401,490,sag,COMPLETE
3970,0.5,2023-10-02 12:22:18.644140,2023-10-02 12:22:18.957318,0 days 00:00:00.313178,0.000236076829063927,490,saga,COMPLETE
3971,0.6534556174254831,2023-10-02 12:22:18.972947,2023-10-02 12:22:19.193081,0 days 00:00:00.220134,110.42143291372074,310,sag,COMPLETE
3972,0.6534556174254831,2023-10-02 12:22:19.193081,2023-10-02 12:22:19.445033,0 days 00:00:00.251952,83.81071814907993,330,liblinear,COMPLETE
3973,0.5,2023-10-02 12:22:19.445033,2023-10-02 12:22:19.649082,0 days 00:00:00.204049,0.0008870809216966117,500,sag,COMPLETE
3974,0.6502893328966044,2023-10-02 12:22:19.649082,2023-10-02 12:22:19.853147,0 days 00:00:00.204065,34.78434918194411,480,sag,COMPLETE
3975,0.666120755540998,2023-10-02 12:22:19.853147,2023-10-02 12:22:20.120216,0 days 00:00:00.267069,13475.09816701549,470,sag,COMPLETE
3976,0.6520362484987444,2023-10-02 12:22:20.120216,2023-10-02 12:22:20.465442,0 days 00:00:00.345226,42494.670643291334,460,saga,COMPLETE
3977,0.6449939949776177,2023-10-02 12:22:20.465442,2023-10-02 12:22:20.747964,0 days 00:00:00.282522,1055.1938045816546,480,sag,COMPLETE
3978,0.666120755540998,2023-10-02 12:22:20.747964,2023-10-02 12:22:21.014919,0 days 00:00:00.266955,22221.64419622146,430,sag,COMPLETE
3979,0.6520362484987444,2023-10-02 12:22:21.014919,2023-10-02 12:22:21.360178,0 days 00:00:00.345259,48339.340068645324,500,sag,COMPLETE
3980,0.5,2023-10-02 12:22:21.360178,2023-10-02 12:22:21.533193,0 days 00:00:00.173015,0.06080280888270153,440,sag,COMPLETE
3981,0.6534556174254831,2023-10-02 12:22:21.548824,2023-10-02 12:22:21.737425,0 days 00:00:00.188601,61.23656916403339,490,sag,COMPLETE
3982,0.6481602795064964,2023-10-02 12:22:21.737425,2023-10-02 12:22:22.082768,0 days 00:00:00.345343,18155.61530805233,470,saga,COMPLETE
3983,0.669996724533246,2023-10-02 12:22:22.082768,2023-10-02 12:22:22.365069,0 days 00:00:00.282301,10893.463926281334,490,sag,COMPLETE
3984,0.5,2023-10-02 12:22:22.365069,2023-10-02 12:22:22.553830,0 days 00:00:00.188761,0.003445762093609289,470,sag,COMPLETE
3985,0.637951741456491,2023-10-02 12:22:22.553830,2023-10-02 12:22:22.852092,0 days 00:00:00.298262,99492.23378848637,280,lbfgs,COMPLETE
3986,0.6520362484987444,2023-10-02 12:22:22.852092,2023-10-02 12:22:23.120752,0 days 00:00:00.268660,32270.127868406627,480,sag,COMPLETE
3987,0.6520362484987444,2023-10-02 12:22:23.120752,2023-10-02 12:22:23.386527,0 days 00:00:00.265775,11026.187645622498,470,sag,COMPLETE
3988,0.6552025330276231,2023-10-02 12:22:23.386527,2023-10-02 12:22:23.731511,0 days 00:00:00.344984,23695.506674199867,470,saga,COMPLETE
3989,0.6590785020198712,2023-10-02 12:22:23.747194,2023-10-02 12:22:24.013876,0 days 00:00:00.266682,98690.59290677898,480,sag,COMPLETE
3990,0.6267059722677149,2023-10-02 12:22:24.013876,2023-10-02 12:22:24.223476,0 days 00:00:00.209600,13.260530888845937,480,sag,COMPLETE
3991,0.5982094115078066,2023-10-02 12:22:24.223476,2023-10-02 12:22:24.485142,0 days 00:00:00.261666,1.906446119449599,460,sag,COMPLETE
3992,0.5,2023-10-02 12:22:24.485142,2023-10-02 12:22:24.684544,0 days 00:00:00.199402,0.09404183616759551,480,sag,COMPLETE
3993,0.6552025330276231,2023-10-02 12:22:24.685543,2023-10-02 12:22:24.972638,0 days 00:00:00.287095,49320.892013075114,350,sag,COMPLETE
3994,0.6069985806310733,2023-10-02 12:22:24.974637,2023-10-02 12:22:25.279036,0 days 00:00:00.304399,4.130838686568447,470,saga,COMPLETE
3995,0.5,2023-10-02 12:22:25.279036,2023-10-02 12:22:25.488256,0 days 00:00:00.209220,0.024581026908383076,470,sag,COMPLETE
3996,0.6235396877388361,2023-10-02 12:22:25.490256,2023-10-02 12:22:25.686460,0 days 00:00:00.196204,8.992874883712457,450,sag,COMPLETE
3997,0.637951741456491,2023-10-02 12:22:25.687462,2023-10-02 12:22:25.911243,0 days 00:00:00.223781,7353.613107190126,480,newton-cg,COMPLETE
3998,0.6534556174254831,2023-10-02 12:22:25.913237,2023-10-02 12:22:26.191295,0 days 00:00:00.278058,153.654125947121,460,liblinear,COMPLETE
3999,0.5,2023-10-02 12:22:26.193402,2023-10-02 12:22:26.620175,0 days 00:00:00.426773,5.506852277524782e-05,480,sag,COMPLETE
4000,0.6629544710121192,2023-10-02 12:22:26.621174,2023-10-02 12:22:26.905598,0 days 00:00:00.284424,15775.94708318193,480,sag,COMPLETE
4001,0.5478764057211486,2023-10-02 12:22:26.906598,2023-10-02 12:22:27.182390,0 days 00:00:00.275792,0.7418561406088781,450,saga,COMPLETE
4002,0.6520362484987444,2023-10-02 12:22:27.183386,2023-10-02 12:22:27.447051,0 days 00:00:00.263665,30738.108182586613,470,sag,COMPLETE
4003,0.5,2023-10-02 12:22:27.447051,2023-10-02 12:22:27.705098,0 days 00:00:00.258047,0.00016338442617452658,470,sag,COMPLETE
4004,0.666120755540998,2023-10-02 12:22:27.706098,2023-10-02 12:22:28.047569,0 days 00:00:00.341471,66099.17920428059,460,sag,COMPLETE
4005,0.6520362484987444,2023-10-02 12:22:28.047569,2023-10-02 12:22:28.328394,0 days 00:00:00.280825,43276.5243026089,420,sag,COMPLETE
4006,0.6520362484987444,2023-10-02 12:22:28.329405,2023-10-02 12:22:28.627318,0 days 00:00:00.297913,98734.85788423427,480,saga,COMPLETE
4007,0.5,2023-10-02 12:22:28.628824,2023-10-02 12:22:29.005905,0 days 00:00:00.377081,0.0188980717348134,300,sag,COMPLETE
4008,0.5,2023-10-02 12:22:29.006899,2023-10-02 12:22:29.880711,0 days 00:00:00.873812,2.1715119718002335e-05,480,sag,COMPLETE
4009,0.5,2023-10-02 12:22:29.880711,2023-10-02 12:22:30.163901,0 days 00:00:00.283190,0.2366919009495721,450,sag,COMPLETE
4010,0.637951741456491,2023-10-02 12:22:30.163901,2023-10-02 12:22:30.870035,0 days 00:00:00.706134,11361.46966614642,460,lbfgs,COMPLETE
4011,0.6590785020198712,2023-10-02 12:22:30.872029,2023-10-02 12:22:31.670310,0 days 00:00:00.798281,20337.285823647413,480,sag,COMPLETE
4012,0.6449939949776177,2023-10-02 12:22:31.675310,2023-10-02 12:22:32.348210,0 days 00:00:00.672900,29756.291371802927,440,saga,COMPLETE
4013,0.5,2023-10-02 12:22:32.348210,2023-10-02 12:22:32.687805,0 days 00:00:00.339595,0.0014814839899030612,490,sag,COMPLETE
4014,0.6590785020198712,2023-10-02 12:22:32.688805,2023-10-02 12:22:32.993980,0 days 00:00:00.305175,7329.974680701188,470,sag,COMPLETE
4015,0.5,2023-10-02 12:22:32.995975,2023-10-02 12:22:33.232099,0 days 00:00:00.236124,0.0005860243085266171,480,sag,COMPLETE
4016,0.6449939949776177,2023-10-02 12:22:33.234122,2023-10-02 12:22:33.896274,0 days 00:00:00.662152,1247.2741294053087,470,sag,COMPLETE
4017,0.6449939949776177,2023-10-02 12:22:33.898268,2023-10-02 12:22:34.428437,0 days 00:00:00.530169,65108.88265441901,490,sag,COMPLETE
4018,0.6411180259853696,2023-10-02 12:22:34.429434,2023-10-02 12:22:34.838800,0 days 00:00:00.409366,14628.423107724873,460,saga,COMPLETE
4019,0.5,2023-10-02 12:22:34.839799,2023-10-02 12:22:35.145433,0 days 00:00:00.305634,0.010150520811862766,490,sag,COMPLETE
4020,0.5376678676711432,2023-10-02 12:22:35.147437,2023-10-02 12:22:35.480758,0 days 00:00:00.333321,0.6275163149709381,480,sag,COMPLETE
4021,0.6449939949776177,2023-10-02 12:22:35.481751,2023-10-02 12:22:35.784010,0 days 00:00:00.302259,43581.48005202517,490,newton-cg,COMPLETE
4022,0.5,2023-10-02 12:22:35.784996,2023-10-02 12:22:36.026095,0 days 00:00:00.241099,0.0036387925834619485,370,sag,COMPLETE
4023,0.6590785020198712,2023-10-02 12:22:36.028099,2023-10-02 12:22:36.481784,0 days 00:00:00.453685,23540.084530067074,460,sag,COMPLETE
4024,0.6481602795064964,2023-10-02 12:22:36.483791,2023-10-02 12:22:36.767986,0 days 00:00:00.284195,34615.31190184584,360,saga,COMPLETE
4025,0.6449939949776177,2023-10-02 12:22:36.784593,2023-10-02 12:22:37.097867,0 days 00:00:00.313274,10076.884336971449,430,sag,COMPLETE
4026,0.6590785020198712,2023-10-02 12:22:37.099872,2023-10-02 12:22:37.487100,0 days 00:00:00.387228,63485.151207796254,390,sag,COMPLETE
4027,0.637951741456491,2023-10-02 12:22:37.487100,2023-10-02 12:22:37.700195,0 days 00:00:00.213095,19665.90631480706,470,liblinear,COMPLETE
4028,0.6590785020198712,2023-10-02 12:22:37.701847,2023-10-02 12:22:37.985833,0 days 00:00:00.283986,47982.39684429961,450,sag,COMPLETE
4029,0.6520362484987444,2023-10-02 12:22:37.985833,2023-10-02 12:22:38.418778,0 days 00:00:00.432945,6939.290050613945,480,sag,COMPLETE
4030,0.6372420569931216,2023-10-02 12:22:38.420781,2023-10-02 12:22:38.698502,0 days 00:00:00.277721,99832.94028136885,340,saga,COMPLETE
4031,0.6534556174254831,2023-10-02 12:22:38.699502,2023-10-02 12:22:38.916093,0 days 00:00:00.216591,52.714426304570516,490,sag,COMPLETE
4032,0.6590785020198712,2023-10-02 12:22:38.918103,2023-10-02 12:22:39.280925,0 days 00:00:00.362822,14796.889404877491,470,sag,COMPLETE
4033,0.6590785020198712,2023-10-02 12:22:39.280925,2023-10-02 12:22:39.578793,0 days 00:00:00.297868,32783.23011876564,480,sag,COMPLETE
4034,0.6590785020198712,2023-10-02 12:22:39.578793,2023-10-02 12:22:39.870779,0 days 00:00:00.291986,20609.96383330202,440,sag,COMPLETE
4035,0.6418277104487389,2023-10-02 12:22:39.870779,2023-10-02 12:22:40.218484,0 days 00:00:00.347705,151.080228985338,490,saga,COMPLETE
4036,0.6418277104487389,2023-10-02 12:22:40.218484,2023-10-02 12:22:40.580017,0 days 00:00:00.361533,344.5853105023687,410,sag,COMPLETE
4037,0.5,2023-10-02 12:22:40.581017,2023-10-02 12:22:40.762006,0 days 00:00:00.180989,0.006193227925032583,490,sag,COMPLETE
4038,0.6590785020198712,2023-10-02 12:22:40.762006,2023-10-02 12:22:41.052309,0 days 00:00:00.290303,64518.77132684774,380,sag,COMPLETE
4039,0.637951741456491,2023-10-02 12:22:41.052309,2023-10-02 12:22:41.371013,0 days 00:00:00.318704,11272.020527204724,470,lbfgs,COMPLETE
4040,0.6590785020198712,2023-10-02 12:22:41.371824,2023-10-02 12:22:41.644671,0 days 00:00:00.272847,32451.618822750184,460,sag,COMPLETE
4041,0.6520362484987444,2023-10-02 12:22:41.644671,2023-10-02 12:22:41.890048,0 days 00:00:00.245377,7094.448278111861,320,sag,COMPLETE
4042,0.66224478654875,2023-10-02 12:22:41.890048,2023-10-02 12:22:42.249975,0 days 00:00:00.359927,47761.884987078774,450,saga,COMPLETE
4043,0.5,2023-10-02 12:22:42.249975,2023-10-02 12:22:42.915397,0 days 00:00:00.665422,2.8933487297387116e-05,290,sag,COMPLETE
4044,0.5,2023-10-02 12:22:42.916394,2023-10-02 12:22:43.141673,0 days 00:00:00.225279,0.00019665582706720675,480,sag,COMPLETE
4045,0.6590785020198712,2023-10-02 12:22:43.141673,2023-10-02 12:22:43.502244,0 days 00:00:00.360571,22546.303710710534,490,sag,COMPLETE
4046,0.6590785020198712,2023-10-02 12:22:43.503244,2023-10-02 12:22:43.783811,0 days 00:00:00.280567,14889.799977393044,480,sag,COMPLETE
4047,0.5,2023-10-02 12:22:43.785814,2023-10-02 12:22:44.173217,0 days 00:00:00.387403,0.0001331999828811044,460,saga,COMPLETE
4048,0.5,2023-10-02 12:22:44.173217,2023-10-02 12:22:44.443028,0 days 00:00:00.269811,0.04075916630304965,470,sag,COMPLETE
4049,0.637951741456491,2023-10-02 12:22:44.443028,2023-10-02 12:22:44.628540,0 days 00:00:00.185512,46579.06727950857,490,liblinear,COMPLETE
4050,0.5,2023-10-02 12:22:44.628540,2023-10-02 12:22:44.832587,0 days 00:00:00.204047,0.0065603450506264375,480,newton-cg,COMPLETE
4051,0.5,2023-10-02 12:22:44.832587,2023-10-02 12:22:45.209240,0 days 00:00:00.376653,0.00010298041708725486,350,sag,COMPLETE
4052,0.5,2023-10-02 12:22:45.224883,2023-10-02 12:22:45.413421,0 days 00:00:00.188538,0.16204015525811236,440,sag,COMPLETE
4053,0.637951741456491,2023-10-02 12:22:45.413421,2023-10-02 12:22:45.712004,0 days 00:00:00.298583,773.973375684528,490,sag,COMPLETE
4054,0.649579648433235,2023-10-02 12:22:45.712004,2023-10-02 12:22:46.033584,0 days 00:00:00.321580,81.12867443623486,450,saga,COMPLETE
4055,0.6629544710121192,2023-10-02 12:22:46.033584,2023-10-02 12:22:46.316107,0 days 00:00:00.282523,68941.52646729864,480,sag,COMPLETE
4056,0.666120755540998,2023-10-02 12:22:46.316107,2023-10-02 12:22:46.598115,0 days 00:00:00.282008,26553.96829391235,470,sag,COMPLETE
4057,0.6203734032099574,2023-10-02 12:22:46.598115,2023-10-02 12:22:46.865027,0 days 00:00:00.266912,7.4771293057655654,460,sag,COMPLETE
4058,0.6559122174909924,2023-10-02 12:22:46.880656,2023-10-02 12:22:47.163128,0 days 00:00:00.282472,11464.131849732046,490,sag,COMPLETE
4059,0.6471230483677258,2023-10-02 12:22:47.163128,2023-10-02 12:22:47.353695,0 days 00:00:00.190567,28.350101432017407,490,sag,COMPLETE
