number,value,datetime_start,datetime_complete,duration,params_C,params_max_iter,params_solver,state
8623,0.5,2023-10-02 12:55:47.835498,2023-10-02 12:55:48.367666,0 days 00:00:00.532168,0.2795583577381634,400,sag,COMPLETE
8624,0.6520362484987444,2023-10-02 12:55:48.370662,2023-10-02 12:55:48.972695,0 days 00:00:00.602033,31451.301762944728,390,sag,COMPLETE
8625,0.6590785020198712,2023-10-02 12:55:48.975690,2023-10-02 12:55:49.575366,0 days 00:00:00.599676,50749.21398070733,410,sag,COMPLETE
8626,0.6590785020198712,2023-10-02 12:55:49.577455,2023-10-02 12:55:50.106336,0 days 00:00:00.528881,31730.177229761586,410,sag,COMPLETE
8627,0.637951741456491,2023-10-02 12:55:50.108339,2023-10-02 12:55:50.700463,0 days 00:00:00.592124,65445.15516477929,400,lbfgs,COMPLETE
8628,0.6629544710121192,2023-10-02 12:55:50.704463,2023-10-02 12:55:51.456612,0 days 00:00:00.752149,27896.45088818355,400,sag,COMPLETE
8629,0.6590785020198712,2023-10-02 12:55:51.458589,2023-10-02 12:55:52.075919,0 days 00:00:00.617330,65404.868300897135,390,sag,COMPLETE
8630,0.5,2023-10-02 12:55:52.077970,2023-10-02 12:55:52.503332,0 days 00:00:00.425362,0.006181751479434444,390,sag,COMPLETE
8631,0.669996724533246,2023-10-02 12:55:52.506333,2023-10-02 12:55:53.088052,0 days 00:00:00.581719,47724.2716574002,410,sag,COMPLETE
8632,0.6629544710121192,2023-10-02 12:55:53.090150,2023-10-02 12:55:53.678958,0 days 00:00:00.588808,98686.92096488482,390,sag,COMPLETE
8633,0.6449939949776177,2023-10-02 12:55:53.680954,2023-10-02 12:55:54.261078,0 days 00:00:00.580124,27088.72823470132,380,sag,COMPLETE
8634,0.649579648433235,2023-10-02 12:55:54.264208,2023-10-02 12:55:54.724841,0 days 00:00:00.460633,162.39098988796064,390,sag,COMPLETE
8635,0.6520362484987444,2023-10-02 12:55:54.726873,2023-10-02 12:55:55.309976,0 days 00:00:00.583103,64534.40443120041,410,sag,COMPLETE
8636,0.6520362484987444,2023-10-02 12:55:55.312008,2023-10-02 12:55:55.893430,0 days 00:00:00.581422,39565.76009601032,400,sag,COMPLETE
8637,0.6133311496888305,2023-10-02 12:55:55.895639,2023-10-02 12:55:56.418571,0 days 00:00:00.522932,6.838523781811817,400,sag,COMPLETE
8638,0.637951741456491,2023-10-02 12:55:56.420571,2023-10-02 12:55:56.963615,0 days 00:00:00.543044,25347.89787543824,400,newton-cg,COMPLETE
8639,0.666120755540998,2023-10-02 12:55:56.965616,2023-10-02 12:55:57.452891,0 days 00:00:00.487275,65181.382928783125,400,sag,COMPLETE
8640,0.6101648651599519,2023-10-02 12:55:57.454894,2023-10-02 12:55:57.977969,0 days 00:00:00.523075,5.226397116075534,410,sag,COMPLETE
8641,0.5,2023-10-02 12:55:57.979964,2023-10-02 12:55:58.500561,0 days 00:00:00.520597,0.05042935323385323,410,liblinear,COMPLETE
8642,0.5376678676711432,2023-10-02 12:55:58.503553,2023-10-02 12:55:59.029894,0 days 00:00:00.526341,0.599957987061129,390,sag,COMPLETE
8643,0.6488699639698657,2023-10-02 12:55:59.032889,2023-10-02 12:55:59.535890,0 days 00:00:00.503001,45745.410101287984,390,sag,COMPLETE
8644,0.6418277104487389,2023-10-02 12:55:59.537890,2023-10-02 12:56:00.113490,0 days 00:00:00.575600,290.4823490440012,380,sag,COMPLETE
8645,0.6629544710121192,2023-10-02 12:56:00.115626,2023-10-02 12:56:00.708334,0 days 00:00:00.592708,27756.63949016665,400,sag,COMPLETE
8646,0.6520362484987444,2023-10-02 12:56:00.711332,2023-10-02 12:56:01.314702,0 days 00:00:00.603370,1800.765472836379,410,sag,COMPLETE
8647,0.6590785020198712,2023-10-02 12:56:01.316709,2023-10-02 12:56:01.822601,0 days 00:00:00.505892,25221.24630337076,400,sag,COMPLETE
8648,0.5,2023-10-02 12:56:01.824597,2023-10-02 12:56:02.401635,0 days 00:00:00.577038,0.0004079995030854956,400,sag,COMPLETE
8649,0.5982094115078066,2023-10-02 12:56:02.404636,2023-10-02 12:56:02.940919,0 days 00:00:00.536283,1.8852754376327143,410,sag,COMPLETE
8650,0.6481602795064964,2023-10-02 12:56:02.942911,2023-10-02 12:56:03.545283,0 days 00:00:00.602372,66362.68710668768,380,sag,COMPLETE
8651,0.637951741456491,2023-10-02 12:56:03.548281,2023-10-02 12:56:04.120112,0 days 00:00:00.571831,99400.29817460774,420,lbfgs,COMPLETE
8652,0.6442843105142483,2023-10-02 12:56:04.122135,2023-10-02 12:56:04.662204,0 days 00:00:00.540069,40563.85332481244,410,sag,COMPLETE
8653,0.5070422535211268,2023-10-02 12:56:04.665204,2023-10-02 12:56:05.196649,0 days 00:00:00.531445,0.3626531242239746,400,sag,COMPLETE
8654,0.637951741456491,2023-10-02 12:56:05.199649,2023-10-02 12:56:05.794236,0 days 00:00:00.594587,685.5813579913981,420,sag,COMPLETE
8655,0.6552025330276231,2023-10-02 12:56:05.797228,2023-10-02 12:56:06.397021,0 days 00:00:00.599793,98368.24866491092,400,sag,COMPLETE
8656,0.6449939949776177,2023-10-02 12:56:06.400020,2023-10-02 12:56:06.912553,0 days 00:00:00.512533,23486.012196357013,420,sag,COMPLETE
8657,0.6629544710121192,2023-10-02 12:56:06.914554,2023-10-02 12:56:07.494988,0 days 00:00:00.580434,45653.59960250705,410,sag,COMPLETE
8658,0.649579648433235,2023-10-02 12:56:07.497982,2023-10-02 12:56:08.079659,0 days 00:00:00.581677,137.65544161356735,390,sag,COMPLETE
8659,0.6108745496233213,2023-10-02 12:56:08.082660,2023-10-02 12:56:08.588964,0 days 00:00:00.506304,4.147347406220912,370,sag,COMPLETE
8660,0.6369145103177202,2023-10-02 12:56:08.591965,2023-10-02 12:56:09.021978,0 days 00:00:00.430013,18.807663235141973,400,sag,COMPLETE
8661,0.6418277104487389,2023-10-02 12:56:09.024977,2023-10-02 12:56:09.608710,0 days 00:00:00.583733,384.6541085018318,400,sag,COMPLETE
8662,0.6238672344142374,2023-10-02 12:56:09.610712,2023-10-02 12:56:10.157560,0 days 00:00:00.546848,2439.1861687157966,390,newton-cg,COMPLETE
8663,0.5,2023-10-02 12:56:10.160566,2023-10-02 12:56:10.715841,0 days 00:00:00.555275,0.00020539246142799996,380,sag,COMPLETE
8664,0.637951741456491,2023-10-02 12:56:10.717840,2023-10-02 12:56:11.324203,0 days 00:00:00.606363,22830.094935097197,410,sag,COMPLETE
8665,0.6502893328966044,2023-10-02 12:56:11.327197,2023-10-02 12:56:11.770797,0 days 00:00:00.443600,35.992951058333915,410,sag,COMPLETE
8666,0.6520362484987444,2023-10-02 12:56:11.772798,2023-10-02 12:56:12.370574,0 days 00:00:00.597776,70535.29591095049,400,sag,COMPLETE
8667,0.5,2023-10-02 12:56:12.373574,2023-10-02 12:56:12.900640,0 days 00:00:00.527066,0.14756044564471646,400,liblinear,COMPLETE
8668,0.6520362484987444,2023-10-02 12:56:12.903640,2023-10-02 12:56:13.483526,0 days 00:00:00.579886,37390.2716344401,400,sag,COMPLETE
8669,0.6449939949776177,2023-10-02 12:56:13.485525,2023-10-02 12:56:13.982454,0 days 00:00:00.496929,20291.208461183793,390,sag,COMPLETE
8670,0.6520362484987444,2023-10-02 12:56:13.984454,2023-10-02 12:56:14.581072,0 days 00:00:00.596618,1112.4920710883243,380,sag,COMPLETE
8671,0.5376678676711432,2023-10-02 12:56:14.583066,2023-10-02 12:56:15.119865,0 days 00:00:00.536799,0.6300415290957422,400,sag,COMPLETE
8672,0.666120755540998,2023-10-02 12:56:15.121865,2023-10-02 12:56:15.759751,0 days 00:00:00.637886,67516.3094551196,400,sag,COMPLETE
8673,0.6534556174254831,2023-10-02 12:56:15.762755,2023-10-02 12:56:16.290524,0 days 00:00:00.527769,109.63577953548258,400,sag,COMPLETE
8674,0.5,2023-10-02 12:56:16.293524,2023-10-02 12:56:16.832905,0 days 00:00:00.539381,0.047106593558051725,420,sag,COMPLETE
8675,0.5,2023-10-02 12:56:16.835900,2023-10-02 12:56:17.466041,0 days 00:00:00.630141,0.00012212241551116194,410,sag,COMPLETE
8676,0.5,2023-10-02 12:56:17.468040,2023-10-02 12:56:18.014472,0 days 00:00:00.546432,0.2262917143683226,420,lbfgs,COMPLETE
8677,0.6520362484987444,2023-10-02 12:56:18.017472,2023-10-02 12:56:18.616746,0 days 00:00:00.599274,44253.977562797816,410,sag,COMPLETE
8678,0.6520362484987444,2023-10-02 12:56:18.618743,2023-10-02 12:56:19.258775,0 days 00:00:00.640032,1530.8826869494333,420,sag,COMPLETE
8679,0.6590785020198712,2023-10-02 12:56:19.260928,2023-10-02 12:56:19.913307,0 days 00:00:00.652379,27081.156255253685,400,sag,COMPLETE
8680,0.6629544710121192,2023-10-02 12:56:19.916303,2023-10-02 12:56:20.520063,0 days 00:00:00.603760,38513.27638823247,420,sag,COMPLETE
8681,0.6449939949776177,2023-10-02 12:56:20.523058,2023-10-02 12:56:21.112999,0 days 00:00:00.589941,18368.136791802048,380,sag,COMPLETE
8682,0.5,2023-10-02 12:56:21.115992,2023-10-02 12:56:21.566224,0 days 00:00:00.450232,0.00043254415537088883,420,sag,COMPLETE
8683,0.5,2023-10-02 12:56:21.568220,2023-10-02 12:56:22.087474,0 days 00:00:00.519254,0.07235570145233217,410,sag,COMPLETE
8684,0.6590785020198712,2023-10-02 12:56:22.090473,2023-10-02 12:56:22.713477,0 days 00:00:00.623004,98591.79378196034,420,sag,COMPLETE
8685,0.5,2023-10-02 12:56:22.716471,2023-10-02 12:56:23.258561,0 days 00:00:00.542090,0.0008482952328079916,420,sag,COMPLETE
8686,0.637951741456491,2023-10-02 12:56:23.261549,2023-10-02 12:56:23.778269,0 days 00:00:00.516720,3072.364843126958,400,sag,COMPLETE
8687,0.6277432034064855,2023-10-02 12:56:23.781276,2023-10-02 12:56:24.330195,0 days 00:00:00.548919,849.7329298070874,410,newton-cg,COMPLETE
8688,0.6235396877388361,2023-10-02 12:56:24.332195,2023-10-02 12:56:24.865307,0 days 00:00:00.533112,8.71669547990467,420,sag,COMPLETE
8689,0.6520362484987444,2023-10-02 12:56:24.868301,2023-10-02 12:56:25.449395,0 days 00:00:00.581094,65343.64970789161,390,sag,COMPLETE
8690,0.5,2023-10-02 12:56:25.451916,2023-10-02 12:56:26.000833,0 days 00:00:00.548917,0.004559735593688062,400,sag,COMPLETE
8691,0.6386614259198603,2023-10-02 12:56:26.002832,2023-10-02 12:56:26.443046,0 days 00:00:00.440214,407.41011513187,410,liblinear,COMPLETE
8692,0.608417949557812,2023-10-02 12:56:26.446044,2023-10-02 12:56:26.978228,0 days 00:00:00.532184,2.894823275139996,420,sag,COMPLETE
8693,0.6411180259853696,2023-10-02 12:56:26.981229,2023-10-02 12:56:27.587633,0 days 00:00:00.606404,47515.85165167517,410,sag,COMPLETE
8694,0.5,2023-10-02 12:56:27.590778,2023-10-02 12:56:28.315912,0 days 00:00:00.725134,5.6829354894776335e-05,390,sag,COMPLETE
8695,0.5,2023-10-02 12:56:28.317909,2023-10-02 12:56:28.746147,0 days 00:00:00.428238,0.09772448812890237,390,sag,COMPLETE
8696,0.6520362484987444,2023-10-02 12:56:28.748147,2023-10-02 12:56:29.349407,0 days 00:00:00.601260,30249.785638367095,400,sag,COMPLETE
8697,0.5,2023-10-02 12:56:29.352405,2023-10-02 12:56:29.894898,0 days 00:00:00.542493,0.012192368221283409,390,sag,COMPLETE
8698,0.6534556174254831,2023-10-02 12:56:29.897892,2023-10-02 12:56:30.446967,0 days 00:00:00.549075,69.17354986565829,380,sag,COMPLETE
8699,0.6590785020198712,2023-10-02 12:56:30.449964,2023-10-02 12:56:30.950714,0 days 00:00:00.500750,16988.64440004457,410,sag,COMPLETE
8700,0.637951741456491,2023-10-02 12:56:30.952709,2023-10-02 12:56:31.537715,0 days 00:00:00.585006,99713.95708624738,430,lbfgs,COMPLETE
8701,0.6520362484987444,2023-10-02 12:56:31.539710,2023-10-02 12:56:32.139501,0 days 00:00:00.599791,99756.04580078067,380,sag,COMPLETE
8702,0.5,2023-10-02 12:56:32.142501,2023-10-02 12:56:32.689649,0 days 00:00:00.547148,0.015814783589825604,390,sag,COMPLETE
8703,0.666120755540998,2023-10-02 12:56:32.691639,2023-10-02 12:56:33.294770,0 days 00:00:00.603131,48632.47295414535,380,sag,COMPLETE
8704,0.5376678676711432,2023-10-02 12:56:33.296770,2023-10-02 12:56:33.759410,0 days 00:00:00.462640,0.6339433064770238,410,sag,COMPLETE
8705,0.6502893328966044,2023-10-02 12:56:33.762500,2023-10-02 12:56:34.310333,0 days 00:00:00.547833,33.93949504856663,400,sag,COMPLETE
8706,0.6369145103177202,2023-10-02 12:56:34.312329,2023-10-02 12:56:34.853247,0 days 00:00:00.540918,18.937152684267247,420,sag,COMPLETE
8707,0.6457036794409869,2023-10-02 12:56:34.856250,2023-10-02 12:56:35.456050,0 days 00:00:00.599800,220.20522507520164,390,sag,COMPLETE
8708,0.5,2023-10-02 12:56:35.458037,2023-10-02 12:56:35.915857,0 days 00:00:00.457820,0.027225513696657593,410,sag,COMPLETE
8709,0.5,2023-10-02 12:56:35.918851,2023-10-02 12:56:36.452356,0 days 00:00:00.533505,0.0011318515826582278,410,sag,COMPLETE
8710,0.5,2023-10-02 12:56:36.455354,2023-10-02 12:56:37.657276,0 days 00:00:01.201922,1.7499435015155076e-05,390,sag,COMPLETE
8711,0.5,2023-10-02 12:56:37.660267,2023-10-02 12:56:38.628130,0 days 00:00:00.967863,3.1671990953371344e-05,390,sag,COMPLETE
8712,0.6559122174909924,2023-10-02 12:56:38.630121,2023-10-02 12:56:39.139095,0 days 00:00:00.508974,2144.1360288410647,390,sag,COMPLETE
8713,0.6267059722677149,2023-10-02 12:56:39.142097,2023-10-02 12:56:39.685053,0 days 00:00:00.542956,10.817049945951796,390,newton-cg,COMPLETE
8714,0.6629544710121192,2023-10-02 12:56:39.687043,2023-10-02 12:56:40.290357,0 days 00:00:00.603314,4199.239866575012,410,sag,COMPLETE
8715,0.637951741456491,2023-10-02 12:56:40.292356,2023-10-02 12:56:40.843396,0 days 00:00:00.551040,20101.14469596386,420,liblinear,COMPLETE
8716,0.669996724533246,2023-10-02 12:56:40.845393,2023-10-02 12:56:41.465203,0 days 00:00:00.619810,32445.96907977917,420,sag,COMPLETE
8717,0.6520362484987444,2023-10-02 12:56:41.467211,2023-10-02 12:56:41.968958,0 days 00:00:00.501747,12216.334547354836,400,sag,COMPLETE
8718,0.6590785020198712,2023-10-02 12:56:41.970958,2023-10-02 12:56:42.575732,0 days 00:00:00.604774,64976.6438460378,420,sag,COMPLETE
8719,0.5,2023-10-02 12:56:42.577728,2023-10-02 12:56:43.111858,0 days 00:00:00.534130,0.004863484900968117,390,sag,COMPLETE
8720,0.5,2023-10-02 12:56:43.113856,2023-10-02 12:56:43.775021,0 days 00:00:00.661165,8.031487088238306e-05,420,sag,COMPLETE
8721,0.669996724533246,2023-10-02 12:56:43.778131,2023-10-02 12:56:44.278687,0 days 00:00:00.500556,33489.37397136804,410,sag,COMPLETE
8722,0.5,2023-10-02 12:56:44.281684,2023-10-02 12:56:44.808969,0 days 00:00:00.527285,0.14590093334748244,420,sag,COMPLETE
8723,0.6449939949776177,2023-10-02 12:56:44.811957,2023-10-02 12:56:45.424458,0 days 00:00:00.612501,4850.987253157726,390,sag,COMPLETE
8724,0.6369145103177202,2023-10-02 12:56:45.427458,2023-10-02 12:56:45.961523,0 days 00:00:00.534065,20.479406950597262,400,sag,COMPLETE
8725,0.637951741456491,2023-10-02 12:56:45.964524,2023-10-02 12:56:46.469168,0 days 00:00:00.504644,646.1050553020938,400,sag,COMPLETE
8726,0.637951741456491,2023-10-02 12:56:46.471685,2023-10-02 12:56:47.067661,0 days 00:00:00.595976,18970.534818256023,410,lbfgs,COMPLETE
8727,0.666120755540998,2023-10-02 12:56:47.070169,2023-10-02 12:56:47.664583,0 days 00:00:00.594414,49267.578142535596,410,sag,COMPLETE
8728,0.6590785020198712,2023-10-02 12:56:47.666579,2023-10-02 12:56:48.279867,0 days 00:00:00.613288,1870.1965960130692,400,sag,COMPLETE
8729,0.5,2023-10-02 12:56:48.281986,2023-10-02 12:56:48.835978,0 days 00:00:00.553992,0.03576091608974298,390,sag,COMPLETE
8730,0.6457036794409869,2023-10-02 12:56:48.838972,2023-10-02 12:56:49.319310,0 days 00:00:00.480338,221.09183518989263,430,sag,COMPLETE
8731,0.666120755540998,2023-10-02 12:56:49.321494,2023-10-02 12:56:49.916806,0 days 00:00:00.595312,13567.581039339571,420,sag,COMPLETE
8732,0.6534556174254831,2023-10-02 12:56:49.918968,2023-10-02 12:56:50.484224,0 days 00:00:00.565256,60.34270054084123,390,sag,COMPLETE
8733,0.637951741456491,2023-10-02 12:56:50.486225,2023-10-02 12:56:51.076333,0 days 00:00:00.590108,3201.777509261729,390,sag,COMPLETE
8734,0.5,2023-10-02 12:56:51.079333,2023-10-02 12:56:51.509179,0 days 00:00:00.429846,0.002846480042538884,420,sag,COMPLETE
8735,0.5,2023-10-02 12:56:51.512171,2023-10-02 12:56:52.083904,0 days 00:00:00.571733,0.00017145069782324352,400,sag,COMPLETE
8736,0.6629544710121192,2023-10-02 12:56:52.086905,2023-10-02 12:56:52.686835,0 days 00:00:00.599930,66843.41528842036,380,sag,COMPLETE
8737,0.6013756960366853,2023-10-02 12:56:52.689835,2023-10-02 12:56:53.231577,0 days 00:00:00.541742,2.3095267094808865,420,newton-cg,COMPLETE
8738,0.5,2023-10-02 12:56:53.233577,2023-10-02 12:56:53.844076,0 days 00:00:00.610499,6.533225774350921e-05,370,sag,COMPLETE
8739,0.6590785020198712,2023-10-02 12:56:53.846084,2023-10-02 12:56:54.446976,0 days 00:00:00.600892,99668.40412781472,390,sag,COMPLETE
8740,0.5,2023-10-02 12:56:54.448970,2023-10-02 12:56:54.987130,0 days 00:00:00.538160,0.008170920117827721,430,sag,COMPLETE
8741,0.5619609127634021,2023-10-02 12:56:54.990130,2023-10-02 12:56:55.512603,0 days 00:00:00.522473,0.8243490945942367,380,sag,COMPLETE
8742,0.5,2023-10-02 12:56:55.514596,2023-10-02 12:56:56.046144,0 days 00:00:00.531548,0.002804019587371763,430,sag,COMPLETE
8743,0.6520362484987444,2023-10-02 12:56:56.049144,2023-10-02 12:56:56.558105,0 days 00:00:00.508961,22758.082379157106,400,sag,COMPLETE
8744,0.6277432034064855,2023-10-02 12:56:56.561311,2023-10-02 12:56:57.094251,0 days 00:00:00.532940,1154.6775414159724,390,liblinear,COMPLETE
8745,0.6520362484987444,2023-10-02 12:56:57.096365,2023-10-02 12:56:57.689199,0 days 00:00:00.592834,6450.2068532874955,380,sag,COMPLETE
8746,0.6629544710121192,2023-10-02 12:56:57.691199,2023-10-02 12:56:58.310286,0 days 00:00:00.619087,35665.56158621261,410,sag,COMPLETE
8747,0.6559122174909924,2023-10-02 12:56:58.313281,2023-10-02 12:56:58.830663,0 days 00:00:00.517382,10195.349833350367,380,sag,COMPLETE
8748,0.5690031662845288,2023-10-02 12:56:58.833669,2023-10-02 12:56:59.355570,0 days 00:00:00.521901,1.0225114764250565,400,sag,COMPLETE
8749,0.6534556174254831,2023-10-02 12:56:59.357566,2023-10-02 12:56:59.897823,0 days 00:00:00.540257,52.37419498713852,420,sag,COMPLETE
8750,0.5,2023-10-02 12:56:59.899817,2023-10-02 12:57:00.455117,0 days 00:00:00.555300,0.21616514932640185,380,sag,COMPLETE
8751,0.5,2023-10-02 12:57:00.457110,2023-10-02 12:57:00.886386,0 days 00:00:00.429276,1.0859711718465367e-05,430,lbfgs,COMPLETE
8752,0.6590785020198712,2023-10-02 12:57:00.889386,2023-10-02 12:57:01.485853,0 days 00:00:00.596467,46667.503279624354,390,sag,COMPLETE
8753,0.5,2023-10-02 12:57:01.488881,2023-10-02 12:57:02.312120,0 days 00:00:00.823239,4.261981261829907e-05,430,sag,COMPLETE
8754,0.649579648433235,2023-10-02 12:57:02.315120,2023-10-02 12:57:02.881943,0 days 00:00:00.566823,130.309549262277,410,sag,COMPLETE
8755,0.6140408341522,2023-10-02 12:57:02.884467,2023-10-02 12:57:03.338599,0 days 00:00:00.454132,5.028003927452181,380,sag,COMPLETE
8756,0.666120755540998,2023-10-02 12:57:03.341599,2023-10-02 12:57:03.924811,0 days 00:00:00.583212,24552.937205187773,390,sag,COMPLETE
8757,0.634075772464243,2023-10-02 12:57:03.927932,2023-10-02 12:57:04.523893,0 days 00:00:00.595961,14652.921241620134,400,sag,COMPLETE
8758,0.66224478654875,2023-10-02 12:57:04.525893,2023-10-02 12:57:05.137619,0 days 00:00:00.611726,4977.305756949336,380,sag,COMPLETE
8759,0.666120755540998,2023-10-02 12:57:05.139672,2023-10-02 12:57:05.758319,0 days 00:00:00.618647,65386.07170620714,420,sag,COMPLETE
8760,0.5,2023-10-02 12:57:05.761320,2023-10-02 12:57:06.237921,0 days 00:00:00.476601,0.00017059670004598355,380,sag,COMPLETE
8761,0.637951741456491,2023-10-02 12:57:06.240920,2023-10-02 12:57:06.776295,0 days 00:00:00.535375,32754.933830300346,390,newton-cg,COMPLETE
8762,0.6449939949776177,2023-10-02 12:57:06.778295,2023-10-02 12:57:07.378051,0 days 00:00:00.599756,8370.570270712582,380,sag,COMPLETE
8763,0.6590785020198712,2023-10-02 12:57:07.380055,2023-10-02 12:57:07.981867,0 days 00:00:00.601812,3004.5578785511066,400,sag,COMPLETE
8764,0.6520362484987444,2023-10-02 12:57:07.984867,2023-10-02 12:57:08.550484,0 days 00:00:00.565617,17586.98819151609,390,sag,COMPLETE
8765,0.6573315864177312,2023-10-02 12:57:08.553484,2023-10-02 12:57:09.086944,0 days 00:00:00.533460,39.21595320047522,420,sag,COMPLETE
8766,0.637951741456491,2023-10-02 12:57:09.088941,2023-10-02 12:57:09.605799,0 days 00:00:00.516858,99516.71203573057,430,liblinear,COMPLETE
8767,0.666120755540998,2023-10-02 12:57:09.608799,2023-10-02 12:57:10.213624,0 days 00:00:00.604825,52052.444012047556,430,sag,COMPLETE
8768,0.6590785020198712,2023-10-02 12:57:10.216629,2023-10-02 12:57:10.718158,0 days 00:00:00.501529,99489.8595641471,380,sag,COMPLETE
8769,0.6520362484987444,2023-10-02 12:57:10.721273,2023-10-02 12:57:11.320364,0 days 00:00:00.599091,30947.7634140757,430,sag,COMPLETE
8770,0.6590785020198712,2023-10-02 12:57:11.323364,2023-10-02 12:57:11.915387,0 days 00:00:00.592023,2031.2851792409317,370,sag,COMPLETE
8771,0.6520362484987444,2023-10-02 12:57:11.918380,2023-10-02 12:57:12.531436,0 days 00:00:00.613056,10884.94890432026,410,sag,COMPLETE
8772,0.6520362484987444,2023-10-02 12:57:12.533432,2023-10-02 12:57:13.153940,0 days 00:00:00.620508,5917.138461544174,380,sag,COMPLETE
8773,0.637951741456491,2023-10-02 12:57:13.155939,2023-10-02 12:57:13.673886,0 days 00:00:00.517947,21149.03374857647,430,sag,COMPLETE
8774,0.6520362484987444,2023-10-02 12:57:13.676886,2023-10-02 12:57:14.265259,0 days 00:00:00.588373,49701.271015867445,380,sag,COMPLETE
8775,0.6316191723987334,2023-10-02 12:57:14.268267,2023-10-02 12:57:14.864769,0 days 00:00:00.596502,561.494863396019,390,lbfgs,COMPLETE
8776,0.6520362484987444,2023-10-02 12:57:14.867774,2023-10-02 12:57:15.464165,0 days 00:00:00.596391,13199.590250423056,400,sag,COMPLETE
8777,0.6520362484987444,2023-10-02 12:57:15.467220,2023-10-02 12:57:15.969484,0 days 00:00:00.502264,3562.665627296215,410,sag,COMPLETE
8778,0.637951741456491,2023-10-02 12:57:15.971615,2023-10-02 12:57:16.557595,0 days 00:00:00.585980,892.5801636083041,420,sag,COMPLETE
8779,0.6520362484987444,2023-10-02 12:57:16.559596,2023-10-02 12:57:17.159444,0 days 00:00:00.599848,34438.812854696014,370,sag,COMPLETE
8780,0.6471230483677258,2023-10-02 12:57:17.161444,2023-10-02 12:57:17.698124,0 days 00:00:00.536680,28.48202459832044,370,sag,COMPLETE
8781,0.6552025330276231,2023-10-02 12:57:17.700118,2023-10-02 12:57:18.200294,0 days 00:00:00.500176,67100.89905927118,420,sag,COMPLETE
8782,0.5,2023-10-02 12:57:18.202543,2023-10-02 12:57:19.123564,0 days 00:00:00.921021,3.160145347591558e-05,380,sag,COMPLETE
8783,0.6534556174254831,2023-10-02 12:57:19.126681,2023-10-02 12:57:19.693942,0 days 00:00:00.567261,107.96977495094144,430,sag,COMPLETE
8784,0.5,2023-10-02 12:57:19.696941,2023-10-02 12:57:20.227975,0 days 00:00:00.531034,0.023763506605228017,400,sag,COMPLETE
8785,0.5,2023-10-02 12:57:20.229974,2023-10-02 12:57:20.840655,0 days 00:00:00.610681,0.0001155756023742287,390,sag,COMPLETE
