number,value,datetime_start,datetime_complete,duration,params_C,params_max_iter,params_solver,state
642,0.608417949557812,2023-10-02 12:11:21.365819,2023-10-02 12:11:21.419867,0 days 00:00:00.054048,2.6355935666833226,460,newton-cg,COMPLETE
643,0.6534556174254831,2023-10-02 12:11:21.420866,2023-10-02 12:11:21.573971,0 days 00:00:00.153105,146.046437244548,220,lbfgs,COMPLETE
644,0.5376678676711432,2023-10-02 12:11:21.574967,2023-10-02 12:11:21.624438,0 days 00:00:00.049471,0.5815374641224216,470,saga,COMPLETE
645,0.637951741456491,2023-10-02 12:11:21.624438,2023-10-02 12:11:21.666438,0 days 00:00:00.042000,92755.95894463744,500,liblinear,COMPLETE
646,0.637951741456491,2023-10-02 12:11:21.666438,2023-10-02 12:11:21.757803,0 days 00:00:00.091365,10061.842254571156,190,lbfgs,COMPLETE
647,0.6590785020198712,2023-10-02 12:11:21.758868,2023-10-02 12:11:21.843475,0 days 00:00:00.084607,4890.841140263632,190,saga,COMPLETE
648,0.5,2023-10-02 12:11:21.843475,2023-10-02 12:11:21.966150,0 days 00:00:00.122675,0.0006612402381300614,210,saga,COMPLETE
649,0.6481602795064964,2023-10-02 12:11:21.966150,2023-10-02 12:11:22.046230,0 days 00:00:00.080080,9487.287484403714,200,saga,COMPLETE
650,0.6481602795064964,2023-10-02 12:11:22.046230,2023-10-02 12:11:22.124758,0 days 00:00:00.078528,23825.50614367865,200,saga,COMPLETE
651,0.6590785020198712,2023-10-02 12:11:22.124758,2023-10-02 12:11:22.206833,0 days 00:00:00.082075,3789.79382563,190,saga,COMPLETE
652,0.6481602795064964,2023-10-02 12:11:22.206833,2023-10-02 12:11:22.288418,0 days 00:00:00.081585,3510.8154751192956,210,saga,COMPLETE
653,0.6481602795064964,2023-10-02 12:11:22.289419,2023-10-02 12:11:22.367936,0 days 00:00:00.078517,2188.3500028075796,210,saga,COMPLETE
654,0.6481602795064964,2023-10-02 12:11:22.368935,2023-10-02 12:11:22.446135,0 days 00:00:00.077200,14806.245870718247,190,saga,COMPLETE
655,0.6481602795064964,2023-10-02 12:11:22.446135,2023-10-02 12:11:22.535674,0 days 00:00:00.089539,5447.420471720229,260,saga,COMPLETE
656,0.6411180259853696,2023-10-02 12:11:22.536675,2023-10-02 12:11:22.615745,0 days 00:00:00.079070,6180.516370167849,200,saga,COMPLETE
657,0.6520362484987444,2023-10-02 12:11:22.615745,2023-10-02 12:11:22.698267,0 days 00:00:00.082522,5861.845172040053,220,saga,COMPLETE
658,0.6411180259853696,2023-10-02 12:11:22.699264,2023-10-02 12:11:22.783158,0 days 00:00:00.083894,2903.9693266408026,230,saga,COMPLETE
659,0.6481602795064964,2023-10-02 12:11:22.783158,2023-10-02 12:11:22.916841,0 days 00:00:00.133683,9921.243516678283,480,saga,COMPLETE
660,0.6481602795064964,2023-10-02 12:11:22.917845,2023-10-02 12:11:23.000385,0 days 00:00:00.082540,4917.535718144196,200,saga,COMPLETE
661,0.5,2023-10-02 12:11:23.001384,2023-10-02 12:11:23.048438,0 days 00:00:00.047054,0.05627206275365057,210,saga,COMPLETE
662,0.6411180259853696,2023-10-02 12:11:23.049472,2023-10-02 12:11:23.131132,0 days 00:00:00.081660,37096.89711670262,200,saga,COMPLETE
663,0.6520362484987444,2023-10-02 12:11:23.131132,2023-10-02 12:11:23.208652,0 days 00:00:00.077520,18277.82005119464,190,saga,COMPLETE
664,0.6481602795064964,2023-10-02 12:11:23.209651,2023-10-02 12:11:23.305732,0 days 00:00:00.096081,1879.4169515373383,290,saga,COMPLETE
665,0.637951741456491,2023-10-02 12:11:23.306735,2023-10-02 12:11:23.426810,0 days 00:00:00.120075,581.9721117871325,420,saga,COMPLETE
666,0.6520362484987444,2023-10-02 12:11:23.426810,2023-10-02 12:11:23.543470,0 days 00:00:00.116660,7492.0604229868995,390,saga,COMPLETE
667,0.5,2023-10-02 12:11:23.544470,2023-10-02 12:11:23.590481,0 days 00:00:00.046011,0.02221511946991975,220,saga,COMPLETE
668,0.6442843105142483,2023-10-02 12:11:23.590481,2023-10-02 12:11:23.679169,0 days 00:00:00.088688,28441.069209116216,240,saga,COMPLETE
669,0.6411180259853696,2023-10-02 12:11:23.679169,2023-10-02 12:11:23.762635,0 days 00:00:00.083466,4748.094252282222,190,saga,COMPLETE
670,0.6481602795064964,2023-10-02 12:11:23.763630,2023-10-02 12:11:23.878476,0 days 00:00:00.114846,12761.454114188999,370,saga,COMPLETE
671,0.637951741456491,2023-10-02 12:11:23.878476,2023-10-02 12:11:23.977384,0 days 00:00:00.098908,242.3146155329701,300,saga,COMPLETE
672,0.6520362484987444,2023-10-02 12:11:23.978383,2023-10-02 12:11:24.078047,0 days 00:00:00.099664,1369.0255568517346,310,saga,COMPLETE
673,0.6481602795064964,2023-10-02 12:11:24.079043,2023-10-02 12:11:24.161575,0 days 00:00:00.082532,47607.55646997733,210,saga,COMPLETE
674,0.6520362484987444,2023-10-02 12:11:24.161575,2023-10-02 12:11:24.248105,0 days 00:00:00.086530,3917.6708462278807,230,saga,COMPLETE
675,0.619663718746588,2023-10-02 12:11:24.248105,2023-10-02 12:11:24.311647,0 days 00:00:00.063542,10.071151885384163,490,saga,COMPLETE
676,0.6418277104487389,2023-10-02 12:11:24.311647,2023-10-02 12:11:24.393646,0 days 00:00:00.081999,121.84896847888133,190,saga,COMPLETE
677,0.5943334425155585,2023-10-02 12:11:24.394645,2023-10-02 12:11:24.445226,0 days 00:00:00.050581,1.9260331709672067,200,saga,COMPLETE
678,0.6520362484987444,2023-10-02 12:11:24.445226,2023-10-02 12:11:24.523156,0 days 00:00:00.077930,22456.768290017048,190,saga,COMPLETE
679,0.6449939949776177,2023-10-02 12:11:24.524156,2023-10-02 12:11:24.656024,0 days 00:00:00.131868,967.1917659231256,460,saga,COMPLETE
680,0.6337482257888415,2023-10-02 12:11:24.656024,2023-10-02 12:11:24.713809,0 days 00:00:00.057785,15.304809475473931,210,newton-cg,COMPLETE
681,0.6520362484987444,2023-10-02 12:11:24.713809,2023-10-02 12:11:24.851443,0 days 00:00:00.137634,7842.134171854275,500,saga,COMPLETE
682,0.5,2023-10-02 12:11:24.851443,2023-10-02 12:11:24.892447,0 days 00:00:00.041004,0.08002594758416244,250,liblinear,COMPLETE
683,0.6520362484987444,2023-10-02 12:11:24.893447,2023-10-02 12:11:24.976965,0 days 00:00:00.083518,57949.09301031484,220,saga,COMPLETE
684,0.5,2023-10-02 12:11:24.977964,2023-10-02 12:11:25.046588,0 days 00:00:00.068624,0.0022940815454043084,380,saga,COMPLETE
685,0.6481602795064964,2023-10-02 12:11:25.046588,2023-10-02 12:11:25.178130,0 days 00:00:00.131542,14156.267648923487,440,saga,COMPLETE
686,0.6449939949776177,2023-10-02 12:11:25.179134,2023-10-02 12:11:25.282670,0 days 00:00:00.103536,436.6958314267541,320,saga,COMPLETE
687,0.649579648433235,2023-10-02 12:11:25.282670,2023-10-02 12:11:25.393942,0 days 00:00:00.111272,92.01056600874385,480,saga,COMPLETE
688,0.6235396877388361,2023-10-02 12:11:25.393942,2023-10-02 12:11:25.458464,0 days 00:00:00.064522,8.14731650722146,200,saga,COMPLETE
689,0.6069985806310733,2023-10-02 12:11:25.458464,2023-10-02 12:11:25.506986,0 days 00:00:00.048522,4.239228540732362,230,saga,COMPLETE
690,0.5,2023-10-02 12:11:25.506986,2023-10-02 12:11:25.593992,0 days 00:00:00.087006,0.0032680216294784957,290,saga,COMPLETE
691,0.6449939949776177,2023-10-02 12:11:25.594994,2023-10-02 12:11:25.719388,0 days 00:00:00.124394,35034.24356567856,430,saga,COMPLETE
692,0.5855442733922918,2023-10-02 12:11:25.720388,2023-10-02 12:11:25.775458,0 days 00:00:00.055070,1.3192589618437813,200,saga,COMPLETE
693,0.6449939949776177,2023-10-02 12:11:25.775458,2023-10-02 12:11:25.875111,0 days 00:00:00.099653,800.7444218485739,300,saga,COMPLETE
694,0.6534556174254831,2023-10-02 12:11:25.876109,2023-10-02 12:11:25.934784,0 days 00:00:00.058675,149.24079090923686,280,newton-cg,COMPLETE
695,0.5,2023-10-02 12:11:25.935780,2023-10-02 12:11:25.986001,0 days 00:00:00.050221,0.04705758603456358,190,saga,COMPLETE
696,0.5,2023-10-02 12:11:25.986001,2023-10-02 12:11:26.064072,0 days 00:00:00.078071,0.006676903658412063,220,saga,COMPLETE
697,0.528169014084507,2023-10-02 12:11:26.064072,2023-10-02 12:11:26.106667,0 days 00:00:00.042595,0.4176542191628536,240,liblinear,COMPLETE
698,0.6298722567965934,2023-10-02 12:11:26.106667,2023-10-02 12:11:26.182252,0 days 00:00:00.075585,16.318314774067566,210,lbfgs,COMPLETE
699,0.6534556174254831,2023-10-02 12:11:26.182252,2023-10-02 12:11:26.287337,0 days 00:00:00.105085,70.3972545918928,490,saga,COMPLETE
700,0.5,2023-10-02 12:11:26.287337,2023-10-02 12:11:26.338170,0 days 00:00:00.050833,0.1530905007972415,200,lbfgs,COMPLETE
701,0.5,2023-10-02 12:11:26.338170,2023-10-02 12:11:26.392343,0 days 00:00:00.054173,0.01863516138506061,310,saga,COMPLETE
702,0.6309094879353642,2023-10-02 12:11:26.393314,2023-10-02 12:11:26.478649,0 days 00:00:00.085335,3485.513590821328,210,lbfgs,COMPLETE
703,0.5,2023-10-02 12:11:26.479647,2023-10-02 12:11:26.567704,0 days 00:00:00.088057,0.0017965057700519396,500,saga,COMPLETE
704,0.5,2023-10-02 12:11:26.568704,2023-10-02 12:11:26.614279,0 days 00:00:00.045575,0.2684226014287706,450,saga,COMPLETE
705,0.6457036794409869,2023-10-02 12:11:26.615271,2023-10-02 12:11:26.705999,0 days 00:00:00.090728,281.7116042574369,360,lbfgs,COMPLETE
706,0.5,2023-10-02 12:11:26.707001,2023-10-02 12:11:26.782474,0 days 00:00:00.075473,0.0060654975311819825,470,saga,COMPLETE
707,0.6238672344142374,2023-10-02 12:11:26.782474,2023-10-02 12:11:26.870002,0 days 00:00:00.087528,2312.107034328426,230,lbfgs,COMPLETE
708,0.6449939949776177,2023-10-02 12:11:26.870002,2023-10-02 12:11:26.949238,0 days 00:00:00.079236,16060.647511960145,190,saga,COMPLETE
709,0.6369145103177202,2023-10-02 12:11:26.950234,2023-10-02 12:11:27.029345,0 days 00:00:00.079111,20.7246821644152,220,lbfgs,COMPLETE
710,0.6267059722677149,2023-10-02 12:11:27.030362,2023-10-02 12:11:27.089189,0 days 00:00:00.058827,11.415403527544346,300,saga,COMPLETE
711,0.5,2023-10-02 12:11:27.090189,2023-10-02 12:11:27.138709,0 days 00:00:00.048520,1.3772066678822262e-05,200,lbfgs,COMPLETE
712,0.5,2023-10-02 12:11:27.138709,2023-10-02 12:11:27.308628,0 days 00:00:00.169919,0.00036587736193377784,420,saga,COMPLETE
713,0.6534556174254831,2023-10-02 12:11:27.308628,2023-10-02 12:11:27.388198,0 days 00:00:00.079570,93.83986344900194,190,lbfgs,COMPLETE
714,0.5478764057211486,2023-10-02 12:11:27.389196,2023-10-02 12:11:27.436717,0 days 00:00:00.047521,0.7580129095346076,280,saga,COMPLETE
715,0.5,2023-10-02 12:11:27.436717,2023-10-02 12:11:27.660578,0 days 00:00:00.223861,0.0001854170443767346,480,saga,COMPLETE
716,0.637951741456491,2023-10-02 12:11:27.661578,2023-10-02 12:11:27.746199,0 days 00:00:00.084621,55921.31719837252,210,lbfgs,COMPLETE
717,0.6481602795064964,2023-10-02 12:11:27.747193,2023-10-02 12:11:27.867170,0 days 00:00:00.119977,90975.98261903954,400,saga,COMPLETE
718,0.5,2023-10-02 12:11:27.868181,2023-10-02 12:11:27.917874,0 days 00:00:00.049693,0.0013940004915216782,250,lbfgs,COMPLETE
719,0.637951741456491,2023-10-02 12:11:27.917874,2023-10-02 12:11:27.983588,0 days 00:00:00.065714,7170.738752921234,490,newton-cg,COMPLETE
720,0.6534556174254831,2023-10-02 12:11:27.984585,2023-10-02 12:11:28.079229,0 days 00:00:00.094644,61.17828300055221,270,saga,COMPLETE
721,0.6277432034064855,2023-10-02 12:11:28.079229,2023-10-02 12:11:28.167752,0 days 00:00:00.088523,1595.1053256740736,240,lbfgs,COMPLETE
722,0.6442843105142483,2023-10-02 12:11:28.167752,2023-10-02 12:11:28.247299,0 days 00:00:00.079547,31437.75748004057,190,saga,COMPLETE
723,0.6369145103177202,2023-10-02 12:11:28.247299,2023-10-02 12:11:28.292289,0 days 00:00:00.044990,23.087684675552214,340,liblinear,COMPLETE
724,0.6062888961677039,2023-10-02 12:11:28.292289,2023-10-02 12:11:28.356813,0 days 00:00:00.064524,5.867470225814325,450,lbfgs,COMPLETE
725,0.6411180259853696,2023-10-02 12:11:28.356813,2023-10-02 12:11:28.438721,0 days 00:00:00.081908,10109.530881083096,200,saga,COMPLETE
726,0.6418277104487389,2023-10-02 12:11:28.438721,2023-10-02 12:11:28.549329,0 days 00:00:00.110608,149.51899864210898,320,saga,COMPLETE
727,0.6534556174254831,2023-10-02 12:11:28.549329,2023-10-02 12:11:28.648888,0 days 00:00:00.099559,68.01093875904111,210,lbfgs,COMPLETE
728,0.5,2023-10-02 12:11:28.648888,2023-10-02 12:11:28.746903,0 days 00:00:00.098015,0.004850640662262308,220,saga,COMPLETE
729,0.637951741456491,2023-10-02 12:11:28.746903,2023-10-02 12:11:28.832432,0 days 00:00:00.085529,21883.45362396777,290,lbfgs,COMPLETE
730,0.604541980565564,2023-10-02 12:11:28.833431,2023-10-02 12:11:28.882430,0 days 00:00:00.048999,3.106998651252148,180,saga,COMPLETE
731,0.6449939949776177,2023-10-02 12:11:28.882430,2023-10-02 12:11:28.978619,0 days 00:00:00.096189,97744.83795550706,190,lbfgs,COMPLETE
732,0.5,2023-10-02 12:11:28.979623,2023-10-02 12:11:29.174518,0 days 00:00:00.194895,4.022553215972215e-05,330,saga,COMPLETE
733,0.643956763838847,2023-10-02 12:11:29.175541,2023-10-02 12:11:29.248999,0 days 00:00:00.073458,24.306896255614824,220,lbfgs,COMPLETE
734,0.6520362484987444,2023-10-02 12:11:29.249999,2023-10-02 12:11:29.334548,0 days 00:00:00.084549,394.5450440905945,210,saga,COMPLETE
735,0.5,2023-10-02 12:11:29.335541,2023-10-02 12:11:29.397686,0 days 00:00:00.062145,0.012101895656374647,310,saga,COMPLETE
736,0.5823779888634131,2023-10-02 12:11:29.398686,2023-10-02 12:11:29.460268,0 days 00:00:00.061582,1.2156102952984085,230,lbfgs,COMPLETE
737,0.6590785020198712,2023-10-02 12:11:29.460268,2023-10-02 12:11:29.545423,0 days 00:00:00.085155,4158.053469128047,200,saga,COMPLETE
738,0.6481602795064964,2023-10-02 12:11:29.545423,2023-10-02 12:11:29.635119,0 days 00:00:00.089696,2887.4731352802896,200,saga,COMPLETE
739,0.6481602795064964,2023-10-02 12:11:29.635119,2023-10-02 12:11:29.719722,0 days 00:00:00.084603,5961.8262062728545,210,saga,COMPLETE
740,0.6481602795064964,2023-10-02 12:11:29.720714,2023-10-02 12:11:29.802723,0 days 00:00:00.082009,4183.628736368858,200,saga,COMPLETE
741,0.6411180259853696,2023-10-02 12:11:29.802723,2023-10-02 12:11:29.885631,0 days 00:00:00.082908,4415.141121943643,190,saga,COMPLETE
742,0.6552025330276231,2023-10-02 12:11:29.885631,2023-10-02 12:11:29.970262,0 days 00:00:00.084631,14518.866833030275,200,saga,COMPLETE
743,0.6520362484987444,2023-10-02 12:11:29.971260,2023-10-02 12:11:30.055438,0 days 00:00:00.084178,1784.6296660528471,200,saga,COMPLETE
744,0.6481602795064964,2023-10-02 12:11:30.056439,2023-10-02 12:11:30.142534,0 days 00:00:00.086095,2638.630353461428,210,saga,COMPLETE
745,0.6481602795064964,2023-10-02 12:11:30.142534,2023-10-02 12:11:30.222146,0 days 00:00:00.079612,8306.3550306088,190,saga,COMPLETE
746,0.6481602795064964,2023-10-02 12:11:30.223147,2023-10-02 12:11:30.309104,0 days 00:00:00.085957,7223.431224332751,220,saga,COMPLETE
747,0.6449939949776177,2023-10-02 12:11:30.309104,2023-10-02 12:11:30.403107,0 days 00:00:00.094003,1153.7511447489549,260,saga,COMPLETE
748,0.6481602795064964,2023-10-02 12:11:30.403107,2023-10-02 12:11:30.486779,0 days 00:00:00.083672,50015.98308519845,200,saga,COMPLETE
749,0.5,2023-10-02 12:11:30.487778,2023-10-02 12:11:30.733464,0 days 00:00:00.245686,0.0001220114376411614,410,saga,COMPLETE
750,0.5,2023-10-02 12:11:30.734594,2023-10-02 12:11:30.785685,0 days 00:00:00.051091,0.12139813778542623,500,saga,COMPLETE
751,0.6552025330276231,2023-10-02 12:11:30.786685,2023-10-02 12:11:30.919427,0 days 00:00:00.132742,21692.966744883684,460,saga,COMPLETE
752,0.6449939949776177,2023-10-02 12:11:30.920427,2023-10-02 12:11:31.007221,0 days 00:00:00.086794,13252.428525049643,210,saga,COMPLETE
753,0.6449939949776177,2023-10-02 12:11:31.008221,2023-10-02 12:11:31.109559,0 days 00:00:00.101338,625.3603791842236,300,saga,COMPLETE
754,0.649579648433235,2023-10-02 12:11:31.110565,2023-10-02 12:11:31.175733,0 days 00:00:00.065168,243.98721675703638,430,newton-cg,COMPLETE
755,0.6337482257888415,2023-10-02 12:11:31.176716,2023-10-02 12:11:31.236380,0 days 00:00:00.059664,12.396105032244618,190,saga,COMPLETE
756,0.637951741456491,2023-10-02 12:11:31.236380,2023-10-02 12:11:31.282446,0 days 00:00:00.046066,34606.944445327004,220,liblinear,COMPLETE
757,0.6449939949776177,2023-10-02 12:11:31.283449,2023-10-02 12:11:31.418499,0 days 00:00:00.135050,4122.01725222068,470,saga,COMPLETE
758,0.649579648433235,2023-10-02 12:11:31.419499,2023-10-02 12:11:31.504606,0 days 00:00:00.085107,60.86713317346369,200,saga,COMPLETE
759,0.649579648433235,2023-10-02 12:11:31.504606,2023-10-02 12:11:31.608265,0 days 00:00:00.103659,110.17571215801978,490,saga,COMPLETE
760,0.5,2023-10-02 12:11:31.608265,2023-10-02 12:11:31.740909,0 days 00:00:00.132644,7.680334870338591e-05,190,saga,COMPLETE
761,0.6133311496888305,2023-10-02 12:11:31.740909,2023-10-02 12:11:31.805216,0 days 00:00:00.064307,7.0972723159495015,230,saga,COMPLETE
762,0.6013756960366853,2023-10-02 12:11:31.806213,2023-10-02 12:11:31.861798,0 days 00:00:00.055585,2.3149673079734416,290,saga,COMPLETE
763,0.6541653018888526,2023-10-02 12:11:31.862792,2023-10-02 12:11:31.943004,0 days 00:00:00.080212,26.40698388599789,180,saga,COMPLETE
764,0.6298722567965934,2023-10-02 12:11:31.943004,2023-10-02 12:11:32.008524,0 days 00:00:00.065520,17.512151410358513,200,saga,COMPLETE
765,0.6590785020198712,2023-10-02 12:11:32.009523,2023-10-02 12:11:32.103884,0 days 00:00:00.094361,9377.407086402418,210,saga,COMPLETE
766,0.634075772464243,2023-10-02 12:11:32.103884,2023-10-02 12:11:32.194789,0 days 00:00:00.090905,11239.826706756796,240,saga,COMPLETE
767,0.6481602795064964,2023-10-02 12:11:32.194789,2023-10-02 12:11:32.284679,0 days 00:00:00.089890,7723.873229294325,230,saga,COMPLETE
768,0.5,2023-10-02 12:11:32.284679,2023-10-02 12:11:32.410710,0 days 00:00:00.126031,0.0008627458010110002,220,saga,COMPLETE
769,0.6481602795064964,2023-10-02 12:11:32.410710,2023-10-02 12:11:32.496735,0 days 00:00:00.086025,16789.060120540926,210,saga,COMPLETE
770,0.5,2023-10-02 12:11:32.496735,2023-10-02 12:11:32.573067,0 days 00:00:00.076332,0.009176552228896191,480,saga,COMPLETE
771,0.6481602795064964,2023-10-02 12:11:32.573067,2023-10-02 12:11:32.702506,0 days 00:00:00.129439,8877.657457833182,440,saga,COMPLETE
772,0.6481602795064964,2023-10-02 12:11:32.703509,2023-10-02 12:11:32.789007,0 days 00:00:00.085498,3875.732872960279,210,saga,COMPLETE
773,0.6481602795064964,2023-10-02 12:11:32.789007,2023-10-02 12:11:32.875604,0 days 00:00:00.086597,27608.474101068583,220,saga,COMPLETE
774,0.5,2023-10-02 12:11:32.875604,2023-10-02 12:11:32.933359,0 days 00:00:00.057755,0.03147864645664894,310,saga,COMPLETE
775,0.6520362484987444,2023-10-02 12:11:32.934357,2023-10-02 12:11:33.055937,0 days 00:00:00.121580,5678.644872424141,350,saga,COMPLETE
776,0.6520362484987444,2023-10-02 12:11:33.056938,2023-10-02 12:11:33.163621,0 days 00:00:00.106683,2779.8580047605524,300,saga,COMPLETE
777,0.6520362484987444,2023-10-02 12:11:33.164626,2023-10-02 12:11:33.254822,0 days 00:00:00.090196,10770.668371143094,220,saga,COMPLETE
778,0.6481602795064964,2023-10-02 12:11:33.255822,2023-10-02 12:11:33.344068,0 days 00:00:00.088246,68378.42217727625,230,saga,COMPLETE
779,0.637951741456491,2023-10-02 12:11:33.345068,2023-10-02 12:11:33.484597,0 days 00:00:00.139529,965.6337549115378,500,saga,COMPLETE
780,0.6520362484987444,2023-10-02 12:11:33.485596,2023-10-02 12:11:33.571117,0 days 00:00:00.085521,25640.740960746698,210,saga,COMPLETE
781,0.6449939949776177,2023-10-02 12:11:33.572118,2023-10-02 12:11:33.681107,0 days 00:00:00.108989,2142.662385213264,280,saga,COMPLETE
782,0.6481602795064964,2023-10-02 12:11:33.681107,2023-10-02 12:11:33.776611,0 days 00:00:00.095504,41665.37717879671,240,saga,COMPLETE
783,0.6411180259853696,2023-10-02 12:11:33.776611,2023-10-02 12:11:33.859223,0 days 00:00:00.082612,5809.890687811637,190,saga,COMPLETE
784,0.528169014084507,2023-10-02 12:11:33.860222,2023-10-02 12:11:33.909325,0 days 00:00:00.049103,0.4107082977724059,460,saga,COMPLETE
785,0.5,2023-10-02 12:11:33.909325,2023-10-02 12:11:33.963397,0 days 00:00:00.054072,0.08382287600052461,210,newton-cg,COMPLETE
786,0.5619609127634021,2023-10-02 12:11:33.963397,2023-10-02 12:11:34.009584,0 days 00:00:00.046187,0.9560748716083063,200,liblinear,COMPLETE
787,0.6411180259853696,2023-10-02 12:11:34.010587,2023-10-02 12:11:34.144246,0 days 00:00:00.133659,17154.29714125618,450,saga,COMPLETE
788,0.637951741456491,2023-10-02 12:11:34.144246,2023-10-02 12:11:34.245883,0 days 00:00:00.101637,213.82492841678825,270,saga,COMPLETE
789,0.6069985806310733,2023-10-02 12:11:34.245883,2023-10-02 12:11:34.307983,0 days 00:00:00.062100,4.417500226557944,320,saga,COMPLETE
790,0.6418277104487389,2023-10-02 12:11:34.307983,2023-10-02 12:11:34.396166,0 days 00:00:00.088183,121.68298049910337,210,saga,COMPLETE
791,0.5,2023-10-02 12:11:34.396166,2023-10-02 12:11:34.610863,0 days 00:00:00.214697,1.7518236986787152e-05,370,saga,COMPLETE
792,0.5,2023-10-02 12:11:34.611912,2023-10-02 12:11:34.737449,0 days 00:00:00.125537,0.0012440242286756657,390,saga,COMPLETE
793,0.6418277104487389,2023-10-02 12:11:34.738446,2023-10-02 12:11:34.820545,0 days 00:00:00.082099,500.7086175515896,180,saga,COMPLETE
794,0.6534556174254831,2023-10-02 12:11:34.821581,2023-10-02 12:11:34.909221,0 days 00:00:00.087640,51.86053947290826,490,saga,COMPLETE
795,0.6552025330276231,2023-10-02 12:11:34.910229,2023-10-02 12:11:35.039393,0 days 00:00:00.129164,60505.41565118298,420,saga,COMPLETE
796,0.6267059722677149,2023-10-02 12:11:35.040399,2023-10-02 12:11:35.105500,0 days 00:00:00.065101,10.463106598559396,480,saga,COMPLETE
797,0.6481602795064964,2023-10-02 12:11:35.106507,2023-10-02 12:11:35.199703,0 days 00:00:00.093196,11495.613933348419,220,saga,COMPLETE
798,0.6277432034064855,2023-10-02 12:11:35.200705,2023-10-02 12:11:35.268325,0 days 00:00:00.067620,1617.717455132373,250,newton-cg,COMPLETE
799,0.6457036794409869,2023-10-02 12:11:35.268325,2023-10-02 12:11:35.354481,0 days 00:00:00.086156,85.02439449331618,200,saga,COMPLETE
800,0.6552025330276231,2023-10-02 12:11:35.354481,2023-10-02 12:11:35.457775,0 days 00:00:00.103294,97430.16644042704,290,saga,COMPLETE
801,0.5376678676711432,2023-10-02 12:11:35.457775,2023-10-02 12:11:35.507928,0 days 00:00:00.050153,0.595324981365559,410,liblinear,COMPLETE
802,0.6411180259853696,2023-10-02 12:11:35.507928,2023-10-02 12:11:35.593710,0 days 00:00:00.085782,19944.79583700073,190,saga,COMPLETE
803,0.5,2023-10-02 12:11:35.594707,2023-10-02 12:11:35.647777,0 days 00:00:00.053070,0.052283307398865574,230,saga,COMPLETE
