number,value,datetime_start,datetime_complete,duration,params_C,params_max_iter,params_solver,state
4060,0.6520362484987444,2023-10-02 12:22:47.353695,2023-10-02 12:22:47.620204,0 days 00:00:00.266509,38987.60479691183,450,saga,COMPLETE
4061,0.5,2023-10-02 12:22:47.635829,2023-10-02 12:22:47.902767,0 days 00:00:00.266938,0.007954997193572046,470,sag,COMPLETE
4062,0.5,2023-10-02 12:22:47.902767,2023-10-02 12:22:48.106422,0 days 00:00:00.203655,0.002599227927341818,480,lbfgs,COMPLETE
4063,0.637951741456491,2023-10-02 12:22:48.107435,2023-10-02 12:22:48.392455,0 days 00:00:00.285020,7194.589870309897,490,sag,COMPLETE
4064,0.6369145103177202,2023-10-02 12:22:48.394512,2023-10-02 12:22:48.656227,0 days 00:00:00.261715,21.50967888515539,330,sag,COMPLETE
4065,0.5619609127634021,2023-10-02 12:22:48.671872,2023-10-02 12:22:48.891778,0 days 00:00:00.219906,0.9424653441366626,480,sag,COMPLETE
4066,0.6418277104487389,2023-10-02 12:22:48.892769,2023-10-02 12:22:49.216036,0 days 00:00:00.323267,218.26883163410443,430,saga,COMPLETE
4067,0.6590785020198712,2023-10-02 12:22:49.216036,2023-10-02 12:22:49.546721,0 days 00:00:00.330685,65560.3774493243,310,sag,COMPLETE
4068,0.5,2023-10-02 12:22:49.548721,2023-10-02 12:22:50.189271,0 days 00:00:00.640550,2.9018072371404214e-05,460,sag,COMPLETE
4069,0.6449939949776177,2023-10-02 12:22:50.189271,2023-10-02 12:22:50.455900,0 days 00:00:00.266629,1271.708860331282,470,sag,COMPLETE
4070,0.6590785020198712,2023-10-02 12:22:50.471548,2023-10-02 12:22:50.816827,0 days 00:00:00.345279,19572.85110441025,490,sag,COMPLETE
4071,0.6520362484987444,2023-10-02 12:22:50.816827,2023-10-02 12:22:51.083802,0 days 00:00:00.266975,576.4869915382881,490,saga,COMPLETE
4072,0.6590785020198712,2023-10-02 12:22:51.083802,2023-10-02 12:22:51.366487,0 days 00:00:00.282685,30566.085807539428,480,sag,COMPLETE
4073,0.637951741456491,2023-10-02 12:22:51.366487,2023-10-02 12:22:51.657911,0 days 00:00:00.291424,14624.038183139515,440,newton-cg,COMPLETE
4074,0.6534556174254831,2023-10-02 12:22:51.657911,2023-10-02 12:22:51.876199,0 days 00:00:00.218288,43.66801679387847,460,sag,COMPLETE
4075,0.5,2023-10-02 12:22:51.876199,2023-10-02 12:22:52.080192,0 days 00:00:00.203993,0.0010216143147181553,470,sag,COMPLETE
4076,0.5,2023-10-02 12:22:52.080192,2023-10-02 12:22:52.349244,0 days 00:00:00.269052,3.307410650060124e-05,450,liblinear,COMPLETE
4077,0.5,2023-10-02 12:22:52.350236,2023-10-02 12:22:52.544388,0 days 00:00:00.194152,0.066127318005672,480,sag,COMPLETE
4078,0.5,2023-10-02 12:22:52.546385,2023-10-02 12:22:52.739885,0 days 00:00:00.193500,0.021587598833473717,420,saga,COMPLETE
4079,0.6520362484987444,2023-10-02 12:22:52.740885,2023-10-02 12:22:53.085151,0 days 00:00:00.344266,67859.39872898688,490,sag,COMPLETE
4080,0.6449939949776177,2023-10-02 12:22:53.085151,2023-10-02 12:22:53.351718,0 days 00:00:00.266567,99021.41109231871,400,sag,COMPLETE
4081,0.608417949557812,2023-10-02 12:22:53.351718,2023-10-02 12:22:53.540397,0 days 00:00:00.188679,3.008207106260646,480,sag,COMPLETE
4082,0.6108745496233213,2023-10-02 12:22:53.540397,2023-10-02 12:22:53.728765,0 days 00:00:00.188368,4.141997150772717,460,sag,COMPLETE
4083,0.6062888961677039,2023-10-02 12:22:53.728765,2023-10-02 12:22:54.019927,0 days 00:00:00.291162,5.594985142995778,500,sag,COMPLETE
4084,0.6449939949776177,2023-10-02 12:22:54.020927,2023-10-02 12:22:54.295894,0 days 00:00:00.274967,41282.3258013766,490,saga,COMPLETE
4085,0.5,2023-10-02 12:22:54.295894,2023-10-02 12:22:54.484378,0 days 00:00:00.188484,0.07506494779309243,470,sag,COMPLETE
4086,0.5,2023-10-02 12:22:54.484378,2023-10-02 12:22:54.766853,0 days 00:00:00.282475,0.23498676571114963,480,sag,COMPLETE
4087,0.5,2023-10-02 12:22:54.766853,2023-10-02 12:22:54.954888,0 days 00:00:00.188035,1.3826137050776341e-05,500,lbfgs,COMPLETE
4088,0.6590785020198712,2023-10-02 12:22:54.954888,2023-10-02 12:22:55.237465,0 days 00:00:00.282577,9381.33594481328,490,sag,COMPLETE
4089,0.6534556174254831,2023-10-02 12:22:55.253090,2023-10-02 12:22:55.551259,0 days 00:00:00.298169,110.3781680159074,450,sag,COMPLETE
4090,0.6481602795064964,2023-10-02 12:22:55.551259,2023-10-02 12:22:55.818137,0 days 00:00:00.266878,29687.928565356488,470,saga,COMPLETE
4091,0.6449939949776177,2023-10-02 12:22:55.833765,2023-10-02 12:22:56.085003,0 days 00:00:00.251238,18889.25315164267,360,sag,COMPLETE
4092,0.528169014084507,2023-10-02 12:22:56.085003,2023-10-02 12:22:56.336553,0 days 00:00:00.251550,0.4672095883975448,490,sag,COMPLETE
4093,0.6590785020198712,2023-10-02 12:22:56.336553,2023-10-02 12:22:56.618423,0 days 00:00:00.281870,6559.789253020252,480,sag,COMPLETE
4094,0.5,2023-10-02 12:22:56.634051,2023-10-02 12:22:56.838024,0 days 00:00:00.203973,0.003945428946192477,460,sag,COMPLETE
4095,0.6298722567965934,2023-10-02 12:22:56.839051,2023-10-02 12:22:57.154724,0 days 00:00:00.315673,14.910718124594709,440,saga,COMPLETE
4096,0.6020853805000546,2023-10-02 12:22:57.155724,2023-10-02 12:22:57.374706,0 days 00:00:00.218982,1.8385363031074116,500,sag,COMPLETE
4097,0.6520362484987444,2023-10-02 12:22:57.376704,2023-10-02 12:22:57.646449,0 days 00:00:00.269745,46875.53869351563,470,sag,COMPLETE
4098,0.6449939949776177,2023-10-02 12:22:57.662075,2023-10-02 12:22:58.021910,0 days 00:00:00.359835,13104.989339408572,490,sag,COMPLETE
4099,0.637951741456491,2023-10-02 12:22:58.021910,2023-10-02 12:22:58.243251,0 days 00:00:00.221341,25967.46340035918,380,newton-cg,COMPLETE
4100,0.5,2023-10-02 12:22:58.243251,2023-10-02 12:22:59.825470,0 days 00:00:01.582219,1.0363985070306779e-05,480,sag,COMPLETE
4101,0.5996287804345454,2023-10-02 12:22:59.825470,2023-10-02 12:23:00.152064,0 days 00:00:00.326594,1.3907942055270723,340,saga,COMPLETE
4102,0.637951741456491,2023-10-02 12:23:00.152064,2023-10-02 12:23:00.562353,0 days 00:00:00.410289,745.7622736452068,450,sag,COMPLETE
4103,0.666120755540998,2023-10-02 12:23:00.564353,2023-10-02 12:23:00.859573,0 days 00:00:00.295220,66080.28884805676,430,sag,COMPLETE
4104,0.637951741456491,2023-10-02 12:23:00.861117,2023-10-02 12:23:01.078622,0 days 00:00:00.217505,19263.068868530605,500,liblinear,COMPLETE
4105,0.6520362484987444,2023-10-02 12:23:01.078622,2023-10-02 12:23:01.515221,0 days 00:00:00.436599,9988.734208805932,490,sag,COMPLETE
4106,0.6590785020198712,2023-10-02 12:23:01.515221,2023-10-02 12:23:01.822930,0 days 00:00:00.307709,43339.27076105907,460,sag,COMPLETE
4107,0.6520362484987444,2023-10-02 12:23:01.824927,2023-10-02 12:23:02.109769,0 days 00:00:00.284842,29787.721421335395,470,sag,COMPLETE
4108,0.6520362484987444,2023-10-02 12:23:02.125289,2023-10-02 12:23:02.498733,0 days 00:00:00.373444,7300.083883830184,480,saga,COMPLETE
4109,0.5211267605633803,2023-10-02 12:23:02.500733,2023-10-02 12:23:02.716216,0 days 00:00:00.215483,0.3685312099879104,500,sag,COMPLETE
4110,0.6013756960366853,2023-10-02 12:23:02.717215,2023-10-02 12:23:02.921442,0 days 00:00:00.204227,2.484888303475644,490,sag,COMPLETE
4111,0.5,2023-10-02 12:23:02.922442,2023-10-02 12:23:03.207542,0 days 00:00:00.285100,0.04023109407457828,440,sag,COMPLETE
4112,0.5,2023-10-02 12:23:03.207542,2023-10-02 12:23:03.521022,0 days 00:00:00.313480,9.595273841397706e-05,480,sag,COMPLETE
4113,0.6369145103177202,2023-10-02 12:23:03.523031,2023-10-02 12:23:03.765616,0 days 00:00:00.242585,19.87155623486761,370,saga,COMPLETE
4114,0.6449939949776177,2023-10-02 12:23:03.767184,2023-10-02 12:23:04.129727,0 days 00:00:00.362543,66625.12834370308,460,sag,COMPLETE
4115,0.637951741456491,2023-10-02 12:23:04.129727,2023-10-02 12:23:04.382263,0 days 00:00:00.252536,13455.506110910963,490,lbfgs,COMPLETE
4116,0.66224478654875,2023-10-02 12:23:04.382263,2023-10-02 12:23:04.680390,0 days 00:00:00.298127,22382.745431923355,470,sag,COMPLETE
4117,0.6590785020198712,2023-10-02 12:23:04.696034,2023-10-02 12:23:05.056192,0 days 00:00:00.360158,42603.3618523139,500,sag,COMPLETE
4118,0.6520362484987444,2023-10-02 12:23:05.056192,2023-10-02 12:23:05.350829,0 days 00:00:00.294637,99686.96562639566,450,sag,COMPLETE
4119,0.6520362484987444,2023-10-02 12:23:05.351830,2023-10-02 12:23:05.654945,0 days 00:00:00.303115,32028.8256652145,480,saga,COMPLETE
4120,0.6418277104487389,2023-10-02 12:23:05.654945,2023-10-02 12:23:05.991853,0 days 00:00:00.336908,326.11112969348585,320,sag,COMPLETE
4121,0.6559122174909924,2023-10-02 12:23:05.993856,2023-10-02 12:23:06.260530,0 days 00:00:00.266674,17582.712153678374,460,sag,COMPLETE
4122,0.649579648433235,2023-10-02 12:23:06.260530,2023-10-02 12:23:06.491865,0 days 00:00:00.231335,147.147512760874,490,sag,COMPLETE
4123,0.6590785020198712,2023-10-02 12:23:06.491865,2023-10-02 12:23:06.852367,0 days 00:00:00.360502,67488.98701943991,470,sag,COMPLETE
4124,0.637951741456491,2023-10-02 12:23:06.852367,2023-10-02 12:23:07.144766,0 days 00:00:00.292399,1488.3131201204228,500,sag,COMPLETE
4125,0.619663718746588,2023-10-02 12:23:07.144766,2023-10-02 12:23:07.371248,0 days 00:00:00.226482,9.615899618952906,480,newton-cg,COMPLETE
4126,0.6520362484987444,2023-10-02 12:23:07.372248,2023-10-02 12:23:07.656864,0 days 00:00:00.284616,9598.904477276934,490,saga,COMPLETE
4127,0.6520362484987444,2023-10-02 12:23:07.656864,2023-10-02 12:23:08.081039,0 days 00:00:00.424175,46204.02554701493,480,sag,COMPLETE
4128,0.6534556174254831,2023-10-02 12:23:08.083188,2023-10-02 12:23:08.358602,0 days 00:00:00.275414,63.55683538275564,490,sag,COMPLETE
4129,0.6481602795064964,2023-10-02 12:23:08.359596,2023-10-02 12:23:08.749892,0 days 00:00:00.390296,6300.307034565898,450,sag,COMPLETE
4130,0.637951741456491,2023-10-02 12:23:08.750893,2023-10-02 12:23:09.102053,0 days 00:00:00.351160,99988.63101426067,500,liblinear,COMPLETE
4131,0.5313352986133857,2023-10-02 12:23:09.103052,2023-10-02 12:23:09.403162,0 days 00:00:00.300110,0.5404956715419557,300,sag,COMPLETE
4132,0.5925865269134185,2023-10-02 12:23:09.404165,2023-10-02 12:23:09.671674,0 days 00:00:00.267509,1.3426328220801667,470,saga,COMPLETE
4133,0.6418277104487389,2023-10-02 12:23:09.680542,2023-10-02 12:23:10.118297,0 days 00:00:00.437755,391.9606132650439,480,sag,COMPLETE
4134,0.666120755540998,2023-10-02 12:23:10.120307,2023-10-02 12:23:10.487809,0 days 00:00:00.367502,23488.125928105437,500,sag,COMPLETE
4135,0.6590785020198712,2023-10-02 12:23:10.489812,2023-10-02 12:23:10.792469,0 days 00:00:00.302657,14669.639474389316,460,sag,COMPLETE
4136,0.6534556174254831,2023-10-02 12:23:10.793753,2023-10-02 12:23:11.100311,0 days 00:00:00.306558,91.28090483156589,440,sag,COMPLETE
4137,0.5,2023-10-02 12:23:11.100311,2023-10-02 12:23:11.335553,0 days 00:00:00.235242,0.00917470316418061,490,saga,COMPLETE
4138,0.5,2023-10-02 12:23:11.335553,2023-10-02 12:23:11.555191,0 days 00:00:00.219638,0.0005339095194771067,470,sag,COMPLETE
4139,0.5,2023-10-02 12:23:11.555191,2023-10-02 12:23:11.857551,0 days 00:00:00.302360,0.13875559873299442,350,sag,COMPLETE
4140,0.6590785020198712,2023-10-02 12:23:11.859396,2023-10-02 12:23:12.139222,0 days 00:00:00.279826,31190.539470559637,390,sag,COMPLETE
4141,0.6590785020198712,2023-10-02 12:23:12.140212,2023-10-02 12:23:12.439789,0 days 00:00:00.299577,99207.93403542615,480,sag,COMPLETE
4142,0.6590785020198712,2023-10-02 12:23:12.440788,2023-10-02 12:23:12.807742,0 days 00:00:00.366954,50397.16374091388,500,saga,COMPLETE
4143,0.649579648433235,2023-10-02 12:23:12.808742,2023-10-02 12:23:13.198734,0 days 00:00:00.389992,186.87659180427235,450,lbfgs,COMPLETE
4144,0.6590785020198712,2023-10-02 12:23:13.200732,2023-10-02 12:23:13.646216,0 days 00:00:00.445484,11709.239731294907,490,sag,COMPLETE
4145,0.6520362484987444,2023-10-02 12:23:13.647790,2023-10-02 12:23:14.156301,0 days 00:00:00.508511,23926.213645773096,470,sag,COMPLETE
4146,0.666120755540998,2023-10-02 12:23:14.157303,2023-10-02 12:23:14.459884,0 days 00:00:00.302581,5852.734017444467,460,sag,COMPLETE
4147,0.6449939949776177,2023-10-02 12:23:14.460889,2023-10-02 12:23:14.769084,0 days 00:00:00.308195,889.958968081351,480,sag,COMPLETE
4148,0.6520362484987444,2023-10-02 12:23:14.771079,2023-10-02 12:23:15.031649,0 days 00:00:00.260570,50801.45011974149,410,sag,COMPLETE
4149,0.6411180259853696,2023-10-02 12:23:15.047169,2023-10-02 12:23:15.423185,0 days 00:00:00.376016,99720.87316148987,490,saga,COMPLETE
4150,0.6520362484987444,2023-10-02 12:23:15.423185,2023-10-02 12:23:15.705725,0 days 00:00:00.282540,34379.292468606094,420,sag,COMPLETE
4151,0.643956763838847,2023-10-02 12:23:15.705725,2023-10-02 12:23:15.925342,0 days 00:00:00.219617,27.434934081011786,500,newton-cg,COMPLETE
4152,0.6590785020198712,2023-10-02 12:23:15.925342,2023-10-02 12:23:16.287510,0 days 00:00:00.362168,15998.3734787637,430,sag,COMPLETE
4153,0.6534556174254831,2023-10-02 12:23:16.289015,2023-10-02 12:23:16.506887,0 days 00:00:00.217872,47.65430123195217,480,sag,COMPLETE
4154,0.5,2023-10-02 12:23:16.506887,2023-10-02 12:23:16.715657,0 days 00:00:00.208770,0.09094577139167072,330,liblinear,COMPLETE
4155,0.6133311496888305,2023-10-02 12:23:16.715657,2023-10-02 12:23:17.027141,0 days 00:00:00.311484,6.863838388051953,470,sag,COMPLETE
4156,0.5,2023-10-02 12:23:17.029140,2023-10-02 12:23:17.343716,0 days 00:00:00.314576,0.00045836514791730787,270,saga,COMPLETE
4157,0.6520362484987444,2023-10-02 12:23:17.344710,2023-10-02 12:23:17.620288,0 days 00:00:00.275578,1567.673241414609,460,sag,COMPLETE
4158,0.6418277104487389,2023-10-02 12:23:17.622285,2023-10-02 12:23:17.976057,0 days 00:00:00.353772,467.05257304219856,490,sag,COMPLETE
4159,0.6541653018888526,2023-10-02 12:23:17.978057,2023-10-02 12:23:18.186569,0 days 00:00:00.208512,32.583616938497904,440,sag,COMPLETE
4160,0.6590785020198712,2023-10-02 12:23:18.188569,2023-10-02 12:23:18.469205,0 days 00:00:00.280636,65360.94975080894,500,sag,COMPLETE
4161,0.5,2023-10-02 12:23:18.471201,2023-10-02 12:23:18.743389,0 days 00:00:00.272188,0.28019006563530197,450,saga,COMPLETE
4162,0.6590785020198712,2023-10-02 12:23:18.744387,2023-10-02 12:23:19.024176,0 days 00:00:00.279789,8953.501169209563,480,sag,COMPLETE
4163,0.66224478654875,2023-10-02 12:23:19.025172,2023-10-02 12:23:19.303890,0 days 00:00:00.278718,20827.655477811728,470,sag,COMPLETE
4164,0.5855442733922918,2023-10-02 12:23:19.303890,2023-10-02 12:23:19.605136,0 days 00:00:00.301246,1.2916696087232156,490,sag,COMPLETE
4165,0.6520362484987444,2023-10-02 12:23:19.605704,2023-10-02 12:23:19.883783,0 days 00:00:00.278079,34481.571618164955,340,sag,COMPLETE
4166,0.5,2023-10-02 12:23:19.885794,2023-10-02 12:23:20.101341,0 days 00:00:00.215547,0.0011867051394909044,500,lbfgs,COMPLETE
4167,0.6411180259853696,2023-10-02 12:23:20.101341,2023-10-02 12:23:20.484986,0 days 00:00:00.383645,6151.316991173789,490,saga,COMPLETE
4168,0.5,2023-10-02 12:23:20.485979,2023-10-02 12:23:20.679363,0 days 00:00:00.193384,0.1605369188404947,470,sag,COMPLETE
4169,0.66224478654875,2023-10-02 12:23:20.680363,2023-10-02 12:23:20.965972,0 days 00:00:00.285609,44604.416119171634,480,sag,COMPLETE
4170,0.5,2023-10-02 12:23:20.965972,2023-10-02 12:23:21.843708,0 days 00:00:00.877736,2.1835837604670353e-05,490,sag,COMPLETE
4171,0.5,2023-10-02 12:23:21.844704,2023-10-02 12:23:22.195442,0 days 00:00:00.350738,8.463927443372528e-05,480,sag,COMPLETE
4172,0.6590785020198712,2023-10-02 12:23:22.196448,2023-10-02 12:23:22.472513,0 days 00:00:00.276065,14501.199073110462,460,sag,COMPLETE
4173,0.6481602795064964,2023-10-02 12:23:22.473523,2023-10-02 12:23:22.735091,0 days 00:00:00.261568,24835.82565568883,360,saga,COMPLETE
4174,0.666120755540998,2023-10-02 12:23:22.736096,2023-10-02 12:23:23.116583,0 days 00:00:00.380487,66889.767777276,500,sag,COMPLETE
4175,0.5,2023-10-02 12:23:23.118377,2023-10-02 12:23:23.402465,0 days 00:00:00.284088,0.00011424193123889038,450,sag,COMPLETE
4176,0.6590785020198712,2023-10-02 12:23:23.402465,2023-10-02 12:23:23.706812,0 days 00:00:00.304347,10458.029779960332,470,sag,COMPLETE
4177,0.637951741456491,2023-10-02 12:23:23.708812,2023-10-02 12:23:24.004076,0 days 00:00:00.295264,34547.718277672175,440,newton-cg,COMPLETE
4178,0.5,2023-10-02 12:23:24.006072,2023-10-02 12:23:24.232327,0 days 00:00:00.226255,0.020284717755909093,490,sag,COMPLETE
4179,0.5,2023-10-02 12:23:24.234323,2023-10-02 12:23:24.580908,0 days 00:00:00.346585,0.0002454564283864368,460,saga,COMPLETE
4180,0.5,2023-10-02 12:23:24.581908,2023-10-02 12:23:24.861487,0 days 00:00:00.279579,0.0022990733821939917,480,liblinear,COMPLETE
4181,0.6418277104487389,2023-10-02 12:23:24.862488,2023-10-02 12:23:25.152044,0 days 00:00:00.289556,478.71993575471015,500,sag,COMPLETE
4182,0.6069985806310733,2023-10-02 12:23:25.153045,2023-10-02 12:23:25.355089,0 days 00:00:00.202044,4.466057314785757,480,sag,COMPLETE
4183,0.6559122174909924,2023-10-02 12:23:25.356089,2023-10-02 12:23:25.734206,0 days 00:00:00.378117,18955.787525494998,490,sag,COMPLETE
4184,0.6590785020198712,2023-10-02 12:23:25.735200,2023-10-02 12:23:26.047791,0 days 00:00:00.312591,65991.44993544431,460,sag,COMPLETE
4185,0.6481602795064964,2023-10-02 12:23:26.048791,2023-10-02 12:23:26.338361,0 days 00:00:00.289570,41539.67286700068,500,saga,COMPLETE
4186,0.6559122174909924,2023-10-02 12:23:26.340360,2023-10-02 12:23:26.727417,0 days 00:00:00.387057,10504.39424636819,430,sag,COMPLETE
4187,0.6449939949776177,2023-10-02 12:23:26.728417,2023-10-02 12:23:27.008058,0 days 00:00:00.279641,24991.23114311163,450,sag,COMPLETE
4188,0.6442843105142483,2023-10-02 12:23:27.009049,2023-10-02 12:23:27.290744,0 days 00:00:00.281695,99323.27539959604,470,sag,COMPLETE
4189,0.6590785020198712,2023-10-02 12:23:27.291744,2023-10-02 12:23:27.679860,0 days 00:00:00.388116,16067.1695183178,490,sag,COMPLETE
4190,0.5,2023-10-02 12:23:27.681858,2023-10-02 12:23:27.889898,0 days 00:00:00.208040,0.0419431076149805,380,lbfgs,COMPLETE
4191,0.6520362484987444,2023-10-02 12:23:27.890898,2023-10-02 12:23:28.280435,0 days 00:00:00.389537,43433.51472860137,480,sag,COMPLETE
4192,0.6520362484987444,2023-10-02 12:23:28.281435,2023-10-02 12:23:28.574002,0 days 00:00:00.292567,5854.40427513978,500,saga,COMPLETE
4193,0.6534556174254831,2023-10-02 12:23:28.575002,2023-10-02 12:23:28.828570,0 days 00:00:00.253568,107.10755734257002,370,sag,COMPLETE
4194,0.637951741456491,2023-10-02 12:23:28.830565,2023-10-02 12:23:29.206652,0 days 00:00:00.376087,27525.249021517786,470,sag,COMPLETE
4195,0.6520362484987444,2023-10-02 12:23:29.208648,2023-10-02 12:23:29.490710,0 days 00:00:00.282062,60898.99872249201,400,sag,COMPLETE
4196,0.5,2023-10-02 12:23:29.491708,2023-10-02 12:23:29.726289,0 days 00:00:00.234581,0.0002910617175902823,490,sag,COMPLETE
4197,0.6449939949776177,2023-10-02 12:23:29.727289,2023-10-02 12:23:30.117169,0 days 00:00:00.389880,1675.5508392120314,480,saga,COMPLETE
4198,0.637951741456491,2023-10-02 12:23:30.119168,2023-10-02 12:23:30.434764,0 days 00:00:00.315596,788.5453451803938,440,sag,COMPLETE
4199,0.666120755540998,2023-10-02 12:23:30.436763,2023-10-02 12:23:30.766744,0 days 00:00:00.329981,9223.259962225755,460,sag,COMPLETE
4200,0.666120755540998,2023-10-02 12:23:30.768744,2023-10-02 12:23:31.152096,0 days 00:00:00.383352,17157.50695582014,490,sag,COMPLETE
4201,0.6552025330276231,2023-10-02 12:23:31.154102,2023-10-02 12:23:31.438689,0 days 00:00:00.284587,99782.95612217078,500,sag,COMPLETE
4202,0.637951741456491,2023-10-02 12:23:31.440682,2023-10-02 12:23:31.689771,0 days 00:00:00.249089,33215.979678901545,470,newton-cg,COMPLETE
4203,0.5,2023-10-02 12:23:31.691765,2023-10-02 12:23:31.984354,0 days 00:00:00.292589,0.01232256084357343,450,saga,COMPLETE
4204,0.5,2023-10-02 12:23:31.986344,2023-10-02 12:23:32.664384,0 days 00:00:00.678040,2.800526500364957e-05,480,sag,COMPLETE
4205,0.5,2023-10-02 12:23:32.665377,2023-10-02 12:23:32.863061,0 days 00:00:00.197684,0.0724411411773585,490,sag,COMPLETE
4206,0.5,2023-10-02 12:23:32.863061,2023-10-02 12:23:33.178413,0 days 00:00:00.315352,0.017970712385015967,500,liblinear,COMPLETE
4207,0.5,2023-10-02 12:23:33.180409,2023-10-02 12:23:33.406570,0 days 00:00:00.226161,0.00033853804691540254,470,sag,COMPLETE
4208,0.6449939949776177,2023-10-02 12:23:33.408561,2023-10-02 12:23:33.715159,0 days 00:00:00.306598,6202.597244734019,460,sag,COMPLETE
4209,0.6481602795064964,2023-10-02 12:23:33.717158,2023-10-02 12:23:34.084765,0 days 00:00:00.367607,49934.63131118362,480,saga,COMPLETE
4210,0.6520362484987444,2023-10-02 12:23:34.085772,2023-10-02 12:23:34.379349,0 days 00:00:00.293577,23682.360138073203,490,sag,COMPLETE
4211,0.6590785020198712,2023-10-02 12:23:34.381344,2023-10-02 12:23:34.668931,0 days 00:00:00.287587,13538.523944507817,450,sag,COMPLETE
4212,0.5,2023-10-02 12:23:34.669931,2023-10-02 12:23:34.975493,0 days 00:00:00.305562,0.006538181655463433,500,sag,COMPLETE
4213,0.6298722567965934,2023-10-02 12:23:34.977493,2023-10-02 12:23:35.197558,0 days 00:00:00.220065,18.031456540120878,480,sag,COMPLETE
4214,0.6337482257888415,2023-10-02 12:23:35.198557,2023-10-02 12:23:35.406124,0 days 00:00:00.207567,14.021683325325206,490,sag,COMPLETE
4215,0.528169014084507,2023-10-02 12:23:35.407131,2023-10-02 12:23:35.695192,0 days 00:00:00.288061,0.44111005083332067,470,saga,COMPLETE
4216,0.6077082650944426,2023-10-02 12:23:35.696192,2023-10-02 12:23:35.890255,0 days 00:00:00.194063,3.7130754340568695,480,sag,COMPLETE
4217,0.6481602795064964,2023-10-02 12:23:35.891248,2023-10-02 12:23:36.164273,0 days 00:00:00.273025,64855.469316817806,320,sag,COMPLETE
4218,0.6590785020198712,2023-10-02 12:23:36.165268,2023-10-02 12:23:36.510407,0 days 00:00:00.345139,31760.422393153032,340,sag,COMPLETE
4219,0.5,2023-10-02 12:23:36.512408,2023-10-02 12:23:36.720451,0 days 00:00:00.208043,0.1235655395721772,500,sag,COMPLETE
4220,0.637951741456491,2023-10-02 12:23:36.721451,2023-10-02 12:23:36.968497,0 days 00:00:00.247046,17511.651953195887,460,lbfgs,COMPLETE
4221,0.5,2023-10-02 12:23:36.970497,2023-10-02 12:23:37.288077,0 days 00:00:00.317580,0.00245042746528654,150,saga,COMPLETE
4222,0.6267059722677149,2023-10-02 12:23:37.290101,2023-10-02 12:23:37.518728,0 days 00:00:00.228627,10.904168401845862,490,sag,COMPLETE
