number,value,datetime_start,datetime_complete,duration,params_C,params_max_iter,params_solver,state
7482,0.637951741456491,2023-10-02 12:45:34.935712,2023-10-02 12:45:35.338150,0 days 00:00:00.402438,98923.40015949392,450,lbfgs,COMPLETE
7483,0.6590785020198712,2023-10-02 12:45:35.340150,2023-10-02 12:45:35.878099,0 days 00:00:00.537949,48947.4345641475,500,sag,COMPLETE
7484,0.6629544710121192,2023-10-02 12:45:35.880106,2023-10-02 12:45:36.396976,0 days 00:00:00.516870,2196.3509622815504,350,sag,COMPLETE
7485,0.6534556174254831,2023-10-02 12:45:36.398976,2023-10-02 12:45:36.788168,0 days 00:00:00.389192,87.90328464110205,490,sag,COMPLETE
7486,0.6541653018888526,2023-10-02 12:45:36.790168,2023-10-02 12:45:37.256528,0 days 00:00:00.466360,31.632576103196534,360,sag,COMPLETE
7487,0.666120755540998,2023-10-02 12:45:37.258528,2023-10-02 12:45:37.792469,0 days 00:00:00.533941,99703.54539889481,480,sag,COMPLETE
7488,0.6069985806310733,2023-10-02 12:45:37.794978,2023-10-02 12:45:38.161569,0 days 00:00:00.366591,4.730754103106877,470,sag,COMPLETE
7489,0.6369145103177202,2023-10-02 12:45:38.163569,2023-10-02 12:45:38.623877,0 days 00:00:00.460308,22.780499822617102,370,sag,COMPLETE
7490,0.608417949557812,2023-10-02 12:45:38.625879,2023-10-02 12:45:39.078883,0 days 00:00:00.453004,3.0844280884199704,470,sag,COMPLETE
7491,0.5,2023-10-02 12:45:39.080891,2023-10-02 12:45:39.566703,0 days 00:00:00.485812,8.391898175232657e-05,430,sag,COMPLETE
7492,0.6552025330276231,2023-10-02 12:45:39.569827,2023-10-02 12:45:40.110464,0 days 00:00:00.540637,7819.224472171434,500,sag,COMPLETE
7493,0.66224478654875,2023-10-02 12:45:40.112531,2023-10-02 12:45:40.647663,0 days 00:00:00.535132,20661.677708097508,490,sag,COMPLETE
7494,0.6277432034064855,2023-10-02 12:45:40.649664,2023-10-02 12:45:41.034088,0 days 00:00:00.384424,1059.4468606690452,410,newton-cg,COMPLETE
7495,0.6590785020198712,2023-10-02 12:45:41.036087,2023-10-02 12:45:41.574358,0 days 00:00:00.538271,4094.6188975429754,460,sag,COMPLETE
7496,0.6520362484987444,2023-10-02 12:45:41.576356,2023-10-02 12:45:42.056824,0 days 00:00:00.480468,34749.17855978556,440,sag,COMPLETE
7497,0.637951741456491,2023-10-02 12:45:42.058857,2023-10-02 12:45:42.505040,0 days 00:00:00.446183,52639.75354650866,340,liblinear,COMPLETE
7498,0.5,2023-10-02 12:45:42.507079,2023-10-02 12:45:43.649146,0 days 00:00:01.142067,1.563538069575388e-05,400,sag,COMPLETE
7499,0.6457036794409869,2023-10-02 12:45:43.652218,2023-10-02 12:45:44.066062,0 days 00:00:00.413844,173.13770183811647,370,sag,COMPLETE
7500,0.6520362484987444,2023-10-02 12:45:44.068065,2023-10-02 12:45:44.585434,0 days 00:00:00.517369,15206.812653109077,390,sag,COMPLETE
7501,0.666120755540998,2023-10-02 12:45:44.587583,2023-10-02 12:45:45.133230,0 days 00:00:00.545647,29229.52819210913,480,sag,COMPLETE
7502,0.5,2023-10-02 12:45:45.136294,2023-10-02 12:45:45.506999,0 days 00:00:00.370705,0.04814533346333083,230,sag,COMPLETE
7503,0.6520362484987444,2023-10-02 12:45:45.509998,2023-10-02 12:45:46.026604,0 days 00:00:00.516606,10676.587531511364,360,sag,COMPLETE
7504,0.5,2023-10-02 12:45:46.028607,2023-10-02 12:45:46.542129,0 days 00:00:00.513522,0.002031445813939588,500,sag,COMPLETE
7505,0.6267059722677149,2023-10-02 12:45:46.544130,2023-10-02 12:45:46.913787,0 days 00:00:00.369657,11.556284068128209,490,sag,COMPLETE
7506,0.6020853805000546,2023-10-02 12:45:46.915787,2023-10-02 12:45:47.367404,0 days 00:00:00.451617,1.825666679763855,460,sag,COMPLETE
7507,0.637951741456491,2023-10-02 12:45:47.369402,2023-10-02 12:45:47.849565,0 days 00:00:00.480163,99947.56816085253,350,lbfgs,COMPLETE
7508,0.6481602795064964,2023-10-02 12:45:47.851564,2023-10-02 12:45:48.260594,0 days 00:00:00.409030,4813.948687052815,310,sag,COMPLETE
7509,0.6590785020198712,2023-10-02 12:45:48.263593,2023-10-02 12:45:48.800875,0 days 00:00:00.537282,46023.766039662834,480,sag,COMPLETE
7510,0.6449939949776177,2023-10-02 12:45:48.802879,2023-10-02 12:45:49.364377,0 days 00:00:00.561498,2667.9592616869645,490,sag,COMPLETE
7511,0.5,2023-10-02 12:45:49.366377,2023-10-02 12:45:49.761489,0 days 00:00:00.395112,0.0005505645102292522,330,sag,COMPLETE
7512,0.6590785020198712,2023-10-02 12:45:49.763483,2023-10-02 12:45:50.303774,0 days 00:00:00.540291,20585.19225671096,450,sag,COMPLETE
7513,0.6590785020198712,2023-10-02 12:45:50.306291,2023-10-02 12:45:50.835066,0 days 00:00:00.528775,7956.582726038454,380,sag,COMPLETE
7514,0.649579648433235,2023-10-02 12:45:50.837074,2023-10-02 12:45:51.260221,0 days 00:00:00.423147,140.7687930527904,500,sag,COMPLETE
7515,0.669996724533246,2023-10-02 12:45:51.262219,2023-10-02 12:45:51.791887,0 days 00:00:00.529668,1777.448335359481,300,sag,COMPLETE
7516,0.6629544710121192,2023-10-02 12:45:51.794889,2023-10-02 12:45:52.333044,0 days 00:00:00.538155,59699.87353498739,430,sag,COMPLETE
7517,0.6481602795064964,2023-10-02 12:45:52.336044,2023-10-02 12:45:52.794160,0 days 00:00:00.458116,35320.371525620685,320,sag,COMPLETE
7518,0.637951741456491,2023-10-02 12:45:52.797154,2023-10-02 12:45:53.316304,0 days 00:00:00.519150,743.0922142357931,340,sag,COMPLETE
7519,0.5,2023-10-02 12:45:53.318303,2023-10-02 12:45:53.785429,0 days 00:00:00.467126,0.004620619854347934,470,newton-cg,COMPLETE
7520,0.6449939949776177,2023-10-02 12:45:53.787429,2023-10-02 12:45:54.220055,0 days 00:00:00.432626,13964.809926414358,360,sag,COMPLETE
7521,0.5,2023-10-02 12:45:54.222059,2023-10-02 12:45:54.691210,0 days 00:00:00.469151,0.010211413290445368,480,sag,COMPLETE
7522,0.6369145103177202,2023-10-02 12:45:54.693225,2023-10-02 12:45:55.154834,0 days 00:00:00.461609,22.358651634879394,500,liblinear,COMPLETE
7523,0.6449939949776177,2023-10-02 12:45:55.156834,2023-10-02 12:45:55.612078,0 days 00:00:00.455244,5627.216452628479,440,sag,COMPLETE
7524,0.6481602795064964,2023-10-02 12:45:55.614071,2023-10-02 12:45:56.185260,0 days 00:00:00.571189,21026.490183014375,460,sag,COMPLETE
7525,0.6590785020198712,2023-10-02 12:45:56.187256,2023-10-02 12:45:56.725419,0 days 00:00:00.538163,69108.10431014933,350,sag,COMPLETE
7526,0.6520362484987444,2023-10-02 12:45:56.727418,2023-10-02 12:45:57.199535,0 days 00:00:00.472117,34715.6152881743,480,sag,COMPLETE
7527,0.6520362484987444,2023-10-02 12:45:57.201535,2023-10-02 12:45:57.757218,0 days 00:00:00.555683,3504.917773116139,490,sag,COMPLETE
7528,0.6534556174254831,2023-10-02 12:45:57.761212,2023-10-02 12:45:58.248852,0 days 00:00:00.487640,72.63660076734763,380,sag,COMPLETE
7529,0.6418277104487389,2023-10-02 12:45:58.250860,2023-10-02 12:45:58.678497,0 days 00:00:00.427637,468.4212875888359,370,sag,COMPLETE
7530,0.6449939949776177,2023-10-02 12:45:58.680504,2023-10-02 12:45:59.238643,0 days 00:00:00.558139,9807.413199880635,470,sag,COMPLETE
7531,0.5690031662845288,2023-10-02 12:45:59.240643,2023-10-02 12:45:59.645273,0 days 00:00:00.404630,1.040294611611674,450,sag,COMPLETE
7532,0.637951741456491,2023-10-02 12:45:59.648273,2023-10-02 12:46:00.201936,0 days 00:00:00.553663,65056.97363473529,500,lbfgs,COMPLETE
7533,0.5,2023-10-02 12:46:00.204928,2023-10-02 12:46:00.687107,0 days 00:00:00.482179,0.0011158217236783812,490,sag,COMPLETE
7534,0.5,2023-10-02 12:46:00.690107,2023-10-02 12:46:01.095219,0 days 00:00:00.405112,0.00028161365221077427,480,sag,COMPLETE
7535,0.5,2023-10-02 12:46:01.097220,2023-10-02 12:46:01.795441,0 days 00:00:00.698221,5.151348525791963e-05,340,sag,COMPLETE
7536,0.5,2023-10-02 12:46:01.798449,2023-10-02 12:46:02.267048,0 days 00:00:00.468599,0.12198761330627382,490,sag,COMPLETE
7537,0.608417949557812,2023-10-02 12:46:02.270047,2023-10-02 12:46:02.647152,0 days 00:00:00.377105,2.5695009993093927,360,sag,COMPLETE
7538,0.5,2023-10-02 12:46:02.649155,2023-10-02 12:46:03.138312,0 days 00:00:00.489157,0.0031145726351446195,460,sag,COMPLETE
7539,0.6520362484987444,2023-10-02 12:46:03.140307,2023-10-02 12:46:03.689928,0 days 00:00:00.549621,99448.51697375032,420,sag,COMPLETE
7540,0.6449939949776177,2023-10-02 12:46:03.691929,2023-10-02 12:46:04.154577,0 days 00:00:00.462648,1556.8675183861005,500,sag,COMPLETE
7541,0.5,2023-10-02 12:46:04.156576,2023-10-02 12:46:04.693185,0 days 00:00:00.536609,0.00013139710203163087,350,sag,COMPLETE
7542,0.528169014084507,2023-10-02 12:46:04.695201,2023-10-02 12:46:05.176366,0 days 00:00:00.481165,0.414876134129647,480,sag,COMPLETE
7543,0.6203734032099574,2023-10-02 12:46:05.178375,2023-10-02 12:46:05.558476,0 days 00:00:00.380101,7.684527794886078,470,sag,COMPLETE
7544,0.666120755540998,2023-10-02 12:46:05.561476,2023-10-02 12:46:06.115613,0 days 00:00:00.554137,28502.249388166292,440,sag,COMPLETE
7545,0.6449939949776177,2023-10-02 12:46:06.118620,2023-10-02 12:46:06.605726,0 days 00:00:00.487106,47639.829929828644,370,newton-cg,COMPLETE
7546,0.6502893328966044,2023-10-02 12:46:06.607735,2023-10-02 12:46:06.997832,0 days 00:00:00.390097,34.25884239188258,490,sag,COMPLETE
7547,0.637951741456491,2023-10-02 12:46:07.000833,2023-10-02 12:46:07.482515,0 days 00:00:00.481682,16485.912271726873,450,liblinear,COMPLETE
7548,0.6552025330276231,2023-10-02 12:46:07.484520,2023-10-02 12:46:08.066245,0 days 00:00:00.581725,7388.504496910213,500,sag,COMPLETE
7549,0.6520362484987444,2023-10-02 12:46:08.068251,2023-10-02 12:46:08.537854,0 days 00:00:00.469603,3217.9009683578824,360,sag,COMPLETE
7550,0.6629544710121192,2023-10-02 12:46:08.540854,2023-10-02 12:46:09.059137,0 days 00:00:00.518283,23482.513764693012,330,sag,COMPLETE
7551,0.666120755540998,2023-10-02 12:46:09.061130,2023-10-02 12:46:09.591963,0 days 00:00:00.530833,12303.497744123239,390,sag,COMPLETE
7552,0.5,2023-10-02 12:46:09.593968,2023-10-02 12:46:10.456280,0 days 00:00:00.862312,2.496529327206091e-05,470,sag,COMPLETE
7553,0.6520362484987444,2023-10-02 12:46:10.459279,2023-10-02 12:46:11.011437,0 days 00:00:00.552158,46768.935916172,490,sag,COMPLETE
7554,0.6520362484987444,2023-10-02 12:46:11.014445,2023-10-02 12:46:11.548066,0 days 00:00:00.533621,5495.355466823039,380,sag,COMPLETE
7555,0.5,2023-10-02 12:46:11.550066,2023-10-02 12:46:11.937802,0 days 00:00:00.387736,0.007115931474300664,500,sag,COMPLETE
7556,0.6520362484987444,2023-10-02 12:46:11.939801,2023-10-02 12:46:12.457958,0 days 00:00:00.518157,33083.01357835677,330,sag,COMPLETE
7557,0.6337482257888415,2023-10-02 12:46:12.459952,2023-10-02 12:46:12.931573,0 days 00:00:00.471621,14.001560723472604,480,sag,COMPLETE
7558,0.6552025330276231,2023-10-02 12:46:12.933567,2023-10-02 12:46:13.389669,0 days 00:00:00.456102,99914.37387456642,430,sag,COMPLETE
7559,0.637951741456491,2023-10-02 12:46:13.392670,2023-10-02 12:46:13.923829,0 days 00:00:00.531159,16399.193676651714,320,lbfgs,COMPLETE
7560,0.5,2023-10-02 12:46:13.925821,2023-10-02 12:46:14.404535,0 days 00:00:00.478714,0.27364854566703783,350,sag,COMPLETE
7561,0.6520362484987444,2023-10-02 12:46:14.406535,2023-10-02 12:46:14.855161,0 days 00:00:00.448626,9921.589362831624,410,sag,COMPLETE
7562,0.649579648433235,2023-10-02 12:46:14.858160,2023-10-02 12:46:15.380740,0 days 00:00:00.522580,134.22444402072603,460,sag,COMPLETE
7563,0.6590785020198712,2023-10-02 12:46:15.382741,2023-10-02 12:46:15.939002,0 days 00:00:00.556261,48727.37114403667,490,sag,COMPLETE
7564,0.6449939949776177,2023-10-02 12:46:15.941002,2023-10-02 12:46:16.407730,0 days 00:00:00.466728,2435.846485929521,480,sag,COMPLETE
7565,0.6520362484987444,2023-10-02 12:46:16.410730,2023-10-02 12:46:16.950899,0 days 00:00:00.540169,66341.56170193435,340,sag,COMPLETE
7566,0.6534556174254831,2023-10-02 12:46:16.953913,2023-10-02 12:46:17.349011,0 days 00:00:00.395098,46.6879174637073,470,sag,COMPLETE
7567,0.6418277104487389,2023-10-02 12:46:17.352019,2023-10-02 12:46:17.861648,0 days 00:00:00.509629,265.1284993452227,290,sag,COMPLETE
7568,0.6277432034064855,2023-10-02 12:46:17.864648,2023-10-02 12:46:18.355278,0 days 00:00:00.490630,874.6957688501524,370,newton-cg,COMPLETE
7569,0.6590785020198712,2023-10-02 12:46:18.357270,2023-10-02 12:46:18.806368,0 days 00:00:00.449098,4530.776663659886,450,sag,COMPLETE
7570,0.6520362484987444,2023-10-02 12:46:18.809375,2023-10-02 12:46:19.358173,0 days 00:00:00.548798,23976.083308909143,500,sag,COMPLETE
7571,0.5,2023-10-02 12:46:19.361172,2023-10-02 12:46:19.959330,0 days 00:00:00.598158,8.228057344387766e-05,360,sag,COMPLETE
7572,0.5855442733922918,2023-10-02 12:46:19.961331,2023-10-02 12:46:20.338432,0 days 00:00:00.377101,1.3517959350461646,490,sag,COMPLETE
7573,0.637951741456491,2023-10-02 12:46:20.340432,2023-10-02 12:46:20.895050,0 days 00:00:00.554618,1448.099722526109,480,sag,COMPLETE
7574,0.6559122174909924,2023-10-02 12:46:20.897054,2023-10-02 12:46:21.460206,0 days 00:00:00.563152,7913.358514932883,500,sag,COMPLETE
7575,0.637951741456491,2023-10-02 12:46:21.462199,2023-10-02 12:46:21.839295,0 days 00:00:00.377096,34697.71311139451,250,liblinear,COMPLETE
7576,0.5,2023-10-02 12:46:21.841289,2023-10-02 12:46:22.310400,0 days 00:00:00.469111,0.027779307047253995,350,sag,COMPLETE
7577,0.6520362484987444,2023-10-02 12:46:22.312400,2023-10-02 12:46:22.840579,0 days 00:00:00.528179,16457.358737850904,380,sag,COMPLETE
7578,0.6590785020198712,2023-10-02 12:46:22.843570,2023-10-02 12:46:23.295620,0 days 00:00:00.452050,46059.88980204049,490,sag,COMPLETE
7579,0.6337482257888415,2023-10-02 12:46:23.297617,2023-10-02 12:46:23.767092,0 days 00:00:00.469475,14.803282172095182,460,sag,COMPLETE
7580,0.5,2023-10-02 12:46:23.769090,2023-10-02 12:46:24.250711,0 days 00:00:00.481621,0.0007911101618918272,440,sag,COMPLETE
7581,0.5,2023-10-02 12:46:24.252721,2023-10-02 12:46:24.641803,0 days 00:00:00.389082,0.0013543422403211054,470,sag,COMPLETE
7582,0.637951741456491,2023-10-02 12:46:24.643802,2023-10-02 12:46:25.155443,0 days 00:00:00.511641,24216.794996977027,370,lbfgs,COMPLETE
7583,0.666120755540998,2023-10-02 12:46:25.157449,2023-10-02 12:46:25.713087,0 days 00:00:00.555638,64337.083546052396,490,sag,COMPLETE
7584,0.6309094879353642,2023-10-02 12:46:25.714084,2023-10-02 12:46:26.186730,0 days 00:00:00.472646,3882.704494926071,450,sag,COMPLETE
7585,0.6520362484987444,2023-10-02 12:46:26.189721,2023-10-02 12:46:26.712363,0 days 00:00:00.522642,10712.82532520714,340,sag,COMPLETE
7586,0.5,2023-10-02 12:46:26.714363,2023-10-02 12:46:27.188017,0 days 00:00:00.473654,0.017518620443316233,500,sag,COMPLETE
7587,0.643956763838847,2023-10-02 12:46:27.190016,2023-10-02 12:46:27.576144,0 days 00:00:00.386128,25.49663036484319,480,sag,COMPLETE
7588,0.666120755540998,2023-10-02 12:46:27.578126,2023-10-02 12:46:28.138269,0 days 00:00:00.560143,6010.287611984071,360,sag,COMPLETE
7589,0.6481602795064964,2023-10-02 12:46:28.140269,2023-10-02 12:46:28.713931,0 days 00:00:00.573662,64571.757233635224,470,sag,COMPLETE
7590,0.6520362484987444,2023-10-02 12:46:28.716440,2023-10-02 12:46:29.187545,0 days 00:00:00.471105,31557.97815536343,480,sag,COMPLETE
7591,0.5,2023-10-02 12:46:29.190535,2023-10-02 12:46:30.098267,0 days 00:00:00.907732,3.0357854306165877e-05,350,sag,COMPLETE
7592,0.6481602795064964,2023-10-02 12:46:30.100267,2023-10-02 12:46:30.639455,0 days 00:00:00.539188,13302.57784449187,390,sag,COMPLETE
7593,0.6013756960366853,2023-10-02 12:46:30.641454,2023-10-02 12:46:31.015239,0 days 00:00:00.373785,2.227004396873445,500,sag,COMPLETE
7594,0.6418277104487389,2023-10-02 12:46:31.017750,2023-10-02 12:46:31.550213,0 days 00:00:00.532463,370.83695959430827,460,sag,COMPLETE
7595,0.5,2023-10-02 12:46:31.552212,2023-10-02 12:46:32.427970,0 days 00:00:00.875758,3.29335982543174e-05,430,sag,COMPLETE
7596,0.5,2023-10-02 12:46:32.429969,2023-10-02 12:46:32.820675,0 days 00:00:00.390706,0.00025699715313169,490,newton-cg,COMPLETE
7597,0.5274593296211376,2023-10-02 12:46:32.823673,2023-10-02 12:46:33.328905,0 days 00:00:00.505232,0.5340140317784183,340,liblinear,COMPLETE
7598,0.6520362484987444,2023-10-02 12:46:33.330951,2023-10-02 12:46:33.775673,0 days 00:00:00.444722,2611.852352619534,440,sag,COMPLETE
7599,0.5,2023-10-02 12:46:33.778673,2023-10-02 12:46:34.236420,0 days 00:00:00.457747,0.2939831761013325,360,sag,COMPLETE
7600,0.666120755540998,2023-10-02 12:46:34.239419,2023-10-02 12:46:34.791609,0 days 00:00:00.552190,20960.53635914112,450,sag,COMPLETE
7601,0.637951741456491,2023-10-02 12:46:34.794608,2023-10-02 12:46:35.262477,0 days 00:00:00.467869,669.33567988069,500,sag,COMPLETE
7602,0.5408341522000218,2023-10-02 12:46:35.265569,2023-10-02 12:46:35.728872,0 days 00:00:00.463303,0.6510615542170717,370,sag,COMPLETE
7603,0.6629544710121192,2023-10-02 12:46:35.731871,2023-10-02 12:46:36.267304,0 days 00:00:00.535433,7135.762751968847,400,sag,COMPLETE
7604,0.666120755540998,2023-10-02 12:46:36.269300,2023-10-02 12:46:36.725301,0 days 00:00:00.456001,45140.272861558224,470,sag,COMPLETE
7605,0.6520362484987444,2023-10-02 12:46:36.727303,2023-10-02 12:46:37.266480,0 days 00:00:00.539177,1443.1126708955303,480,sag,COMPLETE
7606,0.6481602795064964,2023-10-02 12:46:37.268473,2023-10-02 12:46:37.783768,0 days 00:00:00.515295,69742.95611016935,320,sag,COMPLETE
7607,0.5,2023-10-02 12:46:37.785768,2023-10-02 12:46:38.159423,0 days 00:00:00.373655,0.0004317999661201653,490,lbfgs,COMPLETE
7608,0.666120755540998,2023-10-02 12:46:38.161423,2023-10-02 12:46:38.702010,0 days 00:00:00.540587,26399.218968157296,460,sag,COMPLETE
7609,0.6520362484987444,2023-10-02 12:46:38.704011,2023-10-02 12:46:39.196434,0 days 00:00:00.492423,11317.770401135918,150,sag,COMPLETE
7610,0.6552025330276231,2023-10-02 12:46:39.198427,2023-10-02 12:46:39.630224,0 days 00:00:00.431797,98900.9823355623,380,sag,COMPLETE
7611,0.5,2023-10-02 12:46:39.632215,2023-10-02 12:46:40.105048,0 days 00:00:00.472833,0.14486998444091,330,sag,COMPLETE
7612,0.6534556174254831,2023-10-02 12:46:40.108085,2023-10-02 12:46:40.597737,0 days 00:00:00.489652,102.771677538141,490,sag,COMPLETE
7613,0.6449939949776177,2023-10-02 12:46:40.599739,2023-10-02 12:46:41.035261,0 days 00:00:00.435522,4068.7230646786684,420,sag,COMPLETE
7614,0.6520362484987444,2023-10-02 12:46:41.037261,2023-10-02 12:46:41.561848,0 days 00:00:00.524587,99796.84741397838,350,sag,COMPLETE
7615,0.6590785020198712,2023-10-02 12:46:41.563849,2023-10-02 12:46:42.128765,0 days 00:00:00.564916,36623.63446691763,490,sag,COMPLETE
7616,0.6520362484987444,2023-10-02 12:46:42.130957,2023-10-02 12:46:42.598694,0 days 00:00:00.467737,16214.465988801418,500,sag,COMPLETE
7617,0.6457036794409869,2023-10-02 12:46:42.600880,2023-10-02 12:46:43.120537,0 days 00:00:00.519657,275.46156009774995,480,sag,COMPLETE
7618,0.6590785020198712,2023-10-02 12:46:43.122723,2023-10-02 12:46:43.639549,0 days 00:00:00.516826,6297.633895241684,360,sag,COMPLETE
7619,0.6534556174254831,2023-10-02 12:46:43.641571,2023-10-02 12:46:44.022094,0 days 00:00:00.380523,42.094825455027355,450,newton-cg,COMPLETE
7620,0.66224478654875,2023-10-02 12:46:44.024093,2023-10-02 12:46:44.561179,0 days 00:00:00.537086,40655.068991982414,440,sag,COMPLETE
7621,0.6411180259853696,2023-10-02 12:46:44.563179,2023-10-02 12:46:45.105616,0 days 00:00:00.542437,18863.248281478827,480,sag,COMPLETE
7622,0.6238672344142374,2023-10-02 12:46:45.107616,2023-10-02 12:46:45.480217,0 days 00:00:00.372601,1994.2947010095882,370,liblinear,COMPLETE
7623,0.6520362484987444,2023-10-02 12:46:45.482214,2023-10-02 12:46:46.023224,0 days 00:00:00.541010,10071.803805470074,470,sag,COMPLETE
7624,0.5,2023-10-02 12:46:46.025221,2023-10-02 12:46:46.531217,0 days 00:00:00.505996,0.0001822592841125286,500,sag,COMPLETE
7625,0.5,2023-10-02 12:46:46.533225,2023-10-02 12:46:46.910108,0 days 00:00:00.376883,0.012523682650284099,490,sag,COMPLETE
7626,0.5,2023-10-02 12:46:46.913110,2023-10-02 12:46:47.376893,0 days 00:00:00.463783,0.023040340231601765,450,sag,COMPLETE
7627,0.6369145103177202,2023-10-02 12:46:47.379889,2023-10-02 12:46:47.856868,0 days 00:00:00.476979,18.822483404880074,460,sag,COMPLETE
7628,0.5,2023-10-02 12:46:47.858869,2023-10-02 12:46:48.237285,0 days 00:00:00.378416,0.003708104493936013,350,sag,COMPLETE
7629,0.666120755540998,2023-10-02 12:46:48.239285,2023-10-02 12:46:48.761084,0 days 00:00:00.521799,51118.50401810581,380,sag,COMPLETE
7630,0.6534556174254831,2023-10-02 12:46:48.763084,2023-10-02 12:46:49.155148,0 days 00:00:00.392064,58.19140265666767,340,sag,COMPLETE
7631,0.637951741456491,2023-10-02 12:46:49.157145,2023-10-02 12:46:49.655339,0 days 00:00:00.498194,25816.677539321277,430,lbfgs,COMPLETE
7632,0.5,2023-10-02 12:46:49.658339,2023-10-02 12:46:51.303499,0 days 00:00:01.645160,1.0158156660968894e-05,480,sag,COMPLETE
7633,0.5,2023-10-02 12:46:51.305811,2023-10-02 12:46:51.774936,0 days 00:00:00.469125,0.03647099774385393,470,sag,COMPLETE
7634,0.6590785020198712,2023-10-02 12:46:51.777936,2023-10-02 12:46:52.230708,0 days 00:00:00.452772,3420.1963850300795,500,sag,COMPLETE
7635,0.6590785020198712,2023-10-02 12:46:52.232707,2023-10-02 12:46:52.769612,0 days 00:00:00.536905,6756.106494617186,390,sag,COMPLETE
7636,0.6590785020198712,2023-10-02 12:46:52.771691,2023-10-02 12:46:53.227260,0 days 00:00:00.455569,65982.2436632451,490,sag,COMPLETE
7637,0.5,2023-10-02 12:46:53.230258,2023-10-02 12:46:53.685264,0 days 00:00:00.455006,0.2322968793750296,270,sag,COMPLETE
7638,0.5,2023-10-02 12:46:53.688258,2023-10-02 12:46:54.297210,0 days 00:00:00.608952,7.829777323319485e-05,370,sag,COMPLETE
7639,0.6449939949776177,2023-10-02 12:46:54.300208,2023-10-02 12:46:54.740776,0 days 00:00:00.440568,981.6250386855355,360,sag,COMPLETE
7640,0.6062888961677039,2023-10-02 12:46:54.743773,2023-10-02 12:46:55.209009,0 days 00:00:00.465236,6.0082550782136535,330,sag,COMPLETE
7641,0.6520362484987444,2023-10-02 12:46:55.211015,2023-10-02 12:46:55.764780,0 days 00:00:00.553765,17832.586633832427,500,sag,COMPLETE
7642,0.6457036794409869,2023-10-02 12:46:55.766859,2023-10-02 12:46:56.192015,0 days 00:00:00.425156,185.3935064644995,460,sag,COMPLETE
7643,0.5651271972922809,2023-10-02 12:46:56.194015,2023-10-02 12:46:56.669443,0 days 00:00:00.475428,1.06355609294812,480,newton-cg,COMPLETE
7644,0.5,2023-10-02 12:46:56.671444,2023-10-02 12:46:57.126476,0 days 00:00:00.455032,0.207146967185907,400,sag,COMPLETE
